skill,thumbnail_link,video_link,title,num_views,age,channel,snippet,duration,chapter,series
data scientist,https://i.ytimg.com/vi/yNYflGw6kJI/hq720.jpg?sqp=-oaymwEnCNAFEJQDSFryq4qpAxkIARUAAIhCGAHYAQHiAQoIGBACGAY4AUAB&rs=AOn4CLCLemmFOI7VjyguzGNyFko2RpwPcg,https://youtube.com/watch?v=yNYflGw6kJI&pp=ygUzQ291cnNlIGRhdGEgc2NpZW50aXN0IGRhdGEgc2NpZW50aXN0IERhdGEgU2NpZW50aXN0,Stanford's FREE data science book and course are the best yet,726K views,1 year ago,Python Programmer,Thanks to Brilliant for sponsoring this video :-) My video on the science of speed reading https://youtu.be/5RfMMBTLDms Free ...,4:52,5,"['Intro', 'Why', 'Brilliance', 'Video Course', 'How to get a job']"
data scientist,https://i.ytimg.com/vi/9R3X0JoCLyU/hq720.jpg?sqp=-oaymwEnCNAFEJQDSFryq4qpAxkIARUAAIhCGAHYAQHiAQoIGBACGAY4AUAB&rs=AOn4CLBK-moGxUko8S_GH6Bmja0a-DK8lw,https://youtube.com/watch?v=9R3X0JoCLyU&pp=ygUzQ291cnNlIGRhdGEgc2NpZW50aXN0IGRhdGEgc2NpZW50aXN0IERhdGEgU2NpZW50aXN0,The Complete Data Science Roadmap,317K views,8 months ago,Programming with Mosh,Go from zero to a data scientist in 12 months. This step-by-step roadmap covers the essential skills you must learn to become a ...,6:13,11,"['Introduction', 'Programming Languages', 'Version Control', 'Data Structures & Algorithms', 'SQL', 'Mathematics & Statistics', 'Data Handling and Visualization', 'Machine Learning', 'Deep Learning', 'Specialization', 'Big Data']"
data scientist,https://i.ytimg.com/vi/T08eJt9DlgU/hq720.jpg?sqp=-oaymwEnCNAFEJQDSFryq4qpAxkIARUAAIhCGAHYAQHiAQoIGBACGAY4AUAB&rs=AOn4CLAuBoU-BCgAV3bEnSf2SqKMKVMt6w,https://youtube.com/watch?v=T08eJt9DlgU&pp=ygUzQ291cnNlIGRhdGEgc2NpZW50aXN0IGRhdGEgc2NpZW50aXN0IERhdGEgU2NpZW50aXN0,Data Scientist vs Data Analyst - Which Is Right For You? (2024),98K views,3 years ago,CareerFoundry,"What's the difference between Data Science and Data Analytics? Both roles are in huge demand at the moment, so let's define ...",7:02,6,"['Introduction', 'What is Data Science?', 'What is Data Analytics?', 'Key differences between data analytics and data science', 'Key Takeaways', 'Outro + Next steps']"
data scientist,https://i.ytimg.com/vi/dcXqhMqhZUo/hq720.jpg?sqp=-oaymwEnCNAFEJQDSFryq4qpAxkIARUAAIhCGAHYAQHiAQoIGBACGAY4AUAB&rs=AOn4CLBNL-3G2khag20yS6mWdOG3wLu4RQ,https://youtube.com/watch?v=dcXqhMqhZUo&pp=ygUzQ291cnNlIGRhdGEgc2NpZW50aXN0IGRhdGEgc2NpZW50aXN0IERhdGEgU2NpZW50aXN0,Data Analytics vs Data Science,632K views,1 year ago,IBM Technology,"Are you interested in data science ? And have you heard of data analytics, but aren't sure how they're different? In this video ...",6:30,,
data scientist,,https://youtube.com/watch?v=9OA757v4FAM&pp=ygUzQ291cnNlIGRhdGEgc2NpZW50aXN0IGRhdGEgc2NpZW50aXN0IERhdGEgU2NpZW50aXN0,How to Become a Data Scientist in 2025,83K views,1 month ago,Sundas Khalid,In today's video I am sharing Data Scientist Roadmap with 6 steps. I would recommend watching the video in its entirety as each ...,13:26,10,"['Intro', 'What does a Data Scientist do?', 'Step 1', 'Step 2', 'Step 3', 'Data Scientist Certificate (datacamp)', 'Step 3 (cont)', 'Step 4', 'Step 5', 'Step 6']"
data scientist,https://i.ytimg.com/vi/sDlH-YPXd0A/hq720.jpg?sqp=-oaymwEnCNAFEJQDSFryq4qpAxkIARUAAIhCGAHYAQHiAQoIGBACGAY4AUAB&rs=AOn4CLDqeUOLhDQEJK6N9SJoOcWTa7lWCw,https://youtube.com/watch?v=sDlH-YPXd0A&pp=ygUzQ291cnNlIGRhdGEgc2NpZW50aXN0IGRhdGEgc2NpZW50aXN0IERhdGEgU2NpZW50aXN0,How to become a Data Scientist in 2025,62K views,2 months ago,Sahil & Sarra,▻ In this video we covered: 1. How to actually learn Data Science ? 2. What skills do you need to develop? 3. What are the best ...,8:15,,
data scientist,https://i.ytimg.com/vi/mrOIT6v8_0g/hq720.jpg?sqp=-oaymwEnCNAFEJQDSFryq4qpAxkIARUAAIhCGAHYAQHiAQoIGBACGAY4AUAB&rs=AOn4CLAPcKBSuF5xVIhHYzKvJ5-DOS35hg,https://youtube.com/watch?v=mrOIT6v8_0g&pp=ygUzQ291cnNlIGRhdGEgc2NpZW50aXN0IGRhdGEgc2NpZW50aXN0IERhdGEgU2NpZW50aXN0,How to Become a Data Scientist in 2024? (complete roadmap),238K views,1 year ago,Sundas Khalid,In today's video I am sharing a Data Scientist Roadmap with 5 steps. I would recommend watching the video in its entirety as each ...,14:10,,
data scientist,https://i.ytimg.com/vi/ZxefC73PTnM/hq720.jpg?sqp=-oaymwEnCNAFEJQDSFryq4qpAxkIARUAAIhCGAHYAQHiAQoIGBACGAY4AUAB&rs=AOn4CLCdPCeUpFDZbVUCdJmdpfyny5YtPQ,https://youtube.com/watch?v=ZxefC73PTnM&pp=ygUzQ291cnNlIGRhdGEgc2NpZW50aXN0IGRhdGEgc2NpZW50aXN0IERhdGEgU2NpZW50aXN0,🔥 WTF is this! Statistics for Data Science By Vaibhav | EP08: Covariance 🚀,507 views,Streamed 2 days ago,Prep Insta,WTF is this! Statistics for Data Science By Vaibhav | EP08: Covariance Join Vaibhav Shukla's Telegram Community here for ...,28:11,,
data scientist,https://i.ytimg.com/vi/RBSUwFGa6Fk/hq720.jpg?sqp=-oaymwEnCNAFEJQDSFryq4qpAxkIARUAAIhCGAHYAQHiAQoIGBACGAY4AUAB&rs=AOn4CLDIPWVHPIQ7HPDeo02x4Ko_FyZKRA,https://youtube.com/watch?v=RBSUwFGa6Fk&pp=ygUzQ291cnNlIGRhdGEgc2NpZW50aXN0IGRhdGEgc2NpZW50aXN0IERhdGEgU2NpZW50aXN0,What is Data Science?,687K views,2 years ago,IBM Technology,"Data Science is the convergence of computer science, mathematics, and business expertise and helps entrepreneurs predict, ...",7:51,4,"['Intro', 'Data Science', 'Types of Data Science', 'Data Science Life Cycle']"
