skill,thumbnail_link,video_link,title,num_views,age,channel,snippet,duration,chapter,series
h2o,https://i.ytimg.com/vi/Yz5x-YU7pik/hq720.jpg?sqp=-oaymwEnCNAFEJQDSFryq4qpAxkIARUAAIhCGAHYAQHiAQoIGBACGAY4AUAB&rs=AOn4CLBnsLkLt275LeUD4XHUQ7EXuF1A6g,https://youtube.com/watch?v=Yz5x-YU7pik&pp=ygUdQ291cnNlIGgybyBoMm8gRGF0YSBTY2llbnRpc3Q%3D,Intro to Data Science with H2O - Erin LeDell,5.7K views,9 years ago,H2O.ai,"Erin LeDell, Data Scientist & Hacker at H2O .ai H2O World 2015, Day 1 Join the Movement: open source machine learning ...",26:21,18,"['Intro', 'Intro to Data Science', 'What is Data Science', 'The Data Science Venn Diagram', 'The Data Scientist ""Unicorn""', 'Survey of Data Scientists on Linkedin', 'From Data Unicorns to Data Teams', 'Data Science Teams', 'Data Science in the Enterprise', 'Data Science Tools', 'What is Machine Learning?', 'Machine Learning Tasks', 'Train, Validation and Test Set', 'Machine Learning Workflow', 'What is Deep Learning', 'What is Ensemble Learning', 'No Free Lunch', 'Where to Learn More?']"
h2o,https://i.ytimg.com/vi/Bmj_38Mej5c/hq720.jpg?sqp=-oaymwFBCNAFEJQDSFryq4qpAzMIARUAAIhCGAHYAQHiAQoIGBACGAY4AUAB8AEB-AH-CYAC0AWKAgwIABABGH8gXCgVMA8=&rs=AOn4CLBev9t3EKAdwCv7ths3skHNGiWnRw,https://youtube.com/watch?v=Bmj_38Mej5c&pp=ygUdQ291cnNlIGgybyBoMm8gRGF0YSBTY2llbnRpc3Q%3D,How to be a Data Scientist with H2O,1.3K views,7 years ago,H2O.ai,"Listen to one of H2O's Data Scientist , Jorge Luiz Hernandez Villapol as he walks you through the H2O platform. Presented at the ...",1:09:42,,
h2o,https://i.ytimg.com/vi/DmrtywYRAyE/hq720.jpg?sqp=-oaymwEnCNAFEJQDSFryq4qpAxkIARUAAIhCGAHYAQHiAQoIGBACGAY4AUAB&rs=AOn4CLCRmKVwPVd8QLN6DLdk1Qd5mSMu4g,https://youtube.com/watch?v=DmrtywYRAyE&pp=ygUdQ291cnNlIGgybyBoMm8gRGF0YSBTY2llbnRpc3Q%3D,Introduction to H2O.ai's Data Science and Machine Learning Platform,1K views,10 months ago,H2O.ai,"Want to learn how H2O .ai's platform simplifies data science workflows with seamless integration across features, notebooks, and ...",0:25,,
h2o,https://i.ytimg.com/vi/N-Ri7iUpFEs/hq720.jpg?sqp=-oaymwFBCNAFEJQDSFryq4qpAzMIARUAAIhCGAHYAQHiAQoIGBACGAY4AUAB8AEB-AH-CYAC0AWKAgwIABABGH8gFSh2MA8=&rs=AOn4CLD1aYitcYIR8hc58C4ujobtbvr8iw,https://youtube.com/watch?v=N-Ri7iUpFEs&pp=ygUdQ291cnNlIGgybyBoMm8gRGF0YSBTY2llbnRpc3Q%3D,𝐌𝐚𝐬𝐭𝐞𝐫 𝐇𝟐𝐎.𝐚𝐢 𝐢𝐧 𝐚 𝐖𝐞𝐞𝐤,51 views,1 year ago,Un4seen,Are you ready to level up your H2O .ai skills in record time? Join us in this educational video as we break down the first 6 essential ...,2:51,8,"['Introduction to H2O.ai', 'Installation of H2O.ai and Dependencies', 'Understanding the Basics of Building and Training Models', 'Creating a Simple Machine-Learning Model', 'Training the Model Using Sample Data', ""Evaluating the Model's Performance"", ""Utilizing H2O's AutoML Functionality"", 'Conclusion']"
h2o,https://i.ytimg.com/vi/xBfEzm-X-mM/hqdefault.jpg?sqp=-oaymwEnCOADEI4CSFryq4qpAxkIARUAAIhCGAHYAQHiAQoIGBACGAY4AUAB&rs=AOn4CLDPWrZHYueobaxD95xn8ZFRxLcHMg,https://youtube.com/watch?v=xBfEzm-X-mM&pp=ygUdQ291cnNlIGgybyBoMm8gRGF0YSBTY2llbnRpc3Q%3D,Data Science with H2O.ai: An Introduction to Machine Learning and Predictive Modeling,8.4K views,3 years ago,H2O.ai,"Senior Solutions Engineer and Data Scientists at H2O .ai, Jon Farland walks through machine learning concepts and worked-out ...",34:31,4,"['Data Science Project Lifecycle', 'Machine Learning Problems', 'Supervised Learning Algorithms', 'H2O 3 Machine Learning Platform']"
h2o,https://i.ytimg.com/vi/BYF7Lh3Yy0o/hq720.jpg?sqp=-oaymwEnCNAFEJQDSFryq4qpAxkIARUAAIhCGAHYAQHiAQoIGBACGAY4AUAB&rs=AOn4CLDESUjliNw3u7wsGlqhznHv2sXuQA,https://youtube.com/watch?v=BYF7Lh3Yy0o&pp=ygUdQ291cnNlIGgybyBoMm8gRGF0YSBTY2llbnRpc3Q%3D,Scalable Data Science & Deep Learning with H2O • Arno Candel • GOTO 2015,1K views,9 years ago,GOTO Conferences,Arno Candel - PhD - Chief Architect at H2O .ai ABSTRACT H2O is fast scalable open-source machine learning and deep learning ...,49:42,25,"['Intro', 'Agenda', 'H2O', 'What is H2O', 'H2O customers', 'Downloading H2O', 'Demo', 'Metrics', 'Deep Learning', 'World Record', 'Normal Digit Detection', 'Crime Detection', 'Datanami', 'Spark Memory', 'Parse Dataset', 'Date Manipulation', 'Spark', 'Scala', 'Flow', 'State Up Table', 'Python', 'IPython Notebook', 'Kaggle Challenge', 'GBM', 'Outlook']"
h2o,https://i.ytimg.com/vi/yU6EDD955bA/hqdefault.jpg?sqp=-oaymwEnCOADEI4CSFryq4qpAxkIARUAAIhCGAHYAQHiAQoIGBACGAY4AUAB&rs=AOn4CLCR4xkN9OEZPOyzqnR7stu1cAqTeQ,https://youtube.com/watch?v=yU6EDD955bA&pp=ygUdQ291cnNlIGgybyBoMm8gRGF0YSBTY2llbnRpc3Q%3D,Revolutionize Your Data Science Workflows with H2O.ai: The Ultimate Automation Guide!,1.9K views,1 year ago,H2O.ai,Welcome to the Ultimate H2O Driverless AI Journey! ✨ Are you ready to dive into the fascinating world of data science and ...,2:13:41,28,"['Class Intro', 'What is Driverless AI?', 'Problem types', 'Connect to the Driverless AI instance', 'Intro to Driverless AI', 'Adding a dataset to Driverless AI', 'Dataset Overview and Action Buttons', 'Dataset Details', 'Modify by Recipe Overview', 'Visualize Action Button', 'Correlation Graph', 'Data Prep Action Button', 'Predict Action Button', 'Training Settings', 'Expert Settings - high level overview', 'Custom Recipes', 'The Driverless AI Experiment Page', 'Variable importance', 'Completed Experiment Listing Page', 'Focus on the ROC curve', 'Interpretability Report', 'Shapley Values for Original Features', 'Partial Dependence Plot', 'Interpretations using Surrogate Models', 'Diagnostics & Visualize Scoring Pipeline', 'Download AutoDoc', 'Projects Tab', 'Next Steps']"
