skill,thumbnail_link,video_link,title,num_views,age,channel,snippet,duration,chapter,series
zookeeper,https://i.ytimg.com/vi/gZj16chk0Ss/hq720.jpg?sqp=-oaymwEnCNAFEJQDSFryq4qpAxkIARUAAIhCGAHYAQHiAQoIGBACGAY4AUAB&rs=AOn4CLC-dxxBsoTVWm7T_56geuSUg14pBg,https://youtube.com/watch?v=gZj16chk0Ss&pp=ygUpQ291cnNlIHpvb2tlZXBlciB6b29rZWVwZXIgRGF0YSBBcmNoaXRlY3TSBwkJfgkBhyohjO8%3D,064 ZooKeeper explained,137K views,6 years ago,dd ddd,Let's talk about zookeeper next it's a important system for maintaining data across your entire cluster in a consistent manner so ...,13:11,,
zookeeper,https://i.ytimg.com/vi/6YL0L4lb9iM/hq720.jpg?sqp=-oaymwEnCNAFEJQDSFryq4qpAxkIARUAAIhCGAHYAQHiAQoIGBACGAY4AUAB&rs=AOn4CLBLLr06cZ88eh7VtJf1DxBuogwSrw,https://youtube.com/watch?v=6YL0L4lb9iM&pp=ygUpQ291cnNlIHpvb2tlZXBlciB6b29rZWVwZXIgRGF0YSBBcmNoaXRlY3Q%3D,The Apache Kafka® Control Plane – ZooKeeper vs. KRaft,24K views,2 years ago,Confluent,"In this tutorial, you'll learn about the Kafka Control Plane, which simplifies Kafka's architecture by removing its ZooKeeper ...",12:03,12,"['Intro', 'Zookeeper Mode (Legacy) Zookeeper Ensemble', 'Kraft Mode Advantages', 'Kraft Mode Controller', 'KRaft Metadata Replication', 'Vote Request', 'Vote Response', 'Completion', 'Metadata Replica Reconciliation', 'KRaft Cluster Metadata Snapshot', 'Metadata Log Truncation with Snapshot', 'When a Snapshot is Read']"
zookeeper,https://i.ytimg.com/vi/bnHWrSwPvig/hq720.jpg?sqp=-oaymwEnCNAFEJQDSFryq4qpAxkIARUAAIhCGAHYAQHiAQoIGBACGAY4AUAB&rs=AOn4CLClVWnA1LhsoolwTageXScXwxlsFw,https://youtube.com/watch?v=bnHWrSwPvig&pp=ygUpQ291cnNlIHpvb2tlZXBlciB6b29rZWVwZXIgRGF0YSBBcmNoaXRlY3Q%3D,ZooKeeper | Role of ZooKeeper in Kafka,7.1K views,2 years ago,PixelTrice,,11:04,7,"['Introduction', 'What is ZooKeeper', 'What is ZooKeeper used for', 'How do producers and consumers find out who the leader of partisan is', 'Steps before publishing a message', 'Important information', 'Leader failure']"
zookeeper,https://i.ytimg.com/vi/F06tdYgcz_A/hq720.jpg?sqp=-oaymwEnCNAFEJQDSFryq4qpAxkIARUAAIhCGAHYAQHiAQoIGBACGAY4AUAB&rs=AOn4CLABGhxmCGPPOrRiQHzvQ0SRmziRAw,https://youtube.com/watch?v=F06tdYgcz_A&pp=ygUpQ291cnNlIHpvb2tlZXBlciB6b29rZWVwZXIgRGF0YSBBcmNoaXRlY3Q%3D,What is ZooKeeper? - Coordination Services | Systems Design Interview 0 to 1 with Ex-Google SWE,21K views,1 year ago,Jordan has no life,They call me a ZooKeeper the way I got all these birds on lockdown.,7:32,4,"['Intro', 'What is Coordination Services', 'Technical Content', 'Conclusion']"
zookeeper,https://i.ytimg.com/vi/pbmyrNjzdDk/hq720.jpg?sqp=-oaymwEnCNAFEJQDSFryq4qpAxkIARUAAIhCGAHYAQHiAQoIGBACGAY4AUAB&rs=AOn4CLB_P1xvh43Dn6a2XYvyptU2-uq1sQ,https://youtube.com/watch?v=pbmyrNjzdDk&pp=ygUpQ291cnNlIHpvb2tlZXBlciB6b29rZWVwZXIgRGF0YSBBcmNoaXRlY3Q%3D,Lecture 8: Zookeeper,68K views,5 years ago,MIT 6.824: Distributed Systems,Lecture 8: Zookeeper MIT 6.824: Distributed Systems (Spring 2020) https://pdos.csail.mit.edu/6.824/,1:20:32,6,"['Linearize Ability', 'Example', 'Questions', 'Paper', 'Consistency guarantees', 'FIFO client order']"
zookeeper,https://i.ytimg.com/vi/dPKJvAHCAH8/hq720.jpg?sqp=-oaymwEnCNAFEJQDSFryq4qpAxkIARUAAIhCGAHYAQHiAQoIGBACGAY4AUAB&rs=AOn4CLBwsiz44UMsxveg__FdfGN26tcPog,https://youtube.com/watch?v=dPKJvAHCAH8&pp=ygUpQ291cnNlIHpvb2tlZXBlciB6b29rZWVwZXIgRGF0YSBBcmNoaXRlY3Q%3D,Zookeeper Data Model | Types of Zookeeper Nodes,5.7K views,2 years ago,Better Dev with Anubhav,This is a video about Zookeeper data model. The zookeeper data model is similar to unix file system. Each node in the zookeeper ...,17:06,8,"['Introduction', 'Data model', 'znode', 'types of znodes', 'Persistent node', 'Ephemeral nodes', 'Sequential nodes', 'Summary']"
zookeeper,https://i.ytimg.com/vi/Vv4HpLfqAz4/hq720.jpg?sqp=-oaymwEnCNAFEJQDSFryq4qpAxkIARUAAIhCGAHYAQHiAQoIGBACGAY4AUAB&rs=AOn4CLDoIn8nVd0LCESLaZdyyAa8B-jLUg,https://youtube.com/watch?v=Vv4HpLfqAz4&pp=ygUpQ291cnNlIHpvb2tlZXBlciB6b29rZWVwZXIgRGF0YSBBcmNoaXRlY3Q%3D,Zookeeper in action by Alexandre Berthaud,43K views,5 years ago,Devoxx,"While it's accepted to use ZooKeeper to manage databases clusters, it's a bit less common to use it for applications cluster.",32:03,5,"['Why Zookeeper?', 'Zookeeper 101', 'Service Discovery', 'Sequential znodes', 'Zookeeper guarantees']"
zookeeper,https://i.ytimg.com/vi/AS5a91DOmks/hq720.jpg?sqp=-oaymwEnCNAFEJQDSFryq4qpAxkIARUAAIhCGAHYAQHiAQoIGBACGAY4AUAB&rs=AOn4CLACRmCjiyybjs8wSdHREawTGhUnYg,https://youtube.com/watch?v=AS5a91DOmks&pp=ygUpQ291cnNlIHpvb2tlZXBlciB6b29rZWVwZXIgRGF0YSBBcmNoaXRlY3Q%3D,What is Zookeeper?,170K views,6 years ago,Stephane Maarek,,4:56,3,"['Introduction', 'Zookeeper features', 'What is Zookeeper']"
zookeeper,https://i.ytimg.com/vi/nACQ-ZGgfjM/hq720.jpg?sqp=-oaymwFBCNAFEJQDSFryq4qpAzMIARUAAIhCGAHYAQHiAQoIGBACGAY4AUAB8AEB-AHAB4AC0AWKAgwIABABGGUgYShQMA8=&rs=AOn4CLCU2SqmfXtep28-eSpR_uBKkKAKwA,https://youtube.com/watch?v=nACQ-ZGgfjM&pp=ygUpQ291cnNlIHpvb2tlZXBlciB6b29rZWVwZXIgRGF0YSBBcmNoaXRlY3Q%3D,4.6. Apache Zookeeper | Data Model,6K views,7 years ago,CloudxLab Official,"Data Model == The way you store data in any store is called data model. In case of zookeeper , think of data model as if it is a ...",1:22,,
zookeeper,https://i.ytimg.com/vi/Bc6oyURRIxQ/hq720.jpg?sqp=-oaymwFBCNAFEJQDSFryq4qpAzMIARUAAIhCGADYAQHiAQoIGBACGAY4AUAB8AEB-AG2CIACgA-KAgwIABABGGYgZihmMA8=&rs=AOn4CLD2nCVePPM1xoH4mG7XKUo88ORLZQ,https://youtube.com/shorts/Bc6oyURRIxQ,Kafka Basics #javascript #python #web #coding #programming,498K views,1 year ago,ByteByteGo,,SHORTS,,
zookeeper,https://i.ytimg.com/vi/RB8Y4jW4k_o/hq720.jpg?sqp=-oaymwEnCNAFEJQDSFryq4qpAxkIARUAAIhCGAHYAQHiAQoIGBACGAY4AUAB&rs=AOn4CLASrR1sT7K8TzQmy3xT8pKStMTyQA,https://youtube.com/watch?v=RB8Y4jW4k_o&t=330s&pp=ygUpQ291cnNlIHpvb2tlZXBlciB6b29rZWVwZXIgRGF0YSBBcmNoaXRlY3Q%3D,Apache Zookeeper Explained and Simulating a Failing Master Node | Big Data Hadoop Tutorial,11K views,2 years ago,AmpCode,"This lecture is all about Apache Zookeeper where we have discussed what is Zookeeper , its significance in the distributed system, ...",14:16,,['5:30 Zookeeper Architecture']
zookeeper,https://i.ytimg.com/vi/p8ak-xkklIo/hq720.jpg?sqp=-oaymwEnCNAFEJQDSFryq4qpAxkIARUAAIhCGAHYAQHiAQoIGBACGAY4AUAB&rs=AOn4CLDkv6gr34KsHdd0BMaujGaiv65u_w,https://youtube.com/watch?v=p8ak-xkklIo&pp=ygUpQ291cnNlIHpvb2tlZXBlciB6b29rZWVwZXIgRGF0YSBBcmNoaXRlY3Q%3D,ZooKeeper Cluster Distributed Coordination Service,459 views,4 years ago,Loginto Courses,ZooKeeper Cluster Distributed Coordination Service My Website https://www.logintocourses.com/ DailyMotion ...,17:42,7,"['Introduction', 'ZooKeeper Introduction', 'ZooKeeper Infusion', 'System Architecture', 'ZooKeeper Features', 'ZooKeeper and Other Components', 'Conclusion']"
zookeeper,https://i.ytimg.com/vi/aQ9KwJchGgY/hq720.jpg?sqp=-oaymwFBCNAFEJQDSFryq4qpAzMIARUAAIhCGAHYAQHiAQoIGBACGAY4AUAB8AEB-AHAB4AC0AWKAgwIABABGGUgYShSMA8=&rs=AOn4CLAg3liFY5PgGE9rFB7x70VwqrzgFg,https://youtube.com/watch?v=aQ9KwJchGgY&pp=ygUpQ291cnNlIHpvb2tlZXBlciB6b29rZWVwZXIgRGF0YSBBcmNoaXRlY3Q%3D,4.4. Apache Zookeeper | Introduction,6.3K views,7 years ago,CloudxLab Official,"Intro == So what is Zookeeper ? In very simple words, it is a central store of key-value using which distributed systems can ...",0:47,,
