skill,thumbnail_link,video_link,title,num_views,age,channel,snippet,duration,chapter,series
sap apo,https://i.ytimg.com/vi/Yhfas1KLRi8/hq720.jpg?sqp=-oaymwFBCNAFEJQDSFryq4qpAzMIARUAAIhCGAHYAQHiAQoIGBACGAY4AUAB8AEB-AG-B4AC0AWKAgwIABABGA8gZShlMA8=&rs=AOn4CLDoA79gFGJrxYDdoUDgjeTy_T6qZw,https://youtube.com/watch?v=Yhfas1KLRi8&pp=ygUnQ291cnNlIHNhcCBhcG8gc2FwIGFwbyBCdXNpbmVzcyBBbmFseXN0,SAP APO Online Training | SAP APO Training,722 views,11 years ago,xplore sap,Email:Info@araniconsulting.com for more details on SAP APO Online training . visit www.araniconsulting.com for details on other ...,46:54,,
sap apo,https://i.ytimg.com/vi/YVi-9-c1VH0/hq720.jpg?sqp=-oaymwEnCNAFEJQDSFryq4qpAxkIARUAAIhCGAHYAQHiAQoIGBACGAY4AUAB&rs=AOn4CLBG4jQtj-18Nvadi2G6XXBg3Ix74w,https://youtube.com/watch?v=YVi-9-c1VH0&pp=ygUnQ291cnNlIHNhcCBhcG8gc2FwIGFwbyBCdXNpbmVzcyBBbmFseXN0,SAP APO (Advanced Planning and Optimization) Training - Full Course | ZaranTech,7.8K views,Streamed 1 year ago,ZaranTech DotCom,"#SAPAPOTraining #SAPAPOFullCourse # SAPAPO #SAP #SAPTraining In this SAP APO Training video, you will learn about ...",5:48:02,12,"['Introduction', 'Understanding the supply chain architecture in SAP APO', 'Setting up quota arrangement for manufacturing units in SAP APO', 'Understanding production plan changes in SAP APO', 'Introduction to APO and different transaction codes', 'Introduction to Time series object and Order series objects in SAP APO', 'Activation of Integration Model', 'Explanation of active models in SAP APO', 'Understanding error handling in SAP APO', 'Understanding SAP standards and characteristics', 'Understanding the use of BW info cubes for demand planning', 'Creating planning object structure in SAP APO']"
sap apo,https://i.ytimg.com/vi/PsnXg76F0fQ/hq720.jpg?sqp=-oaymwFBCNAFEJQDSFryq4qpAzMIARUAAIhCGAHYAQHiAQoIGBACGAY4AUAB8AEB-AH-CYAC0AWKAgwIABABGGUgYCg1MA8=&rs=AOn4CLCKXXhBo5X4EC2404F_uh8yX-b2eg,https://youtube.com/watch?v=PsnXg76F0fQ&pp=ygUnQ291cnNlIHNhcCBhcG8gc2FwIGFwbyBCdXNpbmVzcyBBbmFseXN0,SAP APO Demand Planning: ABC/XYZ Analysis,8.8K views,8 years ago,"Cadence Technology Consulting, LLC",This video provides an overview of the features and benefits of ABC/XYZ Analysis in SAP APO Demand Planning.,9:04,,
sap apo,https://i.ytimg.com/vi/iHpYGPaYWH8/hqdefault.jpg?sqp=-oaymwEnCOADEI4CSFryq4qpAxkIARUAAIhCGAHYAQHiAQoIGBACGAY4AUAB&rs=AOn4CLA8MLP5Rk5Lj7gE27M4V5pXu81i9w,https://youtube.com/watch?v=iHpYGPaYWH8&pp=ygUnQ291cnNlIHNhcCBhcG8gc2FwIGFwbyBCdXNpbmVzcyBBbmFseXN00gcJCX4JAYcqIYzv,"SAP APO Training Video : Demand Planning, SNP, PPDS",203K views,10 years ago,myTech-school,For complete SAP APO Video training visit; https://mytech-school.com/ sap - apo -video- training /,30:33,9,"['Introduction', 'Supply Chain Management', 'Supply Chain Design', 'Demand Planning', 'Consistent Planning', 'Interactive Demand Planning', 'SNP', 'Performance Comparison', 'PPDS']"
sap apo,https://i.ytimg.com/vi/L6qcq-kFSXI/hq720.jpg?sqp=-oaymwEnCNAFEJQDSFryq4qpAxkIARUAAIhCGAHYAQHiAQoIGBACGAY4AUAB&rs=AOn4CLBJPK_BjAlmOBdO1V4qtNpjl-c_aw,https://youtube.com/watch?v=L6qcq-kFSXI&pp=ygUnQ291cnNlIHNhcCBhcG8gc2FwIGFwbyBCdXNpbmVzcyBBbmFseXN0,Life Cycle Planning in SAP APO | SAP APO (Advanced Planning and Optimization) Training | Uplatz,1.8K views,4 years ago,Uplatz,"In this video, we dive into the intricate process of Life Cycle Planning in SAP APO (Advanced Planning and Optimization).",1:16:18,8,"['Time Bucket Profiles', 'Why You Are Going To Create a Planning Book', 'Generate the Forecast', 'Life Cycle Planning', 'Life Cycle Planning Steps', 'Activate the Life Cycle Training Option in Master Forecast Profiles', 'Basic Settings', 'Creating Create Profiles']"
sap apo,https://i.ytimg.com/vi/6mYNsQN1bDU/hq720.jpg?sqp=-oaymwEnCNAFEJQDSFryq4qpAxkIARUAAIhCGAHYAQHiAQoIGBACGAY4AUAB&rs=AOn4CLCPMWZRB5_7sdXo4Yslwux6iZcvNA,https://youtube.com/watch?v=6mYNsQN1bDU&pp=ygUnQ291cnNlIHNhcCBhcG8gc2FwIGFwbyBCdXNpbmVzcyBBbmFseXN00gcJCX4JAYcqIYzv,SAP APO DP Training Demo Video | SAP APO DEMAND PLANNING Online Course - GOT,1.1K views,8 years ago,Roja,,7:45,,
sap apo,,https://youtube.com/watch?v=lKJ_3BuielE&pp=ygUnQ291cnNlIHNhcCBhcG8gc2FwIGFwbyBCdXNpbmVzcyBBbmFseXN0,SAP ABAP on HANA Full Course | ZaranTech,418 views,Streamed 1 day ago,ZaranTech DotCom,Enroll for SAP ABAP on HANA Full Course - https://zarantech.teachable.com/p/ sap -abap-on-hana- training SAP Corporate ...,5:32:12,7,"['Introduction', 'Components of SAP', 'SAP GUI', 'Accessing ABAP', 'Elementary Types', 'ABAP Tools', 'How to Create Containers']"
sap apo,https://i.ytimg.com/vi/2_fGPEk6o84/hqdefault.jpg?sqp=-oaymwEnCOADEI4CSFryq4qpAxkIARUAAIhCGAHYAQHiAQoIGBACGAY4AUAB&rs=AOn4CLCJBGh5bgeiSdGmG24ipONN5-wSiQ,https://youtube.com/watch?v=2_fGPEk6o84&pp=ygUnQ291cnNlIHNhcCBhcG8gc2FwIGFwbyBCdXNpbmVzcyBBbmFseXN0,SAP APO Training – SAP APO Online Training – (SAP APO Certification Tips)– SAP APO Course,42 views,1 year ago,SAP Training,"SAP APO means SAP Advanced Planner and Optimizer. To manage their supply chain, organizations can use SAP APO , a supply ...",12:27,,
