skill,link,image_link,partner,title,course_description,rating,num_review,difficulty,num_lecture,duration,price
microsoft powerpoint,https://www.udemy.com/course/powerpoint-business-presentations-data-visualization/,https://img-c.udemycdn.com/course/240x135/4775628_54af_4.jpg,Andrew Pach,PowerPoint Business Presentations & Data Visualization,Learn how to create a business PowerPoint presentation and use data visualization in Microsoft PowerPoint.,4.6,1959,All Levels,90 lectures,4 total hours,Current price: $79.99
microsoft powerpoint,https://www.udemy.com/course/case-study-powerpoint-2013-presentation-slide-by-slide/,https://img-c.udemycdn.com/course/240x135/384496_f770_22.jpg,Andrew Pach,Powerpoint 2016 2019 365 - Master powerpoint presentation,"Complete Powerpoint Masterclass, 20+ powerpoint 365 presentation slides. Learn Microsoft Powerpoint beginner to advanced",4.6,22794,All Levels,163 lectures,10 total hours,Current price: $99.99
microsoft powerpoint,https://www.udemy.com/course/excel-basics-for-busy-individuals/,https://img-c.udemycdn.com/course/240x135/4895064_6ec1_6.jpg,Jacob Coccari,Microsoft Excel Crash Course for Business Analysts,Master Excel for Business Analysis: Unlock the Power of Excel & Accelerate Your Career!,4.6,1007,Beginner,153 lectures,8.5 total hours,Current price: $79.99
microsoft powerpoint,https://www.udemy.com/course/microsoft-powerpoint-beginner-to-advanced-x/,https://img-c.udemycdn.com/course/240x135/2619774_41ee_2.jpg,"Kyle Pew, Office Newb",Microsoft PowerPoint From Beginner to Advanced,Go from Zero to Microsoft PowerPoint Presenter Extraordinaire. Downloadable Exercise Files to Follow Along.,4.7,20756,All Levels,89 lectures,7 total hours,Current price: $89.99
microsoft powerpoint,https://www.udemy.com/course/powerpoint-visual-storytelling-course-for-presentations/,https://img-c.udemycdn.com/course/240x135/6091241_5c4c_2.jpg,Andrew Pach,PowerPoint Visual Storytelling for Business Presentations,Learn Visual storytelling in PowerPoint and how to create and present a PowerPoint presentation (presentation skills).,4.3,204,All Levels,61 lectures,3.5 total hours,Current price: $69.99
microsoft powerpoint,https://www.udemy.com/course/microsoft-office-excel-word-access-powerpoint/,https://img-c.udemycdn.com/course/240x135/2743630_037a_4.jpg,Simon Sez IT,"Ultimate Microsoft Office; Excel, Word, PowerPoint & Access",Learn basic to advanced Microsoft Office skills in this 9-course bundle for Office 365 or Office 2019,4.6,15372,All Levels,634 lectures,70.5 total hours,Current price: $159.99
microsoft powerpoint,https://www.udemy.com/course/essential-powerpoint-for-management-consultants-analysts/,https://img-c.udemycdn.com/course/240x135/4218086_66f9.jpg,Asen Gyczew,Essential PowerPoint for Management Consultants & Analysts,A practical guide on how to create slides fast & efficiently during consulting projects,4.2,607,Intermediate,63 lectures,3 total hours,Current price: $59.99
microsoft powerpoint,https://www.udemy.com/course/powerpoint-copilot/,https://img-c.udemycdn.com/course/240x135/6418127_c2dd_8.jpg,Andrew Pach,Copilot for Microsoft PowerPoint - AI Presentation Design,Learn Copilot for PowerPoint. A detailed Microsoft Copilot course specifically for PowerPoint & AI Presentation Design.,4.6,130,All Levels,27 lectures,,Current price: $74.99
microsoft powerpoint,https://www.udemy.com/course/powerpoint-speed-training/,https://img-c.udemycdn.com/course/240x135/157542_07d7_13.jpg,Taylor Croonquist,Advanced PowerPoint Training,PowerPoint Training That Actually Works. NEW and UPDATED for Microsoft 365 (PowerPoint 2019).,4.6,3193,Intermediate,85 lectures,9 total hours,Current price: $79.99
microsoft powerpoint,https://www.udemy.com/course/microsoft-365-copilot/,https://img-c.udemycdn.com/course/240x135/5822484_6609.jpg,"Henry Habib, The Intelligent Worker",Microsoft Copilot Masterclass - Microsoft 365 Copilot Office,"Work faster with Microsoft Copilot Pro in 2024 | Word, PowerPoint, Excel, Teams, Outlook | Microsoft Copilot for M365",4.5,4698,All Levels,87 lectures,7 total hours,Current price: $79.99
microsoft powerpoint,https://www.udemy.com/course/business-presentation-skills-training-bpst-with-powerpoint/,https://img-c.udemycdn.com/course/240x135/1454806_17fc_3.jpg,Ashish Agarwal,Business Presentation in PowerPoint,"Master how to create a client-ready presentation - ideal for investment banking, consulting and business professionals.",4.4,5329,All Levels,193 lectures,5.5 total hours,Current price: $74.99
microsoft powerpoint,https://www.udemy.com/course/create-professional-powerpoint-from-beginner-to-expert/,https://img-c.udemycdn.com/course/240x135/5681934_2f67_4.jpg,Mei Ying Ng,Create Professional PowerPoint: From Beginner to Expert,"Learn visual hierarchy, layout, and design techniques to create professional PowerPoint designs",4.8,253,All Levels,41 lectures,3 total hours,Current price: $74.99
microsoft powerpoint,https://www.udemy.com/course/complete-powerpoint-presentation-design/,https://img-c.udemycdn.com/course/240x135/1406474_cadf_7.jpg,Andrew Pach,PowerPoint Masterclass - Presentation Design & Animation,Microsoft PowerPoint presentation slides and animation. Microsoft PowerPoint 2016 2019 and 365 beginner to expert!,4.7,7021,Intermediate,151 lectures,10 total hours,Current price: $94.99
microsoft powerpoint,https://www.udemy.com/course/microsoft-power-bi-up-running-with-power-bi-desktop/,https://img-c.udemycdn.com/course/240x135/1570206_26c6_6.jpg,"Maven Analytics • 1,500,000 Learners, Chris Dutton, Aaron Parry",Microsoft Power BI Desktop for Business Intelligence,"Master Power BI Desktop for data prep, data analysis, data visualization & dashboard design w/ top Power BI instructors!",4.7,160175,All Levels,198 lectures,16.5 total hours,Current price: $124.99
microsoft powerpoint,https://www.udemy.com/course/microsoft-copilot-workshop-copilot-for-microsoft-365-expert/,https://img-c.udemycdn.com/course/240x135/6363465_0687_8.jpg,Qasim Farooqi,Microsoft Copilot Bootcamp - Microsoft 365 Copilot Training,"Complete Microsoft Copilot 365 Guide - Microsoft Copilot for M365 Word, Excel, PowerPoint, Outlook, Teams & More (2025)",4.9,222,All Levels,44 lectures,2.5 total hours,Current price: $64.99
microsoft powerpoint,https://www.udemy.com/course/microsoft-powerpoint-from-beginner-to-advanced/,https://img-c.udemycdn.com/course/240x135/1513538_b9de_2.jpg,Kirt Kershaw,Microsoft PowerPoint - PowerPoint from Beginner to Advanced,"PowerPoint A-Z Course - Microsoft PowerPoint 2010, 2013, 2016, 2019 and 365 by Microsoft PowerPoint Certified Specialist",4.4,597,All Levels,90 lectures,12.5 total hours,Current price: $74.99
microsoft powerpoint,https://www.udemy.com/course/the-complete-powerpoint-and-presentation-skills-masterclass/,https://img-c.udemycdn.com/course/240x135/2746778_c927_5.jpg,"TJ Walker, Imran Afzal, Media Training Worldwide Digital",The Complete PowerPoint and Presentation Skills Masterclass,"Learn Microsoft PowerPoint, Presentation Skills, PowerPoint 365, and become a Master at Creating/Delivering PowerPoint",4.5,2722,All Levels,625 lectures,34.5 total hours,Current price: $74.99
microsoft powerpoint,https://www.udemy.com/course/powerpoint-365-beginner/,https://img-c.udemycdn.com/course/240x135/2433242_1f9b_3.jpg,Intellezy Trainers,PowerPoint 365 Beginner,"In this course, students will get started with the basics of Microsoft PowerPoint 365.",4.6,26,Beginner,26 lectures,1.5 total hours,Current price: $54.99
microsoft powerpoint,https://www.udemy.com/course/charts-and-data-visualization-in-powerpoint/,https://img-c.udemycdn.com/course/240x135/5916258_8891_2.jpg,Andrew Pach,PowerPoint Charts & Data Visualization for Business,Learn everything about Charts in PowerPoint. Learn how to choose the right chart type for your Data Visualization.,4.6,702,All Levels,51 lectures,3 total hours,Current price: $69.99
microsoft powerpoint,https://www.udemy.com/course/powerpoint-online-fundamentals-for-beginners/,https://img-c.udemycdn.com/course/240x135/6261315_21fe.jpg,Talha Imtiaz,Learn Microsoft PowerPoint : From Beginner to PowerPoint Pro,"Microsoft PowerPoint Made Easy || Slide Design, Templates and Animations for Stunning Presentation || Only For Beginners",4.8,105,Beginner,27 lectures,2 total hours,Current price: $49.99
