skill,link,image_link,partner,title,course_description,rating,num_review,difficulty,num_lecture,duration,price
database,https://www.udemy.com/course/the-business-intelligence-analyst-course-2018/,https://img-c.udemycdn.com/course/240x135/1653432_3a57_3.jpg,"365 Careers, 365 Team",The Business Intelligence Analyst Course 2025,"The skills you need to become a BI Analyst - Statistics, Database theory, SQL, Tableau – Everything is included",4.6,47217,All Levels,467 lectures,23 total hours,Current price: $109.99
database,https://www.udemy.com/course/data-modelling-and-database-design-for-business-analysts/,https://img-c.udemycdn.com/course/240x135/1641148_cbf9.jpg,Dr Monjur Ahmed,Data Modelling and Database Design for Business Analysts,Learn Data Modelling and Database Design to become a successful Business Analyst,4.0,132,Beginner,15 lectures,2 total hours,Current price: $44.99
database,https://www.udemy.com/course/business-analyst-sql-survival-guide/,https://img-c.udemycdn.com/course/240x135/2111876_25d4.jpg,Daniel Gater,Business Analyst - SQL Survival Guide,"Get started in SQL; learn how databases work, connect to one, and get the data you need.",4.3,116,Beginner,19 lectures,2.5 total hours,Current price: $59.99
database,https://www.udemy.com/course/technical-business-analytics-for-agile-decision-making/,https://img-c.udemycdn.com/course/240x135/4990970_895f_4.jpg,Leo Zhu,"Business Analyst Bootcamp: Excel, Stats, SQL, Tableau","30+ Data Analysis, Business Intelligence, and Decision Making Exercises for Agile Business Analytics",4.5,621,All Levels,95 lectures,23.5 total hours,Current price: $64.99
database,https://www.udemy.com/course/salesforcebusinessanalyst/,https://img-c.udemycdn.com/course/240x135/4746864_2973_4.jpg,"Rapid Reskill by Mike Wheeler, Evan Wheeler",The Complete Salesforce Certified Business Analyst Course,Salesforce Business Analyst Certification Exam - Earn Salesforce's Newest Certification and Learn Business Analysis,3.9,1823,All Levels,92 lectures,5 total hours,Current price: $89.99
database,https://www.udemy.com/course/my-sql-excel-pivots-charts-tableau-4-in-1/,https://img-c.udemycdn.com/course/240x135/5344522_650d_7.jpg,Raghvan Bhattacharya,Business Intelligence Analyst Course,40+ hours : Become a BI Analyst - Learn to query database using MySQL | Excel | Tableau Desktop Specialist for BI,4.2,11,All Levels,186 lectures,42.5 total hours,Current price: $49.99
database,https://www.udemy.com/course/the-data-analyst-course-complete-data-analyst-bootcamp/,https://img-c.udemycdn.com/course/240x135/3570337_9b02_6.jpg,365 Careers,The Data Analyst Course: Complete Data Analyst Bootcamp,"Complete Data Analyst Training: Python, NumPy, Pandas, Data Collection, Preprocessing, Data Types, Data Visualization",4.5,21135,All Levels,282 lectures,21.5 total hours,Current price: $149.99
database,https://www.udemy.com/course/mysql-for-data-analysis/,https://img-c.udemycdn.com/course/240x135/2422318_79c1_5.jpg,"Maven Analytics • 1,500,000 Learners, John Pauler",SQL for Data Analysis: Beginner MySQL Business Intelligence,Learn SQL database analysis & business intelligence w/ MySQL Workbench. Perfect for SQL beginners or first-time coders!,4.6,9682,All Levels,103 lectures,4.5 total hours,Current price: $189.99
database,https://www.udemy.com/course/project-management-for-business-analyst/,https://img-c.udemycdn.com/course/240x135/909354_8ed0_8.jpg,The BA Guide | Jeremy Aschenbrenner,Business Analyst: Project Management Techniques and Tools,Learn project management techniques to increase your project success rate as a Business Analyst!,4.5,5406,All Levels,52 lectures,5 total hours,Current price: $89.99
database,https://www.udemy.com/course/become-an-it-business-analyst-learn-apply-succeed/,https://img-c.udemycdn.com/course/240x135/6261303_22f3_2.jpg,Mehul Thanki,"Become an IT Business Analyst: Learn, Apply, Succeed!","Advance your career as an IT Business Analyst through applied learning, real-world case studies and career guidance!",4.4,25,All Levels,51 lectures,11 total hours,Current price: $64.99
database,https://www.udemy.com/course/how-to-start-a-career-as-a-business-analyst/,https://img-c.udemycdn.com/course/240x135/1951482_50a5_5.jpg,Justin Butlion,Business Analytics 101: Become A Business Analyst,Learn the basics of business analytics and build your career as a business analyst.,3.9,116,Beginner,25 lectures,2.5 total hours,Current price: $44.99
database,https://www.udemy.com/course/it-business-analyst-for-beginners-part-2/,https://img-c.udemycdn.com/course/240x135/5117060_03c6.jpg,Brian UYI,IT Business Analyst For Beginners Part 2,IT Business Analyst for Beginners | Information Technology Business Analyst Course for Beginners,4.5,8,Beginner,19 lectures,3 total hours,Current price: $19.99
database,https://www.udemy.com/course/business-analyst-certification/,https://img-c.udemycdn.com/course/240x135/5443154_98a0_3.jpg,ARSCCOM Learning,Business Analyst Certification,"Your Complete Guide to Business Process Improvement, Digital Strategy, and BA Certification",4.3,80,Beginner,33 lectures,3 total hours,Current price: $54.99
database,https://www.udemy.com/course/complete-sql-for-data-analytics-and-business-intelligence/,https://img-c.udemycdn.com/course/240x135/6258315_bbde.jpg,Raja Pradhan | AWS Certified Solution Architect | Software Architect,Complete SQL for Data Analytics and Business Intelligence,"Master SQL from Basics to Advanced with Visualized Concepts, Real-World Case Studies and Interview Qs from Top Companies",4.7,27,All Levels,168 lectures,20 total hours,Current price: $74.99
database,https://www.udemy.com/course/essentials-of-business-analysis/,https://img-c.udemycdn.com/course/240x135/5522158_f62d_5.jpg,"TIA Education, Andrew Ramdayal",The Essentials of Business Analyst- 6 PDUs,Learn the Basis of Business Analysis to Enhance Your Career,4.6,1171,All Levels,50 lectures,3.5 total hours,Current price: $19.99
database,https://www.udemy.com/course/strategy-for-management-consultants-business-analysts/,https://img-c.udemycdn.com/course/240x135/1647046_c11d.jpg,Asen Gyczew,Strategy for Management Consultants & Business Analysts,Top advices from consulting practice with examples and case studies,4.6,11988,Intermediate,139 lectures,6.5 total hours,Current price: $79.99
database,https://www.udemy.com/course/sql-and-rdb-for-analysts/,https://img-c.udemycdn.com/course/240x135/87214_aa8f_3.jpg,Tom Gillies,SQL and Database for Analysts - Increase your team value,"Learn basic SQL so you can communicate better with DBAs and Developers, and increase your value as a team member.",4.4,109,Beginner,58 lectures,7.5 total hours,Current price: $19.99
database,https://www.udemy.com/course/complete-sql-databases-bootcamp-zero-to-mastery/,https://img-c.udemycdn.com/course/240x135/2851942_0cb0_3.jpg,"Andrei Neagoie, Mo Binni",Complete SQL and Databases Bootcamp,"Master SQL, Database Management & Design and learn to work with databases like PostgreSQL, MySQL + more. With Exercises!",4.6,6577,All Levels,282 lectures,24.5 total hours,Current price: $109.99
database,https://www.udemy.com/course/business-analysis-ba/,https://img-c.udemycdn.com/course/240x135/751792_622e_10.jpg,The BA Guide | Jeremy Aschenbrenner,Business Analysis Fundamentals - IIBA endorsed,Gain the core BA skills you need to start strong - and earn PD Hours/CDUs to kickstart your analysis career!,4.5,63374,Beginner,66 lectures,7.5 total hours,Current price: $129.99
database,https://www.udemy.com/course/bpmn-for-business-analysts/,https://img-c.udemycdn.com/course/240x135/599732_533f_5.jpg,Zbigniew Misiak,BPMN for business analysts,Learn the best practices of process modeling and analysis with Business Process Model and Notation (BPMN 2.0) standard,4.4,5026,All Levels,84 lectures,5.5 total hours,Current price: $84.99
