skill,link,image_link,partner,title,course_description,rating,num_review,difficulty,num_lecture,duration,price
html 5,https://www.udemy.com/course/the-data-analyst-course-complete-data-analyst-bootcamp/,https://img-c.udemycdn.com/course/240x135/3570337_9b02_6.jpg,365 Careers,The Data Analyst Course: Complete Data Analyst Bootcamp,"Complete Data Analyst Training: Python, NumPy, Pandas, Data Collection, Preprocessing, Data Types, Data Visualization",4.5,21135,All Levels,282 lectures,21.5 total hours,Current price: $149.99
html 5,https://www.udemy.com/course/the-business-intelligence-analyst-course-2018/,https://img-c.udemycdn.com/course/240x135/1653432_3a57_3.jpg,"365 Careers, 365 Team",The Business Intelligence Analyst Course 2025,"The skills you need to become a BI Analyst - Statistics, Database theory, SQL, Tableau – Everything is included",4.6,47217,All Levels,467 lectures,23 total hours,Current price: $109.99
html 5,https://www.udemy.com/course/bootstrap-from-scratch/,https://img-c.udemycdn.com/course/240x135/5397532_abe9.jpg,Brad Traversy,Bootstrap 5 From Scratch | Build 5 Modern Websites,Learn to customize and build modern websites from scratch using Bootstrap 5,4.7,1355,All Levels,93 lectures,13.5 total hours,Current price: $84.99
html 5,https://www.udemy.com/course/project-management-for-business-analyst/,https://img-c.udemycdn.com/course/240x135/909354_8ed0_8.jpg,The BA Guide | Jeremy Aschenbrenner,Business Analyst: Project Management Techniques and Tools,Learn project management techniques to increase your project success rate as a Business Analyst!,4.5,5406,All Levels,52 lectures,5 total hours,Current price: $89.99
html 5,https://www.udemy.com/course/essentials-of-business-analysis/,https://img-c.udemycdn.com/course/240x135/5522158_f62d_5.jpg,"TIA Education, Andrew Ramdayal",The Essentials of Business Analyst- 6 PDUs,Learn the Basis of Business Analysis to Enhance Your Career,4.6,1171,All Levels,50 lectures,3.5 total hours,Current price: $19.99
html 5,https://www.udemy.com/course/business-analysis-ba/,https://img-c.udemycdn.com/course/240x135/751792_622e_10.jpg,The BA Guide | Jeremy Aschenbrenner,Business Analysis Fundamentals - IIBA endorsed,Gain the core BA skills you need to start strong - and earn PD Hours/CDUs to kickstart your analysis career!,4.5,63374,Beginner,66 lectures,7.5 total hours,Current price: $129.99
html 5,https://www.udemy.com/course/business-analysis-masterclass/,https://img-c.udemycdn.com/course/240x135/3482742_897a_13.jpg,Meetul Patel,"Business Analysis ""A to Z"" Masterclass",We don't teach. We job Train!,4.6,8331,All Levels,25 lectures,31 total hours,Current price: $79.99
html 5,https://www.udemy.com/course/bpmn-for-business-analysts/,https://img-c.udemycdn.com/course/240x135/599732_533f_5.jpg,Zbigniew Misiak,BPMN for business analysts,Learn the best practices of process modeling and analysis with Business Process Model and Notation (BPMN 2.0) standard,4.4,5026,All Levels,84 lectures,5.5 total hours,Current price: $84.99
html 5,https://www.udemy.com/course/understanding-html-and-css/,https://img-c.udemycdn.com/course/240x135/3223049_5074_3.jpg,Anthony Alicea,Understanding HTML and CSS  (2025 Edition),"NEWLY UPDATED! Modern HTML/CSS: Layers, Containers, :has, Nesting, Grid, Flexbox, Semantic HTML, Multiple projects, AI",4.7,2573,All Levels,263 lectures,18 total hours,Current price: $84.99
html 5,https://www.udemy.com/course/strategy-for-management-consultants-business-analysts/,https://img-c.udemycdn.com/course/240x135/1647046_c11d.jpg,Asen Gyczew,Strategy for Management Consultants & Business Analysts,Top advices from consulting practice with examples and case studies,4.6,11988,Intermediate,139 lectures,6.5 total hours,Current price: $79.99
html 5,https://www.udemy.com/course/intro-to-html-web-development/,https://img-c.udemycdn.com/course/240x135/1006914_d679_3.jpg,"Kyle Pew, Office Newb",HTML - Introduction to HTML Web Development,Learn HTML and Master the Building Blocks of HTML Web Development,4.6,1990,Beginner,67 lectures,5.5 total hours,Current price: $79.99
html 5,https://www.udemy.com/course/software-testing-business-analyst/,https://img-c.udemycdn.com/course/240x135/943842_5c2d_7.jpg,The BA Guide | Jeremy Aschenbrenner,Business Analyst: Software Testing Processes & Techniques,"Reduce project bugs with repeatable testing processes. Learn to create test cases, scenarios, track defects, & more!",4.5,11085,All Levels,31 lectures,3 total hours,Current price: $69.99
html 5,https://www.udemy.com/course/data-analytics-career-track/,https://img-c.udemycdn.com/course/240x135/5787046_e749_10.jpg,Shahriar's Sight Academy,Data Analytics Career Path: 72 Days of Data Analyst Bootcamp,"Learn Excel, MySQL, Python, PowerBI, ChatGPT for A-Z Data Analysis. Become a Full-Packed Data Analyst. [5 Courses in 1]",4.3,958,All Levels,359 lectures,34.5 total hours,Current price: $79.99
html 5,https://www.udemy.com/course/the-complete-web-development-bootcamp/,https://img-c.udemycdn.com/course/240x135/1565838_e54e_18.jpg,"Dr. Angela Yu, Developer and Lead Instructor",The Complete Full-Stack Web Development Bootcamp,"Become a Full-Stack Web Developer with just ONE course. HTML, CSS, Javascript, Node, React, PostgreSQL, Web3 and DApps",4.7,431855,All Levels,374 lectures,61.5 total hours,Current price: $119.99
html 5,https://www.udemy.com/course/design-and-develop-a-killer-website-with-html5-and-css3/,https://img-c.udemycdn.com/course/240x135/437398_46c3_10.jpg,Jonas Schmedtmann,Build Responsive Real-World Websites with HTML and CSS,"Learn modern HTML5, CSS3 and web design by building a stunning website for your portfolio! Includes flexbox and CSS Grid",4.7,112845,All Levels,149 lectures,37.5 total hours,Current price: $159.99
html 5,https://www.udemy.com/course/the-complete-bootstrap-5-course-for-beginners-step-by-step/,https://img-c.udemycdn.com/course/240x135/3400594_0e84_3.jpg,Fatah Gabrial,The Ultimate Bootstrap Guide - Bootstrap 5 from Scratch,"A step-by-step course on Bootstrap 5 layouts, forms, components, and helpers with advanced features of Bootstrap 5.",4.6,3059,All Levels,311 lectures,21.5 total hours,Current price: $84.99
html 5,https://www.udemy.com/course/the-complete-financial-analyst-course/,https://img-c.udemycdn.com/course/240x135/648826_f0e5_4.jpg,365 Careers,The Complete Financial Analyst Course 2025,"Excel, Accounting, Financial Statement Analysis, Business Analysis, Financial Math, PowerPoint: Everything is Included!",4.6,94291,All Levels,381 lectures,22.5 total hours,Current price: $199.99
html 5,https://www.udemy.com/course/the-complete-business-plan-course/,https://img-c.udemycdn.com/course/240x135/1787702_b6d4_3.jpg,Chris Haroun | 1.5 Million Students | #1 Best Selling Business & Finance Prof.,The Complete Business Plan Course (Includes 50 Templates),"Everything You Need to Make a Great Business Plan by an Award Winning Business School Prof, VC & Successful Entrepreneur",4.7,20592,All Levels,63 lectures,9 total hours,Current price: $109.99
html 5,https://www.udemy.com/course/professional-communication-and-business-writing/,https://img-c.udemycdn.com/course/240x135/2323470_7191_32.jpg,Alex Genadinik,Business Communication Skills: Business Writing & Grammar,"Professional communication skills: Business writing, English grammar, business English, email, and presentation skills",4.6,26767,Beginner,276 lectures,18 total hours,Current price: $139.99
html 5,https://www.udemy.com/course/build-5-responsive-websites-with-html-css-and-javascript/,https://img-c.udemycdn.com/course/240x135/5485154_02ea.jpg,"Code And Create, George Lomidze, Lasha Nozadze","Build 5 Responsive Websites with HTML, CSS, and JavaScript","HTML, CSS, and JavaScript. Build 5 Modern Complete Responsive Websites with HTML, CSS, and JavaScript",4.4,58,All Levels,47 lectures,8.5 total hours,Current price: $74.99
