skill,link,image_link,partner,title,course_description,rating,num_review,difficulty,num_lecture,duration,price
continuous integration,https://www.udemy.com/course/data-integration-fundamentals/,https://img-c.udemycdn.com/course/240x135/3199784_e306_2.jpg,John Berry,Data Integration Fundamentals,Learn how to use data integration techniques to optimize business results and supercharge your career,4.5,12252,Beginner,30 lectures,4 total hours,Current price: $54.99
continuous integration,https://www.udemy.com/course/introduction-to-continuous-integration-and-continuous-delivery/,https://img-c.udemycdn.com/course/240x135/3565021_5e05.jpg,"Tim Buchalka, Tim Buchalka's Learn Programming Academy, Eduardo Rosas",Introduction to Continuous Integration & Continuous Delivery,"Find out why CI and CD, coupled with DevOps will give you a competitive advantage over developers without this knowledge",4.5,16432,All Levels,35 lectures,2.5 total hours,Current price: $59.99
continuous integration,https://www.udemy.com/course/azure-data-factory-bootcamp/,https://img-c.udemycdn.com/course/240x135/3048852_f2de_4.jpg,"Step2C Education, Step2c Learning",Azure Data Factory Training--Continuous Integration/Delivery,DP-203|DP-200|DP-201Exam Courses: Learn Azure Data Factory from scratch with hands-on exercises &become a data engineer,4.4,860,Beginner,239 lectures,20 total hours,Current price: $79.99
continuous integration,https://www.udemy.com/course/cicd-continuous-integration-and-continuous-deployment/,https://img-c.udemycdn.com/course/240x135/5633082_4816.jpg,SkillBakery Studio,CI/CD Continuous Integration and Continuous Deployment,"A Comprehensive Guide to Continuous Integration and Continuous Deployment with GitHub, AWS and Azure",4.6,2,All Levels,61 lectures,5 total hours,Current price: $34.99
continuous integration,https://www.udemy.com/course/azure-solutions-architect-certification-the-ultimate-bundle/,https://img-c.udemycdn.com/course/240x135/5968986_98b9_2.jpg,Memi Lavi,Azure Solutions Architect Certification: The Ultimate Bundle,Become a certified Azure Architect! Learn to design and build modern cloud apps from a certified Azure Architect,4.6,332,Beginner,392 lectures,28 total hours,Current price: $19.99
continuous integration,https://www.udemy.com/course/google-cloud-professional-cloud-architect-certification/,https://img-c.udemycdn.com/course/240x135/3995372_4064.jpg,"in28Minutes Official, Ranga Karanam | GCP Certification - Google Cloud Engineer & Architect",GCP Professional Cloud Architect: Google Cloud Certification,Become a GCP Cloud Architect. Architect Google Cloud Platform (GCP) Solutions. Includes 4 New Case Studies.,4.6,12379,All Levels,337 lectures,21 total hours,Current price: $119.99
continuous integration,https://www.udemy.com/course/mulesoft-certified-integration-architect-course-mcia/,https://img-c.udemycdn.com/course/240x135/4060596_7b92_3.jpg,Chinna Reddy,MuleSoft Certified Integration Architect Course - MCIA,Practical approach to become Mule integration architect & clear MCIA certification. Practice tests with explanations.,4.5,1200,All Levels,123 lectures,21.5 total hours,Current price: $84.99
continuous integration,https://www.udemy.com/course/data-integration-guide/,https://img-c.udemycdn.com/course/240x135/2447834_9ae0.jpg,Ahmed Fessi,Data Integration Guide,Learn how data can be integrated : following which principles and for what business outcomes,4.4,7528,All Levels,40 lectures,2.5 total hours,Current price: $59.99
continuous integration,https://www.udemy.com/course/ci-cd-devops/,https://img-c.udemycdn.com/course/240x135/2779762_87e5_4.jpg,John Honai,"DevOps, CI/CD(Continuous Integration/Delivery) for Beginners","Learn about CI/CD, DevOps, the concepts of Continuous Integration, Continuous Delivery / Deployment, DevOps pipeline",4.4,47094,Beginner,13 lectures,,Current price: $79.99
continuous integration,https://www.udemy.com/course/docker-for-continuous-integration/,https://img-c.udemycdn.com/course/240x135/2891008_bd8a_5.jpg,Brandon Harper,Docker for Continuous Integration,Build and deploy real-life applications using Docker containers,4.1,18,Beginner,42 lectures,2 total hours,Current price: $39.99
continuous integration,https://www.udemy.com/course/data-architecture-for-data-engineers/,https://img-c.udemycdn.com/course/240x135/6268045_b022.jpg,Manas Jain,Data Architecture for Data Engineers: Practical Approaches,"Building Scalable, Efficient Data Solutions with Real-World Applications",4.5,119,All Levels,41 lectures,4 total hours,Current price: $69.99
continuous integration,https://www.udemy.com/course/data-integration-etl-talend-open-studio-zero-to-hero/,https://img-c.udemycdn.com/course/240x135/4296082_df35_7.jpg,"Samuel Lenk, Diamond Training",Data Integration & ETL with Talend Open Studio Zero to Hero,"Add value to your data - with Talend Open Studio for Data Integration, ETL, Data Warehousing, Data Migration, BI",4.5,1715,Beginner,139 lectures,8.5 total hours,Current price: $84.99
continuous integration,https://www.udemy.com/course/continuous-improvement-an-introduction/,https://img-c.udemycdn.com/course/240x135/3764678_7237_7.jpg,Robert Chapman,Continuous Improvement: Certification,The step by step guide on how you can effectively deploy continuous improvement methodologies within your business,4.6,666,All Levels,85 lectures,8.5 total hours,Current price: $59.99
continuous integration,https://www.udemy.com/course/salesforce-certified-data-architect-course/,https://img-c.udemycdn.com/course/240x135/4480780_cb46_2.jpg,Walid El Horr,Salesforce Data Architect Course,"Get your Salesforce Data Architect certification with this course, aligned with the Spring 23 exam guide objectives",4.5,435,Intermediate,68 lectures,10 total hours,Current price: $59.99
continuous integration,https://www.udemy.com/course/the-data-analyst-course-complete-data-analyst-bootcamp/,https://img-c.udemycdn.com/course/240x135/3570337_9b02_6.jpg,365 Careers,The Data Analyst Course: Complete Data Analyst Bootcamp,"Complete Data Analyst Training: Python, NumPy, Pandas, Data Collection, Preprocessing, Data Types, Data Visualization",4.5,21135,All Levels,282 lectures,21.5 total hours,Current price: $149.99
continuous integration,https://www.udemy.com/course/pentaho-for-etl-data-integration-masterclass/,https://img-c.udemycdn.com/course/240x135/3333760_59ce_2.jpg,Start-Tech Academy,Pentaho for ETL & Data Integration Masterclass 2025 - PDI 9,Use Pentaho Data Integration tool for ETL & Data warehousing. Do ETL development using PDI 9 without coding background,4.7,2128,All Levels,76 lectures,9.5 total hours,Current price: $84.99
continuous integration,https://www.udemy.com/course/data-architecture-for-data-scientists/,https://img-c.udemycdn.com/course/240x135/5295982_ca3c_3.jpg,Biju Krishnan,Data Architecture for Data Scientists,"Datawarehouse, Data Lake, Data Lakehouse, Data Mesh, Kafka, Lambda & Kappa architecture, Feature Store, Vector DB & more",4.6,849,Intermediate,37 lectures,2.5 total hours,Current price: $69.99
continuous integration,https://www.udemy.com/course/learn-azure-data-factory-from-scratch/,https://img-c.udemycdn.com/course/240x135/3685634_740c_6.jpg,Ramesh Retnasamy,Azure Data Factory For Data Engineers - Project on Covid19,"Real world project for Data Engineers using Azure Data Factory, SQL, Data Lake, Databricks, HDInsight, CI/CD [DP203]",4.6,15379,All Levels,146 lectures,13 total hours,Current price: $94.99
continuous integration,https://www.udemy.com/course/devops-continuous-integration-continuous-delivery-agile/,https://img-c.udemycdn.com/course/240x135/5638026_648a_6.jpg,My Cloud Prof,"DevOps, Continuous Integration, Continuous Delivery & Agile","Learn DevOps, CI/CD, Agile, pipeline with Continuous Integration, Continuous Delivery / Continuous Deployment examples",4.2,30,All Levels,22 lectures,2.5 total hours,Current price: $19.99
continuous integration,https://www.udemy.com/course/big-data-engineering-bootcamp-with-gcp-and-azure-cloud/,https://img-c.udemycdn.com/course/240x135/6242299_e787.jpg,"Krish Naik, Mayank Aggarwal, KRISHAI Technologies Private Limited","Big Data Engineering Bootcamp with GCP, and Azure Cloud","Master Big Data with Hadoop, Spark, Kafka & Cloud | Build Real-World Projects & Scalable Data Pipelines from Scratch",4.7,357,All Levels,301 lectures,73.5 total hours,Current price: $44.99
