skill,link,image_link,partner,title,course_description,rating,num_review,difficulty,num_lecture,duration,price
saas,https://www.udemy.com/course/architect-saas-applications-unique-challenges-solutions/,https://img-c.udemycdn.com/course/240x135/1439624_7a64_9.jpg,"V2 Maestros, LLC",Architect SaaS Applications - Unique Challenges & Solutions,"Intro to SaaS, scalability, multi-tenancy, provisioning, security, APIs, management, maintenance",4.7,2063,Intermediate,40 lectures,3.5 total hours,Current price: $64.99
saas,https://www.udemy.com/course/saas-data-analytics-with-excel/,https://img-c.udemycdn.com/course/240x135/4688082_a3c7_2.jpg,Jimmy Chim,Data Analytics with Excel: For SaaS & Software Companies,"Analyze Data, Create Charts and Build Effective Presentation Slides: A Step-by-Step Guide",4.7,54,Intermediate,37 lectures,3 total hours,Current price: $69.99
saas,https://www.udemy.com/course/essentials-of-software-as-a-seervice-saas/,https://img-c.udemycdn.com/course/240x135/1190348_4a26_3.jpg,"Robert Barcik, Jana Gecelovska",Essentials of Software-as-a-Service (SaaS) Business,Learn the essentials of emerging field so that you can become the new business or marketing rockstar of SaaS!,4.6,4754,Intermediate,55 lectures,6.5 total hours,Current price: $39.99
saas,https://www.udemy.com/course/customer-360-saas-master-data-management-in-informatica-idmc/,https://img-c.udemycdn.com/course/240x135/5703436_9b46.jpg,MDM Specialist,Customer 360 SaaS Master Data Management in Informatica IDMC,A complete course on Master Data Management - MDM - Customer 360 (C360)  in Informatica IDMC,4.6,46,Beginner,64 lectures,6 total hours,Current price: $79.99
saas,https://www.udemy.com/course/data-architecture-for-data-engineers/,https://img-c.udemycdn.com/course/240x135/6268045_b022.jpg,Manas Jain,Data Architecture for Data Engineers: Practical Approaches,"Building Scalable, Efficient Data Solutions with Real-World Applications",4.5,119,All Levels,41 lectures,4 total hours,Current price: $69.99
saas,https://www.udemy.com/course/azure-solutions-architect-certification-the-ultimate-bundle/,https://img-c.udemycdn.com/course/240x135/5968986_98b9_2.jpg,Memi Lavi,Azure Solutions Architect Certification: The Ultimate Bundle,Become a certified Azure Architect! Learn to design and build modern cloud apps from a certified Azure Architect,4.6,332,Beginner,392 lectures,28 total hours,Current price: $19.99
saas,https://www.udemy.com/course/saas-product-management/,https://img-c.udemycdn.com/course/240x135/5777056_a9c1_2.jpg,Navdeep Yadav,SaaS Product Management: Become a SaaS PM,Mastering SaaS Product Strategy: From Vision to Execution,4.7,52,All Levels,241 lectures,30.5 total hours,Current price: $64.99
saas,https://www.udemy.com/course/saas-how-to-start-build-and-scale-your-own-saas/,https://img-c.udemycdn.com/course/240x135/5760442_fc8f_3.jpg,Mike Strives,"Learn SaaS: How to start, build, and scale your own SaaS!","Everything you need to know for coming up with a winning idea, launching, and scaling your SaaS.",4.6,60,Beginner,23 lectures,2.5 total hours,Current price: $69.99
saas,https://www.udemy.com/course/saas-metrics-fundamentals/,https://img-c.udemycdn.com/course/240x135/3830982_f050_4.jpg,Jimmy Chim,"SaaS Metrics Fundamentals for Managers, Founders & Investors","The Most Comprehensive Course on SaaS Metrics: Bookings, ARR, Churn, Retention, LTV, CAC, Unit Economics and Dashboard",4.5,1546,Beginner,24 lectures,2.5 total hours,Current price: $84.99
saas,https://www.udemy.com/course/salesforce-data-cloud-consultant-certification-course/,https://img-c.udemycdn.com/course/240x135/6445363_22b1.jpg,Deepika Khanna,Salesforce Data Cloud Consultant Certification Course,Pass your Salesforce Data Cloud Certification with this course. Build mini projects in Data Cloud.,4.8,110,All Levels,64 lectures,6 total hours,Current price: $44.99
saas,https://www.udemy.com/course/the-data-analyst-course-complete-data-analyst-bootcamp/,https://img-c.udemycdn.com/course/240x135/3570337_9b02_6.jpg,365 Careers,The Data Analyst Course: Complete Data Analyst Bootcamp,"Complete Data Analyst Training: Python, NumPy, Pandas, Data Collection, Preprocessing, Data Types, Data Visualization",4.5,21135,All Levels,282 lectures,21.5 total hours,Current price: $149.99
saas,https://www.udemy.com/course/complete-generative-ai-build-pro-web-mobile-saas-apps/,https://img-c.udemycdn.com/course/240x135/6168067_c159_4.jpg,Debayan Dey,"Complete Generative AI : Build Pro Web, Mobile & SaaS Apps","Build Generative AI SaaS Apps with ChatGPT, MongoDB, Firebase, Stripe, and More – No Coding Skills Required!",4.7,453,All Levels,76 lectures,10 total hours,Current price: $79.99
saas,https://www.udemy.com/course/data-architecture-for-data-scientists/,https://img-c.udemycdn.com/course/240x135/5295982_ca3c_3.jpg,Biju Krishnan,Data Architecture for Data Scientists,"Datawarehouse, Data Lake, Data Lakehouse, Data Mesh, Kafka, Lambda & Kappa architecture, Feature Store, Vector DB & more",4.6,849,Intermediate,37 lectures,2.5 total hours,Current price: $69.99
saas,https://www.udemy.com/course/saas-marketing-metrics/,https://img-c.udemycdn.com/course/240x135/4200596_d778_6.jpg,Navdeep Yadav,"SaaS Masterclass: Sales, Marketing and Growth Metrics","Comprehensive Course on Software as a Service(SaaS) Metrics: ARR, Churn, Retention, LTV, CAC, Unit Economics",4.2,690,All Levels,110 lectures,13 total hours,Current price: $64.99
saas,https://www.udemy.com/course/aws-certified-solutions-architect-associate-saa-c03/,https://img-c.udemycdn.com/course/240x135/2196488_8fc7_10.jpg,"Stephane Maarek | AWS Certified Cloud Practitioner,Solutions Architect,Developer",Ultimate AWS Certified Solutions Architect Associate 2025,Full Practice Exam | Learn Cloud Computing | Pass the AWS Certified Solutions Architect Associate Certification SAA-C03!,4.7,253574,All Levels,398 lectures,27.5 total hours,Current price: $119.99
saas,https://www.udemy.com/course/data-entry-skills-a-complete-data-entry-course-from-scratch/,https://img-c.udemycdn.com/course/240x135/5223618_671c.jpg,Data Tutors,Data Entry Skills: A Complete Data Entry Course from Scratch,A Complete Guide to Data Entry Skills: Learn Data Entry Skills and become a Data Entry Pro & Get a Online Data Entry Job,4.5,2672,Beginner,201 lectures,16 total hours,Current price: $19.99
saas,https://www.udemy.com/course/aws-data-engineer/,https://img-c.udemycdn.com/course/240x135/5591620_4e46_2.jpg,"Sundog Education by Frank Kane, Frank Kane, Stephane Maarek | AWS Certified Cloud Practitioner,Solutions Architect,Developer",AWS Certified Data Engineer Associate 2025 - Hands On!,"AWS DEA-C01 certification prep course with exercises and a full-length practice exam. Redshift, Glue, Athena, and more",4.6,7915,Intermediate,289 lectures,22 total hours,Current price: $94.99
saas,https://www.udemy.com/course/google-cloud-professional-cloud-architect-certification/,https://img-c.udemycdn.com/course/240x135/3995372_4064.jpg,"in28Minutes Official, Ranga Karanam | GCP Certification - Google Cloud Engineer & Architect",GCP Professional Cloud Architect: Google Cloud Certification,Become a GCP Cloud Architect. Architect Google Cloud Platform (GCP) Solutions. Includes 4 New Case Studies.,4.6,12379,All Levels,337 lectures,21 total hours,Current price: $119.99
saas,https://www.udemy.com/course/aws-solutions-architect-professional/,https://img-c.udemycdn.com/course/240x135/2789348_065c_4.jpg,"Stephane Maarek | AWS Certified Cloud Practitioner,Solutions Architect,Developer",Ultimate AWS Certified Solutions Architect Professional 2025,Be AWS Certified Solutions Architect Professional. Full Amazon Web Services Solution Architecture deep-dive for SAP-C02,4.7,22069,,Expert,16.5 total hours,Current price: $149.99
saas,https://www.udemy.com/course/build-a-saas-develop-a-subscription-based-app-from-scratch/,https://img-c.udemycdn.com/course/240x135/6254285_0c5a_2.jpg,Bluelime Learning Solutions,Build a SaaS: Develop a Subscription-Based App from scratch,"Create a Full-Stack Application with User Dashboard, Authentication, Subscription Plans ,Secure Payment Processing",4.4,11,Beginner,133 lectures,13 total hours,Current price: $79.99
