skill,link,image_link,partner,title,course_description,rating,num_review,difficulty,num_lecture,duration,price
rabbitmq,https://www.udemy.com/course/rabbitmq-in-practice/,https://img-c.udemycdn.com/course/240x135/4049476_e0db_3.jpg,Piotr Zuk,RabbitMQ In Practice,"A Complete Guide to RabbitMQ, Queues, Exchanges, Producers and Consumers, Patterns, Clustering, Optimization & Tune-up",4.6,1191,All Levels,58 lectures,9 total hours,Current price: $79.99
rabbitmq,https://www.udemy.com/course/net-8-microservices-with-rabbitmq-and-masstransit/,https://img-c.udemycdn.com/course/240x135/6368869_f3ab_4.jpg,Manish Narayan,.NET 8 Microservices with RabbitMQ and MassTransit,Microservices Architecture with RabbitMQ and MassTransit,4.6,12,All Levels,32 lectures,4 total hours,Current price: $54.99
rabbitmq,https://www.udemy.com/course/rabbitmq-ss/,https://img-c.udemycdn.com/course/240x135/4009782_7688_2.jpg,Gulshan Bajaj,RabbitMQ Python,Learn How to use RabbitMQ for establishing your messaging framework,4.5,153,Intermediate,20 lectures,3.5 total hours,Current price: $74.99
rabbitmq,https://www.udemy.com/course/rabbitmq-and-messaging-concepts/,https://img-c.udemycdn.com/course/240x135/2526432_6e10_2.jpg,Mustafa Kök,RabbitMQ and Messaging Concepts,"Learn RabbitMQ message broker, general messaging concepts with C# and Java code samples",4.6,1827,All Levels,48 lectures,4 total hours,Current price: $64.99
rabbitmq,https://www.udemy.com/course/data-architecture-for-data-engineers/,https://img-c.udemycdn.com/course/240x135/6268045_b022.jpg,Manas Jain,Data Architecture for Data Engineers: Practical Approaches,"Building Scalable, Efficient Data Solutions with Real-World Applications",4.5,119,All Levels,41 lectures,4 total hours,Current price: $69.99
rabbitmq,https://www.udemy.com/course/build-microservices-with-net-8-rabbitmq-masstransit-saga-pattern/,https://img-c.udemycdn.com/course/240x135/6247337_c9aa_2.jpg,CodeCraft Mastery,"Build Microservices with .NET 8, RabbitMQ, MassTransit, Saga","A Practical Guide to Creating Robust Microservices Architecture with NET 8, RabbitMQ, MassTransit and Saga Pattern",4.1,24,All Levels,43 lectures,4.5 total hours,Current price: $59.99
rabbitmq,https://www.udemy.com/course/data-architecture-for-data-scientists/,https://img-c.udemycdn.com/course/240x135/5295982_ca3c_3.jpg,Biju Krishnan,Data Architecture for Data Scientists,"Datawarehouse, Data Lake, Data Lakehouse, Data Mesh, Kafka, Lambda & Kappa architecture, Feature Store, Vector DB & more",4.6,849,Intermediate,37 lectures,2.5 total hours,Current price: $69.99
rabbitmq,https://www.udemy.com/course/getting-started-net-core-microservices-rabbitmq/,https://img-c.udemycdn.com/course/240x135/2394666_fd33_4.jpg,Manish Narayan,Getting Started .NET Core Microservices RabbitMQ,Build .NET Core Microservices using RabbitMQ Messaging,4.4,2577,All Levels,78 lectures,4.5 total hours,Current price: $59.99
rabbitmq,https://www.udemy.com/course/rabbitmq-java-spring-boot-for-system-integration/,https://img-c.udemycdn.com/course/240x135/1861314_3ba4_4.jpg,Timotius Pamungkas,RabbitMQ & Java (Spring Boot 3) Bootcamp - Basic To Advanced,Learn RabbitMQ (queue + stream) & Java Spring Boot 3 for asynchronous messaging & real-time data transfer among systems,4.6,624,All Levels,89 lectures,7.5 total hours,Current price: $69.99
rabbitmq,https://www.udemy.com/course/aws-certified-solutions-architect-associate-saa-c03/,https://img-c.udemycdn.com/course/240x135/2196488_8fc7_10.jpg,"Stephane Maarek | AWS Certified Cloud Practitioner,Solutions Architect,Developer",Ultimate AWS Certified Solutions Architect Associate 2025,Full Practice Exam | Learn Cloud Computing | Pass the AWS Certified Solutions Architect Associate Certification SAA-C03!,4.7,253574,All Levels,398 lectures,27.5 total hours,Current price: $119.99
rabbitmq,https://www.udemy.com/course/dynamodb-data-modeling/,https://img-c.udemycdn.com/course/240x135/5152646_e3f8_8.jpg,Rajeev Sakhuja,Amazon DynamoDB Data Modeling for Architects & Developers,"Proven design patterns. best practices, tips on saving costs and more",4.6,321,All Levels,71 lectures,6.5 total hours,Current price: $54.99
rabbitmq,https://www.udemy.com/course/data-mesh-demystified/,https://img-c.udemycdn.com/course/240x135/6236811_f1f4_2.jpg,Manas Jain,Data Mesh Architecture For Data Engineers,"Data Mesh Architecture for Data Engineers: Building Scalable, Decentralized Data Architectures for Modern Organizations",4.5,60,All Levels,30 lectures,2 total hours,Current price: $54.99
rabbitmq,https://www.udemy.com/course/salesforce-certified-data-architect-course/,https://img-c.udemycdn.com/course/240x135/4480780_cb46_2.jpg,Walid El Horr,Salesforce Data Architect Course,"Get your Salesforce Data Architect certification with this course, aligned with the Spring 23 exam guide objectives",4.5,435,Intermediate,68 lectures,10 total hours,Current price: $59.99
rabbitmq,https://www.udemy.com/course/apache-kafka/,https://img-c.udemycdn.com/course/240x135/1075642_b6d2_10.jpg,"Stephane Maarek | AWS Certified Cloud Practitioner,Solutions Architect,Developer, Conduktor Kafkademy",Apache Kafka Series - Learn Apache Kafka for Beginners v3,"START HERE: Learn Apache Kafka 3.0 Ecosystem, Core Concepts, Real World Java Producers/Consumers & Big Data Architecture",4.5,48396,All Levels,121 lectures,8.5 total hours,Current price: $94.99
rabbitmq,https://www.udemy.com/course/big-data-engineering-bootcamp-with-gcp-and-azure-cloud/,https://img-c.udemycdn.com/course/240x135/6242299_e787.jpg,"Krish Naik, Mayank Aggarwal, KRISHAI Technologies Private Limited","Big Data Engineering Bootcamp with GCP, and Azure Cloud","Master Big Data with Hadoop, Spark, Kafka & Cloud | Build Real-World Projects & Scalable Data Pipelines from Scratch",4.7,357,All Levels,301 lectures,73.5 total hours,Current price: $44.99
rabbitmq,https://www.udemy.com/course/aws-data-engineer/,https://img-c.udemycdn.com/course/240x135/5591620_4e46_2.jpg,"Sundog Education by Frank Kane, Frank Kane, Stephane Maarek | AWS Certified Cloud Practitioner,Solutions Architect,Developer",AWS Certified Data Engineer Associate 2025 - Hands On!,"AWS DEA-C01 certification prep course with exercises and a full-length practice exam. Redshift, Glue, Athena, and more",4.6,7915,Intermediate,289 lectures,22 total hours,Current price: $94.99
rabbitmq,https://www.udemy.com/course/learn-azure-data-factory-from-scratch/,https://img-c.udemycdn.com/course/240x135/3685634_740c_6.jpg,Ramesh Retnasamy,Azure Data Factory For Data Engineers - Project on Covid19,"Real world project for Data Engineers using Azure Data Factory, SQL, Data Lake, Databricks, HDInsight, CI/CD [DP203]",4.6,15379,All Levels,146 lectures,13 total hours,Current price: $94.99
rabbitmq,https://www.udemy.com/course/master-software-architecture-system-design-for-developers/,https://img-c.udemycdn.com/course/240x135/6216121_668f_2.jpg,Munawar Ali,Master Software Architecture & System Design for Developers,"Master System Design, Software Architectures, Microservices Architecture, AWS - To Crack Interviews or become Architect",4.9,26,All Levels,350 lectures,15.5 total hours,Current price: $44.99
rabbitmq,https://www.udemy.com/course/the-data-analyst-course-complete-data-analyst-bootcamp/,https://img-c.udemycdn.com/course/240x135/3570337_9b02_6.jpg,365 Careers,The Data Analyst Course: Complete Data Analyst Bootcamp,"Complete Data Analyst Training: Python, NumPy, Pandas, Data Collection, Preprocessing, Data Types, Data Visualization",4.5,21135,All Levels,282 lectures,21.5 total hours,Current price: $149.99
rabbitmq,https://www.udemy.com/course/google-cloud-professional-cloud-architect-certification/,https://img-c.udemycdn.com/course/240x135/3995372_4064.jpg,"in28Minutes Official, Ranga Karanam | GCP Certification - Google Cloud Engineer & Architect",GCP Professional Cloud Architect: Google Cloud Certification,Become a GCP Cloud Architect. Architect Google Cloud Platform (GCP) Solutions. Includes 4 New Case Studies.,4.6,12379,All Levels,337 lectures,21 total hours,Current price: $119.99
