skill,link,image_link,partner,title,course_description,rating,num_review,difficulty,num_lecture,duration,price
hive,https://www.udemy.com/course/the-big-data-developer-course/,https://img-c.udemycdn.com/course/240x135/4870802_1653_5.jpg,Deesa Technologies,"Mastering Big Data: Spark, Scala, Kafka, Hadoop,Hive & More","Complete Hands-On Developer Guide to Modern Big Data Tools like Hadoop, Hive, Spark, Scala, Kafka, NIFI, HBase and more",4.4,140,All Levels,197 lectures,33.5 total hours,Current price: $64.99
hive,https://www.udemy.com/course/mastering-hive-from-basics-to-advanced-big-data-analysis/,https://img-c.udemycdn.com/course/240x135/6050191_12b6_2.jpg,EDUCBA Bridging the Gap,Mastering Hive: From Basics to Advanced Big Data Analysis,"Unlock the power of Hive for big data management and analytics, from beginner to expert level!",4.9,5,All Levels,190 lectures,23.5 total hours,Current price: $19.99
hive,https://www.udemy.com/course/data-architecture-for-data-scientists/,https://img-c.udemycdn.com/course/240x135/5295982_ca3c_3.jpg,Biju Krishnan,Data Architecture for Data Scientists,"Datawarehouse, Data Lake, Data Lakehouse, Data Mesh, Kafka, Lambda & Kappa architecture, Feature Store, Vector DB & more",4.6,849,Intermediate,37 lectures,2.5 total hours,Current price: $69.99
hive,https://www.udemy.com/course/the-ultimate-hands-on-hadoop-tame-your-big-data/,https://img-c.udemycdn.com/course/240x135/996228_af5f_3.jpg,"Sundog Education by Frank Kane, Frank Kane, Sundog Education Team",The Ultimate Hands-On Hadoop: Tame your Big Data!,"Data Engineering and Hadoop tutorial with MapReduce, HDFS, Spark, Flink, Hive, HBase, MongoDB, Cassandra, Kafka + more!",4.6,30658,All Levels,104 lectures,14.5 total hours,Current price: $139.99
hive,https://www.udemy.com/course/hands-on-hadoop-masterclass-tame-the-big-data/,https://img-c.udemycdn.com/course/240x135/1978354_c650_4.jpg,EDUCBA Bridging the Gap,Big Data: Hadoop| MapReduce| Hive| Pig| NoSQL| Mahout| Oozie,"Learn Hadoop, HDFS, MapReduce, Hive, Pig, NoSQL, Mahout, Oozie, Flume, Storm, Avro, Spark, Projects and Case studies.",3.9,490,All Levels,532 lectures,68 total hours,Current price: $34.99
hive,https://www.udemy.com/course/ai-master-class/,https://img-c.udemycdn.com/course/240x135/2918410_a5db_5.jpg,Rupak Bob Roy,Ai/Data Scientist - Python/R/Big Data Master Class,"includes Data Science, Machine Learning-R/Python, Big Data-Hive, Flume,Sqoop, Pig and more.(Beginners To Expert Level)",4.4,29,All Levels,250 lectures,19.5 total hours,Current price: $59.99
hive,https://www.udemy.com/course/the-data-science-course-complete-data-science-bootcamp/,https://img-c.udemycdn.com/course/240x135/1754098_e0df_3.jpg,365 Careers,The Data Science Course: Complete Data Science Bootcamp 2025,"Complete Data Science Training: Math, Statistics, Python, Advanced Statistics in Python, Machine and Deep Learning",4.6,151551,All Levels,523 lectures,32 total hours,Current price: $124.99
hive,https://www.udemy.com/course/hadoop-querying-tool-hive-to-advance-hivereal-time-usage/,https://img-c.udemycdn.com/course/240x135/1286120_1ad8_10.jpg,J Garg,Hive to ADVANCE Hive (Real time usage) :Hadoop querying tool,In and Out of Apache Hive - From Basic to Advance Hive (Real-world concepts) + Use cases asked in Hive interviews,4.5,6011,All Levels,77 lectures,7 total hours,Current price: $74.99
hive,https://www.udemy.com/course/the-data-analyst-course-complete-data-analyst-bootcamp/,https://img-c.udemycdn.com/course/240x135/3570337_9b02_6.jpg,365 Careers,The Data Analyst Course: Complete Data Analyst Bootcamp,"Complete Data Analyst Training: Python, NumPy, Pandas, Data Collection, Preprocessing, Data Types, Data Visualization",4.5,21135,All Levels,282 lectures,21.5 total hours,Current price: $149.99
hive,https://www.udemy.com/course/apache-hive-for-data-engineers-hands-on/,https://img-c.udemycdn.com/course/240x135/4394060_67f4.jpg,Bigdata Engineer,Apache Hive for Data Engineers (Hands On) with 2 Projects,"Learn everything about Apache Hive a modern, data warehouse.",3.9,38,Beginner,97 lectures,6.5 total hours,Current price: $54.99
hive,https://www.udemy.com/course/top-data-scientist/,https://img-c.udemycdn.com/course/240x135/5961214_0e9b_3.jpg,Nancy Ticharwa (CEO Bethel Labs),The Top Data Scientist ™ BootCamp,Python | SQL | Machine Learning | Deep Learning | ChatGPT | Natural Language Processing | Computer Vision | 20+ Projects,4.3,43,All Levels,433 lectures,38 total hours,Current price: $49.99
hive,https://www.udemy.com/course/cca-159-data-analyst-using-sqoop-hive-and-impala/,https://img-c.udemycdn.com/course/240x135/2341082_0c5a_4.jpg,"Durga Viswanatha Raju Gadiraju, Madhuri Gadiraju, Sathvika Dandu, Pratik Kumar, Sai Varma, Phani Bhushan Bozzam, Siva Kalyan Geddada, Anushka Chakraborty","Sqoop, Hive and Impala for Data Analysts (Formerly CCA 159)","Hands on Sqoop, Hive and Impala for Data Analysts",4.1,714,Intermediate,233 lectures,20.5 total hours,Current price: $49.99
hive,https://www.udemy.com/course/ace-your-tech-interview-sql-for-data-scientists-engineers/,https://img-c.udemycdn.com/course/240x135/5806102_6b94_7.jpg,"Chandra Lingam, Compute with Cloud Support","SQL for Data Scientists, Data Engineers and Developers",Solve Real-World Problems with Interactive Coding Exercises and LeetCode challenges,4.8,17,Beginner,102 lectures,5 total hours,Current price: $79.99
hive,https://www.udemy.com/course/spark-nlp-for-data-scientists/,https://img-c.udemycdn.com/course/240x135/4790132_5802_4.jpg,"Ace Vo, David Talby, Jiri Dobes, Veysel Kocaman",Spark NLP for Data Scientists,"Unlock your NLP power with Spark NLP, the most popular NLP library in enterprises",4.6,61,Intermediate,78 lectures,12.5 total hours,Current price: $19.99
hive,https://www.udemy.com/course/from-0-to-1-hive/,https://img-c.udemycdn.com/course/240x135/857298_e6aa_2.jpg,Loony Corn,From 0 to 1: Hive for Processing Big Data,"End-to-End Hive : HQL, Partitioning, Bucketing, UDFs, Windowing, Optimization, Map Joins, Indexes",4.5,958,All Levels,87 lectures,15.5 total hours,Current price: $74.99
hive,https://www.udemy.com/course/big-data-ingestion-using-sqoop-and-flume-cca-and-hdpcd/,https://img-c.udemycdn.com/course/240x135/2170564_8911_17.jpg,Navdeep Kaur,Data Engineering Master Course: Spark/Hadoop/Kafka/MongoDB,Full Hands on course to become Big Data Engineer: Spark/Kafka/Hadoop/Flume/Hive/Sqoop/MongoDB. Data Engineering course.,4.5,1966,All Levels,151 lectures,12 total hours,Current price: $69.99
hive,https://www.udemy.com/course/big-data-testing-hadoop/,https://img-c.udemycdn.com/course/240x135/919134_7014_6.jpg,Big Data Engineer,Learn Big Data Testing with Hadoop and Hive with Pig Script,"Big Data Testing - Hadoop & Hive including Unix, Shell and Pig Scripting",4.1,219,All Levels,78 lectures,11 total hours,Current price: $44.99
hive,https://www.udemy.com/course/dp-100-azure-data-scientist-associate-complete-exam-guide/,https://img-c.udemycdn.com/course/240x135/4992188_0f74_2.jpg,Henry Habib,DP-100 Azure Data Scientist Associate Complete Exam Guide,"Complete DP-100 Azure Machine Learning training guide to prepare you for DP-100, with practice exams on DP 100 Azure ML",4.4,689,All Levels,97 lectures,8.5 total hours,Current price: $74.99
hive,https://www.udemy.com/course/big-data-engineering-bootcamp-with-gcp-and-azure-cloud/,https://img-c.udemycdn.com/course/240x135/6242299_e787.jpg,"Krish Naik, Mayank Aggarwal, KRISHAI Technologies Private Limited","Big Data Engineering Bootcamp with GCP, and Azure Cloud","Master Big Data with Hadoop, Spark, Kafka & Cloud | Build Real-World Projects & Scalable Data Pipelines from Scratch",4.7,357,All Levels,301 lectures,73.5 total hours,Current price: $44.99
hive,https://www.udemy.com/course/ml-in-production/,https://img-c.udemycdn.com/course/240x135/5768286_9a96_2.jpg,"Andrew Wolf, Ilya Fursov",ML in Production: From Data Scientist to ML Engineer,Turn any ML model within Jupyter Notebook into a deployed production-ready microservice.,4.6,191,All Levels,23 lectures,5.5 total hours,Current price: $74.99
