skill,link,image_link,partner,title,course_description,rating,num_review,difficulty,num_lecture,duration,price
cloud architectures,https://www.udemy.com/course/google-cloud-professional-cloud-architect-certification/,https://img-c.udemycdn.com/course/240x135/3995372_4064.jpg,"in28Minutes Official, Ranga Karanam | GCP Certification - Google Cloud Engineer & Architect",GCP Professional Cloud Architect: Google Cloud Certification,Become a GCP Cloud Architect. Architect Google Cloud Platform (GCP) Solutions. Includes 4 New Case Studies.,4.6,12379,All Levels,337 lectures,21 total hours,Current price: $119.99
cloud architectures,https://www.udemy.com/course/the-complete-cloud-computing-software-architecture-patterns/,https://img-c.udemycdn.com/course/240x135/4472674_020e_2.jpg,"Michael Pogrebinsky | Software Architecture, System Design, Java Expert, Top Developer Academy LLC",The Complete Cloud Computing Software Architecture Patterns,"Architect Large Scale Systems using Cloud Computing, Software Architecture Patterns & Modern System Design Principles",4.7,2216,All Levels,26 lectures,4.5 total hours,Current price: $84.99
cloud architectures,https://www.udemy.com/course/data-architecture-for-data-engineers/,https://img-c.udemycdn.com/course/240x135/6268045_b022.jpg,Manas Jain,Data Architecture for Data Engineers: Practical Approaches,"Building Scalable, Efficient Data Solutions with Real-World Applications",4.5,119,All Levels,41 lectures,4 total hours,Current price: $69.99
cloud architectures,https://www.udemy.com/course/software-architecture-design-of-modern-large-scale-systems/,https://img-c.udemycdn.com/course/240x135/3997622_0670_2.jpg,"Michael Pogrebinsky | Software Architecture, System Design, Java Expert, Top Developer Academy LLC",Software Architecture & Design of Modern Large Scale Systems,"Become a Software Architect or Technical Lead by Mastering Software Architecture, System Design & Big Data Processing.",4.7,11311,All Levels,45 lectures,7 total hours,Current price: $109.99
cloud architectures,https://www.udemy.com/course/aws-certified-solutions-architect-associate-saa-c03/,https://img-c.udemycdn.com/course/240x135/2196488_8fc7_10.jpg,"Stephane Maarek | AWS Certified Cloud Practitioner,Solutions Architect,Developer",Ultimate AWS Certified Solutions Architect Associate 2025,Full Practice Exam | Learn Cloud Computing | Pass the AWS Certified Solutions Architect Associate Certification SAA-C03!,4.7,253574,All Levels,398 lectures,27.5 total hours,Current price: $119.99
cloud architectures,https://www.udemy.com/course/microsoft-azure-cloud-architecture-case-studies/,https://img-c.udemycdn.com/course/240x135/4321566_5fc5.jpg,Memi Lavi,Microsoft Azure: Cloud Architecture Case Studies,Become an even better Cloud Architect by learning from real-world cloud architecture case studies.,4.5,1050,Intermediate,89 lectures,4 total hours,Current price: $79.99
cloud architectures,https://www.udemy.com/course/google-professional-cloud-architect-gcp-pca-exams/,https://img-c.udemycdn.com/course/240x135/4555898_37da_5.jpg,Paweł Krakowiak,Google Professional Cloud Architect - PCA - Practice Exams,Conquer the Google Professional Cloud Architect Exam - Master Cloud Architecture and Lead Transformational Projects!,4.3,616,All Levels,420 questions,,Current price: $54.99
cloud architectures,https://www.udemy.com/course/google-cloud-architect-certifications/,https://img-c.udemycdn.com/course/240x135/1343890_c3c3_15.jpg,"Google Cloud Experts Cloud Architect, Google Cloud Platform Gurus !",Google Certified Professional Cloud Architect 2025,"449,000 Subscriptions-In depth coverage of all Services-300+ Practice questions Including 3 case Studies Analysis Design",4.1,5154,All Levels,254 lectures,29.5 total hours,Current price: $44.99
cloud architectures,https://www.udemy.com/course/google-cloud-platform-from-zero-to-hero-the-complete-guide/,https://img-c.udemycdn.com/course/240x135/5485846_95c2.jpg,Memi Lavi,Google Professional Cloud Architect - The Complete Guide,Become a Certified Google Cloud Architect! Learn how to design and build modern cloud apps like a pro.,4.7,439,Beginner,264 lectures,17 total hours,Current price: $19.99
cloud architectures,https://www.udemy.com/course/aws-mastery-hands-on-cloud-projects-for-engineers/,https://img-c.udemycdn.com/course/240x135/6362029_fba1_4.jpg,Pravin Mishra | AWS Certified Cloud Practitioner | Solutions Architect,AWS Mastery: 26 AWS Cloud Projects for Engineers & Architect,"Master AWS with 26 Hands-On AWS Projects, Hands-on and Assignments covering VPC, EC2, Lambda, and Real-World Scenarios.",4.9,108,Intermediate,33 lectures,27 total hours,Current price: $79.99
cloud architectures,https://www.udemy.com/course/master-software-architecture-system-design-for-developers/,https://img-c.udemycdn.com/course/240x135/6216121_668f_2.jpg,Munawar Ali,Master Software Architecture & System Design for Developers,"Master System Design, Software Architectures, Microservices Architecture, AWS - To Crack Interviews or become Architect",4.9,26,All Levels,350 lectures,15.5 total hours,Current price: $44.99
cloud architectures,https://www.udemy.com/course/data-architecture-for-data-scientists/,https://img-c.udemycdn.com/course/240x135/5295982_ca3c_3.jpg,Biju Krishnan,Data Architecture for Data Scientists,"Datawarehouse, Data Lake, Data Lakehouse, Data Mesh, Kafka, Lambda & Kappa architecture, Feature Store, Vector DB & more",4.6,849,Intermediate,37 lectures,2.5 total hours,Current price: $69.99
cloud architectures,https://www.udemy.com/course/gcp-professional-cloud-architect-exam-practice-tests-2024/,https://img-c.udemycdn.com/course/240x135/5936668_7180.jpg,Ravinder | IT Certifications Experts,GCP Professional Cloud Architect Exam Practice Tests - 2025,LATEST scenario based Questions for GCP Professional Cloud Architect Exam. Solutions + Detailed Explanations,4.5,145,All Levels,260 questions,,Current price: $64.99
cloud architectures,https://www.udemy.com/course/becoming-a-cloud-architect-a-beginners-path/,https://img-c.udemycdn.com/course/240x135/5082358_7fda_2.jpg,Jindi Tech Cloud,Becoming a Cloud Architect: A Beginner's Path,Master the Fundamentals of Cloud Architecture: A Beginner's Guide to Becoming a Cloud Architect (From 0 to Cloud Hero),4.5,29,Beginner,10 lectures,,Current price: $44.99
cloud architectures,https://www.udemy.com/course/salesforce-data-cloud-consultant-certification-course/,https://img-c.udemycdn.com/course/240x135/6445363_22b1.jpg,Deepika Khanna,Salesforce Data Cloud Consultant Certification Course,Pass your Salesforce Data Cloud Certification with this course. Build mini projects in Data Cloud.,4.8,110,All Levels,64 lectures,6 total hours,Current price: $44.99
cloud architectures,https://www.udemy.com/course/cloud-architecture-pro-design-engineer-aws-azure-gcp/,https://img-c.udemycdn.com/course/240x135/5219198_2c94_2.jpg,Brian Newman,"Cloud Architecture Pro: Design & Engineer AWS, Azure, GCP!",From Fundamentals to Advanced Techniques in Cloud Engineering,4.7,7,Beginner,67 lectures,6.5 total hours,Current price: $19.99
cloud architectures,https://www.udemy.com/course/aws-certified-solutions-architect-associate-hands-on/,https://img-c.udemycdn.com/course/240x135/2469516_ab87_11.jpg,"Neal Davis | AWS Certified Solutions Architect & Developer, Digital Cloud Training | AWS Certified Cloud Practitioner AWS Certified Solutions Architect, AWS Developer Associate",AWS Certified Solutions Architect Associate (SAA-C03) Course,2025 AWS Certified Solutions Architect Associate Video Course SAA-C03 | Hands-on Exercises + AWS Practice Exam + Slides,4.6,20792,All Levels,290 lectures,23 total hours,Current price: $149.99
cloud architectures,https://www.udemy.com/course/azure-solutions-architect-certification-the-ultimate-bundle/,https://img-c.udemycdn.com/course/240x135/5968986_98b9_2.jpg,Memi Lavi,Azure Solutions Architect Certification: The Ultimate Bundle,Become a certified Azure Architect! Learn to design and build modern cloud apps from a certified Azure Architect,4.6,332,Beginner,392 lectures,28 total hours,Current price: $19.99
cloud architectures,https://www.udemy.com/course/big-data-engineering-bootcamp-with-gcp-and-azure-cloud/,https://img-c.udemycdn.com/course/240x135/6242299_e787.jpg,"Krish Naik, Mayank Aggarwal, KRISHAI Technologies Private Limited","Big Data Engineering Bootcamp with GCP, and Azure Cloud","Master Big Data with Hadoop, Spark, Kafka & Cloud | Build Real-World Projects & Scalable Data Pipelines from Scratch",4.7,357,All Levels,301 lectures,73.5 total hours,Current price: $44.99
cloud architectures,https://www.udemy.com/course/data-mesh-demystified/,https://img-c.udemycdn.com/course/240x135/6236811_f1f4_2.jpg,Manas Jain,Data Mesh Architecture For Data Engineers,"Data Mesh Architecture for Data Engineers: Building Scalable, Decentralized Data Architectures for Modern Organizations",4.5,60,All Levels,30 lectures,2 total hours,Current price: $54.99
