skill,link,image_link,partner,title,course_description,rating,num_review,difficulty,num_lecture,duration,price
mongodb,https://www.udemy.com/course/mongodb-the-complete-developers-guide/,https://img-c.udemycdn.com/course/240x135/1906852_93c6_2.jpg,"Academind by Maximilian Schwarzmüller, Maximilian Schwarzmüller",MongoDB - The Complete Developer's Guide 2025,"Master MongoDB Development for Web & Mobile Apps. CRUD Operations, Indexes, Aggregation Framework - All about MongoDB!",4.6,26568,All Levels,266 lectures,17.5 total hours,Current price: $99.99
mongodb,https://www.udemy.com/course/mongodb-associate-data-modeler-certification-exams/,https://img-c.udemycdn.com/course/240x135/5904014_d1fd_2.jpg,Paweł Krakowiak,MongoDB Associate Data Modeler Certification - Mock Exams,Master MongoDB Data Modeling with Practice Exams: Ace Your MongoDB Associate Data Modeler Certification!,4.4,10,,Expert,,Current price: $54.99
mongodb,https://www.udemy.com/course/the-ultimate-guide-for-mongodb/,https://img-c.udemycdn.com/course/240x135/4186602_e4d7_3.jpg,Firoj Atar,MongoDB - The Ultimate Administration and Developer's Guide,"Master MongoDB Development and Administration. CRUD, Aggregation, Indexes, Replication, Sharding, Security, MongoDB 6.0!",4.4,242,All Levels,316 lectures,37.5 total hours,Current price: $59.99
mongodb,https://www.udemy.com/course/the-complete-mongodb-course/,https://img-c.udemycdn.com/course/240x135/4336104_6211_9.jpg,Malvik Vaghadia,The Complete MongoDB Course,"Learn about NoSQL Document Databases and master Mongo Query Language, Aggregation Pipelines and more!",4.6,1649,Beginner,96 lectures,8 total hours,Current price: $84.99
mongodb,https://www.udemy.com/course/introduction-to-mongodb/,https://img-c.udemycdn.com/course/240x135/2277219_d700_2.jpg,"Brian Dowe, SuperDataScience Team, Ligency Team",Introduction to MongoDB for Data Analytics,Learn the basics of MongoDB with step by step exercises from a professional Web Developer.,4.2,196,Beginner,80 lectures,6 total hours,Current price: $59.99
mongodb,https://www.udemy.com/course/big-data-ingestion-using-sqoop-and-flume-cca-and-hdpcd/,https://img-c.udemycdn.com/course/240x135/2170564_8911_17.jpg,Navdeep Kaur,Data Engineering Master Course: Spark/Hadoop/Kafka/MongoDB,Full Hands on course to become Big Data Engineer: Spark/Kafka/Hadoop/Flume/Hive/Sqoop/MongoDB. Data Engineering course.,4.5,1966,All Levels,151 lectures,12 total hours,Current price: $69.99
mongodb,https://www.udemy.com/course/google-cloud-professional-cloud-architect-certification/,https://img-c.udemycdn.com/course/240x135/3995372_4064.jpg,"in28Minutes Official, Ranga Karanam | GCP Certification - Google Cloud Engineer & Architect",GCP Professional Cloud Architect: Google Cloud Certification,Become a GCP Cloud Architect. Architect Google Cloud Platform (GCP) Solutions. Includes 4 New Case Studies.,4.6,12379,All Levels,337 lectures,21 total hours,Current price: $119.99
mongodb,https://www.udemy.com/course/mongodb-101-beginners-guide-to-mongodb/,https://img-c.udemycdn.com/course/240x135/5611220_9fae.jpg,SKILL CURB,MongoDB 101: Beginner's Guide to MongoDB,"Understanding MongoDB's Document-Oriented Data Model. Learn, understand and practice fundamentals of the MongoDB.",4.3,12,Beginner,52 lectures,4 total hours,Current price: $19.99
mongodb,https://www.udemy.com/course/mongodb-online-training/,https://img-c.udemycdn.com/course/240x135/2710088_ace3_3.jpg,Uplatz Training,MongoDB Certification Training (beginner to expert),Understand in-depth the concepts of MongoDB and apply them. Become a MongoDB Database Architect. Apply for MongoDB jobs.,3.6,158,All Levels,17 lectures,12.5 total hours,Current price: $44.99
mongodb,https://www.udemy.com/course/nodejs-express-mongodb-bootcamp/,https://img-c.udemycdn.com/course/240x135/1672410_9ff1_5.jpg,Jonas Schmedtmann,"Node.js, Express, MongoDB & More: The Complete Bootcamp","Master Node by building a real-world RESTful API and web app (with authentication, Node.js security, payments & more)",4.6,27203,All Levels,229 lectures,42 total hours,Current price: $139.99
mongodb,https://www.udemy.com/course/certified-mongodb-developer-exam-c100dev-practice-tests/,https://img-c.udemycdn.com/course/240x135/4417592_ad04_9.jpg,Paweł Krakowiak,MongoDB Associate Developer Exam - Practice Tests,Master MongoDB Development with Practice Tests - Ace the Associate Developer Exam and Validate Your Expertise!,4.5,251,,Expert,,Current price: $59.99
mongodb,https://www.udemy.com/course/data-architecture-for-data-engineers/,https://img-c.udemycdn.com/course/240x135/6268045_b022.jpg,Manas Jain,Data Architecture for Data Engineers: Practical Approaches,"Building Scalable, Efficient Data Solutions with Real-World Applications",4.5,119,All Levels,41 lectures,4 total hours,Current price: $69.99
mongodb,https://www.udemy.com/course/the-data-analyst-course-complete-data-analyst-bootcamp/,https://img-c.udemycdn.com/course/240x135/3570337_9b02_6.jpg,365 Careers,The Data Analyst Course: Complete Data Analyst Bootcamp,"Complete Data Analyst Training: Python, NumPy, Pandas, Data Collection, Preprocessing, Data Types, Data Visualization",4.5,21135,All Levels,282 lectures,21.5 total hours,Current price: $149.99
mongodb,https://www.udemy.com/course/mongodb-associate-developer-exam-preparation/,https://img-c.udemycdn.com/course/240x135/5652474_2773_6.jpg,Bartosz Prętnik,MongoDB Associate Developer Exam Preparation,Efficient Exam Preparation for MongoDB Associate Developer Certification,4.4,36,All Levels,23 lectures,,Current price: $69.99
mongodb,https://www.udemy.com/course/data-architecture-for-data-scientists/,https://img-c.udemycdn.com/course/240x135/5295982_ca3c_3.jpg,Biju Krishnan,Data Architecture for Data Scientists,"Datawarehouse, Data Lake, Data Lakehouse, Data Mesh, Kafka, Lambda & Kappa architecture, Feature Store, Vector DB & more",4.6,849,Intermediate,37 lectures,2.5 total hours,Current price: $69.99
mongodb,https://www.udemy.com/course/the-complete-developers-guide-to-mongodb/,https://img-c.udemycdn.com/course/240x135/1000574_06cb.jpg,Stephen Grider,The Complete Developers Guide to MongoDB,Master MongoDB and Mongoose design with a test-driven approach,4.1,8032,All Levels,130 lectures,13 total hours,Current price: $79.99
mongodb,https://www.udemy.com/course/mongodb-masterclass-excel-in-nosql-pass-certification/,https://img-c.udemycdn.com/course/240x135/5176668_7169.jpg,"Tim Buchalka's Learn Programming Academy, Faisal Memon (EmbarkX)",MongoDB Masterclass: Excel in NoSQL & Pass Certification!,"Unlock the Power of MongoDB: Learn Data Modeling, Aggregations, Indexing Using Java, Python, C# and Node.js",4.5,121,Beginner,179 lectures,14.5 total hours,Current price: $74.99
mongodb,https://www.udemy.com/course/aws-solutions-architect-professional/,https://img-c.udemycdn.com/course/240x135/2789348_065c_4.jpg,"Stephane Maarek | AWS Certified Cloud Practitioner,Solutions Architect,Developer",Ultimate AWS Certified Solutions Architect Professional 2025,Be AWS Certified Solutions Architect Professional. Full Amazon Web Services Solution Architecture deep-dive for SAP-C02,4.7,22069,,Expert,16.5 total hours,Current price: $149.99
mongodb,https://www.udemy.com/course/mongodb-a-complete-course-on-database-administration/,https://img-c.udemycdn.com/course/240x135/4060884_e3ed_2.jpg,Wysheid Learning Portal,MongoDB : A Complete Database Administration Course,"Designed specifically for database administrators who work on RDBMS like Oracle, SQL Server, MySQL, Postgresql",4.2,622,Beginner,72 lectures,10.5 total hours,Current price: $74.99
mongodb,https://www.udemy.com/course/dynamodb-data-modeling/,https://img-c.udemycdn.com/course/240x135/5152646_e3f8_8.jpg,Rajeev Sakhuja,Amazon DynamoDB Data Modeling for Architects & Developers,"Proven design patterns. best practices, tips on saving costs and more",4.6,321,All Levels,71 lectures,6.5 total hours,Current price: $54.99
