skill,link,image_link,partner,title,course_description,rating,num_review,difficulty,num_lecture,duration,price
google analytics,https://www.udemy.com/course/top-data-scientist/,https://img-c.udemycdn.com/course/240x135/5961214_0e9b_3.jpg,Nancy Ticharwa (CEO Bethel Labs),The Top Data Scientist ™ BootCamp,Python | SQL | Machine Learning | Deep Learning | ChatGPT | Natural Language Processing | Computer Vision | 20+ Projects,4.3,43,All Levels,433 lectures,38 total hours,Current price: $49.99
google analytics,https://www.udemy.com/course/ultimate-google-analytics-course-50-practical-tips/,https://img-c.udemycdn.com/course/240x135/1710336_799c_4.jpg,Pavel Brecik,Ultimate Google Analytics 4 course + 50 practical examples,Google Analytics 4 (GA4) course based on real experience including 50 practical examples + 100 quiz questions,4.5,11615,All Levels,53 lectures,5.5 total hours,Current price: $84.99
google analytics,https://www.udemy.com/course/mastering-google-analytics-4-in-2025/,https://img-c.udemycdn.com/course/240x135/6160795_8788.jpg,Sakshar Barua,Mastering Google Analytics 4 In 2025,Master Google Analytics 4 In 2025. Learn from a certified former Google Vendor Instructor.,4.5,31,All Levels,26 lectures,5 total hours,Current price: $44.99
google analytics,https://www.udemy.com/course/the-data-science-course-complete-data-science-bootcamp/,https://img-c.udemycdn.com/course/240x135/1754098_e0df_3.jpg,365 Careers,The Data Science Course: Complete Data Science Bootcamp 2025,"Complete Data Science Training: Math, Statistics, Python, Advanced Statistics in Python, Machine and Deep Learning",4.6,151551,All Levels,523 lectures,32 total hours,Current price: $124.99
google analytics,https://www.udemy.com/course/google-biqquery/,https://img-c.udemycdn.com/course/240x135/3658828_f5e5_4.jpg,Sandeep Kumar,The Complete Google BiqQuery Masterclass: Beginner to Expert,"Master Google BigQuery Analytics with SQL  used in Big Query to analyze Real data for data scientists, Developers, etc.",4.4,1097,All Levels,162 lectures,8.5 total hours,Current price: $79.99
google analytics,https://www.udemy.com/course/data-analytics-masters-basics-to-advanced/,https://img-c.udemycdn.com/course/240x135/5182120_a68b.jpg,"Satyajit Pattnaik, Zep Tech Solutions",Data Analytics Masters - From Basics To Advanced,"Master Data Analysis: Learn Python, EDA, Stats,  MS Excel, SQL, Power BI, Tableau, Predictive Analytics & ETL Basics",4.3,738,Beginner,274 lectures,49.5 total hours,Current price: $74.99
google analytics,https://www.udemy.com/course/ultimate-google-analytics-training-for-beginners/,https://img-c.udemycdn.com/course/240x135/4014938_3547.jpg,"Joshua George, ClickSlice Ltd",The Ultimate Google Analytics Course For Beginners 2025,Learn how to use Google Analytics to grow your business. Taught by an award-winning Digital Marketing agency owner. GA4,4.7,1802,Beginner,35 lectures,4 total hours,Current price: $74.99
google analytics,https://www.udemy.com/course/data-analytics-career-track/,https://img-c.udemycdn.com/course/240x135/5787046_e749_10.jpg,Shahriar's Sight Academy,Data Analytics Career Path: 72 Days of Data Analyst Bootcamp,"Learn Excel, MySQL, Python, PowerBI, ChatGPT for A-Z Data Analysis. Become a Full-Packed Data Analyst. [5 Courses in 1]",4.3,958,All Levels,359 lectures,34.5 total hours,Current price: $79.99
google analytics,https://www.udemy.com/course/google-analytics-insights/,https://img-c.udemycdn.com/course/240x135/613946_e110_11.jpg,Daragh Walsh,Google Analytics for Beginners - Master Google Analytics,Learn Google Analytics - Become an Expert in Web & Marketing Analytics in this Best-Selling Google Analytics Course!,4.5,16193,All Levels,31 lectures,2.5 total hours,Current price: $79.99
google analytics,https://www.udemy.com/course/google-analytics-ga4-gtm-for-beginners/,https://img-c.udemycdn.com/course/240x135/4152226_bd76_8.jpg,"Anton Voroniuk, Anton Voroniuk Support, Hanna Ivanova",Google Analytics 4 (GA4): Become a Web Analytics Specialist!,Unlock the Power of Google Analytics 4: Your Journey from Setup to Data Mastery,4.3,1008,Beginner,127 lectures,11 total hours,Current price: $54.99
google analytics,https://www.udemy.com/course/applied-sql-for-data-analytics-data-science-with-bigquery/,https://img-c.udemycdn.com/course/240x135/3666718_b452_2.jpg,Jeff James,Applied SQL For Data Analytics / Data Science With BigQuery,Go from SQL Zero to Hero and develop rich mental models for writing sophisticated SQL statements & solving problems.,4.6,1123,Beginner,63 lectures,13 total hours,Current price: $74.99
google analytics,https://www.udemy.com/course/become-a-data-scientist/,https://img-c.udemycdn.com/course/240x135/5254956_406a_3.jpg,Start-Tech Academy,"Become a Data Scientist: SQL, Tableau, ML & DL [4-in-1]","4-in-1 Bundle covering the 4 essential topics for a data scientist - SQL, Tableau, Machine & Deep Learning using Python",4.6,111,Beginner,338 lectures,37 total hours,Current price: $79.99
google analytics,https://www.udemy.com/course/data-analysis-and-dashboards-with-google-data-studio/,https://img-c.udemycdn.com/course/240x135/1213560_e635_12.jpg,Ian Littlejohn,Complete Introduction to Looker Studio (Google Data Studio),"Learn how to create powerful data analysis, reports and dashboards with Looker Studio (formerly Google Data Studio)",4.7,8050,All Levels,72 lectures,5 total hours,Current price: $89.99
google analytics,https://www.udemy.com/course/google-analytics-guide/,https://img-c.udemycdn.com/course/240x135/1613102_34d3_10.jpg,Robin & Jesper,The Complete Google Analytics 4 Training for Beginners 2025,"Google Analytics 4: Increase Website Traffic, 100+ AI Prompts, Optimize Your Website, Preparation for GA Certification.",4.6,3514,Beginner,20 lectures,2 total hours,Current price: $79.99
google analytics,https://www.udemy.com/course/google-analytics-certification/,https://img-c.udemycdn.com/course/240x135/328386_6809_11.jpg,Daragh Walsh,Google Analytics Certification - Get Certified & Earn More,A Step-by-Step Guide to Pass the Google Analytics Certification Exam in One Day. No Experience Required!,4.3,17650,All Levels,25 lectures,2.5 total hours,Current price: $124.99
google analytics,https://www.udemy.com/course/data-analytics-with-google-data-studio/,https://img-c.udemycdn.com/course/240x135/3912956_2aaf.jpg,Pedro Bailadeira,Data Analytics with Google Data Studio,Show the key insights from your AppSheet or Google Sheets data into a Google Data Studio dashboard,4.5,35,All Levels,16 lectures,2.5 total hours,Current price: $44.99
google analytics,https://www.udemy.com/course/mega-google-analytics-4-course-google-tag-manager-digital-marketing/,https://img-c.udemycdn.com/course/240x135/5896430_aa2d_2.jpg,Pouya Eti • Digital Marketing Expert,Mega Google Analytics 4 + Google Tag Manager for Beginners,"Master Google Analytics 4 (GA4), Google Tag Manager (GTM) custom events, reports, ecommerce events for digital marketing",4.4,208,All Levels,38 lectures,4 total hours,Current price: $79.99
google analytics,https://www.udemy.com/course/google-analytics-4-with-tag-manager/,https://img-c.udemycdn.com/course/240x135/3778360_726b_2.jpg,Rudranil Chakrabortty,Master Google Analytics 4 Reports and GTM Basics in 2025,"Learn to analyze Google Analytics 4 reports, create powerful custom reports and tailor GA4 data with Google Tag Manager",4.5,1850,All Levels,90 lectures,13 total hours,Current price: $74.99
google analytics,https://www.udemy.com/course/google-data-studio-for-data-analytics-business-intelligence/,https://img-c.udemycdn.com/course/240x135/2891062_7cb5.jpg,Minerva Singh,"Google Data Studio For Data Analytics, Business Intelligence",Master a Free Tool For Data Analytics & Business Intelligence: Google Data Studio For Analyitics,4.4,266,All Levels,34 lectures,3.5 total hours,Current price: $49.99
google analytics,https://www.udemy.com/course/advanced-google-analytics-training-course/,https://img-c.udemycdn.com/course/240x135/2219902_0fb0_3.jpg,Anil Batra,Google Analytics Advanced Training - Master Google Analytics,"Advanced Google Analytics Mastery - Advanced Features, Tracking, Reports and Analysis & Overview of Google Tag Manager",4.5,181,All Levels,25 lectures,3 total hours,Current price: $74.99
