skill,link,image_link,partner,title,course_description,rating,num_review,difficulty,num_lecture,duration,price
agile,https://www.udemy.com/course/google-cloud-professional-cloud-architect-certification/,https://img-c.udemycdn.com/course/240x135/3995372_4064.jpg,"in28Minutes Official, Ranga Karanam | GCP Certification - Google Cloud Engineer & Architect",GCP Professional Cloud Architect: Google Cloud Certification,Become a GCP Cloud Architect. Architect Google Cloud Platform (GCP) Solutions. Includes 4 New Case Studies.,4.6,12379,All Levels,337 lectures,21 total hours,Current price: $119.99
agile,https://www.udemy.com/course/the-data-analyst-course-complete-data-analyst-bootcamp/,https://img-c.udemycdn.com/course/240x135/3570337_9b02_6.jpg,365 Careers,The Data Analyst Course: Complete Data Analyst Bootcamp,"Complete Data Analyst Training: Python, NumPy, Pandas, Data Collection, Preprocessing, Data Types, Data Visualization",4.5,21135,All Levels,282 lectures,21.5 total hours,Current price: $149.99
agile,https://www.udemy.com/course/aws-certified-solutions-architect-associate-saa-c03/,https://img-c.udemycdn.com/course/240x135/2196488_8fc7_10.jpg,"Stephane Maarek | AWS Certified Cloud Practitioner,Solutions Architect,Developer",Ultimate AWS Certified Solutions Architect Associate 2025,Full Practice Exam | Learn Cloud Computing | Pass the AWS Certified Solutions Architect Associate Certification SAA-C03!,4.7,253574,All Levels,398 lectures,27.5 total hours,Current price: $119.99
agile,https://www.udemy.com/course/data-governance-training-course/,https://img-c.udemycdn.com/course/240x135/4263588_ec80.jpg,George Smarts,Data Governance - The Complete Course for Beginners,Make yourself standout in meetings about Data Governance. Learn everything that the experts know about Data Governance,4.5,5800,Beginner,107 lectures,6.5 total hours,Current price: $84.99
agile,https://www.udemy.com/course/agile-scrum-for-beginners-scrum-master-certification-preparation/,https://img-c.udemycdn.com/course/240x135/1850902_6c52_6.jpg,"Valentin Despa, Valentin Despa - Support",Agile Scrum for Beginners + Scrum Master Certification Prep,"[UNOFFICIAL] Learn Scrum, understand the Agile principles + prepare for your Agile/Scrum Master certification in 2025",4.7,26066,All Levels,134 lectures,14.5 total hours,Current price: $109.99
agile,https://www.udemy.com/course/modeling-data-warehouse-with-data-vault-for-beginners/,https://img-c.udemycdn.com/course/240x135/3655144_5a8d_2.jpg,Esra Ekiz,Modeling Data Warehouse with Data Vault 2.0,Course covers the basics and fundamentals of Data Vault 2.0 along with Agile Methodology and Big Data,4.5,3694,Intermediate,47 lectures,6 total hours,Current price: $74.99
agile,https://www.udemy.com/course/aws-solutions-architect-professional/,https://img-c.udemycdn.com/course/240x135/2789348_065c_4.jpg,"Stephane Maarek | AWS Certified Cloud Practitioner,Solutions Architect,Developer",Ultimate AWS Certified Solutions Architect Professional 2025,Be AWS Certified Solutions Architect Professional. Full Amazon Web Services Solution Architecture deep-dive for SAP-C02,4.7,22069,,Expert,16.5 total hours,Current price: $149.99
agile,https://www.udemy.com/course/scrum-course-udemy/,https://img-c.udemycdn.com/course/240x135/2002862_aa45_5.jpg,"YESI EDUCATION, Mauricio Rubio - Agile Guru & Founder of YESI EDUCATION, AgileKB & Grabdl",The Complete Agile Scrum Fundamentals Course + Certification,"Agile Scrum from A to Z: Scrum a Project Management methodology, Scrum Fundamentals, Scrum concepts, Agile Scrum tools",4.6,19628,Beginner,107 lectures,15 total hours,Current price: $139.99
agile,https://www.udemy.com/course/learn-azure-data-factory-from-scratch/,https://img-c.udemycdn.com/course/240x135/3685634_740c_6.jpg,Ramesh Retnasamy,Azure Data Factory For Data Engineers - Project on Covid19,"Real world project for Data Engineers using Azure Data Factory, SQL, Data Lake, Databricks, HDInsight, CI/CD [DP203]",4.6,15379,All Levels,146 lectures,13 total hours,Current price: $94.99
agile,https://www.udemy.com/course/agile-crash-course/,https://img-c.udemycdn.com/course/240x135/864146_dbd7_11.jpg,"YESI EDUCATION, Mauricio Rubio - Agile Guru & Founder of YESI EDUCATION, AgileKB & Grabdl",Agile Crash Course: Agile Project Management; Agile Delivery,"Agile Project Management Basics (Scrum), Agile Project Management Essentials (Scrum). Plus Agile Certification (Scrum)",4.5,93117,Beginner,26 lectures,3 total hours,Current price: $174.99
agile,https://www.udemy.com/course/scaled-agile-framework-safe-scaling-agile-scrum-to-safe/,https://img-c.udemycdn.com/course/240x135/4852986_56bc_9.jpg,Mohammad N. Khan - SAFe Trainer (SPC),Scaled Agile Framework® (Latest SAFe® 6.0) : In-Depth,"Agile/Scrum, SAFe® 6.0- Scaled Agile Framework®, Rally Project Management Tool, SAFe SSM, POPM free practice test link",4.3,5092,All Levels,81 lectures,9 total hours,Current price: $74.99
agile,https://www.udemy.com/course/the-complete-agile-scrum-project-management-course/,https://img-c.udemycdn.com/course/240x135/6028152_84b7.jpg,365 Careers,The Complete Agile & Scrum Project Management Course,"Master Agile and Scrum through an immersive, real-world case study to become a world-class project manager",4.6,1942,All Levels,57 lectures,4 total hours,Current price: $79.99
agile,https://www.udemy.com/course/understanding-agile-complete-guide-for-beginners/,https://img-c.udemycdn.com/course/240x135/4287408_416a.jpg,"Masha Ostroumova, Agile Apothecary",Understanding Agile 2024 | Complete Guide for Beginners,Everything you need to know about Agile and Agile organizations in 2024,4.6,7635,Beginner,34 lectures,5 total hours,Current price: $59.99
agile,https://www.udemy.com/course/mastering-the-art-of-data-visualization-2020/,https://img-c.udemycdn.com/course/240x135/3002664_21f4_7.jpg,Joshua Brindley,Data Storytelling and Data Visualization Mastery,"Learn the crucial skills to effectively communicate, persuade, and drive decisions with data",4.5,10452,All Levels,30 lectures,6 total hours,Current price: $119.99
agile,https://www.udemy.com/course/complete-agile-scrum-master-training-exam-simulator/,https://img-c.udemycdn.com/course/240x135/3270848_8120_5.jpg,"Omni Academy 400,000+ students, Mirko Perkusich, Ph.D., Gustavo Farias 500.000+ Alunos, Omni Academy - Student Care & Support",Complete Agile Scrum Master Certification Training,Get PSM™ I certified on your first try in 2025! Agile Scrum Simulation + 340 PSM I Practice Questions + [EXTRA] PSM II,4.6,24835,Beginner,123 lectures,6 total hours,Current price: $119.99
agile,https://www.udemy.com/course/becoming-an-agile-coach/,https://img-c.udemycdn.com/course/240x135/3079220_2081_4.jpg,"Masha Ostroumova, Agile Apothecary","Become an Agile Coach in 2024 | Mindset, Frameworks, Skills","Learn to plan, build, and deliver successful products | Master Scrum, Kanban, and more Agile frameworks in 2024",4.5,2503,All Levels,84 lectures,11.5 total hours,Current price: $84.99
agile,https://www.udemy.com/course/agile-fundamentals-scrum-kanban-scrumban/,https://img-c.udemycdn.com/course/240x135/2013892_4fd3_5.jpg,"The BA Guide | Jeremy Aschenbrenner, Vivek & Pabitra Khattri",Agile Fundamentals: Including Scrum & Kanban,"Master Agile principles, values, approaches, & mindset to help organizations make changes faster and with less expense",4.5,82850,All Levels,85 lectures,4.5 total hours,Current price: $149.99
agile,https://www.udemy.com/course/agile-data-science/,https://img-c.udemycdn.com/course/240x135/3135706_0909.jpg,Shreesha Jagadeesh,Zero to Agile Data Science,Learn how to iteratively develop Data Science models,4.3,79,Intermediate,58 lectures,4 total hours,Current price: $44.99
agile,https://www.udemy.com/course/the-data-science-course-complete-data-science-bootcamp/,https://img-c.udemycdn.com/course/240x135/1754098_e0df_3.jpg,365 Careers,The Data Science Course: Complete Data Science Bootcamp 2025,"Complete Data Science Training: Math, Statistics, Python, Advanced Statistics in Python, Machine and Deep Learning",4.6,151551,All Levels,523 lectures,32 total hours,Current price: $124.99
agile,https://www.udemy.com/course/the-ultimate-agile-leader-certification-training/,https://img-c.udemycdn.com/course/240x135/4461816_83d5.jpg,Vladimir Raykov,The Ultimate Agile Leader Certification Training,[Unofficial] A Complete Preparation For An Agile Leader Certification (2025),4.8,925,All Levels,53 lectures,4.5 total hours,Current price: $84.99
