skill,link,image_link,partner,title,course_description,rating,num_review,difficulty,num_lecture,duration,price
programming languages,https://www.udemy.com/course/r-programming-language-for-data-scientists-data-science-tm/,https://img-c.udemycdn.com/course/240x135/6153129_a0ed.jpg,"Dr. Noble Arya Full-Stack Data Scientist, Ai Researcher End to End",R Programming Language for Data Scientists (Data Science) TM,Data Science With Case Study,,,All Levels,15 lectures,7.5 total hours,Current price: $19.99
programming languages,https://www.udemy.com/course/r-programming/,https://img-c.udemycdn.com/course/240x135/765242_2578_6.jpg,"Kirill Eremenko, SuperDataScience Team, Ligency Team",R Programming A-Z™: R For Data Science With Real Exercises!,"Learn Programming In R And R Studio. Data Analytics, Data Science, Statistical Analysis, Packages, Functions, GGPlot2",4.5,55636.0,All Levels,79 lectures,10.5 total hours,Current price: $109.99
programming languages,https://www.udemy.com/course/spark-nlp-for-data-scientists/,https://img-c.udemycdn.com/course/240x135/4790132_5802_4.jpg,"Ace Vo, David Talby, Jiri Dobes, Veysel Kocaman",Spark NLP for Data Scientists,"Unlock your NLP power with Spark NLP, the most popular NLP library in enterprises",4.6,61.0,Intermediate,78 lectures,12.5 total hours,Current price: $19.99
programming languages,https://www.udemy.com/course/c-programming-for-beginners-programming-in-c/,https://img-c.udemycdn.com/course/240x135/3173974_b870_4.jpg,Vlad Budnitski,C Programming Bootcamp - The Complete C Language Course,C Programming 2025: Master the Fundamentals of C Programming Language. Join the Comprehensive C Bootcamp Masterclass!,4.5,8880.0,All Levels,396 lectures,44 total hours,Current price: $84.99
programming languages,https://www.udemy.com/course/c-programming-for-beginners-/,https://img-c.udemycdn.com/course/240x135/1467808_f8c0.jpg,"Tim Buchalka's Learn Programming Academy, Jason Fedin",C Programming For Beginners - Master the C Language,C Programming will increase career options.  Become a better dev in other languages by learning C.   Pointers explained,4.4,37980.0,All Levels,150 lectures,25.5 total hours,Current price: $119.99
programming languages,https://www.udemy.com/course/python-data-science-with-r-python-r-programming/,https://img-c.udemycdn.com/course/240x135/5293466_b5ef.jpg,"Oak Academy, OAK Academy Team, Ali̇ CAVDAR",Python & Data Science with R | Python & R Programming,R Programming Language & Python Programming for Data Science & Data Analytics all in one from scratch with real projects,4.6,43.0,All Levels,236 lectures,32 total hours,Current price: $64.99
programming languages,https://www.udemy.com/course/r-programming-for-statistics-and-data-science/,https://img-c.udemycdn.com/course/240x135/1562640_6c9c_5.jpg,"365 Careers, 365 Simona (The 365 Team)",R Programming for Statistics and Data Science,R Programming for Data Science & Data Analysis. Applying R for Statistics and Data Visualization with GGplot2 in R,4.5,5447.0,All Levels,126 lectures,6.5 total hours,Current price: $79.99
programming languages,https://www.udemy.com/course/programming-languages-build-an-interpreter/,https://img-c.udemycdn.com/course/240x135/1283066_39a7.jpg,Nawaf Alluqmani,Build a Complete Programming Language,Understand the concept of how programming languages are working and build complete programming Language from scratch,3.7,27.0,Beginner,39 lectures,4 total hours,Current price: $49.99
programming languages,https://www.udemy.com/course/data-science-and-machine-learning-bootcamp-with-r/,https://img-c.udemycdn.com/course/240x135/821726_8071.jpg,"Jose Portilla, Pierian Training",Data Science and Machine Learning Bootcamp with R,Learn how to use the R programming language for data science and machine learning and data visualization!,4.6,17410.0,All Levels,128 lectures,18 total hours,Current price: $99.99
programming languages,https://www.udemy.com/course/r-analytics/,https://img-c.udemycdn.com/course/240x135/860148_4f31_7.jpg,"Kirill Eremenko, SuperDataScience Team, Ligency Team",R Programming: Advanced Analytics In R For Data Science,"Take Your R & R Studio Skills To The Next Level. Data Analytics, Data Science, Statistical Analysis in Business, GGPlot2",4.7,9053.0,Intermediate,53 lectures,6 total hours,Current price: $109.99
programming languages,https://www.udemy.com/course/big-data-programming-languages-big-data-vs-data-science/,https://img-c.udemycdn.com/course/240x135/3049106_004f_5.jpg,Lalitha Audikesavan,Big Data Programming Languages & Big Data Vs Data Science,"Big Data Programming Languages,Skills to become a Big Data Professional,Differences between Big Data &  Data Science",3.3,764.0,Beginner,6 lectures,,Current price: $19.99
programming languages,https://www.udemy.com/course/introduction-to-data-science/,https://img-c.udemycdn.com/course/240x135/405520_8da0_2.jpg,"Nina Zumel, John Mount",Introduction To Data Science,Use the R Programming Language to execute data science projects and become a data scientist.,4.1,255.0,Intermediate,28 lectures,6 total hours,Current price: $24.99
programming languages,https://www.udemy.com/course/r-programming-easy-as-abc-for-the-beginner-data-scientist/,https://img-c.udemycdn.com/course/240x135/3259980_5c51_4.jpg,Bayti Data,R Programming Easy As ABC: For The Beginner Data Scientist,"Learn Data Analytics, Data Manipulation and Data Visualization using R Programming, R Studio and ggplot2 Package",4.3,7.0,Beginner,58 lectures,4.5 total hours,Current price: $19.99
programming languages,https://www.udemy.com/course/data-visualization-with-r/,https://img-c.udemycdn.com/course/240x135/1467280_b74d_4.jpg,Arpan Gupta,R Programming for Data Analysis & Data Visualization,Developed  by Data Scientist / IITian  for Beginners . Complete Guide for Data Visualization & Data Analysis  in R,4.1,46.0,All Levels,32 lectures,4 total hours,Current price: $44.99
programming languages,https://www.udemy.com/course/r-for-absolute-beginners/,https://img-c.udemycdn.com/course/240x135/2700614_1e75_8.jpg,Ivo Bernardo,R Programming - R Language for Absolute Beginners,"R Programming course suitable for everyone, no coding experience or a statistics background needed",4.5,2996.0,Beginner,112 lectures,10.5 total hours,Current price: $84.99
programming languages,https://www.udemy.com/course/complete_python_programming_bootcamp_course_used_in_data_science/,https://img-c.udemycdn.com/course/240x135/3392516_b1be_11.jpg,Vincent Bongolan,Data Science Bootcamp with Computer Programming Language,Course to bridge the gap between Computer Science and Statistics. Programs that combines the two disciplines,5.0,1.0,,Expert,7 total hours,Current price: $19.99
programming languages,https://www.udemy.com/course/r-programming-for-data-science-practise-250-exercises-part1/,https://img-c.udemycdn.com/course/240x135/6159767_e750_2.jpg,Sheik Jamil Ahmed,R Programming for Data Science- Practise 250 Exercises-Part1,"Learn by Doing: Practical R Programming with Data Frames, ggplot2, and dplyr for Data Science using RStudio",4.7,32.0,All Levels,507 lectures,3 total hours,Current price: $59.99
programming languages,https://www.udemy.com/course/pandas-numpy-python-programming-language-libraries-a-ztm/,https://img-c.udemycdn.com/course/240x135/4935698_bba0.jpg,"Oak Academy, OAK Academy Team, Ali̇ CAVDAR",Pandas & NumPy Python Programming Language Libraries A-Z™,"NumPy & Python Pandas for Python Data Analysis, Data Science, Machine Learning, Deep Learning using Python from scratch",4.6,46.0,All Levels,87 lectures,10.5 total hours,Current price: $79.99
programming languages,https://www.udemy.com/course/pandas-python-programming-language-library-from-scratch-a-ztm/,https://img-c.udemycdn.com/course/240x135/4855912_d45e_7.jpg,"Oak Academy, OAK Academy Team, Ali̇ CAVDAR",Pandas Python Programming Language Library From Scratch A-Z™,"Pandas mainly used for Python Data Analysis. Learn Pandas for Data Science, Machine Learning, Deep Learning using Python",4.7,9.0,All Levels,54 lectures,7.5 total hours,Current price: $74.99
programming languages,https://www.udemy.com/course/introduction-to-the-cpp-programming-language/,https://img-c.udemycdn.com/course/240x135/6403041_85b1_19.jpg,Clear Programming,Introduction to the C++ Programming Language,Introduction to the C++ Programming Language and the C++ Standard Library,4.5,12.0,All Levels,83 lectures,7.5 total hours,Current price: $54.99
