skill,link,image_link,partner,title,course_description,rating,num_review,difficulty,num_lecture,duration,price
big data,https://www.udemy.com/course/pyspark-essentials-for-data-scientists-big-data-python/,https://img-c.udemycdn.com/course/240x135/2839728_a96b_4.jpg,Layla AI,PySpark Essentials for Data Scientists (Big Data + Python),Learn how to wrangle Big Data for Machine Learning using Python in PySpark taught by an industry expert!,4.4,820,All Levels,109 lectures,17.5 total hours,Current price: $54.99
big data,https://www.udemy.com/course/what-to-be-a-big-data-scientist/,https://img-c.udemycdn.com/course/240x135/1547582_6328_7.jpg,"V2 Maestros, LLC",Want to be a Big Data Scientist?,"Should you pursue a career in Data Science? Data Science basics, process, team, roles, skills, transition, opportunities",4.5,973,Beginner,13 lectures,1.5 total hours,Current price: $49.99
big data,https://www.udemy.com/course/big-data-engineering-bootcamp-with-gcp-and-azure-cloud/,https://img-c.udemycdn.com/course/240x135/6242299_e787.jpg,"Krish Naik, Mayank Aggarwal, KRISHAI Technologies Private Limited","Big Data Engineering Bootcamp with GCP, and Azure Cloud","Master Big Data with Hadoop, Spark, Kafka & Cloud | Build Real-World Projects & Scalable Data Pipelines from Scratch",4.7,357,All Levels,301 lectures,73.5 total hours,Current price: $44.99
big data,https://www.udemy.com/course/ai-master-class/,https://img-c.udemycdn.com/course/240x135/2918410_a5db_5.jpg,Rupak Bob Roy,Ai/Data Scientist - Python/R/Big Data Master Class,"includes Data Science, Machine Learning-R/Python, Big Data-Hive, Flume,Sqoop, Pig and more.(Beginners To Expert Level)",4.4,29,All Levels,250 lectures,19.5 total hours,Current price: $59.99
big data,https://www.udemy.com/course/data-architecture-for-data-scientists/,https://img-c.udemycdn.com/course/240x135/5295982_ca3c_3.jpg,Biju Krishnan,Data Architecture for Data Scientists,"Datawarehouse, Data Lake, Data Lakehouse, Data Mesh, Kafka, Lambda & Kappa architecture, Feature Store, Vector DB & more",4.6,849,Intermediate,37 lectures,2.5 total hours,Current price: $69.99
big data,https://www.udemy.com/course/top-data-scientist/,https://img-c.udemycdn.com/course/240x135/5961214_0e9b_3.jpg,Nancy Ticharwa (CEO Bethel Labs),The Top Data Scientist ™ BootCamp,Python | SQL | Machine Learning | Deep Learning | ChatGPT | Natural Language Processing | Computer Vision | 20+ Projects,4.3,43,All Levels,433 lectures,38 total hours,Current price: $49.99
big data,https://www.udemy.com/course/the-data-science-course-complete-data-science-bootcamp/,https://img-c.udemycdn.com/course/240x135/1754098_e0df_3.jpg,365 Careers,The Data Science Course: Complete Data Science Bootcamp 2025,"Complete Data Science Training: Math, Statistics, Python, Advanced Statistics in Python, Machine and Deep Learning",4.6,151551,All Levels,523 lectures,32 total hours,Current price: $124.99
big data,https://www.udemy.com/course/dp-100-azure-data-scientist-associate-complete-exam-guide/,https://img-c.udemycdn.com/course/240x135/4992188_0f74_2.jpg,Henry Habib,DP-100 Azure Data Scientist Associate Complete Exam Guide,"Complete DP-100 Azure Machine Learning training guide to prepare you for DP-100, with practice exams on DP 100 Azure ML",4.4,689,All Levels,97 lectures,8.5 total hours,Current price: $74.99
big data,https://www.udemy.com/course/become-a-data-scientist/,https://img-c.udemycdn.com/course/240x135/5254956_406a_3.jpg,Start-Tech Academy,"Become a Data Scientist: SQL, Tableau, ML & DL [4-in-1]","4-in-1 Bundle covering the 4 essential topics for a data scientist - SQL, Tableau, Machine & Deep Learning using Python",4.6,111,Beginner,338 lectures,37 total hours,Current price: $79.99
big data,https://www.udemy.com/course/taming-big-data-with-apache-spark-hands-on/,https://img-c.udemycdn.com/course/240x135/622414_03f5_4.jpg,"Sundog Education by Frank Kane, Frank Kane, Sundog Education Team",Taming Big Data with Apache Spark and Python - Hands On!,PySpark tutorial with 40+  hands-on examples of analyzing large data sets on your desktop or on Hadoop with Python!,4.5,16985,All Levels,77 lectures,9 total hours,Current price: $119.99
big data,https://www.udemy.com/course/ml-in-production/,https://img-c.udemycdn.com/course/240x135/5768286_9a96_2.jpg,"Andrew Wolf, Ilya Fursov",ML in Production: From Data Scientist to ML Engineer,Turn any ML model within Jupyter Notebook into a deployed production-ready microservice.,4.6,191,All Levels,23 lectures,5.5 total hours,Current price: $74.99
big data,https://www.udemy.com/course/data-lake-mastery-the-key-to-big-data-data-engineering/,https://img-c.udemycdn.com/course/240x135/5645008_67c0.jpg,Nikolai Schuler,Data Lake Mastery: The Key to Big Data & Data Engineering,"Data Lake Mastery using AWS: A Shortcut to Success in Big Data, Cloud Data Engineering and Data Architecture",4.6,401,All Levels,97 lectures,10 total hours,Current price: $84.99
big data,https://www.udemy.com/course/the-data-analyst-course-complete-data-analyst-bootcamp/,https://img-c.udemycdn.com/course/240x135/3570337_9b02_6.jpg,365 Careers,The Data Analyst Course: Complete Data Analyst Bootcamp,"Complete Data Analyst Training: Python, NumPy, Pandas, Data Collection, Preprocessing, Data Types, Data Visualization",4.5,21135,All Levels,282 lectures,21.5 total hours,Current price: $149.99
big data,https://www.udemy.com/course/big-data-for-managers/,https://img-c.udemycdn.com/course/240x135/1541066_55c9_3.jpg,Ganapathi Devappa,Big Data for Managers,A foundation course for big data that covers the big data tools for various stages of a big data project and now chatGPT,4.5,1552,Beginner,107 lectures,5 total hours,Current price: $69.99
big data,https://www.udemy.com/course/spark-and-python-for-big-data-with-pyspark/,https://img-c.udemycdn.com/course/240x135/980798_6081.jpg,"Jose Portilla, Pierian Training",Spark and Python for Big Data with PySpark,"Learn how to use Spark with Python, including Spark Streaming, Machine Learning, Spark 2.0 DataFrames and more!",4.5,25263,Intermediate,67 lectures,10.5 total hours,Current price: $174.99
big data,https://www.udemy.com/course/spark-nlp-for-data-scientists/,https://img-c.udemycdn.com/course/240x135/4790132_5802_4.jpg,"Ace Vo, David Talby, Jiri Dobes, Veysel Kocaman",Spark NLP for Data Scientists,"Unlock your NLP power with Spark NLP, the most popular NLP library in enterprises",4.6,61,Intermediate,78 lectures,12.5 total hours,Current price: $19.99
big data,https://www.udemy.com/course/ace-your-tech-interview-sql-for-data-scientists-engineers/,https://img-c.udemycdn.com/course/240x135/5806102_6b94_7.jpg,"Chandra Lingam, Compute with Cloud Support","SQL for Data Scientists, Data Engineers and Developers",Solve Real-World Problems with Interactive Coding Exercises and LeetCode challenges,4.8,17,Beginner,102 lectures,5 total hours,Current price: $79.99
big data,https://www.udemy.com/course/bigquery/,https://img-c.udemycdn.com/course/240x135/3563469_0dc3_3.jpg,J Garg - Real Time Learning,BigQuery for Big data engineers - Master Big Query Internals,"A Complete deep knowledge BigQuery guide for Data engineers and Analysts. Hands-On Bigquery via Console, CLI, Python lib",4.5,3207,All Levels,105 lectures,9 total hours,Current price: $84.99
big data,https://www.udemy.com/course/python-big-data-analytics-and-data-science/,https://img-c.udemycdn.com/course/240x135/3523010_aaad.jpg,Dr Amol Prakash Bhagat,Python: Big Data Analytics and Data Science,"Microsoft Azure HDInsight, MongoDB Atlas Cluster, IoT, Twitter API, Apache Hadoop",4.0,31,Beginner,8 lectures,10.5 total hours,Current price: $44.99
big data,https://www.udemy.com/course/the-ultimate-hands-on-hadoop-tame-your-big-data/,https://img-c.udemycdn.com/course/240x135/996228_af5f_3.jpg,"Sundog Education by Frank Kane, Frank Kane, Sundog Education Team",The Ultimate Hands-On Hadoop: Tame your Big Data!,"Data Engineering and Hadoop tutorial with MapReduce, HDFS, Spark, Flink, Hive, HBase, MongoDB, Cassandra, Kafka + more!",4.6,30658,All Levels,104 lectures,14.5 total hours,Current price: $139.99
