skill,link,image_link,partner,title,course_description,rating,num_review,difficulty,num_lecture,duration,price
big data,https://www.udemy.com/course/big-data-engineering-bootcamp-with-gcp-and-azure-cloud/,https://img-c.udemycdn.com/course/240x135/6242299_e787.jpg,"Krish Naik, Mayank Aggarwal, KRISHAI Technologies Private Limited","Big Data Engineering Bootcamp with GCP, and Azure Cloud","Master Big Data with Hadoop, Spark, Kafka & Cloud | Build Real-World Projects & Scalable Data Pipelines from Scratch",4.7,357,All Levels,301 lectures,73.5 total hours,Current price: $44.99
big data,https://www.udemy.com/course/software-architecture-design-of-modern-large-scale-systems/,https://img-c.udemycdn.com/course/240x135/3997622_0670_2.jpg,"Michael Pogrebinsky | Software Architecture, System Design, Java Expert, Top Developer Academy LLC",Software Architecture & Design of Modern Large Scale Systems,"Become a Software Architect or Technical Lead by Mastering Software Architecture, System Design & Big Data Processing.",4.7,11311,All Levels,45 lectures,7 total hours,Current price: $109.99
big data,https://www.udemy.com/course/data-lake-mastery-the-key-to-big-data-data-engineering/,https://img-c.udemycdn.com/course/240x135/5645008_67c0.jpg,Nikolai Schuler,Data Lake Mastery: The Key to Big Data & Data Engineering,"Data Lake Mastery using AWS: A Shortcut to Success in Big Data, Cloud Data Engineering and Data Architecture",4.6,401,All Levels,97 lectures,10 total hours,Current price: $84.99
big data,https://www.udemy.com/course/bigquery/,https://img-c.udemycdn.com/course/240x135/3563469_0dc3_3.jpg,J Garg - Real Time Learning,BigQuery for Big data engineers - Master Big Query Internals,"A Complete deep knowledge BigQuery guide for Data engineers and Analysts. Hands-On Bigquery via Console, CLI, Python lib",4.5,3207,All Levels,105 lectures,9 total hours,Current price: $84.99
big data,https://www.udemy.com/course/taming-big-data-with-apache-spark-hands-on/,https://img-c.udemycdn.com/course/240x135/622414_03f5_4.jpg,"Sundog Education by Frank Kane, Frank Kane, Sundog Education Team",Taming Big Data with Apache Spark and Python - Hands On!,PySpark tutorial with 40+  hands-on examples of analyzing large data sets on your desktop or on Hadoop with Python!,4.5,16985,All Levels,77 lectures,9 total hours,Current price: $119.99
big data,https://www.udemy.com/course/big-data-architecture/,https://img-c.udemycdn.com/course/240x135/5383042_36a6_2.jpg,Big Data Landscape,NIST Big Data Reference Architecture - High Level Overview,"Big Data architecture, Hadoop Ecosystem, Data Lake, DataWarehouse, Data Governance, MapReduce, Data Mesh, NIST",3.8,24,All Levels,44 lectures,2 total hours,Current price: $44.99
big data,https://www.udemy.com/course/the-ultimate-hands-on-hadoop-tame-your-big-data/,https://img-c.udemycdn.com/course/240x135/996228_af5f_3.jpg,"Sundog Education by Frank Kane, Frank Kane, Sundog Education Team",The Ultimate Hands-On Hadoop: Tame your Big Data!,"Data Engineering and Hadoop tutorial with MapReduce, HDFS, Spark, Flink, Hive, HBase, MongoDB, Cassandra, Kafka + more!",4.6,30658,All Levels,104 lectures,14.5 total hours,Current price: $139.99
big data,https://www.udemy.com/course/big-data-for-managers/,https://img-c.udemycdn.com/course/240x135/1541066_55c9_3.jpg,Ganapathi Devappa,Big Data for Managers,A foundation course for big data that covers the big data tools for various stages of a big data project and now chatGPT,4.5,1552,Beginner,107 lectures,5 total hours,Current price: $69.99
big data,https://www.udemy.com/course/data-architecture-for-data-engineers/,https://img-c.udemycdn.com/course/240x135/6268045_b022.jpg,Manas Jain,Data Architecture for Data Engineers: Practical Approaches,"Building Scalable, Efficient Data Solutions with Real-World Applications",4.5,119,All Levels,41 lectures,4 total hours,Current price: $69.99
big data,https://www.udemy.com/course/the-big-data-developer-course/,https://img-c.udemycdn.com/course/240x135/4870802_1653_5.jpg,Deesa Technologies,"Mastering Big Data: Spark, Scala, Kafka, Hadoop,Hive & More","Complete Hands-On Developer Guide to Modern Big Data Tools like Hadoop, Hive, Spark, Scala, Kafka, NIFI, HBase and more",4.4,140,All Levels,197 lectures,33.5 total hours,Current price: $64.99
big data,https://www.udemy.com/course/gcp-data-engineer-and-cloud-architect/,https://img-c.udemycdn.com/course/240x135/1299656_ad0c.jpg,Loony Corn,GCP: Complete Google Data Engineer and Cloud Architect Guide,"The Google Cloud for ML with TensorFlow, Big Data with Managed Hadoop",4.0,7359,All Levels,226 lectures,28 total hours,Current price: $89.99
big data,https://www.udemy.com/course/python-kafka-streaming-handson/,https://img-c.udemycdn.com/course/240x135/5282846_09b9_4.jpg,Big Data Landscape,Apache Kafka v3 for Big Data Streaming - Python Hands On,"Build End-to-End Real-Time Streaming Pipelines : Kafka, Flink, Elasticsearch, Kibana in Python - Big Data Architecture",3.8,44,All Levels,47 lectures,2.5 total hours,Current price: $54.99
big data,https://www.udemy.com/course/spark-and-python-for-big-data-with-pyspark/,https://img-c.udemycdn.com/course/240x135/980798_6081.jpg,"Jose Portilla, Pierian Training",Spark and Python for Big Data with PySpark,"Learn how to use Spark with Python, including Spark Streaming, Machine Learning, Spark 2.0 DataFrames and more!",4.5,25263,Intermediate,67 lectures,10.5 total hours,Current price: $174.99
big data,https://www.udemy.com/course/databricks-and-pyspark-for-big-data-from-zero-to-expert/,https://img-c.udemycdn.com/course/240x135/5006432_e257.jpg,Data Bootcamp,Databricks and PySpark for Big Data: From Zero to Expert,"Complete course to learn Databricks, including PySpark, Dataframes, Machine Learning, Advanced Analytics and Streaming",4.0,173,All Levels,94 lectures,5.5 total hours,Current price: $69.99
big data,https://www.udemy.com/course/google-cloud-professional-cloud-architect-certification/,https://img-c.udemycdn.com/course/240x135/3995372_4064.jpg,"in28Minutes Official, Ranga Karanam | GCP Certification - Google Cloud Engineer & Architect",GCP Professional Cloud Architect: Google Cloud Certification,Become a GCP Cloud Architect. Architect Google Cloud Platform (GCP) Solutions. Includes 4 New Case Studies.,4.6,12379,All Levels,337 lectures,21 total hours,Current price: $119.99
big data,https://www.udemy.com/course/salesforce-certified-data-architect-course/,https://img-c.udemycdn.com/course/240x135/4480780_cb46_2.jpg,Walid El Horr,Salesforce Data Architect Course,"Get your Salesforce Data Architect certification with this course, aligned with the Spring 23 exam guide objectives",4.5,435,Intermediate,68 lectures,10 total hours,Current price: $59.99
big data,https://www.udemy.com/course/cloud-out-loud/,https://img-c.udemycdn.com/course/240x135/4797694_a198_4.jpg,Michelle Sollicito,Cloud Out Loud - Multi-Cloud with AI/ML and Big Data,"AWS, Azure and GCP - Including AI/ML and Big Data - To Professional Architect Level",4.8,25,,Expert,25.5 total hours,Current price: $39.99
big data,https://www.udemy.com/course/every-data-architecture-is-the-same/,https://img-c.udemycdn.com/course/240x135/4868550_83f2.jpg,Erik Tromp,Every (big) data architecture is the same,One data architecture blueprint to rule them all.,4.4,211,Intermediate,17 lectures,4 total hours,Current price: $69.99
big data,https://www.udemy.com/course/pyspark-aws-master-big-data-with-pyspark-and-aws/,https://img-c.udemycdn.com/course/240x135/4076436_dcfc_4.jpg,"AI Sciences, AI Sciences Team",PySpark & AWS: Master Big Data With PySpark and AWS,"Mastering AWS & PySpark: Spark, PySpark, AWS, Spark Ecosystem, Hadoop, and Spark Applications [AWS, Hadoop, Pyspark]",4.3,2454,All Levels,190 lectures,18.5 total hours,Current price: $79.99
big data,https://www.udemy.com/course/data-architecture-for-data-scientists/,https://img-c.udemycdn.com/course/240x135/5295982_ca3c_3.jpg,Biju Krishnan,Data Architecture for Data Scientists,"Datawarehouse, Data Lake, Data Lakehouse, Data Mesh, Kafka, Lambda & Kappa architecture, Feature Store, Vector DB & more",4.6,849,Intermediate,37 lectures,2.5 total hours,Current price: $69.99
