skill,link,image_link,partner,title,course_description,rating,num_review,difficulty,num_lecture,duration,price
powershell,https://www.udemy.com/course/powershell-for-systems-engineers/,https://img-c.udemycdn.com/course/240x135/5278568_6463_2.jpg,Jim Tyler,PowerShell for Systems Engineers,Leveraging Automation and ChatGPT to Solve Business Problems,4.6,44,All Levels,91 lectures,6.5 total hours,Current price: $19.99
powershell,https://www.udemy.com/course/powershell-from-beginner-to-sheller-and-scripter/,https://img-c.udemycdn.com/course/240x135/979510_95e0.jpg,David Fitzpatrick,PowerShell  from Beginner To Sheller And Scripter,Learn how to use PowerShell the easy way,4.7,2174,Beginner,115 lectures,11.5 total hours,Current price: $99.99
powershell,https://www.udemy.com/course/master-windows-powershell/,https://img-c.udemycdn.com/course/240x135/6180477_0476_2.jpg,Nerd Academy ⭑,"PowerShell Mastery: Script, Automate & Succeed + 75 Projects",★ 20+ Hours Of Content  ★ 75 Hands-On Exercises – Master PowerShell 5.1 / 7 - Including Advanced Scripting / Automation,4.7,118,All Levels,150 lectures,20.5 total hours,Current price: $84.99
powershell,https://www.udemy.com/course/decodingdevops/,https://img-c.udemycdn.com/course/240x135/4039556_ebb3_9.jpg,Imran Teli,DevOps Beginners to Advanced with Projects,"Begin Your DevOps Career As a Newbie | AWS, Linux, Scripting, Jenkins, Ansible, GitOps, Docker, Kubernetes, & Terraform.",4.6,36463,All Levels,318 lectures,53 total hours,Current price: $119.99
powershell,https://www.udemy.com/course/linux-for-cloud-engineers-a-complete-project-based-learning/,https://img-c.udemycdn.com/course/240x135/5403140_ce56_12.jpg,Pravin Mishra | AWS Certified Cloud Practitioner | Solutions Architect,"Linux for DevOps, Cloud, and SRE Engineers","Master Linux fundamentals, shell scripting, process management & networking for DevOps, Cloud, and SRE Engineers",4.4,401,Beginner,26 lectures,5.5 total hours,Current price: $59.99
powershell,https://www.udemy.com/course/aws-certified-devops-engineer-professional-hands-on/,https://img-c.udemycdn.com/course/240x135/2533568_2828_6.jpg,"Stephane Maarek | AWS Certified Cloud Practitioner,Solutions Architect,Developer",AWS Certified DevOps Engineer Professional 2025 - DOP-C02,Pass the AWS Certified DevOps Engineer Professional Certification (DOP-C02) with 20 hours of advanced videos.,4.7,18041,Intermediate,248 lectures,17 total hours,
powershell,https://www.udemy.com/course/powershell-stairway-to-automation/,https://img-c.udemycdn.com/course/240x135/3115680_eff8_11.jpg,Powershell Academy,Powershell Essential Training on Automation and Scripting,Learn powershell from scratch and become a geek in powershell Automation and Powershell scripting. FREE TOOL DOWNLOAD,4.7,758,Intermediate,57 lectures,7 total hours,
powershell,https://www.udemy.com/course/azure-powershell/,https://img-c.udemycdn.com/course/240x135/4574150_4af3.jpg,Alan Rodrigues,Mastering Azure PowerShell,Using Azure PowerShell to work with Azure-based resources,4.6,802,All Levels,136 lectures,20 total hours,Current price: $84.99
powershell,https://www.udemy.com/course/administration-and-automation-with-windows-powershell/,https://img-c.udemycdn.com/course/240x135/3469910_c44b_2.jpg,Intellezy Trainers,Administration and Automation with Windows PowerShell,Learn the fundamental knowledge and skills to use Windows PowerShell.,4.7,1644,Intermediate,101 lectures,10.5 total hours,Current price: $84.99
powershell,https://www.udemy.com/course/devops-with-docker-kubernetes-and-azure-devops/,https://img-c.udemycdn.com/course/240x135/2813427_cc60_2.jpg,"in28Minutes Official, Ravi S | DevOps Expert - Docker & Kubernetes, Open Cloud Solutions | Microsoft Azure Certification - AZ 900, Ranga Karanam | GCP Certification - Google Cloud Engineer & Architect","Learn DevOps: Docker, Kubernetes, Terraform and Azure DevOps","DevOps for Absolute Beginners: Azure DevOps, Docker, Kubernetes, Jenkins, Terraform, Ansible - AWS, Azure & Google Cloud",4.5,15966,All Levels,235 lectures,21.5 total hours,
powershell,https://www.udemy.com/course/valaxy-linux/,https://img-c.udemycdn.com/course/240x135/3184362_4102_12.jpg,AR Shankar | Valaxy Technologies,Linux for Cloud & DevOps Engineers,"Linux basics about files, directories, installations, networking, system configuration, user management etc...",4.5,3918,Beginner,43 lectures,4.5 total hours,
powershell,https://www.udemy.com/course/gcp-google-cloud-professional-devops-engineer-certification/,https://img-c.udemycdn.com/course/240x135/4133780_4390_9.jpg,"Ankit Mistry : 150,000+ Students, GCP Certification - Google Cloud Academy | Associate Cloud & Professional Engineer Certifications",GCP Google Cloud Professional DevOps Engineer Certification,Pass Google Cloud Professional DevOps Certification with 12+ Hours of HD quality video and 70+ Hands-on Practical labs,4.2,2106,All Levels,112 lectures,13.5 total hours,Current price: $79.99
powershell,https://www.udemy.com/course/the-complete-devops-bootcamp/,https://img-c.udemycdn.com/course/240x135/4347106_9cfa.jpg,"Mumshad Mannambeth, KodeKloud Training",The Ultimate DevOps Bootcamp,The ultimate DevOps Bootcamp course for all your DevOps learning,4.6,6636,Beginner,281 lectures,17.5 total hours,Current price: $99.99
powershell,https://www.udemy.com/course/master-microsoft-powershell/,https://img-c.udemycdn.com/course/240x135/915782_5dda.jpg,Tom Meservy,Master Microsoft PowerShell,Unleash the Power of PowerShell. Amazing skills for anyone that deals with IT.,4.5,16440,Beginner,31 lectures,2 total hours,Current price: $79.99
powershell,https://www.udemy.com/course/windows-powershell-training/,https://img-c.udemycdn.com/course/240x135/1768672_4063_2.jpg,"Paul Hill, Robert Hill",Introduction to Windows PowerShell 5.1,"Install PowerShell 5.1, Understand PowerShell Syntax, Setup a PowerShell IT lab, Manage Active Directory with Powershell",4.5,10869,All Levels,123 lectures,11 total hours,
powershell,https://www.udemy.com/course/aws-certified-devops-engineer-professional-practice-exams-amazon-dop-c02/,https://img-c.udemycdn.com/course/240x135/2644002_eff2_6.jpg,"Jon Bonso AWS Certified Cloud Practitioner, Developer, Solutions Architect, Tutorials Dojo | AWS Certified Cloud Practitioner, AWS Certified Solutions Architect, AWS Certified Developer, Amiel Palacol AWS Certified Solutions Architect, DevOps Engineer Professional",AWS Certified DevOps Engineer Professional Practice Exams,Be an AWS DevOps Engineer! AWS Certified DevOps Engineer Professional Practice Tests that covers all DOP-C02 topics!,4.5,1285,Intermediate,150 questions,,
powershell,https://www.udemy.com/course/powershell-advanced/,https://img-c.udemycdn.com/course/240x135/3346756_531f.jpg,David Fitzpatrick,PowerShell Advanced,PowerShell from Basic Scripter to Advanced Scripter,4.6,197,Intermediate,82 lectures,8 total hours,
powershell,https://www.udemy.com/course/aws-certified-devops-engineer-professional-practice-exam-dop/,https://img-c.udemycdn.com/course/240x135/2567118_611e_8.jpg,"Stephane Maarek | AWS Certified Cloud Practitioner,Solutions Architect,Developer, Abhishek Singh",Practice Exams | AWS Certified DevOps Engineer Professional,AWS Certified DevOps: 120 high fidelity questions: AWS Certified DevOps Engineer Professional DOP-C02.,4.4,2568,All Levels,120 questions,,
powershell,https://www.udemy.com/course/learning-path-powershell-the-road-to-powershell-dsc/,https://img-c.udemycdn.com/course/240x135/1592636_0b9f_2.jpg,Packt Publishing,Learning Path: PowerShell: The Road to PowerShell DSC,Master DevOps with PowerShell DSC using real-world examples.,3.9,137,Beginner,33 lectures,4.5 total hours,
powershell,https://www.udemy.com/course/devops-training/,https://img-c.udemycdn.com/course/240x135/1464166_c16e_33.jpg,TechLink Selenium | DevOps | GenAI,DevOps MasterClass: Terraform Kubernetes Ansible Docker,"DevOps with Jenkins Terraform GIT Docker Maven Kubernetes Ansible Automation Docker Swarm, DevOps Real world Exercises",4.5,6619,All Levels,548 lectures,76.5 total hours,
