skill,link,image_link,partner,title,course_description,rating,num_review,difficulty,num_lecture,duration,price
cisco ios,https://www.udemy.com/course/aws-certified-devops-engineer-professional-practice-exam-dop/,https://img-c.udemycdn.com/course/240x135/2567118_611e_8.jpg,"Stephane Maarek | AWS Certified Cloud Practitioner,Solutions Architect,Developer, Abhishek Singh",Practice Exams | AWS Certified DevOps Engineer Professional,AWS Certified DevOps: 120 high fidelity questions: AWS Certified DevOps Engineer Professional DOP-C02.,4.4,2568,All Levels,120 questions,,Current price: $59.99
cisco ios,https://www.udemy.com/course/aws-certified-devops-engineer-professional-hands-on/,https://img-c.udemycdn.com/course/240x135/2533568_2828_6.jpg,"Stephane Maarek | AWS Certified Cloud Practitioner,Solutions Architect,Developer",AWS Certified DevOps Engineer Professional 2025 - DOP-C02,Pass the AWS Certified DevOps Engineer Professional Certification (DOP-C02) with 20 hours of advanced videos.,4.7,18041,Intermediate,248 lectures,17 total hours,Current price: $149.99
cisco ios,https://www.udemy.com/course/gcp-google-cloud-professional-devops-engineer-certification/,https://img-c.udemycdn.com/course/240x135/4133780_4390_9.jpg,"Ankit Mistry : 150,000+ Students, GCP Certification - Google Cloud Academy | Associate Cloud & Professional Engineer Certifications",GCP Google Cloud Professional DevOps Engineer Certification,Pass Google Cloud Professional DevOps Certification with 12+ Hours of HD quality video and 70+ Hands-on Practical labs,4.2,2106,All Levels,112 lectures,13.5 total hours,Current price: $79.99
cisco ios,https://www.udemy.com/course/ios-13-app-development-bootcamp/,https://img-c.udemycdn.com/course/240x135/1778502_f4b9_12.jpg,"Dr. Angela Yu, Developer and Lead Instructor",iOS & Swift - The Complete iOS App Development Bootcamp,From Beginner to iOS App Developer with Just One Course! Fully Updated with a Comprehensive Module Dedicated to SwiftUI!,4.6,93955,All Levels,542 lectures,60.5 total hours,Current price: $159.99
cisco ios,https://www.udemy.com/course/complete-ansible-for-network-engineers-ios-junos-arista/,https://img-c.udemycdn.com/course/240x135/3114242_af9f_3.jpg,Shahzad Qadir,"Ansible for Network Engineers - Cisco IOS, Junos, Arista","A course to make you an expert in Network automation using Ansible: covers Cisco IOS, Juniper, and Arista devices.",4.3,68,All Levels,31 lectures,4.5 total hours,Current price: $54.99
cisco ios,https://www.udemy.com/course/decodingdevops/,https://img-c.udemycdn.com/course/240x135/4039556_ebb3_9.jpg,Imran Teli,DevOps Beginners to Advanced with Projects,"Begin Your DevOps Career As a Newbie | AWS, Linux, Scripting, Jenkins, Ansible, GitOps, Docker, Kubernetes, & Terraform.",4.6,36463,All Levels,318 lectures,53 total hours,Current price: $119.99
cisco ios,https://www.udemy.com/course/the-complete-devops-bootcamp/,https://img-c.udemycdn.com/course/240x135/4347106_9cfa.jpg,"Mumshad Mannambeth, KodeKloud Training",The Ultimate DevOps Bootcamp,The ultimate DevOps Bootcamp course for all your DevOps learning,4.6,6636,Beginner,281 lectures,17.5 total hours,Current price: $99.99
cisco ios,https://www.udemy.com/course/devops-with-docker-kubernetes-and-azure-devops/,https://img-c.udemycdn.com/course/240x135/2813427_cc60_2.jpg,"in28Minutes Official, Ravi S | DevOps Expert - Docker & Kubernetes, Open Cloud Solutions | Microsoft Azure Certification - AZ 900, Ranga Karanam | GCP Certification - Google Cloud Engineer & Architect","Learn DevOps: Docker, Kubernetes, Terraform and Azure DevOps","DevOps for Absolute Beginners: Azure DevOps, Docker, Kubernetes, Jenkins, Terraform, Ansible - AWS, Azure & Google Cloud",4.5,15966,All Levels,235 lectures,21.5 total hours,Current price: $139.99
cisco ios,https://www.udemy.com/course/cisco-certified-devnet-associate-course-netdevops/,https://img-c.udemycdn.com/course/240x135/4042720_c514_2.jpg,Francis Kagai,Cisco Certified DevNet Associate Course - Part 1 - NetDevOPs,Cisco Certified DevNet Associate Course - Part 1: Developing Applications and Automating Workflows using Cisco Platforms,4.1,92,Beginner,124 lectures,10 total hours,Current price: $59.99
cisco ios,https://www.udemy.com/course/cisco-ios-xr-zero-to-hero-course/,https://img-c.udemycdn.com/course/240x135/4609698_874d_2.jpg,Network-Fi .,Cisco IOS-XR Zero to Hero Course,Cisco IOS-XR Networking Course,4.6,167,All Levels,82 lectures,8 total hours,Current price: $64.99
cisco ios,https://www.udemy.com/course/devops-training/,https://img-c.udemycdn.com/course/240x135/1464166_c16e_33.jpg,TechLink Selenium | DevOps | GenAI,DevOps MasterClass: Terraform Kubernetes Ansible Docker,"DevOps with Jenkins Terraform GIT Docker Maven Kubernetes Ansible Automation Docker Swarm, DevOps Real world Exercises",4.5,6619,All Levels,548 lectures,76.5 total hours,Current price: $139.99
cisco ios,https://www.udemy.com/course/ultimate-devops-project-with-resume-preparation/,https://img-c.udemycdn.com/course/240x135/6416543_f441_4.jpg,Abhishek Veeramalla,Ultimate DevOps Project Implementation,End to End DevOps Implementation on an E-Commerce project with Resume preparation and Interview Q&A,4.8,1993,Beginner,76 lectures,12 total hours,Current price: $44.99
cisco ios,https://www.udemy.com/course/devopsprojects/,https://img-c.udemycdn.com/course/240x135/3710504_9b6d_9.jpg,Imran Teli,DevOps Projects | Real Time DevOps & GitOps Projects,Master Your DevOps Skills with Real challenge,4.7,3409,Intermediate,218 lectures,33.5 total hours,Current price: $89.99
cisco ios,https://www.udemy.com/course/ios-15-app-development-with-swiftui-3-and-swift-5/,https://img-c.udemycdn.com/course/240x135/4458256_9899_9.jpg,Kenneth Jones,"iOS 18, SwiftUI 6, & Swift 6: Build iOS Apps From Scratch","Learn iOS development with SwiftUI 6 and Swift 6; build complete iOS 18 apps from scratch; visionOS, macOS, watchOS",4.6,1694,All Levels,126 lectures,30 total hours,Current price: $79.99
cisco ios,https://www.udemy.com/course/new-cisco-ise-3x-training-with-labs-8021x-mab-aaa-cisco-ise-v3x/,https://img-c.udemycdn.com/course/240x135/6362969_a75e.jpg,Zach Dyke,New Cisco ISE 3.X Training With Labs 802.1x MAB AAA ISE v3.x,New Cisco ISE 3.X Training With Labs Cisco Identity Services Engine v3.x Labs 802.1x MAB AAA ISE,4.8,32,All Levels,23 lectures,2 total hours,Current price: $69.99
cisco ios,https://www.udemy.com/course/valaxy-linux/,https://img-c.udemycdn.com/course/240x135/3184362_4102_12.jpg,AR Shankar | Valaxy Technologies,Linux for Cloud & DevOps Engineers,"Linux basics about files, directories, installations, networking, system configuration, user management etc...",4.5,3918,Beginner,43 lectures,4.5 total hours,Current price: $74.99
cisco ios,https://www.udemy.com/course/cisco-ccna-rs-200-125-ios-administration-labs/,https://img-c.udemycdn.com/course/240x135/1239096_61b4_2.jpg,Keith Gebhardt,NEW Cisco CCNA (200-301) - iOS Administration Labs,NEW Cisco CCNA (200-301) iOS Administration and Protocols,4.8,86,All Levels,25 lectures,5 total hours,Current price: $49.99
cisco ios,https://www.udemy.com/course/ccna-complete/,https://img-c.udemycdn.com/course/240x135/1203374_6d6f_3.jpg,Neil Anderson,Cisco CCNA 200-301 – The Complete Guide to Getting Certified,"The top rated CCNA course online with comprehensive videos, lab exercises, study notes, Anki flashcards and active Q&A",4.8,75610,Beginner,326 lectures,42.5 total hours,Current price: $124.99
cisco ios,https://www.udemy.com/course/tcp-protocol-deep-dive-concise-guide-for-network-engineers/,https://img-c.udemycdn.com/course/240x135/5503650_1c2b_4.jpg,Shaun Hummel,Mastering TCP/IP For Network Engineers and DevOps,"The Essential Guide to Understanding TCP/IP Protocols - Network Engineers, DevOps, CCNA, CCNP, Cyber Security",4.4,17,All Levels,32 lectures,3 total hours,Current price: $19.99
cisco ios,https://www.udemy.com/course/cisco-bgp-masterclass/,https://img-c.udemycdn.com/course/240x135/4805092_a2f8_2.jpg,Neil Anderson,Cisco BGP Masterclass for Enterprise Network Engineers,Become a BGP expert with full hands-on lab exercises included.,4.7,851,Intermediate,57 lectures,16.5 total hours,Current price: $84.99
