skill,link,image_link,partner,title,course_description,rating,num_review,difficulty,num_lecture,duration,price
c programming,https://www.udemy.com/course/c-programming-for-beginners-/,https://img-c.udemycdn.com/course/240x135/1467808_f8c0.jpg,"Tim Buchalka's Learn Programming Academy, Jason Fedin",C Programming For Beginners - Master the C Language,C Programming will increase career options.  Become a better dev in other languages by learning C.   Pointers explained,4.4,37980.0,All Levels,150 lectures,25.5 total hours,Current price: $119.99
c programming,https://www.udemy.com/course/advanced-c-programming-course/,https://img-c.udemycdn.com/course/240x135/2800976_98e5.jpg,"Tim Buchalka's Learn Programming Academy, Jason Fedin",Advanced C Programming Course,Become a True Master of the C Programming Language - Confidently Apply for Real Time or Embedded C Jobs or contracts!,4.4,5100.0,Intermediate,175 lectures,29 total hours,Current price: $89.99
c programming,https://www.udemy.com/course/c-programming-for-beginners-programming-in-c/,https://img-c.udemycdn.com/course/240x135/3173974_b870_4.jpg,Vlad Budnitski,C Programming Bootcamp - The Complete C Language Course,C Programming 2025: Master the Fundamentals of C Programming Language. Join the Comprehensive C Bootcamp Masterclass!,4.5,8880.0,All Levels,396 lectures,44 total hours,Current price: $84.99
c programming,https://www.udemy.com/course/beginning-c-plus-plus-programming/,https://img-c.udemycdn.com/course/240x135/1576854_9aeb_2.jpg,"Tim Buchalka's Learn Programming Academy, Dr. Frank Mitropoulos",Beginning C++ Programming - From Beginner to Beyond,Obtain Modern C++ Object-Oriented Programming (OOP) and STL skills. C++14 and C++17 covered.  C++20 info see below.,4.6,75423.0,All Levels,305 lectures,46 total hours,Current price: $129.99
c programming,https://www.udemy.com/course/c-programming-for-beginners-master-the-c-language-b/,https://img-c.udemycdn.com/course/240x135/6029272_2dbb_2.jpg,GeeksforGeeks (GfG),C Programming For Beginners - Master the C Language,"C Programming 2024: Master the C Language from basics to advanced including operators, loops, arrays, function and more",4.4,135.0,Beginner,313 lectures,37 total hours,Current price: $69.99
c programming,https://www.udemy.com/course/c-programming-pointers-from-zero-to-hero/,https://img-c.udemycdn.com/course/240x135/3408682_3d93_3.jpg,Vlad Budnitski,C Programming Masterclass: Pointers & Advanced C Language,"C Programming Advanced Topics: Pointers, Memory, Low-Level C Language and Embedded C Preparation",4.5,1317.0,Intermediate,251 lectures,41 total hours,Current price: $84.99
c programming,https://www.udemy.com/course/c-programming-for-engineers/,https://img-c.udemycdn.com/course/240x135/5500284_58c9_4.jpg,MESA Academy,C Programming For Engineers,Learn C Programming Language Like Learning Alphabets. Learn All the Fundamentals of C in Simplest Way,,,Beginner,94 lectures,13.5 total hours,Current price: $19.99
c programming,https://www.udemy.com/course/the-complete-c-programming-bootcamp/,https://img-c.udemycdn.com/course/240x135/3992134_20ab.jpg,"Byte Garage, Byte Garage Instructors",The Complete C Programming Bootcamp,"Master C programming in Visual Studio Code. Learn pointers, macro and low level data manipulation. Embedded ready.",4.5,1619.0,All Levels,160 lectures,25 total hours,Current price: $74.99
c programming,https://www.udemy.com/course/microcontroller-embedded-c-programming/,https://img-c.udemycdn.com/course/240x135/2068149_a63b_9.jpg,"FastBit Embedded Brain Academy, Kiran Nayak",Microcontroller Embedded C Programming: Absolute Beginners,Foundation course on Embedded C programming  using STM32 Microcontroller.,4.5,13587.0,Beginner,193 lectures,16.5 total hours,Current price: $94.99
c programming,https://www.udemy.com/course/learn-c-programming-beginners-to-expert/,https://img-c.udemycdn.com/course/240x135/3305896_8d18.jpg,Programming Knowledge,Learn C Programming  (Beginners to Expert ),If you’re ready to buckle down and learn C Programming here’s where you should start.,4.4,234.0,Beginner,30 lectures,6 total hours,Current price: $44.99
c programming,https://www.udemy.com/course/advanced-c-coding-in-linux/,https://img-c.udemycdn.com/course/240x135/5286890_35b9_4.jpg,"dr Jonas Birch, C programming ninja",The Beginner's guide to Advanced C programming for Linux,"Learn C, improve your CV & stand out from the crowd when applying for developer positions. Become a better Linux admin.",4.7,57.0,All Levels,37 lectures,12 total hours,Current price: $59.99
c programming,https://www.udemy.com/course/the-modern-cpp-20-masterclass/,https://img-c.udemycdn.com/course/240x135/2987082_04e6_10.jpg,Daniel Gakwaya,The C++20 Masterclass :  From Fundamentals to Advanced,"Learn and Master Modern C++ From Beginning to Advanced in Plain English :  C++11, C++14, C++17, C++20 and More!",4.5,4978.0,All Levels,585 lectures,115 total hours,Current price: $84.99
c programming,https://www.udemy.com/course/advanced-c-programming-z/,https://img-c.udemycdn.com/course/240x135/4101550_7db1_2.jpg,Ahmed Adel,Advanced C Programming,C Programming for C Programmers,4.4,94.0,,Expert,8 total hours,Current price: $49.99
c programming,https://www.udemy.com/course/problem-solving-and-program-design-in-c-language/,https://img-c.udemycdn.com/course/240x135/4578590_57c8.jpg,Afterclap Academy,C Programming and Problem Solving in C.,C language is fruit of the computer. This course helps you to collect your fruits for any career opportunities.,4.5,34.0,All Levels,83 lectures,17 total hours,Current price: $69.99
c programming,https://www.udemy.com/course/c-programming-bootcamp-for-beginners/,https://img-c.udemycdn.com/course/240x135/5082092_040e_7.jpg,Toppers Bootcamp,2025 C Programming Bootcamp - The Complete C Language Course,C Programming 2025: Master the Fundamentals of C Programming Language. Join the Comprehensive C Bootcamp Masterclass!,4.4,642.0,All Levels,84 lectures,12 total hours,Current price: $74.99
c programming,https://www.udemy.com/course/comprehensive-c-programming-course/,https://img-c.udemycdn.com/course/240x135/6076779_58a3_2.jpg,EDUCBA Bridging the Gap,Comprehensive C Programming Course,Master C programming and build real-world applications with our Comprehensive C Programming Course!,4.6,2.0,All Levels,196 lectures,27.5 total hours,Current price: $19.99
c programming,https://www.udemy.com/course/decodingdevops/,https://img-c.udemycdn.com/course/240x135/4039556_ebb3_9.jpg,Imran Teli,DevOps Beginners to Advanced with Projects,"Begin Your DevOps Career As a Newbie | AWS, Linux, Scripting, Jenkins, Ansible, GitOps, Docker, Kubernetes, & Terraform.",4.6,36463.0,All Levels,318 lectures,53 total hours,Current price: $119.99
c programming,https://www.udemy.com/course/c-programming-for-beginner/,https://img-c.udemycdn.com/course/240x135/4447504_1490_2.jpg,"Educational Engineering Team, Educational Engineering, Ashraf Said AlMadhoun",C Programming: Master C with this Step by Step,Go from zero to hero in programming with C Language and start your Journey as a highly paid  C Developer/Programmer,3.5,12.0,All Levels,136 lectures,7.5 total hours,Current price: $54.99
c programming,https://www.udemy.com/course/advanced-c-programming-linux/,https://img-c.udemycdn.com/course/240x135/4048692_46d1.jpg,Mohan M,Advanced C Programming in Linux Environment,Advanced  C Programming -  Linux systems C Programming -  C Programming interview preparation.,3.8,4.0,Intermediate,78 lectures,6.5 total hours,Current price: $19.99
c programming,https://www.udemy.com/course/cpp23-fundamentals-projects-algorithms/,https://img-c.udemycdn.com/course/240x135/6397539_9f8b_3.jpg,Daniel Gakwaya,C++23 Fundamentals with Projects & Algorithms,"Go beyond the basics—build, debug, and optimize modern C++23 projects with pro tools like CMake and vcpkg.",4.8,17.0,Beginner,103 lectures,60.5 total hours,Current price: $54.99
