skill,link,image_link,partner,title,course_description,rating,num_review,difficulty,num_lecture,duration,price
github,https://www.udemy.com/course/valaxy-git/,https://img-c.udemycdn.com/course/240x135/3184348_e5db_5.jpg,AR Shankar | Valaxy Technologies,Git and GitHub for DevOps Engineers,DevOps Engineer Roles on Git and GitHub from Creating a Repository to Releasing Code onto Production Environment,4.6,1521,All Levels,54 lectures,6.5 total hours,Current price: $74.99
github,https://www.udemy.com/course/github-actions-the-complete-guide/,https://img-c.udemycdn.com/course/240x135/4900166_73e5.jpg,"Academind by Maximilian Schwarzmüller, Maximilian Schwarzmüller",GitHub Actions - The Complete Guide,Learn how to build automated CI / CD workflows with GitHub's DevOps service.,4.7,7599,Beginner,143 lectures,10.5 total hours,Current price: $99.99
github,https://www.udemy.com/course/mastering-github-copilot-for-devops-and-devsecops-engineers/,https://img-c.udemycdn.com/course/240x135/6432739_7621.jpg,Raghu The Security Expert,Mastering GitHub Copilot for DevOps and DevSecOps Engineers,"Boost DevOps & DevSecOps with GitHub Copilot: AI-Powered Coding, CI/CD, and Real life End to End Case Study",4.2,17,All Levels,24 lectures,2.5 total hours,Current price: $54.99
github,https://www.udemy.com/course/git-and-github-bootcamp/,https://img-c.udemycdn.com/course/240x135/3792262_6b0c_2.jpg,Colt Steele,The Git & Github Bootcamp,"Master the essentials and the tricky bits: rebasing, squashing, stashing, reflogs, blobs, trees, & more!",4.8,35908,Beginner,189 lectures,17 total hours,Current price: $94.99
github,https://www.udemy.com/course/ci-cd-using-github-actions-made-easy/,https://img-c.udemycdn.com/course/240x135/4998034_7c43_7.jpg,DevOps Hint,CI CD using GitHub Actions-Made Easy | GitHub Actions CI/CD,"GitHub Actions Tutorial for Beginners, Developers and DevOps Engineers",4.0,10,Intermediate,41 lectures,14 total hours,Current price: $74.99
github,https://www.udemy.com/course/aws-certified-devops-engineer-professional-hands-on/,https://img-c.udemycdn.com/course/240x135/2533568_2828_6.jpg,"Stephane Maarek | AWS Certified Cloud Practitioner,Solutions Architect,Developer",AWS Certified DevOps Engineer Professional 2025 - DOP-C02,Pass the AWS Certified DevOps Engineer Professional Certification (DOP-C02) with 20 hours of advanced videos.,4.7,18041,Intermediate,248 lectures,17 total hours,Current price: $149.99
github,https://www.udemy.com/course/learn-github-actions-ci-cd-devops-pipelines/,https://img-c.udemycdn.com/course/240x135/4640376_2e3b.jpg,Houssem Dellai,Learn Github Actions for CI/CD DevOps Pipelines,"Learn how to create DevOps CI/CD pipelines for web, database, container and cloud apps with Github Actions",4.5,541,Beginner,30 lectures,4 total hours,Current price: $54.99
github,https://www.udemy.com/course/decodingdevops/,https://img-c.udemycdn.com/course/240x135/4039556_ebb3_9.jpg,Imran Teli,DevOps Beginners to Advanced with Projects,"Begin Your DevOps Career As a Newbie | AWS, Linux, Scripting, Jenkins, Ansible, GitOps, Docker, Kubernetes, & Terraform.",4.6,36463,All Levels,318 lectures,53 total hours,Current price: $119.99
github,https://www.udemy.com/course/gcp-google-cloud-professional-devops-engineer-certification/,https://img-c.udemycdn.com/course/240x135/4133780_4390_9.jpg,"Ankit Mistry : 150,000+ Students, GCP Certification - Google Cloud Academy | Associate Cloud & Professional Engineer Certifications",GCP Google Cloud Professional DevOps Engineer Certification,Pass Google Cloud Professional DevOps Certification with 12+ Hours of HD quality video and 70+ Hands-on Practical labs,4.2,2106,All Levels,112 lectures,13.5 total hours,Current price: $79.99
github,https://www.udemy.com/course/aws-certified-devops-engineer-professional-practice-exams-amazon-dop-c02/,https://img-c.udemycdn.com/course/240x135/2644002_eff2_6.jpg,"Jon Bonso AWS Certified Cloud Practitioner, Developer, Solutions Architect, Tutorials Dojo | AWS Certified Cloud Practitioner, AWS Certified Solutions Architect, AWS Certified Developer, Amiel Palacol AWS Certified Solutions Architect, DevOps Engineer Professional",AWS Certified DevOps Engineer Professional Practice Exams,Be an AWS DevOps Engineer! AWS Certified DevOps Engineer Professional Practice Tests that covers all DOP-C02 topics!,4.5,1285,Intermediate,150 questions,,Current price: $59.99
github,https://www.udemy.com/course/aws-certified-devops-engineer-professional-practice-exam-dop/,https://img-c.udemycdn.com/course/240x135/2567118_611e_8.jpg,"Stephane Maarek | AWS Certified Cloud Practitioner,Solutions Architect,Developer, Abhishek Singh",Practice Exams | AWS Certified DevOps Engineer Professional,AWS Certified DevOps: 120 high fidelity questions: AWS Certified DevOps Engineer Professional DOP-C02.,4.4,2568,All Levels,120 questions,,Current price: $59.99
github,https://www.udemy.com/course/golang-for-devops-and-cloud-engineers/,https://img-c.udemycdn.com/course/240x135/4689134_cb97.jpg,Edward Viaene,Golang For DevOps And Cloud Engineers,"Learn by example how to use Go (Golang) with REST APIs, Amazon Web Services (AWS), Azure, GitHub, Kubernetes, and more",4.2,491,Intermediate,112 lectures,19.5 total hours,Current price: $84.99
github,https://www.udemy.com/course/the-complete-devops-bootcamp/,https://img-c.udemycdn.com/course/240x135/4347106_9cfa.jpg,"Mumshad Mannambeth, KodeKloud Training",The Ultimate DevOps Bootcamp,The ultimate DevOps Bootcamp course for all your DevOps learning,4.6,6636,Beginner,281 lectures,17.5 total hours,Current price: $99.99
github,https://www.udemy.com/course/master-git-and-github-in-5-days-go-from-zero-to-hero/,https://img-c.udemycdn.com/course/240x135/4871336_eb07_5.jpg,"Jose Portilla, Pierian Training",Master Git and GitHub in 5 Days: Go from Zero to Hero,"Learn to master git and GitHub in just one week! Learn how to use commits, branches, pull requests, and more!",4.6,4465,All Levels,44 lectures,6 total hours,Current price: $89.99
github,https://www.udemy.com/course/mastering-github-actions-beginner-to-expert/,https://img-c.udemycdn.com/course/240x135/5731766_bbac_3.jpg,Lauro Fialho Müller,GitHub Actions: The Complete Guide from Beginner to Expert,Learn the most important GitHub Actions concepts to build resilient CI/CD pipelines and automate many development tasks!,4.7,456,Beginner,107 lectures,12 total hours,Current price: $89.99
github,https://www.udemy.com/course/jenkins-ci-cd-pipelines-devops-for-beginners/,https://img-c.udemycdn.com/course/240x135/5737068_3f88_3.jpg,"Valentin Despa, Valentin Despa - Support","Jenkins: Jobs, Pipelines, CI/CD and DevOps for Beginners","[2025] Learn modern Jenkins by writing pipeline as code (Jenkinsfile), using Git, GitHub, Docker and deploying to AWS.",4.6,1178,All Levels,112 lectures,10.5 total hours,Current price: $79.99
github,https://www.udemy.com/course/learn-git-github-and-github-actions/,https://img-c.udemycdn.com/course/240x135/6309915_2db1.jpg,Felipe Gavilán,"Learn Git, GitHub and GitHub Actions","Learn professional software development practices like Continuous Integration and Delivery, GitHub Flow, and more!",4.9,14,Beginner,132 lectures,5.5 total hours,Current price: $84.99
github,https://www.udemy.com/course/git-mastery-beginner-to-expert-with-github-gitlab/,https://img-c.udemycdn.com/course/240x135/3571633_1ceb_3.jpg,Mike Kilic,Git Mastery: Beginner to Expert with GitHub & GitLab,"Become a professional Git user along with expertise in GitHub, GitLab & Azure DevOps. Step-by-Step no assumptions made.",4.5,1099,All Levels,185 lectures,31.5 total hours,Current price: $84.99
github,https://www.udemy.com/course/become-the-jedi-of-cicd-github-actions/,https://img-c.udemycdn.com/course/240x135/5178416_f92c_4.jpg,Hilmi Cihan Yıldırım,Mastering GitHub Actions & DevOps: Optimize Your Workflow,"Elevate Your DevOps Game: Automation, Efficiency, and Agile Practices with GitHub Actions",4.4,108,All Levels,40 lectures,5 total hours,Current price: $69.99
github,https://www.udemy.com/course/devopsprojects/,https://img-c.udemycdn.com/course/240x135/3710504_9b6d_9.jpg,Imran Teli,DevOps Projects | Real Time DevOps & GitOps Projects,Master Your DevOps Skills with Real challenge,4.7,3409,Intermediate,218 lectures,33.5 total hours,Current price: $89.99
