skill,link,image_link,partner,title,course_description,rating,num_review,difficulty,num_lecture,duration,price
system administration,https://www.udemy.com/course/it-system-engineer-cloud-system-administrator/,https://img-c.udemycdn.com/course/240x135/5049178_e19c.jpg,Kelvin Johnson,IT System Engineer & Cloud System Administration,"Learn Active Directory, Microsoft Intune, Group Policy, DNS,  Azure AD, Microsoft 365, Storage, Backup, WSUS and Azure",4.3,424,Intermediate,102 lectures,7 total hours,Current price: $54.99
system administration,https://www.udemy.com/course/mastering-linux-system-administration-and-troubleshooting/,https://img-c.udemycdn.com/course/240x135/5301720_5f74.jpg,Tareq Tech,Mastering Linux System Administration and Troubleshooting,"Become a Linux System Administrator Level 1 and 2, System Engineer Or perhaps you're interested in Cloud and DevOps jobs",4.7,48,Beginner,68 lectures,13.5 total hours,Current price: $84.99
system administration,https://www.udemy.com/course/mastering-it-systems-administration-azure-cloud-engineering/,https://img-c.udemycdn.com/course/240x135/5640394_c6fd_2.jpg,Kelvin Johnson,Mastering IT Systems Administration & Azure Cloud Engineer,"Mastering IT: Systems Administration, Azure Cloud Engineering, IT Service Desk, and Windows Server Administration Skills",4.5,11,All Levels,186 lectures,14 total hours,Current price: $49.99
system administration,https://www.udemy.com/course/valaxy-linux/,https://img-c.udemycdn.com/course/240x135/3184362_4102_12.jpg,AR Shankar | Valaxy Technologies,Linux for Cloud & DevOps Engineers,"Linux basics about files, directories, installations, networking, system configuration, user management etc...",4.5,3918,Beginner,43 lectures,4.5 total hours,Current price: $74.99
system administration,https://www.udemy.com/course/decodingdevops/,https://img-c.udemycdn.com/course/240x135/4039556_ebb3_9.jpg,Imran Teli,DevOps Beginners to Advanced with Projects,"Begin Your DevOps Career As a Newbie | AWS, Linux, Scripting, Jenkins, Ansible, GitOps, Docker, Kubernetes, & Terraform.",4.6,36463,All Levels,318 lectures,53 total hours,Current price: $119.99
system administration,https://www.udemy.com/course/linux-for-cloud-engineers-a-complete-project-based-learning/,https://img-c.udemycdn.com/course/240x135/5403140_ce56_12.jpg,Pravin Mishra | AWS Certified Cloud Practitioner | Solutions Architect,"Linux for DevOps, Cloud, and SRE Engineers","Master Linux fundamentals, shell scripting, process management & networking for DevOps, Cloud, and SRE Engineers",4.4,401,Beginner,26 lectures,5.5 total hours,Current price: $59.99
system administration,https://www.udemy.com/course/aws-certified-devops-engineer-professional-hands-on/,https://img-c.udemycdn.com/course/240x135/2533568_2828_6.jpg,"Stephane Maarek | AWS Certified Cloud Practitioner,Solutions Architect,Developer",AWS Certified DevOps Engineer Professional 2025 - DOP-C02,Pass the AWS Certified DevOps Engineer Professional Certification (DOP-C02) with 20 hours of advanced videos.,4.7,18041,Intermediate,248 lectures,17 total hours,Current price: $149.99
system administration,https://www.udemy.com/course/aws-certified-devops-engineer-professional-practice-exam-dop/,https://img-c.udemycdn.com/course/240x135/2567118_611e_8.jpg,"Stephane Maarek | AWS Certified Cloud Practitioner,Solutions Architect,Developer, Abhishek Singh",Practice Exams | AWS Certified DevOps Engineer Professional,AWS Certified DevOps: 120 high fidelity questions: AWS Certified DevOps Engineer Professional DOP-C02.,4.4,2568,All Levels,120 questions,,Current price: $59.99
system administration,https://www.udemy.com/course/the-complete-devops-bootcamp/,https://img-c.udemycdn.com/course/240x135/4347106_9cfa.jpg,"Mumshad Mannambeth, KodeKloud Training",The Ultimate DevOps Bootcamp,The ultimate DevOps Bootcamp course for all your DevOps learning,4.6,6636,Beginner,281 lectures,17.5 total hours,Current price: $99.99
system administration,https://www.udemy.com/course/gcp-google-cloud-professional-devops-engineer-certification/,https://img-c.udemycdn.com/course/240x135/4133780_4390_9.jpg,"Ankit Mistry : 150,000+ Students, GCP Certification - Google Cloud Academy | Associate Cloud & Professional Engineer Certifications",GCP Google Cloud Professional DevOps Engineer Certification,Pass Google Cloud Professional DevOps Certification with 12+ Hours of HD quality video and 70+ Hands-on Practical labs,4.2,2106,All Levels,112 lectures,13.5 total hours,Current price: $79.99
system administration,https://www.udemy.com/course/devops-with-docker-kubernetes-and-azure-devops/,https://img-c.udemycdn.com/course/240x135/2813427_cc60_2.jpg,"in28Minutes Official, Ravi S | DevOps Expert - Docker & Kubernetes, Open Cloud Solutions | Microsoft Azure Certification - AZ 900, Ranga Karanam | GCP Certification - Google Cloud Engineer & Architect","Learn DevOps: Docker, Kubernetes, Terraform and Azure DevOps","DevOps for Absolute Beginners: Azure DevOps, Docker, Kubernetes, Jenkins, Terraform, Ansible - AWS, Azure & Google Cloud",4.5,15966,All Levels,235 lectures,21.5 total hours,Current price: $139.99
system administration,https://www.udemy.com/course/introduction-devops/,https://img-c.udemycdn.com/course/240x135/5236958_2efa_2.jpg,Imran Afzal,Introduction to DevOps: Roadmap to DevOps Career,"DevOps course for someone who wants to learn Jenkins​,​ Jira, Dockers, Kubernetes, Nagios, Ansible, Terraform, and more",4.5,513,All Levels,55 lectures,7.5 total hours,Current price: $79.99
system administration,https://www.udemy.com/course/it-system-administration-training-for-it-help-desk-engineer/,https://img-c.udemycdn.com/course/240x135/4569762_b774_2.jpg,Kelvin Johnson,IT System Administration Training for IT Help Desk Engineer,IT System Administration for IT Service Desk Technician,4.3,75,All Levels,18 lectures,3 total hours,Current price: $49.99
system administration,https://www.udemy.com/course/devops-training/,https://img-c.udemycdn.com/course/240x135/1464166_c16e_33.jpg,TechLink Selenium | DevOps | GenAI,DevOps MasterClass: Terraform Kubernetes Ansible Docker,"DevOps with Jenkins Terraform GIT Docker Maven Kubernetes Ansible Automation Docker Swarm, DevOps Real world Exercises",4.5,6619,All Levels,548 lectures,76.5 total hours,Current price: $139.99
system administration,https://www.udemy.com/course/valaxy-ansible/,https://img-c.udemycdn.com/course/240x135/2717100_8748_10.jpg,AR Shankar | Valaxy Technologies,Ansible for the DevOps Beginners & System Admins,Ansible for the Beginners course for DevOps Engineers and System Admins helps you to enhance skills towards Ansible.,4.6,2534,Beginner,39 lectures,5 total hours,Current price: $84.99
system administration,https://www.udemy.com/course/ultimate-devops-project-with-resume-preparation/,https://img-c.udemycdn.com/course/240x135/6416543_f441_4.jpg,Abhishek Veeramalla,Ultimate DevOps Project Implementation,End to End DevOps Implementation on an E-Commerce project with Resume preparation and Interview Q&A,4.8,1993,Beginner,76 lectures,12 total hours,Current price: $44.99
system administration,https://www.udemy.com/course/complete-linux-training-course-to-get-your-dream-it-job/,https://img-c.udemycdn.com/course/240x135/1523066_334c_15.jpg,Imran Afzal,Complete Linux Training Course to Get Your Dream IT Job 2025,"The BEST Linux Administration course for corporate jobs and RHCSA, RHCE, LFCS, LPIC and CompTIA Linux+ certifications",4.7,40279,All Levels,283 lectures,41 total hours,Current price: $139.99
system administration,https://www.udemy.com/course/devopsprojects/,https://img-c.udemycdn.com/course/240x135/3710504_9b6d_9.jpg,Imran Teli,DevOps Projects | Real Time DevOps & GitOps Projects,Master Your DevOps Skills with Real challenge,4.7,3409,Intermediate,218 lectures,33.5 total hours,Current price: $89.99
system administration,https://www.udemy.com/course/init6-linux/,https://img-c.udemycdn.com/course/240x135/5037268_ebf5_5.jpg,Praveen Kumar,"Linux for Devops, Cloud Engineers and Developers","Get the linux skills like user management, networking, wild card, redirection software management, services etc",4.5,40,Intermediate,55 lectures,8 total hours,Current price: $54.99
system administration,https://www.udemy.com/course/master-linux-admin-for-devops-sre-become-job-ready/,https://img-c.udemycdn.com/course/240x135/6505035_fdb4_2.jpg,Abe Bazouie,Master Linux Admin for DevOps & SRE: Become Job-Ready,"Master Linux Admin for DevOps & SRE (2025) | Hands-On System Administration, Bash Scripting & Networking",4.7,5,All Levels,130 lectures,25.5 total hours,Current price: $44.99
