skill,link,image_link,partner,title,course_description,rating,num_review,difficulty,num_lecture,duration,price
operating system,https://www.udemy.com/course/fundamentals-of-operating-systems/,https://img-c.udemycdn.com/course/240x135/5666148_d14d.jpg,Hussein Nasser,Fundamentals of Operating Systems,Build efficient software by understanding how the OS kernel works,4.7,1549,Intermediate,52 lectures,21.5 total hours,Current price: $89.99
operating system,https://www.udemy.com/course/operating-systems-from-scratch-part1/,https://img-c.udemycdn.com/course/240x135/1555228_0997_12.jpg,Vignesh Sekar,Operating Systems from scratch - Part 1,Learn the concepts of Operating Systems from scratch as Operating System forms the core of Computer Science,4.7,5321,All Levels,66 lectures,8.5 total hours,Current price: $84.99
operating system,https://www.udemy.com/course/operating-systems-computer-science-course/,https://img-c.udemycdn.com/course/240x135/2395182_a9aa_4.jpg,Vignesh Sekar,Operating Systems Final Part (4) : File Systems & Threads,Learn the concepts of Operating Systems from scratch as Operating System forms the core of Computer Science,4.9,646,All Levels,64 lectures,10 total hours,Current price: $74.99
operating system,https://www.udemy.com/course/operatingsystems/,https://img-c.udemycdn.com/course/240x135/1657548_2c15_3.jpg,Vignesh Sekar,Operating Systems from scratch - Part 2,Learn memory management in operating systems as operating system forms the core of computer science,4.5,1407,All Levels,103 lectures,12.5 total hours,Current price: $79.99
operating system,https://www.udemy.com/course/operating-systems-online-course/,https://img-c.udemycdn.com/course/240x135/2032604_965f_4.jpg,Vignesh Sekar,Operating Systems Part 3 : Synchronization and Deadlock,Learn the concepts of Operating Systems from scratch as Operating System forms the core of Computer Science,4.9,844,All Levels,95 lectures,15.5 total hours,Current price: $84.99
operating system,https://www.udemy.com/course/the-ultimate-linux-bootcamp-for-devops-sre-cloud-engineers/,https://img-c.udemycdn.com/course/240x135/6458119_5e4d_2.jpg,"Yogesh Raheja, Thinknyx Technologies",The Ultimate Linux Bootcamp for DevOps SRE & Cloud Engineers,"Unlock your potential in Linux Administration with expert-led lectures, interactive demonstrations, and practice tests",4.9,21,All Levels,113 lectures,14 total hours,Current price: $44.99
operating system,https://www.udemy.com/course/writing-your-own-operating-system-from-scratch/,https://img-c.udemycdn.com/course/240x135/3452470_d92a_3.jpg,x-BIT Development,Write Your Own Operating System From Scratch - Step by Step,Build your own 64-bit operating system - for the x86 architecture,4.4,368,All Levels,64 lectures,10 total hours,Current price: $64.99
operating system,https://www.udemy.com/course/valaxy-linux/,https://img-c.udemycdn.com/course/240x135/3184362_4102_12.jpg,AR Shankar | Valaxy Technologies,Linux for Cloud & DevOps Engineers,"Linux basics about files, directories, installations, networking, system configuration, user management etc...",4.5,3918,Beginner,43 lectures,4.5 total hours,Current price: $74.99
operating system,https://www.udemy.com/course/the-complete-operating-systems-course-from-zero-to-expert/,https://img-c.udemycdn.com/course/240x135/5156578_8fe0_5.jpg,Lucas Bazilio,The Complete Operating Systems Course: From Zero to Hero!,"Operating Systems for everyone! Master Operating Systems with projects, challenges and theory. Many courses in one!",4.4,19,All Levels,32 lectures,10 total hours,Current price: $64.99
operating system,https://www.udemy.com/course/aws-certified-devops-engineer-professional-practice-exam-dop/,https://img-c.udemycdn.com/course/240x135/2567118_611e_8.jpg,"Stephane Maarek | AWS Certified Cloud Practitioner,Solutions Architect,Developer, Abhishek Singh",Practice Exams | AWS Certified DevOps Engineer Professional,AWS Certified DevOps: 120 high fidelity questions: AWS Certified DevOps Engineer Professional DOP-C02.,4.4,2568,All Levels,120 questions,,Current price: $59.99
operating system,https://www.udemy.com/course/it-system-engineer-cloud-system-administrator/,https://img-c.udemycdn.com/course/240x135/5049178_e19c.jpg,Kelvin Johnson,IT System Engineer & Cloud System Administration,"Learn Active Directory, Microsoft Intune, Group Policy, DNS,  Azure AD, Microsoft 365, Storage, Backup, WSUS and Azure",4.3,424,Intermediate,102 lectures,7 total hours,Current price: $54.99
operating system,https://www.udemy.com/course/make-your-operating-system-fundamental-rock-solid-pdf-notes/,https://img-c.udemycdn.com/course/240x135/5863440_f2f3_9.jpg,Kshitij Sharma,Operating System: Make The Fundamentals Rock Solid+PDF Notes,(Ongoing)  Academically Oriented Operating System Advanced Course : Mastering Core Concepts with 200+ Top Notch Examples,5.0,2,Intermediate,137 lectures,25 total hours,Current price: $19.99
operating system,https://www.udemy.com/course/operating-systems-course-ace-interview-questions-in-30-days/,https://img-c.udemycdn.com/course/240x135/4642216_7808_3.jpg,Prerak Mehta,Operating Systems Course: Ace Interview Questions in 30 days,COMPLETE Beginner to Expert Guide to Crack Technical Interview THIS YEAR With Operating Systems EVEN WITH Zero Knowledge,4.6,118,Beginner,33 lectures,13 total hours,Current price: $59.99
operating system,https://www.udemy.com/course/linux-for-cloud-engineers-a-complete-project-based-learning/,https://img-c.udemycdn.com/course/240x135/5403140_ce56_12.jpg,Pravin Mishra | AWS Certified Cloud Practitioner | Solutions Architect,"Linux for DevOps, Cloud, and SRE Engineers","Master Linux fundamentals, shell scripting, process management & networking for DevOps, Cloud, and SRE Engineers",4.4,401,Beginner,26 lectures,5.5 total hours,Current price: $59.99
operating system,https://www.udemy.com/course/the-complete-devops-bootcamp/,https://img-c.udemycdn.com/course/240x135/4347106_9cfa.jpg,"Mumshad Mannambeth, KodeKloud Training",The Ultimate DevOps Bootcamp,The ultimate DevOps Bootcamp course for all your DevOps learning,4.6,6636,Beginner,281 lectures,17.5 total hours,Current price: $99.99
operating system,https://www.udemy.com/course/aws-certified-devops-engineer-professional-practice-exams-amazon-dop-c02/,https://img-c.udemycdn.com/course/240x135/2644002_eff2_6.jpg,"Jon Bonso AWS Certified Cloud Practitioner, Developer, Solutions Architect, Tutorials Dojo | AWS Certified Cloud Practitioner, AWS Certified Solutions Architect, AWS Certified Developer, Amiel Palacol AWS Certified Solutions Architect, DevOps Engineer Professional",AWS Certified DevOps Engineer Professional Practice Exams,Be an AWS DevOps Engineer! AWS Certified DevOps Engineer Professional Practice Tests that covers all DOP-C02 topics!,4.5,1285,Intermediate,150 questions,,Current price: $59.99
operating system,https://www.udemy.com/course/decodingdevops/,https://img-c.udemycdn.com/course/240x135/4039556_ebb3_9.jpg,Imran Teli,DevOps Beginners to Advanced with Projects,"Begin Your DevOps Career As a Newbie | AWS, Linux, Scripting, Jenkins, Ansible, GitOps, Docker, Kubernetes, & Terraform.",4.6,36463,All Levels,318 lectures,53 total hours,Current price: $119.99
operating system,https://www.udemy.com/course/aws-certified-devops-engineer-professional-hands-on/,https://img-c.udemycdn.com/course/240x135/2533568_2828_6.jpg,"Stephane Maarek | AWS Certified Cloud Practitioner,Solutions Architect,Developer",AWS Certified DevOps Engineer Professional 2025 - DOP-C02,Pass the AWS Certified DevOps Engineer Professional Certification (DOP-C02) with 20 hours of advanced videos.,4.7,18041,Intermediate,248 lectures,17 total hours,Current price: $149.99
operating system,https://www.udemy.com/course/introduction-devops/,https://img-c.udemycdn.com/course/240x135/5236958_2efa_2.jpg,Imran Afzal,Introduction to DevOps: Roadmap to DevOps Career,"DevOps course for someone who wants to learn Jenkins​,​ Jira, Dockers, Kubernetes, Nagios, Ansible, Terraform, and more",4.5,513,All Levels,55 lectures,7.5 total hours,Current price: $79.99
operating system,https://www.udemy.com/course/operating-system-j/,https://img-c.udemycdn.com/course/240x135/2735532_5db3.jpg,Edutainer India,Operating System,The Complete Course,4.3,185,All Levels,71 lectures,8 total hours,Current price: $49.99
