skill,link,image_link,partner,title,course_description,rating,num_review,difficulty,num_lecture,duration,price
service oriented architecture,https://www.udemy.com/course/software-architecture-design-of-modern-large-scale-systems/,https://img-c.udemycdn.com/course/240x135/3997622_0670_2.jpg,"Michael Pogrebinsky | Software Architecture, System Design, Java Expert, Top Developer Academy LLC",Software Architecture & Design of Modern Large Scale Systems,"Become a Software Architect or Technical Lead by Mastering Software Architecture, System Design & Big Data Processing.",4.7,11311,All Levels,45 lectures,7 total hours,
service oriented architecture,https://www.udemy.com/course/java-programming-tutorial-for-beginners/,https://img-c.udemycdn.com/course/240x135/1535678_0ce9_7.jpg,in28Minutes Official,Java Programming for Complete Beginners [2025],Java Programming for Beginners to Java Object Oriented Programming. Core Java + Spring Boot. Java 8 to Java 24.,4.5,49448,Beginner,749 lectures,59 total hours,
service oriented architecture,https://www.udemy.com/course/master-software-architecture-system-design-for-developers/,https://img-c.udemycdn.com/course/240x135/6216121_668f_2.jpg,Munawar Ali,Master Software Architecture & System Design for Developers,"Master System Design, Software Architectures, Microservices Architecture, AWS - To Crack Interviews or become Architect",4.9,26,All Levels,350 lectures,15.5 total hours,Current price: $44.99
service oriented architecture,https://www.udemy.com/course/the-complete-microservices-event-driven-architecture/,https://img-c.udemycdn.com/course/240x135/5283706_8f89.jpg,"Michael Pogrebinsky | Software Architecture, System Design, Java Expert, Top Developer Academy LLC",The Complete Microservices & Event-Driven Architecture,Master Modern Software Architecture. Design Highly Scalable Systems using Microservices & Event-Driven Architecture,4.8,2474,All Levels,33 lectures,5.5 total hours,Current price: $84.99
service oriented architecture,https://www.udemy.com/course/javamasterclass/,https://img-c.udemycdn.com/course/240x135/6211415_d24a_2.jpg,"Denis Panjuta, Tutorials.eu by Denis Panjuta, Jafar TutorialsEU",60 Days of Java : The Complete Java Masterclass,"Master Java by building real-world projects. Learn JavaFX, Spring Boot, REST APIs, and more!",4.6,526,All Levels,729 lectures,58 total hours,Current price: $89.99
service oriented architecture,https://www.udemy.com/course/software-architecture-system-design-practical-case-studies/,https://img-c.udemycdn.com/course/240x135/4696446_b345_4.jpg,"Michael Pogrebinsky | Software Architecture, System Design, Java Expert, Top Developer Academy LLC",Software Architecture & System Design Practical Case Studies,"Design Real-life Large Scale Systems, Practice Modern Software Architecture & Prepare for a System Design Interview",4.8,1461,All Levels,26 lectures,4 total hours,Current price: $79.99
service oriented architecture,https://www.udemy.com/course/aws-java/,https://img-c.udemycdn.com/course/240x135/6082267_2c68_3.jpg,Vinoth Selvaraj,AWS Cloud Architecture For Java Spring Boot Developers,"Design, Deploy, Secure Applications with VPC. Subnets, Auto Scaling, Load Balancing, ECS Fargate, CI/CD Pipelines",4.6,156,All Levels,167 lectures,11.5 total hours,Current price: $19.99
service oriented architecture,https://www.udemy.com/course/oop-learnit/,https://img-c.udemycdn.com/course/240x135/3520172_30b8_2.jpg,"Andrii Piatakha, Learn IT University",Object Oriented Programming - Basics to Advance (Java OOP),"Learn OOP, SOLID principles with Java examples. Implement backend part for online store by the end of the course",4.4,2162,Intermediate,64 lectures,15 total hours,
service oriented architecture,https://www.udemy.com/course/java-se-programming/,https://img-c.udemycdn.com/course/240x135/2462140_b27f_2.jpg,Abdul Bari,Learn JAVA Programming - Beginner to Master,Deep Dive in Core Java programming -Standard Edition. A Practical approach to learn Java. Become a Java Expert,4.6,26143,All Levels,333 lectures,61.5 total hours,
service oriented architecture,https://www.udemy.com/course/the-complete-cloud-computing-software-architecture-patterns/,https://img-c.udemycdn.com/course/240x135/4472674_020e_2.jpg,"Michael Pogrebinsky | Software Architecture, System Design, Java Expert, Top Developer Academy LLC",The Complete Cloud Computing Software Architecture Patterns,"Architect Large Scale Systems using Cloud Computing, Software Architecture Patterns & Modern System Design Principles",4.7,2216,All Levels,26 lectures,4.5 total hours,Current price: $84.99
service oriented architecture,https://www.udemy.com/course/mastering-object-oriented-design-in-java/,https://img-c.udemycdn.com/course/240x135/359550_ab12_14.jpg,Job Ready Programmer,Master Object Oriented Design in Java - Homework + Solutions,Don't just learn Java! Learn to write practical industry standard object oriented software and super charge your career!,4.7,5364,All Levels,41 lectures,6 total hours,
service oriented architecture,https://www.udemy.com/course/java-the-complete-java-developer-course/,https://img-c.udemycdn.com/course/240x135/533682_c10c_4.jpg,"Tim Buchalka, Tim Buchalka's Learn Programming Academy, Edwin Einsen Vásquez Velásquez, Igor Popovic",Java Masterclass 2025: 130+ Hours of Expert Lessons,"Gain real-world experience with OOP, coding exercises, and problem-solving for job-ready Java development skills",4.6,205616,All Levels,736 lectures,135.5 total hours,Current price: $139.99
service oriented architecture,https://www.udemy.com/course/ocp11_from_oca8/,https://img-c.udemycdn.com/course/240x135/4435956_8c4d_16.jpg,"Dr. Seán Kennedy OCA, OCP","Java 21, Java 17, Java 11, Java 8 (adv.) and Spring Boot 3","Master the latest topics; get Oracle OCP Certification (1Z0-830, 829, 819, 809) and code a Spring Boot application",4.5,2330,Intermediate,357 lectures,32 total hours,
service oriented architecture,https://www.udemy.com/course/spring-boot-and-spring-framework-tutorial-for-beginners/,https://img-c.udemycdn.com/course/240x135/4993276_3452.jpg,in28Minutes Official,[NEW] Master Spring Boot 3 & Spring Framework 6 with Java,"Become Java Spring Boot Full Stack Developer. Learn Spring Framework, Spring Boot, Spring Data, Docker & AWS",4.6,9808,All Levels,423 lectures,39 total hours,Current price: $99.99
service oriented architecture,https://www.udemy.com/course/solid-principles-object-oriented-design-architecture/,https://img-c.udemycdn.com/course/240x135/2064941_1f63_2.jpg,Vasiliy Zukanov,SOLID Principles of Object Oriented Design and Architecture,"Design clean, extensible and maintainable systems using SOLID principles",4.7,4545,Beginner,39 lectures,4.5 total hours,
service oriented architecture,https://www.udemy.com/course/java-programming-a-comprehensive-bootcamp-from-zero-to-hero/,https://img-c.udemycdn.com/course/240x135/5196034_e1f9_2.jpg,"Eazy Bytes, Madan Reddy",Java Programming: A Comprehensive Bootcamp from Zero to Hero,"Become a Java developer - Core Java, Functional Programming, Lambdas, Streams, Collections, Covers upto Java 23",4.6,1855,Beginner,533 lectures,66.5 total hours,Current price: $79.99
service oriented architecture,https://www.udemy.com/course/java-oop-iter-academy/,https://img-c.udemycdn.com/course/240x135/6408069_84c7.jpg,"Andrii Partola, ITER Academy",Java OOP: Object Oriented Programming with Exercises - 2025,"Object Oriented Programming (OOP), Classes, Objects, Encapsulation, Inheritance, Polymorphism, SOLID and more",4.6,92,All Levels,13 lectures,3.5 total hours,Current price: $54.99
service oriented architecture,https://www.udemy.com/course/java-in-depth-become-a-complete-java-engineer/,https://img-c.udemycdn.com/course/240x135/358540_d06b_16.jpg,Dheeru Mundluru,Java In-Depth: Become a Complete Java Engineer!,"Java programming bootcamp integrated with best practices, design rules and instructor-led Java EE project. Up to Java 21",4.6,23634,All Levels,410 lectures,76 total hours,
service oriented architecture,https://www.udemy.com/course/learn-object-oriented-programming-in-java-j/,https://img-c.udemycdn.com/course/240x135/4215744_1097.jpg,Eduonix Learning Solutions,Learn Object Oriented Programming in Java,Master the fundamentals of Java Programming Language,4.1,10,Beginner,99 lectures,14 total hours,
service oriented architecture,https://www.udemy.com/course/java-development-for-beginners-learnit/,https://img-c.udemycdn.com/course/240x135/2691654_2f52_3.jpg,"Andrii Piatakha, Learn IT University","Java from Zero to First Job, Practical Guide, 2000+ examples","Java Core, TDD, Streams, Lambdas, JPA/Hibernate, SQL, Build Tools, Git, Web Servers, HTML,Servlets, JSP, Spring Boot etc",4.5,5616,All Levels,466 lectures,123.5 total hours,
