skill,link,image_link,partner,title,course_description,rating,num_review,difficulty,num_lecture,duration,price
spring boot,https://www.udemy.com/course/spring-boot-and-spring-framework-tutorial-for-beginners/,https://img-c.udemycdn.com/course/240x135/4993276_3452.jpg,in28Minutes Official,[NEW] Master Spring Boot 3 & Spring Framework 6 with Java,"Become Java Spring Boot Full Stack Developer. Learn Spring Framework, Spring Boot, Spring Data, Docker & AWS",4.6,9808,All Levels,423 lectures,39 total hours,Current price: $99.99
spring boot,https://www.udemy.com/course/all-in-one-java-spring-boot-spring-and-hibernate/,https://img-c.udemycdn.com/course/240x135/6265681_d70d_4.jpg,"Sunshine Coding, Code IT","ALL IN ONE! Java + Spring Boot, Spring and Hibernate [NEW]",Become a Full-Stack Developer by Learning Java and Spring Framework,4.8,72,All Levels,257 lectures,32.5 total hours,Current price: $74.99
spring boot,https://www.udemy.com/course/spring-5-with-spring-boot-2/,https://img-c.udemycdn.com/course/240x135/2167814_a0e6_5.jpg,"Navin Reddy, Telusko",Java Spring Framework 6 with Spring Boot 3,"Master Java, Spring 6 and Spring Boot 3 with JDBC, JPA, Security, Docker and Microservices with Telusko",4.6,27979,All Levels,427 lectures,48.5 total hours,Current price: $109.99
spring boot,https://www.udemy.com/course/spring-boot-using-intellij-build-a-real-world-project/,https://img-c.udemycdn.com/course/240x135/4298517_aa5d_3.jpg,"Faisal Memon (EmbarkX), EmbarkX Official",Java Spring Boot: Professional eCommerce Project Masterclass,"Spring Framework + Spring Boot Full Stack: eCommerce REST API, Spring Data JPA, Spring Security 6, JWT, Deploy on AWS",4.6,1374,All Levels,635 lectures,89 total hours,Current price: $74.99
spring boot,https://www.udemy.com/course/full-stack-react-and-java-spring-boot-the-developer-guide/,https://img-c.udemycdn.com/course/240x135/4659752_7514.jpg,"Chad Darby, Eric Roby",Full Stack: React and Java Spring Boot - The Developer Guide,"Build a Full Stack App - React and Java Spring Boot, Stripe Credit Card Payments, Spring Security, JWT, Spring Data JPA",4.4,2414,Intermediate,319 lectures,26.5 total hours,Current price: $89.99
spring boot,https://www.udemy.com/course/full-stack-application-development-with-spring-boot-and-angular/,https://img-c.udemycdn.com/course/240x135/2023728_2d6d_4.jpg,in28Minutes Official,Go Java Full Stack with Spring Boot and Angular,Become a Full Stack Java Developer. Build Your First Java Full Stack Application with Angular and Spring Boot.,4.6,10689,All Levels,180 lectures,14 total hours,Current price: $109.99
spring boot,https://www.udemy.com/course/spring-hibernate-tutorial/,https://img-c.udemycdn.com/course/240x135/647428_be28_10.jpg,Chad Darby,"[NEW] Spring Boot 3, Spring 6 & Hibernate for Beginners","Spring Boot 3: Learn Spring 6, Spring Core, Spring REST, Spring MVC, Spring Security, Thymeleaf, JPA, Hibernate, MySQL",4.6,88557,All Levels,403 lectures,34.5 total hours,Current price: $109.99
spring boot,https://www.udemy.com/course/amazon-q-developer-for-java-spring-boot-developers/,https://img-c.udemycdn.com/course/240x135/6119193_b974.jpg,Bharath Thippireddy,Amazon Q Developer for Java & Spring Boot Developers,Unlock the Power of AI Pair Programming :  Maximizing Productivity in Java and Spring Boot with AWS Q Developer,4.7,33,All Levels,81 lectures,4 total hours,Current price: $59.99
spring boot,https://www.udemy.com/course/docker-java/,https://img-c.udemycdn.com/course/240x135/4743926_5280_4.jpg,Vinoth Selvaraj,Docker Masterclass For Java Spring Boot Developers,"Build, Ship, and Run Your Java Spring Boot Microservices with Confidence. Integration Testing with Test Containers.",4.5,204,All Levels,137 lectures,10.5 total hours,Current price: $64.99
spring boot,https://www.udemy.com/course/spring-boot-e-commerce-ultimate/,https://img-c.udemycdn.com/course/240x135/3716888_5054_2.jpg,Nam Ha Minh,Java Spring Boot E-Commerce Ultimate Course,Become Job-ready Java Spring Developer: Learn to Build Real-world Shopping Website with Java and Spring framework,4.5,1705,All Levels,333 lectures,86 total hours,Current price: $84.99
spring boot,https://www.udemy.com/course/aws-java/,https://img-c.udemycdn.com/course/240x135/6082267_2c68_3.jpg,Vinoth Selvaraj,AWS Cloud Architecture For Java Spring Boot Developers,"Design, Deploy, Secure Applications with VPC. Subnets, Auto Scaling, Load Balancing, ECS Fargate, CI/CD Pipelines",4.6,156,All Levels,167 lectures,11.5 total hours,Current price: $19.99
spring boot,https://www.udemy.com/course/graphql-spring/,https://img-c.udemycdn.com/course/240x135/4839740_7098_2.jpg,Vinoth Selvaraj,Reactive GraphQL Masterclass For Java Spring Boot Developers,Boost API Performance and Scalability using Efficient Data Fetching with GraphQL and Spring Boot,4.7,180,All Levels,176 lectures,12.5 total hours,Current price: $84.99
spring boot,https://www.udemy.com/course/full-stack-java-developer-java/,https://img-c.udemycdn.com/course/240x135/1993718_b47a_4.jpg,"StudyEasy Organization, Chand Sheikh",FULL STACK JAVA DEV: JAVA + JSP + SPRING + BOOT + JS + REACT,"Full Stack Java, JSP, Hibernate, Spring, Web-services/RestFul  API, Spring boot, JavaScript, React, FREE 6-month IDE.",4.4,11808,All Levels,716 lectures,84.5 total hours,Current price: $139.99
spring boot,https://www.udemy.com/course/spring-springboot-jpa-hibernate-zero-to-master/,https://img-c.udemycdn.com/course/240x135/4364200_0221_5.jpg,"Eazy Bytes, Madan Reddy","[NEW] Master Spring 6, Spring Boot 3, REST, JPA, Hibernate","Master Java framework Spring 6, AOP, Spring MVC, Spring Boot 3, Thymeleaf, Spring Security 6, Spring JDBC, JPA,REST",4.6,4891,Beginner,251 lectures,36.5 total hours,Current price: $89.99
spring boot,https://www.udemy.com/course/spring-framework-6-beginner-to-guru/,https://img-c.udemycdn.com/course/240x135/4522192_d71d.jpg,"John Thompson • 500,000+ Enrollments Worldwide","[NEW] Spring Boot 3, Spring Framework 6: Beginner to Guru","Spring 6, Spring Boot 3, Spring MVC, JPA/Hibernate, Mongo, Spring Security, OAuth2 JWT, MySQL, Docker/K8s, Microservices",4.5,2275,All Levels,563 lectures,47.5 total hours,Current price: $84.99
spring boot,https://www.udemy.com/course/build-spring-boot-projects-with-java/,https://img-c.udemycdn.com/course/240x135/5852528_b5a4_2.jpg,Ramesh Fadatare (Java Guides),Build 5 Spring Boot Projects with Java: Line-by-Line Coding,"Build 5+ Mini Spring Boot Projects using Java 17+, REST API, Spring Boot 3, Spring Security 6, Thymeleaf, React, MySQL",4.5,165,Intermediate,193 lectures,20 total hours,Current price: $74.99
spring boot,https://www.udemy.com/course/java-mastery-unleashing-the-power-of-programming/,https://img-c.udemycdn.com/course/240x135/5410794_a010_3.jpg,"ZK Tutorials, Sadhu Sreenivas",Mastering Java + Spring Boot: REST APIs and Microservices,"Complete Java SE + Spring Boot with REST API, JPA, MVC, Security, Microservices + SQL with MySQL +JDBC (Use 1.25x speed)",4.6,610,All Levels,195 lectures,81.5 total hours,Current price: $19.99
spring boot,https://www.udemy.com/course/learn-spring-boot/,https://img-c.udemycdn.com/course/240x135/4872100_35d1_3.jpg,Ramesh Fadatare (Java Guides),Spring 6 & Spring Boot 3 for Beginners (Includes 7 Projects),"Spring Core 6, Spring Boot 3, Spring Security 6, REST API, Spring MVC, WebFlux, Hibernate, React JS, Thymeleaf, Docker",4.5,1111,Beginner,420 lectures,46 total hours,Current price: $79.99
spring boot,https://www.udemy.com/course/no-nonsense-guide-to-java-spring-boot/,https://img-c.udemycdn.com/course/240x135/6182777_c870_3.jpg,Peachez Programming,The No Nonsense Guide to Java Spring Boot,Go from Java Developer to Backend Engineer using Java 17 + mySQL,3.8,4,Beginner,83 lectures,3 total hours,Current price: $49.99
spring boot,https://www.udemy.com/course/microservices-with-spring-boot-and-spring-cloud/,https://img-c.udemycdn.com/course/240x135/1352468_3d97_8.jpg,in28Minutes Official,Master Microservices with Spring Boot and Spring Cloud,"Java Spring Boot Microservices 5-in-1 - Spring Boot, Spring Cloud, Docker, Kubernetes and REST API (REST Web Services)",4.6,55658,All Levels,326 lectures,25.5 total hours,Current price: $139.99
