skill,link,image_link,partner,title,course_description,rating,num_review,difficulty,num_lecture,duration,price
hyperparameter optimization,https://www.udemy.com/course/hyperparameter-optimization-for-machine-learning/,https://img-c.udemycdn.com/course/240x135/3802920_de93_4.jpg,"Soledad Galli, Train in Data Team",Hyperparameter Optimization for Machine Learning,"Learn grid and random search, Bayesian optimization, multi-fidelity models, Optuna, Hyperopt, Scikit-Optimize & more.",4.6,726,Intermediate,95 lectures,9.5 total hours,Current price: $84.99
hyperparameter optimization,https://www.udemy.com/course/mastering-ml-hyperparameter-optimization-feature-selection/,https://img-c.udemycdn.com/course/240x135/5640814_d0ec_8.jpg,Alejandro Ruiz Olivares,Mastering ML:Hyperparameter Optimization & Feature Selection,"Advanced ML Techniques: Hyperparameter Optimization, Feature Selection, Hands-on Python Practice Utilizing Key Libraries",4.5,9,Beginner,37 lectures,6.5 total hours,Current price: $54.99
hyperparameter optimization,https://www.udemy.com/course/complete-machine-learning-nlp-bootcamp-mlops-deployment/,https://img-c.udemycdn.com/course/240x135/5993822_2c2a_7.jpg,"Krish Naik, KRISHAI Technologies Private Limited","Complete Data Science,Machine Learning,DL,NLP Bootcamp","Master the theory, practice,and math behind Data Science,Machine Learning,Deep Learning,NLP with end to end projects",4.5,11296,All Levels,429 lectures,99 total hours,Current price: $94.99
hyperparameter optimization,https://www.udemy.com/course/aws-certified-machine-learning-engineer-associate-mla-c01/,https://img-c.udemycdn.com/course/240x135/6125705_2219.jpg,"Sundog Education by Frank Kane, Stephane Maarek | AWS Certified Cloud Practitioner,Solutions Architect,Developer, Frank Kane",AWS Certified Machine Learning Engineer Associate: Hands On!,"Practice exam included! Master MLA-C01 / ME1-C01 AWS Machine Learning Engineer Exam: SageMaker, Bedrock, and AI Skills.",4.6,1747,All Levels,294 lectures,23.5 total hours,Current price: $89.99
hyperparameter optimization,https://www.udemy.com/course/google-cloud-machine-learning-engineer-certification-prep/,https://img-c.udemycdn.com/course/240x135/4878666_74ed_3.jpg,"Dan Sullivan, Dan Sullivan",Google Cloud Machine Learning Engineer Certification Prep,"Building, Deploying, and Managing Machine Learning Services at Scale",4.4,1213,All Levels,71 lectures,5.5 total hours,Current price: $69.99
hyperparameter optimization,https://www.udemy.com/course/machine-learning-with-projects-on-retail-marketing-analytics/,https://img-c.udemycdn.com/course/240x135/3751642_8d21_4.jpg,Machine Learning Express,Master Marketing Analytics with Python and Machine Learning,Level up your marketing career with data analytics skills | Learn Python & ML to optimize your marketing campaigns,4.5,85,Intermediate,145 lectures,25.5 total hours,Current price: $69.99
hyperparameter optimization,https://www.udemy.com/course/aws-certified-machine-learning-engineer-associate-mla-c01-exam-prep/,https://img-c.udemycdn.com/course/240x135/6188041_95ae.jpg,Nikolai Schuler,AWS Certified Machine Learning Engineer - Associate MLA-C01,The ONLY course you need to PASS the AWS Certified Machine Learning Engineer Exam | MLA-C01 | Incl. FULL Practice Exam!,4.6,263,All Levels,252 lectures,26.5 total hours,Current price: $89.99
hyperparameter optimization,https://www.udemy.com/course/machine-learning-using-azureml/,https://img-c.udemycdn.com/course/240x135/1088256_077d_2.jpg,"Jitesh Khurkhuriya, Python, Data Science & Machine Learning A-Z Team",DP-100: A-Z Machine Learning using Azure Machine Learning,Microsoft Azure DP-100: Designing and Implementing a Data Science Solution Exam Covered. Learn Azure Machine Learning,4.4,7796,All Levels,230 lectures,26.5 total hours,Current price: $124.99
hyperparameter optimization,https://www.udemy.com/course/practice-exams-aws-certified-machine-learning-engineer-associate/,https://img-c.udemycdn.com/course/240x135/6139021_a896.jpg,"Stephane Maarek | AWS Certified Cloud Practitioner,Solutions Architect,Developer, Abhishek Singh",Practice Exams: AWS Machine Learning Engineer Associate Cert,Prepare for AWS Certified Machine Learning Engineer Associate. 195 high-quality test questions and detailed explanations,4.6,306,All Levels,195 questions,,Current price: $64.99
hyperparameter optimization,https://www.udemy.com/course/data-science-in-python-unsupervised-learning/,https://img-c.udemycdn.com/course/240x135/5930252_06be_6.jpg,"Maven Analytics • 1,500,000 Learners, Alice Zhao",Python Data Science: Unsupervised Machine Learning,"Learn Python for data science & machine learning, and build unsupervised learning models w/ a top Python instructor!",4.7,187,All Levels,202 lectures,17 total hours,Current price: $84.99
hyperparameter optimization,https://www.udemy.com/course/natural-language-processing-in-python/,https://img-c.udemycdn.com/course/240x135/4294434_daf2_5.jpg,"Lazy Programmer Inc., Lazy Programmer Team",Machine Learning: Natural Language Processing in Python (V2),"NLP: Use Markov Models, NLTK, Artificial Intelligence, Deep Learning, Machine Learning, and Data Science in Python",4.7,6395,All Levels,160 lectures,22.5 total hours,Current price: $89.99
hyperparameter optimization,https://www.udemy.com/course/machine-learning-optimization-using-genetic-algorithm/,https://img-c.udemycdn.com/course/240x135/1602180_c701_4.jpg,Curiosity for Data Science,Machine Learning Optimization Using Genetic Algorithm,Learn how to optimize Machine Learning algorithms' performances and apply feature selection using Genetic Algorithm,4.3,367,Intermediate,57 lectures,6.5 total hours,Current price: $84.99
hyperparameter optimization,https://www.udemy.com/course/aws-machine-learning/,https://img-c.udemycdn.com/course/240x135/2529790_a0c6_9.jpg,"Sundog Education by Frank Kane, Stephane Maarek | AWS Certified Cloud Practitioner,Solutions Architect,Developer, Frank Kane, Sundog Education Team",AWS Certified Machine Learning Specialty 2025 - Hands On!,"AWS machine learning certification preparation - learn SageMaker, generative AI, data engineering, modeling & more",4.6,15104,Intermediate,167 lectures,15 total hours,Current price: $119.99
hyperparameter optimization,https://www.udemy.com/course/complete-machine-learning-and-data-science-zero-to-mastery/,https://img-c.udemycdn.com/course/240x135/2511476_4e38_5.jpg,"Andrei Neagoie, Daniel Bourke","Complete A.I. & Machine Learning, Data Science Bootcamp","Learn Data Science, Data Analysis, Machine Learning (Artificial Intelligence) and Python with Tensorflow, Pandas & more!",4.6,26310,All Levels,384 lectures,44 total hours,Current price: $119.99
hyperparameter optimization,https://www.udemy.com/course/machinelearning/,https://img-c.udemycdn.com/course/240x135/950390_270f_3.jpg,"Kirill Eremenko, Hadelin de Ponteves, SuperDataScience Team, Ligency Team","Machine Learning A-Z: AI, Python & R + ChatGPT Prize [2025]",Learn to create Machine Learning Algorithms in Python and R from two Data Science experts. Code templates included.,4.5,195572,All Levels,386 lectures,43 total hours,Current price: $149.99
hyperparameter optimization,https://www.udemy.com/course/introduction-to-machine-learning-in-python/,https://img-c.udemycdn.com/course/240x135/617930_44e3_2.jpg,Holczer Balazs,Machine Learning and Deep Learning Bootcamp in Python,"Machine Learning, Neural Networks, Deep Learning and Reinforcement Learning, GAN in Keras and TensorFlow",4.4,1533,All Levels,311 lectures,31.5 total hours,Current price: $129.99
hyperparameter optimization,https://www.udemy.com/course/the-ai-engineer-course-complete-ai-engineer-bootcamp/,https://img-c.udemycdn.com/course/240x135/6112535_7103.jpg,365 Careers,The AI Engineer Course 2025: Complete AI Engineer Bootcamp,"Complete AI Engineer Training: Python, NLP, Transformers, LLMs, LangChain, Hugging Face, APIs",4.6,2803,All Levels,367 lectures,24.5 total hours,Current price: $89.99
hyperparameter optimization,https://www.udemy.com/course/machine-learning-2020-complete-maths-for-machine-learning/,https://img-c.udemycdn.com/course/240x135/2674092_8ec5_3.jpg,"Jitesh Khurkhuriya, Python, Data Science & Machine Learning A-Z Team",Machine Learning : Complete Maths for Machine Learning,"Learn Math for Machine Learning, Math for Data Science, Linear Algebra, Calculus, Vectors & Matrices, Probability & more",4.6,308,Beginner,25 lectures,2.5 total hours,Current price: $49.99
hyperparameter optimization,https://www.udemy.com/course/machine-learning-data-science-foundations-masterclass/,https://img-c.udemycdn.com/course/240x135/3501832_8dbc_3.jpg,"Dr Jon Krohn, SuperDataScience Team, Ligency Team",Mathematical Foundations of Machine Learning,"Essential Linear Algebra and Calculus Hands-On in NumPy, TensorFlow, and PyTorch",4.6,7135,All Levels,114 lectures,16.5 total hours,Current price: $109.99
hyperparameter optimization,https://www.udemy.com/course/python-for-machine-learning-data-science-masterclass/,https://img-c.udemycdn.com/course/240x135/2769460_e60c.jpg,"Jose Portilla, Pierian Training",Python for Machine Learning & Data Science Masterclass,"Learn about Data Science and Machine Learning with Python! Including Numpy, Pandas, Matplotlib, Scikit-Learn and more!",4.6,17183,All Levels,231 lectures,44 total hours,Current price: $119.99
