skill,link,image_link,partner,title,course_description,rating,num_review,difficulty,num_lecture,duration,price
git,https://www.udemy.com/course/aws-certified-machine-learning-engineer-associate-mla-c01/,https://img-c.udemycdn.com/course/240x135/6125705_2219.jpg,"Sundog Education by Frank Kane, Stephane Maarek | AWS Certified Cloud Practitioner,Solutions Architect,Developer, Frank Kane",AWS Certified Machine Learning Engineer Associate: Hands On!,"Practice exam included! Master MLA-C01 / ME1-C01 AWS Machine Learning Engineer Exam: SageMaker, Bedrock, and AI Skills.",4.6,1747,All Levels,294 lectures,23.5 total hours,Current price: $89.99
git,https://www.udemy.com/course/complete-machine-learning-nlp-bootcamp-mlops-deployment/,https://img-c.udemycdn.com/course/240x135/5993822_2c2a_7.jpg,"Krish Naik, KRISHAI Technologies Private Limited","Complete Data Science,Machine Learning,DL,NLP Bootcamp","Master the theory, practice,and math behind Data Science,Machine Learning,Deep Learning,NLP with end to end projects",4.5,11296,All Levels,429 lectures,99 total hours,Current price: $94.99
git,https://www.udemy.com/course/practice-exams-aws-certified-machine-learning-engineer-associate/,https://img-c.udemycdn.com/course/240x135/6139021_a896.jpg,"Stephane Maarek | AWS Certified Cloud Practitioner,Solutions Architect,Developer, Abhishek Singh",Practice Exams: AWS Machine Learning Engineer Associate Cert,Prepare for AWS Certified Machine Learning Engineer Associate. 195 high-quality test questions and detailed explanations,4.6,306,All Levels,195 questions,,Current price: $64.99
git,https://www.udemy.com/course/aws-certified-machine-learning-engineer-associate-mla-c01-exam-prep/,https://img-c.udemycdn.com/course/240x135/6188041_95ae.jpg,Nikolai Schuler,AWS Certified Machine Learning Engineer - Associate MLA-C01,The ONLY course you need to PASS the AWS Certified Machine Learning Engineer Exam | MLA-C01 | Incl. FULL Practice Exam!,4.6,263,All Levels,252 lectures,26.5 total hours,Current price: $89.99
git,https://www.udemy.com/course/google-cloud-machine-learning-engineer-certification-prep/,https://img-c.udemycdn.com/course/240x135/4878666_74ed_3.jpg,"Dan Sullivan, Dan Sullivan",Google Cloud Machine Learning Engineer Certification Prep,"Building, Deploying, and Managing Machine Learning Services at Scale",4.4,1213,All Levels,71 lectures,5.5 total hours,
git,https://www.udemy.com/course/complete-machine-learning-and-data-science-zero-to-mastery/,https://img-c.udemycdn.com/course/240x135/2511476_4e38_5.jpg,"Andrei Neagoie, Daniel Bourke","Complete A.I. & Machine Learning, Data Science Bootcamp","Learn Data Science, Data Analysis, Machine Learning (Artificial Intelligence) and Python with Tensorflow, Pandas & more!",4.6,26310,All Levels,384 lectures,44 total hours,
git,https://www.udemy.com/course/git-and-github-bootcamp/,https://img-c.udemycdn.com/course/240x135/3792262_6b0c_2.jpg,Colt Steele,The Git & Github Bootcamp,"Master the essentials and the tricky bits: rebasing, squashing, stashing, reflogs, blobs, trees, & more!",4.8,35908,Beginner,189 lectures,17 total hours,
git,https://www.udemy.com/course/aws-machine-learning/,https://img-c.udemycdn.com/course/240x135/2529790_a0c6_9.jpg,"Sundog Education by Frank Kane, Stephane Maarek | AWS Certified Cloud Practitioner,Solutions Architect,Developer, Frank Kane, Sundog Education Team",AWS Certified Machine Learning Specialty 2025 - Hands On!,"AWS machine learning certification preparation - learn SageMaker, generative AI, data engineering, modeling & more",4.6,15104,Intermediate,167 lectures,15 total hours,
git,https://www.udemy.com/course/the-ai-engineer-course-complete-ai-engineer-bootcamp/,https://img-c.udemycdn.com/course/240x135/6112535_7103.jpg,365 Careers,The AI Engineer Course 2025: Complete AI Engineer Bootcamp,"Complete AI Engineer Training: Python, NLP, Transformers, LLMs, LangChain, Hugging Face, APIs",4.6,2803,All Levels,367 lectures,24.5 total hours,Current price: $89.99
git,https://www.udemy.com/course/google-certified-professional-machine-learning-engineer/,https://img-c.udemycdn.com/course/240x135/5211228_899a_3.jpg,Deepak Dubey,Google Certified Professional Machine Learning Engineer,"Master ML Algorithms, Data Modeling, TensorFlow & Google Cloud AI/ML Services. 137 Questions, Answers with Explanations",4.1,223,All Levels,63 lectures,16.5 total hours,
git,https://www.udemy.com/course/become-an-aws-machine-learning-engineer-in-30-days-new-2022/,https://img-c.udemycdn.com/course/240x135/4579406_6c5e_10.jpg,Dr. Ryan Ahmed | 400K+ Students | Best-Selling Professor | 250K+ YouTube,AWS SageMaker Machine Learning Engineer in 30 Days + ChatGPT,"Build 30+ ML Projects in 30 Days in AWS, Master SageMaker JumpStart, Canvas, AutoPilot, DataWrangler, Lambda & S3",4.4,1055,Beginner,481 lectures,43 total hours,
git,https://www.udemy.com/course/python-for-space-applications-git-fastapi-machine-learning/,https://img-c.udemycdn.com/course/240x135/5881766_3c1b.jpg,Spartificial Innovations,Python for Space Applications: Git FastAPI Machine Learning,Unleash Python's Potential in Space Exploration,4.3,19,Beginner,119 lectures,16 total hours,Current price: $59.99
git,https://www.udemy.com/course/aws-machine-learning-engineer-associate-practice-exams/,https://img-c.udemycdn.com/course/240x135/6203243_dd68.jpg,Nikolai Schuler,Practice Exams | AWS Machine Learning Engineer - Associate,ACE the AWS Certified Machine Learning Engineer Associate Exam MLA-C01 | Full Practice Exam Sets + Detailed Explanations,4.4,57,All Levels,260 questions,,Current price: $69.99
git,https://www.udemy.com/course/google-certified-architect-developer-engineer-data-devops/,https://img-c.udemycdn.com/course/240x135/2459706_d13a_6.jpg,"Google Cloud Experts Cloud Architect, Google Cloud Platform Gurus !",Google Cloud Certifications: All in one Bundle,"430k Subs -Digital Leader, Cloud Engineer, Machine Learning, Architect, Developer, DevOps Engineer, Security Engineer",4.4,3628,All Levels,642 lectures,67.5 total hours,
git,https://www.udemy.com/course/machinelearning/,https://img-c.udemycdn.com/course/240x135/950390_270f_3.jpg,"Kirill Eremenko, Hadelin de Ponteves, SuperDataScience Team, Ligency Team","Machine Learning A-Z: AI, Python & R + ChatGPT Prize [2025]",Learn to create Machine Learning Algorithms in Python and R from two Data Science experts. Code templates included.,4.5,195572,All Levels,386 lectures,43 total hours,Current price: $149.99
git,https://www.udemy.com/course/gcp-ml-engineer-exams-2024/,https://img-c.udemycdn.com/course/240x135/5702662_bf13.jpg,Exam Questions,Google Cloud Professional Machine Learning Engineer Exams,Prepare for the Google Cloud Certified Professional Machine Learning Engineer exam with 500 sample questions and a mock,4.5,3,Intermediate,555 questions,,
git,https://www.udemy.com/course/google-professional-machine-learning-engineer-certification-test/,https://img-c.udemycdn.com/course/240x135/6051553_556c_2.jpg,Algoholic.pro ™,Professional Machine Learning Engineer - 2025,Pass Google Machine Learning Engineer in 1 Attempt by mastering ML deployment and operations principles,3.5,7,All Levels,346 questions,,Current price: $49.99
git,https://www.udemy.com/course/google-professional-machine-learning-engineer-test/,https://img-c.udemycdn.com/course/240x135/5863408_5446.jpg,IT Education Hub,Google Professional Machine Learning Engineer Test 2025,Prepare for your Google Cloud Certified Professional Machine Learning Engineer certification exam (Verified QA),5.0,1,All Levels,175 questions,,
git,https://www.udemy.com/course/git-and-github-complete-guide/,https://img-c.udemycdn.com/course/240x135/2677498_6edb_18.jpg,"Bogdan Stashchuk | 300K Students Worldwide | MBA, PhD",The Complete Git Guide: Understand and master Git and GitHub,"Complete Git and GitHub guide (23 HOURS) - Master all Git features: commits, branches, merging, rebasing and squashing",4.6,4916,All Levels,293 lectures,23.5 total hours,
git,https://www.udemy.com/course/data-science-in-python-unsupervised-learning/,https://img-c.udemycdn.com/course/240x135/5930252_06be_6.jpg,"Maven Analytics • 1,500,000 Learners, Alice Zhao",Python Data Science: Unsupervised Machine Learning,"Learn Python for data science & machine learning, and build unsupervised learning models w/ a top Python instructor!",4.7,187,All Levels,202 lectures,17 total hours,Current price: $84.99
