skill,link,image_link,partner,title,course_description,rating,num_review,difficulty,num_lecture,duration,price
machine learning models,https://www.udemy.com/course/aws-certified-machine-learning-engineer-associate-mla-c01/,https://img-c.udemycdn.com/course/240x135/6125705_2219.jpg,"Sundog Education by Frank Kane, Stephane Maarek | AWS Certified Cloud Practitioner,Solutions Architect,Developer, Frank Kane",AWS Certified Machine Learning Engineer Associate: Hands On!,"Practice exam included! Master MLA-C01 / ME1-C01 AWS Machine Learning Engineer Exam: SageMaker, Bedrock, and AI Skills.",4.6,1747,All Levels,294 lectures,23.5 total hours,Current price: $89.99
machine learning models,https://www.udemy.com/course/complete-machine-learning-nlp-bootcamp-mlops-deployment/,https://img-c.udemycdn.com/course/240x135/5993822_2c2a_7.jpg,"Krish Naik, KRISHAI Technologies Private Limited","Complete Data Science,Machine Learning,DL,NLP Bootcamp","Master the theory, practice,and math behind Data Science,Machine Learning,Deep Learning,NLP with end to end projects",4.5,11296,All Levels,429 lectures,99 total hours,Current price: $94.99
machine learning models,https://www.udemy.com/course/aws-machine-learning/,https://img-c.udemycdn.com/course/240x135/2529790_a0c6_9.jpg,"Sundog Education by Frank Kane, Stephane Maarek | AWS Certified Cloud Practitioner,Solutions Architect,Developer, Frank Kane, Sundog Education Team",AWS Certified Machine Learning Specialty 2025 - Hands On!,"AWS machine learning certification preparation - learn SageMaker, generative AI, data engineering, modeling & more",4.6,15104,Intermediate,167 lectures,15 total hours,Current price: $119.99
machine learning models,https://www.udemy.com/course/practice-exams-aws-certified-machine-learning-engineer-associate/,https://img-c.udemycdn.com/course/240x135/6139021_a896.jpg,"Stephane Maarek | AWS Certified Cloud Practitioner,Solutions Architect,Developer, Abhishek Singh",Practice Exams: AWS Machine Learning Engineer Associate Cert,Prepare for AWS Certified Machine Learning Engineer Associate. 195 high-quality test questions and detailed explanations,4.6,306,All Levels,195 questions,,Current price: $64.99
machine learning models,https://www.udemy.com/course/google-certified-professional-machine-learning-engineer/,https://img-c.udemycdn.com/course/240x135/5211228_899a_3.jpg,Deepak Dubey,Google Certified Professional Machine Learning Engineer,"Master ML Algorithms, Data Modeling, TensorFlow & Google Cloud AI/ML Services. 137 Questions, Answers with Explanations",4.1,223,All Levels,63 lectures,16.5 total hours,Current price: $79.99
machine learning models,https://www.udemy.com/course/aws-certified-machine-learning-engineer-associate-mla-c01-exam-prep/,https://img-c.udemycdn.com/course/240x135/6188041_95ae.jpg,Nikolai Schuler,AWS Certified Machine Learning Engineer - Associate MLA-C01,The ONLY course you need to PASS the AWS Certified Machine Learning Engineer Exam | MLA-C01 | Incl. FULL Practice Exam!,4.6,263,All Levels,252 lectures,26.5 total hours,Current price: $89.99
machine learning models,https://www.udemy.com/course/complete-machine-learning-and-data-science-zero-to-mastery/,https://img-c.udemycdn.com/course/240x135/2511476_4e38_5.jpg,"Andrei Neagoie, Daniel Bourke","Complete A.I. & Machine Learning, Data Science Bootcamp","Learn Data Science, Data Analysis, Machine Learning (Artificial Intelligence) and Python with Tensorflow, Pandas & more!",4.6,26310,All Levels,384 lectures,44 total hours,Current price: $119.99
machine learning models,https://www.udemy.com/course/google-professional-machine-learning-gcp-practice-exams/,https://img-c.udemycdn.com/course/240x135/6399753_e170_2.jpg,Cloud Masters,Google Professional Machine Learning (GCP) | Practice Exams,"Master Google Cloud Professional Machine Learning Engineer certification : Real Exam Practice, Key Concepts in AI Models",5.0,1,All Levels,300 questions,,Current price: $44.99
machine learning models,https://www.udemy.com/course/google-cloud-machine-learning-engineer-certification-prep/,https://img-c.udemycdn.com/course/240x135/4878666_74ed_3.jpg,"Dan Sullivan, Dan Sullivan",Google Cloud Machine Learning Engineer Certification Prep,"Building, Deploying, and Managing Machine Learning Services at Scale",4.4,1213,All Levels,71 lectures,5.5 total hours,Current price: $69.99
machine learning models,https://www.udemy.com/course/machine-learning-for-beginners-build-and-train-an-ml-model/,https://img-c.udemycdn.com/course/240x135/6047333_7368.jpg,247 Learning,Machine Learning For Beginners: Build and Train an ML  Model,"A Step-by-Step Guide to Understanding, Building, and Evaluating Your First Machine Learning Model",4.5,27,Beginner,40 lectures,2.5 total hours,Current price: $19.99
machine learning models,https://www.udemy.com/course/deployment-of-machine-learning-models/,https://img-c.udemycdn.com/course/240x135/2158256_031a_6.jpg,"Soledad Galli, Christopher Samiullah, Train in Data Team",Deployment of Machine Learning Models,Learn how to integrate robust and reliable Machine Learning Pipelines in Production,4.1,5773,Intermediate,150 lectures,10.5 total hours,Current price: $99.99
machine learning models,https://www.udemy.com/course/data-science-in-python-unsupervised-learning/,https://img-c.udemycdn.com/course/240x135/5930252_06be_6.jpg,"Maven Analytics • 1,500,000 Learners, Alice Zhao",Python Data Science: Unsupervised Machine Learning,"Learn Python for data science & machine learning, and build unsupervised learning models w/ a top Python instructor!",4.7,187,All Levels,202 lectures,17 total hours,Current price: $84.99
machine learning models,https://www.udemy.com/course/machine-learning-practical-course-build-real-world-projects/,https://img-c.udemycdn.com/course/240x135/4889890_25b4_2.jpg,The Machine Learning,Machine Learning Practical Course: Build 30 Projects,Learn To Build Machine Learning Projects Practically,4.5,48,All Levels,173 lectures,19.5 total hours,Current price: $54.99
machine learning models,https://www.udemy.com/course/machine-learning-models-ai-testing/,https://img-c.udemycdn.com/course/240x135/6189991_7242_4.jpg,Rahul Shetty,Introduction to Machine Learning Models (AI) Testing,"From Scratch, Learn testing types and Strategies involved in all the phases of ML Models (AI) with real time examples",4.5,625,All Levels,39 lectures,5 total hours,Current price: $79.99
machine learning models,https://www.udemy.com/course/become-machine-learning-engineer/,https://img-c.udemycdn.com/course/240x135/6171287_8306_3.jpg,Data Marathon,Become Machine Learning Engineer,"Master machine learning algorithms, data preprocessing, and real-world model deployment with Python and essential tools.",5.0,4,All Levels,17 lectures,3 total hours,Current price: $39.99
machine learning models,https://www.udemy.com/course/machinelearning/,https://img-c.udemycdn.com/course/240x135/950390_270f_3.jpg,"Kirill Eremenko, Hadelin de Ponteves, SuperDataScience Team, Ligency Team","Machine Learning A-Z: AI, Python & R + ChatGPT Prize [2025]",Learn to create Machine Learning Algorithms in Python and R from two Data Science experts. Code templates included.,4.5,195572,All Levels,386 lectures,43 total hours,Current price: $149.99
machine learning models,https://www.udemy.com/course/machine-learning-model-deployment-with-streamlit/,https://img-c.udemycdn.com/course/240x135/5326624_fdd2_2.jpg,Marco Peixeiro,Machine Learning Model Deployment with Streamlit,Deploy ML models with Streamlit and share your data science work with the world,4.7,512,Intermediate,44 lectures,7 total hours,Current price: $79.99
machine learning models,https://www.udemy.com/course/machine-learning-using-azureml/,https://img-c.udemycdn.com/course/240x135/1088256_077d_2.jpg,"Jitesh Khurkhuriya, Python, Data Science & Machine Learning A-Z Team",DP-100: A-Z Machine Learning using Azure Machine Learning,Microsoft Azure DP-100: Designing and Implementing a Data Science Solution Exam Covered. Learn Azure Machine Learning,4.4,7796,All Levels,230 lectures,26.5 total hours,Current price: $124.99
machine learning models,https://www.udemy.com/course/introduction-to-machine-learning-in-python/,https://img-c.udemycdn.com/course/240x135/617930_44e3_2.jpg,Holczer Balazs,Machine Learning and Deep Learning Bootcamp in Python,"Machine Learning, Neural Networks, Deep Learning and Reinforcement Learning, GAN in Keras and TensorFlow",4.4,1533,All Levels,311 lectures,31.5 total hours,Current price: $129.99
machine learning models,https://www.udemy.com/course/machine-learning-with-projects-on-retail-marketing-analytics/,https://img-c.udemycdn.com/course/240x135/3751642_8d21_4.jpg,Machine Learning Express,Master Marketing Analytics with Python and Machine Learning,Level up your marketing career with data analytics skills | Learn Python & ML to optimize your marketing campaigns,4.5,85,Intermediate,145 lectures,25.5 total hours,Current price: $69.99
