skill,link,image_link,partner,title,course_description,rating,num_review,difficulty,num_lecture,duration,price
docker,https://www.udemy.com/course/docker-tutorial/,https://img-c.udemycdn.com/course/240x135/2469322_66a1_5.jpg,Jason Cannon,Docker: A Project-Based Approach to Learning,Learn how to manage Docker hosts and Docker containers through project-based training.,4.5,2659,All Levels,35 lectures,4.5 total hours,Current price: $79.99
docker,https://www.udemy.com/course/docker-kubernetes-the-practical-guide/,https://img-c.udemycdn.com/course/240x135/3490000_d298_2.jpg,"Academind by Maximilian Schwarzmüller, Maximilian Schwarzmüller",Docker & Kubernetes: The Practical Guide [2025 Edition],"Learn Docker, Docker Compose, Multi-Container Projects, Deployment and all about Kubernetes from the ground up!",4.7,32379,All Levels,264 lectures,23.5 total hours,Current price: $149.99
docker,https://www.udemy.com/course/docker-mastery/,https://img-c.udemycdn.com/course/240x135/1035000_c1aa_8.jpg,"Bret Fisher, Docker Captain Program",Docker Mastery: with Kubernetes +Swarm from a Docker Captain,"Build, test, deploy containers with the best mega-course on Docker, Kubernetes, Compose, GitHub Actions CI using DevOps",4.6,64655,All Levels,225 lectures,23 total hours,Current price: $109.99
docker,https://www.udemy.com/course/docker-and-kubernetes-the-complete-guide/,https://img-c.udemycdn.com/course/240x135/1793828_7999_2.jpg,Stephen Grider,Docker and Kubernetes: The Complete Guide,"Build, test, and deploy Docker applications with Kubernetes while learning production-style development workflows",4.7,60329,All Levels,316 lectures,22 total hours,Current price: $124.99
docker,https://www.udemy.com/course/the-project-management-course-beginner-to-project-manager/,https://img-c.udemycdn.com/course/240x135/1978132_e90d_5.jpg,365 Careers,The Project Management Course: Beginner to PROject Manager,The Complete Course For Becoming A Successful Project Manager,4.6,74024,All Levels,109 lectures,8 total hours,Current price: $119.99
docker,https://www.udemy.com/course/docker-deployment/,https://img-c.udemycdn.com/course/240x135/5884390_5ed7.jpg,"Jannis Seemann, Andreas Kansy","Docker, Kubernetes & AWS: Real-World Deployment in 25 Days","Build and deploy applications from scratch with Docker, Kubernetes & AWS. The step-by-step guide from Beginner to Pro.",4.7,227,Beginner,332 lectures,32 total hours,Current price: $89.99
docker,https://www.udemy.com/course/docker-and-docker-compose-project-deployment-from-scratch/,https://img-c.udemycdn.com/course/240x135/3156206_12a0_4.jpg,Oleksandr Kocherhin,Project in Docker | Docker Basics - Microservices,[Docker Endorsed] Learn microservices and Docker Basics and build project in Docker with Docker Compose,4.6,218,All Levels,31 lectures,4.5 total hours,Current price: $49.99
docker,https://www.udemy.com/course/docker-mastery-for-nodejs/,https://img-c.udemycdn.com/course/240x135/1927496_db13_3.jpg,"Bret Fisher, Docker Captain Program",Docker for Node.js Projects From a Docker Captain,"Build advanced Node images for use in dev, test, and prod with the latest DevOps practices from a container expert",4.6,1492,Intermediate,84 lectures,8.5 total hours,Current price: $84.99
docker,https://www.udemy.com/course/docker-in-a-weekend-40-practical-demos-for-devops-learners/,https://img-c.udemycdn.com/course/240x135/6266585_9f1e_9.jpg,"Kalyan Reddy Daida | DevOps & SRE Architect on AWS, Azure & Google Cloud Platforms",Docker in a Weekend: 40 Practical Demos for DevOps Learners,"Master Dockerfiles, Docker Build, Docker Compose, Multi-Container Apps, and Multi-Stage Builds with 40 Practical Demos",4.7,197,All Levels,90 lectures,10 total hours,Current price: $84.99
docker,https://www.udemy.com/course/hands-on-with-docker-and-docker-compose/,https://img-c.udemycdn.com/course/240x135/1359020_5426.jpg,"Nick Janetakis, Docker Captain Program",Hands on With Docker & Docker Compose From a Docker Captain,"v19.03. Everything you need to build, run and compose Docker containers so you can start using Docker for your web apps.",4.6,793,Beginner,51 lectures,5 total hours,Current price: $54.99
docker,https://www.udemy.com/course/diveintodocker/,https://img-c.udemycdn.com/course/240x135/5740444_8af0_4.jpg,"James Spurin (Docker Captain / CNCF Ambassador / Kubestronaut), DiveInto Training","Docker Introduction - Docker, Containers & DevOps - Hands On","Beginner-Friendly Guide to Docker, Docker Desktop, DevOps + More with a Docker Captain, Kubestronaut and CNCF Ambassador",4.6,173,Beginner,23 lectures,1.5 total hours,Current price: $69.99
docker,https://www.udemy.com/course/complete-docker-kubernetes/,https://img-c.udemycdn.com/course/240x135/5967966_849d.jpg,Lauro Fialho Müller,Docker and Kubernetes: The Complete Course from Zero to Hero,"30+ hours of content and 130+ hands-on labs for you to master working with Docker, Kubernetes, and Kustomize!",4.8,342,Beginner,299 lectures,33 total hours,Current price: $94.99
docker,https://www.udemy.com/course/decodingdevops/,https://img-c.udemycdn.com/course/240x135/4039556_ebb3_9.jpg,Imran Teli,DevOps Beginners to Advanced with Projects,"Begin Your DevOps Career As a Newbie | AWS, Linux, Scripting, Jenkins, Ansible, GitOps, Docker, Kubernetes, & Terraform.",4.6,36463,All Levels,318 lectures,53 total hours,Current price: $119.99
docker,https://www.udemy.com/course/devopsprojects/,https://img-c.udemycdn.com/course/240x135/3710504_9b6d_9.jpg,Imran Teli,DevOps Projects | Real Time DevOps & GitOps Projects,Master Your DevOps Skills with Real challenge,4.7,3409,Intermediate,218 lectures,33.5 total hours,Current price: $89.99
docker,https://www.udemy.com/course/master-docker-kubernetes/,https://img-c.udemycdn.com/course/240x135/5663854_eb19_5.jpg,Visualpath Pvt Ltd,Master Docker & Kubernetes,This course helps to understand core concepts of Containerization technology | Docker Tools | Kubernetes Orchestration,4.6,204,All Levels,371 lectures,64.5 total hours,Current price: $19.99
docker,https://www.udemy.com/course/learn-docker/,https://img-c.udemycdn.com/course/240x135/1332278_4ea6_6.jpg,"Mumshad Mannambeth, KodeKloud Training",Docker for the Absolute Beginner - Hands On - DevOps,Learn Docker with Hands On Coding Exercises. For beginners in DevOps,4.6,62838,Beginner,54 lectures,4.5 total hours,Current price: $174.99
docker,https://www.udemy.com/course/docker-bootcamp-conquer-docker-with-real-world-projects/,https://img-c.udemycdn.com/course/240x135/5868712_8eec_5.jpg,"Jose Portilla, Rayan Slim, Learn The Part Inc., Pierian Training, Jad Slim, Amer Abdulkader, Sarmad Tanveer",Docker Training: Learn Docker from Zero to Cloud,"Containerize Apps, Manage Microservices, and Deploy to the Cloud with Docker!",4.7,203,All Levels,33 lectures,5.5 total hours,Current price: $79.99
docker,https://www.udemy.com/course/what-is-docker-step-by-step-for-beginners/,https://img-c.udemycdn.com/course/240x135/1644560_825d_4.jpg,Raghav Pal,DOCKER | Step by Step for Beginners | with Sample Project,Docker from scratch,4.4,557,All Levels,23 lectures,5 total hours,Current price: $64.99
docker,https://www.udemy.com/course/a-project-management-course-becoming-a-project-manager/,https://img-c.udemycdn.com/course/240x135/6049011_94c0_2.jpg,Providence Essien,A project management course: Becoming a PROject Manager,The Complete Course you need to Becoming a Successful PROject Manager,4.7,200,All Levels,10 lectures,1.5 total hours,Current price: $19.99
docker,https://www.udemy.com/course/project-management-with-gen-ai-a-guide-for-project-managers/,https://img-c.udemycdn.com/course/240x135/6488353_f0c1.jpg,AI MENTOR,Project Management with Gen AI: A Guide for Project Managers,"Learn Project Management with Generative AI to optimize workflows, automate tasks & drive Success in Project Management",4.5,90,All Levels,17 lectures,2 total hours,Current price: $44.99
