skill,link,image_link,partner,title,course_description,rating,num_review,difficulty,num_lecture,duration,price
ssis,https://www.udemy.com/course/the-project-management-course-beginner-to-project-manager/,https://img-c.udemycdn.com/course/240x135/1978132_e90d_5.jpg,365 Careers,The Project Management Course: Beginner to PROject Manager,The Complete Course For Becoming A Successful Project Manager,4.6,74024,All Levels,109 lectures,8 total hours,Current price: $119.99
ssis,https://www.udemy.com/course/masteringssis2016/,https://img-c.udemycdn.com/course/240x135/1061212_2a4e_2.jpg,Kameswara Sarma Uppuluri | 25+ Years Of Experienced Corporate Trainer,Mastering SQL Server 2016 Integration Services (SSIS)-Part 1,Learn How to Create SSIS Packages From Scratch Step By Step for SQL Server 2016/2019/2022,4.6,7910,All Levels,100 lectures,11 total hours,Current price: $79.99
ssis,https://www.udemy.com/course/sql-server-ssis-an-introduction/,https://img-c.udemycdn.com/course/240x135/905246_ef52_5.jpg,"Phillip Burton • 880000+ students so far, I Do Data Limited",SQL Server Integration Services (SSIS) - An Introduction,Learn the basics of SQL Server Integration Services (SSIS) - with Practical Activities.,4.5,9762,Beginner,52 lectures,4 total hours,Current price: $89.99
ssis,https://www.udemy.com/course/ssis-training/,https://img-c.udemycdn.com/course/240x135/2862130_cc65_2.jpg,Vikas Munjal,SSIS Real World Scenarios & Projects : Tricks of the Trade,Learn Microsoft Business Intelligence SQL SSIS Tools & Package with ETL in Data Warehouse Step by Step via SSDT in MSBI,4.5,367,Intermediate,32 lectures,6.5 total hours,Current price: $59.99
ssis,https://www.udemy.com/course/project-management-with-gen-ai-a-guide-for-project-managers/,https://img-c.udemycdn.com/course/240x135/6488353_f0c1.jpg,AI MENTOR,Project Management with Gen AI: A Guide for Project Managers,"Learn Project Management with Generative AI to optimize workflows, automate tasks & drive Success in Project Management",4.5,90,All Levels,17 lectures,2 total hours,Current price: $44.99
ssis,https://www.udemy.com/course/artificial-intelligence-for-project-managers/,https://img-c.udemycdn.com/course/240x135/6219365_0e77.jpg,"Cornelius Fichtner, PMP, CSM",Artificial Intelligence for Project Managers,Transform into an AI-empowered Project Manager and elevate your projects,4.3,32,Intermediate,24 lectures,14.5 total hours,Current price: $79.99
ssis,https://www.udemy.com/course/a-project-management-course-becoming-a-project-manager/,https://img-c.udemycdn.com/course/240x135/6049011_94c0_2.jpg,Providence Essien,A project management course: Becoming a PROject Manager,The Complete Course you need to Becoming a Successful PROject Manager,4.7,200,All Levels,10 lectures,1.5 total hours,Current price: $19.99
ssis,https://www.udemy.com/course/etl-developer-mysql-data-migration-ms-sql-server-ssis/,https://img-c.udemycdn.com/course/240x135/5423598_75aa.jpg,Bluelime Learning Solutions,"ETL Developer - (MySQL, Data Migration ,MS SQL Server, SSIS)","Harnessing Data Power: ETL Development and Data Migration with MySQL, MS SQL Server",4.8,17,Beginner,118 lectures,8.5 total hours,Current price: $34.99
ssis,https://www.udemy.com/course/project-management-mastery/,https://img-c.udemycdn.com/course/240x135/1918248_ad2f.jpg,Chris Croft,Project Management for Non Project Managers - PMP/PMI,Project Management practical guide for all industries,4.6,14699,All Levels,29 lectures,2.5 total hours,Current price: $109.99
ssis,https://www.udemy.com/course/project-management-with-chatgpt/,https://img-c.udemycdn.com/course/240x135/5534098_a35c_5.jpg,Tobias Becker,Project Management with ChatGPT: AI for Project Managers,Master Modern Project Management with AI. A Comprehensive Guide to Use Chat GPT for Project Managers (+ 42 Prompts),4.4,4678,Beginner,29 lectures,2.5 total hours,Current price: $19.99
ssis,https://www.udemy.com/course/project-management-skills-for-successful-project-managers/,https://img-c.udemycdn.com/course/240x135/6222223_e2aa.jpg,Fahad Virk,Project Management Skills for Successful Project Managers,"Learn to Analyze, Plan & Execute Projects to Achieve Company Objectives & Master Project Management Skills for Managers.",4.4,4,All Levels,15 lectures,1.5 total hours,Current price: $44.99
ssis,https://www.udemy.com/course/msbi-ssis-ssas-ssrs/,https://img-c.udemycdn.com/course/240x135/2046188_9f33_5.jpg,Shivprasad Koirala,"Learn MSBI , SSIS , SSRS and SSAS Step by Step","This course teaches you MSBI   from basic level to advanced level . Covers all 3 concepts SSIS , SSAS and SSRS.",4.4,4432,Beginner,47 lectures,23 total hours,Current price: $79.99
ssis,https://www.udemy.com/course/microsoft-business-intelligence-tools-ssisssrsssasbi/,https://img-c.udemycdn.com/course/240x135/4616774_f482.jpg,Bluelime Learning Solutions,"Microsoft  Business Intelligence Tools: SSIS,SSRS,SSAS,BI",Make Data-Driven Decisions using Microsoft  Business Intelligence Tools:  SQL Server | SSIS | SSRS | SSAS | Power BI,3.9,44,Beginner,93 lectures,7 total hours,Current price: $54.99
ssis,https://www.udemy.com/course/sql-srver-integration-servicesssis/,https://img-c.udemycdn.com/course/240x135/4088500_dd5e.jpg,VenkatM M,SQL Server Integration Services(SSIS),SSIS Basics to Advanced Concepts,4.0,74,All Levels,18 lectures,3 total hours,Current price: $54.99
ssis,https://www.udemy.com/course/masteringssis2016part2/,https://img-c.udemycdn.com/course/240x135/2597238_44cc_4.jpg,Kameswara Sarma Uppuluri | 25+ Years Of Experienced Corporate Trainer,Mastering SQL Server 2016 Integration Services (SSIS)-Part 2,Learn How to Create SSIS Packages From Scratch Step By Step for SQL Server 2016/2019/2022,4.5,1306,All Levels,89 lectures,13.5 total hours,Current price: $69.99
ssis,https://www.udemy.com/course/database-developer-mssql-ssrs-ssis/,https://img-c.udemycdn.com/course/240x135/5510558_ab6d.jpg,Bluelime Learning Solutions,"Database Developer (MSSQL, SSRS, & SSIS)","Mastering Data Management and Integration: Database Developer Proficiency in MSSQL, SSRS, & SSIS",4.3,12,Beginner,75 lectures,6 total hours,Current price: $19.99
ssis,https://www.udemy.com/course/microsoft-project-tutorial/,https://img-c.udemycdn.com/course/240x135/831116_92e7_2.jpg,Srikanth Shirodkar,Microsoft Project ALL: BEGINNER to EXPERT 10 Projects 9 PDU,Learn MS Project all version HANDS-ON with COMPLETE real life examples BONUS 125 project files FREE PMI approved 9 PDUs,4.6,21952,All Levels,139 lectures,10.5 total hours,Current price: $124.99
ssis,https://www.udemy.com/course/project-management-ready-becoming-a-project-manager-in-2024/,https://img-c.udemycdn.com/course/240x135/5698496_d3b8_2.jpg,Ivy Lewis,Project Management Ready - Becoming a Project Manager,Step by step actionable guide to transform your skills and experiences to become a project manager,4.8,13,Beginner,31 lectures,5.5 total hours,Current price: $19.99
ssis,https://www.udemy.com/course/atlassian-confluence-training-project-management/,https://img-c.udemycdn.com/course/240x135/2573662_3be7_2.jpg,Andy Makar,Atlassian Confluence for Project Managers,Learn Confluence Project Management and how to manage projects and programs BETTER with Atlassian Confluence,4.5,4140,All Levels,38 lectures,3 total hours,Current price: $69.99
ssis,https://www.udemy.com/course/ssis-real-time-scenarios-implementation/,https://img-c.udemycdn.com/course/240x135/3416402_6283_5.jpg,Om Shakya,Microsoft SSIS Real-time Scenarios (Package Design),Implementing SSIS (SQL Server Integration Services) or ETL real-time use cases and scenarios,3.3,30,All Levels,52 lectures,6 total hours,Current price: $29.99
