skill,link,image_link,partner,title,course_description,rating,num_review,difficulty,num_lecture,duration,price
agile methodologies,https://www.udemy.com/course/production-site-reliability-engineer/,https://img-c.udemycdn.com/course/240x135/3531340_3cd0_2.jpg,Nidhi Singh,Production Support - Site Reliability Engineer,Job of SRE in DevOps,4.5,2087,Beginner,95 lectures,7 total hours,Current price: $59.99
agile methodologies,https://www.udemy.com/course/sre-fundamentals-mastering-site-reliability-engineering/,https://img-c.udemycdn.com/course/240x135/5481794_d3c4_2.jpg,Douglas Mugnos,SRE Fundamentals: Mastering Site Reliability Engineering,Empower Your Team: Embrace SRE Fundamentals for Unparalleled Reliability and Efficiency,4.4,2058,All Levels,35 lectures,4 total hours,Current price: $19.99
agile methodologies,https://www.udemy.com/course/from-zero-to-site-reliability-engineer/,https://img-c.udemycdn.com/course/240x135/5901296_0671.jpg,Philip Afable,From Zero to Site Reliability Engineer,Learn About the SRE Workflow,4.2,20,Intermediate,24 lectures,3 total hours,Current price: $69.99
agile methodologies,https://www.udemy.com/course/site-reliability-engineer-sre-150-unique-interview-questions/,https://img-c.udemycdn.com/course/240x135/5366082_0865.jpg,Mustafa Erdinç ZORBA,150 Unique Site Reliability Engineer SRE Interview Questions,Master SRE Concepts: Real-World Scenarios In-Depth Interview Preparation Guide with Answers and Explanations!,4.2,28,All Levels,150 questions,,Current price: $69.99
agile methodologies,https://www.udemy.com/course/introduction-to-reliability-maintainability-availability/,https://img-c.udemycdn.com/course/240x135/4448412_a4b3_3.jpg,Christopher Olson,"Introduction to Reliability, Maintainability & Availability",A solid foundation for Project Managers & Systems Engineers,4.6,742,Beginner,85 lectures,7 total hours,Current price: $69.99
agile methodologies,https://www.udemy.com/course/site-reliability-engineering-on-aws/,https://img-c.udemycdn.com/course/240x135/3287718_5368_2.jpg,Packt Publishing,Site Reliability Engineering on AWS,Implement a reliable application architecture using the patterns and best practices recommended by AWS.,4.1,224,Beginner,37 lectures,4.5 total hours,Current price: $54.99
agile methodologies,https://www.udemy.com/course/mastering-asq-certified-reliability-engineer-exam/,https://img-c.udemycdn.com/course/240x135/5663722_5b5f_4.jpg,AERP Engineering,Mastering Certified Reliability Engineer Exam - Vol 1,This course has been meticulously designed to aid individuals preparing for the Certified Reliability Engineer exam.,4.2,12,Intermediate,856 questions,,Current price: $19.99
agile methodologies,https://www.udemy.com/course/project-management-methodologies-agile-scrum-and-pmp/,https://img-c.udemycdn.com/course/240x135/6362573_2f2e.jpg,"MTF Institute of Management, Technology and Finance","Project Management Methodologies: Agile, Scrum, and PMP","Comparing: Project Management, Agile, Scrum, Project Management Professional (PMP) Methodology, Kanban, Lean and tools",4.4,137,All Levels,15 lectures,1.5 total hours,Current price: $44.99
agile methodologies,https://www.udemy.com/course/scaled-agile-framework-safe-scaling-agile-scrum-to-safe/,https://img-c.udemycdn.com/course/240x135/4852986_56bc_9.jpg,Mohammad N. Khan - SAFe Trainer (SPC),Scaled Agile Framework® (Latest SAFe® 6.0) : In-Depth,"Agile/Scrum, SAFe® 6.0- Scaled Agile Framework®, Rally Project Management Tool, SAFe SSM, POPM free practice test link",4.3,5092,All Levels,81 lectures,9 total hours,Current price: $74.99
agile methodologies,https://www.udemy.com/course/introduction-to-agile-methodology-t/,https://img-c.udemycdn.com/course/240x135/5155318_77dc_2.jpg,Master Easily,Introduction to Agile methodology,"Agile methodology, a project management approach that prioritizes flexibility, collaboration, and customer satisfaction.",3.9,11,All Levels,7 lectures,,Current price: $29.99
agile methodologies,https://www.udemy.com/course/scrum-course-udemy/,https://img-c.udemycdn.com/course/240x135/2002862_aa45_5.jpg,"YESI EDUCATION, Mauricio Rubio - Agile Guru & Founder of YESI EDUCATION, AgileKB & Grabdl",The Complete Agile Scrum Fundamentals Course + Certification,"Agile Scrum from A to Z: Scrum a Project Management methodology, Scrum Fundamentals, Scrum concepts, Agile Scrum tools",4.6,19628,Beginner,107 lectures,15 total hours,Current price: $139.99
agile methodologies,https://www.udemy.com/course/reliability-engineering-statistics/,https://img-c.udemycdn.com/course/240x135/4308267_bdea.jpg,"Ray Harkins, The Manufacturing Academy, Michael J. Vella",Reliability Engineering Statistics (2025),"Master the Statistical Tools to Optimize Reliability, Minimize Failures, and Drive Performance in Engineering",4.4,633,All Levels,123 lectures,9 total hours,Current price: $84.99
agile methodologies,https://www.udemy.com/course/master-certified-maintenance-reliability-professional-cmrp/,https://img-c.udemycdn.com/course/240x135/6467193_0ba3.jpg,Kareem Ullah,Master Certified Maintenance & Reliability Professional CMRP,"CMRP Certification Bootcamp: Strategies for Maintenance & Reliability Success, CMRP Exam Prep, Best Practices and Tips.",4.7,53,All Levels,25 lectures,2.5 total hours,Current price: $44.99
agile methodologies,https://www.udemy.com/course/site-reliability-engineering-mastering-slo-and-error-budget/,https://img-c.udemycdn.com/course/240x135/5842894_7ad8.jpg,Junior Mayhé,Site Reliability Engineering: Mastering SLO and Error Budget,"SRE core concepts of Non-Functional Requirements, Reliability, Business Flows, SLI, SLO, Error Budget, and more.",4.4,29,Beginner,27 lectures,,Current price: $39.99
agile methodologies,https://www.udemy.com/course/agile-scrum-for-beginners-scrum-master-certification-preparation/,https://img-c.udemycdn.com/course/240x135/1850902_6c52_6.jpg,"Valentin Despa, Valentin Despa - Support",Agile Scrum for Beginners + Scrum Master Certification Prep,"[UNOFFICIAL] Learn Scrum, understand the Agile principles + prepare for your Agile/Scrum Master certification in 2025",4.7,26066,All Levels,134 lectures,14.5 total hours,Current price: $109.99
agile methodologies,https://www.udemy.com/course/an-introduction-to-reliability-engineering/,https://img-c.udemycdn.com/course/240x135/2513962_7e40_4.jpg,"Ray Harkins, The Manufacturing Academy",An Introduction to Reliability Engineering,A Study of Why Things Fail and How to Measure and Improve their Useful Life,4.4,3367,All Levels,39 lectures,5 total hours,Current price: $84.99
agile methodologies,https://www.udemy.com/course/agile-crash-course/,https://img-c.udemycdn.com/course/240x135/864146_dbd7_11.jpg,"YESI EDUCATION, Mauricio Rubio - Agile Guru & Founder of YESI EDUCATION, AgileKB & Grabdl",Agile Crash Course: Agile Project Management; Agile Delivery,"Agile Project Management Basics (Scrum), Agile Project Management Essentials (Scrum). Plus Agile Certification (Scrum)",4.5,93117,Beginner,26 lectures,3 total hours,Current price: $174.99
agile methodologies,https://www.udemy.com/course/advanced-agile-product-management/,https://img-c.udemycdn.com/course/240x135/3965358_e01a_4.jpg,Institute of Product Leadership,Advanced Product Management - Agile Methodologies,"Fast Track your Product Management career. Learn, practice and develop the Agile Mindset.",4.4,313,Beginner,56 lectures,5.5 total hours,Current price: $59.99
agile methodologies,https://www.udemy.com/course/the-agile-methodology-for-project-risk-managers/,https://img-c.udemycdn.com/course/240x135/1559988_e2af.jpg,Sorin Dumitrascu,The Agile Methodology for Project Risk Managers,The Agile Project Management and Risk Management for Project Professionals Full Course,4.3,369,All Levels,278 lectures,31.5 total hours,Current price: $69.99
agile methodologies,https://www.udemy.com/course/fundamentals-of-reliability-engineering/,https://img-c.udemycdn.com/course/240x135/4901284_2632_3.jpg,"Sandeep Kumar, ­ Quality Gurus Inc.",Fundamentals of Reliability Engineering (Accredited),Gain Insight into the Basics of Reliability Engineering for CRE or CMRP Certification - Get 2.5 PMI PDUs and SHRM PDCs,4.2,391,Beginner,34 lectures,2.5 total hours,Current price: $74.99
