skill,link,image_link,partner,title,course_description,rating,num_review,difficulty,num_lecture,duration,price
scripting languages,https://www.udemy.com/course/production-site-reliability-engineer/,https://img-c.udemycdn.com/course/240x135/3531340_3cd0_2.jpg,Nidhi Singh,Production Support - Site Reliability Engineer,Job of SRE in DevOps,4.5,2087,Beginner,95 lectures,7 total hours,Current price: $59.99
scripting languages,https://www.udemy.com/course/sre-fundamentals-mastering-site-reliability-engineering/,https://img-c.udemycdn.com/course/240x135/5481794_d3c4_2.jpg,Douglas Mugnos,SRE Fundamentals: Mastering Site Reliability Engineering,Empower Your Team: Embrace SRE Fundamentals for Unparalleled Reliability and Efficiency,4.4,2058,All Levels,35 lectures,4 total hours,Current price: $19.99
scripting languages,https://www.udemy.com/course/from-zero-to-site-reliability-engineer/,https://img-c.udemycdn.com/course/240x135/5901296_0671.jpg,Philip Afable,From Zero to Site Reliability Engineer,Learn About the SRE Workflow,4.2,20,Intermediate,24 lectures,3 total hours,Current price: $69.99
scripting languages,https://www.udemy.com/course/site-reliability-engineer-sre-150-unique-interview-questions/,https://img-c.udemycdn.com/course/240x135/5366082_0865.jpg,Mustafa Erdinç ZORBA,150 Unique Site Reliability Engineer SRE Interview Questions,Master SRE Concepts: Real-World Scenarios In-Depth Interview Preparation Guide with Answers and Explanations!,4.2,28,All Levels,150 questions,,Current price: $69.99
scripting languages,https://www.udemy.com/course/site-reliability-engineering-on-aws/,https://img-c.udemycdn.com/course/240x135/3287718_5368_2.jpg,Packt Publishing,Site Reliability Engineering on AWS,Implement a reliable application architecture using the patterns and best practices recommended by AWS.,4.1,224,Beginner,37 lectures,4.5 total hours,Current price: $54.99
scripting languages,https://www.udemy.com/course/the-ai-engineer-course-complete-ai-engineer-bootcamp/,https://img-c.udemycdn.com/course/240x135/6112535_7103.jpg,365 Careers,The AI Engineer Course 2025: Complete AI Engineer Bootcamp,"Complete AI Engineer Training: Python, NLP, Transformers, LLMs, LangChain, Hugging Face, APIs",4.6,2803,All Levels,367 lectures,24.5 total hours,Current price: $89.99
scripting languages,https://www.udemy.com/course/introduction-to-reliability-maintainability-availability/,https://img-c.udemycdn.com/course/240x135/4448412_a4b3_3.jpg,Christopher Olson,"Introduction to Reliability, Maintainability & Availability",A solid foundation for Project Managers & Systems Engineers,4.6,742,Beginner,85 lectures,7 total hours,Current price: $69.99
scripting languages,https://www.udemy.com/course/mastering-asq-certified-reliability-engineer-exam/,https://img-c.udemycdn.com/course/240x135/5663722_5b5f_4.jpg,AERP Engineering,Mastering Certified Reliability Engineer Exam - Vol 1,This course has been meticulously designed to aid individuals preparing for the Certified Reliability Engineer exam.,4.2,12,Intermediate,856 questions,,Current price: $19.99
scripting languages,https://www.udemy.com/course/reliability-engineering-statistics/,https://img-c.udemycdn.com/course/240x135/4308267_bdea.jpg,"Ray Harkins, The Manufacturing Academy, Michael J. Vella",Reliability Engineering Statistics (2025),"Master the Statistical Tools to Optimize Reliability, Minimize Failures, and Drive Performance in Engineering",4.4,633,All Levels,123 lectures,9 total hours,Current price: $84.99
scripting languages,https://www.udemy.com/course/an-introduction-to-reliability-engineering/,https://img-c.udemycdn.com/course/240x135/2513962_7e40_4.jpg,"Ray Harkins, The Manufacturing Academy",An Introduction to Reliability Engineering,A Study of Why Things Fail and How to Measure and Improve their Useful Life,4.4,3367,All Levels,39 lectures,5 total hours,Current price: $84.99
scripting languages,https://www.udemy.com/course/linux-shell-scripting-projects/,https://img-c.udemycdn.com/course/240x135/1349660_ecfb_4.jpg,Jason Cannon,Linux Shell Scripting: A Project-Based Approach to Learning,"Learn how to shell script through project-based training (Bash Scripting, Bash Programming, Sed, Grep, Awk, and More)",4.5,14948,All Levels,49 lectures,12.5 total hours,Current price: $119.99
scripting languages,https://www.udemy.com/course/site-reliability-engineering-mastering-slo-and-error-budget/,https://img-c.udemycdn.com/course/240x135/5842894_7ad8.jpg,Junior Mayhé,Site Reliability Engineering: Mastering SLO and Error Budget,"SRE core concepts of Non-Functional Requirements, Reliability, Business Flows, SLI, SLO, Error Budget, and more.",4.4,29,Beginner,27 lectures,,Current price: $39.99
scripting languages,https://www.udemy.com/course/master-certified-maintenance-reliability-professional-cmrp/,https://img-c.udemycdn.com/course/240x135/6467193_0ba3.jpg,Kareem Ullah,Master Certified Maintenance & Reliability Professional CMRP,"CMRP Certification Bootcamp: Strategies for Maintenance & Reliability Success, CMRP Exam Prep, Best Practices and Tips.",4.7,53,All Levels,25 lectures,2.5 total hours,Current price: $44.99
scripting languages,https://www.udemy.com/course/linux-bash-shell-scripting-through-real-life-examples/,https://img-c.udemycdn.com/course/240x135/1585444_e4de_6.jpg,Imran Afzal,Complete Linux Bash Shell Scripting with Real Life Examples,Shell Scripting and Programming for Daily Tedious Tasks Automation (Scripting is required for RHCSA certification),4.5,4383,All Levels,87 lectures,14.5 total hours,Current price: $99.99
scripting languages,https://www.udemy.com/course/powershell-from-beginner-to-sheller-and-scripter/,https://img-c.udemycdn.com/course/240x135/979510_95e0.jpg,David Fitzpatrick,PowerShell  from Beginner To Sheller And Scripter,Learn how to use PowerShell the easy way,4.7,2174,Beginner,115 lectures,11.5 total hours,Current price: $99.99
scripting languages,https://www.udemy.com/course/bash-mastery/,https://img-c.udemycdn.com/course/240x135/2997494_0cc5_2.jpg,"Ziyad Yehia, Internet of Things Academy",Bash Mastery: The Complete Guide to Bash Shell Scripting,"Master Bash Shell Scripting to Automate Tasks, Save Time, and Boost Your Career. Practical Projects + All Code Included.",4.8,3906,All Levels,111 lectures,12 total hours,Current price: $84.99
scripting languages,https://www.udemy.com/course/fundamentals-of-reliability-engineering/,https://img-c.udemycdn.com/course/240x135/4901284_2632_3.jpg,"Sandeep Kumar, ­ Quality Gurus Inc.",Fundamentals of Reliability Engineering (Accredited),Gain Insight into the Basics of Reliability Engineering for CRE or CMRP Certification - Get 2.5 PMI PDUs and SHRM PDCs,4.2,391,Beginner,34 lectures,2.5 total hours,Current price: $74.99
scripting languages,https://www.udemy.com/course/fast-track-to-shell-scripting-for-linux-admins/,https://img-c.udemycdn.com/course/240x135/5385340_7906_2.jpg,"Mo Khalil, Muhammed Torkey, Cloudsark",Linux Bash Shell Scripting for Beginners,"Learn Linux Bash Shell Scripting fast! Simple, beginner-friendly Linux shell scripting lessons to get you started.",4.2,19,All Levels,39 lectures,2.5 total hours,Current price: $54.99
scripting languages,https://www.udemy.com/course/master-windows-powershell/,https://img-c.udemycdn.com/course/240x135/6180477_0476_2.jpg,Nerd Academy ⭑,"PowerShell Mastery: Script, Automate & Succeed + 75 Projects",★ 20+ Hours Of Content  ★ 75 Hands-On Exercises – Master PowerShell 5.1 / 7 - Including Advanced Scripting / Automation,4.7,118,All Levels,150 lectures,20.5 total hours,Current price: $84.99
scripting languages,https://www.udemy.com/course/google-cloud-certification-associate-cloud-engineer/,https://img-c.udemycdn.com/course/240x135/3827154_aecc_4.jpg,"in28Minutes Official, Ranga Karanam | GCP Certification - Google Cloud Engineer & Architect",GCP Associate Cloud Engineer - Google Cloud Certification,GCP ACE - Google Cloud Associate Cloud Engineer certification. Begin your Google Cloud Platform - GCP journey!,4.6,31693,All Levels,299 lectures,18 total hours,Current price: $109.99
