skill,link,image_link,partner,title,course_description,rating,num_review,difficulty,num_lecture,duration,price
configuration management system,https://www.udemy.com/course/production-site-reliability-engineer/,https://img-c.udemycdn.com/course/240x135/3531340_3cd0_2.jpg,Nidhi Singh,Production Support - Site Reliability Engineer,Job of SRE in DevOps,4.5,2087,Beginner,95 lectures,7 total hours,Current price: $59.99
configuration management system,https://www.udemy.com/course/sre-fundamentals-mastering-site-reliability-engineering/,https://img-c.udemycdn.com/course/240x135/5481794_d3c4_2.jpg,Douglas Mugnos,SRE Fundamentals: Mastering Site Reliability Engineering,Empower Your Team: Embrace SRE Fundamentals for Unparalleled Reliability and Efficiency,4.4,2058,All Levels,35 lectures,4 total hours,Current price: $19.99
configuration management system,https://www.udemy.com/course/maintenance-management-reliability-engineering-full-course/,https://img-c.udemycdn.com/course/240x135/5433122_e234_2.jpg,Engineering Training Academy,Maintenance Management & Reliability Crash Course,"Comprehensive Course covering all Fundamentals of Maintenance Management, Reliability Engineering and Asset Management",4.3,327,All Levels,35 lectures,4.5 total hours,Current price: $69.99
configuration management system,https://www.udemy.com/course/from-zero-to-site-reliability-engineer/,https://img-c.udemycdn.com/course/240x135/5901296_0671.jpg,Philip Afable,From Zero to Site Reliability Engineer,Learn About the SRE Workflow,4.2,20,Intermediate,24 lectures,3 total hours,Current price: $69.99
configuration management system,https://www.udemy.com/course/introduction-to-reliability-maintainability-availability/,https://img-c.udemycdn.com/course/240x135/4448412_a4b3_3.jpg,Christopher Olson,"Introduction to Reliability, Maintainability & Availability",A solid foundation for Project Managers & Systems Engineers,4.6,742,Beginner,85 lectures,7 total hours,Current price: $69.99
configuration management system,https://www.udemy.com/course/it-system-engineer-cloud-system-administrator/,https://img-c.udemycdn.com/course/240x135/5049178_e19c.jpg,Kelvin Johnson,IT System Engineer & Cloud System Administration,"Learn Active Directory, Microsoft Intune, Group Policy, DNS,  Azure AD, Microsoft 365, Storage, Backup, WSUS and Azure",4.3,424,Intermediate,102 lectures,7 total hours,Current price: $54.99
configuration management system,https://www.udemy.com/course/site-reliability-engineer-sre-150-unique-interview-questions/,https://img-c.udemycdn.com/course/240x135/5366082_0865.jpg,Mustafa Erdinç ZORBA,150 Unique Site Reliability Engineer SRE Interview Questions,Master SRE Concepts: Real-World Scenarios In-Depth Interview Preparation Guide with Answers and Explanations!,4.2,28,All Levels,150 questions,,Current price: $69.99
configuration management system,https://www.udemy.com/course/site-reliability-engineering-on-aws/,https://img-c.udemycdn.com/course/240x135/3287718_5368_2.jpg,Packt Publishing,Site Reliability Engineering on AWS,Implement a reliable application architecture using the patterns and best practices recommended by AWS.,4.1,224,Beginner,37 lectures,4.5 total hours,Current price: $54.99
configuration management system,https://www.udemy.com/course/reliability-engineering-statistics/,https://img-c.udemycdn.com/course/240x135/4308267_bdea.jpg,"Ray Harkins, The Manufacturing Academy, Michael J. Vella",Reliability Engineering Statistics (2025),"Master the Statistical Tools to Optimize Reliability, Minimize Failures, and Drive Performance in Engineering",4.4,633,All Levels,123 lectures,9 total hours,Current price: $84.99
configuration management system,https://www.udemy.com/course/system-center-configuration-manager/,https://img-c.udemycdn.com/course/240x135/1194706_10f5_3.jpg,"Paul Hill, Robert Hill",Microsoft SCCM/Endpoint Configuration Manager for Beginners,"The fluff-free SCCM course that shows you how to install and administrate SCCM within your network, screen-by-screen",4.6,10833,All Levels,107 lectures,9.5 total hours,Current price: $129.99
configuration management system,https://www.udemy.com/course/sccm-training/,https://img-c.udemycdn.com/course/240x135/2336932_d7bf_3.jpg,Pavan Kumar,Mastering Microsoft Configuration Manager (SCCM) Training,"The Ultimate Training on Microsoft Intune Family Products - Configuration Manager (SCCM), Endpoint Analytics, Autopilot",4.5,1716,All Levels,306 lectures,72.5 total hours,Current price: $79.99
configuration management system,https://www.udemy.com/course/bms_fundamentals/,https://img-c.udemycdn.com/course/240x135/5186402_5c2a_6.jpg,Abdul Rehman Zafar,BMS-Building Management System Fundamentals: From A to Z,"BMS system(Building Management System) course covering concepts of Controls, HVAC, Electrical, IT networking, protocols.",4.5,551,All Levels,76 lectures,7 total hours,Current price: $79.99
configuration management system,https://www.udemy.com/course/an-introduction-to-reliability-engineering/,https://img-c.udemycdn.com/course/240x135/2513962_7e40_4.jpg,"Ray Harkins, The Manufacturing Academy",An Introduction to Reliability Engineering,A Study of Why Things Fail and How to Measure and Improve their Useful Life,4.4,3367,All Levels,39 lectures,5 total hours,Current price: $84.99
configuration management system,https://www.udemy.com/course/software-architecture-design-of-modern-large-scale-systems/,https://img-c.udemycdn.com/course/240x135/3997622_0670_2.jpg,"Michael Pogrebinsky | Software Architecture, System Design, Java Expert, Top Developer Academy LLC",Software Architecture & Design of Modern Large Scale Systems,"Become a Software Architect or Technical Lead by Mastering Software Architecture, System Design & Big Data Processing.",4.7,11311,All Levels,45 lectures,7 total hours,Current price: $109.99
configuration management system,https://www.udemy.com/course/site-reliability-engineering-mastering-slo-and-error-budget/,https://img-c.udemycdn.com/course/240x135/5842894_7ad8.jpg,Junior Mayhé,Site Reliability Engineering: Mastering SLO and Error Budget,"SRE core concepts of Non-Functional Requirements, Reliability, Business Flows, SLI, SLO, Error Budget, and more.",4.4,29,Beginner,27 lectures,,Current price: $39.99
configuration management system,https://www.udemy.com/course/change-management-leading-transformational-change/,https://img-c.udemycdn.com/course/240x135/4996874_02b8_3.jpg,"Lawrence M. Miller, Leadership Excellence, LLC",Change Management: Whole-System Design & Change Management,High Engagement Transformational Change Management in Organization Culture and Business Performance.,4.6,2024,All Levels,76 lectures,10 total hours,Current price: $59.99
configuration management system,https://www.udemy.com/course/fundamentals-of-reliability-engineering/,https://img-c.udemycdn.com/course/240x135/4901284_2632_3.jpg,"Sandeep Kumar, ­ Quality Gurus Inc.",Fundamentals of Reliability Engineering (Accredited),Gain Insight into the Basics of Reliability Engineering for CRE or CMRP Certification - Get 2.5 PMI PDUs and SHRM PDCs,4.2,391,Beginner,34 lectures,2.5 total hours,Current price: $74.99
configuration management system,https://www.udemy.com/course/google-cloud-certification-associate-cloud-engineer/,https://img-c.udemycdn.com/course/240x135/3827154_aecc_4.jpg,"in28Minutes Official, Ranga Karanam | GCP Certification - Google Cloud Engineer & Architect",GCP Associate Cloud Engineer - Google Cloud Certification,GCP ACE - Google Cloud Associate Cloud Engineer certification. Begin your Google Cloud Platform - GCP journey!,4.6,31693,All Levels,299 lectures,18 total hours,Current price: $109.99
configuration management system,https://www.udemy.com/course/control-system-engineering-from-basic-to-advanced-concepts/,https://img-c.udemycdn.com/course/240x135/6372963_08e1_4.jpg,Prof. Hitesh Dholakiya (CEO of Engineering Funda & Day Dream Software),Control Systems: Simplifying Control System Engineering,"Transfer Function, Block Diagram, Signal Flow Graph, Root Locus, PID Controller, Polar, Nyquist, Bode Plot & State Space",4.7,12,All Levels,147 lectures,27.5 total hours,Current price: $84.99
configuration management system,https://www.udemy.com/course/the-ai-engineer-course-complete-ai-engineer-bootcamp/,https://img-c.udemycdn.com/course/240x135/6112535_7103.jpg,365 Careers,The AI Engineer Course 2025: Complete AI Engineer Bootcamp,"Complete AI Engineer Training: Python, NLP, Transformers, LLMs, LangChain, Hugging Face, APIs",4.6,2803,All Levels,367 lectures,24.5 total hours,Current price: $89.99
