skill,link,image_link,partner,title,course_description,rating,num_review,difficulty,num_lecture,duration,price
big data,https://www.udemy.com/course/big-data-engineering-bootcamp-with-gcp-and-azure-cloud/,https://img-c.udemycdn.com/course/240x135/6242299_e787.jpg,"Krish Naik, Mayank Aggarwal, KRISHAI Technologies Private Limited","Big Data Engineering Bootcamp with GCP, and Azure Cloud","Master Big Data with Hadoop, Spark, Kafka & Cloud | Build Real-World Projects & Scalable Data Pipelines from Scratch",4.7,357,All Levels,301 lectures,73.5 total hours,
big data,https://www.udemy.com/course/production-site-reliability-engineer/,https://img-c.udemycdn.com/course/240x135/3531340_3cd0_2.jpg,Nidhi Singh,Production Support - Site Reliability Engineer,Job of SRE in DevOps,4.5,2087,Beginner,95 lectures,7 total hours,Current price: $59.99
big data,https://www.udemy.com/course/learn-azure-data-factory-from-scratch/,https://img-c.udemycdn.com/course/240x135/3685634_740c_6.jpg,Ramesh Retnasamy,Azure Data Factory For Data Engineers - Project on Covid19,"Real world project for Data Engineers using Azure Data Factory, SQL, Data Lake, Databricks, HDInsight, CI/CD [DP203]",4.6,15379,All Levels,146 lectures,13 total hours,Current price: $94.99
big data,https://www.udemy.com/course/the-data-engineer-bootcamp/,https://img-c.udemycdn.com/course/240x135/6450865_98e6.jpg,365 Careers,The Data Engineer Bootcamp 2025,"Master Data Engineering, Build Scalable Pipelines, and Land a High-Paying Job. Learn with a Silicon Valley Data Engineer",4.7,49,All Levels,115 lectures,8 total hours,
big data,https://www.udemy.com/course/big-data-testing-hadoop/,https://img-c.udemycdn.com/course/240x135/919134_7014_6.jpg,Big Data Engineer,Learn Big Data Testing with Hadoop and Hive with Pig Script,"Big Data Testing - Hadoop & Hive including Unix, Shell and Pig Scripting",4.1,219,All Levels,78 lectures,11 total hours,
big data,https://www.udemy.com/course/bigquery/,https://img-c.udemycdn.com/course/240x135/3563469_0dc3_3.jpg,J Garg - Real Time Learning,BigQuery for Big data engineers - Master Big Query Internals,"A Complete deep knowledge BigQuery guide for Data engineers and Analysts. Hands-On Bigquery via Console, CLI, Python lib",4.5,3207,All Levels,105 lectures,9 total hours,Current price: $84.99
big data,https://www.udemy.com/course/learn-big-data-testing-with-spark-scala-and-mongodb/,https://img-c.udemycdn.com/course/240x135/1114170_fa08.jpg,Big Data Engineer,"Learn Big Data Testing with Spark, Scala and MongoDB","Learn Big Data Testing with Spark, Scala and MongoDB",3.6,26,All Levels,29 lectures,4 total hours,Current price: $27.99
big data,https://www.udemy.com/course/sre-fundamentals-mastering-site-reliability-engineering/,https://img-c.udemycdn.com/course/240x135/5481794_d3c4_2.jpg,Douglas Mugnos,SRE Fundamentals: Mastering Site Reliability Engineering,Empower Your Team: Embrace SRE Fundamentals for Unparalleled Reliability and Efficiency,4.4,2058,All Levels,35 lectures,4 total hours,
big data,https://www.udemy.com/course/data-architecture-for-data-engineers/,https://img-c.udemycdn.com/course/240x135/6268045_b022.jpg,Manas Jain,Data Architecture for Data Engineers: Practical Approaches,"Building Scalable, Efficient Data Solutions with Real-World Applications",4.5,119,All Levels,41 lectures,4 total hours,
big data,https://www.udemy.com/course/data-lake-mastery-the-key-to-big-data-data-engineering/,https://img-c.udemycdn.com/course/240x135/5645008_67c0.jpg,Nikolai Schuler,Data Lake Mastery: The Key to Big Data & Data Engineering,"Data Lake Mastery using AWS: A Shortcut to Success in Big Data, Cloud Data Engineering and Data Architecture",4.6,401,All Levels,97 lectures,10 total hours,
big data,https://www.udemy.com/course/from-zero-to-site-reliability-engineer/,https://img-c.udemycdn.com/course/240x135/5901296_0671.jpg,Philip Afable,From Zero to Site Reliability Engineer,Learn About the SRE Workflow,4.2,20,Intermediate,24 lectures,3 total hours,
big data,https://www.udemy.com/course/aws-data-engineer/,https://img-c.udemycdn.com/course/240x135/5591620_4e46_2.jpg,"Sundog Education by Frank Kane, Frank Kane, Stephane Maarek | AWS Certified Cloud Practitioner,Solutions Architect,Developer",AWS Certified Data Engineer Associate 2025 - Hands On!,"AWS DEA-C01 certification prep course with exercises and a full-length practice exam. Redshift, Glue, Athena, and more",4.6,7915,Intermediate,289 lectures,22 total hours,
big data,https://www.udemy.com/course/data-mesh-demystified/,https://img-c.udemycdn.com/course/240x135/6236811_f1f4_2.jpg,Manas Jain,Data Mesh Architecture For Data Engineers,"Data Mesh Architecture for Data Engineers: Building Scalable, Decentralized Data Architectures for Modern Organizations",4.5,60,All Levels,30 lectures,2 total hours,
big data,https://www.udemy.com/course/google-cloud-gcp-professional-data-engineer-certification/,https://img-c.udemycdn.com/course/240x135/4095980_4e90_18.jpg,"Ankit Mistry : 150,000+ Students, GCP Certification - Google Cloud Academy | Associate Cloud & Professional Engineer Certifications",GCP - Google Cloud Professional Data Engineer Certification,"Learn Google Cloud Professional Data Engineer Certification with 80+ Hands-on demo on storage, Database, ML GCP Services",4.4,4721,All Levels,268 lectures,32.5 total hours,Current price: $94.99
big data,https://www.udemy.com/course/azure-data-factory-data-engineer-real-time-projects/,https://img-c.udemycdn.com/course/240x135/4910374_507c_2.jpg,"Atchyut Kumar, Edufulness EFN",Masterclass on Azure Data Factory - Data Engineer for 2024,"Learn ETL & Big Data Processing - Azure Data Factory(ADF), SQL Server, Blob, Datalake, REST API, PySpark, Databricks",4.4,644,All Levels,69 lectures,17 total hours,Current price: $69.99
big data,https://www.udemy.com/course/learn-hive-database-for-big-data-testing/,https://img-c.udemycdn.com/course/240x135/900244_6f70.jpg,Big Data Engineer,Easy Road Map to Big Data Testing (Hive and MySQL Databases),Hive and MySQL for Testing Profile,3.4,28,All Levels,35 lectures,6.5 total hours,
big data,https://www.udemy.com/course/learn-big-data-testing-hadoop-hive-cassandra-hbase-etc/,https://img-c.udemycdn.com/course/240x135/1114172_dfc4.jpg,Big Data Engineer,"Learn Big Data Testing (Hadoop, Hive, Cassandra, HBase etc.)","Learn Big Data Testing (Hadoop, Hive, Cassandra, HBase, Unix, Shell, Pig etc.)",3.5,165,All Levels,40 lectures,6 total hours,Current price: $29.99
big data,https://www.udemy.com/course/site-reliability-engineer-sre-150-unique-interview-questions/,https://img-c.udemycdn.com/course/240x135/5366082_0865.jpg,Mustafa Erdinç ZORBA,150 Unique Site Reliability Engineer SRE Interview Questions,Master SRE Concepts: Real-World Scenarios In-Depth Interview Preparation Guide with Answers and Explanations!,4.2,28,All Levels,150 questions,,Current price: $69.99
big data,https://www.udemy.com/course/databricks-certified-data-engineer-associate/,https://img-c.udemycdn.com/course/240x135/4956262_2022_2.jpg,Derar Alhussein | 8x Databricks Certified,Databricks Certified Data Engineer Associate - Preparation,Preparation course for Databricks Data Engineer Associate certification exam with hands-on training,4.5,7978,All Levels,39 lectures,4.5 total hours,Current price: $84.99
big data,https://www.udemy.com/course/big-data-testing-150-interview-questions-and-answers/,https://img-c.udemycdn.com/course/240x135/1114168_0932.jpg,Big Data Engineer,Big Data Testing: 150+ Interview Questions and Answers,Big Data Testing: 150+ Interview Questions and Answers,3.9,68,All Levels,51 lectures,5.5 total hours,Current price: $39.99
