skill,link,image_link,partner,title,course_description,rating,num_review,difficulty,num_lecture,duration,price
dns,https://www.udemy.com/course/production-site-reliability-engineer/,https://img-c.udemycdn.com/course/240x135/3531340_3cd0_2.jpg,Nidhi Singh,Production Support - Site Reliability Engineer,Job of SRE in DevOps,4.5,2087.0,Beginner,95 lectures,7 total hours,Current price: $59.99
dns,https://www.udemy.com/course/sre-fundamentals-mastering-site-reliability-engineering/,https://img-c.udemycdn.com/course/240x135/5481794_d3c4_2.jpg,Douglas Mugnos,SRE Fundamentals: Mastering Site Reliability Engineering,Empower Your Team: Embrace SRE Fundamentals for Unparalleled Reliability and Efficiency,4.4,2058.0,All Levels,35 lectures,4 total hours,Current price: $19.99
dns,https://www.udemy.com/course/from-zero-to-site-reliability-engineer/,https://img-c.udemycdn.com/course/240x135/5901296_0671.jpg,Philip Afable,From Zero to Site Reliability Engineer,Learn About the SRE Workflow,4.2,20.0,Intermediate,24 lectures,3 total hours,Current price: $69.99
dns,https://www.udemy.com/course/dns-deep-dive/,https://img-c.udemycdn.com/course/240x135/4303391_8eac_4.jpg,Nicholas Doropoulos  | 4-Time AWS SME,DNS Deep Dive,The most comprehensive course on the DNS protocol,4.5,1177.0,All Levels,47 lectures,4.5 total hours,Current price: $84.99
dns,https://www.udemy.com/course/site-reliability-engineer-sre-150-unique-interview-questions/,https://img-c.udemycdn.com/course/240x135/5366082_0865.jpg,Mustafa Erdinç ZORBA,150 Unique Site Reliability Engineer SRE Interview Questions,Master SRE Concepts: Real-World Scenarios In-Depth Interview Preparation Guide with Answers and Explanations!,4.2,28.0,All Levels,150 questions,,Current price: $69.99
dns,https://www.udemy.com/course/site-reliability-engineering-on-aws/,https://img-c.udemycdn.com/course/240x135/3287718_5368_2.jpg,Packt Publishing,Site Reliability Engineering on AWS,Implement a reliable application architecture using the patterns and best practices recommended by AWS.,4.1,224.0,Beginner,37 lectures,4.5 total hours,Current price: $54.99
dns,https://www.udemy.com/course/mastering-dns-on-windows-server-2016/,https://img-c.udemycdn.com/course/240x135/1096842_004d.jpg,"Robert Hill, Paul Hill",Mastering DNS on Windows Server,"Learn to Install, Configure and Troubleshoot a Windows DNS Server",4.5,2320.0,All Levels,49 lectures,5 total hours,Current price: $79.99
dns,https://www.udemy.com/course/introduction-to-reliability-maintainability-availability/,https://img-c.udemycdn.com/course/240x135/4448412_a4b3_3.jpg,Christopher Olson,"Introduction to Reliability, Maintainability & Availability",A solid foundation for Project Managers & Systems Engineers,4.6,742.0,Beginner,85 lectures,7 total hours,Current price: $69.99
dns,https://www.udemy.com/course/learn-in-and-out-of-dns/,https://img-c.udemycdn.com/course/240x135/3157836_d183_4.jpg,Vista Skills,Learn in and Out of DNS,Learn the Core Concepts of DNS functionality,3.7,31.0,All Levels,37 lectures,2.5 total hours,Current price: $34.99
dns,https://www.udemy.com/course/mastering-bind-dns/,https://img-c.udemycdn.com/course/240x135/3735400_a113_2.jpg,Vipin Gupta,Mastering BIND DNS,"How to configure Master DNS, Slave DNS, Round Robin, Split View, Virtual Hosting, DNS for Postfix in professional way",4.3,275.0,All Levels,114 lectures,8 total hours,Current price: $64.99
dns,https://www.udemy.com/course/mastering-asq-certified-reliability-engineer-exam/,https://img-c.udemycdn.com/course/240x135/5663722_5b5f_4.jpg,AERP Engineering,Mastering Certified Reliability Engineer Exam - Vol 1,This course has been meticulously designed to aid individuals preparing for the Certified Reliability Engineer exam.,4.2,12.0,Intermediate,856 questions,,Current price: $19.99
dns,https://www.udemy.com/course/mastering-dns-on-server-2022-100-labs-hands-on-exp/,https://img-c.udemycdn.com/course/240x135/5952422_de89.jpg,Network Specialist (Professor Mo Max),DNS On Windows  Server 2022 (100% LABS) HANDS ON EXP.,Learn How To Manage DNS On Windows 2019/2022  As Working In The Field. (Build A Server and Setup DNS From Scratch).,5.0,3.0,All Levels,41 lectures,4.5 total hours,Current price: $19.99
dns,https://www.udemy.com/course/site-reliability-engineering-mastering-slo-and-error-budget/,https://img-c.udemycdn.com/course/240x135/5842894_7ad8.jpg,Junior Mayhé,Site Reliability Engineering: Mastering SLO and Error Budget,"SRE core concepts of Non-Functional Requirements, Reliability, Business Flows, SLI, SLO, Error Budget, and more.",4.4,29.0,Beginner,27 lectures,,Current price: $39.99
dns,https://www.udemy.com/course/comprehensive-dns-security/,https://img-c.udemycdn.com/course/240x135/4046654_23df_6.jpg,Taoufik Z.,Comprehensive DNS Security and DNSSEC,"Learn the foundations of the DNS, how it works and how to make it secure. Explore DNSSEC and TSIG. Configure BIND.",4.3,54.0,All Levels,26 lectures,1.5 total hours,Current price: $39.99
dns,https://www.udemy.com/course/reliability-engineering-statistics/,https://img-c.udemycdn.com/course/240x135/4308267_bdea.jpg,"Ray Harkins, The Manufacturing Academy, Michael J. Vella",Reliability Engineering Statistics (2025),"Master the Statistical Tools to Optimize Reliability, Minimize Failures, and Drive Performance in Engineering",4.4,633.0,All Levels,123 lectures,9 total hours,Current price: $84.99
dns,https://www.udemy.com/course/an-introduction-to-reliability-engineering/,https://img-c.udemycdn.com/course/240x135/2513962_7e40_4.jpg,"Ray Harkins, The Manufacturing Academy",An Introduction to Reliability Engineering,A Study of Why Things Fail and How to Measure and Improve their Useful Life,4.4,3367.0,All Levels,39 lectures,5 total hours,Current price: $84.99
dns,https://www.udemy.com/course/google-certified-architect-developer-engineer-data-devops/,https://img-c.udemycdn.com/course/240x135/2459706_d13a_6.jpg,"Google Cloud Experts Cloud Architect, Google Cloud Platform Gurus !",Google Cloud Certifications: All in one Bundle,"430k Subs -Digital Leader, Cloud Engineer, Machine Learning, Architect, Developer, DevOps Engineer, Security Engineer",4.4,3628.0,All Levels,642 lectures,67.5 total hours,Current price: $69.99
dns,https://www.udemy.com/course/mastering-active-directorydnsgpos-20192022-100-hands-on/,https://img-c.udemycdn.com/course/240x135/5929324_298d_2.jpg,Network Specialist (Professor Mo Max),"Active Directory,DNS,GPOs Server 2019/2022 100% HANDS ON EXP",Learn How To Manage AD/DNS/ GPOs On 2019/2022  As Working In The Field. (Build Servers Setup AD/DNS/GPOs From Scratch).,4.7,31.0,All Levels,100 lectures,12 total hours,Current price: $89.99
dns,https://www.udemy.com/course/sre-site-reliability-engineering-quick-learninig-course/,https://img-c.udemycdn.com/course/240x135/4913734_aae5_2.jpg,GG トップ,SRE ( Site Reliability Engineering ) Quick Learning Course,Google's innovative methodology for DevOps,3.4,24.0,Beginner,39 lectures,2 total hours,Current price: $44.99
dns,https://www.udemy.com/course/certified-reliability-engineer-cre-practice-tests/,https://img-c.udemycdn.com/course/240x135/6376849_acb3_2.jpg,Aman Kaushik,Certified Reliability Engineer (CRE) Practice Tests,Comprehensive Practice for the Certified Reliability Engineer (CRE) Exam,,,All Levels,240 questions,,Current price: $44.99
