skill,link,image_link,partner,title,course_description,rating,num_review,difficulty,num_lecture,duration,price
ci/cd,https://www.udemy.com/course/production-site-reliability-engineer/,https://img-c.udemycdn.com/course/240x135/3531340_3cd0_2.jpg,Nidhi Singh,Production Support - Site Reliability Engineer,Job of SRE in DevOps,4.5,2087,Beginner,95 lectures,7 total hours,Current price: $59.99
ci/cd,https://www.udemy.com/course/sre-fundamentals-mastering-site-reliability-engineering/,https://img-c.udemycdn.com/course/240x135/5481794_d3c4_2.jpg,Douglas Mugnos,SRE Fundamentals: Mastering Site Reliability Engineering,Empower Your Team: Embrace SRE Fundamentals for Unparalleled Reliability and Efficiency,4.4,2058,All Levels,35 lectures,4 total hours,
ci/cd,https://www.udemy.com/course/from-zero-to-site-reliability-engineer/,https://img-c.udemycdn.com/course/240x135/5901296_0671.jpg,Philip Afable,From Zero to Site Reliability Engineer,Learn About the SRE Workflow,4.2,20,Intermediate,24 lectures,3 total hours,
ci/cd,https://www.udemy.com/course/site-reliability-engineering-on-aws/,https://img-c.udemycdn.com/course/240x135/3287718_5368_2.jpg,Packt Publishing,Site Reliability Engineering on AWS,Implement a reliable application architecture using the patterns and best practices recommended by AWS.,4.1,224,Beginner,37 lectures,4.5 total hours,Current price: $54.99
ci/cd,https://www.udemy.com/course/gitlab-ci-pipelines-ci-cd-and-devops-for-beginners/,https://img-c.udemycdn.com/course/240x135/2309602_ed2d_3.jpg,"Valentin Despa, Valentin Despa - Support","GitLab CI/CD: Pipelines, CI/CD and DevOps for Beginners",Complete course for GitLab CI/CD from a GitLab Hero. Learn valuable DevOps skills. Build pipelines and Deploy to AWS.,4.6,20713,Intermediate,141 lectures,13 total hours,Current price: $99.99
ci/cd,https://www.udemy.com/course/site-reliability-engineer-sre-150-unique-interview-questions/,https://img-c.udemycdn.com/course/240x135/5366082_0865.jpg,Mustafa Erdinç ZORBA,150 Unique Site Reliability Engineer SRE Interview Questions,Master SRE Concepts: Real-World Scenarios In-Depth Interview Preparation Guide with Answers and Explanations!,4.2,28,All Levels,150 questions,,
ci/cd,https://www.udemy.com/course/mastering-aws-devops-for-cloud-engineers/,https://img-c.udemycdn.com/course/240x135/5492716_8a93_5.jpg,Pravin Mishra | AWS Certified Cloud Practitioner | Solutions Architect,AWS DevOps & CI/CD with AWS CodePipeline for Engineers,"Build, Deploy, Scaling Applications with AWS DevOps. Learn AWS CodeCommit, CodeBuild, CodeDeploy, CodePipeline",4.6,373,Intermediate,78 lectures,16.5 total hours,
ci/cd,https://www.udemy.com/course/jenkins-cicd-pipeline-masterclass-for-devops/,https://img-c.udemycdn.com/course/240x135/5032660_3663_7.jpg,CSCareerKaizen.com | CKA & CKS & AWS DevOps Pro (元Microsoft現シリバレエンジニア),Jenkins CI/CD Pipeline Masterclass for DevOps/SRE engineers,"Learn Jenkins to enable DevOps CI/CD pipeline. Jenkins job vs pipeline, jenkinsfile syntax, security, etc",5.0,1,Beginner,53 lectures,4 total hours,
ci/cd,https://www.udemy.com/course/mastering-asq-certified-reliability-engineer-exam/,https://img-c.udemycdn.com/course/240x135/5663722_5b5f_4.jpg,AERP Engineering,Mastering Certified Reliability Engineer Exam - Vol 1,This course has been meticulously designed to aid individuals preparing for the Certified Reliability Engineer exam.,4.2,12,Intermediate,856 questions,,
ci/cd,https://www.udemy.com/course/azure-devops-fundamental/,https://img-c.udemycdn.com/course/240x135/3514014_c9ee_6.jpg,Rahul Shetty,Azure Devops Crash Course -Build CI/CD release pipelines,"Step by step Tutorial to understand CI/CD pipelines ,Release activities, Docker, Code  Repos, Project Boards, in Azure",4.4,6542,All Levels,51 lectures,7 total hours,Current price: $94.99
ci/cd,https://www.udemy.com/course/introduction-to-reliability-maintainability-availability/,https://img-c.udemycdn.com/course/240x135/4448412_a4b3_3.jpg,Christopher Olson,"Introduction to Reliability, Maintainability & Availability",A solid foundation for Project Managers & Systems Engineers,4.6,742,Beginner,85 lectures,7 total hours,Current price: $69.99
ci/cd,https://www.udemy.com/course/google-certified-architect-developer-engineer-data-devops/,https://img-c.udemycdn.com/course/240x135/2459706_d13a_6.jpg,"Google Cloud Experts Cloud Architect, Google Cloud Platform Gurus !",Google Cloud Certifications: All in one Bundle,"430k Subs -Digital Leader, Cloud Engineer, Machine Learning, Architect, Developer, DevOps Engineer, Security Engineer",4.4,3628,All Levels,642 lectures,67.5 total hours,Current price: $69.99
ci/cd,https://www.udemy.com/course/jenkins-ci-cd-pipelines-devops-for-beginners/,https://img-c.udemycdn.com/course/240x135/5737068_3f88_3.jpg,"Valentin Despa, Valentin Despa - Support","Jenkins: Jobs, Pipelines, CI/CD and DevOps for Beginners","[2025] Learn modern Jenkins by writing pipeline as code (Jenkinsfile), using Git, GitHub, Docker and deploying to AWS.",4.6,1178,All Levels,112 lectures,10.5 total hours,
ci/cd,https://www.udemy.com/course/sre-site-reliability-engineering-quick-learninig-course/,https://img-c.udemycdn.com/course/240x135/4913734_aae5_2.jpg,GG トップ,SRE ( Site Reliability Engineering ) Quick Learning Course,Google's innovative methodology for DevOps,3.4,24,Beginner,39 lectures,2 total hours,
ci/cd,https://www.udemy.com/course/devsecops-with-azure-devops/,https://img-c.udemycdn.com/course/240x135/4816326_37f2_2.jpg,"A Security Guru, Raghu The Security Expert",DevSecOps with Azure DevOps: Secure CI/CD with Azure DevOps,"This course helps to implement DevSecOps in Azure DevOps and integrate SAST, SCA & DAST security tools in CI/CD Pipeline",4.5,634,Beginner,40 lectures,3.5 total hours,Current price: $79.99
ci/cd,https://www.udemy.com/course/reliability-engineering-statistics/,https://img-c.udemycdn.com/course/240x135/4308267_bdea.jpg,"Ray Harkins, The Manufacturing Academy, Michael J. Vella",Reliability Engineering Statistics (2025),"Master the Statistical Tools to Optimize Reliability, Minimize Failures, and Drive Performance in Engineering",4.4,633,All Levels,123 lectures,9 total hours,Current price: $84.99
ci/cd,https://www.udemy.com/course/ci-cd-devops/,https://img-c.udemycdn.com/course/240x135/2779762_87e5_4.jpg,John Honai,"DevOps, CI/CD(Continuous Integration/Delivery) for Beginners","Learn about CI/CD, DevOps, the concepts of Continuous Integration, Continuous Delivery / Deployment, DevOps pipeline",4.4,47094,Beginner,13 lectures,,Current price: $79.99
ci/cd,https://www.udemy.com/course/mastering-advanced-mlops-on-gcp-cicd-kubernetes-kubeflow/,https://img-c.udemycdn.com/course/240x135/6474355_89e1.jpg,"KRISHAI Technologies Private Limited, Sudhanshu Gusain","Beginner to Advanced MLOps on GCP-CI/CD, Kubernetes Jenkins","Simply streamline ML pipelines with Kubernetes, GitLab CI, Jenkins, Prometheus, Grafana, Kubeflow & Minikube on GCP.",4.6,63,All Levels,112 lectures,54.5 total hours,
ci/cd,https://www.udemy.com/course/an-introduction-to-reliability-engineering/,https://img-c.udemycdn.com/course/240x135/2513962_7e40_4.jpg,"Ray Harkins, The Manufacturing Academy",An Introduction to Reliability Engineering,A Study of Why Things Fail and How to Measure and Improve their Useful Life,4.4,3367,All Levels,39 lectures,5 total hours,Current price: $84.99
ci/cd,https://www.udemy.com/course/cicd-in-azure-databricks-using-azure-devops/,https://img-c.udemycdn.com/course/240x135/5767020_e85b.jpg,Mr. K Talks Tech,CI/CD in Azure Databricks using Azure DevOps,Databricks and Azure DevOps- Master CI/CD deployment across two environments with ease in this straightforward course.,4.7,257,Beginner,8 lectures,2 total hours,
