skill,link,image_link,partner,title,course_description,rating,num_review,difficulty,num_lecture,duration,price
webpack,https://www.udemy.com/course/webpack-from-beginner-to-advanced/,https://img-c.udemycdn.com/course/240x135/1776342_057a_3.jpg,Viktor Pyskunov,Webpack 5: The Complete Guide For Beginners,"Learn Webpack 5 from the very basics to advanced! Use Webpack with JS, CSS, NPM, Module Federation and Micro Frontends.",4.6,5303,All Levels,66 lectures,5 total hours,Current price: $79.99
webpack,https://www.udemy.com/course/webpack-optimizing-for-production/,https://img-c.udemycdn.com/course/240x135/4831306_36e0.jpg,Viktor Pyskunov,Webpack 5: Optimizing For Production,"Optimize your Webpack 5 configuration for Production with Code Splitting, Lazy Loading, Gzip compression etc.",4.6,416,All Levels,61 lectures,6 total hours,Current price: $79.99
webpack,https://www.udemy.com/course/webpack-5-ninja-build-micro-frontend-and-web-apps/,https://img-c.udemycdn.com/course/240x135/4475008_753d.jpg,Gaurav Soni,Webpack 5 Ninja - Build Micro frontend and web apps,"Webpack 5 (2024).Basics to Advanced concepts like loaders ,plugins, Module Federation, Build production apps (React App)",4.1,678,Beginner,84 lectures,8.5 total hours,Current price: $84.99
webpack,https://www.udemy.com/course/webpack-2-the-complete-developers-guide/,https://img-c.udemycdn.com/course/240x135/1039062_e553_4.jpg,Stephen Grider,Webpack 2: The Complete Developer's Guide,"Master Webpack 2 as you deploy web apps supported by Babel, code splitting, and ES2015 Modules.",4.6,5315,All Levels,57 lectures,5.5 total hours,Current price: $84.99
webpack,https://www.udemy.com/course/become-an-associate-software-engineer/,https://img-c.udemycdn.com/course/240x135/5958238_8203_3.jpg,Paulo Victor Gomes,Become a Software Engineer,The Complete Guide to Becoming an Associate Software Engineer: Your Entry into the Tech World,4.8,19,All Levels,135 lectures,14.5 total hours,Current price: $19.99
webpack,https://www.udemy.com/course/webpack-for-react-applications/,https://img-c.udemycdn.com/course/240x135/1541108_4e63_2.jpg,Packt Publishing,Webpack for React Applications,Learn everything needed to build your own modern stateful web applications,4.0,37,,Expert,3.5 total hours,Current price: $27.99
webpack,https://www.udemy.com/course/using-webpack/,https://img-c.udemycdn.com/course/240x135/4258840_39ab.jpg,Daniel Stern,Using Webpack,Compiling and serving sophisticated Node applications using Webpack,4.5,6,Intermediate,22 lectures,1.5 total hours,Current price: $19.99
webpack,https://www.udemy.com/course/software-development-and-it-complete-guide-to-key-concepts/,https://img-c.udemycdn.com/course/240x135/4879694_6afd_4.jpg,Kamil Kulik • Software Engineer,Software Development and IT - Complete Guide To Key Concepts,"For new joiners in IT industry: basics of apps, APIs, testing, Cloud, GIT, deployment, containerisation, SDLC, Scrum",4.7,1213,All Levels,109 lectures,6.5 total hours,Current price: $84.99
webpack,https://www.udemy.com/course/software-engineering-101/,https://img-c.udemycdn.com/course/240x135/2267906_505c.jpg,Kurt Anderson,Software Engineering 101: Plan and Execute Better Software.,Software Engineering 101: Use Software Engineering to Plan and Build Amazing Software + Learn SCRUM Framework!,4.5,12122,All Levels,102 lectures,8.5 total hours,Current price: $109.99
webpack,https://www.udemy.com/course/webpack-4-first-steps/,https://img-c.udemycdn.com/course/240x135/2301794_a718.jpg,Mehul Mohan,Webpack 4 - First Steps,Use Webpack to bundle and automate a lot of regular JavaScript workflow task and become a powerful JS developer!,4.6,35,Beginner,29 lectures,2 total hours,Current price: $44.99
webpack,https://www.udemy.com/course/the-ai-engineer-course-complete-ai-engineer-bootcamp/,https://img-c.udemycdn.com/course/240x135/6112535_7103.jpg,365 Careers,The AI Engineer Course 2025: Complete AI Engineer Bootcamp,"Complete AI Engineer Training: Python, NLP, Transformers, LLMs, LangChain, Hugging Face, APIs",4.6,2803,All Levels,367 lectures,24.5 total hours,Current price: $89.99
webpack,https://www.udemy.com/course/software-engineer-interview-unleashed/,https://img-c.udemycdn.com/course/240x135/960796_025f_4.jpg,Jeff Bae,Software Engineer Interview Unleashed,Learn how to make yourself ready for software engineer interviews from a former Google interviewer.,4.2,1206,All Levels,41 lectures,7 total hours,Current price: $69.99
webpack,https://www.udemy.com/course/learn-react-micro-frontends-from-scratch-using-webpack/,https://img-c.udemycdn.com/course/240x135/5998580_df11_3.jpg,K.Sathyaprakash Reddy,Learn React Micro Frontend From Scratch Using Webpack,A course on optimizing React applications with Webpack and implementing a scalable micro-frontend UI architecture 2024,4.8,11,Beginner,27 lectures,3.5 total hours,Current price: $69.99
webpack,https://www.udemy.com/course/webpack-5-vite/,https://img-c.udemycdn.com/course/240x135/4646988_0848_4.jpg,OnlyKiosk Tech,Webpack 5 and Vite: A New Way to Learn - Active Thinking,Learn by Guessing; Understand Webpack Better by Learning Vite; Master Vite based on Webpack Experience.,4.5,91,All Levels,44 lectures,4.5 total hours,Current price: $49.99
webpack,https://www.udemy.com/course/software-architecture-design-of-modern-large-scale-systems/,https://img-c.udemycdn.com/course/240x135/3997622_0670_2.jpg,"Michael Pogrebinsky | Software Architecture, System Design, Java Expert, Top Developer Academy LLC",Software Architecture & Design of Modern Large Scale Systems,"Become a Software Architect or Technical Lead by Mastering Software Architecture, System Design & Big Data Processing.",4.7,11311,All Levels,45 lectures,7 total hours,Current price: $109.99
webpack,https://www.udemy.com/course/complete-guide-to-webpack-for-react-development-3-in-1/,https://img-c.udemycdn.com/course/240x135/1861454_e1ee_2.jpg,Packt Publishing,Complete Guide to Webpack for React Development: 3-in-1,Learn everything needed to build your own modern stateful web applications with webpack,3.6,19,Beginner,64 lectures,9 total hours,Current price: $19.99
webpack,https://www.udemy.com/course/the-complete-guide-to-becoming-a-software-architect/,https://img-c.udemycdn.com/course/240x135/2304734_767b.jpg,Memi Lavi,The Complete Guide to Becoming a Software Architect,"The most comprehensive guide that will make you a Software Architect, the most desired role in the software industry.",4.6,16096,Beginner,117 lectures,6 total hours,Current price: $159.99
webpack,https://www.udemy.com/course/react-for-senior-engineers/,https://img-c.udemycdn.com/course/240x135/4089874_0cb6_4.jpg,Frantz Kati,Advanced React For Enterprise: React for senior engineers,"A practical deep dive into building, scaling and maintaining high-quality design systems for software engineers.",4.4,2358,Intermediate,59 lectures,6 total hours,Current price: $69.99
webpack,https://www.udemy.com/course/2019-js-infrastructure-course-npm-babel-7-webpack-4/,https://img-c.udemycdn.com/course/240x135/2036298_f1a7_10.jpg,OnlyKiosk Tech,"JavaScript Infrastructure: CLI, NPM, Babel and Webpack","Command Line, NPM, Babel, and Webpack! Theory, Application and Practice!",4.3,303,Beginner,68 lectures,3.5 total hours,Current price: $54.99
webpack,https://www.udemy.com/course/webpack-complete-guide/,https://img-c.udemycdn.com/course/240x135/1037666_91c9_2.jpg,Nelson Jamal,Webpack 1 & 2 - The Complete Guide,Master Webpack Once and For All,4.4,129,All Levels,80 lectures,6.5 total hours,Current price: $19.99
