skill,link,image_link,partner,title,course_description,rating,num_review,difficulty,num_lecture,duration,price
s3,https://www.udemy.com/course/aws-amazon-s3-ultimate-master-class/,https://img-c.udemycdn.com/course/240x135/5222762_267b_2.jpg,Arno Pretorius,AWS Amazon S3 - Ultimate Master Class - 2025,Master AWS Amazon S3 | From Zero to Hero | Theory and hands-on demonstrations,4.6,41,All Levels,143 lectures,13 total hours,Current price: $84.99
s3,https://www.udemy.com/course/amazon-s3-deep-dive/,https://img-c.udemycdn.com/course/240x135/5081086_fcba_11.jpg,"Bryan Krausen • 160,000+ Enrollments Worldwide",[NEW] Amazon S3 Deep Dive: The Ultimate Guide to AWS Storage,"Unlock the Power of Amazon S3 - Everything You Need to Know for Faster, Cheaper, and More Secure Amazon S3 Cloud Storage",4.6,278,All Levels,125 lectures,11 total hours,Current price: $74.99
s3,https://www.udemy.com/course/aws-foundations-amazon-s3-mastery-bootcamp/,https://img-c.udemycdn.com/course/240x135/1654364_0ba9_3.jpg,Matt Bohn,AWS Amazon S3 Mastery Bootcamp,Take this course to master all aspects of Amazon S3!  Hone your skills with the AWS CLI and master S3 security.,4.4,1295,All Levels,62 lectures,5 total hours,Current price: $84.99
s3,https://www.udemy.com/course/aws-s3-mastery-beginner-to-expert/,https://img-c.udemycdn.com/course/240x135/5869052_03bb_3.jpg,Jagan Aws Coach,AWS Mastery on S3: Beginner to Expert,"The Ultimate S3 Mastery: Building, Securing, and Optimizing Cloud Storage",4.6,15,Beginner,139 lectures,7.5 total hours,Current price: $54.99
s3,https://www.udemy.com/course/become-an-associate-software-engineer/,https://img-c.udemycdn.com/course/240x135/5958238_8203_3.jpg,Paulo Victor Gomes,Become a Software Engineer,The Complete Guide to Becoming an Associate Software Engineer: Your Entry into the Tech World,4.8,19,All Levels,135 lectures,14.5 total hours,Current price: $19.99
s3,https://www.udemy.com/course/amazon-s3-master-course/,https://img-c.udemycdn.com/course/240x135/3878746_91bd.jpg,Harshavardhan Nara,Amazon S3 - Master course,Amazon S3 & AWS are Easy Once You Know How. Follow My Step-By-Step navigations & Master Amazon S3 Quickly.,4.2,38,All Levels,20 lectures,2 total hours,Current price: $19.99
s3,https://www.udemy.com/course/aws-data-engineer/,https://img-c.udemycdn.com/course/240x135/5591620_4e46_2.jpg,"Sundog Education by Frank Kane, Frank Kane, Stephane Maarek | AWS Certified Cloud Practitioner,Solutions Architect,Developer",AWS Certified Data Engineer Associate 2025 - Hands On!,"AWS DEA-C01 certification prep course with exercises and a full-length practice exam. Redshift, Glue, Athena, and more",4.6,7915,Intermediate,289 lectures,22 total hours,Current price: $94.99
s3,https://www.udemy.com/course/software-development-and-it-complete-guide-to-key-concepts/,https://img-c.udemycdn.com/course/240x135/4879694_6afd_4.jpg,Kamil Kulik • Software Engineer,Software Development and IT - Complete Guide To Key Concepts,"For new joiners in IT industry: basics of apps, APIs, testing, Cloud, GIT, deployment, containerisation, SDLC, Scrum",4.7,1213,All Levels,109 lectures,6.5 total hours,Current price: $84.99
s3,https://www.udemy.com/course/aws-mastery-hands-on-cloud-projects-for-engineers/,https://img-c.udemycdn.com/course/240x135/6362029_fba1_4.jpg,Pravin Mishra | AWS Certified Cloud Practitioner | Solutions Architect,AWS Mastery: 26 AWS Cloud Projects for Engineers & Architect,"Master AWS with 26 Hands-On AWS Projects, Hands-on and Assignments covering VPC, EC2, Lambda, and Real-World Scenarios.",4.9,108,Intermediate,33 lectures,27 total hours,Current price: $79.99
s3,https://www.udemy.com/course/software-engineering-101/,https://img-c.udemycdn.com/course/240x135/2267906_505c.jpg,Kurt Anderson,Software Engineering 101: Plan and Execute Better Software.,Software Engineering 101: Use Software Engineering to Plan and Build Amazing Software + Learn SCRUM Framework!,4.5,12122,All Levels,102 lectures,8.5 total hours,Current price: $109.99
s3,https://www.udemy.com/course/aws-s3-be-the-best/,https://img-c.udemycdn.com/course/240x135/2990946_8788_4.jpg,Shahed Kazi,AWS S3 - Be the best,"Become an Expert in AWS S3! Learn Amazon S3 interaction with Lambda, Athena, CloudFront,VPC Endpoint",3.8,13,All Levels,77 lectures,4 total hours,Current price: $39.99
s3,https://www.udemy.com/course/building-and-hosting-websites-with-aws-ec2-and-s3/,https://img-c.udemycdn.com/course/240x135/6314709_0eba.jpg,EDUCBA Bridging the Gap,Building and Hosting Websites with AWS EC2 and S3,"Master AWS EC2, S3, and ASP.NET to build, host, and scale dynamic websites with a hands-on approach.",4.6,5,All Levels,52 lectures,7.5 total hours,Current price: $54.99
s3,https://www.udemy.com/course/mastering-aws-s3-tutorial/,https://img-c.udemycdn.com/course/240x135/1742850_4abb.jpg,Alston Godbolt,Mastering AWS: Featuring S3,"Learn S3 with hands on tutorials including creating static pages, modifying buckets and objects with AWS CLI and Node.js",4.2,22,All Levels,43 lectures,3.5 total hours,Current price: $19.99
s3,https://www.udemy.com/course/aws-storage-and-cdn-services-s3-ebs-efs-cloudfront/,https://img-c.udemycdn.com/course/240x135/1176238_3d8b_3.jpg,"TetraNoodle Team, Manuj Aggarwal",AWS MasterClass: Storage & CDN - AWS S3 & AWS CloudFront,"Learn skills with rising demand. Storage and CDN services in Amazon cloud - AWS S3, EBS, EFS, CloudFront",4.1,218,All Levels,37 lectures,3 total hours,Current price: $64.99
s3,https://www.udemy.com/course/aws-quicksight-datalake/,https://img-c.udemycdn.com/course/240x135/1919594_9f3f_2.jpg,"ClayDesk E-learning, Syed Raza, Ali Bokhari, Qasim Shah","Amazon (AWS) QuickSight, Glue, Athena and S3 Fundamentals","Amazon QuickSight Fundamentals. Make great visualizations learn complete workflow: Data Lake, AWS Athena, AWS Glue, S3",4.0,286,All Levels,26 lectures,3.5 total hours,Current price: $44.99
s3,https://www.udemy.com/course/google-cloud-certification-associate-cloud-engineer/,https://img-c.udemycdn.com/course/240x135/3827154_aecc_4.jpg,"in28Minutes Official, Ranga Karanam | GCP Certification - Google Cloud Engineer & Architect",GCP Associate Cloud Engineer - Google Cloud Certification,GCP ACE - Google Cloud Associate Cloud Engineer certification. Begin your Google Cloud Platform - GCP journey!,4.6,31693,All Levels,299 lectures,18 total hours,Current price: $109.99
s3,https://www.udemy.com/course/software-architecture-design-of-modern-large-scale-systems/,https://img-c.udemycdn.com/course/240x135/3997622_0670_2.jpg,"Michael Pogrebinsky | Software Architecture, System Design, Java Expert, Top Developer Academy LLC",Software Architecture & Design of Modern Large Scale Systems,"Become a Software Architect or Technical Lead by Mastering Software Architecture, System Design & Big Data Processing.",4.7,11311,All Levels,45 lectures,7 total hours,Current price: $109.99
s3,https://www.udemy.com/course/the-ai-engineer-course-complete-ai-engineer-bootcamp/,https://img-c.udemycdn.com/course/240x135/6112535_7103.jpg,365 Careers,The AI Engineer Course 2025: Complete AI Engineer Bootcamp,"Complete AI Engineer Training: Python, NLP, Transformers, LLMs, LangChain, Hugging Face, APIs",4.6,2803,All Levels,367 lectures,24.5 total hours,Current price: $89.99
s3,https://www.udemy.com/course/master-aws-s3-and-static-web-hosting/,https://img-c.udemycdn.com/course/240x135/6339167_d2ec_2.jpg,Jayesh Deshmukh,Master AWS S3 and Static Web Hosting: Basics to Deployment,"Learn to manage AWS S3, configure static websites, and deploy web apps with CloudFront and Route 53.",5.0,2,Beginner,19 lectures,1.5 total hours,Current price: $44.99
s3,https://www.udemy.com/course/the-complete-guide-to-becoming-a-software-architect/,https://img-c.udemycdn.com/course/240x135/2304734_767b.jpg,Memi Lavi,The Complete Guide to Becoming a Software Architect,"The most comprehensive guide that will make you a Software Architect, the most desired role in the software industry.",4.6,16096,Beginner,117 lectures,6 total hours,Current price: $159.99
