skill,link,image_link,partner,title,course_description,rating,num_review,difficulty,num_lecture,duration,price
gcp,https://www.udemy.com/course/google-cloud-certification-associate-cloud-engineer/,https://img-c.udemycdn.com/course/240x135/3827154_aecc_4.jpg,"in28Minutes Official, Ranga Karanam | GCP Certification - Google Cloud Engineer & Architect",GCP Associate Cloud Engineer - Google Cloud Certification,GCP ACE - Google Cloud Associate Cloud Engineer certification. Begin your Google Cloud Platform - GCP journey!,4.6,31693,All Levels,299 lectures,18 total hours,
gcp,https://www.udemy.com/course/google-cloud-gcp-professional-data-engineer-certification/,https://img-c.udemycdn.com/course/240x135/4095980_4e90_18.jpg,"Ankit Mistry : 150,000+ Students, GCP Certification - Google Cloud Academy | Associate Cloud & Professional Engineer Certifications",GCP - Google Cloud Professional Data Engineer Certification,"Learn Google Cloud Professional Data Engineer Certification with 80+ Hands-on demo on storage, Database, ML GCP Services",4.4,4721,All Levels,268 lectures,32.5 total hours,
gcp,https://www.udemy.com/course/gcp-associate-cloud-engineer-google-certification/,https://img-c.udemycdn.com/course/240x135/4321816_a698_5.jpg,"Kalyan Reddy Daida | DevOps & SRE Architect on AWS, Azure & Google Cloud Platforms",GCP Associate Cloud Engineer Google Certification -150 Demos,GCP ACE - Start your Google Cloud Platform Journey with 150 practical demos. Google Cloud Associate Cloud Engineer [NEW],4.7,359,All Levels,313 lectures,36.5 total hours,Current price: $79.99
gcp,https://www.udemy.com/course/google-cloud-professional-cloud-architect-certification/,https://img-c.udemycdn.com/course/240x135/3995372_4064.jpg,"in28Minutes Official, Ranga Karanam | GCP Certification - Google Cloud Engineer & Architect",GCP Professional Cloud Architect: Google Cloud Certification,Become a GCP Cloud Architect. Architect Google Cloud Platform (GCP) Solutions. Includes 4 New Case Studies.,4.6,12379,All Levels,337 lectures,21 total hours,
gcp,https://www.udemy.com/course/latest-gcp-ace-google-associate-cloud-engineer-practice-exams-tests/,https://img-c.udemycdn.com/course/240x135/4916320_2183_17.jpg,Sayyam | GCP ACE Google Cloud Associate Engineer Practice Exam Test | ADP Data & CDL Digital Leader Certification Exams Tests,GCP ACE Google Associate Cloud Engineer Practice Test Exam,[2025] LATEST GCP ACE Google Cloud Platform Associate Cloud Engineer Practice Exams Tests | Questions + Solutions,4.7,1730,All Levels,300 questions,,Current price: $74.99
gcp,https://www.udemy.com/course/google-cloud-networking/,https://img-c.udemycdn.com/course/240x135/4133782_a308_12.jpg,"Ankit Mistry : 150,000+ Students, GCP Certification - Google Cloud Academy | Associate Cloud & Professional Engineer Certifications",GCP - Google Cloud Professional Cloud Network Engineer,Pass Google Cloud Professional Network Certification with 15+ Hours of HD quality video and 90+ Hands-on Practical labs,4.4,1241,All Levels,131 lectures,15 total hours,Current price: $79.99
gcp,https://www.udemy.com/course/gcp-google-cloud-professional-devops-engineer-certification/,https://img-c.udemycdn.com/course/240x135/4133780_4390_9.jpg,"Ankit Mistry : 150,000+ Students, GCP Certification - Google Cloud Academy | Associate Cloud & Professional Engineer Certifications",GCP Google Cloud Professional DevOps Engineer Certification,Pass Google Cloud Professional DevOps Certification with 12+ Hours of HD quality video and 70+ Hands-on Practical labs,4.2,2106,All Levels,112 lectures,13.5 total hours,
gcp,https://www.udemy.com/course/google-cloud-gcp-associate-cloud-engineer-certification/,https://img-c.udemycdn.com/course/240x135/3962460_77bb_30.jpg,"Ankit Mistry : 150,000+ Students, GCP Certification - Google Cloud Academy | Associate Cloud & Professional Engineer Certifications",GCP Associate Cloud Engineer Certification : Google Cloud,Learn Google Cloud - GCP with 90+ Hands-on demo Lab & make yourself fully prepared for GCP Associate Cloud Engineer Exam,4.6,2046,All Levels,211 lectures,24 total hours,
gcp,https://www.udemy.com/course/google-cloud-digital-leader-certification/,https://img-c.udemycdn.com/course/240x135/4008228_6ef7.jpg,"in28Minutes Official, Ranga Karanam | GCP Certification - Google Cloud Engineer & Architect",GCP for Beginners - Become a Google Cloud Digital Leader,Google Cloud for Beginners. Start Cloud Computing with GCP and become a Cloud Digital Leader.,4.6,15383,All Levels,195 lectures,11.5 total hours,
gcp,https://www.udemy.com/course/google-cloud-gcp-professional-cloud-security-engineer-certification/,https://img-c.udemycdn.com/course/240x135/4126398_9559_13.jpg,"Ankit Mistry : 150,000+ Students, GCP Certification - Google Cloud Academy | Associate Cloud & Professional Engineer Certifications",Google Professional Cloud Security Engineer Certification,Learn Google Cloud - GCP with 50+ Hands-on Demo lab & Prepare yourself for GCP Professional Cloud Security Engineer Exam,4.4,1943,All Levels,117 lectures,13.5 total hours,
gcp,https://www.udemy.com/course/google-certified-architect-developer-engineer-data-devops/,https://img-c.udemycdn.com/course/240x135/2459706_d13a_6.jpg,"Google Cloud Experts Cloud Architect, Google Cloud Platform Gurus !",Google Cloud Certifications: All in one Bundle,"430k Subs -Digital Leader, Cloud Engineer, Machine Learning, Architect, Developer, DevOps Engineer, Security Engineer",4.4,3628,All Levels,642 lectures,67.5 total hours,
gcp,https://www.udemy.com/course/google-cloud-specialization/,https://img-c.udemycdn.com/course/240x135/2827592_53fc_10.jpg,TechLink Selenium | DevOps | GenAI,Google Cloud (GCP) MasterClass : GCP Live Projects,"Google Cloud (GCP) Platform: GCP Essentials, Cloud Computing, GCP Associate Cloud Engineer, Professional Cloud Architect",4.4,1896,All Levels,199 lectures,31 total hours,
gcp,https://www.udemy.com/course/gcp-professional-data-engineer-exam-practice-tests-2024/,https://img-c.udemycdn.com/course/240x135/5938562_0f0e.jpg,Ravinder | IT Certifications Experts,GCP Professional Data Engineer Exam Practice Tests - 2025,Latest questions and solutions for GCP Professional Data Engineer Exam,4.4,74,All Levels,200 questions,,Current price: $49.99
gcp,https://www.udemy.com/course/gcp-ace-exam/,https://img-c.udemycdn.com/course/240x135/5749886_af63_2.jpg,"MAQTBA • Over 60,000 Enrollments",GCP Associate Cloud Engineer–Google Cloud Certification Prep,A Practical Guide to Prepare for the GCP Associate Cloud Engineer Certification Exam With Hands-on Demos and Mock Exam!,4.7,180,All Levels,78 lectures,9.5 total hours,Current price: $69.99
gcp,https://www.udemy.com/course/google-cloud-certified-professional-cloud-developer/,https://img-c.udemycdn.com/course/240x135/4178136_bd4b.jpg,"in28Minutes Official, Ranga Karanam | GCP Certification - Google Cloud Engineer & Architect",Google Cloud Developer - GCP Professional Certification,Get Google Cloud Developer Professional Certification. Develop Solutions for Google Cloud Platform - GCP.,4.5,2631,All Levels,352 lectures,21.5 total hours,Current price: $94.99
gcp,https://www.udemy.com/course/gcp-de-professional-data-engineer-practice-exam/,https://img-c.udemycdn.com/course/240x135/5863618_622a_5.jpg,Priya Dw | CertifyQuick - CertShield,Become a GCP Data Engineer Pro: Certification Exam Practice,Master Google Cloud data engineering and confidently prepare for the Professional Data Engineer certification-CertShield,4.7,24,All Levels,328 questions,,Current price: $59.99
gcp,https://www.udemy.com/course/big-data-engineering-bootcamp-with-gcp-and-azure-cloud/,https://img-c.udemycdn.com/course/240x135/6242299_e787.jpg,"Krish Naik, Mayank Aggarwal, KRISHAI Technologies Private Limited","Big Data Engineering Bootcamp with GCP, and Azure Cloud","Master Big Data with Hadoop, Spark, Kafka & Cloud | Build Real-World Projects & Scalable Data Pipelines from Scratch",4.7,357,All Levels,301 lectures,73.5 total hours,Current price: $44.99
gcp,https://www.udemy.com/course/gcpgoogle-cloud-professional-data-engineer-exam-2025/,https://img-c.udemycdn.com/course/240x135/6489105_8506_4.jpg,Cloud Dog,【GCP】Google Cloud Professional Data Engineer Exam - 2025,Master Scenarios for the GCP Professional Data Engineer Exam Exam: Comprehensive Solutions & In-Depth Explanations,5.0,1,Intermediate,150 questions,,Current price: $44.99
gcp,https://www.udemy.com/course/google-cloud-platform-gcp-fundamentals-for-beginners/,https://img-c.udemycdn.com/course/240x135/2604078_8780_3.jpg,Janakiram MSV,Google Cloud Platform (GCP) Fundamentals for Beginners,Learn How to Use Key GCP Services From the Ground Up Through Hands-On Demos and Detailed Use Cases!,4.5,43046,Beginner,98 lectures,5.5 total hours,
gcp,https://www.udemy.com/course/become-an-associate-software-engineer/,https://img-c.udemycdn.com/course/240x135/5958238_8203_3.jpg,Paulo Victor Gomes,Become a Software Engineer,The Complete Guide to Becoming an Associate Software Engineer: Your Entry into the Tech World,4.8,19,All Levels,135 lectures,14.5 total hours,Current price: $19.99
