skill,link,image_link,partner,title,course_description,rating,num_review,difficulty,num_lecture,duration,price
c/c++,https://www.udemy.com/course/become-an-associate-software-engineer/,https://img-c.udemycdn.com/course/240x135/5958238_8203_3.jpg,Paulo Victor Gomes,Become a Software Engineer,The Complete Guide to Becoming an Associate Software Engineer: Your Entry into the Tech World,4.8,19.0,All Levels,135 lectures,14.5 total hours,Current price: $19.99
c/c++,https://www.udemy.com/course/software-engineering-101/,https://img-c.udemycdn.com/course/240x135/2267906_505c.jpg,Kurt Anderson,Software Engineering 101: Plan and Execute Better Software.,Software Engineering 101: Use Software Engineering to Plan and Build Amazing Software + Learn SCRUM Framework!,4.5,12113.0,All Levels,102 lectures,8.5 total hours,
c/c++,https://www.udemy.com/course/c-programming-for-beginners-/,https://img-c.udemycdn.com/course/240x135/1467808_f8c0.jpg,"Tim Buchalka's Learn Programming Academy, Jason Fedin",C Programming For Beginners - Master the C Language,C Programming will increase career options.  Become a better dev in other languages by learning C.   Pointers explained,4.4,37997.0,All Levels,150 lectures,25.5 total hours,
c/c++,https://www.udemy.com/course/software-development-and-it-complete-guide-to-key-concepts/,https://img-c.udemycdn.com/course/240x135/4879694_6afd_4.jpg,Kamil Kulik • Software Engineer,Software Development and IT - Complete Guide To Key Concepts,"For new joiners in IT industry: basics of apps, APIs, testing, Cloud, GIT, deployment, containerisation, SDLC, Scrum",4.7,1213.0,All Levels,109 lectures,6.5 total hours,Current price: $84.99
c/c++,https://www.udemy.com/course/c-programming-for-beginners-programming-in-c/,https://img-c.udemycdn.com/course/240x135/3173974_b870_4.jpg,Vlad Budnitski,C Programming Bootcamp - The Complete C Language Course,C Programming 2025: Master the Fundamentals of C Programming Language. Join the Comprehensive C Bootcamp Masterclass!,4.5,8880.0,All Levels,396 lectures,44 total hours,
c/c++,https://www.udemy.com/course/the-ai-engineer-course-complete-ai-engineer-bootcamp/,https://img-c.udemycdn.com/course/240x135/6112535_7103.jpg,365 Careers,The AI Engineer Course 2025: Complete AI Engineer Bootcamp,"Complete AI Engineer Training: Python, NLP, Transformers, LLMs, LangChain, Hugging Face, APIs",4.6,2803.0,All Levels,367 lectures,24.5 total hours,Current price: $89.99
c/c++,https://www.udemy.com/course/beginning-c-plus-plus-programming/,https://img-c.udemycdn.com/course/240x135/1576854_9aeb_2.jpg,"Tim Buchalka's Learn Programming Academy, Dr. Frank Mitropoulos",Beginning C++ Programming - From Beginner to Beyond,Obtain Modern C++ Object-Oriented Programming (OOP) and STL skills. C++14 and C++17 covered.  C++20 info see below.,4.6,75436.0,All Levels,305 lectures,46 total hours,
c/c++,https://www.udemy.com/course/the-complete-guide-to-becoming-a-software-architect/,https://img-c.udemycdn.com/course/240x135/2304734_767b.jpg,Memi Lavi,The Complete Guide to Becoming a Software Architect,"The most comprehensive guide that will make you a Software Architect, the most desired role in the software industry.",4.6,16080.0,Beginner,117 lectures,6 total hours,
c/c++,https://www.udemy.com/course/advanced-c-programming-course/,https://img-c.udemycdn.com/course/240x135/2800976_98e5.jpg,"Tim Buchalka's Learn Programming Academy, Jason Fedin",Advanced C Programming Course,Become a True Master of the C Programming Language - Confidently Apply for Real Time or Embedded C Jobs or contracts!,4.4,5100.0,Intermediate,175 lectures,29 total hours,
c/c++,https://www.udemy.com/course/software-architecture-design-of-modern-large-scale-systems/,https://img-c.udemycdn.com/course/240x135/3997622_0670_2.jpg,"Michael Pogrebinsky | Software Architecture, System Design, Java Expert, Top Developer Academy LLC",Software Architecture & Design of Modern Large Scale Systems,"Become a Software Architect or Technical Lead by Mastering Software Architecture, System Design & Big Data Processing.",4.7,11311.0,All Levels,45 lectures,7 total hours,Current price: $109.99
c/c++,https://www.udemy.com/course/c-programming-for-beginners-master-the-c-language-b/,https://img-c.udemycdn.com/course/240x135/6029272_2dbb_2.jpg,GeeksforGeeks (GfG),C Programming For Beginners - Master the C Language,"C Programming 2024: Master the C Language from basics to advanced including operators, loops, arrays, function and more",4.4,135.0,Beginner,313 lectures,37 total hours,Current price: $69.99
c/c++,https://www.udemy.com/course/complete-software-engineering-course-build-develop-better-software/,https://img-c.udemycdn.com/course/240x135/5663686_5172_6.jpg,Yogesh Dahake,Complete Software Engineering Course : Build Better Software,"Learn Everything of Software Engineering : Plan, Design ,Develop, Test and Execute Software's using Software Engineering",4.3,228.0,All Levels,196 lectures,15 total hours,Current price: $19.99
c/c++,https://www.udemy.com/course/c-programming-for-engineers/,https://img-c.udemycdn.com/course/240x135/5500284_58c9_4.jpg,MESA Academy,C Programming For Engineers,Learn C Programming Language Like Learning Alphabets. Learn All the Fundamentals of C in Simplest Way,,,Beginner,94 lectures,13.5 total hours,Current price: $19.99
c/c++,https://www.udemy.com/course/low-level-system-design/,https://img-c.udemycdn.com/course/240x135/6213077_f96e_4.jpg,Prateek Narang Sr. Software Engineer Google,"Low Level System Design, Design Patterns & SOLID Principles",Master Proven Design Techniques and SOLID Principles to Build Robust and Scalable Systems!,4.6,473.0,All Levels,70 lectures,9 total hours,Current price: $74.99
c/c++,https://www.udemy.com/course/testerbootcamp/,https://img-c.udemycdn.com/course/240x135/2125112_86f5_8.jpg,"Tarek Roshdy, Nezam Academy, Nezam Team",The Complete 2025 Software Testing Bootcamp,Your Step-by-Step Guide to Becoming a Professional Software Tester,4.5,33946.0,Beginner,395 lectures,37.5 total hours,
c/c++,https://www.udemy.com/course/the-modern-cpp-20-masterclass/,https://img-c.udemycdn.com/course/240x135/2987082_04e6_10.jpg,Daniel Gakwaya,The C++20 Masterclass :  From Fundamentals to Advanced,"Learn and Master Modern C++ From Beginning to Advanced in Plain English :  C++11, C++14, C++17, C++20 and More!",4.5,4978.0,All Levels,585 lectures,115 total hours,
c/c++,https://www.udemy.com/course/google-cloud-certification-associate-cloud-engineer/,https://img-c.udemycdn.com/course/240x135/3827154_aecc_4.jpg,"in28Minutes Official, Ranga Karanam | GCP Certification - Google Cloud Engineer & Architect",GCP Associate Cloud Engineer - Google Cloud Certification,GCP ACE - Google Cloud Associate Cloud Engineer certification. Begin your Google Cloud Platform - GCP journey!,4.6,31693.0,All Levels,299 lectures,18 total hours,
c/c++,https://www.udemy.com/course/software-development-from-a-to-z/,https://img-c.udemycdn.com/course/240x135/826410_16f3_14.jpg,Karoly Nyisztor • Professional Software Architect,Software Development From A to Z - Learn What Truly Matters,"Valuable Software Development Insights: IT Roles, Agile, SCRUM, SDLC, OOP, UML, Python Programming 101, Web Development",4.5,3313.0,Beginner,117 lectures,6.5 total hours,Current price: $89.99
c/c++,https://www.udemy.com/course/comprehensive-software-testing-bootcamp-beginner-to-expert/,https://img-c.udemycdn.com/course/240x135/5833748_65ca_3.jpg,Sanketh Shanbhag,Learn Software Testing : Beginner to Expert.,A Software Testing Bootcamp for beginners aiming to shape their careers in Software Testing and Quality Assurance (QA),4.5,125.0,Beginner,134 lectures,35 total hours,Current price: $64.99
c/c++,https://www.udemy.com/course/c-programming-pointers-from-zero-to-hero/,https://img-c.udemycdn.com/course/240x135/3408682_3d93_3.jpg,Vlad Budnitski,C Programming Masterclass: Pointers & Advanced C Language,"C Programming Advanced Topics: Pointers, Memory, Low-Level C Language and Embedded C Preparation",4.5,1317.0,Intermediate,251 lectures,41 total hours,
