skill,link,image_link,partner,title,course_description,rating,num_review,difficulty,num_lecture,duration,price
j2ee,https://www.udemy.com/course/the-complete-web-development-bootcamp/,https://img-c.udemycdn.com/course/240x135/1565838_e54e_18.jpg,"Dr. Angela Yu, Developer and Lead Instructor",The Complete Full-Stack Web Development Bootcamp,"Become a Full-Stack Web Developer with just ONE course. HTML, CSS, Javascript, Node, React, PostgreSQL, Web3 and DApps",4.7,431983,All Levels,374 lectures,61.5 total hours,Current price: $119.99
j2ee,https://www.udemy.com/course/the-web-developer-bootcamp/,https://img-c.udemycdn.com/course/240x135/625204_436a_3.jpg,Colt Steele,The Web Developer Bootcamp 2025,"With 10 Hours of React added. Become a Developer With ONE course - HTML, CSS, JavaScript, React, Node, MongoDB and More!",4.7,279902,All Levels,730 lectures,74 total hours,Current price: $149.99
j2ee,https://www.udemy.com/course/aws-certified-developer-associate-dva-c01/,https://img-c.udemycdn.com/course/240x135/1921420_384a_14.jpg,"Stephane Maarek | AWS Certified Cloud Practitioner,Solutions Architect,Developer",Ultimate AWS Certified Developer Associate 2025 DVA-C02,Full Practice Exam with Explanations included! PASS the Amazon Web Services Certified Developer Certification DVA-C02,4.7,110810,All Levels,461 lectures,32.5 total hours,Current price: $149.99
j2ee,https://www.udemy.com/course/web-dev-master/,https://img-c.udemycdn.com/course/240x135/6035102_7d1a.jpg,Hitesh Choudhary,Complete web development course,"Only web development course that you will need. Covers HTML, CSS, Tailwind, Node, React, MongoDB, Prisma, Deployment etc",4.7,9477,All Levels,231 lectures,79.5 total hours,Current price: $79.99
j2ee,https://www.udemy.com/course/web-developer-course/,https://img-c.udemycdn.com/course/240x135/446134_383c_3.jpg,Brad Hussey,Ultimate Web Designer & Web Developer Course,Become a Full-Stack Web Designer in 2023 - Learn Everything from Web Design Fundamentals to Front-End Web Development,4.6,14623,All Levels,262 lectures,35 total hours,Current price: $139.99
j2ee,https://www.udemy.com/course/become-a-web-developer/,https://img-c.udemycdn.com/course/240x135/288466_7404_4.jpg,Simon Sez IT,Web Developer Fundamentals: Newbie to Pro Web Bootcamp!,The 12 must have web programming courses to help you become the ultimate web developer. Includes 50+ hours of training.,4.5,98,All Levels,424 lectures,54.5 total hours,Current price: $59.99
j2ee,https://www.udemy.com/course/100-days-of-code/,https://img-c.udemycdn.com/course/240x135/2776760_f176_10.jpg,"Dr. Angela Yu, Developer and Lead Instructor",100 Days of Code: The Complete Python Pro Bootcamp,"Master Python by building 100 projects in 100 days. Learn data science, automation, build websites, games and apps!",4.7,361848,All Levels,592 lectures,56.5 total hours,Current price: $119.99
j2ee,https://www.udemy.com/course/become-a-web-developer-bootcamp/,https://img-c.udemycdn.com/course/240x135/5776152_44ed_5.jpg,Brad Schiff,Become a Web Developer: 2024 Bootcamp,"A guided path to boost beginner's confidence from scratch; learn HTML, CSS, JavaScript, MongoDB, Deployment and more!",4.7,241,All Levels,114 lectures,22.5 total hours,Current price: $89.99
j2ee,https://www.udemy.com/course/advanced-web-developer-course-beginner-to-advanced/,https://img-c.udemycdn.com/course/240x135/3438062_61c1.jpg,Fatah Gabrial,Advanced Web Developer Course - Beginner to Advanced,"Complete Advanced Web Developer Course, Beginner to Advanced Level. 6 in 1 Course Bundle with Practical's with Projects",4.6,994,Beginner,569 lectures,37 total hours,Current price: $54.99
j2ee,https://www.udemy.com/course/seo-for-web-developers/,https://img-c.udemycdn.com/course/240x135/4677892_d310.jpg,Nat Miletic,SEO for Web Developers,Do you want to raise your rates as a web developer without having to learn another programming language?,4.7,16,Beginner,11 lectures,3 total hours,Current price: $49.99
j2ee,https://www.udemy.com/course/spring-boot-and-spring-framework-tutorial-for-beginners/,https://img-c.udemycdn.com/course/240x135/4993276_3452.jpg,in28Minutes Official,[NEW] Master Spring Boot 3 & Spring Framework 6 with Java,"Become Java Spring Boot Full Stack Developer. Learn Spring Framework, Spring Boot, Spring Data, Docker & AWS",4.6,9808,All Levels,423 lectures,39 total hours,Current price: $99.99
j2ee,https://www.udemy.com/course/the-complete-guide-to-angular-2/,https://img-c.udemycdn.com/course/240x135/756150_c033_4.jpg,Maximilian Schwarzmüller,Angular - The Complete Guide (2025 Edition),"Master Angular (formerly Angular 2) and build awesome, reactive web apps with the successor of Angular.js",4.7,213730,All Levels,757 lectures,56 total hours,Current price: $119.99
j2ee,https://www.udemy.com/course/the-front-end-web-developer-bootcamp-html-css-js-react/,https://img-c.udemycdn.com/course/240x135/5178116_6858.jpg,Meta Brains,"The Front-End Web Developer Bootcamp: HTML, CSS, JS & React","Get started as a front-end web developer with HTML, CSS, JavaScript, React.JS, and more!",4.4,993,All Levels,159 lectures,11 total hours,Current price: $54.99
j2ee,https://www.udemy.com/course/the-web-dev-bootcamp/,https://img-c.udemycdn.com/course/240x135/6375895_c850_2.jpg,Burak Orkmez,100 Hours Web Development Bootcamp - Build 23 React Projects,The only project based course you will ever need. Get access to all kinds React.js projects that you can think of.,4.8,172,All Levels,414 lectures,122 total hours,Current price: $54.99
j2ee,https://www.udemy.com/course/web-developer-101-use-web-servers-to-build-sites-on-your-pc/,https://img-c.udemycdn.com/course/240x135/3176922_5ca3_19.jpg,Brandon Price,Web Developer 101-Use Web Servers to Build Sites on your PC,"Setup your pc to start making websites on Apache & IIS Web Servers. Wordpress, Joomla Drupal, ASP.NET, NodeJS, etc..",4.3,57,All Levels,88 lectures,15.5 total hours,Current price: $64.99
j2ee,https://www.udemy.com/course/the-advanced-web-developer-bootcamp/,https://img-c.udemycdn.com/course/240x135/1218586_9f86.jpg,"Colt Steele, Elie Schoppik, Tim Garcia, Matt Lane",The Advanced Web Developer Bootcamp,"Learn React 16, Redux, D3, ES2015, Testing, CSS Flexbox, Animations, SVG, AJAX, and more!",4.6,9371,Intermediate,391 lectures,34 total hours,Current price: $139.99
j2ee,https://www.udemy.com/course/full-stack-java-developer-java/,https://img-c.udemycdn.com/course/240x135/1993718_b47a_4.jpg,"StudyEasy Organization, Chand Sheikh",FULL STACK JAVA DEV: JAVA + JSP + SPRING + BOOT + JS + REACT,"Full Stack Java, JSP, Hibernate, Spring, Web-services/RestFul  API, Spring boot, JavaScript, React, FREE 6-month IDE.",4.4,11812,All Levels,716 lectures,84.5 total hours,Current price: $139.99
j2ee,https://www.udemy.com/course/the-essential-web-developer-course/,https://img-c.udemycdn.com/course/240x135/260756_bac8_3.jpg,Robert Kanaat,The Essential Web Developer Course - Build 12 Websites,"From an absolute beginner, to a certified Web developer, this course will teach you the ABCs of Web development.",4.5,1233,All Levels,177 lectures,16.5 total hours,Current price: $19.99
j2ee,https://www.udemy.com/course/python-and-django-full-stack-web-developer-bootcamp/,https://img-c.udemycdn.com/course/240x135/822444_a6db.jpg,"Jose Portilla, Pierian Training",Python and Django Full Stack Web Developer Bootcamp,"Learn to build websites with HTML , CSS , Bootstrap , Javascript , jQuery , Python 3 , and Django!",4.4,51257,All Levels,198 lectures,32 total hours,Current price: $139.99
j2ee,https://www.udemy.com/course/the-ultimate-fullstack-web-development-bootcamp/,https://img-c.udemycdn.com/course/240x135/3655840_1c3c.jpg,"Kane Ezki, Kalob Taulien, Radek Wilk",The Ultimate 2025 Fullstack Web Development Bootcamp,"Become a fullstack web developer (and get a job) by taking this ONE course, even if you've never coded before.",4.6,8191,All Levels,616 lectures,55 total hours,Current price: $119.99
