skill,link,image_link,partner,title,course_description,rating,num_review,difficulty,num_lecture,duration,price
nlp,https://www.udemy.com/course/nlp-practitioner-master-practitioner-certification-course/,https://img-c.udemycdn.com/course/240x135/1731900_fd3d_6.jpg,"Graham Nicholls, The Priority Academy Ltd",NLP Practitioner & NLP Master Practitioner Cert (ACCREDITED),The ONLY Combined NLP Practitioner & NLP Master Practitioner Certification Course on this platform - 2 Courses in 1!,4.7,6661,All Levels,188 lectures,19 total hours,Current price: $129.99
nlp,https://www.udemy.com/course/nlp-practitioner-neuro-linguistic-programming-certification-abnlp/,https://img-c.udemycdn.com/course/240x135/1173854_8b3a_20.jpg,"Matthew Barnett, HeadgearLabs™ Personal & Professional Development",iGNLP™ Certified NLP Practitioner (Associate),NLP Get the only Genuine 100%  iGNLP™  Accredited - NLP Practitioner Certification Recognised Globally,4.8,9890,All Levels,276 lectures,30 total hours,Current price: $109.99
nlp,https://www.udemy.com/course/the-complete-web-development-bootcamp/,https://img-c.udemycdn.com/course/240x135/1565838_e54e_18.jpg,"Dr. Angela Yu, Developer and Lead Instructor",The Complete Full-Stack Web Development Bootcamp,"Become a Full-Stack Web Developer with just ONE course. HTML, CSS, Javascript, Node, React, PostgreSQL, Web3 and DApps",4.7,431983,All Levels,374 lectures,61.5 total hours,Current price: $119.99
nlp,https://www.udemy.com/course/nlp-practitioner-and-life-coach-certification-accredited/,https://img-c.udemycdn.com/course/240x135/2323532_2abe_4.jpg,"Joeel & Natalie of Transformation Services, David Key, Transformation Services",NLP Practitioner & NLP Life Coach Certification (Accredited),NLP Certification & Ultimate Guide. Become a Certified NLP (Neuro Linguistic Programming) Practitioner & NLP Life Coach,4.4,2814,All Levels,191 lectures,20.5 total hours,Current price: $119.99
nlp,https://www.udemy.com/course/the-ai-engineer-course-complete-ai-engineer-bootcamp/,https://img-c.udemycdn.com/course/240x135/6112535_7103.jpg,365 Careers,The AI Engineer Course 2025: Complete AI Engineer Bootcamp,"Complete AI Engineer Training: Python, NLP, Transformers, LLMs, LangChain, Hugging Face, APIs",4.6,2803,All Levels,367 lectures,24.5 total hours,Current price: $89.99
nlp,https://www.udemy.com/course/the-web-developer-bootcamp/,https://img-c.udemycdn.com/course/240x135/625204_436a_3.jpg,Colt Steele,The Web Developer Bootcamp 2025,"With 10 Hours of React added. Become a Developer With ONE course - HTML, CSS, JavaScript, React, Node, MongoDB and More!",4.7,279902,All Levels,730 lectures,74 total hours,Current price: $149.99
nlp,https://www.udemy.com/course/introduction-to-nlp-certification/,https://img-c.udemycdn.com/course/240x135/446108_939e_15.jpg,Matthew Barnett,iGNLP™ - Certified NLP  Assoc and Master Practitioner,A FULLY iGNLP™ CERTIFIED - NLP (Neuro Linguistic Programming) Certification Training from Beginner to Expert level,4.6,2321,All Levels,494 lectures,44.5 total hours,Current price: $119.99
nlp,https://www.udemy.com/course/nlp-practitioner-neuro-linguistic-programming-online-course/,https://img-c.udemycdn.com/course/240x135/1336872_db4d_17.jpg,"Kain Ramsay, The Academy of Applied Psychology",NLP Practitioner Training (Neuro-Linguistic Programming),Know Your Psychology | Learn Effective NLP Productivity Strategies | Develop a Mature Mindset | Foster Inner Resilience,4.6,26227,All Levels,154 lectures,42 total hours,Current price: $124.99
nlp,https://www.udemy.com/course/nlp-personal-transformation-training/,https://img-c.udemycdn.com/course/240x135/1650264_6909_3.jpg,Steven Burns,NLP Personal Transformation (NLP for Personal Development),Train your Brain. Master your Mindset. Unlock your Colossal Potential.,4.7,431,All Levels,59 lectures,7.5 total hours,Current price: $79.99
nlp,https://www.udemy.com/course/nlp-power-boost-your-personal-development-mental-clarity/,https://img-c.udemycdn.com/course/240x135/6025592_ec91_4.jpg,Claudiu Ivan Academy,NLP Power: Boost Your Personal Development & Mental Clarity,NLP Mastery: Learn Neuro-Linguistic Programming for Self-Improvement Mental Wellness and Growth with Psychology Insights,4.8,437,All Levels,35 lectures,1.5 total hours,Current price: $19.99
nlp,https://www.udemy.com/course/100-days-of-code/,https://img-c.udemycdn.com/course/240x135/2776760_f176_10.jpg,"Dr. Angela Yu, Developer and Lead Instructor",100 Days of Code: The Complete Python Pro Bootcamp,"Master Python by building 100 projects in 100 days. Learn data science, automation, build websites, games and apps!",4.7,361848,All Levels,592 lectures,56.5 total hours,Current price: $119.99
nlp,https://www.udemy.com/course/develop-python-django-web-nlp-app/,https://img-c.udemycdn.com/course/240x135/2835434_684c.jpg,Zlatko Lazarevski,Python Django Web Development of NLP App,Django Web Development with Python and Spacy,4.3,10,Beginner,13 lectures,2 total hours,Current price: $34.99
nlp,https://www.udemy.com/course/nlp-natural-language-processing-with-python/,https://img-c.udemycdn.com/course/240x135/2058283_214d.jpg,"Jose Portilla, Pierian Training",NLP - Natural Language Processing with Python,"Learn to use Machine Learning, Spacy, NLTK, SciKit-Learn, Deep Learning, and more to conduct Natural Language Processing",4.5,18691,Intermediate,80 lectures,11.5 total hours,Current price: $109.99
nlp,https://www.udemy.com/course/neuro-linguistic-programming-nlp-master-practitioner-online-course/,https://img-c.udemycdn.com/course/240x135/1336870_9d77_16.jpg,"Kain Ramsay, The Academy of Applied Psychology",Neuro-Linguistic Programming Master Practitioner (Advanced),Advanced NLP and Mindset Development | Influential Communication Skills | Outcome Focused Goal Setting | NLP for Leaders,4.7,4362,All Levels,157 lectures,45.5 total hours,Current price: $109.99
nlp,https://www.udemy.com/course/spark-nlp-for-data-scientists/,https://img-c.udemycdn.com/course/240x135/4790132_5802_4.jpg,"Ace Vo, David Talby, Jiri Dobes, Veysel Kocaman",Spark NLP for Data Scientists,"Unlock your NLP power with Spark NLP, the most popular NLP library in enterprises",4.6,61,Intermediate,78 lectures,12.5 total hours,Current price: $19.99
nlp,https://www.udemy.com/course/complete-machine-learning-nlp-bootcamp-mlops-deployment/,https://img-c.udemycdn.com/course/240x135/5993822_2c2a_7.jpg,"Krish Naik, KRISHAI Technologies Private Limited","Complete Data Science,Machine Learning,DL,NLP Bootcamp","Master the theory, practice,and math behind Data Science,Machine Learning,Deep Learning,NLP with end to end projects",4.5,11296,All Levels,429 lectures,99 total hours,Current price: $94.99
nlp,https://www.udemy.com/course/introduction-to-nlp-london/,https://img-c.udemycdn.com/course/240x135/864848_58fc_8.jpg,"Matthew Barnett, HeadgearLabs™ Personal & Professional Development",iGNLP™ - NLP In Sales Certification,Get new sales with NLP skills for persuasion and influence - makes sales easy using Neuro-Linguistic Programming,4.6,1147,All Levels,90 lectures,5.5 total hours,Current price: $69.99
nlp,https://www.udemy.com/course/nlp-beginner-practitioner-course-certification-ianlp/,https://img-c.udemycdn.com/course/240x135/4052060_7c3e_12.jpg,Tea Motti,"NLP Practitioner, Beginner, Certified / Accredited™ trainer",MIND DESIGN Accredited™ -  NLP Beginner Practitioner Course Certification,4.7,283,Beginner,52 lectures,12.5 total hours,Current price: $89.99
nlp,https://www.udemy.com/course/nlp-at-work-nlp-for-career-development/,https://img-c.udemycdn.com/course/240x135/2065107_a784_7.jpg,Steven Burns,NLP at Work: NLP for Career Development,Use NLP in the Workplace; Be more successful in your career; Accelerate your Professional & Career Development,4.4,62,All Levels,71 lectures,7.5 total hours,Current price: $49.99
nlp,https://www.udemy.com/course/nlp-in-python/,https://img-c.udemycdn.com/course/240x135/3257648_f800_6.jpg,Laxmi Kant | KGP Talkie,2025 Natural Language Processing (NLP) Mastery in Python,"Text Cleaning, Spacy, NLTK, Scikit-Learn, Deep Learning, word2vec, GloVe, LSTM for Sentiment, Emotion, Spam, CV Parsing",4.5,1017,All Levels,317 lectures,38.5 total hours,Current price: $69.99
