skill,link,image_link,partner,title,course_description,rating,num_review,difficulty,num_lecture,duration,price
jboss,https://www.udemy.com/course/jboss-course/,https://img-c.udemycdn.com/course/240x135/6248263_6c5d_3.jpg,The Tech Courses,The Complete Course of JBoss EAP 2025,"Learn JBoss Wildlfy in a Professional Way from Scratch. Become an Expert in Jboss Administration, from ZERO to HERO!",3.1,9,All Levels,26 lectures,8.5 total hours,Current price: $54.99
jboss,https://www.udemy.com/course/jboss-eap-basics-administrationconfiguration-development/,https://img-c.udemycdn.com/course/240x135/2927502_8146_6.jpg,Karthikeyan Dharmaraj,"JBOSS EAP Basics-Administration,configuration & development","Basics of JBOSS EAP Enterprise Application Platform 7.3 - Administration, configuration and development (and Wildfly AS)",4.2,588,Beginner,28 lectures,5 total hours,Current price: $44.99
jboss,https://www.udemy.com/course/the-complete-web-development-bootcamp/,https://img-c.udemycdn.com/course/240x135/1565838_e54e_18.jpg,"Dr. Angela Yu, Developer and Lead Instructor",The Complete Full-Stack Web Development Bootcamp,"Become a Full-Stack Web Developer with just ONE course. HTML, CSS, Javascript, Node, React, PostgreSQL, Web3 and DApps",4.7,431983,All Levels,374 lectures,61.5 total hours,Current price: $119.99
jboss,https://www.udemy.com/course/the-web-developer-bootcamp/,https://img-c.udemycdn.com/course/240x135/625204_436a_3.jpg,Colt Steele,The Web Developer Bootcamp 2025,"With 10 Hours of React added. Become a Developer With ONE course - HTML, CSS, JavaScript, React, Node, MongoDB and More!",4.7,279902,All Levels,730 lectures,74 total hours,Current price: $149.99
jboss,https://www.udemy.com/course/mastering-jboss-eap-8-administration-from-intro-to-advanced/,https://img-c.udemycdn.com/course/240x135/5906696_f0f5_5.jpg,Digitalk Systems,Mastering JBoss EAP 8 Administration: From Intro to Advanced,Empower Yourself with In-Depth Expertise in JBoss EAP 8 Administration. Fine-Grained Contents!!,4.4,52,All Levels,28 lectures,8 total hours,Current price: $74.99
jboss,https://www.udemy.com/course/jboss-eap-from-basics-to-advanced/,https://img-c.udemycdn.com/course/240x135/6311575_faa6.jpg,EDUCBA Bridging the Gap,JBoss EAP - From Basics to Advanced,"Learn to deploy, manage, and troubleshoot enterprise applications with JBoss EAP, mastering every step.",4.5,1,All Levels,24 lectures,3.5 total hours,Current price: $44.99
jboss,https://www.udemy.com/course/100-days-of-code/,https://img-c.udemycdn.com/course/240x135/2776760_f176_10.jpg,"Dr. Angela Yu, Developer and Lead Instructor",100 Days of Code: The Complete Python Pro Bootcamp,"Master Python by building 100 projects in 100 days. Learn data science, automation, build websites, games and apps!",4.7,361848,All Levels,592 lectures,56.5 total hours,Current price: $119.99
jboss,https://www.udemy.com/course/become-a-web-developer/,https://img-c.udemycdn.com/course/240x135/288466_7404_4.jpg,Simon Sez IT,Web Developer Fundamentals: Newbie to Pro Web Bootcamp!,The 12 must have web programming courses to help you become the ultimate web developer. Includes 50+ hours of training.,4.5,98,All Levels,424 lectures,54.5 total hours,Current price: $59.99
jboss,https://www.udemy.com/course/web-dev-master/,https://img-c.udemycdn.com/course/240x135/6035102_7d1a.jpg,Hitesh Choudhary,Complete web development course,"Only web development course that you will need. Covers HTML, CSS, Tailwind, Node, React, MongoDB, Prisma, Deployment etc",4.7,9477,All Levels,231 lectures,79.5 total hours,Current price: $79.99
jboss,https://www.udemy.com/course/web-developer-101-use-web-servers-to-build-sites-on-your-pc/,https://img-c.udemycdn.com/course/240x135/3176922_5ca3_19.jpg,Brandon Price,Web Developer 101-Use Web Servers to Build Sites on your PC,"Setup your pc to start making websites on Apache & IIS Web Servers. Wordpress, Joomla Drupal, ASP.NET, NodeJS, etc..",4.3,57,All Levels,88 lectures,15.5 total hours,Current price: $64.99
jboss,https://www.udemy.com/course/deno-for-web-developers/,https://img-c.udemycdn.com/course/240x135/3217933_8d01_12.jpg,Simple Coder,Deno For Web Developers,The comprehensive practical guide to Deno for web developers. Learn the core and build real world app.,4.4,22,All Levels,205 lectures,23.5 total hours,Current price: $49.99
jboss,https://www.udemy.com/course/seo-for-web-developers/,https://img-c.udemycdn.com/course/240x135/4677892_d310.jpg,Nat Miletic,SEO for Web Developers,Do you want to raise your rates as a web developer without having to learn another programming language?,4.7,16,Beginner,11 lectures,3 total hours,Current price: $49.99
jboss,https://www.udemy.com/course/aws-certified-developer-associate-dva-c01/,https://img-c.udemycdn.com/course/240x135/1921420_384a_14.jpg,"Stephane Maarek | AWS Certified Cloud Practitioner,Solutions Architect,Developer",Ultimate AWS Certified Developer Associate 2025 DVA-C02,Full Practice Exam with Explanations included! PASS the Amazon Web Services Certified Developer Certification DVA-C02,4.7,110810,All Levels,461 lectures,32.5 total hours,Current price: $149.99
jboss,https://www.udemy.com/course/web-developer-course/,https://img-c.udemycdn.com/course/240x135/446134_383c_3.jpg,Brad Hussey,Ultimate Web Designer & Web Developer Course,Become a Full-Stack Web Designer in 2023 - Learn Everything from Web Design Fundamentals to Front-End Web Development,4.6,14623,All Levels,262 lectures,35 total hours,Current price: $139.99
jboss,https://www.udemy.com/course/mongodb-the-complete-developers-guide/,https://img-c.udemycdn.com/course/240x135/1906852_93c6_2.jpg,"Academind by Maximilian Schwarzmüller, Maximilian Schwarzmüller",MongoDB - The Complete Developer's Guide 2025,"Master MongoDB Development for Web & Mobile Apps. CRUD Operations, Indexes, Aggregation Framework - All about MongoDB!",4.6,26573,All Levels,266 lectures,17.5 total hours,Current price: $99.99
jboss,https://www.udemy.com/course/advanced-web-developer-course-beginner-to-advanced/,https://img-c.udemycdn.com/course/240x135/3438062_61c1.jpg,Fatah Gabrial,Advanced Web Developer Course - Beginner to Advanced,"Complete Advanced Web Developer Course, Beginner to Advanced Level. 6 in 1 Course Bundle with Practical's with Projects",4.6,994,Beginner,569 lectures,37 total hours,Current price: $54.99
jboss,https://www.udemy.com/course/spring-web-services-tutorial/,https://img-c.udemycdn.com/course/240x135/1302610_5c62_4.jpg,in28Minutes Official,Master Java Web Services and REST API with Spring Boot,Build Java Web Services & REST API - RESTful & SOAP - with Spring & Spring Boot. Learn REST API & SOAP Web Services Now!,4.5,16044,All Levels,154 lectures,13.5 total hours,Current price: $129.99
jboss,https://www.udemy.com/course/become-a-web-developer-bootcamp/,https://img-c.udemycdn.com/course/240x135/5776152_44ed_5.jpg,Brad Schiff,Become a Web Developer: 2024 Bootcamp,"A guided path to boost beginner's confidence from scratch; learn HTML, CSS, JavaScript, MongoDB, Deployment and more!",4.7,241,All Levels,114 lectures,22.5 total hours,Current price: $89.99
jboss,https://www.udemy.com/course/redis-the-complete-developers-guide-p/,https://img-c.udemycdn.com/course/240x135/4672206_9053.jpg,Stephen Grider,Redis: The Complete Developer's Guide,"Master Redis v7.0 with hands-on exercises. Includes Modules, Scripting, Concurrency, and Streams!",4.7,1886,All Levels,188 lectures,15.5 total hours,Current price: $84.99
jboss,https://www.udemy.com/course/the-complete-guide-to-angular-2/,https://img-c.udemycdn.com/course/240x135/756150_c033_4.jpg,Maximilian Schwarzmüller,Angular - The Complete Guide (2025 Edition),"Master Angular (formerly Angular 2) and build awesome, reactive web apps with the successor of Angular.js",4.7,213730,All Levels,757 lectures,56 total hours,Current price: $119.99
