skill,link,image_link,partner,title,course_description,rating,num_review,difficulty,num_lecture,duration,price
data migration,https://www.udemy.com/course/the-data-analyst-course-complete-data-analyst-bootcamp/,https://img-c.udemycdn.com/course/240x135/3570337_9b02_6.jpg,365 Careers,The Data Analyst Course: Complete Data Analyst Bootcamp,"Complete Data Analyst Training: Python, NumPy, Pandas, Data Collection, Preprocessing, Data Types, Data Visualization",4.5,21135,All Levels,282 lectures,21.5 total hours,Current price: $149.99
data migration,https://www.udemy.com/course/data-migration/,https://img-c.udemycdn.com/course/240x135/5263746_f473_3.jpg,M Nahid Rahman,Data Migration - A Methodical Approach,"Data Migration is the one of initial, yet most-impactful, steps following a merger or acquisition.",4.0,48,Beginner,30 lectures,3 total hours,Current price: $19.99
data migration,https://www.udemy.com/course/data-analytics-career-track/,https://img-c.udemycdn.com/course/240x135/5787046_e749_10.jpg,Shahriar's Sight Academy,Data Analytics Career Path: 72 Days of Data Analyst Bootcamp,"Learn Excel, MySQL, Python, PowerBI, ChatGPT for A-Z Data Analysis. Become a Full-Packed Data Analyst. [5 Courses in 1]",4.3,958,All Levels,359 lectures,34.5 total hours,Current price: $79.99
data migration,https://www.udemy.com/course/technical-business-analytics-for-agile-decision-making/,https://img-c.udemycdn.com/course/240x135/4990970_895f_4.jpg,Leo Zhu,"Business Analyst Bootcamp: Excel, Stats, SQL, Tableau","30+ Data Analysis, Business Intelligence, and Decision Making Exercises for Agile Business Analytics",4.5,621,All Levels,95 lectures,23.5 total hours,Current price: $64.99
data migration,https://www.udemy.com/course/the-business-intelligence-analyst-course-2018/,https://img-c.udemycdn.com/course/240x135/1653432_3a57_3.jpg,"365 Careers, 365 Team",The Business Intelligence Analyst Course 2025,"The skills you need to become a BI Analyst - Statistics, Database theory, SQL, Tableau – Everything is included",4.6,47217,All Levels,467 lectures,23 total hours,Current price: $109.99
data migration,https://www.udemy.com/course/complete-data-analyst-bootcamp-from-basics-to-advanced/,https://img-c.udemycdn.com/course/240x135/6074041_36f4_3.jpg,"Krish Naik, Jayant Topnani, KRISHAI Technologies Private Limited",Complete Data Analyst Bootcamp From Basics To Advanced,"Master Data Analysis: Python, Statistics, EDA, Feature Engineering, Power BI, and SQL Server,Snowflake,AWS",4.5,4995,All Levels,407 lectures,71.5 total hours,Current price: $79.99
data migration,https://www.udemy.com/course/sap-data-migration-along-with-sap-data-services-bods/,https://img-c.udemycdn.com/course/240x135/5448522_2c88_4.jpg,Imran Mohammad,SAP Data Migration along with SAP Data Services (BODS),"The course covers SAP Data Migration strategies to load data in S4HANA using BODS, IDoc, BAPI, LSMW and LTMC",4.4,121,All Levels,30 lectures,19.5 total hours,Current price: $79.99
data migration,https://www.udemy.com/course/the-data-strategy-course-building-a-data-driven-business/,https://img-c.udemycdn.com/course/240x135/3870162_dde5.jpg,"365 Careers, Bernard Marr",The Data Strategy Course: Building a Data-driven Business,A Practical Guide to Intelligent Business Performance: Learn How to Position Your Business for Success Leveraging Data,4.4,5256,All Levels,78 lectures,4.5 total hours,Current price: $94.99
data migration,https://www.udemy.com/course/mastering-sap-data-migration-techniques-for-sap-consultants/,https://img-c.udemycdn.com/course/240x135/6231215_188b_2.jpg,Vin WC,Mastering SAP Data Migration Techniques For SAP Consultants,SAP Data Migration and Migration Tools For SAP Functional Consultants,4.5,9,All Levels,14 lectures,12.5 total hours,Current price: $74.99
data migration,https://www.udemy.com/course/data-entry-skills-a-complete-data-entry-course-from-scratch/,https://img-c.udemycdn.com/course/240x135/5223618_671c.jpg,Data Tutors,Data Entry Skills: A Complete Data Entry Course from Scratch,A Complete Guide to Data Entry Skills: Learn Data Entry Skills and become a Data Entry Pro & Get a Online Data Entry Job,4.5,2672,Beginner,201 lectures,16 total hours,Current price: $19.99
data migration,https://www.udemy.com/course/salesforcebusinessanalyst/,https://img-c.udemycdn.com/course/240x135/4746864_2973_4.jpg,"Rapid Reskill by Mike Wheeler, Evan Wheeler",The Complete Salesforce Certified Business Analyst Course,Salesforce Business Analyst Certification Exam - Earn Salesforce's Newest Certification and Learn Business Analysis,3.9,1823,All Levels,92 lectures,5 total hours,Current price: $89.99
data migration,https://www.udemy.com/course/python-mysql-chatgpt-tableau-with-data-analysis-projects/,https://img-c.udemycdn.com/course/240x135/5874984_3d2b_17.jpg,Graeme Gordon,"Data Analyst in Python, Tableau, SQL & ChatGPT with Projects","4 in 1 Bundle - Data Analytics with Python, SQL, ChatGPT projects. Prepare for the Tableau Data Analyst Certification.",4.7,355,All Levels,199 lectures,21.5 total hours,Current price: $84.99
data migration,https://www.udemy.com/course/data-analyst-skillpath-zero-to-hero-in-excel-sql-python/,https://img-c.udemycdn.com/course/240x135/4316674_7708.jpg,Start-Tech Academy,"Data Analyst Skillpath: Zero to Hero in Excel, SQL & Python","Begin data analytics by learning Excel, SQL, Python, Analytics & ML concepts from scratch. Must-know for a data analyst.",4.5,6696,All Levels,225 lectures,23 total hours,Current price: $99.99
data migration,https://www.udemy.com/course/data-analyst-professional-certificate-in-data-analysis/,https://img-c.udemycdn.com/course/240x135/6300333_97a2.jpg,"MTF Institute of Management, Technology and Finance",Data Analyst: Professional Certificate in Data Analysis,"Data Based Decision Making, Data Analysis. Data Collection, Cleaning, Statistical Analysis, Visualisation, Privacy.",4.6,366,All Levels,236 lectures,19 total hours,Current price: $69.99
data migration,https://www.udemy.com/course/business-and-data-analysis-with-sql/,https://img-c.udemycdn.com/course/240x135/1629684_c896_7.jpg,Geoffrey Devitt,SQL Essentials for Business Analysts and Data Professionals,Mastering SQL: Essential Skills for Data and Business Analysts,4.2,110,Intermediate,39 lectures,5.5 total hours,Current price: $59.99
data migration,https://www.udemy.com/course/tableau_certified_associate/,https://img-c.udemycdn.com/course/240x135/3729802_eea6_4.jpg,Amandeep Sawhney | HawkEye Data,Tableau Data Analyst Certification Prep 2025,Ace the Tableau Data Analyst certification exam on your first attempt with in-depth videos and 45+ quizzes!,4.7,1438,All Levels,105 lectures,11 total hours,Current price: $89.99
data migration,https://www.udemy.com/course/hana-migration-cockpit/,https://img-c.udemycdn.com/course/240x135/3698886_02bb_3.jpg,Sastrageek Solutions,Data Migration in SAP S/4 Hana - Hana Migration Cockpit,Data Migration to S/4 Hana with Green Field Implementation Approach,4.4,1149,All Levels,29 lectures,5.5 total hours,Current price: $39.99
data migration,https://www.udemy.com/course/data-modelling-and-database-design-for-business-analysts/,https://img-c.udemycdn.com/course/240x135/1641148_cbf9.jpg,Dr Monjur Ahmed,Data Modelling and Database Design for Business Analysts,Learn Data Modelling and Database Design to become a successful Business Analyst,4.0,132,Beginner,15 lectures,2 total hours,Current price: $44.99
data migration,https://www.udemy.com/course/sap-data-migration-sap-ecc-s4-hana-data-migration/,https://img-c.udemycdn.com/course/240x135/4952338_c93c_3.jpg,Mohanraj Muthuraja,SAP Data Migration ( SAP ECC / S4 HANA Data Migration) | ETL,"SAP Data Migration, S/4 HANA, ECC, LSMW, LTMC, IDOC, BAPI, BODS, Preload & Recon Reports, LSMW ABAP Code & Debug, LTMOM",4.3,271,All Levels,39 lectures,8 total hours,Current price: $64.99
data migration,https://www.udemy.com/course/sql-mysql-for-data-analytics-and-business-intelligence/,https://img-c.udemycdn.com/course/240x135/1405632_6e6f_2.jpg,"365 Careers, 365 Team",SQL - MySQL for Data Analytics and Business Intelligence,"SQL that will get you hired – SQL for Data Science, Data Engineering, Business Analysis, Marketing, and Data Management",4.6,61887,All Levels,333 lectures,12 total hours,Current price: $139.99
