skill,link,image_link,partner,title,course_description,rating,num_review,difficulty,num_lecture,duration,price
t-sql,https://www.udemy.com/course/technical-business-analytics-for-agile-decision-making/,https://img-c.udemycdn.com/course/240x135/4990970_895f_4.jpg,Leo Zhu,"Business Analyst Bootcamp: Excel, Stats, SQL, Tableau","30+ Data Analysis, Business Intelligence, and Decision Making Exercises for Agile Business Analytics",4.5,621,All Levels,95 lectures,23.5 total hours,Current price: $64.99
t-sql,https://www.udemy.com/course/the-business-intelligence-analyst-course-2018/,https://img-c.udemycdn.com/course/240x135/1653432_3a57_3.jpg,"365 Careers, 365 Team",The Business Intelligence Analyst Course 2025,"The skills you need to become a BI Analyst - Statistics, Database theory, SQL, Tableau – Everything is included",4.6,47217,All Levels,467 lectures,23 total hours,Current price: $109.99
t-sql,https://www.udemy.com/course/t-sql-for-data-analysts/,https://img-c.udemycdn.com/course/240x135/198554_134b_4.jpg,Steve Fox,Introduction to T-SQL for Data Analysts,"In 60 minutes, learn 30 of the most important Transact-SQL (T-SQL)  tasks that data analysts need to perform",4.3,223,Beginner,6 lectures,,Current price: $34.99
t-sql,https://www.udemy.com/course/business-analyst-sql-survival-guide/,https://img-c.udemycdn.com/course/240x135/2111876_25d4.jpg,Daniel Gater,Business Analyst - SQL Survival Guide,"Get started in SQL; learn how databases work, connect to one, and get the data you need.",4.3,116,Beginner,19 lectures,2.5 total hours,Current price: $59.99
t-sql,https://www.udemy.com/course/online-t-sql-developer-video-training/,https://img-c.udemycdn.com/course/240x135/2419248_8d46_2.jpg,Vikas Munjal,"Beginning T-SQL for SQL Server Developer, Data Analyst & DBA","Step By Step Practical Training on Programming, Development and Querying Microsoft SQL Server using Transact SQL",4.6,15,Beginner,47 lectures,7.5 total hours,Current price: $19.99
t-sql,https://www.udemy.com/course/the-data-analyst-course-complete-data-analyst-bootcamp/,https://img-c.udemycdn.com/course/240x135/3570337_9b02_6.jpg,365 Careers,The Data Analyst Course: Complete Data Analyst Bootcamp,"Complete Data Analyst Training: Python, NumPy, Pandas, Data Collection, Preprocessing, Data Types, Data Visualization",4.5,21135,All Levels,282 lectures,21.5 total hours,Current price: $149.99
t-sql,https://www.udemy.com/course/business-and-data-analysis-with-sql/,https://img-c.udemycdn.com/course/240x135/1629684_c896_7.jpg,Geoffrey Devitt,SQL Essentials for Business Analysts and Data Professionals,Mastering SQL: Essential Skills for Data and Business Analysts,4.2,110,Intermediate,39 lectures,5.5 total hours,Current price: $59.99
t-sql,https://www.udemy.com/course/get-started-with-t-sql/,https://img-c.udemycdn.com/course/240x135/5611994_8098_2.jpg,Robert Angi-lazar,Get Started with T-SQL,Master the fundamentals of Transact-SQL and learn how to filter and analyze data in databases,4.8,2,Beginner,39 lectures,3.5 total hours,Current price: $19.99
t-sql,https://www.udemy.com/course/microsoft-sql-server-t-sql/,https://img-c.udemycdn.com/course/240x135/5173642_02db_3.jpg,"Trevoir Williams, Emar Morrison",The Ultimate T-SQL and Microsoft SQL Server Bootcamp,Querying | Microsoft SQL Server | T-SQL | 70-461 | Azure Data Studio | DDL | DML | Database Administration,4.6,44,Beginner,73 lectures,7 total hours,Current price: $74.99
t-sql,https://www.udemy.com/course/complete-data-analyst-bootcamp-from-basics-to-advanced/,https://img-c.udemycdn.com/course/240x135/6074041_36f4_3.jpg,"Krish Naik, Jayant Topnani, KRISHAI Technologies Private Limited",Complete Data Analyst Bootcamp From Basics To Advanced,"Master Data Analysis: Python, Statistics, EDA, Feature Engineering, Power BI, and SQL Server,Snowflake,AWS",4.5,4995,All Levels,407 lectures,71.5 total hours,Current price: $79.99
t-sql,https://www.udemy.com/course/sql-mysql-for-data-analytics-and-business-intelligence/,https://img-c.udemycdn.com/course/240x135/1405632_6e6f_2.jpg,"365 Careers, 365 Team",SQL - MySQL for Data Analytics and Business Intelligence,"SQL that will get you hired – SQL for Data Science, Data Engineering, Business Analysis, Marketing, and Data Management",4.6,61887,All Levels,333 lectures,12 total hours,Current price: $139.99
t-sql,https://www.udemy.com/course/sql-window-functions-for-advanced-querying/,https://img-c.udemycdn.com/course/240x135/3445780_daa8_6.jpg,Rwynn Christian,Advanced T-SQL: Window Functions for Advanced Querying,Learn how to use Window Functions or Analytical Functions to perform data analysis in SQL Server,4.7,557,Intermediate,17 lectures,1.5 total hours,Current price: $64.99
t-sql,https://www.udemy.com/course/learn-advanced-t-sql-for-sql-server-administrator/,https://img-c.udemycdn.com/course/240x135/1058670_a2cc_3.jpg,Raphael Asghar,Learn Advanced T-SQL For SQL Server Administrator,Getting to understand stored procedures,4.6,991,Intermediate,34 lectures,5.5 total hours,Current price: $54.99
t-sql,https://www.udemy.com/course/become-a-production-sql-server-administrator/,https://img-c.udemycdn.com/course/240x135/586902_418c_3.jpg,Raphael Asghar,Learn T-SQL From Scratch For SQL Server Administrator,All the information needed within the courses to set yourself for a successful career as a SQL Production DBA,4.7,2776,Beginner,63 lectures,9 total hours,Current price: $79.99
t-sql,https://www.udemy.com/course/t-sql-training/,https://img-c.udemycdn.com/course/240x135/1450676_cb74_4.jpg,Vikas Munjal,T-SQL Training with Real World Scenarios:Tricks of the Trade,Transact SQL Query Programming & Developer Advanced Microsoft SQL Server Online Video Training Course  by Vikas Munjal,4.7,497,Intermediate,44 lectures,6 total hours,Current price: $69.99
t-sql,https://www.udemy.com/course/mysql-for-data-analysis/,https://img-c.udemycdn.com/course/240x135/2422318_79c1_5.jpg,"Maven Analytics • 1,500,000 Learners, John Pauler",SQL for Data Analysis: Beginner MySQL Business Intelligence,Learn SQL database analysis & business intelligence w/ MySQL Workbench. Perfect for SQL beginners or first-time coders!,4.6,9682,All Levels,103 lectures,4.5 total hours,Current price: $189.99
t-sql,https://www.udemy.com/course/transaction-isolation-levels-in-memory-oltp-t-sql/,https://img-c.udemycdn.com/course/240x135/2699512_b946_2.jpg,Vikas Munjal,"Transaction, Isolation Levels and In-Memory OLTP in T-SQL","Microsoft SQL Server Transact SQL Advanced Query and Developer Course, helpful in Microsoft Certification Exam 70-762",4.6,51,Intermediate,33 lectures,4 total hours,Current price: $49.99
t-sql,https://www.udemy.com/course/sql-data-analyst-sql-microsoft-sql-postgresql-mysql/,https://img-c.udemycdn.com/course/240x135/4259018_16b9_2.jpg,Bluelime Learning Solutions,"SQL Data Analyst -  SQL , Microsoft SQL, PostgreSQL, MySQL",Hands-On Data Analysis with SQL,4.2,252,Beginner,108 lectures,10.5 total hours,Current price: $54.99
t-sql,https://www.udemy.com/course/t-sql-programming-and-scripting-for-sql-dba-and-developer/,https://img-c.udemycdn.com/course/240x135/6152107_2898_2.jpg,Rajesh J,T-SQL Programming and Scripting For SQL DBA and Developer,Built Your SQL Server T-SQL Programming and Scripting Skills: Master Essential Database Programming Techniques,4.2,8,Intermediate,68 lectures,20 total hours,Current price: $69.99
t-sql,https://www.udemy.com/course/data-analyst-skillpath-zero-to-hero-in-excel-sql-python/,https://img-c.udemycdn.com/course/240x135/4316674_7708.jpg,Start-Tech Academy,"Data Analyst Skillpath: Zero to Hero in Excel, SQL & Python","Begin data analytics by learning Excel, SQL, Python, Analytics & ML concepts from scratch. Must-know for a data analyst.",4.5,6696,All Levels,225 lectures,23 total hours,Current price: $99.99
