skill,link,image_link,partner,title,course_description,rating,num_review,difficulty,num_lecture,duration,price
business object,https://www.udemy.com/course/salesforcebusinessanalyst/,https://img-c.udemycdn.com/course/240x135/4746864_2973_4.jpg,"Rapid Reskill by Mike Wheeler, Evan Wheeler",The Complete Salesforce Certified Business Analyst Course,Salesforce Business Analyst Certification Exam - Earn Salesforce's Newest Certification and Learn Business Analysis,3.9,1823,All Levels,92 lectures,5 total hours,Current price: $89.99
business object,https://www.udemy.com/course/the-business-intelligence-analyst-course-2018/,https://img-c.udemycdn.com/course/240x135/1653432_3a57_3.jpg,"365 Careers, 365 Team",The Business Intelligence Analyst Course 2025,"The skills you need to become a BI Analyst - Statistics, Database theory, SQL, Tableau – Everything is included",4.6,47217,All Levels,467 lectures,23 total hours,Current price: $109.99
business object,https://www.udemy.com/course/technical-business-analytics-for-agile-decision-making/,https://img-c.udemycdn.com/course/240x135/4990970_895f_4.jpg,Leo Zhu,"Business Analyst Bootcamp: Excel, Stats, SQL, Tableau","30+ Data Analysis, Business Intelligence, and Decision Making Exercises for Agile Business Analytics",4.5,621,All Levels,95 lectures,23.5 total hours,Current price: $64.99
business object,https://www.udemy.com/course/the-data-analyst-course-complete-data-analyst-bootcamp/,https://img-c.udemycdn.com/course/240x135/3570337_9b02_6.jpg,365 Careers,The Data Analyst Course: Complete Data Analyst Bootcamp,"Complete Data Analyst Training: Python, NumPy, Pandas, Data Collection, Preprocessing, Data Types, Data Visualization",4.5,21135,All Levels,282 lectures,21.5 total hours,Current price: $149.99
business object,https://www.udemy.com/course/bpmn-business-process-modelling-for-business-analysts/,https://img-c.udemycdn.com/course/240x135/2898026_1ecd_4.jpg,Peter Vliegenthart,BPMN 2.0 Business Process Modelling for Business Analysts,Become a BPMN 2.0 Expert in 1 day. With this practical hands-on course you will learn proper Business Process Modelling,4.4,843,All Levels,69 lectures,3 total hours,Current price: $54.99
business object,https://www.udemy.com/course/prepare-for-the-salesforce-business-analyst-certification/,https://img-c.udemycdn.com/course/240x135/4865350_69f9.jpg,"Emily Call, MBA, Jeremy Call, MSDA",Prepare for the Salesforce Business Analyst Certification,Pass the Salesforce Business Analyst Certification with Ease and Confidence!,5.0,2,All Levels,106 lectures,8.5 total hours,Current price: $44.99
business object,https://www.udemy.com/course/business-analysis-masterclass/,https://img-c.udemycdn.com/course/240x135/3482742_897a_13.jpg,Meetul Patel,"Business Analysis ""A to Z"" Masterclass",We don't teach. We job Train!,4.6,8331,All Levels,25 lectures,31 total hours,Current price: $79.99
business object,https://www.udemy.com/course/software-testing-business-analyst/,https://img-c.udemycdn.com/course/240x135/943842_5c2d_7.jpg,The BA Guide | Jeremy Aschenbrenner,Business Analyst: Software Testing Processes & Techniques,"Reduce project bugs with repeatable testing processes. Learn to create test cases, scenarios, track defects, & more!",4.5,11085,All Levels,31 lectures,3 total hours,Current price: $69.99
business object,https://www.udemy.com/course/excel-basics-for-busy-individuals/,https://img-c.udemycdn.com/course/240x135/4895064_6ec1_6.jpg,Jacob Coccari,Microsoft Excel Crash Course for Business Analysts,Master Excel for Business Analysis: Unlock the Power of Excel & Accelerate Your Career!,4.6,1007,Beginner,153 lectures,8.5 total hours,Current price: $79.99
business object,https://www.udemy.com/course/business-analysis-ba/,https://img-c.udemycdn.com/course/240x135/751792_622e_10.jpg,The BA Guide | Jeremy Aschenbrenner,Business Analysis Fundamentals - IIBA endorsed,Gain the core BA skills you need to start strong - and earn PD Hours/CDUs to kickstart your analysis career!,4.5,63374,Beginner,66 lectures,7.5 total hours,Current price: $129.99
business object,https://www.udemy.com/course/business-intelligence-for-manager-business-analyst/,https://img-c.udemycdn.com/course/240x135/4790728_1fdf_5.jpg,Clément Fiocre | Data | API | Business Intelligence | Low Code,Business Intelligence for Manager & Business Analyst,Understand the basics and express a need in BI with a little french touch !,4.5,17,Beginner,47 lectures,3.5 total hours,Current price: $49.99
business object,https://www.udemy.com/course/project-management-for-business-analyst/,https://img-c.udemycdn.com/course/240x135/909354_8ed0_8.jpg,The BA Guide | Jeremy Aschenbrenner,Business Analyst: Project Management Techniques and Tools,Learn project management techniques to increase your project success rate as a Business Analyst!,4.5,5406,All Levels,52 lectures,5 total hours,Current price: $89.99
business object,https://www.udemy.com/course/salesforce-business-analyst-training-for-beginner-to-advance/,https://img-c.udemycdn.com/course/240x135/5009096_2d94.jpg,Srividya Thipereshetty,Salesforce Business Analyst Training for Beginner to Advance,Learn Salesforce Business Analyst,4.0,73,Beginner,48 lectures,2.5 total hours,Current price: $64.99
business object,https://www.udemy.com/course/salesforce-certified-business-analyst-certification-exam/,https://img-c.udemycdn.com/course/240x135/5813540_7725_3.jpg,Driss Motbir,Salesforce Certified Business Analyst certification exam,Salesforce Certified Business Analyst Exam 2024: Master the Essentials with 5 Comprehensive Practice Tests,4.7,32,All Levels,486 questions,,Current price: $44.99
business object,https://www.udemy.com/course/dmn-training-understanding-and-applying-decision-models/,https://img-c.udemycdn.com/course/240x135/5989398_7508_3.jpg,Oliver Berndorf | Senior Business Analyst - Xplore One,DMN for Business Analysts: Decision Modeling made easy,Decision Modeling & Notation - The ideal BPMN extension for efficient business processes.,4.7,13,All Levels,34 lectures,1.5 total hours,Current price: $19.99
business object,https://www.udemy.com/course/essentials-of-business-analysis/,https://img-c.udemycdn.com/course/240x135/5522158_f62d_5.jpg,"TIA Education, Andrew Ramdayal",The Essentials of Business Analyst- 6 PDUs,Learn the Basis of Business Analysis to Enhance Your Career,4.6,1171,All Levels,50 lectures,3.5 total hours,Current price: $19.99
business object,https://www.udemy.com/course/business-analyst-certification/,https://img-c.udemycdn.com/course/240x135/5443154_98a0_3.jpg,ARSCCOM Learning,Business Analyst Certification,"Your Complete Guide to Business Process Improvement, Digital Strategy, and BA Certification",4.3,80,Beginner,33 lectures,3 total hours,Current price: $54.99
business object,https://www.udemy.com/course/business-analyst-career-blueprint-from-beginner-to-hired/,https://img-c.udemycdn.com/course/240x135/5953488_6577.jpg,Youness Gouiza,Business Analyst Career Blueprint: From Beginner to Hired,"Master the essential skills to become a Business Analyst, from requirements gathering to landing your first job.",4.3,67,All Levels,66 lectures,4 total hours,Current price: $69.99
business object,https://www.udemy.com/course/sap-business-objects-business-intelligence-platform/,https://img-c.udemycdn.com/course/240x135/1897254_0d5f_3.jpg,Sunil Singh,SAP - Business Objects Business Intelligence Platform,All you need to know about BOBI,3.8,228,All Levels,286 lectures,24 total hours,Current price: $54.99
business object,https://www.udemy.com/course/business-analysis-cases-in-excel/,https://img-c.udemycdn.com/course/240x135/711872_af8e.jpg,Asen Gyczew,How to become world class Business Analyst -  Cases in Excel,A practical guide on how to do business analysis in Excel especially of sales and operations,4.5,526,Intermediate,167 lectures,8.5 total hours,Current price: $64.99
