skill,link,image_link,partner,title,course_description,rating,num_review,difficulty,num_lecture,duration,price
sql server,https://www.udemy.com/course/sql-bootcamp-for-business-product-data-analysts/,https://img-c.udemycdn.com/course/240x135/2994064_aa9b.jpg,Manish Narayan,"SQL Bootcamp for Business, Product, & Data Analysts","SQL Server 2017, SQL Querying and Reporting",4.4,46,All Levels,55 lectures,2 total hours,Current price: $34.99
sql server,https://www.udemy.com/course/business-analyst-sql-survival-guide/,https://img-c.udemycdn.com/course/240x135/2111876_25d4.jpg,Daniel Gater,Business Analyst - SQL Survival Guide,"Get started in SQL; learn how databases work, connect to one, and get the data you need.",4.3,116,Beginner,19 lectures,2.5 total hours,Current price: $59.99
sql server,https://www.udemy.com/course/sql-mysql-for-data-analytics-and-business-intelligence/,https://img-c.udemycdn.com/course/240x135/1405632_6e6f_2.jpg,"365 Careers, 365 Team",SQL - MySQL for Data Analytics and Business Intelligence,"SQL that will get you hired – SQL for Data Science, Data Engineering, Business Analysis, Marketing, and Data Management",4.6,61887,All Levels,333 lectures,12 total hours,Current price: $139.99
sql server,https://www.udemy.com/course/mysql-for-data-analysis/,https://img-c.udemycdn.com/course/240x135/2422318_79c1_5.jpg,"Maven Analytics • 1,500,000 Learners, John Pauler",SQL for Data Analysis: Beginner MySQL Business Intelligence,Learn SQL database analysis & business intelligence w/ MySQL Workbench. Perfect for SQL beginners or first-time coders!,4.6,9682,All Levels,103 lectures,4.5 total hours,Current price: $189.99
sql server,https://www.udemy.com/course/technical-business-analytics-for-agile-decision-making/,https://img-c.udemycdn.com/course/240x135/4990970_895f_4.jpg,Leo Zhu,"Business Analyst Bootcamp: Excel, Stats, SQL, Tableau","30+ Data Analysis, Business Intelligence, and Decision Making Exercises for Agile Business Analytics",4.5,621,All Levels,95 lectures,23.5 total hours,Current price: $64.99
sql server,https://www.udemy.com/course/a-complete-course-in-sql-with-sql-server/,https://img-c.udemycdn.com/course/240x135/4236108_0294.jpg,Robert Meldrum,A complete course in SQL with SQL server,This course will take you from novice to expert level in SQL development using SQL server,4.6,231,Beginner,91 lectures,14.5 total hours,Current price: $64.99
sql server,https://www.udemy.com/course/the-complete-sql-course-2021-learn-by-doing/,https://img-c.udemycdn.com/course/240x135/3733912_71be_5.jpg,Daniel Tait,The Complete SQL Course 2025 - Learn by Doing - SQL Server,Master SQL and Database Design in this SQL Bootcamp - Use Advanced Queries for Data Analysis and Analytics - SQL Server,4.6,2963,All Levels,114 lectures,13.5 total hours,Current price: $99.99
sql server,https://www.udemy.com/course/sql-for-data-analyst-business-analyst-and-bi-developer/,https://img-c.udemycdn.com/course/240x135/5667252_2bea_4.jpg,Shishir Kumar,"SQL for Data Analyst, Business Analyst and BI Developer","Unlock the Power of SQL Server for Data Management, Data Analysis, Business Analyst and BI Developer with Live Practical",2.5,3,All Levels,70 lectures,7 total hours,Current price: $19.99
sql server,https://www.udemy.com/course/complete-microsoft-sql-server-database-administration-course/,https://img-c.udemycdn.com/course/240x135/3832968_141a_3.jpg,"Imran Afzal, Abbas Mehmood",Complete Microsoft SQL Server Database Administration Course,Mastering Database Management and Security with Microsoft SQL Server,4.4,8721,All Levels,124 lectures,32 total hours,Current price: $99.99
sql server,https://www.udemy.com/course/sql-basics-crash-course-with-sql-server/,https://img-c.udemycdn.com/course/240x135/3399338_4fae.jpg,Travis Cuzick,SQL for Data Analysis - with SQL Server,The most direct path to mastering the SQL skills you'll actually use on the job,4.6,2544,Beginner,76 lectures,6.5 total hours,Current price: $79.99
sql server,https://www.udemy.com/course/70-461-session-2-querying-microsoft-sql-server-2012/,https://img-c.udemycdn.com/course/240x135/555384_1c04_6.jpg,"Phillip Burton • 880000+ students so far, I Do Data Limited","70-461, 761: Querying Microsoft SQL Server with Transact-SQL","From Tables and SELECT queries to advanced SQL. SQL Server 2012, 2014, 2016, 2017, 2019, and 2022. Helps with DP-600",4.5,17479,Beginner,269 lectures,28.5 total hours,Current price: $139.99
sql server,https://www.udemy.com/course/master-sql-basics-in-7-days/,https://img-c.udemycdn.com/course/240x135/6175557_8858_4.jpg,Curtis Norman,Master SQL Basics in 7 Days! | Learn SQL Server (SSMS),A One Week Comprehensive Introduction to SQL and Microsoft SQL Server Management Studio!,4.7,46,Beginner,172 lectures,7.5 total hours,Current price: $74.99
sql server,https://www.udemy.com/course/the-business-intelligence-analyst-course-2018/,https://img-c.udemycdn.com/course/240x135/1653432_3a57_3.jpg,"365 Careers, 365 Team",The Business Intelligence Analyst Course 2025,"The skills you need to become a BI Analyst - Statistics, Database theory, SQL, Tableau – Everything is included",4.6,47217,All Levels,467 lectures,23 total hours,Current price: $109.99
sql server,https://www.udemy.com/course/sql-advanced-queries/,https://img-c.udemycdn.com/course/240x135/6299761_9b16_5.jpg,"Maven Analytics • 1,500,000 Learners, Alice Zhao",SQL for Data Analysis: Advanced SQL Querying Techniques,"Learn advanced data analysis with SQL, and master topics like subqueries, CTEs, window functions, and more",4.7,799,All Levels,125 lectures,8.5 total hours,Current price: $89.99
sql server,https://www.udemy.com/course/complete-microsoft-sql-masterclass-beginner-advanced/,https://img-c.udemycdn.com/course/240x135/3493498_a762_4.jpg,Sandeep Kumar,Complete Microsoft SQL Server Masterclass:Beginner to Expert,"Master course using Microsoft SQL Server. These SQL can also  used in Oracle, MySQL, PostgreSQL, SQLite, DB2, etc.",4.5,2685,All Levels,210 lectures,11 total hours,Current price: $89.99
sql server,https://www.udemy.com/course/complete-sql-for-data-analytics-and-business-intelligence/,https://img-c.udemycdn.com/course/240x135/6258315_bbde.jpg,Raja Pradhan | AWS Certified Solution Architect | Software Architect,Complete SQL for Data Analytics and Business Intelligence,"Master SQL from Basics to Advanced with Visualized Concepts, Real-World Case Studies and Interview Qs from Top Companies",4.7,27,All Levels,168 lectures,20 total hours,Current price: $74.99
sql server,https://www.udemy.com/course/15-days-of-sql/,https://img-c.udemycdn.com/course/240x135/4742966_b6e5_15.jpg,Nikolai Schuler,15 Days of SQL: The Complete SQL Masterclass 2025,Master SQL in just 15 days from Basics to Pro by working daily on real-life projects,4.7,12109,All Levels,270 lectures,15 total hours,Current price: $99.99
sql server,https://www.udemy.com/course/sql-server-beginner-to-master/,https://img-c.udemycdn.com/course/240x135/4997090_1973_4.jpg,Dominic Tripodi,SQL Development with MS SQL Server Beginner to Master 2025,"Learn SQL (Structured Query Language) with MS SQL Server and T-SQL from Mac, Linux or Windows!",4.5,315,All Levels,94 lectures,10.5 total hours,Current price: $84.99
sql server,https://www.udemy.com/course/the-complete-sql-server-for-developers/,https://img-c.udemycdn.com/course/240x135/1512598_fc9f_2.jpg,Ahmad Mohey,The Complete SQL Server For Beginners,The ultimate practical guide to master SQL Server as a developer (Downloadable SQL Scripts Included).,4.5,575,Beginner,140 lectures,9.5 total hours,Current price: $84.99
sql server,https://www.udemy.com/course/the-data-analyst-course-complete-data-analyst-bootcamp/,https://img-c.udemycdn.com/course/240x135/3570337_9b02_6.jpg,365 Careers,The Data Analyst Course: Complete Data Analyst Bootcamp,"Complete Data Analyst Training: Python, NumPy, Pandas, Data Collection, Preprocessing, Data Types, Data Visualization",4.5,21135,All Levels,282 lectures,21.5 total hours,Current price: $149.99
