skill,link,image_link,partner,title,course_description,rating,num_review,difficulty,num_lecture,duration,price
sap ecc,https://www.udemy.com/course/sap-business-analyst-erp-ba-ba-role-in-sdmmfi/,https://img-c.udemycdn.com/course/240x135/3993946_d755_5.jpg,Brian UYI,"SAP Business Analyst / ERP BA / BA Role in SD,MM,FI.","SAP Business Analyst / ERP Business Analyst  / Business Analyst  Role in SD,MM,FI Functionality.",4.0,201,Beginner,7 lectures,2 total hours,
sap ecc,https://www.udemy.com/course/sap-for-beginners-2021/,https://img-c.udemycdn.com/course/240x135/4289598_9aaf_17.jpg,Artur Paziewski,SAP for Beginners course | SAP ERP with practice,SAP ERP practical training with business examples and practice on the newest SAP HANA system,4.5,14446,Beginner,27 lectures,4.5 total hours,Current price: $89.99
sap ecc,https://www.udemy.com/course/sapbusinessanalyst-erpbusinessanalyst-barole-in-sdmmfi-part2/,https://img-c.udemycdn.com/course/240x135/4210774_fe80_2.jpg,Brian UYI,"SAP Business Analyst / ERP BA / BA Role in SD,MM,FI. PART 2","SAP Business Analyst / ERP Business Analyst  / Business Analyst  Role in SD,MM,FI Functionality.",4.4,21,Intermediate,32 lectures,10 total hours,
sap ecc,https://www.udemy.com/course/sap-s4hana-erp/,https://img-c.udemycdn.com/course/240x135/4768966_c12d.jpg,"Allen Sun, Michael Todd, Fredrick Higgins",The Ultimate SAP S/4HANA Course 2025: From Zero to Expert,SAP ERP for absolute beginners: Become an in-demand SAP consultant through real-world projects,4.4,9379,All Levels,168 lectures,7.5 total hours,Current price: $74.99
sap ecc,https://www.udemy.com/course/sap-ecc-to-sap-s4hana-aerial-view-of-migration/,https://img-c.udemycdn.com/course/240x135/5098466_a46b.jpg,Global Learning Labs .,SAP ECC to SAP S/4HANA - Aerial View of Migration,SAP ECC to SAP S/4HANA,4.4,37,Intermediate,7 lectures,,Current price: $27.99
sap ecc,https://www.udemy.com/course/salesforcebusinessanalyst/,https://img-c.udemycdn.com/course/240x135/4746864_2973_4.jpg,"Rapid Reskill by Mike Wheeler, Evan Wheeler",The Complete Salesforce Certified Business Analyst Course,Salesforce Business Analyst Certification Exam - Earn Salesforce's Newest Certification and Learn Business Analysis,3.9,1823,All Levels,92 lectures,5 total hours,Current price: $89.99
sap ecc,https://www.udemy.com/course/sap-data-migration-sap-ecc-s4-hana-data-migration/,https://img-c.udemycdn.com/course/240x135/4952338_c93c_3.jpg,Mohanraj Muthuraja,SAP Data Migration ( SAP ECC / S4 HANA Data Migration) | ETL,"SAP Data Migration, S/4 HANA, ECC, LSMW, LTMC, IDOC, BAPI, BODS, Preload & Recon Reports, LSMW ABAP Code & Debug, LTMOM",4.3,271,All Levels,39 lectures,8 total hours,Current price: $64.99
sap ecc,https://www.udemy.com/course/sap-ecc-and-s4-hana-differences/,https://img-c.udemycdn.com/course/240x135/5897318_ca47_2.jpg,Ganesh Padala,SAP ECC and S/4 HANA Differences,SAP S/4 HANA Latest Projects and other information,4.1,60,All Levels,25 lectures,4.5 total hours,Current price: $49.99
sap ecc,https://www.udemy.com/course/sap-business-objects-web-intelligence/,https://img-c.udemycdn.com/course/240x135/370898_dddd_12.jpg,Esra Ekiz,SAP BI /SAP Business Objects Web Intelligence,SAP BO 4.1 Web Intelligence  course gives you the comprehensive reporting knowledge and real-project perspective !,4.0,954,All Levels,26 lectures,4 total hours,
sap ecc,https://www.udemy.com/course/sap-basis-administrator/,https://img-c.udemycdn.com/course/240x135/2464676_59ac_6.jpg,SAP  Buddy,SAP Basis Administration,"Learn everything you need to know to become and SAP Basis Administrator, will prepare from start to be an SAP Consultant",4.5,6439,,Expert,40 total hours,
sap ecc,https://www.udemy.com/course/the-data-analyst-course-complete-data-analyst-bootcamp/,https://img-c.udemycdn.com/course/240x135/3570337_9b02_6.jpg,365 Careers,The Data Analyst Course: Complete Data Analyst Bootcamp,"Complete Data Analyst Training: Python, NumPy, Pandas, Data Collection, Preprocessing, Data Types, Data Visualization",4.5,21135,All Levels,282 lectures,21.5 total hours,
sap ecc,https://www.udemy.com/course/sap-business-one-b1-advance-professional-training/,https://img-c.udemycdn.com/course/240x135/4313154_66db_2.jpg,Accountech Training & Solutions,SAP Business One B1 Advance Professional Training,SAP Business One B1 Advance Professional Training is a continuation to our SAP Basic to Advance Training for Next Level,4.6,137,,Expert,5.5 total hours,Current price: $59.99
sap ecc,https://www.udemy.com/course/the-business-intelligence-analyst-course-2018/,https://img-c.udemycdn.com/course/240x135/1653432_3a57_3.jpg,"365 Careers, 365 Team",The Business Intelligence Analyst Course 2025,"The skills you need to become a BI Analyst - Statistics, Database theory, SQL, Tableau – Everything is included",4.6,47217,All Levels,467 lectures,23 total hours,
sap ecc,https://www.udemy.com/course/sap-extended-warehouse-management-ewm-business-process/,https://img-c.udemycdn.com/course/240x135/5566666_7466_2.jpg,Key User Training,SAP Extended Warehouse Management (EWM) : Business Process,Discover SAP Extended Warehouse Management (EWM) Business Processes under S4/HANA (SAP GUI & Fiori),4.5,37,All Levels,79 lectures,5 total hours,Current price: $64.99
sap ecc,https://www.udemy.com/course/sap_fico_with_material/,https://img-c.udemycdn.com/course/240x135/2636828_ea64_3.jpg,R eLearning Solutions,SAP FICO (Finance & Controlling )  Simplified For Beginners,"SAP FI CO Comprehensive Training for Beginners /SAP Financial Accounting End-Users to become SAP Consultant ,sap finance",4.3,8416,All Levels,524 lectures,97 total hours,
sap ecc,https://www.udemy.com/course/sap-abap-for-sap-functional-consultants/,https://img-c.udemycdn.com/course/240x135/5998886_bfa3.jpg,Vin WC,SAP ABAP For SAP Functional Consultants,SAP ABAP For SAP Functional Consultants,4.4,197,All Levels,55 lectures,49.5 total hours,Current price: $19.99
sap ecc,https://www.udemy.com/course/sap-mm-master-data-course/,https://img-c.udemycdn.com/course/240x135/3098900_1bcc.jpg,Ganesh Padala,SAP ECC & S/4 HANA MM Organization Structure & Master Data,"SAP MM Master Data topics like Material, Vendor, Service, Info record, Source List and Quota Arrangement",4.5,659,Beginner,17 lectures,12 total hours,
sap ecc,https://www.udemy.com/course/sap-btp-training-from-basics-to-advanced/,https://img-c.udemycdn.com/course/240x135/5519112_7010_2.jpg,"SAP TutorPro, SAP CloudMax",SAP BTP Training - From Basics to Advanced [Hands-on],Start your SAP BTP Cloud journey From BTP concepts To Development of Full-Stack Fiori Application with CAP & HANA Cloud,4.3,1752,All Levels,42 lectures,7 total hours,Current price: $19.99
sap ecc,https://www.udemy.com/course/learn-sap-mm-in-ecc-part-1/,https://img-c.udemycdn.com/course/240x135/4102976_9a2a_2.jpg,Santosh Bora,SAP MM ECC Short Course - Part 1,SAP MM -  Procurement processes & master data,4.3,16,All Levels,13 lectures,5 total hours,
sap ecc,https://www.udemy.com/course/sap-bpc-business-planning-and-consolidation-training/,https://img-c.udemycdn.com/course/240x135/2246308_4617_7.jpg,Uplatz Training,SAP BPC (Business Planning and Consolidation) Training,Master the SAP BPC module in this course. This course covers all topics in depth and will help you become BPC consultant,3.8,234,All Levels,29 lectures,35.5 total hours,
