skill,link,image_link,partner,title,course_description,rating,num_review,difficulty,num_lecture,duration,price
data science,https://www.udemy.com/course/the-data-analyst-course-complete-data-analyst-bootcamp/,https://img-c.udemycdn.com/course/240x135/3570337_9b02_6.jpg,365 Careers,The Data Analyst Course: Complete Data Analyst Bootcamp,"Complete Data Analyst Training: Python, NumPy, Pandas, Data Collection, Preprocessing, Data Types, Data Visualization",4.5,21135,All Levels,282 lectures,21.5 total hours,Current price: $149.99
data science,https://www.udemy.com/course/the-data-science-course-complete-data-science-bootcamp/,https://img-c.udemycdn.com/course/240x135/1754098_e0df_3.jpg,365 Careers,The Data Science Course: Complete Data Science Bootcamp 2025,"Complete Data Science Training: Math, Statistics, Python, Advanced Statistics in Python, Machine and Deep Learning",4.6,151551,All Levels,523 lectures,32 total hours,Current price: $124.99
data science,https://www.udemy.com/course/the-business-intelligence-analyst-course-2018/,https://img-c.udemycdn.com/course/240x135/1653432_3a57_3.jpg,"365 Careers, 365 Team",The Business Intelligence Analyst Course 2025,"The skills you need to become a BI Analyst - Statistics, Database theory, SQL, Tableau – Everything is included",4.6,47217,All Levels,467 lectures,23 total hours,Current price: $109.99
data science,https://www.udemy.com/course/statistics-for-data-science-and-business-analysis/,https://img-c.udemycdn.com/course/240x135/1298780_731f_4.jpg,365 Careers,Statistics for Data Science and Business Analysis,"Statistics you need in the office: Descriptive & Inferential statistics, Hypothesis testing, Regression analysis",4.5,46858,All Levels,92 lectures,5 total hours,Current price: $109.99
data science,https://www.udemy.com/course/data-science-business-analytics-business-analysis-data-analyst/,https://img-c.udemycdn.com/course/240x135/5408874_b972.jpg,Dr. José Prabhu J,Master Course in Data Science and Business Analytics 3.0,"Data Science, Business Analytics, machine learning, Statistics, Data Analyst, Business Analyst, Data Analysis",4.2,392,All Levels,11 lectures,2.5 total hours,Current price: $29.99
data science,https://www.udemy.com/course/master-in-business-analytics/,https://img-c.udemycdn.com/course/240x135/6323705_6a4b.jpg,"Arun Singhal B-Tech, MBA (IIM-B),Unilever, J&J, Danone, IIMU, Cello",Master in Business Analytics,"An in-depth Data Science course for Data and Business Analyst covering data analysis, analytics, statistics etc",4.4,16,All Levels,91 lectures,13 total hours,Current price: $54.99
data science,https://www.udemy.com/course/complete-data-analyst-bootcamp-from-basics-to-advanced/,https://img-c.udemycdn.com/course/240x135/6074041_36f4_3.jpg,"Krish Naik, Jayant Topnani, KRISHAI Technologies Private Limited",Complete Data Analyst Bootcamp From Basics To Advanced,"Master Data Analysis: Python, Statistics, EDA, Feature Engineering, Power BI, and SQL Server,Snowflake,AWS",4.5,4995,All Levels,407 lectures,71.5 total hours,Current price: $79.99
data science,https://www.udemy.com/course/data-analytics-career-track/,https://img-c.udemycdn.com/course/240x135/5787046_e749_10.jpg,Shahriar's Sight Academy,Data Analytics Career Path: 72 Days of Data Analyst Bootcamp,"Learn Excel, MySQL, Python, PowerBI, ChatGPT for A-Z Data Analysis. Become a Full-Packed Data Analyst. [5 Courses in 1]",4.3,958,All Levels,359 lectures,34.5 total hours,Current price: $79.99
data science,https://www.udemy.com/course/complete-machine-learning-and-data-science-zero-to-mastery/,https://img-c.udemycdn.com/course/240x135/2511476_4e38_5.jpg,"Andrei Neagoie, Daniel Bourke","Complete A.I. & Machine Learning, Data Science Bootcamp","Learn Data Science, Data Analysis, Machine Learning (Artificial Intelligence) and Python with Tensorflow, Pandas & more!",4.6,26310,All Levels,384 lectures,44 total hours,Current price: $119.99
data science,https://www.udemy.com/course/statistics-for-data-science-data-analytics/,https://img-c.udemycdn.com/course/240x135/3627350_c89c_4.jpg,Nikolai Schuler,Statistics & Mathematics for Data Science & Data Analytics,Learn the statistics & probability for data science and business analysis,4.6,2212,Beginner,91 lectures,11.5 total hours,Current price: $109.99
data science,https://www.udemy.com/course/data-science-for-business-6-real-world-case-studies/,https://img-c.udemycdn.com/course/240x135/2907160_eeef.jpg,"Dr. Ryan Ahmed | 400K+ Students | Best-Selling Professor | 250K+ YouTube, SuperDataScience Team, Stemplicity Q&A Support, Ligency Team",Data Science for Business | 6 Real-world Case Studies,"Solve 6 real Business Problems. Build Robust AI, DL and NLP models for Sales, Marketing, Operations, HR and PR projects.",4.7,1630,Intermediate,75 lectures,11.5 total hours,Current price: $74.99
data science,https://www.udemy.com/course/python-foundations-for-data-analysis/,https://img-c.udemycdn.com/course/240x135/4616694_f947_4.jpg,"Maven Analytics • 1,500,000 Learners, Chris Bruehl",Python for Data Analysis & Business Intelligence,"Learn Python for data analysis & business intelligence, w/ real-world projects from a top Python data science instructor",4.6,1686,All Levels,226 lectures,11.5 total hours,Current price: $84.99
data science,https://www.udemy.com/course/statisticsforbusiness/,https://img-c.udemycdn.com/course/240x135/4958074_b7d6_2.jpg,"Justin Bateh, PhD, PMP",Statistics & Data Analytics For Data Science And Business,A Beginner's Guide To Statistics & Data Analytics For Data Science and Business Decisions (+Ebook & Templates),4.4,840,Beginner,27 lectures,2.5 total hours,Current price: $54.99
data science,https://www.udemy.com/course/data-analyst-professional-certificate-in-data-analysis/,https://img-c.udemycdn.com/course/240x135/6300333_97a2.jpg,"MTF Institute of Management, Technology and Finance",Data Analyst: Professional Certificate in Data Analysis,"Data Based Decision Making, Data Analysis. Data Collection, Cleaning, Statistical Analysis, Visualisation, Privacy.",4.6,366,All Levels,236 lectures,19 total hours,Current price: $69.99
data science,https://www.udemy.com/course/data-analyst-skillpath-zero-to-hero-in-excel-sql-python/,https://img-c.udemycdn.com/course/240x135/4316674_7708.jpg,Start-Tech Academy,"Data Analyst Skillpath: Zero to Hero in Excel, SQL & Python","Begin data analytics by learning Excel, SQL, Python, Analytics & ML concepts from scratch. Must-know for a data analyst.",4.5,6696,All Levels,225 lectures,23 total hours,Current price: $99.99
data science,https://www.udemy.com/course/data-science-in-python-data-prep-eda/,https://img-c.udemycdn.com/course/240x135/5457418_5f1f_2.jpg,"Maven Analytics • 1,500,000 Learners, Alice Zhao",Python Data Science: Data Prep & EDA with Python,"Learn Python + Pandas for data cleaning, profiling & EDA, and prep data for machine learning & data science with Python",4.7,1170,All Levels,180 lectures,8.5 total hours,Current price: $79.99
data science,https://www.udemy.com/course/data-statistics/,https://img-c.udemycdn.com/course/240x135/1175200_2723.jpg,"Kirill Eremenko, SuperDataScience Team, Ligency Team",Statistics for Business Analytics and Data Science A-Z™,"Learn The Core Stats For A Data Science Career. Master Statistical Significance, Confidence Intervals And Much More!",4.6,12430,All Levels,43 lectures,6 total hours,Current price: $119.99
data science,https://www.udemy.com/course/tableau10/,https://img-c.udemycdn.com/course/240x135/937678_abd2_3.jpg,"Kirill Eremenko, SuperDataScience Team, Ligency Team",Tableau A-Z: Hands-On Tableau Training for Data Science,Learn Tableau for data science step by step. Real-life data analytics exercises & quizzes included. Learn by doing!,4.6,103507,All Levels,79 lectures,8.5 total hours,Current price: $159.99
data science,https://www.udemy.com/course/business-analytics-using-data-science/,https://img-c.udemycdn.com/course/240x135/6273827_20ce.jpg,Human and Emotion: CHRMI,Business Analytics using Data Science,"Complete guide applicable to Business analysis using visualization, assessment through Python, Power BI and Tableau",4.9,12,Intermediate,62 lectures,10 total hours,Current price: $49.99
data science,https://www.udemy.com/course/complete-machine-learning-nlp-bootcamp-mlops-deployment/,https://img-c.udemycdn.com/course/240x135/5993822_2c2a_7.jpg,"Krish Naik, KRISHAI Technologies Private Limited","Complete Data Science,Machine Learning,DL,NLP Bootcamp","Master the theory, practice,and math behind Data Science,Machine Learning,Deep Learning,NLP with end to end projects",4.5,11296,All Levels,429 lectures,99 total hours,Current price: $94.99
