skill,link,image_link,partner,title,course_description,rating,num_review,difficulty,num_lecture,duration,price
scala,https://www.udemy.com/course/technical-business-analytics-for-agile-decision-making/,https://img-c.udemycdn.com/course/240x135/4990970_895f_4.jpg,Leo Zhu,"Business Analyst Bootcamp: Excel, Stats, SQL, Tableau","30+ Data Analysis, Business Intelligence, and Decision Making Exercises for Agile Business Analytics",4.5,621,All Levels,95 lectures,23.5 total hours,Current price: $64.99
scala,https://www.udemy.com/course/the-business-intelligence-analyst-course-2018/,https://img-c.udemycdn.com/course/240x135/1653432_3a57_3.jpg,"365 Careers, 365 Team",The Business Intelligence Analyst Course 2025,"The skills you need to become a BI Analyst - Statistics, Database theory, SQL, Tableau – Everything is included",4.6,47217,All Levels,467 lectures,23 total hours,Current price: $109.99
scala,https://www.udemy.com/course/salesforcebusinessanalyst/,https://img-c.udemycdn.com/course/240x135/4746864_2973_4.jpg,"Rapid Reskill by Mike Wheeler, Evan Wheeler",The Complete Salesforce Certified Business Analyst Course,Salesforce Business Analyst Certification Exam - Earn Salesforce's Newest Certification and Learn Business Analysis,3.9,1823,All Levels,92 lectures,5 total hours,Current price: $89.99
scala,https://www.udemy.com/course/rock-the-jvm-scala-for-beginners/,https://img-c.udemycdn.com/course/240x135/1310772_2dd5_8.jpg,Daniel Ciocîrlan,Scala & Functional Programming Essentials,"Become a Scala programmer and get the skills you need to work with Spark, Akka, and any Scala framework!",4.5,15151,Intermediate,40 lectures,11.5 total hours,Current price: $24.99
scala,https://www.udemy.com/course/completescala3/,https://img-c.udemycdn.com/course/240x135/5118924_58a2.jpg,Catalin Stefan,Complete Scala 3 development masterclass,Master the fundamentals and advanced features of Scala 3 development,4.7,327,All Levels,333 lectures,20 total hours,Current price: $59.99
scala,https://www.udemy.com/course/prepare-for-the-salesforce-business-analyst-certification/,https://img-c.udemycdn.com/course/240x135/4865350_69f9.jpg,"Emily Call, MBA, Jeremy Call, MSDA",Prepare for the Salesforce Business Analyst Certification,Pass the Salesforce Business Analyst Certification with Ease and Confidence!,5.0,2,All Levels,106 lectures,8.5 total hours,Current price: $44.99
scala,https://www.udemy.com/course/scala-programming/,https://img-c.udemycdn.com/course/240x135/3478798_9b0b.jpg,Harish Masand,Scala Programming In-Depth,Scala Programming From Scratch To Depth,4.4,574,,Expert,39.5 total hours,Current price: $64.99
scala,https://www.udemy.com/course/bpmn-business-process-modelling-for-business-analysts/,https://img-c.udemycdn.com/course/240x135/2898026_1ecd_4.jpg,Peter Vliegenthart,BPMN 2.0 Business Process Modelling for Business Analysts,Become a BPMN 2.0 Expert in 1 day. With this practical hands-on course you will learn proper Business Process Modelling,4.4,843,All Levels,69 lectures,3 total hours,Current price: $54.99
scala,https://www.udemy.com/course/the-data-analyst-course-complete-data-analyst-bootcamp/,https://img-c.udemycdn.com/course/240x135/3570337_9b02_6.jpg,365 Careers,The Data Analyst Course: Complete Data Analyst Bootcamp,"Complete Data Analyst Training: Python, NumPy, Pandas, Data Collection, Preprocessing, Data Types, Data Visualization",4.5,21135,All Levels,282 lectures,21.5 total hours,Current price: $149.99
scala,https://www.udemy.com/course/salesforce-certified-business-analyst-certification-exam/,https://img-c.udemycdn.com/course/240x135/5813540_7725_3.jpg,Driss Motbir,Salesforce Certified Business Analyst certification exam,Salesforce Certified Business Analyst Exam 2024: Master the Essentials with 5 Comprehensive Practice Tests,4.7,32,All Levels,486 questions,,Current price: $44.99
scala,https://www.udemy.com/course/excel-basics-for-busy-individuals/,https://img-c.udemycdn.com/course/240x135/4895064_6ec1_6.jpg,Jacob Coccari,Microsoft Excel Crash Course for Business Analysts,Master Excel for Business Analysis: Unlock the Power of Excel & Accelerate Your Career!,4.6,1007,Beginner,153 lectures,8.5 total hours,Current price: $79.99
scala,https://www.udemy.com/course/business-intelligence-for-manager-business-analyst/,https://img-c.udemycdn.com/course/240x135/4790728_1fdf_5.jpg,Clément Fiocre | Data | API | Business Intelligence | Low Code,Business Intelligence for Manager & Business Analyst,Understand the basics and express a need in BI with a little french touch !,4.5,17,Beginner,47 lectures,3.5 total hours,Current price: $49.99
scala,https://www.udemy.com/course/essentials-of-business-analysis/,https://img-c.udemycdn.com/course/240x135/5522158_f62d_5.jpg,"TIA Education, Andrew Ramdayal",The Essentials of Business Analyst- 6 PDUs,Learn the Basis of Business Analysis to Enhance Your Career,4.6,1171,All Levels,50 lectures,3.5 total hours,Current price: $19.99
scala,https://www.udemy.com/course/project-management-for-business-analyst/,https://img-c.udemycdn.com/course/240x135/909354_8ed0_8.jpg,The BA Guide | Jeremy Aschenbrenner,Business Analyst: Project Management Techniques and Tools,Learn project management techniques to increase your project success rate as a Business Analyst!,4.5,5406,All Levels,52 lectures,5 total hours,Current price: $89.99
scala,https://www.udemy.com/course/advanced-scala/,https://img-c.udemycdn.com/course/240x135/1775858_9e8a.jpg,Daniel Ciocîrlan,Advanced Scala and Functional Programming,"For Scala developers: become a top level Scala programmer so you can rock Spark, Akka, Cats or any Scala tool!",4.8,3505,,Expert,13.5 total hours,Current price: $39.99
scala,https://www.udemy.com/course/business-analyst-in-it-role-skills-and-responsibilities/,https://img-c.udemycdn.com/course/240x135/4921598_975c_2.jpg,The Interview | Vitali Botvich,"Business Analyst in IT: role, skills and responsibilities",Learn the key business analysis concepts to get the job and thrive in your Business Analyst career,4.5,22,Beginner,8 lectures,1.5 total hours,Current price: $54.99
scala,https://www.udemy.com/course/scala-3-just-what-you-need/,https://img-c.udemycdn.com/course/240x135/5194954_9f40.jpg,Dick Wall,Scala 3: Just What You Need,"Fully updated for Scala 3, Zero to Hero, Just the skills you need in just the language you want.",4.6,35,Beginner,353 lectures,16.5 total hours,Current price: $84.99
scala,https://www.udemy.com/course/stairway-to-scala-applied-part-3/,https://img-c.udemycdn.com/course/240x135/791838_6124_7.jpg,Dick Wall,"Scala Applied, Part 3","Part 3 of Scala Applied, covering Scala's core libraries",4.3,880,Intermediate,126 lectures,5.5 total hours,Current price: $64.99
scala,https://www.udemy.com/course/master-in-business-analysis/,https://img-c.udemycdn.com/course/240x135/5977824_a024.jpg,"Arun Singhal B-Tech, MBA (IIM-B),Unilever, J&J, Danone, IIMU, Cello",Master Business Analysis to become a Business Analyst,Get certification and join Salesforce. Complements Business Analytics /Business Intelligence / Data Analytics / Tableau,4.6,72,All Levels,59 lectures,6.5 total hours,Current price: $54.99
scala,https://www.udemy.com/course/business-analyst-career-blueprint-from-beginner-to-hired/,https://img-c.udemycdn.com/course/240x135/5953488_6577.jpg,Youness Gouiza,Business Analyst Career Blueprint: From Beginner to Hired,"Master the essential skills to become a Business Analyst, from requirements gathering to landing your first job.",4.3,67,All Levels,66 lectures,4 total hours,Current price: $69.99
