skill,link,image_link,partner,title,course_description,rating,num_review,difficulty,num_lecture,duration,price
active directory,https://www.udemy.com/course/active-directory-group-policy-2012/,https://img-c.udemycdn.com/course/240x135/700114_3644_2.jpg,Paul Hill,Active Directory & Group Policy Lab,Learn REAL job skills and stack your resume with the experience you will gain in this course!,4.6,13650,All Levels,78 lectures,7 total hours,Current price: $99.99
active directory,https://www.udemy.com/course/active-directory-on-windows-server-2016/,https://img-c.udemycdn.com/course/240x135/1344728_2ee3_2.jpg,Kevin Brown,Active Directory on Windows Server,"Learn how to deploy and manage all aspects of Active Directory, Group Policy, DNS and many more technologies",4.6,12078,All Levels,63 lectures,7 total hours,Current price: $89.99
active directory,https://www.udemy.com/course/windows-server-2016-with-powershell-dns/,https://img-c.udemycdn.com/course/240x135/1132376_40c0_4.jpg,Vitalii Shumylo,Administration of Active Directory and Windows Server (2025),"Domain Controllers (DC), Global Catalog, FSMO, Groups, Users, Security, Domains and Forests ,Trusts, GPO, much more..",4.4,337,All Levels,664 lectures,72 total hours,Current price: $34.99
active directory,https://www.udemy.com/course/complete-active-directory-9-hours-bootcamp/,https://img-c.udemycdn.com/course/240x135/2301648_6fde_3.jpg,Vitalii Shumylo,Active Directory and Windows Server 40+ Hour with Labs,"Domain Controllers (DC), Global Catalog, FSMO, Groups, Users, Security, Domains and Forests ,Trusts, GPO, much more..",4.5,536,All Levels,594 lectures,59 total hours,Current price: $84.99
active directory,https://www.udemy.com/course/azure-active-directory-masterclass/,https://img-c.udemycdn.com/course/240x135/4084634_902e.jpg,Kevin Brown,Azure Active Directory Masterclass,Learn to be a Subject Matter Expert (SME) on Azure Active Directory,4.5,2279,All Levels,66 lectures,7 total hours,Current price: $84.99
active directory,https://www.udemy.com/course/powershell-for-active-directory-administrators/,https://img-c.udemycdn.com/course/240x135/1688848_6371_4.jpg,Kevin Brown,PowerShell for Active Directory Administrators,"Use PowerShell to manage Active Directory users, computer, groups, security settings and more on Windows Server",4.5,6900,Intermediate,22 lectures,3 total hours,Current price: $69.99
active directory,https://www.udemy.com/course/active-directory-administration-for-helpdesk-technicians/,https://img-c.udemycdn.com/course/240x135/2631188_6a16_6.jpg,John Courtenay,Mastering Active Directory: Administration and Fundamentals,Essential Skills for Active Directory Administration: Master Active Directory and Group Policy Management,4.5,721,Beginner,27 lectures,,Current price: $34.99
active directory,https://www.udemy.com/course/active-directory-managing-users-accounts-and-properties/,https://img-c.udemycdn.com/course/240x135/2254938_925b_3.jpg,Vitalii Shumylo,Active Directory: Managing Users Accounts and Properties,"Active Directory: Managing Users Accounts, Profiles, Attributes, Properties",4.5,55,All Levels,16 lectures,2 total hours,Current price: $27.99
active directory,https://www.udemy.com/course/getting-started-with-microsoft-active-directory/,https://img-c.udemycdn.com/course/240x135/3815602_c573_2.jpg,Glen Richardson,Getting Started with Microsoft Active Directory,Your path to becoming a great Active Directory Administrator,4.4,105,All Levels,100 lectures,7 total hours,Current price: $44.99
active directory,https://www.udemy.com/course/active-directory-securing-active-directory-domain-services/,https://img-c.udemycdn.com/course/240x135/2491972_8b4e.jpg,Vitalii Shumylo,Active Directory: Securing Active Directory Domain Services,"AD DS Security with Lab: domain controllers, account security, audit authentication, managed service accounts, PSO",4.3,606,,Expert,9.5 total hours,Current price: $54.99
active directory,https://www.udemy.com/course/mastering-active-directorydnsgpos-20192022-100-hands-on/,https://img-c.udemycdn.com/course/240x135/5929324_298d_2.jpg,Network Specialist (Professor Mo Max),"Active Directory,DNS,GPOs Server 2019/2022 100% HANDS ON EXP",Learn How To Manage AD/DNS/ GPOs On 2019/2022  As Working In The Field. (Build Servers Setup AD/DNS/GPOs From Scratch).,4.7,31,All Levels,100 lectures,12 total hours,Current price: $89.99
active directory,https://www.udemy.com/course/auditing-windows-active-directory-security-course/,https://img-c.udemycdn.com/course/240x135/6057057_d77b.jpg,Audilitics eLearning,Auditing Windows Server Active Directory Security Course,Learn practical auditing techniques for Windows Server Active Directory Security.,4.4,10,All Levels,41 lectures,2 total hours,Current price: $49.99
active directory,https://www.udemy.com/course/it-support-training-for-active-directory/,https://img-c.udemycdn.com/course/240x135/2803599_9f9a_2.jpg,Duale Adan,The Complete Active Directory Course | IT Support,This is the complete Active directory course you would need to get started in IT.,3.9,53,Beginner,12 lectures,,Current price: $22.99
active directory,https://www.udemy.com/course/powershell-for-sysadmins-automating-active-directory/,https://img-c.udemycdn.com/course/240x135/6003938_5643_3.jpg,Adam Bertram,PowerShell for SysAdmins: Automating Active Directory,Automating Active Directory,4.7,3,Intermediate,35 lectures,1.5 total hours,Current price: $69.99
active directory,https://www.udemy.com/course/attacking-and-defending-active-directory/,https://img-c.udemycdn.com/course/240x135/5587824_f4ac_4.jpg,Vivek Pandit,Attacking And Defending Active Directory: AD Pentesting,"Explore Active Directory Pentesting: Attack, Defend, and Secure. Master Active Directory Pentesting",4.3,49,All Levels,95 lectures,8.5 total hours,Current price: $19.99
active directory,https://www.udemy.com/course/active-directory-with-windows-server-2016-the-total-course/,https://img-c.udemycdn.com/course/240x135/1642176_476a_3.jpg,"Total Seminars Over 1 Million Enrollments, Barbara Andrews",TOTAL: Active Directory with Windows Server 2016,"Identity, Access, and Authentication with Microsoft AD and Identity with Windows Server 2016",4.5,2552,All Levels,55 lectures,6.5 total hours,Current price: $64.99
active directory,https://www.udemy.com/course/identity-access-management-azure-active-directory-2020/,https://img-c.udemycdn.com/course/240x135/3043232_af7c.jpg,Anand Rao Nednur,Identity & Access Management - Azure Active Directory,"Learn about Identity, Directory , SAML , OAUTH , OpenID Connect , Identity Security and Azure Active Directory",4.5,1564,,Expert,3.5 total hours,Current price: $99.99
active directory,https://www.udemy.com/course/managing-and-automating-active-directory-with-powershell/,https://img-c.udemycdn.com/course/240x135/1844094_222e.jpg,TechSnips IT Training,Managing and Automating Active Directory with PowerShell,The how-to guide on automating everything in Active Directory,4.3,29,Intermediate,58 lectures,4.5 total hours,Current price: $34.99
active directory,https://www.udemy.com/course/active-directory-management-using-windows-powershell/,https://img-c.udemycdn.com/course/240x135/1588090_1340_2.jpg,"TechSckool By Vijay, Pooja Kataria",[Active Directory] Management using Windows PowerShell,Simplified practical knowledge for automation & management of [Active Directory] using Windows PowerShell,4.5,1651,All Levels,36 lectures,3.5 total hours,Current price: $54.99
active directory,https://www.udemy.com/course/azure-active-directory-training/,https://img-c.udemycdn.com/course/240x135/3321086_fdd6_3.jpg,Pavan Kumar,Azure Active Directory training,Upgrade System Administrators Active Directory Skills to Azure Active Directory skills a complete training from Basics,4.3,53,Intermediate,56 lectures,9.5 total hours,Current price: $59.99
