skill,link,image_link,partner,title,course_description,rating,num_review,difficulty,num_lecture,duration,price
firewall,https://www.udemy.com/course/aws-certified-solutions-architect-associate-saa-c03/,https://img-c.udemycdn.com/course/240x135/2196488_8fc7_10.jpg,"Stephane Maarek | AWS Certified Cloud Practitioner,Solutions Architect,Developer",Ultimate AWS Certified Solutions Architect Associate 2025,Full Practice Exam | Learn Cloud Computing | Pass the AWS Certified Solutions Architect Associate Certification SAA-C03!,4.7,253574,All Levels,398 lectures,27.5 total hours,
firewall,https://www.udemy.com/course/data-architecture-for-data-engineers/,https://img-c.udemycdn.com/course/240x135/6268045_b022.jpg,Manas Jain,Data Architecture for Data Engineers: Practical Approaches,"Building Scalable, Efficient Data Solutions with Real-World Applications",4.5,119,All Levels,41 lectures,4 total hours,Current price: $69.99
firewall,https://www.udemy.com/course/google-cloud-professional-cloud-architect-certification/,https://img-c.udemycdn.com/course/240x135/3995372_4064.jpg,"in28Minutes Official, Ranga Karanam | GCP Certification - Google Cloud Engineer & Architect",GCP Professional Cloud Architect: Google Cloud Certification,Become a GCP Cloud Architect. Architect Google Cloud Platform (GCP) Solutions. Includes 4 New Case Studies.,4.6,12379,All Levels,337 lectures,21 total hours,
firewall,https://www.udemy.com/course/fortigate-firewall-training/,https://img-c.udemycdn.com/course/240x135/6201343_d8fa.jpg,Yugendhira M,FortiGate Firewall Training v7- From Beginner to Expert 2025,FortiGate Firewall FCP / NSE4 Training v7 with the step-by-step labs along with detailed Wireshark Packet Analysis,4.4,113,All Levels,90 lectures,27 total hours,Current price: $79.99
firewall,https://www.udemy.com/course/firewalls/,https://img-c.udemycdn.com/course/240x135/5574572_58c8_4.jpg,Rick Crisci,Introduction to Firewalls - 2 Hour Beginner Crash Course,Learn firewall fundamentals with clear lectures and diagrams. This video course covers all the basics of firewalls.,4.6,1385,Beginner,20 lectures,2 total hours,Current price: $64.99
firewall,https://www.udemy.com/course/fortigate-firewall-administration-course/,https://img-c.udemycdn.com/course/240x135/4433738_ea4e.jpg,Hamza Benhamani,Fortigate Firewall Administration Course,You will Learn How to administrate your fortigate Firewal from Zero to FortiHero,4.5,1945,All Levels,52 lectures,10 total hours,
firewall,https://www.udemy.com/course/learn-azure-data-factory-from-scratch/,https://img-c.udemycdn.com/course/240x135/3685634_740c_6.jpg,Ramesh Retnasamy,Azure Data Factory For Data Engineers - Project on Covid19,"Real world project for Data Engineers using Azure Data Factory, SQL, Data Lake, Databricks, HDInsight, CI/CD [DP203]",4.6,15379,All Levels,146 lectures,13 total hours,
firewall,https://www.udemy.com/course/data-architecture-for-data-scientists/,https://img-c.udemycdn.com/course/240x135/5295982_ca3c_3.jpg,Biju Krishnan,Data Architecture for Data Scientists,"Datawarehouse, Data Lake, Data Lakehouse, Data Mesh, Kafka, Lambda & Kappa architecture, Feature Store, Vector DB & more",4.6,849,Intermediate,37 lectures,2.5 total hours,Current price: $69.99
firewall,https://www.udemy.com/course/palo-alto-firewall-training/,https://img-c.udemycdn.com/course/240x135/5600954_093a_3.jpg,Yugendhira M,Palo Alto Firewall Training V10 - Beginner to Expert 2025,PCNSE and PCNSA Palo Alto Firewall Training  with the step-by-step labs along with detailed Wireshark Packet Analysis,4.6,899,All Levels,89 lectures,30.5 total hours,Current price: $79.99
firewall,https://www.udemy.com/course/aws-certified-solutions-architect-associate-hands-on/,https://img-c.udemycdn.com/course/240x135/2469516_ab87_11.jpg,"Neal Davis | AWS Certified Solutions Architect & Developer, Digital Cloud Training | AWS Certified Cloud Practitioner AWS Certified Solutions Architect, AWS Developer Associate",AWS Certified Solutions Architect Associate (SAA-C03) Course,2025 AWS Certified Solutions Architect Associate Video Course SAA-C03 | Hands-on Exercises + AWS Practice Exam + Slides,4.6,20792,All Levels,290 lectures,23 total hours,
firewall,https://www.udemy.com/course/the-data-analyst-course-complete-data-analyst-bootcamp/,https://img-c.udemycdn.com/course/240x135/3570337_9b02_6.jpg,365 Careers,The Data Analyst Course: Complete Data Analyst Bootcamp,"Complete Data Analyst Training: Python, NumPy, Pandas, Data Collection, Preprocessing, Data Types, Data Visualization",4.5,21135,All Levels,282 lectures,21.5 total hours,
firewall,https://www.udemy.com/course/introduction-to-network-firewalls/,https://img-c.udemycdn.com/course/240x135/6210493_098c.jpg,Dan Mill,Network Firewalls Bootcamp,Master the Basics of Network Firewalls: Protecting Networks with Essential Security Knowledge and Hands-on Labs,4.5,8,Beginner,53 lectures,5 total hours,Current price: $69.99
firewall,https://www.udemy.com/course/aws-solutions-architect-professional/,https://img-c.udemycdn.com/course/240x135/2789348_065c_4.jpg,"Stephane Maarek | AWS Certified Cloud Practitioner,Solutions Architect,Developer",Ultimate AWS Certified Solutions Architect Professional 2025,Be AWS Certified Solutions Architect Professional. Full Amazon Web Services Solution Architecture deep-dive for SAP-C02,4.7,22069,,Expert,16.5 total hours,
firewall,https://www.udemy.com/course/azure-solutions-architect-certification-the-ultimate-bundle/,https://img-c.udemycdn.com/course/240x135/5968986_98b9_2.jpg,Memi Lavi,Azure Solutions Architect Certification: The Ultimate Bundle,Become a certified Azure Architect! Learn to design and build modern cloud apps from a certified Azure Architect,4.6,332,Beginner,392 lectures,28 total hours,Current price: $19.99
firewall,https://www.udemy.com/course/data-entry-skills-a-complete-data-entry-course-from-scratch/,https://img-c.udemycdn.com/course/240x135/5223618_671c.jpg,Data Tutors,Data Entry Skills: A Complete Data Entry Course from Scratch,A Complete Guide to Data Entry Skills: Learn Data Entry Skills and become a Data Entry Pro & Get a Online Data Entry Job,4.5,2672,Beginner,201 lectures,16 total hours,Current price: $19.99
firewall,https://www.udemy.com/course/aws-certified-solutions-architect-professional-training/,https://img-c.udemycdn.com/course/240x135/3898634_5c95_4.jpg,"Neal Davis | AWS Certified Solutions Architect & Developer, Digital Cloud Training | AWS Certified Cloud Practitioner AWS Certified Solutions Architect, AWS Developer Associate",AWS Certified Solutions Architect Professional SAP-C02,[2025] AWS Certified Solutions Architect Professional Video Course | includes AWS Solutions Architect PRO Practice Test,4.6,6713,Intermediate,250 lectures,21.5 total hours,
firewall,https://www.udemy.com/course/linux-security-the-complete-iptables-firewall-guide/,https://img-c.udemycdn.com/course/240x135/1779610_0a4e_7.jpg,"Andrei Dumitrescu, Crystal Mind Academy",Linux Security: The Complete Iptables Firewall Guide,Linux Security Improved. Create professional Netfilter/Iptables Firewalls. All you need to know about Netfilter/Iptables,4.8,1446,All Levels,125 lectures,9.5 total hours,
firewall,https://www.udemy.com/course/big-data-engineering-bootcamp-with-gcp-and-azure-cloud/,https://img-c.udemycdn.com/course/240x135/6242299_e787.jpg,"Krish Naik, Mayank Aggarwal, KRISHAI Technologies Private Limited","Big Data Engineering Bootcamp with GCP, and Azure Cloud","Master Big Data with Hadoop, Spark, Kafka & Cloud | Build Real-World Projects & Scalable Data Pipelines from Scratch",4.7,357,All Levels,301 lectures,73.5 total hours,Current price: $44.99
firewall,https://www.udemy.com/course/palo-alto-firewall-pcnse-new-v9-v10-training/,https://img-c.udemycdn.com/course/240x135/3618082_c046_4.jpg,Ahmad Ali,Palo Alto Firewall PCNSE New V9 & V10 Training,Learn Palo Alto Firewall V9 & V10 with Step by Step Lab Workbook,4.5,3936,All Levels,102 lectures,36.5 total hours,
firewall,https://www.udemy.com/course/aws-solutions-architect-associate-saa-c03-training-2024/,https://img-c.udemycdn.com/course/240x135/6000716_29c4.jpg,CloudFolks HUB,Topmost AWS Certified Solutions Architect Associate SAA-C03,Beginner-Friendly | Learn Cloud Computing | Pass the AWS Certified Solutions Architect Associate Certification SAA-C03,4.8,49,All Levels,359 lectures,80.5 total hours,Current price: $39.99
