skill,link,image_link,partner,title,course_description,rating,num_review,difficulty,num_lecture,duration,price
sharepoint,https://www.udemy.com/course/the-complete-guide-to-microsoft-sharepoint-online/,https://img-c.udemycdn.com/course/240x135/4236836_f66a_2.jpg,Henry Habib,SharePoint - Complete Guide to Microsoft SharePoint Online,"SharePoint Online, SharePoint Team Sites, Pages, Libraries, Workflows with the basic to expert SharePoint Online guide",4.5,7619,All Levels,176 lectures,15 total hours,Current price: $84.99
sharepoint,https://www.udemy.com/course/build-solutions-with-power-platform/,https://img-c.udemycdn.com/course/240x135/4698882_a5dc_2.jpg,Henry Habib,"Build Solutions with Power Apps, Power Automate & SharePoint","Create enterprise applications with the Power Platform (PowerApps, Power Automate, and SharePoint), and master PL-900",4.6,5736,All Levels,237 lectures,22 total hours,Current price: $89.99
sharepoint,https://www.udemy.com/course/sharepoint-for-administrators/,https://img-c.udemycdn.com/course/240x135/6214673_5f61_2.jpg,Amit Kumar,[New] SharePoint for Administrators - Mastering SharePoint,SharePoint Online for Administrators. A complete course for SharePoint Administrators. Mastering SharePoint Online,4.6,15,All Levels,101 lectures,8.5 total hours,Current price: $74.99
sharepoint,https://www.udemy.com/course/sharepoint-admin/,https://img-c.udemycdn.com/course/240x135/6094993_1408_3.jpg,Competitive Computing Consultants Inc.,SharePoint Admin and Site Owner: Comprehensive Guide,"Master SharePoint admin tasks, from site creation to advanced customization, permissions, and seamless Teams integration",4.7,46,Beginner,7 lectures,2.5 total hours,Current price: $19.99
sharepoint,https://www.udemy.com/course/sharepoint-complete-guide-to-microsoft-sharepoint-online/,https://img-c.udemycdn.com/course/240x135/6152795_8d7d_4.jpg,Amit Kumar,SharePoint Online - Complete Course for SharePoint Online,A complete course for SharePoint Online Administrators,4.4,30,All Levels,64 lectures,6.5 total hours,Current price: $74.99
sharepoint,https://www.udemy.com/course/sharepoint-online-beginners-course/,https://img-c.udemycdn.com/course/240x135/4162966_ee5d_2.jpg,Simon Sez IT,Mastering Microsoft 365 SharePoint Online: Essential Guide,"Learn to get started using SharePoint Online with this comprehensive course from Microsoft experts, Simon Sez IT",4.6,9506,Beginner,49 lectures,4 total hours,Current price: $84.99
sharepoint,https://www.udemy.com/course/sharepoint-designer-2013/,https://img-c.udemycdn.com/course/240x135/975658_177e_2.jpg,Intellezy Trainers,SharePoint Designer 2013,"Learn about SharePoint Designer, including how to integrate data sources and customize content types.",4.4,684,Intermediate,83 lectures,4.5 total hours,Current price: $59.99
sharepoint,https://www.udemy.com/course/sharepoint-online-complete-guide/,https://img-c.udemycdn.com/course/240x135/5461042_5bb6_3.jpg,Toshit Bhardwaj,SharePoint Online: Complete Guide to Microsoft SharePoint,"Beginners To Advanced M365 SharePoint Online Course Sharepoint Team Sites, Workflows, Permissions, Libraries, Lists",4.5,408,All Levels,179 lectures,15.5 total hours,Current price: $84.99
sharepoint,https://www.udemy.com/course/sharepoint-2019-2016-complete-boot-camp-5-course-bundle/,https://img-c.udemycdn.com/course/240x135/1427616_f92b.jpg,NPM Global Technologies,Mastering SharePoint Online A-Z Complete Boot Camp 5-1 16hrs,"5-1 Course. MS O365 SharePoint Online Power User/Admin/Developer Complete Course. 16 hr. LABs. FORMS, FLOWS PowerShell",4.1,2325,All Levels,170 lectures,16 total hours,Current price: $69.99
sharepoint,https://www.udemy.com/course/sharepoint-administration-in-microsoft-365-for-beginners/,https://img-c.udemycdn.com/course/240x135/5156724_89f9_5.jpg,Alicia Crowder,Microsoft 365 Administration: Mastering SharePoint & Teams,"Administration in Microsoft 365: SharePoint, Teams, OneDrive, Microsoft Entra ID, and become a master SharePoint user",4.2,299,Beginner,278 lectures,26.5 total hours,Current price: $64.99
sharepoint,https://www.udemy.com/course/office-365-sharepoint-site-user/,https://img-c.udemycdn.com/course/240x135/2589488_61e6_4.jpg,Intellezy Trainers,Microsoft 365 SharePoint Site User,SharePoint Site User,4.2,216,Beginner,46 lectures,3 total hours,Current price: $49.99
sharepoint,https://www.udemy.com/course/sharepoint-online-permissions-sharepoint-permissions-guide/,https://img-c.udemycdn.com/course/240x135/6206599_9903_2.jpg,Amit Kumar,SharePoint Online Permissions - SharePoint Permissions Guide,A Complete Guide to SharePoint Online Permissions - Mastering SharePoint Online Permissions: A Comprehensive Guide,4.8,11,All Levels,16 lectures,2 total hours,Current price: $79.99
sharepoint,https://www.udemy.com/course/sharepointframeworkspfxdevelopment/,https://img-c.udemycdn.com/course/240x135/3014852_765a_2.jpg,Kameswara Sarma Uppuluri | 25+ Years Of Experienced Corporate Trainer,Mastering SharePoint Framework SPFx Development,Learn How to Develop SPFx Solutions using React & NoJS Frameworks From Scratch Step By Step,4.4,2941,All Levels,118 lectures,22 total hours,Current price: $69.99
sharepoint,https://www.udemy.com/course/sharepoint-from-beginner-to-advanced-case-study/,https://img-c.udemycdn.com/course/240x135/6257879_009f_3.jpg,"Leonardo Adonis, SquadHub Academy",SharePoint: From Beginner to Advanced + Case Study,Master Site Creation in SharePoint and Integrate with Key Office 365 Features,4.1,14,All Levels,24 lectures,2.5 total hours,Current price: $49.99
sharepoint,https://www.udemy.com/course/master-sharepoint/,https://img-c.udemycdn.com/course/240x135/6094981_bb0c.jpg,Competitive Computing Consultants Inc.,SharePoint Users: From Fundamentals to Advanced Features,"Unlock SharePoint's Full Potential: Document Management, Collaboration, and Integration with Teams",4.4,21,Beginner,8 lectures,1.5 total hours,Current price: $19.99
sharepoint,https://www.udemy.com/course/sharepoint-online-for-users/,https://img-c.udemycdn.com/course/240x135/4184776_c24c.jpg,Competitive Computing Consultants Inc.,SharePoint Online for Users,Learn to use SharePoint Online like a Pro!,4.5,2933,All Levels,36 lectures,3 total hours,Current price: $54.99
sharepoint,https://www.udemy.com/course/excel-on-sharepoint/,https://img-c.udemycdn.com/course/240x135/2299284_f400.jpg,Russell Mangum,Excel on SharePoint,Learn how to create interactive data presentations in Excel that can be viewed in any browser without opening Excel,4.2,20,Intermediate,45 lectures,2.5 total hours,Current price: $39.99
sharepoint,https://www.udemy.com/course/the-data-analyst-course-complete-data-analyst-bootcamp/,https://img-c.udemycdn.com/course/240x135/3570337_9b02_6.jpg,365 Careers,The Data Analyst Course: Complete Data Analyst Bootcamp,"Complete Data Analyst Training: Python, NumPy, Pandas, Data Collection, Preprocessing, Data Types, Data Visualization",4.5,21135,All Levels,282 lectures,21.5 total hours,Current price: $149.99
sharepoint,https://www.udemy.com/course/microsoft-power-bi-up-running-with-power-bi-desktop/,https://img-c.udemycdn.com/course/240x135/1570206_26c6_6.jpg,"Maven Analytics • 1,500,000 Learners, Chris Dutton, Aaron Parry",Microsoft Power BI Desktop for Business Intelligence,"Master Power BI Desktop for data prep, data analysis, data visualization & dashboard design w/ top Power BI instructors!",4.7,160175,All Levels,198 lectures,16.5 total hours,Current price: $124.99
sharepoint,https://www.udemy.com/course/data-architecture-for-data-engineers/,https://img-c.udemycdn.com/course/240x135/6268045_b022.jpg,Manas Jain,Data Architecture for Data Engineers: Practical Approaches,"Building Scalable, Efficient Data Solutions with Real-World Applications",4.5,119,All Levels,41 lectures,4 total hours,Current price: $69.99
