skill,link,image_link,partner,title,course_description,rating,num_review,difficulty,num_lecture,duration,price
classification,https://www.udemy.com/course/data-science-in-python-classification/,https://img-c.udemycdn.com/course/240x135/5740958_17e4_3.jpg,"Maven Analytics • 1,500,000 Learners, Chris Bruehl",Python Data Science: Classification Modeling,"Learn Python for data science & supervised machine learning, and build classification models w/ a top Python instructor!",4.7,149,All Levels,170 lectures,10 total hours,Current price: $84.99
classification,https://www.udemy.com/course/top-data-scientist/,https://img-c.udemycdn.com/course/240x135/5961214_0e9b_3.jpg,Nancy Ticharwa (CEO Bethel Labs),The Top Data Scientist ™ BootCamp,Python | SQL | Machine Learning | Deep Learning | ChatGPT | Natural Language Processing | Computer Vision | 20+ Projects,4.3,43,All Levels,433 lectures,38 total hours,Current price: $49.99
classification,https://www.udemy.com/course/time-series-classification-in-python/,https://img-c.udemycdn.com/course/240x135/6374541_c2c4_2.jpg,Marco Peixeiro,Time Series Classification in Python,Develop robust and performant classification models for time series data using machine learning and deep learning,5.0,1,Beginner,57 lectures,6.5 total hours,Current price: $54.99
classification,https://www.udemy.com/course/the-data-science-course-complete-data-science-bootcamp/,https://img-c.udemycdn.com/course/240x135/1754098_e0df_3.jpg,365 Careers,The Data Science Course: Complete Data Science Bootcamp 2025,"Complete Data Science Training: Math, Statistics, Python, Advanced Statistics in Python, Machine and Deep Learning",4.6,151551,All Levels,523 lectures,32 total hours,Current price: $124.99
classification,https://www.udemy.com/course/machine-learning-computing-school/,https://img-c.udemycdn.com/course/240x135/4836476_a3e8_2.jpg,Emmanuel Maggiori,Machine Learning for Aspiring Data Scientists: Zero to Hero,Learn the foundations of machine learning to get a job in data science. No coding experience required.,4.8,65,Beginner,218 lectures,16 total hours,Current price: $84.99
classification,https://www.udemy.com/course/data-architecture-for-data-scientists/,https://img-c.udemycdn.com/course/240x135/5295982_ca3c_3.jpg,Biju Krishnan,Data Architecture for Data Scientists,"Datawarehouse, Data Lake, Data Lakehouse, Data Mesh, Kafka, Lambda & Kappa architecture, Feature Store, Vector DB & more",4.6,849,Intermediate,37 lectures,2.5 total hours,Current price: $69.99
classification,https://www.udemy.com/course/spark-nlp-for-data-scientists/,https://img-c.udemycdn.com/course/240x135/4790132_5802_4.jpg,"Ace Vo, David Talby, Jiri Dobes, Veysel Kocaman",Spark NLP for Data Scientists,"Unlock your NLP power with Spark NLP, the most popular NLP library in enterprises",4.6,61,Intermediate,78 lectures,12.5 total hours,Current price: $19.99
classification,https://www.udemy.com/course/the-data-analyst-course-complete-data-analyst-bootcamp/,https://img-c.udemycdn.com/course/240x135/3570337_9b02_6.jpg,365 Careers,The Data Analyst Course: Complete Data Analyst Bootcamp,"Complete Data Analyst Training: Python, NumPy, Pandas, Data Collection, Preprocessing, Data Types, Data Visualization",4.5,21135,All Levels,282 lectures,21.5 total hours,Current price: $149.99
classification,https://www.udemy.com/course/dp-100-azure-data-scientist-associate-complete-exam-guide/,https://img-c.udemycdn.com/course/240x135/4992188_0f74_2.jpg,Henry Habib,DP-100 Azure Data Scientist Associate Complete Exam Guide,"Complete DP-100 Azure Machine Learning training guide to prepare you for DP-100, with practice exams on DP 100 Azure ML",4.4,689,All Levels,97 lectures,8.5 total hours,Current price: $74.99
classification,https://www.udemy.com/course/complete-machine-learning-and-data-science-zero-to-mastery/,https://img-c.udemycdn.com/course/240x135/2511476_4e38_5.jpg,"Andrei Neagoie, Daniel Bourke","Complete A.I. & Machine Learning, Data Science Bootcamp","Learn Data Science, Data Analysis, Machine Learning (Artificial Intelligence) and Python with Tensorflow, Pandas & more!",4.6,26310,All Levels,384 lectures,44 total hours,Current price: $119.99
classification,https://www.udemy.com/course/regression-classification-with-machine-learning-in-r/,https://img-c.udemycdn.com/course/240x135/3799998_f41a_2.jpg,Kate Alison,Data Science in R:  Regression & Classification Analysis,Master Complete Hands-On Regression Analysis & Classification for applied Statistical Modelling & Machine Learning in R,4.3,38,Beginner,46 lectures,4.5 total hours,Current price: $59.99
classification,https://www.udemy.com/course/healthcare-nlp-for-data-scientists/,https://img-c.udemycdn.com/course/240x135/5845028_f148.jpg,Ace Vo,Healthcare NLP for Data Scientists,"Unlock your NLP power with Healthcare NLP, the most popular NLP library in the healthcare industry",4.5,9,Intermediate,82 lectures,13.5 total hours,Current price: $19.99
classification,https://www.udemy.com/course/become-a-data-scientist/,https://img-c.udemycdn.com/course/240x135/5254956_406a_3.jpg,Start-Tech Academy,"Become a Data Scientist: SQL, Tableau, ML & DL [4-in-1]","4-in-1 Bundle covering the 4 essential topics for a data scientist - SQL, Tableau, Machine & Deep Learning using Python",4.6,111,Beginner,338 lectures,37 total hours,Current price: $79.99
classification,https://www.udemy.com/course/data-science-for-beginners-python-azure-ml-with-projects/,https://img-c.udemycdn.com/course/240x135/6257851_f33b.jpg,Graeme Gordon,"Data Science for Beginners - Python, Azure ML and Tableau","Practical Data Science: Machine Learning, AI, Cloud and Data Analysis in Python, Tableau and Azure ML with Real Projects",4.7,41,All Levels,126 lectures,14 total hours,Current price: $84.99
classification,https://www.udemy.com/course/machine-learning-classification/,https://img-c.udemycdn.com/course/240x135/2157118_edff_5.jpg,"Dr. Ryan Ahmed | 400K+ Students | Best-Selling Professor | 250K+ YouTube, SuperDataScience Team, Ligency Team",Machine Learning Classification Bootcamp in Python,Build 10 Practical Projects and Advance Your Skills in Machine Learning Using Python and Scikit Learn,4.6,1018,Intermediate,82 lectures,11.5 total hours,Current price: $69.99
classification,https://www.udemy.com/course/deep-learning-with-python-for-image-classification/,https://img-c.udemycdn.com/course/240x135/4681154_ca33_2.jpg,"AI & Computer Science School, Dr. Mazhar Hussain",Deep Learning with Python & Pytorch for Image Classification,"Deep Learning and Computer Vision for Image Classification with PyTorch, Python. Train and Deploy Models on Custom data",4.3,146,All Levels,32 lectures,3.5 total hours,Current price: $49.99
classification,https://www.udemy.com/course/complete-data-science-and-machine-learning-using-python/,https://img-c.udemycdn.com/course/240x135/1478886_7e44_5.jpg,"Jitesh Khurkhuriya, Python, Data Science & Machine Learning A-Z Team",Data Science : Complete Data Science & Machine Learning,"Learn and master the Data Science, Python for Machine Learning, Math for Machine Learning, Statistics for Data Science",4.4,3337,All Levels,281 lectures,26 total hours,Current price: $99.99
classification,https://www.udemy.com/course/data-science-in-python-data-prep-eda/,https://img-c.udemycdn.com/course/240x135/5457418_5f1f_2.jpg,"Maven Analytics • 1,500,000 Learners, Alice Zhao",Python Data Science: Data Prep & EDA with Python,"Learn Python + Pandas for data cleaning, profiling & EDA, and prep data for machine learning & data science with Python",4.7,1170,All Levels,180 lectures,8.5 total hours,Current price: $79.99
classification,https://www.udemy.com/course/the-1-python-data-scientist-sentiment-analysis-more/,https://img-c.udemycdn.com/course/240x135/3059776_9a4d.jpg,"Mammoth Interactive, John Bura",The #1 Python Data Scientist: Sentiment Analysis & More,"Build Projects with Machine Learning, Text Classification, TensorFlowNumPy, PyPlot, Pandas, and More in Google Colab...",4.5,27,Beginner,105 lectures,16.5 total hours,Current price: $59.99
classification,https://www.udemy.com/course/complete-machine-learning-nlp-bootcamp-mlops-deployment/,https://img-c.udemycdn.com/course/240x135/5993822_2c2a_7.jpg,"Krish Naik, KRISHAI Technologies Private Limited","Complete Data Science,Machine Learning,DL,NLP Bootcamp","Master the theory, practice,and math behind Data Science,Machine Learning,Deep Learning,NLP with end to end projects",4.5,11296,All Levels,429 lectures,99 total hours,Current price: $94.99
