skill,link,image_link,partner,title,course_description,rating,num_review,difficulty,num_lecture,duration,price
vpn,https://www.udemy.com/course/google-cloud-professional-cloud-architect-certification/,https://img-c.udemycdn.com/course/240x135/3995372_4064.jpg,"in28Minutes Official, Ranga Karanam | GCP Certification - Google Cloud Engineer & Architect",GCP Professional Cloud Architect: Google Cloud Certification,Become a GCP Cloud Architect. Architect Google Cloud Platform (GCP) Solutions. Includes 4 New Case Studies.,4.6,12379,All Levels,337 lectures,21 total hours,
vpn,https://www.udemy.com/course/aws-certified-solutions-architect-associate-saa-c03/,https://img-c.udemycdn.com/course/240x135/2196488_8fc7_10.jpg,"Stephane Maarek | AWS Certified Cloud Practitioner,Solutions Architect,Developer",Ultimate AWS Certified Solutions Architect Associate 2025,Full Practice Exam | Learn Cloud Computing | Pass the AWS Certified Solutions Architect Associate Certification SAA-C03!,4.7,253574,All Levels,398 lectures,27.5 total hours,
vpn,https://www.udemy.com/course/virtualprivatenetwork/,https://img-c.udemycdn.com/course/240x135/2463014_5e42_7.jpg,"Munib Shah - CCIE (Security, Data Center)",Virtual Private Networks - Zero to Hero (VPN),A comprehensive coverage of Virtual Private Networks from basic level to advanced,4.4,416,All Levels,31 lectures,31.5 total hours,
vpn,https://www.udemy.com/course/data-architecture-for-data-engineers/,https://img-c.udemycdn.com/course/240x135/6268045_b022.jpg,Manas Jain,Data Architecture for Data Engineers: Practical Approaches,"Building Scalable, Efficient Data Solutions with Real-World Applications",4.5,119,All Levels,41 lectures,4 total hours,Current price: $69.99
vpn,https://www.udemy.com/course/aws-certified-solutions-architect-associate-hands-on/,https://img-c.udemycdn.com/course/240x135/2469516_ab87_11.jpg,"Neal Davis | AWS Certified Solutions Architect & Developer, Digital Cloud Training | AWS Certified Cloud Practitioner AWS Certified Solutions Architect, AWS Developer Associate",AWS Certified Solutions Architect Associate (SAA-C03) Course,2025 AWS Certified Solutions Architect Associate Video Course SAA-C03 | Hands-on Exercises + AWS Practice Exam + Slides,4.6,20792,All Levels,290 lectures,23 total hours,
vpn,https://www.udemy.com/course/vpn-business-in-a-box-launch-your-own-vpn-app-servers/,https://img-c.udemycdn.com/course/240x135/4632522_9736_4.jpg,Corels Emmanuel,"VPN Business in a Box: Build, Launch, and Monetize Your VPN",Master VPN Technology and Launch Your Profitable VPN Business with Zero Experience!,4.2,76,Beginner,33 lectures,3.5 total hours,Current price: $69.99
vpn,https://www.udemy.com/course/learn-azure-data-factory-from-scratch/,https://img-c.udemycdn.com/course/240x135/3685634_740c_6.jpg,Ramesh Retnasamy,Azure Data Factory For Data Engineers - Project on Covid19,"Real world project for Data Engineers using Azure Data Factory, SQL, Data Lake, Databricks, HDInsight, CI/CD [DP203]",4.6,15379,All Levels,146 lectures,13 total hours,
vpn,https://www.udemy.com/course/aws-certified-solutions-architect-professional-training/,https://img-c.udemycdn.com/course/240x135/3898634_5c95_4.jpg,"Neal Davis | AWS Certified Solutions Architect & Developer, Digital Cloud Training | AWS Certified Cloud Practitioner AWS Certified Solutions Architect, AWS Developer Associate",AWS Certified Solutions Architect Professional SAP-C02,[2025] AWS Certified Solutions Architect Professional Video Course | includes AWS Solutions Architect PRO Practice Test,4.6,6713,Intermediate,250 lectures,21.5 total hours,
vpn,https://www.udemy.com/course/aws-solutions-architect-professional/,https://img-c.udemycdn.com/course/240x135/2789348_065c_4.jpg,"Stephane Maarek | AWS Certified Cloud Practitioner,Solutions Architect,Developer",Ultimate AWS Certified Solutions Architect Professional 2025,Be AWS Certified Solutions Architect Professional. Full Amazon Web Services Solution Architecture deep-dive for SAP-C02,4.7,22069,,Expert,16.5 total hours,
vpn,https://www.udemy.com/course/the-data-analyst-course-complete-data-analyst-bootcamp/,https://img-c.udemycdn.com/course/240x135/3570337_9b02_6.jpg,365 Careers,The Data Analyst Course: Complete Data Analyst Bootcamp,"Complete Data Analyst Training: Python, NumPy, Pandas, Data Collection, Preprocessing, Data Types, Data Visualization",4.5,21135,All Levels,282 lectures,21.5 total hours,
vpn,https://www.udemy.com/course/virtual-private-network/,https://img-c.udemycdn.com/course/240x135/234558_94bd_4.jpg,Marious Kuriata,"Virtual Private Networks for beginners - VPN, Cisco training","Learn how VPN works and discover protocols like PPTP, L2TP, IPSec and SSL. Build your own VPN network at home. Security.",4.2,1948,All Levels,32 lectures,5 total hours,
vpn,https://www.udemy.com/course/azure-solutions-architect-certification-the-ultimate-bundle/,https://img-c.udemycdn.com/course/240x135/5968986_98b9_2.jpg,Memi Lavi,Azure Solutions Architect Certification: The Ultimate Bundle,Become a certified Azure Architect! Learn to design and build modern cloud apps from a certified Azure Architect,4.6,332,Beginner,392 lectures,28 total hours,Current price: $19.99
vpn,https://www.udemy.com/course/data-architecture-for-data-scientists/,https://img-c.udemycdn.com/course/240x135/5295982_ca3c_3.jpg,Biju Krishnan,Data Architecture for Data Scientists,"Datawarehouse, Data Lake, Data Lakehouse, Data Mesh, Kafka, Lambda & Kappa architecture, Feature Store, Vector DB & more",4.6,849,Intermediate,37 lectures,2.5 total hours,Current price: $69.99
vpn,https://www.udemy.com/course/salesforce-certified-data-architect-course/,https://img-c.udemycdn.com/course/240x135/4480780_cb46_2.jpg,Walid El Horr,Salesforce Data Architect Course,"Get your Salesforce Data Architect certification with this course, aligned with the Spring 23 exam guide objectives",4.5,435,Intermediate,68 lectures,10 total hours,
vpn,https://www.udemy.com/course/data-entry-skills-a-complete-data-entry-course-from-scratch/,https://img-c.udemycdn.com/course/240x135/5223618_671c.jpg,Data Tutors,Data Entry Skills: A Complete Data Entry Course from Scratch,A Complete Guide to Data Entry Skills: Learn Data Entry Skills and become a Data Entry Pro & Get a Online Data Entry Job,4.5,2672,Beginner,201 lectures,16 total hours,Current price: $19.99
vpn,https://www.udemy.com/course/mastering-vpns-on-cisco-ios-bootcamp-beginner-to-advanced/,https://img-c.udemycdn.com/course/240x135/5470030_63e4.jpg,ZB Networks 50000+ students trained Worldwide,Mastering VPNs on Cisco IOS Bootcamp: Beginner to Advanced,Securing Your Digital Footprint: A Comprehensive Guide to Virtual Private Networks (VPNs),4.6,42,All Levels,57 lectures,17 total hours,Current price: $19.99
vpn,https://www.udemy.com/course/big-data-engineering-bootcamp-with-gcp-and-azure-cloud/,https://img-c.udemycdn.com/course/240x135/6242299_e787.jpg,"Krish Naik, Mayank Aggarwal, KRISHAI Technologies Private Limited","Big Data Engineering Bootcamp with GCP, and Azure Cloud","Master Big Data with Hadoop, Spark, Kafka & Cloud | Build Real-World Projects & Scalable Data Pipelines from Scratch",4.7,357,All Levels,301 lectures,73.5 total hours,Current price: $44.99
vpn,https://www.udemy.com/course/data-mesh-demystified/,https://img-c.udemycdn.com/course/240x135/6236811_f1f4_2.jpg,Manas Jain,Data Mesh Architecture For Data Engineers,"Data Mesh Architecture for Data Engineers: Building Scalable, Decentralized Data Architectures for Modern Organizations",4.5,60,All Levels,30 lectures,2 total hours,Current price: $54.99
vpn,https://www.udemy.com/course/anyconnect/,https://img-c.udemycdn.com/course/240x135/847264_add4.jpg,Jimmy Larsson,Cisco ASA AnyConnect VPN,Learn how to setup Cisco ASA firewall for AnyConnect client vpn solutions,4.4,784,Intermediate,23 lectures,3 total hours,Current price: $49.99
vpn,https://www.udemy.com/course/mpls-vpns-with-juniper-networks/,https://img-c.udemycdn.com/course/240x135/5969080_147f.jpg,NetSecCloud Training,MPLS VPNs with Juniper Networks,A Deep Dive into MPLS VPN Configurations on Juniper,4.8,7,Beginner,19 lectures,6.5 total hours,Current price: $74.99
