skill,link,image_link,partner,title,course_description,rating,num_review,difficulty,num_lecture,duration,price
junit,https://www.udemy.com/course/testing-java-code-with-junit-5-and-mockito/,https://img-c.udemycdn.com/course/240x135/4602786_a947_2.jpg,Sergey Kargopolov,"Testing Java: JUnit 5, Mockito, Testcontainers, REST Assured",Unit Testing & Integration Testing of Java and Spring Boot applications. Test Driven Development(TDD) Explained.,4.6,1958,All Levels,154 lectures,10.5 total hours,Current price: $84.99
junit,https://www.udemy.com/course/spring-boot-unit-testing/,https://img-c.udemycdn.com/course/240x135/4425116_1f53_6.jpg,"Chad Darby, Eric Roby","Spring Boot Unit Testing with JUnit, Mockito and MockMvc","Develop Real-Time Spring Boot 3 Unit Tests: JUnit 5, Mockito, MockMvc, TDD, JsonPath, Hamcrest, H2 Embedded DB, MySQL",4.6,3317,Intermediate,135 lectures,10 total hours,Current price: $84.99
junit,https://www.udemy.com/course/mockito-tutorial-with-junit-examples/,https://img-c.udemycdn.com/course/240x135/950152_3c65_5.jpg,in28Minutes Official,Learn Java Unit Testing with Junit & Mockito in 30 Steps,Learn Mockito and JUnit - the most popular Java unit testing and mocking frameworks - with 25 Examples,4.4,25572,All Levels,48 lectures,5 total hours,Current price: $94.99
junit,https://www.udemy.com/course/junitandmockitocrashcourse/,https://img-c.udemycdn.com/course/240x135/548058_a172_4.jpg,Bharath Thippireddy,JUnit and Mockito Crash Course,Learn how to use JUnit and Mockito and Unit Test in easy steps.,4.5,5001,All Levels,94 lectures,4.5 total hours,Current price: $84.99
junit,https://www.udemy.com/course/junit5-for-beginners/,https://img-c.udemycdn.com/course/240x135/2007868_a89d_8.jpg,Adrian Wiech,Practical Java Unit Testing with JUnit 5,"Learn practical Java Unit Testing with JUnit 5 in just 1 hour. Comes with a quiz, JUnit cheat sheet and extra exercises.",4.7,7276,All Levels,31 lectures,1.5 total hours,Current price: $74.99
junit,https://www.udemy.com/course/testing-spring-boot-application-with-junit-and-mockito/,https://img-c.udemycdn.com/course/240x135/4457400_b340_2.jpg,Ramesh Fadatare (Java Guides),"Spring Boot Testing with JUnit 5, Mockito & Testcontainers","Unit tests and Integration tests for Spring Boot App and Spring WebFlux App using JUnit 5, Mockito and Testcontainers",4.5,1555,Intermediate,139 lectures,16 total hours,Current price: $84.99
junit,https://www.udemy.com/course/practical-java-testing-with-junit-5-for-complete-beginners/,https://img-c.udemycdn.com/course/240x135/3970616_acab.jpg,"Faisal Memon (EmbarkX), EmbarkX Official",Practical Java Testing With JUnit 5 for Complete Beginners,Learn To Automate Your Java Tests With JUnit 5. Learn Junit 5 for a Test Driven Approach. Unit Testing Using Java,4.4,126,Beginner,43 lectures,5 total hours,Current price: $54.99
junit,https://www.udemy.com/course/master-junit-5-for-java-developers/,https://img-c.udemycdn.com/course/240x135/4557368_89cd.jpg,Code Caffeine,Master JUnit 5 for Java developers,Understand JUnit5 and write fully featured test cases,4.2,149,All Levels,21 lectures,,Current price: $19.99
junit,https://www.udemy.com/course/salesforce-certified-data-architect-course/,https://img-c.udemycdn.com/course/240x135/4480780_cb46_2.jpg,Walid El Horr,Salesforce Data Architect Course,"Get your Salesforce Data Architect certification with this course, aligned with the Spring 23 exam guide objectives",4.5,435,Intermediate,68 lectures,10 total hours,Current price: $59.99
junit,https://www.udemy.com/course/the-data-analyst-course-complete-data-analyst-bootcamp/,https://img-c.udemycdn.com/course/240x135/3570337_9b02_6.jpg,365 Careers,The Data Analyst Course: Complete Data Analyst Bootcamp,"Complete Data Analyst Training: Python, NumPy, Pandas, Data Collection, Preprocessing, Data Types, Data Visualization",4.5,21135,All Levels,282 lectures,21.5 total hours,Current price: $149.99
junit,https://www.udemy.com/course/practical-junit-mockito-test-with-java-springboot-jpa/,https://img-c.udemycdn.com/course/240x135/4547536_e51f_2.jpg,Ranjan Pandey,Practical Junit & Mockito Test with Java SpringBoot & JPA,Learn about Test Driven Development & how its implemented in companies for Java SpringBoot project using Junit & Mockito,4.4,103,Beginner,65 lectures,9 total hours,Current price: $54.99
junit,https://www.udemy.com/course/data-architecture-for-data-engineers/,https://img-c.udemycdn.com/course/240x135/6268045_b022.jpg,Manas Jain,Data Architecture for Data Engineers: Practical Approaches,"Building Scalable, Efficient Data Solutions with Real-World Applications",4.5,119,All Levels,41 lectures,4 total hours,Current price: $69.99
junit,https://www.udemy.com/course/data-architecture-for-data-scientists/,https://img-c.udemycdn.com/course/240x135/5295982_ca3c_3.jpg,Biju Krishnan,Data Architecture for Data Scientists,"Datawarehouse, Data Lake, Data Lakehouse, Data Mesh, Kafka, Lambda & Kappa architecture, Feature Store, Vector DB & more",4.6,849,Intermediate,37 lectures,2.5 total hours,Current price: $69.99
junit,https://www.udemy.com/course/practical-junit-5-for-java-developers-junit-5-simplified/,https://img-c.udemycdn.com/course/240x135/6273699_76f6_2.jpg,Hyder Abbas,Practical JUnit 5 for Beginners : Unit Testing with JUnit5,Unit Testing with JUnit 5 Simplified for Java Developers [JUnit 5],4.7,46,All Levels,27 lectures,2 total hours,Current price: $54.99
junit,https://www.udemy.com/course/learn-azure-data-factory-from-scratch/,https://img-c.udemycdn.com/course/240x135/3685634_740c_6.jpg,Ramesh Retnasamy,Azure Data Factory For Data Engineers - Project on Covid19,"Real world project for Data Engineers using Azure Data Factory, SQL, Data Lake, Databricks, HDInsight, CI/CD [DP203]",4.6,15379,All Levels,146 lectures,13 total hours,Current price: $94.99
junit,https://www.udemy.com/course/data-mesh-demystified/,https://img-c.udemycdn.com/course/240x135/6236811_f1f4_2.jpg,Manas Jain,Data Mesh Architecture For Data Engineers,"Data Mesh Architecture for Data Engineers: Building Scalable, Decentralized Data Architectures for Modern Organizations",4.5,60,All Levels,30 lectures,2 total hours,Current price: $54.99
junit,https://www.udemy.com/course/testing-for-developers/,https://img-c.udemycdn.com/course/240x135/3273578_a5eb.jpg,"Andrii Piatakha, Learn IT University","JUnit 5, Mockito, PowerMock, TDD, BDD & ATTD",Learn JUnit 5 (JUpiter) + libraries for unit and integration testing from scratch together with test-driven development,4.1,366,All Levels,17 lectures,4 total hours,Current price: $49.99
junit,https://www.udemy.com/course/data-entry-skills-a-complete-data-entry-course-from-scratch/,https://img-c.udemycdn.com/course/240x135/5223618_671c.jpg,Data Tutors,Data Entry Skills: A Complete Data Entry Course from Scratch,A Complete Guide to Data Entry Skills: Learn Data Entry Skills and become a Data Entry Pro & Get a Online Data Entry Job,4.5,2672,Beginner,201 lectures,16 total hours,Current price: $19.99
junit,https://www.udemy.com/course/testing-spring-boot-beginner-to-guru/,https://img-c.udemycdn.com/course/240x135/1935322_d91d_2.jpg,"John Thompson • 500,000+ Enrollments Worldwide, Spring Ahead Code Academy",Testing Spring Boot: Beginner to Guru,"Become an Expert Testing Java and Spring Boot Applications using JUnit 5, Mockito, Spring Boot, and More!",4.1,3376,All Levels,217 lectures,21 total hours,Current price: $84.99
junit,https://www.udemy.com/course/java-testing-unit-framework/,https://img-c.udemycdn.com/course/240x135/6165391_4317.jpg,Ramesh Fadatare (Java Guides),JUnit 5 Full Course for Beginners [2025] - Java Unit Testing,"Learn Unit testing in Java using JUnit 5, Java 21, JUnit 5, Maven, and IntelliJ IDEA. Unit Testing Banking App in Java.",4.5,9,Beginner,51 lectures,8.5 total hours,Current price: $59.99
