skill,link,image_link,partner,title,course_description,rating,num_review,difficulty,num_lecture,duration,price
shell,https://www.udemy.com/course/bash-mastery/,https://img-c.udemycdn.com/course/240x135/2997494_0cc5_2.jpg,"Ziyad Yehia, Internet of Things Academy",Bash Mastery: The Complete Guide to Bash Shell Scripting,"Master Bash Shell Scripting to Automate Tasks, Save Time, and Boost Your Career. Practical Projects + All Code Included.",4.8,3906,All Levels,111 lectures,12 total hours,Current price: $84.99
shell,https://www.udemy.com/course/google-cloud-professional-cloud-architect-certification/,https://img-c.udemycdn.com/course/240x135/3995372_4064.jpg,"in28Minutes Official, Ranga Karanam | GCP Certification - Google Cloud Engineer & Architect",GCP Professional Cloud Architect: Google Cloud Certification,Become a GCP Cloud Architect. Architect Google Cloud Platform (GCP) Solutions. Includes 4 New Case Studies.,4.6,12379,All Levels,337 lectures,21 total hours,Current price: $119.99
shell,https://www.udemy.com/course/hello-big-data-at-bash/,https://img-c.udemycdn.com/course/240x135/1124030_262f_41.jpg,"Scientific Programmer™ Team, Scientific Programming School",Bash Shell Programming for Data Sciences: Animated Course,Innovative Project-based Animated Linux Command Line Masterclass: Bash Shell Programming  Data Mining Science- 7.5 Hours,4.5,158,Beginner,100 lectures,7 total hours,Current price: $79.99
shell,https://www.udemy.com/course/data-architecture-for-data-engineers/,https://img-c.udemycdn.com/course/240x135/6268045_b022.jpg,Manas Jain,Data Architecture for Data Engineers: Practical Approaches,"Building Scalable, Efficient Data Solutions with Real-World Applications",4.5,119,All Levels,41 lectures,4 total hours,Current price: $69.99
shell,https://www.udemy.com/course/powershell-from-beginner-to-sheller-and-scripter/,https://img-c.udemycdn.com/course/240x135/979510_95e0.jpg,David Fitzpatrick,PowerShell  from Beginner To Sheller And Scripter,Learn how to use PowerShell the easy way,4.7,2174,Beginner,115 lectures,11.5 total hours,Current price: $99.99
shell,https://www.udemy.com/course/linux-shell-scripting-projects/,https://img-c.udemycdn.com/course/240x135/1349660_ecfb_4.jpg,Jason Cannon,Linux Shell Scripting: A Project-Based Approach to Learning,"Learn how to shell script through project-based training (Bash Scripting, Bash Programming, Sed, Grep, Awk, and More)",4.5,14948,All Levels,49 lectures,12.5 total hours,Current price: $119.99
shell,https://www.udemy.com/course/big-data-engineering-bootcamp-with-gcp-and-azure-cloud/,https://img-c.udemycdn.com/course/240x135/6242299_e787.jpg,"Krish Naik, Mayank Aggarwal, KRISHAI Technologies Private Limited","Big Data Engineering Bootcamp with GCP, and Azure Cloud","Master Big Data with Hadoop, Spark, Kafka & Cloud | Build Real-World Projects & Scalable Data Pipelines from Scratch",4.7,357,All Levels,301 lectures,73.5 total hours,Current price: $44.99
shell,https://www.udemy.com/course/data-architecture-for-data-scientists/,https://img-c.udemycdn.com/course/240x135/5295982_ca3c_3.jpg,Biju Krishnan,Data Architecture for Data Scientists,"Datawarehouse, Data Lake, Data Lakehouse, Data Mesh, Kafka, Lambda & Kappa architecture, Feature Store, Vector DB & more",4.6,849,Intermediate,37 lectures,2.5 total hours,Current price: $69.99
shell,https://www.udemy.com/course/learn-azure-data-factory-from-scratch/,https://img-c.udemycdn.com/course/240x135/3685634_740c_6.jpg,Ramesh Retnasamy,Azure Data Factory For Data Engineers - Project on Covid19,"Real world project for Data Engineers using Azure Data Factory, SQL, Data Lake, Databricks, HDInsight, CI/CD [DP203]",4.6,15379,All Levels,146 lectures,13 total hours,Current price: $94.99
shell,https://www.udemy.com/course/aws-data-engineer/,https://img-c.udemycdn.com/course/240x135/5591620_4e46_2.jpg,"Sundog Education by Frank Kane, Frank Kane, Stephane Maarek | AWS Certified Cloud Practitioner,Solutions Architect,Developer",AWS Certified Data Engineer Associate 2025 - Hands On!,"AWS DEA-C01 certification prep course with exercises and a full-length practice exam. Redshift, Glue, Athena, and more",4.6,7915,Intermediate,289 lectures,22 total hours,Current price: $94.99
shell,https://www.udemy.com/course/bash-scripting/,https://img-c.udemycdn.com/course/240x135/958532_478a_4.jpg,Jason Cannon,Bash Scripting and Shell Programming (Linux Command Line),"Learn bash programming for Linux, Unix, & Mac. Learn how to write bash scripts like a pro & solve real-world problems!",4.5,20282,All Levels,34 lectures,2.5 total hours,Current price: $109.99
shell,https://www.udemy.com/course/the-data-analyst-course-complete-data-analyst-bootcamp/,https://img-c.udemycdn.com/course/240x135/3570337_9b02_6.jpg,365 Careers,The Data Analyst Course: Complete Data Analyst Bootcamp,"Complete Data Analyst Training: Python, NumPy, Pandas, Data Collection, Preprocessing, Data Types, Data Visualization",4.5,21135,All Levels,282 lectures,21.5 total hours,Current price: $149.99
shell,https://www.udemy.com/course/shell-scripting-linux/,https://img-c.udemycdn.com/course/240x135/563066_4981_2.jpg,Jason Cannon,Shell Scripting: Discover How to Automate Command Line Tasks,"Learn shell programming for Linux, Unix, & Mac. Learn how to write shell scripts like a pro & solve real-world problems!",4.5,9140,All Levels,48 lectures,6 total hours,Current price: $84.99
shell,https://www.udemy.com/course/linux-bash-shell-scripting-through-real-life-examples/,https://img-c.udemycdn.com/course/240x135/1585444_e4de_6.jpg,Imran Afzal,Complete Linux Bash Shell Scripting with Real Life Examples,Shell Scripting and Programming for Daily Tedious Tasks Automation (Scripting is required for RHCSA certification),4.5,4383,All Levels,87 lectures,14.5 total hours,Current price: $99.99
shell,https://www.udemy.com/course/aws-solutions-architect-professional/,https://img-c.udemycdn.com/course/240x135/2789348_065c_4.jpg,"Stephane Maarek | AWS Certified Cloud Practitioner,Solutions Architect,Developer",Ultimate AWS Certified Solutions Architect Professional 2025,Be AWS Certified Solutions Architect Professional. Full Amazon Web Services Solution Architecture deep-dive for SAP-C02,4.7,22069,,Expert,16.5 total hours,Current price: $149.99
shell,https://www.udemy.com/course/fast-track-to-shell-scripting-for-linux-admins/,https://img-c.udemycdn.com/course/240x135/5385340_7906_2.jpg,"Mo Khalil, Muhammed Torkey, Cloudsark",Linux Bash Shell Scripting for Beginners,"Learn Linux Bash Shell Scripting fast! Simple, beginner-friendly Linux shell scripting lessons to get you started.",4.2,19,All Levels,39 lectures,2.5 total hours,Current price: $54.99
shell,https://www.udemy.com/course/bash-shell-scripting-crash-course-for-beginners/,https://img-c.udemycdn.com/course/240x135/1583482_7f8e_2.jpg,Francesco Santi,Bash Shell Scripting: Crash Course For Beginners,"Learn Bash Shell Scripting from total beginner:Start from the Command Line,finish with a real world Shell Script Project",4.5,14866,All Levels,75 lectures,5.5 total hours,Current price: $109.99
shell,https://www.udemy.com/course/the-data-science-course-complete-data-science-bootcamp/,https://img-c.udemycdn.com/course/240x135/1754098_e0df_3.jpg,365 Careers,The Data Science Course: Complete Data Science Bootcamp 2025,"Complete Data Science Training: Math, Statistics, Python, Advanced Statistics in Python, Machine and Deep Learning",4.6,151551,All Levels,523 lectures,32 total hours,Current price: $124.99
shell,https://www.udemy.com/course/modeling-data-warehouse-with-data-vault-for-beginners/,https://img-c.udemycdn.com/course/240x135/3655144_5a8d_2.jpg,Esra Ekiz,Modeling Data Warehouse with Data Vault 2.0,Course covers the basics and fundamentals of Data Vault 2.0 along with Agile Methodology and Big Data,4.5,3694,Intermediate,47 lectures,6 total hours,Current price: $74.99
shell,https://www.udemy.com/course/azure-solutions-architect-certification-the-ultimate-bundle/,https://img-c.udemycdn.com/course/240x135/5968986_98b9_2.jpg,Memi Lavi,Azure Solutions Architect Certification: The Ultimate Bundle,Become a certified Azure Architect! Learn to design and build modern cloud apps from a certified Azure Architect,4.6,332,Beginner,392 lectures,28 total hours,Current price: $19.99
