skill,link,image_link,partner,title,course_description,rating,num_review,difficulty,num_lecture,duration,price
oauth,https://www.udemy.com/course/oauth-2-simplified/,https://img-c.udemycdn.com/course/240x135/3681884_151a.jpg,Aaron Parecki,The Nuts and Bolts of OAuth 2.0,"Covering OAuth 2.0, OpenID, PKCE, deprecated flows, JWTs, API Gateways, and scopes. No programming knowledge needed",4.7,10252,Intermediate,51 lectures,3.5 total hours,Current price: $84.99
oauth,https://www.udemy.com/course/enterprise-oauth-for-developers/,https://img-c.udemycdn.com/course/240x135/3746012_46e2_5.jpg,Viraj Shetty,Enterprise OAuth 2.0 and OpenID Connect,"OAuth2/OpenID Connect with Okta and Google IAM, JWT, Encryption, Signatures, openssl, Java Spring Boot and Angular",4.8,2619,All Levels,104 lectures,12.5 total hours,Current price: $84.99
oauth,https://www.udemy.com/course/master-oauth-2-api-security-practical-guide/,https://img-c.udemycdn.com/course/240x135/6367031_69f2_4.jpg,Muhannad Darraj,Master OAuth 2.0: A Practical Guide to API Security,"OAuth 2.0 with practical flows, implementations, real-world use cases, and decision-making for robust API architectures",4.9,73,All Levels,55 lectures,3.5 total hours,Current price: $64.99
oauth,https://www.udemy.com/course/advanced-oauth-security/,https://img-c.udemycdn.com/course/240x135/4885700_ea9e.jpg,Aaron Parecki,Advanced OAuth Security,"Learn the high-security OAuth extensions described in FAPI: PAR, JAR, JARM, DPoP, Mutual TLS, and HTTP Signatures",4.8,482,Intermediate,31 lectures,1.5 total hours,Current price: $74.99
oauth,https://www.udemy.com/course/getting-started-with-oauth-20/,https://img-c.udemycdn.com/course/240x135/4056642_0d02_6.jpg,Programming Made Easy,OAuth 2.0: The Complete Guide,"Covering OAuth 2.0 Workflows, Endpoints, Scopes, Tokens: JWTs and API Security. Real-life examples included!",4.3,136,All Levels,17 lectures,2 total hours,Current price: $39.99
oauth,https://www.udemy.com/course/learn-oauth-2/,https://img-c.udemycdn.com/course/240x135/380582_0396_6.jpg,Matthias Biehl,Learn OAuth 2.0 - Get started as an API Security Expert,Imagine what could happen to YOUR career if you knew API Security| Udmy for Business approved| 17000 satisfied students,4.4,3036,All Levels,53 lectures,4.5 total hours,Current price: $74.99
oauth,https://www.udemy.com/course/azure-solutions-architect-certification-the-ultimate-bundle/,https://img-c.udemycdn.com/course/240x135/5968986_98b9_2.jpg,Memi Lavi,Azure Solutions Architect Certification: The Ultimate Bundle,Become a certified Azure Architect! Learn to design and build modern cloud apps from a certified Azure Architect,4.6,332,Beginner,392 lectures,28 total hours,Current price: $19.99
oauth,https://www.udemy.com/course/salesforce-certified-data-architect-course/,https://img-c.udemycdn.com/course/240x135/4480780_cb46_2.jpg,Walid El Horr,Salesforce Data Architect Course,"Get your Salesforce Data Architect certification with this course, aligned with the Spring 23 exam guide objectives",4.5,435,Intermediate,68 lectures,10 total hours,Current price: $59.99
oauth,https://www.udemy.com/course/identity-access-management-learn-oauth-openidsaml-ldap/,https://img-c.udemycdn.com/course/240x135/2454252_3e78_4.jpg,Varinder K,"Identity & Access Management-Learn LDAP, SAML, OAuth, OpenID",Identity access management & Identity Security (Updated-2024),4.3,638,All Levels,36 lectures,3 total hours,Current price: $54.99
oauth,https://www.udemy.com/course/oauth2-in-spring-boot-applications/,https://img-c.udemycdn.com/course/240x135/3219295_581d_3.jpg,Sergey Kargopolov,OAuth 2.0 in Spring Boot Applications,Learn to secure Spring Boot applications with the New OAuth 2.0 Stack in Spring Security 5,4.6,3560,All Levels,188 lectures,11 total hours,Current price: $84.99
oauth,https://www.udemy.com/course/data-architecture-for-data-engineers/,https://img-c.udemycdn.com/course/240x135/6268045_b022.jpg,Manas Jain,Data Architecture for Data Engineers: Practical Approaches,"Building Scalable, Efficient Data Solutions with Real-World Applications",4.5,119,All Levels,41 lectures,4 total hours,Current price: $69.99
oauth,https://www.udemy.com/course/data-architecture-for-data-scientists/,https://img-c.udemycdn.com/course/240x135/5295982_ca3c_3.jpg,Biju Krishnan,Data Architecture for Data Scientists,"Datawarehouse, Data Lake, Data Lakehouse, Data Mesh, Kafka, Lambda & Kappa architecture, Feature Store, Vector DB & more",4.6,849,Intermediate,37 lectures,2.5 total hours,Current price: $69.99
oauth,https://www.udemy.com/course/oauth2-deep-dive-volume-1/,https://img-c.udemycdn.com/course/240x135/3509728_6a63_2.jpg,Zach LaCourse,OAuth 2.0 Deep Dive Volume 1,An OAuth Practice & Development Framework,3.7,7,All Levels,95 lectures,21.5 total hours,Current price: $49.99
oauth,https://www.udemy.com/course/aws-certified-solutions-architect-associate-saa-c03/,https://img-c.udemycdn.com/course/240x135/2196488_8fc7_10.jpg,"Stephane Maarek | AWS Certified Cloud Practitioner,Solutions Architect,Developer",Ultimate AWS Certified Solutions Architect Associate 2025,Full Practice Exam | Learn Cloud Computing | Pass the AWS Certified Solutions Architect Associate Certification SAA-C03!,4.7,253574,All Levels,398 lectures,27.5 total hours,Current price: $119.99
oauth,https://www.udemy.com/course/data-mesh-demystified/,https://img-c.udemycdn.com/course/240x135/6236811_f1f4_2.jpg,Manas Jain,Data Mesh Architecture For Data Engineers,"Data Mesh Architecture for Data Engineers: Building Scalable, Decentralized Data Architectures for Modern Organizations",4.5,60,All Levels,30 lectures,2 total hours,Current price: $54.99
oauth,https://www.udemy.com/course/google-cloud-professional-cloud-architect-certification/,https://img-c.udemycdn.com/course/240x135/3995372_4064.jpg,"in28Minutes Official, Ranga Karanam | GCP Certification - Google Cloud Engineer & Architect",GCP Professional Cloud Architect: Google Cloud Certification,Become a GCP Cloud Architect. Architect Google Cloud Platform (GCP) Solutions. Includes 4 New Case Studies.,4.6,12379,All Levels,337 lectures,21 total hours,Current price: $119.99
oauth,https://www.udemy.com/course/aws-solutions-architect-professional/,https://img-c.udemycdn.com/course/240x135/2789348_065c_4.jpg,"Stephane Maarek | AWS Certified Cloud Practitioner,Solutions Architect,Developer",Ultimate AWS Certified Solutions Architect Professional 2025,Be AWS Certified Solutions Architect Professional. Full Amazon Web Services Solution Architecture deep-dive for SAP-C02,4.7,22069,,Expert,16.5 total hours,Current price: $149.99
oauth,https://www.udemy.com/course/the-data-analyst-course-complete-data-analyst-bootcamp/,https://img-c.udemycdn.com/course/240x135/3570337_9b02_6.jpg,365 Careers,The Data Analyst Course: Complete Data Analyst Bootcamp,"Complete Data Analyst Training: Python, NumPy, Pandas, Data Collection, Preprocessing, Data Types, Data Visualization",4.5,21135,All Levels,282 lectures,21.5 total hours,Current price: $149.99
oauth,https://www.udemy.com/course/fastapi-the-complete-course/,https://img-c.udemycdn.com/course/240x135/4355412_2065_7.jpg,"Eric Roby, Chad Darby",FastAPI - The Complete Course 2025 (Beginner + Advanced),"Dive in and learn FastAPI from scratch! Learn FastAPI, RESTful APIs using Python, SQLAlchemy, OAuth, JWT and way more!",4.6,6855,All Levels,241 lectures,21.5 total hours,Current price: $84.99
oauth,https://www.udemy.com/course/practical-oauth-openid-and-jwt-in-c-net-core/,https://img-c.udemycdn.com/course/240x135/4335764_e732.jpg,Omar McIver,"Practical OAuth, OpenID and JWT in C# .NET Core",Get hands on with these standards and technologies in .NET Core,4.3,61,Intermediate,17 lectures,5 total hours,Current price: $49.99
