skill,link,image_link,partner,title,course_description,rating,num_review,difficulty,num_lecture,duration,price
php,https://www.udemy.com/course/modern-php/,https://img-c.udemycdn.com/course/240x135/5566586_456b_6.jpg,Jannis Seemann,Modern PHP: The Complete Guide - from Beginner to Advanced,Master the programming language that powers the web: Learn PHP and kickstart a lucrative web developer career,4.7,681,Beginner,349 lectures,45.5 total hours,
php,https://www.udemy.com/course/the-data-analyst-course-complete-data-analyst-bootcamp/,https://img-c.udemycdn.com/course/240x135/3570337_9b02_6.jpg,365 Careers,The Data Analyst Course: Complete Data Analyst Bootcamp,"Complete Data Analyst Training: Python, NumPy, Pandas, Data Collection, Preprocessing, Data Types, Data Visualization",4.5,21135,All Levels,282 lectures,21.5 total hours,Current price: $149.99
php,https://www.udemy.com/course/laravel-beginner-fundamentals/,https://img-c.udemycdn.com/course/240x135/2020278_e07c_10.jpg,"Piotr Jura | 62,000+ Students",Master Laravel 11 & PHP: From Beginner to Advanced,Master Laravel and PHP: Build 5 Real-World Projects! Learn PHP From Scratch!,4.6,5388,All Levels,195 lectures,30.5 total hours,Current price: $69.99
php,https://www.udemy.com/course/php-for-complete-beginners-includes-msql-object-oriented/,https://img-c.udemycdn.com/course/240x135/405282_27d2_3.jpg,"Edwin Diaz | 900,000+ Students, Coding Faculty Solutions",PHP for Beginners - Become a PHP Master - CMS Project,PHP for Beginners: learn everything you need to become a professional PHP developer with practical exercises & projects.,4.5,25074,All Levels,332 lectures,40.5 total hours,Current price: $149.99
php,https://www.udemy.com/course/google-cloud-professional-cloud-architect-certification/,https://img-c.udemycdn.com/course/240x135/3995372_4064.jpg,"in28Minutes Official, Ranga Karanam | GCP Certification - Google Cloud Engineer & Architect",GCP Professional Cloud Architect: Google Cloud Certification,Become a GCP Cloud Architect. Architect Google Cloud Platform (GCP) Solutions. Includes 4 New Case Studies.,4.6,12379,All Levels,337 lectures,21 total hours,Current price: $119.99
php,https://www.udemy.com/course/data-architecture-for-data-scientists/,https://img-c.udemycdn.com/course/240x135/5295982_ca3c_3.jpg,Biju Krishnan,Data Architecture for Data Scientists,"Datawarehouse, Data Lake, Data Lakehouse, Data Mesh, Kafka, Lambda & Kappa architecture, Feature Store, Vector DB & more",4.6,849,Intermediate,37 lectures,2.5 total hours,
php,https://www.udemy.com/course/php-apis/,https://img-c.udemycdn.com/course/240x135/4053426_5975_2.jpg,Dave Hollingworth,APIs in PHP: from Basic to Advanced,"Use REST APIs from PHP, and create your own RESTful API using plain PHP, with API key and JWT token authentication",4.7,1219,All Levels,90 lectures,5 total hours,
php,https://www.udemy.com/course/php-mvc-from-scratch/,https://img-c.udemycdn.com/course/240x135/424864_ab6e_3.jpg,Dave Hollingworth,Write PHP Like a Pro: Build a PHP MVC Framework From Scratch,"Write faster, easier to maintain, more secure PHP websites by creating your own Model View Controller framework",4.7,3179,All Levels,190 lectures,6.5 total hours,
php,https://www.udemy.com/course/learn-azure-data-factory-from-scratch/,https://img-c.udemycdn.com/course/240x135/3685634_740c_6.jpg,Ramesh Retnasamy,Azure Data Factory For Data Engineers - Project on Covid19,"Real world project for Data Engineers using Azure Data Factory, SQL, Data Lake, Databricks, HDInsight, CI/CD [DP203]",4.6,15379,All Levels,146 lectures,13 total hours,Current price: $94.99
php,https://www.udemy.com/course/data-entry-skills-a-complete-data-entry-course-from-scratch/,https://img-c.udemycdn.com/course/240x135/5223618_671c.jpg,Data Tutors,Data Entry Skills: A Complete Data Entry Course from Scratch,A Complete Guide to Data Entry Skills: Learn Data Entry Skills and become a Data Entry Pro & Get a Online Data Entry Job,4.5,2672,Beginner,201 lectures,16 total hours,
php,https://www.udemy.com/course/php-from-scratch-course/,https://img-c.udemycdn.com/course/240x135/5682894_e112.jpg,Brad Traversy,PHP From Scratch | Beginner To Advanced,"Learn PHP fundamentals then build a job listing website from the ground up, using a Laravel-like infrastructure",4.7,1431,All Levels,135 lectures,18.5 total hours,
php,https://www.udemy.com/course/the-data-science-course-complete-data-science-bootcamp/,https://img-c.udemycdn.com/course/240x135/1754098_e0df_3.jpg,365 Careers,The Data Science Course: Complete Data Science Bootcamp 2025,"Complete Data Science Training: Math, Statistics, Python, Advanced Statistics in Python, Machine and Deep Learning",4.6,151551,All Levels,523 lectures,32 total hours,Current price: $124.99
php,https://www.udemy.com/course/aws-certified-solutions-architect-associate-saa-c03/,https://img-c.udemycdn.com/course/240x135/2196488_8fc7_10.jpg,"Stephane Maarek | AWS Certified Cloud Practitioner,Solutions Architect,Developer",Ultimate AWS Certified Solutions Architect Associate 2025,Full Practice Exam | Learn Cloud Computing | Pass the AWS Certified Solutions Architect Associate Certification SAA-C03!,4.7,253574,All Levels,398 lectures,27.5 total hours,Current price: $119.99
php,https://www.udemy.com/course/complete-modern-php-developer/,https://img-c.udemycdn.com/course/240x135/4994252_6808_2.jpg,Luis Ramirez Jr,Complete Modern PHP Developer Course,"The modern PHP course with a project, challenges and theory. Includes SQL and MVC Framework. Get started with PHP 8!",4.6,720,Beginner,307 lectures,23.5 total hours,
php,https://www.udemy.com/course/master-php-for-absolute-beginners/,https://img-c.udemycdn.com/course/240x135/6071467_f760.jpg,"Piotr Jura | 62,000+ Students",Master Modern PHP 8: From Beginner to Advanced,"Learn PHP from scratch, build projects and Laravel-like framework. Learn modern PHP 8 like never before.",4.6,105,Beginner,141 lectures,20 total hours,
php,https://www.udemy.com/course/data-structures-and-algorithm-in-php-part-one/,https://img-c.udemycdn.com/course/240x135/2117980_e187_2.jpg,Joshua Melvin Benhar,Data Structures And Algorithms In PHP,"Linked list, Stacks, Queues And Interview Problems",3.6,79,Beginner,76 lectures,4.5 total hours,Current price: $44.99
php,https://www.udemy.com/course/aws-solutions-architect-professional/,https://img-c.udemycdn.com/course/240x135/2789348_065c_4.jpg,"Stephane Maarek | AWS Certified Cloud Practitioner,Solutions Architect,Developer",Ultimate AWS Certified Solutions Architect Professional 2025,Be AWS Certified Solutions Architect Professional. Full Amazon Web Services Solution Architecture deep-dive for SAP-C02,4.7,22069,,Expert,16.5 total hours,Current price: $149.99
php,https://www.udemy.com/course/aws-data-engineer/,https://img-c.udemycdn.com/course/240x135/5591620_4e46_2.jpg,"Sundog Education by Frank Kane, Frank Kane, Stephane Maarek | AWS Certified Cloud Practitioner,Solutions Architect,Developer",AWS Certified Data Engineer Associate 2025 - Hands On!,"AWS DEA-C01 certification prep course with exercises and a full-length practice exam. Redshift, Glue, Athena, and more",4.6,7915,Intermediate,289 lectures,22 total hours,
php,https://www.udemy.com/course/100-days-of-code/,https://img-c.udemycdn.com/course/240x135/2776760_f176_10.jpg,"Dr. Angela Yu, Developer and Lead Instructor",100 Days of Code: The Complete Python Pro Bootcamp,"Master Python by building 100 projects in 100 days. Learn data science, automation, build websites, games and apps!",4.7,361653,All Levels,592 lectures,56.5 total hours,Current price: $119.99
php,https://www.udemy.com/course/data-analytics-career-track/,https://img-c.udemycdn.com/course/240x135/5787046_e749_10.jpg,Shahriar's Sight Academy,Data Analytics Career Path: 72 Days of Data Analyst Bootcamp,"Learn Excel, MySQL, Python, PowerBI, ChatGPT for A-Z Data Analysis. Become a Full-Packed Data Analyst. [5 Courses in 1]",4.3,958,All Levels,359 lectures,34.5 total hours,
