skill,link,image_link,partner,title,course_description,rating,num_review,difficulty,num_lecture,duration,price
jira,https://www.udemy.com/course/introduction-devops/,https://img-c.udemycdn.com/course/240x135/5236958_2efa_2.jpg,Imran Afzal,Introduction to DevOps: Roadmap to DevOps Career,"DevOps course for someone who wants to learn Jenkins​,​ Jira, Dockers, Kubernetes, Nagios, Ansible, Terraform, and more",4.5,513,All Levels,55 lectures,7.5 total hours,Current price: $79.99
jira,https://www.udemy.com/course/jira-confluence-masterclass-2025-for-users-projects/,https://img-c.udemycdn.com/course/240x135/6203609_c5c7.jpg,"Niels Rabe | Agile Coach, Project manager, Scrum Master",Jira & Confluence Masterclass 2025 for Projects & Teams,"Manage Agile, Scrum, Kanban and more Teams and Projects by Mastering Jira and Confluence in 2025. Learn Jira today!",4.5,48,Beginner,114 lectures,10.5 total hours,Current price: $89.99
jira,https://www.udemy.com/course/aws-certified-devops-engineer-professional-hands-on/,https://img-c.udemycdn.com/course/240x135/2533568_2828_6.jpg,"Stephane Maarek | AWS Certified Cloud Practitioner,Solutions Architect,Developer",AWS Certified DevOps Engineer Professional 2025 - DOP-C02,Pass the AWS Certified DevOps Engineer Professional Certification (DOP-C02) with 20 hours of advanced videos.,4.7,18041,Intermediate,248 lectures,17 total hours,Current price: $149.99
jira,https://www.udemy.com/course/the-complete-guide-to-jira-with-real-world-examples/,https://img-c.udemycdn.com/course/240x135/1120038_2d02_6.jpg,Kosh Sarkar (Atlassian Certified Trainer),Learn Jira with real-world examples 2024 (+Confluence bonus),"Updated 2024! Learn to work on, manage, administer agile projects with this comprehensive course on JIRA and Confluence",4.6,39808,All Levels,82 lectures,10.5 total hours,Current price: $109.99
jira,https://www.udemy.com/course/aws-certified-devops-engineer-professional-practice-exams-amazon-dop-c02/,https://img-c.udemycdn.com/course/240x135/2644002_eff2_6.jpg,"Jon Bonso AWS Certified Cloud Practitioner, Developer, Solutions Architect, Tutorials Dojo | AWS Certified Cloud Practitioner, AWS Certified Solutions Architect, AWS Certified Developer, Amiel Palacol AWS Certified Solutions Architect, DevOps Engineer Professional",AWS Certified DevOps Engineer Professional Practice Exams,Be an AWS DevOps Engineer! AWS Certified DevOps Engineer Professional Practice Tests that covers all DOP-C02 topics!,4.5,1285,Intermediate,150 questions,,Current price: $59.99
jira,https://www.udemy.com/course/decodingdevops/,https://img-c.udemycdn.com/course/240x135/4039556_ebb3_9.jpg,Imran Teli,DevOps Beginners to Advanced with Projects,"Begin Your DevOps Career As a Newbie | AWS, Linux, Scripting, Jenkins, Ansible, GitOps, Docker, Kubernetes, & Terraform.",4.6,36463,All Levels,318 lectures,53 total hours,Current price: $119.99
jira,https://www.udemy.com/course/aws-certified-devops-engineer-professional-practice-exam-dop/,https://img-c.udemycdn.com/course/240x135/2567118_611e_8.jpg,"Stephane Maarek | AWS Certified Cloud Practitioner,Solutions Architect,Developer, Abhishek Singh",Practice Exams | AWS Certified DevOps Engineer Professional,AWS Certified DevOps: 120 high fidelity questions: AWS Certified DevOps Engineer Professional DOP-C02.,4.4,2568,All Levels,120 questions,,Current price: $59.99
jira,https://www.udemy.com/course/devops-with-docker-kubernetes-and-azure-devops/,https://img-c.udemycdn.com/course/240x135/2813427_cc60_2.jpg,"in28Minutes Official, Ravi S | DevOps Expert - Docker & Kubernetes, Open Cloud Solutions | Microsoft Azure Certification - AZ 900, Ranga Karanam | GCP Certification - Google Cloud Engineer & Architect","Learn DevOps: Docker, Kubernetes, Terraform and Azure DevOps","DevOps for Absolute Beginners: Azure DevOps, Docker, Kubernetes, Jenkins, Terraform, Ansible - AWS, Azure & Google Cloud",4.5,15966,All Levels,235 lectures,21.5 total hours,Current price: $139.99
jira,https://www.udemy.com/course/the-complete-devops-bootcamp/,https://img-c.udemycdn.com/course/240x135/4347106_9cfa.jpg,"Mumshad Mannambeth, KodeKloud Training",The Ultimate DevOps Bootcamp,The ultimate DevOps Bootcamp course for all your DevOps learning,4.6,6636,Beginner,281 lectures,17.5 total hours,Current price: $99.99
jira,https://www.udemy.com/course/gcp-google-cloud-professional-devops-engineer-certification/,https://img-c.udemycdn.com/course/240x135/4133780_4390_9.jpg,"Ankit Mistry : 150,000+ Students, GCP Certification - Google Cloud Academy | Associate Cloud & Professional Engineer Certifications",GCP Google Cloud Professional DevOps Engineer Certification,Pass Google Cloud Professional DevOps Certification with 12+ Hours of HD quality video and 70+ Hands-on Practical labs,4.2,2106,All Levels,112 lectures,13.5 total hours,Current price: $79.99
jira,https://www.udemy.com/course/devops-training/,https://img-c.udemycdn.com/course/240x135/1464166_c16e_33.jpg,TechLink Selenium | DevOps | GenAI,DevOps MasterClass: Terraform Kubernetes Ansible Docker,"DevOps with Jenkins Terraform GIT Docker Maven Kubernetes Ansible Automation Docker Swarm, DevOps Real world Exercises",4.5,6619,All Levels,548 lectures,76.5 total hours,Current price: $139.99
jira,https://www.udemy.com/course/devsecops-with-azure-devops/,https://img-c.udemycdn.com/course/240x135/4816326_37f2_2.jpg,"A Security Guru, Raghu The Security Expert",DevSecOps with Azure DevOps: Secure CI/CD with Azure DevOps,"This course helps to implement DevSecOps in Azure DevOps and integrate SAST, SCA & DAST security tools in CI/CD Pipeline",4.5,634,Beginner,40 lectures,3.5 total hours,Current price: $79.99
jira,https://www.udemy.com/course/devopsprojects/,https://img-c.udemycdn.com/course/240x135/3710504_9b6d_9.jpg,Imran Teli,DevOps Projects | Real Time DevOps & GitOps Projects,Master Your DevOps Skills with Real challenge,4.7,3409,Intermediate,218 lectures,33.5 total hours,Current price: $89.99
jira,https://www.udemy.com/course/ultimate-devops-project-with-resume-preparation/,https://img-c.udemycdn.com/course/240x135/6416543_f441_4.jpg,Abhishek Veeramalla,Ultimate DevOps Project Implementation,End to End DevOps Implementation on an E-Commerce project with Resume preparation and Interview Q&A,4.8,1993,Beginner,76 lectures,12 total hours,Current price: $44.99
jira,https://www.udemy.com/course/jira-for-beginners-detailed-course-to-get-started-in-jira-online/,https://img-c.udemycdn.com/course/240x135/4287514_db09_2.jpg,Simon Sez IT,Jira for Beginners - Detailed Course to Get Started in Jira,Learn how to manage projects with Jira for agile teams in this comprehensive beginner course from Simon Sez IT!,4.5,22651,Beginner,89 lectures,8.5 total hours,Current price: $89.99
jira,https://www.udemy.com/course/jira-advanced/,https://img-c.udemycdn.com/course/240x135/4524878_25e4.jpg,"Masha Ostroumova, Agile Apothecary",Jira Advanced 2024 | Manage & Administer Jira Like a Pro,"Become a Jira guru in 2024 | Master advanced settings, tools, and best practices",4.5,3356,Intermediate,39 lectures,7.5 total hours,Current price: $74.99
jira,https://www.udemy.com/course/xray-test-managament-tool-jira-automation/,https://img-c.udemycdn.com/course/240x135/5890254_6818.jpg,Ace Automation Academy,Xray | Test Managament Tool | JIRA | Automation Testing -E2E,"JIRA,Manual+Automation Testing,Selenium,Scrum,Kanban,Agile,Xray,Bitbucket, APIs,Docker,AWS,BDD,Cucumber",4.3,21,All Levels,104 lectures,14 total hours,Current price: $19.99
jira,https://www.udemy.com/course/valaxy-git/,https://img-c.udemycdn.com/course/240x135/3184348_e5db_5.jpg,AR Shankar | Valaxy Technologies,Git and GitHub for DevOps Engineers,DevOps Engineer Roles on Git and GitHub from Creating a Repository to Releasing Code onto Production Environment,4.6,1521,All Levels,54 lectures,6.5 total hours,Current price: $74.99
jira,https://www.udemy.com/course/jira-essentials/,https://img-c.udemycdn.com/course/240x135/4181202_efda_2.jpg,"Masha Ostroumova, Agile Apothecary",Jira Essentials 2024 | Complete Guide for Beginners,"Making Jira your best friend in 2024 | Master setup, issues, filters, boards, and more",4.5,9963,Beginner,27 lectures,4.5 total hours,Current price: $74.99
jira,https://www.udemy.com/course/the-complete-jira-agile-project-management-course/,https://img-c.udemycdn.com/course/240x135/1839552_d891_5.jpg,Danny Liu,The Complete JIRA Agile Project Management Course,Learn how to quickly manage Scrum and Kanban Agile projects using JIRA Software Cloud and more!,4.5,2956,Beginner,48 lectures,2 total hours,Current price: $49.99
