skill,link,image_link,partner,title,course_description,rating,num_review,difficulty,num_lecture,duration,price
systems architecture,https://www.udemy.com/course/software-architecture-design-of-modern-large-scale-systems/,https://img-c.udemycdn.com/course/240x135/3997622_0670_2.jpg,"Michael Pogrebinsky | Software Architecture, System Design, Java Expert, Top Developer Academy LLC",Software Architecture & Design of Modern Large Scale Systems,"Become a Software Architect or Technical Lead by Mastering Software Architecture, System Design & Big Data Processing.",4.7,11311,All Levels,45 lectures,7 total hours,Current price: $109.99
systems architecture,https://www.udemy.com/course/aws-certified-devops-engineer-professional-hands-on/,https://img-c.udemycdn.com/course/240x135/2533568_2828_6.jpg,"Stephane Maarek | AWS Certified Cloud Practitioner,Solutions Architect,Developer",AWS Certified DevOps Engineer Professional 2025 - DOP-C02,Pass the AWS Certified DevOps Engineer Professional Certification (DOP-C02) with 20 hours of advanced videos.,4.7,18041,Intermediate,248 lectures,17 total hours,Current price: $149.99
systems architecture,https://www.udemy.com/course/master-software-architecture-system-design-for-developers/,https://img-c.udemycdn.com/course/240x135/6216121_668f_2.jpg,Munawar Ali,Master Software Architecture & System Design for Developers,"Master System Design, Software Architectures, Microservices Architecture, AWS - To Crack Interviews or become Architect",4.9,26,All Levels,350 lectures,15.5 total hours,Current price: $44.99
systems architecture,https://www.udemy.com/course/software-architecture-system-design-practical-case-studies/,https://img-c.udemycdn.com/course/240x135/4696446_b345_4.jpg,"Michael Pogrebinsky | Software Architecture, System Design, Java Expert, Top Developer Academy LLC",Software Architecture & System Design Practical Case Studies,"Design Real-life Large Scale Systems, Practice Modern Software Architecture & Prepare for a System Design Interview",4.8,1461,All Levels,26 lectures,4 total hours,Current price: $79.99
systems architecture,https://www.udemy.com/course/devops-with-docker-kubernetes-and-azure-devops/,https://img-c.udemycdn.com/course/240x135/2813427_cc60_2.jpg,"in28Minutes Official, Ravi S | DevOps Expert - Docker & Kubernetes, Open Cloud Solutions | Microsoft Azure Certification - AZ 900, Ranga Karanam | GCP Certification - Google Cloud Engineer & Architect","Learn DevOps: Docker, Kubernetes, Terraform and Azure DevOps","DevOps for Absolute Beginners: Azure DevOps, Docker, Kubernetes, Jenkins, Terraform, Ansible - AWS, Azure & Google Cloud",4.5,15966,All Levels,235 lectures,21.5 total hours,Current price: $139.99
systems architecture,https://www.udemy.com/course/aws-certified-devops-engineer-professional-practice-exam-dop/,https://img-c.udemycdn.com/course/240x135/2567118_611e_8.jpg,"Stephane Maarek | AWS Certified Cloud Practitioner,Solutions Architect,Developer, Abhishek Singh",Practice Exams | AWS Certified DevOps Engineer Professional,AWS Certified DevOps: 120 high fidelity questions: AWS Certified DevOps Engineer Professional DOP-C02.,4.4,2568,All Levels,120 questions,,Current price: $59.99
systems architecture,https://www.udemy.com/course/decodingdevops/,https://img-c.udemycdn.com/course/240x135/4039556_ebb3_9.jpg,Imran Teli,DevOps Beginners to Advanced with Projects,"Begin Your DevOps Career As a Newbie | AWS, Linux, Scripting, Jenkins, Ansible, GitOps, Docker, Kubernetes, & Terraform.",4.6,36463,All Levels,318 lectures,53 total hours,Current price: $119.99
systems architecture,https://www.udemy.com/course/the-complete-devops-bootcamp/,https://img-c.udemycdn.com/course/240x135/4347106_9cfa.jpg,"Mumshad Mannambeth, KodeKloud Training",The Ultimate DevOps Bootcamp,The ultimate DevOps Bootcamp course for all your DevOps learning,4.6,6636,Beginner,281 lectures,17.5 total hours,Current price: $99.99
systems architecture,https://www.udemy.com/course/gcp-google-cloud-professional-devops-engineer-certification/,https://img-c.udemycdn.com/course/240x135/4133780_4390_9.jpg,"Ankit Mistry : 150,000+ Students, GCP Certification - Google Cloud Academy | Associate Cloud & Professional Engineer Certifications",GCP Google Cloud Professional DevOps Engineer Certification,Pass Google Cloud Professional DevOps Certification with 12+ Hours of HD quality video and 70+ Hands-on Practical labs,4.2,2106,All Levels,112 lectures,13.5 total hours,Current price: $79.99
systems architecture,https://www.udemy.com/course/the-ultimate-linux-bootcamp-for-devops-sre-cloud-engineers/,https://img-c.udemycdn.com/course/240x135/6458119_5e4d_2.jpg,"Yogesh Raheja, Thinknyx Technologies",The Ultimate Linux Bootcamp for DevOps SRE & Cloud Engineers,"Unlock your potential in Linux Administration with expert-led lectures, interactive demonstrations, and practice tests",4.9,21,All Levels,113 lectures,14 total hours,Current price: $44.99
systems architecture,https://www.udemy.com/course/the-complete-microservices-event-driven-architecture/,https://img-c.udemycdn.com/course/240x135/5283706_8f89.jpg,"Michael Pogrebinsky | Software Architecture, System Design, Java Expert, Top Developer Academy LLC",The Complete Microservices & Event-Driven Architecture,Master Modern Software Architecture. Design Highly Scalable Systems using Microservices & Event-Driven Architecture,4.8,2474,All Levels,33 lectures,5.5 total hours,Current price: $84.99
systems architecture,https://www.udemy.com/course/developer-to-architect/,https://img-c.udemycdn.com/course/240x135/3768806_69be_7.jpg,NewTechWays - Anurag Yadav,Software Architecture & Technology of Large-Scale Systems,"Learn Architecting Software Systems with High Performance, Scalability, Availability, Security using Modern Technologies",4.5,6864,Intermediate,256 lectures,25.5 total hours,Current price: $124.99
systems architecture,https://www.udemy.com/course/the-complete-cloud-computing-software-architecture-patterns/,https://img-c.udemycdn.com/course/240x135/4472674_020e_2.jpg,"Michael Pogrebinsky | Software Architecture, System Design, Java Expert, Top Developer Academy LLC",The Complete Cloud Computing Software Architecture Patterns,"Architect Large Scale Systems using Cloud Computing, Software Architecture Patterns & Modern System Design Principles",4.7,2216,All Levels,26 lectures,4.5 total hours,Current price: $84.99
systems architecture,https://www.udemy.com/course/ultimate-devops-project-with-resume-preparation/,https://img-c.udemycdn.com/course/240x135/6416543_f441_4.jpg,Abhishek Veeramalla,Ultimate DevOps Project Implementation,End to End DevOps Implementation on an E-Commerce project with Resume preparation and Interview Q&A,4.8,1993,Beginner,76 lectures,12 total hours,Current price: $44.99
systems architecture,https://www.udemy.com/course/it-system-engineer-cloud-system-administrator/,https://img-c.udemycdn.com/course/240x135/5049178_e19c.jpg,Kelvin Johnson,IT System Engineer & Cloud System Administration,"Learn Active Directory, Microsoft Intune, Group Policy, DNS,  Azure AD, Microsoft 365, Storage, Backup, WSUS and Azure",4.3,424,Intermediate,102 lectures,7 total hours,Current price: $54.99
systems architecture,https://www.udemy.com/course/software-architecture-system-design-practice-tests/,https://img-c.udemycdn.com/course/240x135/5318020_fc5c_2.jpg,"Michael Pogrebinsky | Software Architecture, System Design, Java Expert, Top Developer Academy LLC",Software Architecture & System Design - Practice Tests,"Prepare for a System Design Interview. Practice Software Architecture, API Design, Microservices & Big Data Processing",4.7,98,Intermediate,110 questions,,Current price: $69.99
systems architecture,https://www.udemy.com/course/linux-for-cloud-engineers-a-complete-project-based-learning/,https://img-c.udemycdn.com/course/240x135/5403140_ce56_12.jpg,Pravin Mishra | AWS Certified Cloud Practitioner | Solutions Architect,"Linux for DevOps, Cloud, and SRE Engineers","Master Linux fundamentals, shell scripting, process management & networking for DevOps, Cloud, and SRE Engineers",4.4,401,Beginner,26 lectures,5.5 total hours,Current price: $59.99
systems architecture,https://www.udemy.com/course/valaxy-linux/,https://img-c.udemycdn.com/course/240x135/3184362_4102_12.jpg,AR Shankar | Valaxy Technologies,Linux for Cloud & DevOps Engineers,"Linux basics about files, directories, installations, networking, system configuration, user management etc...",4.5,3918,Beginner,43 lectures,4.5 total hours,Current price: $74.99
systems architecture,https://www.udemy.com/course/data-mesh-demystified/,https://img-c.udemycdn.com/course/240x135/6236811_f1f4_2.jpg,Manas Jain,Data Mesh Architecture For Data Engineers,"Data Mesh Architecture for Data Engineers: Building Scalable, Decentralized Data Architectures for Modern Organizations",4.5,60,All Levels,30 lectures,2 total hours,Current price: $54.99
systems architecture,https://www.udemy.com/course/implementing-software-architecture/,https://img-c.udemycdn.com/course/240x135/4248486_f030_4.jpg,NewTechWays - Anurag Yadav,Implementing Software Architecture of a Large-Scale System,A hands-on approach to Software Solution Architecture of large-scale systems using modern methods & open source products,4.6,562,Intermediate,83 lectures,11.5 total hours,Current price: $79.99
