skill,link,image_link,partner,title,course_description,rating,num_review,difficulty,num_lecture,duration,price
infrastructure as code,https://www.udemy.com/course/aws-certified-devops-engineer-professional-hands-on/,https://img-c.udemycdn.com/course/240x135/2533568_2828_6.jpg,"Stephane Maarek | AWS Certified Cloud Practitioner,Solutions Architect,Developer",AWS Certified DevOps Engineer Professional 2025 - DOP-C02,Pass the AWS Certified DevOps Engineer Professional Certification (DOP-C02) with 20 hours of advanced videos.,4.7,18041,Intermediate,248 lectures,17 total hours,Current price: $149.99
infrastructure as code,https://www.udemy.com/course/aws-certified-devops-engineer-professional-practice-exams-amazon-dop-c02/,https://img-c.udemycdn.com/course/240x135/2644002_eff2_6.jpg,"Jon Bonso AWS Certified Cloud Practitioner, Developer, Solutions Architect, Tutorials Dojo | AWS Certified Cloud Practitioner, AWS Certified Solutions Architect, AWS Certified Developer, Amiel Palacol AWS Certified Solutions Architect, DevOps Engineer Professional",AWS Certified DevOps Engineer Professional Practice Exams,Be an AWS DevOps Engineer! AWS Certified DevOps Engineer Professional Practice Tests that covers all DOP-C02 topics!,4.5,1285,Intermediate,150 questions,,Current price: $59.99
infrastructure as code,https://www.udemy.com/course/aws-certified-devops-engineer-professional-practice-exam-dop/,https://img-c.udemycdn.com/course/240x135/2567118_611e_8.jpg,"Stephane Maarek | AWS Certified Cloud Practitioner,Solutions Architect,Developer, Abhishek Singh",Practice Exams | AWS Certified DevOps Engineer Professional,AWS Certified DevOps: 120 high fidelity questions: AWS Certified DevOps Engineer Professional DOP-C02.,4.4,2568,All Levels,120 questions,,Current price: $59.99
infrastructure as code,https://www.udemy.com/course/gcp-google-cloud-professional-devops-engineer-certification/,https://img-c.udemycdn.com/course/240x135/4133780_4390_9.jpg,"Ankit Mistry : 150,000+ Students, GCP Certification - Google Cloud Academy | Associate Cloud & Professional Engineer Certifications",GCP Google Cloud Professional DevOps Engineer Certification,Pass Google Cloud Professional DevOps Certification with 12+ Hours of HD quality video and 70+ Hands-on Practical labs,4.2,2106,All Levels,112 lectures,13.5 total hours,Current price: $79.99
infrastructure as code,https://www.udemy.com/course/infrastructure-as-code-beginners/,https://img-c.udemycdn.com/course/240x135/4725274_66a1_4.jpg,Rifat Erdem Sahin,Complete Infrastructure As Code For Beginners to Advanced,Hero to Zero / Behind The Scenes,4.2,29,Beginner,95 lectures,8 total hours,Current price: $59.99
infrastructure as code,https://www.udemy.com/course/decodingdevops/,https://img-c.udemycdn.com/course/240x135/4039556_ebb3_9.jpg,Imran Teli,DevOps Beginners to Advanced with Projects,"Begin Your DevOps Career As a Newbie | AWS, Linux, Scripting, Jenkins, Ansible, GitOps, Docker, Kubernetes, & Terraform.",4.6,36463,All Levels,318 lectures,53 total hours,Current price: $119.99
infrastructure as code,https://www.udemy.com/course/devops-with-docker-kubernetes-and-azure-devops/,https://img-c.udemycdn.com/course/240x135/2813427_cc60_2.jpg,"in28Minutes Official, Ravi S | DevOps Expert - Docker & Kubernetes, Open Cloud Solutions | Microsoft Azure Certification - AZ 900, Ranga Karanam | GCP Certification - Google Cloud Engineer & Architect","Learn DevOps: Docker, Kubernetes, Terraform and Azure DevOps","DevOps for Absolute Beginners: Azure DevOps, Docker, Kubernetes, Jenkins, Terraform, Ansible - AWS, Azure & Google Cloud",4.5,15966,All Levels,235 lectures,21.5 total hours,Current price: $139.99
infrastructure as code,https://www.udemy.com/course/google-certified-architect-developer-engineer-data-devops/,https://img-c.udemycdn.com/course/240x135/2459706_d13a_6.jpg,"Google Cloud Experts Cloud Architect, Google Cloud Platform Gurus !",Google Cloud Certifications: All in one Bundle,"430k Subs -Digital Leader, Cloud Engineer, Machine Learning, Architect, Developer, DevOps Engineer, Security Engineer",4.4,3628,All Levels,642 lectures,67.5 total hours,Current price: $69.99
infrastructure as code,https://www.udemy.com/course/aws-certified-devops-engineer-professional-complete-guide/,https://img-c.udemycdn.com/course/240x135/6303665_f861.jpg,Deepak Dubey,AWS Certified DevOps Engineer Professional - Complete Guide,"Master CI/CD pipelines, Infrastructure as Code, monitoring, and IT automation for AWS DevOps Certification Exam",4.4,34,Intermediate,155 lectures,41.5 total hours,Current price: $49.99
infrastructure as code,https://www.udemy.com/course/the-complete-devops-bootcamp/,https://img-c.udemycdn.com/course/240x135/4347106_9cfa.jpg,"Mumshad Mannambeth, KodeKloud Training",The Ultimate DevOps Bootcamp,The ultimate DevOps Bootcamp course for all your DevOps learning,4.6,6636,Beginner,281 lectures,17.5 total hours,Current price: $99.99
infrastructure as code,https://www.udemy.com/course/devops-training/,https://img-c.udemycdn.com/course/240x135/1464166_c16e_33.jpg,TechLink Selenium | DevOps | GenAI,DevOps MasterClass: Terraform Kubernetes Ansible Docker,"DevOps with Jenkins Terraform GIT Docker Maven Kubernetes Ansible Automation Docker Swarm, DevOps Real world Exercises",4.5,6619,All Levels,548 lectures,76.5 total hours,Current price: $139.99
infrastructure as code,https://www.udemy.com/course/introduction-devops/,https://img-c.udemycdn.com/course/240x135/5236958_2efa_2.jpg,Imran Afzal,Introduction to DevOps: Roadmap to DevOps Career,"DevOps course for someone who wants to learn Jenkins​,​ Jira, Dockers, Kubernetes, Nagios, Ansible, Terraform, and more",4.5,513,All Levels,55 lectures,7.5 total hours,Current price: $79.99
infrastructure as code,https://www.udemy.com/course/valaxy-git/,https://img-c.udemycdn.com/course/240x135/3184348_e5db_5.jpg,AR Shankar | Valaxy Technologies,Git and GitHub for DevOps Engineers,DevOps Engineer Roles on Git and GitHub from Creating a Repository to Releasing Code onto Production Environment,4.6,1521,All Levels,54 lectures,6.5 total hours,Current price: $74.99
infrastructure as code,https://www.udemy.com/course/devopsprojects/,https://img-c.udemycdn.com/course/240x135/3710504_9b6d_9.jpg,Imran Teli,DevOps Projects | Real Time DevOps & GitOps Projects,Master Your DevOps Skills with Real challenge,4.7,3409,Intermediate,218 lectures,33.5 total hours,Current price: $89.99
infrastructure as code,https://www.udemy.com/course/platform-engineering/,https://img-c.udemycdn.com/course/240x135/6179403_d435_4.jpg,Uplatz Training,Platform Engineering: Build Scalable & Resilient Systems,"Learn DevOps, Infrastructure as Code, CI/CD, Kubernetes, more. Prepare for a successful career in platform engineering!",3.2,14,All Levels,43 lectures,40 total hours,Current price: $64.99
infrastructure as code,https://www.udemy.com/course/learn-devops-infrastructure-automation-with-terraform/,https://img-c.udemycdn.com/course/240x135/977360_8585_5.jpg,Edward Viaene,AWS Infrastructure as Code With Terraform [2024 Updates],"Terraform, a popular infrastructure automation tool for DevOps. Terraform with AWS, Packer, Docker, ECS, EKS, Jenkins",4.4,15689,Beginner,116 lectures,12.5 total hours,Current price: $99.99
infrastructure as code,https://www.udemy.com/course/azure-devops-and-continuous-delivery-with-git/,https://img-c.udemycdn.com/course/240x135/3817678_7781_2.jpg,Trevoir Williams,Azure DevOps and Continuous Delivery With Git,Azure DevOps | CI/CD | Git | Branching and merging | Agile Development | Pipelines | Infrastructure as code | Automation,4.6,693,All Levels,55 lectures,4.5 total hours,Current price: $69.99
infrastructure as code,https://www.udemy.com/course/azure-devops-iac-with-bicep-yaml-git-and-powershell/,https://img-c.udemycdn.com/course/240x135/5009656_1ac6.jpg,David Charles Academy,Azure Bicep & DevOps for Infra as Code: Beginner to Ninja,"Learn how to professionally write and develop Azure DevOps Infrastructure as Code with BICEP, YAML, Git and PowerShell",4.2,318,Beginner,84 lectures,7 total hours,Current price: $69.99
infrastructure as code,https://www.udemy.com/course/infrastructure-automation-with-opentofu-hands-on-devops/,https://img-c.udemycdn.com/course/240x135/5859846_9386_3.jpg,"Yogesh Raheja, Thinknyx Technologies, Deepthi Narayan",Infrastructure Automation with OpenTofu – Hands-On DevOps,"Learn Infrastructure  Provisioning using OpenTofu with lectures, quizzes, hands-on demos and coding exercises",4.5,26,All Levels,94 lectures,7.5 total hours,Current price: $74.99
infrastructure as code,https://www.udemy.com/course/ultimate-devops-project-with-resume-preparation/,https://img-c.udemycdn.com/course/240x135/6416543_f441_4.jpg,Abhishek Veeramalla,Ultimate DevOps Project Implementation,End to End DevOps Implementation on an E-Commerce project with Resume preparation and Interview Q&A,4.8,1993,Beginner,76 lectures,12 total hours,Current price: $44.99
