skill,link,image_link,partner,title,course_description,rating,num_review,difficulty,num_lecture,duration,price
spring,https://www.udemy.com/course/spring-core-devops-on-aws/,https://img-c.udemycdn.com/course/240x135/863812_399a_3.jpg,"John Thompson • 500,000+ Enrollments Worldwide, Spring Ahead Code Academy",Spring Framework DevOps on AWS,Deploy Spring Boot Applications to the Cloud on AWS,4.4,883,Intermediate,82 lectures,7 total hours,Current price: $64.99
spring,https://www.udemy.com/course/aws-certified-devops-engineer-professional-practice-exams-amazon-dop-c02/,https://img-c.udemycdn.com/course/240x135/2644002_eff2_6.jpg,"Jon Bonso AWS Certified Cloud Practitioner, Developer, Solutions Architect, Tutorials Dojo | AWS Certified Cloud Practitioner, AWS Certified Solutions Architect, AWS Certified Developer, Amiel Palacol AWS Certified Solutions Architect, DevOps Engineer Professional",AWS Certified DevOps Engineer Professional Practice Exams,Be an AWS DevOps Engineer! AWS Certified DevOps Engineer Professional Practice Tests that covers all DOP-C02 topics!,4.5,1285,Intermediate,150 questions,,Current price: $59.99
spring,https://www.udemy.com/course/aws-certified-devops-engineer-professional-hands-on/,https://img-c.udemycdn.com/course/240x135/2533568_2828_6.jpg,"Stephane Maarek | AWS Certified Cloud Practitioner,Solutions Architect,Developer",AWS Certified DevOps Engineer Professional 2025 - DOP-C02,Pass the AWS Certified DevOps Engineer Professional Certification (DOP-C02) with 20 hours of advanced videos.,4.7,18041,Intermediate,248 lectures,17 total hours,Current price: $149.99
spring,https://www.udemy.com/course/aws-certified-devops-engineer-professional-practice-exam-dop/,https://img-c.udemycdn.com/course/240x135/2567118_611e_8.jpg,"Stephane Maarek | AWS Certified Cloud Practitioner,Solutions Architect,Developer, Abhishek Singh",Practice Exams | AWS Certified DevOps Engineer Professional,AWS Certified DevOps: 120 high fidelity questions: AWS Certified DevOps Engineer Professional DOP-C02.,4.4,2568,All Levels,120 questions,,Current price: $59.99
spring,https://www.udemy.com/course/docker-course-with-java-and-spring-boot-for-beginners/,https://img-c.udemycdn.com/course/240x135/2582160_7f71_5.jpg,in28Minutes Official,Docker for Beginners: DevOps for Java & Spring Boot,Docker for Beginners. DevOps for Java Spring Boot Microservices. Get Hands-on with Docker.,4.3,3278,All Levels,63 lectures,6.5 total hours,Current price: $74.99
spring,https://www.udemy.com/course/gcp-google-cloud-professional-devops-engineer-certification/,https://img-c.udemycdn.com/course/240x135/4133780_4390_9.jpg,"Ankit Mistry : 150,000+ Students, GCP Certification - Google Cloud Academy | Associate Cloud & Professional Engineer Certifications",GCP Google Cloud Professional DevOps Engineer Certification,Pass Google Cloud Professional DevOps Certification with 12+ Hours of HD quality video and 70+ Hands-on Practical labs,4.2,2106,All Levels,112 lectures,13.5 total hours,Current price: $79.99
spring,https://www.udemy.com/course/decodingdevops/,https://img-c.udemycdn.com/course/240x135/4039556_ebb3_9.jpg,Imran Teli,DevOps Beginners to Advanced with Projects,"Begin Your DevOps Career As a Newbie | AWS, Linux, Scripting, Jenkins, Ansible, GitOps, Docker, Kubernetes, & Terraform.",4.6,36463,All Levels,318 lectures,53 total hours,Current price: $119.99
spring,https://www.udemy.com/course/spring-framework-6-beginner-to-guru/,https://img-c.udemycdn.com/course/240x135/4522192_d71d.jpg,"John Thompson • 500,000+ Enrollments Worldwide","[NEW] Spring Boot 3, Spring Framework 6: Beginner to Guru","Spring 6, Spring Boot 3, Spring MVC, JPA/Hibernate, Mongo, Spring Security, OAuth2 JWT, MySQL, Docker/K8s, Microservices",4.5,2275,All Levels,563 lectures,47.5 total hours,Current price: $84.99
spring,https://www.udemy.com/course/spring-hibernate-tutorial/,https://img-c.udemycdn.com/course/240x135/647428_be28_10.jpg,Chad Darby,"[NEW] Spring Boot 3, Spring 6 & Hibernate for Beginners","Spring Boot 3: Learn Spring 6, Spring Core, Spring REST, Spring MVC, Spring Security, Thymeleaf, JPA, Hibernate, MySQL",4.6,88557,All Levels,403 lectures,34.5 total hours,Current price: $109.99
spring,https://www.udemy.com/course/the-complete-devops-bootcamp/,https://img-c.udemycdn.com/course/240x135/4347106_9cfa.jpg,"Mumshad Mannambeth, KodeKloud Training",The Ultimate DevOps Bootcamp,The ultimate DevOps Bootcamp course for all your DevOps learning,4.6,6636,Beginner,281 lectures,17.5 total hours,Current price: $99.99
spring,https://www.udemy.com/course/devops-with-docker-kubernetes-and-azure-devops/,https://img-c.udemycdn.com/course/240x135/2813427_cc60_2.jpg,"in28Minutes Official, Ravi S | DevOps Expert - Docker & Kubernetes, Open Cloud Solutions | Microsoft Azure Certification - AZ 900, Ranga Karanam | GCP Certification - Google Cloud Engineer & Architect","Learn DevOps: Docker, Kubernetes, Terraform and Azure DevOps","DevOps for Absolute Beginners: Azure DevOps, Docker, Kubernetes, Jenkins, Terraform, Ansible - AWS, Azure & Google Cloud",4.5,15966,All Levels,235 lectures,21.5 total hours,Current price: $139.99
spring,https://www.udemy.com/course/microservices-with-spring-boot-and-spring-cloud/,https://img-c.udemycdn.com/course/240x135/1352468_3d97_8.jpg,in28Minutes Official,Master Microservices with Spring Boot and Spring Cloud,"Java Spring Boot Microservices 5-in-1 - Spring Boot, Spring Cloud, Docker, Kubernetes and REST API (REST Web Services)",4.6,55658,All Levels,326 lectures,25.5 total hours,Current price: $139.99
spring,https://www.udemy.com/course/devops-training/,https://img-c.udemycdn.com/course/240x135/1464166_c16e_33.jpg,TechLink Selenium | DevOps | GenAI,DevOps MasterClass: Terraform Kubernetes Ansible Docker,"DevOps with Jenkins Terraform GIT Docker Maven Kubernetes Ansible Automation Docker Swarm, DevOps Real world Exercises",4.5,6619,All Levels,548 lectures,76.5 total hours,Current price: $139.99
spring,https://www.udemy.com/course/spring-boot-and-spring-framework-tutorial-for-beginners/,https://img-c.udemycdn.com/course/240x135/4993276_3452.jpg,in28Minutes Official,[NEW] Master Spring Boot 3 & Spring Framework 6 with Java,"Become Java Spring Boot Full Stack Developer. Learn Spring Framework, Spring Boot, Spring Data, Docker & AWS",4.6,9808,All Levels,423 lectures,39 total hours,Current price: $99.99
spring,https://www.udemy.com/course/spring-boot-for-software-engineers/,https://img-c.udemycdn.com/course/240x135/1418878_58b5_2.jpg,Nelson Jamal,Spring Boot For Software Engineers,Build enterprise restful API's,4.7,1259,,Expert,6.5 total hours,Current price: $59.99
spring,https://www.udemy.com/course/spring-5-with-spring-boot-2/,https://img-c.udemycdn.com/course/240x135/2167814_a0e6_5.jpg,"Navin Reddy, Telusko",Java Spring Framework 6 with Spring Boot 3,"Master Java, Spring 6 and Spring Boot 3 with JDBC, JPA, Security, Docker and Microservices with Telusko",4.6,27979,All Levels,427 lectures,48.5 total hours,Current price: $109.99
spring,https://www.udemy.com/course/spring-boot-using-intellij-build-a-real-world-project/,https://img-c.udemycdn.com/course/240x135/4298517_aa5d_3.jpg,"Faisal Memon (EmbarkX), EmbarkX Official",Java Spring Boot: Professional eCommerce Project Masterclass,"Spring Framework + Spring Boot Full Stack: eCommerce REST API, Spring Data JPA, Spring Security 6, JWT, Deploy on AWS",4.6,1374,All Levels,635 lectures,89 total hours,Current price: $74.99
spring,https://www.udemy.com/course/spring-professional-certification-6-full-tests-2v0-7222-a/,https://img-c.udemycdn.com/course/240x135/5247636_9027_4.jpg,Vincent VAUBAN,Spring Professional Certification - 6 full Tests (2V0-72.22),NEW SPRING Certification prep with 360 questions/answers from the best of Spring Certified Professional  -- 2024 Edition,4.7,167,All Levels,350 questions,,Current price: $44.99
spring,https://www.udemy.com/course/devsecops-with-azure-devops/,https://img-c.udemycdn.com/course/240x135/4816326_37f2_2.jpg,"A Security Guru, Raghu The Security Expert",DevSecOps with Azure DevOps: Secure CI/CD with Azure DevOps,"This course helps to implement DevSecOps in Azure DevOps and integrate SAST, SCA & DAST security tools in CI/CD Pipeline",4.5,634,Beginner,40 lectures,3.5 total hours,Current price: $79.99
spring,https://www.udemy.com/course/valaxy-git/,https://img-c.udemycdn.com/course/240x135/3184348_e5db_5.jpg,AR Shankar | Valaxy Technologies,Git and GitHub for DevOps Engineers,DevOps Engineer Roles on Git and GitHub from Creating a Repository to Releasing Code onto Production Environment,4.6,1521,All Levels,54 lectures,6.5 total hours,Current price: $74.99
