skill,link,image_link,partner,title,course_description,rating,num_review,difficulty,num_lecture,duration,price
linux/unix,https://www.udemy.com/course/valaxy-linux/,https://img-c.udemycdn.com/course/240x135/3184362_4102_12.jpg,AR Shankar | Valaxy Technologies,Linux for Cloud & DevOps Engineers,"Linux basics about files, directories, installations, networking, system configuration, user management etc...",4.5,3918,Beginner,43 lectures,4.5 total hours,Current price: $74.99
linux/unix,https://www.udemy.com/course/the-ultimate-linux-bootcamp-for-devops-sre-cloud-engineers/,https://img-c.udemycdn.com/course/240x135/6458119_5e4d_2.jpg,"Yogesh Raheja, Thinknyx Technologies",The Ultimate Linux Bootcamp for DevOps SRE & Cloud Engineers,"Unlock your potential in Linux Administration with expert-led lectures, interactive demonstrations, and practice tests",4.9,21,All Levels,113 lectures,14 total hours,Current price: $44.99
linux/unix,https://www.udemy.com/course/linux-for-cloud-engineers-a-complete-project-based-learning/,https://img-c.udemycdn.com/course/240x135/5403140_ce56_12.jpg,Pravin Mishra | AWS Certified Cloud Practitioner | Solutions Architect,"Linux for DevOps, Cloud, and SRE Engineers","Master Linux fundamentals, shell scripting, process management & networking for DevOps, Cloud, and SRE Engineers",4.4,401,Beginner,26 lectures,5.5 total hours,Current price: $59.99
linux/unix,https://www.udemy.com/course/decodingdevops/,https://img-c.udemycdn.com/course/240x135/4039556_ebb3_9.jpg,Imran Teli,DevOps Beginners to Advanced with Projects,"Begin Your DevOps Career As a Newbie | AWS, Linux, Scripting, Jenkins, Ansible, GitOps, Docker, Kubernetes, & Terraform.",4.6,36463,All Levels,318 lectures,53 total hours,Current price: $119.99
linux/unix,https://www.udemy.com/course/aws-certified-devops-engineer-professional-hands-on/,https://img-c.udemycdn.com/course/240x135/2533568_2828_6.jpg,"Stephane Maarek | AWS Certified Cloud Practitioner,Solutions Architect,Developer",AWS Certified DevOps Engineer Professional 2025 - DOP-C02,Pass the AWS Certified DevOps Engineer Professional Certification (DOP-C02) with 20 hours of advanced videos.,4.7,18041,Intermediate,248 lectures,17 total hours,Current price: $149.99
linux/unix,https://www.udemy.com/course/aws-certified-devops-engineer-professional-practice-exam-dop/,https://img-c.udemycdn.com/course/240x135/2567118_611e_8.jpg,"Stephane Maarek | AWS Certified Cloud Practitioner,Solutions Architect,Developer, Abhishek Singh",Practice Exams | AWS Certified DevOps Engineer Professional,AWS Certified DevOps: 120 high fidelity questions: AWS Certified DevOps Engineer Professional DOP-C02.,4.4,2568,All Levels,120 questions,,Current price: $59.99
linux/unix,https://www.udemy.com/course/the-complete-devops-bootcamp/,https://img-c.udemycdn.com/course/240x135/4347106_9cfa.jpg,"Mumshad Mannambeth, KodeKloud Training",The Ultimate DevOps Bootcamp,The ultimate DevOps Bootcamp course for all your DevOps learning,4.6,6636,Beginner,281 lectures,17.5 total hours,Current price: $99.99
linux/unix,https://www.udemy.com/course/gcp-google-cloud-professional-devops-engineer-certification/,https://img-c.udemycdn.com/course/240x135/4133780_4390_9.jpg,"Ankit Mistry : 150,000+ Students, GCP Certification - Google Cloud Academy | Associate Cloud & Professional Engineer Certifications",GCP Google Cloud Professional DevOps Engineer Certification,Pass Google Cloud Professional DevOps Certification with 12+ Hours of HD quality video and 70+ Hands-on Practical labs,4.2,2106,All Levels,112 lectures,13.5 total hours,Current price: $79.99
linux/unix,https://www.udemy.com/course/init6-linux/,https://img-c.udemycdn.com/course/240x135/5037268_ebf5_5.jpg,Praveen Kumar,"Linux for Devops, Cloud Engineers and Developers","Get the linux skills like user management, networking, wild card, redirection software management, services etc",4.5,40,Intermediate,55 lectures,8 total hours,Current price: $54.99
linux/unix,https://www.udemy.com/course/devops-with-docker-kubernetes-and-azure-devops/,https://img-c.udemycdn.com/course/240x135/2813427_cc60_2.jpg,"in28Minutes Official, Ravi S | DevOps Expert - Docker & Kubernetes, Open Cloud Solutions | Microsoft Azure Certification - AZ 900, Ranga Karanam | GCP Certification - Google Cloud Engineer & Architect","Learn DevOps: Docker, Kubernetes, Terraform and Azure DevOps","DevOps for Absolute Beginners: Azure DevOps, Docker, Kubernetes, Jenkins, Terraform, Ansible - AWS, Azure & Google Cloud",4.5,15966,All Levels,235 lectures,21.5 total hours,Current price: $139.99
linux/unix,https://www.udemy.com/course/linux-for-developers/,https://img-c.udemycdn.com/course/240x135/5781840_fd42.jpg,Frank Anemaet,Linux for Devops Engineers and Developers,Guide to Getting Started,4.0,126,Beginner,14 lectures,,Current price: $19.99
linux/unix,https://www.udemy.com/course/linux-commands-for-devops-ci-cd/,https://img-c.udemycdn.com/course/240x135/5040932_5f8a.jpg,Valentin Despa,Introduction to LINUX® Commands for DevOps,"Master Linux Basics: Commands, Filesystems, Shell Tools, and Networking for CI/CD and DevOps Beginners",4.8,35,Beginner,53 lectures,4 total hours,Current price: $74.99
linux/unix,https://www.udemy.com/course/complete-linux-training-course-to-get-your-dream-it-job/,https://img-c.udemycdn.com/course/240x135/1523066_334c_15.jpg,Imran Afzal,Complete Linux Training Course to Get Your Dream IT Job 2025,"The BEST Linux Administration course for corporate jobs and RHCSA, RHCE, LFCS, LPIC and CompTIA Linux+ certifications",4.7,40279,All Levels,283 lectures,41 total hours,Current price: $139.99
linux/unix,https://www.udemy.com/course/devopsprojects/,https://img-c.udemycdn.com/course/240x135/3710504_9b6d_9.jpg,Imran Teli,DevOps Projects | Real Time DevOps & GitOps Projects,Master Your DevOps Skills with Real challenge,4.7,3409,Intermediate,218 lectures,33.5 total hours,Current price: $89.99
linux/unix,https://www.udemy.com/course/linux-for-cloud-devops-engineers-hands-on/,https://img-c.udemycdn.com/course/240x135/4327172_1e3d.jpg,Shikhar Verma☆100K+ Students Globally,Linux for Cloud & DevOps Engineers - Hands-on!!,Linux for Beginners to learn Cloud and DevOps Technologies,4.1,25,Beginner,83 lectures,8 total hours,Current price: $49.99
linux/unix,https://www.udemy.com/course/master-linux-admin-for-devops-sre-become-job-ready/,https://img-c.udemycdn.com/course/240x135/6505035_fdb4_2.jpg,Abe Bazouie,Master Linux Admin for DevOps & SRE: Become Job-Ready,"Master Linux Admin for DevOps & SRE (2025) | Hands-On System Administration, Bash Scripting & Networking",4.7,5,All Levels,130 lectures,25.5 total hours,Current price: $44.99
linux/unix,https://www.udemy.com/course/ultimate-devops-project-with-resume-preparation/,https://img-c.udemycdn.com/course/240x135/6416543_f441_4.jpg,Abhishek Veeramalla,Ultimate DevOps Project Implementation,End to End DevOps Implementation on an E-Commerce project with Resume preparation and Interview Q&A,4.8,1993,Beginner,76 lectures,12 total hours,Current price: $44.99
linux/unix,https://www.udemy.com/course/azure100/,https://img-c.udemycdn.com/course/240x135/3492150_ec37.jpg,Alan Rodrigues,AZ-400 Designing and Implementing DevOps Certification,Pass your AZ-400 DevOps Exam,4.6,11583,Intermediate,258 lectures,21 total hours,Current price: $119.99
linux/unix,https://www.udemy.com/course/essential-unix-skills-for-developers/,https://img-c.udemycdn.com/course/240x135/4925270_afc6_6.jpg,Terry Martin,Essential Unix Skills for Developers,"Harness the powerful Unix command line within Linux, MacOS & other OSs to take your developer skills to the next level",4.6,628,Beginner,76 lectures,18 total hours,Current price: $79.99
linux/unix,https://www.udemy.com/course/azure-devops-for-beginners/,https://img-c.udemycdn.com/course/240x135/2591908_30cf_11.jpg,Brian Culp,Azure DevOps Fundamentals for Beginners,"Learn How to Plan, Manage, and Deploy Your Very First Azure DevOps Application Through Hands-On Demos and Use Cases!",4.5,43498,Intermediate,45 lectures,3.5 total hours,Current price: $119.99
