skill,link,image_link,partner,title,course_description,rating,num_review,difficulty,num_lecture,duration,price
product development,https://www.udemy.com/course/aws-certified-devops-engineer-professional-hands-on/,https://img-c.udemycdn.com/course/240x135/2533568_2828_6.jpg,"Stephane Maarek | AWS Certified Cloud Practitioner,Solutions Architect,Developer",AWS Certified DevOps Engineer Professional 2025 - DOP-C02,Pass the AWS Certified DevOps Engineer Professional Certification (DOP-C02) with 20 hours of advanced videos.,4.7,18041,Intermediate,248 lectures,17 total hours,Current price: $149.99
product development,https://www.udemy.com/course/decodingdevops/,https://img-c.udemycdn.com/course/240x135/4039556_ebb3_9.jpg,Imran Teli,DevOps Beginners to Advanced with Projects,"Begin Your DevOps Career As a Newbie | AWS, Linux, Scripting, Jenkins, Ansible, GitOps, Docker, Kubernetes, & Terraform.",4.6,36463,All Levels,318 lectures,53 total hours,Current price: $119.99
product development,https://www.udemy.com/course/learnse_product_development_systems_engineering/,https://img-c.udemycdn.com/course/240x135/3196352_17c6_4.jpg,Christopher Olson,Product Development & Systems Engineering (INCOSE / 15288),The complete Product Development and Systems Engineering course! Earn 25 contact hours!,4.6,5125,All Levels,102 lectures,25 total hours,Current price: $89.99
product development,https://www.udemy.com/course/ultimate-devops-project-with-resume-preparation/,https://img-c.udemycdn.com/course/240x135/6416543_f441_4.jpg,Abhishek Veeramalla,Ultimate DevOps Project Implementation,End to End DevOps Implementation on an E-Commerce project with Resume preparation and Interview Q&A,4.8,1993,Beginner,76 lectures,12 total hours,Current price: $44.99
product development,https://www.udemy.com/course/the-complete-devops-bootcamp/,https://img-c.udemycdn.com/course/240x135/4347106_9cfa.jpg,"Mumshad Mannambeth, KodeKloud Training",The Ultimate DevOps Bootcamp,The ultimate DevOps Bootcamp course for all your DevOps learning,4.6,6636,Beginner,281 lectures,17.5 total hours,Current price: $99.99
product development,https://www.udemy.com/course/aws-certified-devops-engineer-professional-practice-exam-dop/,https://img-c.udemycdn.com/course/240x135/2567118_611e_8.jpg,"Stephane Maarek | AWS Certified Cloud Practitioner,Solutions Architect,Developer, Abhishek Singh",Practice Exams | AWS Certified DevOps Engineer Professional,AWS Certified DevOps: 120 high fidelity questions: AWS Certified DevOps Engineer Professional DOP-C02.,4.4,2568,All Levels,120 questions,,Current price: $59.99
product development,https://www.udemy.com/course/master-product-management-skills-by-building-a-product/,https://img-c.udemycdn.com/course/240x135/5138720_6fb7_4.jpg,"Anna Kolenkina, FutureVersity School .",Master Product Management by actually building a Product,The Most Practical course on Product Management. 15.5+ hours. Real-life project. AI productivity tips. With Certificate,4.6,1426,All Levels,143 lectures,15.5 total hours,Current price: $79.99
product development,https://www.udemy.com/course/gcp-google-cloud-professional-devops-engineer-certification/,https://img-c.udemycdn.com/course/240x135/4133780_4390_9.jpg,"Ankit Mistry : 150,000+ Students, GCP Certification - Google Cloud Academy | Associate Cloud & Professional Engineer Certifications",GCP Google Cloud Professional DevOps Engineer Certification,Pass Google Cloud Professional DevOps Certification with 12+ Hours of HD quality video and 70+ Hands-on Practical labs,4.2,2106,All Levels,112 lectures,13.5 total hours,Current price: $79.99
product development,https://www.udemy.com/course/devops-with-docker-kubernetes-and-azure-devops/,https://img-c.udemycdn.com/course/240x135/2813427_cc60_2.jpg,"in28Minutes Official, Ravi S | DevOps Expert - Docker & Kubernetes, Open Cloud Solutions | Microsoft Azure Certification - AZ 900, Ranga Karanam | GCP Certification - Google Cloud Engineer & Architect","Learn DevOps: Docker, Kubernetes, Terraform and Azure DevOps","DevOps for Absolute Beginners: Azure DevOps, Docker, Kubernetes, Jenkins, Terraform, Ansible - AWS, Azure & Google Cloud",4.5,15966,All Levels,235 lectures,21.5 total hours,Current price: $139.99
product development,https://www.udemy.com/course/data-driven-development-ab-testing-for-product-engineers/,https://img-c.udemycdn.com/course/240x135/4501342_2695.jpg,Seamus James,Data Driven Development: A/B Testing for Product Engineers,Learn the techniques and best practices to make confident choices for your user interface and get measurable results.,4.6,18,Intermediate,95 lectures,11 total hours,Current price: $74.99
product development,https://www.udemy.com/course/devopsprojects/,https://img-c.udemycdn.com/course/240x135/3710504_9b6d_9.jpg,Imran Teli,DevOps Projects | Real Time DevOps & GitOps Projects,Master Your DevOps Skills with Real challenge,4.7,3409,Intermediate,218 lectures,33.5 total hours,Current price: $89.99
product development,https://www.udemy.com/course/mastering-prd-step-by-step-guide-for-product-manager/,https://img-c.udemycdn.com/course/240x135/6188473_6600_4.jpg,W3 Product Management,Mastering PRD: Step-by-Step Guide for Product Manager,Learn to create Product Requirement Documents (PRD) that align teams and drive successful product development.,4.5,10,Beginner,28 lectures,1.5 total hours,Current price: $69.99
product development,https://www.udemy.com/course/devops-training/,https://img-c.udemycdn.com/course/240x135/1464166_c16e_33.jpg,TechLink Selenium | DevOps | GenAI,DevOps MasterClass: Terraform Kubernetes Ansible Docker,"DevOps with Jenkins Terraform GIT Docker Maven Kubernetes Ansible Automation Docker Swarm, DevOps Real world Exercises",4.5,6619,All Levels,548 lectures,76.5 total hours,Current price: $139.99
product development,https://www.udemy.com/course/devops-culture-and-agile-software-development-the-complete-guide/,https://img-c.udemycdn.com/course/240x135/4981152_554e_3.jpg,"Omni Academy 400,000+ students, Mirko Perkusich, Ph.D., Gustavo Farias 500.000+ Alunos, Omni Academy - Student Care & Support",DevOps Beyond Tools: A Practical Guide for Agile Teams,Go beyond tools like Kubernetes or Jenkins. Master how DevOps empowers Agile organizations. 2 EXTRA courses: Git & Scrum,4.6,464,All Levels,80 lectures,3.5 total hours,Current price: $74.99
product development,https://www.udemy.com/course/azure-devops-for-project-managers-analyst/,https://img-c.udemycdn.com/course/240x135/2377792_4088_5.jpg,Patrick Videos,Azure DevOps Boards for Project Managers/Analysts/Developers,Microsoft Project Management tool Azure DevOps Boards. TFS / VSTS is now Azure DevOps.,4.5,26863,Beginner,10 lectures,1.5 total hours,Current price: $89.99
product development,https://www.udemy.com/course/become-a-product-manager-learn-the-skills-get-a-job/,https://img-c.udemycdn.com/course/240x135/673654_d677_7.jpg,"Cole Mercer, Evan Kimbrell",Become a Product Manager | Learn the Skills & Get the Job,"The most complete course available on Product Management. 13+ hours of videos, activities, interviews, & more",4.4,61026,All Levels,144 lectures,13 total hours,Current price: $119.99
product development,https://www.udemy.com/course/the-ai-engineer-course-complete-ai-engineer-bootcamp/,https://img-c.udemycdn.com/course/240x135/6112535_7103.jpg,365 Careers,The AI Engineer Course 2025: Complete AI Engineer Bootcamp,"Complete AI Engineer Training: Python, NLP, Transformers, LLMs, LangChain, Hugging Face, APIs",4.6,2803,All Levels,367 lectures,24.5 total hours,Current price: $89.99
product development,https://www.udemy.com/course/productmanagement101/,https://img-c.udemycdn.com/course/240x135/129118_fab9_11.jpg,Todd Birzer,Product Management 101,Learn to become a more strategic product manager - and have a greater impact on your company and your products,4.6,22159,Beginner,76 lectures,5.5 total hours,Current price: $109.99
product development,https://www.udemy.com/course/advanced-product-management-vision-strategy-metrics/,https://img-c.udemycdn.com/course/240x135/2013542_4203_7.jpg,"Cole Mercer, Evan Kimbrell","Advanced Product Management: Vision, Strategy & Metrics","Learn the skills Product Managers use every day. Vision, strategy, & advanced metrics for Product Managers",4.5,10402,Intermediate,37 lectures,5.5 total hours,Current price: $94.99
product development,https://www.udemy.com/course/complete-product-management-learn-the-skills-get-the-job/,https://img-c.udemycdn.com/course/240x135/4113606_3c7e_2.jpg,Institute of Product Leadership,Complete Product Management Course: Become a Product Manager,"Learn the complete Product Management process from ideation, market research, product development, and delivery.",4.1,647,Intermediate,276 lectures,24.5 total hours,Current price: $74.99
