skill,link,image_link,partner,title,course_description,rating,num_review,difficulty,num_lecture,duration,price
excel,https://www.udemy.com/course/aws-certified-devops-engineer-professional-hands-on/,https://img-c.udemycdn.com/course/240x135/2533568_2828_6.jpg,"Stephane Maarek | AWS Certified Cloud Practitioner,Solutions Architect,Developer",AWS Certified DevOps Engineer Professional 2025 - DOP-C02,Pass the AWS Certified DevOps Engineer Professional Certification (DOP-C02) with 20 hours of advanced videos.,4.7,18041,Intermediate,248 lectures,17 total hours,
excel,https://www.udemy.com/course/gcp-google-cloud-professional-devops-engineer-certification/,https://img-c.udemycdn.com/course/240x135/4133780_4390_9.jpg,"Ankit Mistry : 150,000+ Students, GCP Certification - Google Cloud Academy | Associate Cloud & Professional Engineer Certifications",GCP Google Cloud Professional DevOps Engineer Certification,Pass Google Cloud Professional DevOps Certification with 12+ Hours of HD quality video and 70+ Hands-on Practical labs,4.2,2106,All Levels,112 lectures,13.5 total hours,Current price: $79.99
excel,https://www.udemy.com/course/microsoft-excel-2013-from-beginner-to-advanced-and-beyond/,https://img-c.udemycdn.com/course/240x135/793796_0e89_4.jpg,"Kyle Pew, Office Newb",Microsoft Excel - Excel from Beginner to Advanced,All-in-One Excel Training: Transform Your Skills with Hands-On Projects and Real-World Applications! - Excel 2007-2024,4.7,482212,All Levels,271 lectures,22 total hours,Current price: $129.99
excel,https://www.udemy.com/course/aws-certified-devops-engineer-professional-practice-exam-dop/,https://img-c.udemycdn.com/course/240x135/2567118_611e_8.jpg,"Stephane Maarek | AWS Certified Cloud Practitioner,Solutions Architect,Developer, Abhishek Singh",Practice Exams | AWS Certified DevOps Engineer Professional,AWS Certified DevOps: 120 high fidelity questions: AWS Certified DevOps Engineer Professional DOP-C02.,4.4,2568,All Levels,120 questions,,
excel,https://www.udemy.com/course/decodingdevops/,https://img-c.udemycdn.com/course/240x135/4039556_ebb3_9.jpg,Imran Teli,DevOps Beginners to Advanced with Projects,"Begin Your DevOps Career As a Newbie | AWS, Linux, Scripting, Jenkins, Ansible, GitOps, Docker, Kubernetes, & Terraform.",4.6,36463,All Levels,318 lectures,53 total hours,Current price: $119.99
excel,https://www.udemy.com/course/the-complete-devops-bootcamp/,https://img-c.udemycdn.com/course/240x135/4347106_9cfa.jpg,"Mumshad Mannambeth, KodeKloud Training",The Ultimate DevOps Bootcamp,The ultimate DevOps Bootcamp course for all your DevOps learning,4.6,6636,Beginner,281 lectures,17.5 total hours,Current price: $99.99
excel,https://www.udemy.com/course/excel-crash-course-full-tutorial/,https://img-c.udemycdn.com/course/240x135/1105404_aca0_22.jpg,Warrick Klimaytys,Microsoft Excel - Excel from Beginner to Advanced 2025,"The complete Microsoft Excel course, compatible with MS Office 365, or ANY version of Excel. Zero to HERO!",4.7,18653,All Levels,146 lectures,12 total hours,
excel,https://www.udemy.com/course/microsoft-excel-for-scientists-and-engineers/,https://img-c.udemycdn.com/course/240x135/3565253_d9ce_3.jpg,Prof. Samer,Microsoft Excel for Scientists and Engineers,"Unlock Excel's Potential: Data Analysis, Charting, and Advanced Techniques for Science & Engineering Professionals",4.5,522,Intermediate,64 lectures,7 total hours,
excel,https://www.udemy.com/course/excel-vba-and-macros-course/,https://img-c.udemycdn.com/course/240x135/1506888_52b0_3.jpg,Leila Gharani,Unlock Excel VBA and Excel Macros,Automate Complex Tasks with Microsoft Excel VBA & Excel Macros (Real-World Projects included). Achieve More. Save time.,4.7,45647,All Levels,172 lectures,22.5 total hours,
excel,https://www.udemy.com/course/devops-with-docker-kubernetes-and-azure-devops/,https://img-c.udemycdn.com/course/240x135/2813427_cc60_2.jpg,"in28Minutes Official, Ravi S | DevOps Expert - Docker & Kubernetes, Open Cloud Solutions | Microsoft Azure Certification - AZ 900, Ranga Karanam | GCP Certification - Google Cloud Engineer & Architect","Learn DevOps: Docker, Kubernetes, Terraform and Azure DevOps","DevOps for Absolute Beginners: Azure DevOps, Docker, Kubernetes, Jenkins, Terraform, Ansible - AWS, Azure & Google Cloud",4.5,15966,All Levels,235 lectures,21.5 total hours,
excel,https://www.udemy.com/course/excel-for-analysts/,https://img-c.udemycdn.com/course/240x135/516446_4935_5.jpg,"Maven Analytics • 1,500,000 Learners, Chris Dutton",Microsoft Excel: Advanced Excel Formulas & Functions,"Learn 75+ Excel spreadsheet formulas for data analysis & business intelligence, with a top Microsoft Excel instructor!",4.7,102919,All Levels,115 lectures,9.5 total hours,Current price: $199.99
excel,https://www.udemy.com/course/devopsprojects/,https://img-c.udemycdn.com/course/240x135/3710504_9b6d_9.jpg,Imran Teli,DevOps Projects | Real Time DevOps & GitOps Projects,Master Your DevOps Skills with Real challenge,4.7,3409,Intermediate,218 lectures,33.5 total hours,Current price: $89.99
excel,https://www.udemy.com/course/exam-mo-201-microsoft-excel-expert/,https://img-c.udemycdn.com/course/240x135/3614594_b3c5_3.jpg,"Maven Analytics • 1,500,000 Learners, Enrique Ruiz",Microsoft Excel Certification Exam Prep: MO-201 Excel Expert,Ace the Excel MO-201 Exam! Learn data analysis & visualization and earn your Excel Expert Certification (MS Excel 2019),4.8,2591,All Levels,98 lectures,8.5 total hours,Current price: $94.99
excel,https://www.udemy.com/course/ultimate-devops-project-with-resume-preparation/,https://img-c.udemycdn.com/course/240x135/6416543_f441_4.jpg,Abhishek Veeramalla,Ultimate DevOps Project Implementation,End to End DevOps Implementation on an E-Commerce project with Resume preparation and Interview Q&A,4.8,1993,Beginner,76 lectures,12 total hours,Current price: $44.99
excel,https://www.udemy.com/course/devops-training/,https://img-c.udemycdn.com/course/240x135/1464166_c16e_33.jpg,TechLink Selenium | DevOps | GenAI,DevOps MasterClass: Terraform Kubernetes Ansible Docker,"DevOps with Jenkins Terraform GIT Docker Maven Kubernetes Ansible Automation Docker Swarm, DevOps Real world Exercises",4.5,6619,All Levels,548 lectures,76.5 total hours,
excel,https://www.udemy.com/course/master-microsoft-excel-from-basics-to-advanced-excel/,https://img-c.udemycdn.com/course/240x135/6316089_8d4f.jpg,EXCEL: Microsoft Excel Basic to Advanced Excel (data analytics I financial modeling I ms excel I data analyst),EXCEL: Microsoft Excel Basic to Advanced Excel,Ms Excel Complete 4 in 1: Excel Basics I Intermediate Excel I Advanced Excel I Expert Excel,4.2,233,All Levels,71 lectures,13 total hours,Current price: $79.99
excel,https://www.udemy.com/course/microsoft-excel-pro-tips-for-power-users/,https://img-c.udemycdn.com/course/240x135/1885612_b008_9.jpg,"Maven Analytics • 1,500,000 Learners, Chris Dutton",Microsoft Excel Pro Tips: Excel from Beginner to Advanced,"Learn hands-on Excel spreadsheet tips for data analysis, visualization, pivot tables, advanced analytics & more!",4.7,6286,All Levels,93 lectures,10.5 total hours,
excel,https://www.udemy.com/course/azure-devops-for-project-managers-analyst/,https://img-c.udemycdn.com/course/240x135/2377792_4088_5.jpg,Patrick Videos,Azure DevOps Boards for Project Managers/Analysts/Developers,Microsoft Project Management tool Azure DevOps Boards. TFS / VSTS is now Azure DevOps.,4.5,26863,Beginner,10 lectures,1.5 total hours,
excel,https://www.udemy.com/course/azure-devops-for-beginners/,https://img-c.udemycdn.com/course/240x135/2591908_30cf_11.jpg,Brian Culp,Azure DevOps Fundamentals for Beginners,"Learn How to Plan, Manage, and Deploy Your Very First Azure DevOps Application Through Hands-On Demos and Use Cases!",4.5,43498,Intermediate,45 lectures,3.5 total hours,
excel,https://www.udemy.com/course/the-ultimate-microsoft-excel-online-course/,https://img-c.udemycdn.com/course/240x135/4920048_b156.jpg,Simon Sez IT,The Ultimate Microsoft Excel Mastery Bundle - 8 Courses,Master Microsoft Excel with this huge-value beginner to advanced eight-course bundle and become an Excel power user!,4.6,2284,All Levels,589 lectures,66.5 total hours,Current price: $99.99
