skill,link,image_link,partner,title,course_description,rating,num_review,difficulty,num_lecture,duration,price
routing protocols,https://www.udemy.com/course/aws-certified-devops-engineer-professional-practice-exams-amazon-dop-c02/,https://img-c.udemycdn.com/course/240x135/2644002_eff2_6.jpg,"Jon Bonso AWS Certified Cloud Practitioner, Developer, Solutions Architect, Tutorials Dojo | AWS Certified Cloud Practitioner, AWS Certified Solutions Architect, AWS Certified Developer, Amiel Palacol AWS Certified Solutions Architect, DevOps Engineer Professional",AWS Certified DevOps Engineer Professional Practice Exams,Be an AWS DevOps Engineer! AWS Certified DevOps Engineer Professional Practice Tests that covers all DOP-C02 topics!,4.5,1285,Intermediate,150 questions,,Current price: $59.99
routing protocols,https://www.udemy.com/course/aws-certified-devops-engineer-professional-hands-on/,https://img-c.udemycdn.com/course/240x135/2533568_2828_6.jpg,"Stephane Maarek | AWS Certified Cloud Practitioner,Solutions Architect,Developer",AWS Certified DevOps Engineer Professional 2025 - DOP-C02,Pass the AWS Certified DevOps Engineer Professional Certification (DOP-C02) with 20 hours of advanced videos.,4.7,18041,Intermediate,248 lectures,17 total hours,Current price: $149.99
routing protocols,https://www.udemy.com/course/cisco-ospf-hands-on-certification-training/,https://img-c.udemycdn.com/course/240x135/4844382_3644_5.jpg,EDUCBA Bridging the Gap,"Dynamic Routing Protocols Mastery: Guide to RIP, EIGRP, OSPF","Master Dynamic Routing Protocols like RIP, EIGRP, and OSPF for efficient network management.",4.7,52,All Levels,80 lectures,10.5 total hours,Current price: $39.99
routing protocols,https://www.udemy.com/course/aws-certified-devops-engineer-professional-practice-exam-dop/,https://img-c.udemycdn.com/course/240x135/2567118_611e_8.jpg,"Stephane Maarek | AWS Certified Cloud Practitioner,Solutions Architect,Developer, Abhishek Singh",Practice Exams | AWS Certified DevOps Engineer Professional,AWS Certified DevOps: 120 high fidelity questions: AWS Certified DevOps Engineer Professional DOP-C02.,4.4,2568,All Levels,120 questions,,Current price: $59.99
routing protocols,https://www.udemy.com/course/gcp-google-cloud-professional-devops-engineer-certification/,https://img-c.udemycdn.com/course/240x135/4133780_4390_9.jpg,"Ankit Mistry : 150,000+ Students, GCP Certification - Google Cloud Academy | Associate Cloud & Professional Engineer Certifications",GCP Google Cloud Professional DevOps Engineer Certification,Pass Google Cloud Professional DevOps Certification with 12+ Hours of HD quality video and 70+ Hands-on Practical labs,4.2,2106,All Levels,112 lectures,13.5 total hours,Current price: $79.99
routing protocols,https://www.udemy.com/course/the-complete-devops-bootcamp/,https://img-c.udemycdn.com/course/240x135/4347106_9cfa.jpg,"Mumshad Mannambeth, KodeKloud Training",The Ultimate DevOps Bootcamp,The ultimate DevOps Bootcamp course for all your DevOps learning,4.6,6636,Beginner,281 lectures,17.5 total hours,Current price: $99.99
routing protocols,https://www.udemy.com/course/decodingdevops/,https://img-c.udemycdn.com/course/240x135/4039556_ebb3_9.jpg,Imran Teli,DevOps Beginners to Advanced with Projects,"Begin Your DevOps Career As a Newbie | AWS, Linux, Scripting, Jenkins, Ansible, GitOps, Docker, Kubernetes, & Terraform.",4.6,36463,All Levels,318 lectures,53 total hours,Current price: $119.99
routing protocols,https://www.udemy.com/course/devops-training/,https://img-c.udemycdn.com/course/240x135/1464166_c16e_33.jpg,TechLink Selenium | DevOps | GenAI,DevOps MasterClass: Terraform Kubernetes Ansible Docker,"DevOps with Jenkins Terraform GIT Docker Maven Kubernetes Ansible Automation Docker Swarm, DevOps Real world Exercises",4.5,6619,All Levels,548 lectures,76.5 total hours,Current price: $139.99
routing protocols,https://www.udemy.com/course/devops-with-docker-kubernetes-and-azure-devops/,https://img-c.udemycdn.com/course/240x135/2813427_cc60_2.jpg,"in28Minutes Official, Ravi S | DevOps Expert - Docker & Kubernetes, Open Cloud Solutions | Microsoft Azure Certification - AZ 900, Ranga Karanam | GCP Certification - Google Cloud Engineer & Architect","Learn DevOps: Docker, Kubernetes, Terraform and Azure DevOps","DevOps for Absolute Beginners: Azure DevOps, Docker, Kubernetes, Jenkins, Terraform, Ansible - AWS, Azure & Google Cloud",4.5,15966,All Levels,235 lectures,21.5 total hours,Current price: $139.99
routing protocols,https://www.udemy.com/course/ultimate-devops-project-with-resume-preparation/,https://img-c.udemycdn.com/course/240x135/6416543_f441_4.jpg,Abhishek Veeramalla,Ultimate DevOps Project Implementation,End to End DevOps Implementation on an E-Commerce project with Resume preparation and Interview Q&A,4.8,1993,Beginner,76 lectures,12 total hours,Current price: $44.99
routing protocols,https://www.udemy.com/course/mikrotik-routing-engineer-with-labs-mtcre/,https://img-c.udemycdn.com/course/240x135/2856870_3b68_2.jpg,Maher Haddad,MikroTik Routing Engineer with LABS,Understand the topics of the MikroTik MTCRE track and be ready for the MTCRE exam,4.8,540,Intermediate,53 lectures,12 total hours,Current price: $69.99
routing protocols,https://www.udemy.com/course/linux-for-cloud-engineers-a-complete-project-based-learning/,https://img-c.udemycdn.com/course/240x135/5403140_ce56_12.jpg,Pravin Mishra | AWS Certified Cloud Practitioner | Solutions Architect,"Linux for DevOps, Cloud, and SRE Engineers","Master Linux fundamentals, shell scripting, process management & networking for DevOps, Cloud, and SRE Engineers",4.4,401,Beginner,26 lectures,5.5 total hours,Current price: $59.99
routing protocols,https://www.udemy.com/course/azure-kubernetes-service-with-azure-devops-and-terraform/,https://img-c.udemycdn.com/course/240x135/3381074_e443_2.jpg,"Kalyan Reddy Daida | DevOps & SRE Architect on AWS, Azure & Google Cloud Platforms",Azure Kubernetes Service with Azure DevOps and Terraform,"Docker, AKS, Azure Disks, DevOps, Virtual Nodes, ACR, DNS Zones, Active Directory, Kubernetes RBAC, Ingress, Terraform",4.6,5480,All Levels,216 lectures,28 total hours,Current price: $109.99
routing protocols,https://www.udemy.com/course/devopsprojects/,https://img-c.udemycdn.com/course/240x135/3710504_9b6d_9.jpg,Imran Teli,DevOps Projects | Real Time DevOps & GitOps Projects,Master Your DevOps Skills with Real challenge,4.7,3409,Intermediate,218 lectures,33.5 total hours,Current price: $89.99
routing protocols,https://www.udemy.com/course/cisco-bgp-masterclass/,https://img-c.udemycdn.com/course/240x135/4805092_a2f8_2.jpg,Neil Anderson,Cisco BGP Masterclass for Enterprise Network Engineers,Become a BGP expert with full hands-on lab exercises included.,4.7,851,Intermediate,57 lectures,16.5 total hours,Current price: $84.99
routing protocols,https://www.udemy.com/course/model-context-protocol/,https://img-c.udemycdn.com/course/240x135/6508751_d289.jpg,Eden Marco | LLM Specialist,MCP Crash Course: Complete Model Context Protocol in a Day,"(BETA)  Build, Connect, Deploy: Master MCP Servers,  MCP Clients, Tools & Resources for Powerful LLM Applications",4.5,108,,Expert,3 total hours,Current price: $49.99
routing protocols,https://www.udemy.com/course/valaxy-git/,https://img-c.udemycdn.com/course/240x135/3184348_e5db_5.jpg,AR Shankar | Valaxy Technologies,Git and GitHub for DevOps Engineers,DevOps Engineer Roles on Git and GitHub from Creating a Repository to Releasing Code onto Production Environment,4.6,1521,All Levels,54 lectures,6.5 total hours,Current price: $74.99
routing protocols,https://www.udemy.com/course/aws-eks-kubernetes-masterclass-devops-microservices/,https://img-c.udemycdn.com/course/240x135/3028312_0c5c_3.jpg,"Kalyan Reddy Daida | DevOps & SRE Architect on AWS, Azure & Google Cloud Platforms","AWS EKS Kubernetes-Masterclass | DevOps, Microservices","Docker, EBS, RDS, CLB, NLB, ALB, Fargate, ECR, CloudWatch, Route53, Certificate Manager, X-Ray, Ingress, Autoscaling,SNS",4.6,4835,All Levels,193 lectures,23.5 total hours,Current price: $89.99
routing protocols,https://www.udemy.com/course/valaxy-linux/,https://img-c.udemycdn.com/course/240x135/3184362_4102_12.jpg,AR Shankar | Valaxy Technologies,Linux for Cloud & DevOps Engineers,"Linux basics about files, directories, installations, networking, system configuration, user management etc...",4.5,3918,Beginner,43 lectures,4.5 total hours,Current price: $74.99
routing protocols,https://www.udemy.com/course/aws-certified-devops-engineer-professional-practice-exam-dop-c02/,https://img-c.udemycdn.com/course/240x135/5718312_6e10_3.jpg,Datavalley Trainings & Placements,AWS Certified DevOps Engineer Professional | Practice Exams,AWS Certified DevOps Engineer Pro Practice Tests 2024 | Insights into Strategic Prep for DOP-C02 AWS DevOps Engineer,4.4,15,,Expert,,Current price: $44.99
