skill,link,image_link,partner,title,course_description,rating,num_review,difficulty,num_lecture,duration,price
server,https://www.udemy.com/course/aws-certified-devops-engineer-professional-hands-on/,https://img-c.udemycdn.com/course/240x135/2533568_2828_6.jpg,"Stephane Maarek | AWS Certified Cloud Practitioner,Solutions Architect,Developer",AWS Certified DevOps Engineer Professional 2025 - DOP-C02,Pass the AWS Certified DevOps Engineer Professional Certification (DOP-C02) with 20 hours of advanced videos.,4.7,18041,Intermediate,248 lectures,17 total hours,Current price: $149.99
server,https://www.udemy.com/course/aws-certified-devops-engineer-professional-practice-exam-dop/,https://img-c.udemycdn.com/course/240x135/2567118_611e_8.jpg,"Stephane Maarek | AWS Certified Cloud Practitioner,Solutions Architect,Developer, Abhishek Singh",Practice Exams | AWS Certified DevOps Engineer Professional,AWS Certified DevOps: 120 high fidelity questions: AWS Certified DevOps Engineer Professional DOP-C02.,4.4,2568,All Levels,120 questions,,Current price: $59.99
server,https://www.udemy.com/course/decodingdevops/,https://img-c.udemycdn.com/course/240x135/4039556_ebb3_9.jpg,Imran Teli,DevOps Beginners to Advanced with Projects,"Begin Your DevOps Career As a Newbie | AWS, Linux, Scripting, Jenkins, Ansible, GitOps, Docker, Kubernetes, & Terraform.",4.6,36463,All Levels,318 lectures,53 total hours,Current price: $119.99
server,https://www.udemy.com/course/gcp-google-cloud-professional-devops-engineer-certification/,https://img-c.udemycdn.com/course/240x135/4133780_4390_9.jpg,"Ankit Mistry : 150,000+ Students, GCP Certification - Google Cloud Academy | Associate Cloud & Professional Engineer Certifications",GCP Google Cloud Professional DevOps Engineer Certification,Pass Google Cloud Professional DevOps Certification with 12+ Hours of HD quality video and 70+ Hands-on Practical labs,4.2,2106,All Levels,112 lectures,13.5 total hours,Current price: $79.99
server,https://www.udemy.com/course/the-ultimate-linux-bootcamp-for-devops-sre-cloud-engineers/,https://img-c.udemycdn.com/course/240x135/6458119_5e4d_2.jpg,"Yogesh Raheja, Thinknyx Technologies",The Ultimate Linux Bootcamp for DevOps SRE & Cloud Engineers,"Unlock your potential in Linux Administration with expert-led lectures, interactive demonstrations, and practice tests",4.9,21,All Levels,113 lectures,14 total hours,Current price: $44.99
server,https://www.udemy.com/course/the-complete-devops-bootcamp/,https://img-c.udemycdn.com/course/240x135/4347106_9cfa.jpg,"Mumshad Mannambeth, KodeKloud Training",The Ultimate DevOps Bootcamp,The ultimate DevOps Bootcamp course for all your DevOps learning,4.6,6636,Beginner,281 lectures,17.5 total hours,Current price: $99.99
server,https://www.udemy.com/course/devops-with-docker-kubernetes-and-azure-devops/,https://img-c.udemycdn.com/course/240x135/2813427_cc60_2.jpg,"in28Minutes Official, Ravi S | DevOps Expert - Docker & Kubernetes, Open Cloud Solutions | Microsoft Azure Certification - AZ 900, Ranga Karanam | GCP Certification - Google Cloud Engineer & Architect","Learn DevOps: Docker, Kubernetes, Terraform and Azure DevOps","DevOps for Absolute Beginners: Azure DevOps, Docker, Kubernetes, Jenkins, Terraform, Ansible - AWS, Azure & Google Cloud",4.5,15966,All Levels,235 lectures,21.5 total hours,Current price: $139.99
server,https://www.udemy.com/course/valaxy-linux/,https://img-c.udemycdn.com/course/240x135/3184362_4102_12.jpg,AR Shankar | Valaxy Technologies,Linux for Cloud & DevOps Engineers,"Linux basics about files, directories, installations, networking, system configuration, user management etc...",4.5,3918,Beginner,43 lectures,4.5 total hours,Current price: $74.99
server,https://www.udemy.com/course/networking-fundamentals-for-full-stack-web-developers/,https://img-c.udemycdn.com/course/240x135/5358812_152a_13.jpg,Shaun Hummel,Troubleshooting Web Applications (DevOps),"Network Engineers and DevOps - Troubleshoot Server Connection, Internet Performance, TCP/IP, DNS, AWS Subnetting",4.5,24,All Levels,71 lectures,6.5 total hours,Current price: $74.99
server,https://www.udemy.com/course/devops-training/,https://img-c.udemycdn.com/course/240x135/1464166_c16e_33.jpg,TechLink Selenium | DevOps | GenAI,DevOps MasterClass: Terraform Kubernetes Ansible Docker,"DevOps with Jenkins Terraform GIT Docker Maven Kubernetes Ansible Automation Docker Swarm, DevOps Real world Exercises",4.5,6619,All Levels,548 lectures,76.5 total hours,Current price: $139.99
server,https://www.udemy.com/course/devopsprojects/,https://img-c.udemycdn.com/course/240x135/3710504_9b6d_9.jpg,Imran Teli,DevOps Projects | Real Time DevOps & GitOps Projects,Master Your DevOps Skills with Real challenge,4.7,3409,Intermediate,218 lectures,33.5 total hours,Current price: $89.99
server,https://www.udemy.com/course/valaxy-git/,https://img-c.udemycdn.com/course/240x135/3184348_e5db_5.jpg,AR Shankar | Valaxy Technologies,Git and GitHub for DevOps Engineers,DevOps Engineer Roles on Git and GitHub from Creating a Repository to Releasing Code onto Production Environment,4.6,1521,All Levels,54 lectures,6.5 total hours,Current price: $74.99
server,https://www.udemy.com/course/master-aws-certified-devops-engineer-professional/,https://img-c.udemycdn.com/course/240x135/2045722_9c82_2.jpg,Zeal Vora,AWS Certified DevOps Engineer - Professional 2024,All you need to master AWS Certified DevOps Engineer - Professional (DOP-C02) certification.,4.7,1435,Intermediate,313 lectures,35.5 total hours,Current price: $22.99
server,https://www.udemy.com/course/azure-devops-for-beginners/,https://img-c.udemycdn.com/course/240x135/2591908_30cf_11.jpg,Brian Culp,Azure DevOps Fundamentals for Beginners,"Learn How to Plan, Manage, and Deploy Your Very First Azure DevOps Application Through Hands-On Demos and Use Cases!",4.5,43498,Intermediate,45 lectures,3.5 total hours,Current price: $119.99
server,https://www.udemy.com/course/generative-ai-for-devops-engineers/,https://img-c.udemycdn.com/course/240x135/6088953_912c.jpg,Raghu The Security Expert,Generative AI (GenAI) for DevOps and DevSecOps Engineers,Gen AI for DevOps and DevSecOps Engineers | Learn about Basics of Gen AI | Use Gen AI Models Online and on Local Machine,4.6,770,All Levels,23 lectures,2.5 total hours,Current price: $19.99
server,https://www.udemy.com/course/azure100/,https://img-c.udemycdn.com/course/240x135/3492150_ec37.jpg,Alan Rodrigues,AZ-400 Designing and Implementing DevOps Certification,Pass your AZ-400 DevOps Exam,4.6,11583,Intermediate,258 lectures,21 total hours,Current price: $119.99
server,https://www.udemy.com/course/mastering-aws-devops-for-cloud-engineers/,https://img-c.udemycdn.com/course/240x135/5492716_8a93_5.jpg,Pravin Mishra | AWS Certified Cloud Practitioner | Solutions Architect,AWS DevOps & CI/CD with AWS CodePipeline for Engineers,"Build, Deploy, Scaling Applications with AWS DevOps. Learn AWS CodeCommit, CodeBuild, CodeDeploy, CodePipeline",4.6,373,Intermediate,78 lectures,16.5 total hours,Current price: $19.99
server,https://www.udemy.com/course/ultimate-devops-project-with-resume-preparation/,https://img-c.udemycdn.com/course/240x135/6416543_f441_4.jpg,Abhishek Veeramalla,Ultimate DevOps Project Implementation,End to End DevOps Implementation on an E-Commerce project with Resume preparation and Interview Q&A,4.8,1993,Beginner,76 lectures,12 total hours,Current price: $44.99
server,https://www.udemy.com/course/introduction-devops/,https://img-c.udemycdn.com/course/240x135/5236958_2efa_2.jpg,Imran Afzal,Introduction to DevOps: Roadmap to DevOps Career,"DevOps course for someone who wants to learn Jenkins​,​ Jira, Dockers, Kubernetes, Nagios, Ansible, Terraform, and more",4.5,513,All Levels,55 lectures,7.5 total hours,Current price: $79.99
server,https://www.udemy.com/course/cicd-pipelines-using-azure-devops/,https://img-c.udemycdn.com/course/240x135/3244560_b8b3_2.jpg,Charles Aylward,CI/CD Pipelines using Azure DevOps,Create end-to-end DevOps pipelines using the Azure DevOps Platform,4.5,5234,Intermediate,70 lectures,6.5 total hours,Current price: $69.99
