skill,link,image_link,partner,title,course_description,rating,num_review,difficulty,num_lecture,duration,price
linux,https://www.udemy.com/course/javamasterclass/,https://img-c.udemycdn.com/course/240x135/6211415_d24a_2.jpg,"Denis Panjuta, Tutorials.eu by Denis Panjuta, Jafar TutorialsEU",60 Days of Java : The Complete Java Masterclass,"Master Java by building real-world projects. Learn JavaFX, Spring Boot, REST APIs, and more!",4.6,526,All Levels,729 lectures,58 total hours,Current price: $89.99
linux,https://www.udemy.com/course/kotlin-for-java-developers/,https://img-c.udemycdn.com/course/240x135/1322796_9675.jpg,"Tim Buchalka, Goran Lochert, Tim Buchalka's Learn Programming Academy",Kotlin for Java Developers,"Use your Java skills to learn Kotlin fast. Enhance career prospects and master Kotlin, including Java interoperability",4.5,5138,All Levels,92 lectures,17 total hours,Current price: $74.99
linux,https://www.udemy.com/course/java-the-complete-java-developer-course/,https://img-c.udemycdn.com/course/240x135/533682_c10c_4.jpg,"Tim Buchalka, Tim Buchalka's Learn Programming Academy, Edwin Einsen Vásquez Velásquez, Igor Popovic",Java Masterclass 2025: 130+ Hours of Expert Lessons,"Gain real-world experience with OOP, coding exercises, and problem-solving for job-ready Java development skills",4.6,205616,All Levels,736 lectures,135.5 total hours,Current price: $139.99
linux,https://www.udemy.com/course/java-se-programming/,https://img-c.udemycdn.com/course/240x135/2462140_b27f_2.jpg,Abdul Bari,Learn JAVA Programming - Beginner to Master,Deep Dive in Core Java programming -Standard Edition. A Practical approach to learn Java. Become a Java Expert,4.6,26143,All Levels,333 lectures,61.5 total hours,Current price: $109.99
linux,https://www.udemy.com/course/complete-linux-training-course-to-get-your-dream-it-job/,https://img-c.udemycdn.com/course/240x135/1523066_334c_15.jpg,Imran Afzal,Complete Linux Training Course to Get Your Dream IT Job 2025,"The BEST Linux Administration course for corporate jobs and RHCSA, RHCE, LFCS, LPIC and CompTIA Linux+ certifications",4.7,40279,All Levels,283 lectures,41 total hours,Current price: $139.99
linux,https://www.udemy.com/course/java-programming-tutorial-for-beginners/,https://img-c.udemycdn.com/course/240x135/1535678_0ce9_7.jpg,in28Minutes Official,Java Programming for Complete Beginners [2025],Java Programming for Beginners to Java Object Oriented Programming. Core Java + Spring Boot. Java 8 to Java 24.,4.5,49448,Beginner,749 lectures,59 total hours,Current price: $119.99
linux,https://www.udemy.com/course/java-in-depth-become-a-complete-java-engineer/,https://img-c.udemycdn.com/course/240x135/358540_d06b_16.jpg,Dheeru Mundluru,Java In-Depth: Become a Complete Java Engineer!,"Java programming bootcamp integrated with best practices, design rules and instructor-led Java EE project. Up to Java 21",4.6,23634,All Levels,410 lectures,76 total hours,Current price: $119.99
linux,https://www.udemy.com/course/master-linux-administration/,https://img-c.udemycdn.com/course/240x135/3371848_9ea9_20.jpg,"Andrei Dumitrescu, Crystal Mind Academy",Linux Administration: The Complete Linux Bootcamp in 2025,"Linux Sysadmin for Beginners. Get the Linux skills to boost your career and get hired. Quizzes, Projects, Challenges.",4.7,4034,All Levels,224 lectures,22.5 total hours,Current price: $129.99
linux,https://www.udemy.com/course/ocp11_from_oca8/,https://img-c.udemycdn.com/course/240x135/4435956_8c4d_16.jpg,"Dr. Seán Kennedy OCA, OCP","Java 21, Java 17, Java 11, Java 8 (adv.) and Spring Boot 3","Master the latest topics; get Oracle OCP Certification (1Z0-830, 829, 819, 809) and code a Spring Boot application",4.5,2330,Intermediate,357 lectures,32 total hours,Current price: $69.99
linux,https://www.udemy.com/course/java-programming-a-comprehensive-bootcamp-from-zero-to-hero/,https://img-c.udemycdn.com/course/240x135/5196034_e1f9_2.jpg,"Eazy Bytes, Madan Reddy",Java Programming: A Comprehensive Bootcamp from Zero to Hero,"Become a Java developer - Core Java, Functional Programming, Lambdas, Streams, Collections, Covers upto Java 23",4.6,1855,Beginner,533 lectures,66.5 total hours,Current price: $79.99
linux,https://www.udemy.com/course/the-complete-java-training/,https://img-c.udemycdn.com/course/240x135/5070626_5047_3.jpg,"Imran Afzal, Kashif Ali",The Complete JAVA Training - 2025,The Complete Java Masterclass: From Fundamentals to Advanced Application Development,4.7,318,All Levels,189 lectures,36.5 total hours,Current price: $79.99
linux,https://www.udemy.com/course/mastering-linux/,https://img-c.udemycdn.com/course/240x135/5181942_dc28_14.jpg,"Jannis Seemann, Denis Panjuta",Mastering Linux: The Comprehensive Guide,Gain an almost unfair advantage by unlocking the Power of Linux: 70 hours of hands-on training. The ONLY course you need,4.7,2123,Beginner,608 lectures,71.5 total hours,Current price: $19.99
linux,https://www.udemy.com/course/the-complete-java-development-bootcamp/,https://img-c.udemycdn.com/course/240x135/3740582_cc2c_9.jpg,"Rayan Slim, Jad Slim, Amer Abdulkader, Jose Portilla, Pierian Training, Sarmad Tanveer",Java Bootcamp: Learn Java with 100+ Java Projects,"Master Core Java: OOP, Collections, Lambda, Streams, Threads & Real-World Projects",4.6,9216,All Levels,434 lectures,29.5 total hours,Current price: $109.99
linux,https://www.udemy.com/course/kali-linux-certification-course-hacking-with-kali-linux/,https://img-c.udemycdn.com/course/240x135/6214651_30d6.jpg,Cyber Security Online Training,Kali Linux Certification Course: Hacking with Kali Linux,"Learn Kali Linux for Security, Hacking, Cracking, Privacy, Linux, Website Hacking, WiFi Hacking and much more.",4.4,108,All Levels,146 lectures,11 total hours,Current price: $79.99
linux,https://www.udemy.com/course/linux-command-line-masterclass/,https://img-c.udemycdn.com/course/240x135/5670494_cf42_9.jpg,Manik (Cloudaffle),Linux Command Line For Developers Masterclass - Bash Shell,Learn the Linux Administration using Linux Command Line and Bash Shell. Learn to Use Linux From Scratch as A Developer.,4.8,15,All Levels,192 lectures,20 total hours,Current price: $74.99
linux,https://www.udemy.com/course/master-practical-java-development/,https://img-c.udemycdn.com/course/240x135/827692_91ad_5.jpg,Job Ready Programmer,The Complete Java Certification Course,Become a confident industry ready core Java developer and get certified as a Java professional!,4.5,29679,All Levels,65 lectures,17.5 total hours,Current price: $159.99
linux,https://www.udemy.com/course/100-days-of-code/,https://img-c.udemycdn.com/course/240x135/2776760_f176_10.jpg,"Dr. Angela Yu, Developer and Lead Instructor",100 Days of Code: The Complete Python Pro Bootcamp,"Master Python by building 100 projects in 100 days. Learn data science, automation, build websites, games and apps!",4.7,361653,All Levels,592 lectures,56.5 total hours,Current price: $119.99
linux,https://www.udemy.com/course/essential-unix-skills-for-developers/,https://img-c.udemycdn.com/course/240x135/4925270_afc6_6.jpg,Terry Martin,Essential Unix Skills for Developers,"Harness the powerful Unix command line within Linux, MacOS & other OSs to take your developer skills to the next level",4.6,628,Beginner,76 lectures,18 total hours,Current price: $79.99
linux,https://www.udemy.com/course/learn-linux-kernel-programming/,https://img-c.udemycdn.com/course/240x135/3101800_e570_4.jpg,Linux Trainer,Learn Linux Kernel Programming,This course will teach you how to start writing Linux Kernel Modules and Device Drivers. Course is full of examples,4.0,684,Beginner,112 lectures,5.5 total hours,Current price: $59.99
linux,https://www.udemy.com/course/init6-linux/,https://img-c.udemycdn.com/course/240x135/5037268_ebf5_5.jpg,Praveen Kumar,"Linux for Devops, Cloud Engineers and Developers","Get the linux skills like user management, networking, wild card, redirection software management, services etc",4.5,40,Intermediate,55 lectures,8 total hours,Current price: $54.99
