skill,link,image_link,partner,title,course_description,rating,num_review,difficulty,num_lecture,duration,price
feature engineering,https://www.udemy.com/course/feature-engineering-for-machine-learning/,https://img-c.udemycdn.com/course/240x135/1304050_ee0f_10.jpg,"Soledad Galli, Train in Data Team",Feature Engineering for Machine Learning,"Learn imputation, variable encoding, discretization, feature extraction, how to work with datetime, outliers, and more.",4.5,3424.0,Intermediate,202 lectures,13.5 total hours,Current price: $84.99
feature engineering,https://www.udemy.com/course/feature-engineering-for-machine-learning-x/,https://img-c.udemycdn.com/course/240x135/5691662_5e01.jpg,Kaaves AI,Feature Engineering for Machine Learning,Learn the most popular Feature Engineering techniques for Data Science.,5.0,1.0,All Levels,8 lectures,,Current price: $19.99
feature engineering,https://www.udemy.com/course/aws-certified-machine-learning-engineer-associate-mla-c01/,https://img-c.udemycdn.com/course/240x135/6125705_2219.jpg,"Sundog Education by Frank Kane, Stephane Maarek | AWS Certified Cloud Practitioner,Solutions Architect,Developer, Frank Kane",AWS Certified Machine Learning Engineer Associate: Hands On!,"Practice exam included! Master MLA-C01 / ME1-C01 AWS Machine Learning Engineer Exam: SageMaker, Bedrock, and AI Skills.",4.6,1747.0,All Levels,294 lectures,23.5 total hours,Current price: $89.99
feature engineering,https://www.udemy.com/course/feature-selection-for-machine-learning/,https://img-c.udemycdn.com/course/240x135/1548436_7e85_5.jpg,"Soledad Galli, Train in Data Team",Feature Selection for Machine Learning,"Learn filter, wrapper, and embedded methods, recursive feature elimination, exhaustive search, feature shuffling & more.",4.8,2274.0,Intermediate,88 lectures,6 total hours,Current price: $84.99
feature engineering,https://www.udemy.com/course/complete-machine-learning-nlp-bootcamp-mlops-deployment/,https://img-c.udemycdn.com/course/240x135/5993822_2c2a_7.jpg,"Krish Naik, KRISHAI Technologies Private Limited","Complete Data Science,Machine Learning,DL,NLP Bootcamp","Master the theory, practice,and math behind Data Science,Machine Learning,Deep Learning,NLP with end to end projects",4.5,11296.0,All Levels,429 lectures,99 total hours,Current price: $94.99
feature engineering,https://www.udemy.com/course/google-cloud-machine-learning-engineer-certification-prep/,https://img-c.udemycdn.com/course/240x135/4878666_74ed_3.jpg,"Dan Sullivan, Dan Sullivan",Google Cloud Machine Learning Engineer Certification Prep,"Building, Deploying, and Managing Machine Learning Services at Scale",4.4,1213.0,All Levels,71 lectures,5.5 total hours,Current price: $69.99
feature engineering,https://www.udemy.com/course/detect-fake-news-with-machine-learning-feature-engineering/,https://img-c.udemycdn.com/course/240x135/5646052_2347.jpg,Christ Raharja,Detect Fake News with Machine Learning & Feature Engineering,"Learn how to build fake news detection model using machine learning, feature engineering, logistic regression, and NLP",4.5,17.0,All Levels,23 lectures,3.5 total hours,Current price: $34.99
feature engineering,https://www.udemy.com/course/comprehensive-feature-engineering-for-machine-learning/,https://img-c.udemycdn.com/course/240x135/6052519_6d58.jpg,Miuul Data Science & Deep Learning,Comprehensive Feature Engineering for Machine Learning,Master Data Preprocessing and Feature Engineering with Python.,,,Intermediate,39 lectures,4.5 total hours,Current price: $19.99
feature engineering,https://www.udemy.com/course/aws-certified-machine-learning-engineer-associate-mla-c01-exam-prep/,https://img-c.udemycdn.com/course/240x135/6188041_95ae.jpg,Nikolai Schuler,AWS Certified Machine Learning Engineer - Associate MLA-C01,The ONLY course you need to PASS the AWS Certified Machine Learning Engineer Exam | MLA-C01 | Incl. FULL Practice Exam!,4.6,263.0,All Levels,252 lectures,26.5 total hours,Current price: $89.99
feature engineering,https://www.udemy.com/course/aws-machine-learning/,https://img-c.udemycdn.com/course/240x135/2529790_a0c6_9.jpg,"Sundog Education by Frank Kane, Stephane Maarek | AWS Certified Cloud Practitioner,Solutions Architect,Developer, Frank Kane, Sundog Education Team",AWS Certified Machine Learning Specialty 2025 - Hands On!,"AWS machine learning certification preparation - learn SageMaker, generative AI, data engineering, modeling & more",4.6,15104.0,Intermediate,167 lectures,15 total hours,Current price: $119.99
feature engineering,https://www.udemy.com/course/practice-exams-aws-certified-machine-learning-engineer-associate/,https://img-c.udemycdn.com/course/240x135/6139021_a896.jpg,"Stephane Maarek | AWS Certified Cloud Practitioner,Solutions Architect,Developer, Abhishek Singh",Practice Exams: AWS Machine Learning Engineer Associate Cert,Prepare for AWS Certified Machine Learning Engineer Associate. 195 high-quality test questions and detailed explanations,4.6,306.0,All Levels,195 questions,,Current price: $64.99
feature engineering,https://www.udemy.com/course/the-ai-engineer-course-complete-ai-engineer-bootcamp/,https://img-c.udemycdn.com/course/240x135/6112535_7103.jpg,365 Careers,The AI Engineer Course 2025: Complete AI Engineer Bootcamp,"Complete AI Engineer Training: Python, NLP, Transformers, LLMs, LangChain, Hugging Face, APIs",4.6,2803.0,All Levels,367 lectures,24.5 total hours,Current price: $89.99
feature engineering,https://www.udemy.com/course/complete-machine-learning-and-data-science-zero-to-mastery/,https://img-c.udemycdn.com/course/240x135/2511476_4e38_5.jpg,"Andrei Neagoie, Daniel Bourke","Complete A.I. & Machine Learning, Data Science Bootcamp","Learn Data Science, Data Analysis, Machine Learning (Artificial Intelligence) and Python with Tensorflow, Pandas & more!",4.6,26310.0,All Levels,384 lectures,44 total hours,Current price: $119.99
feature engineering,https://www.udemy.com/course/feature-engineering-step-by-step/,https://img-c.udemycdn.com/course/240x135/6229835_edd6.jpg,Dr. Amar Massoud,Feature Engineering Step by Step,Mastering Feature Engineering: Boost Machine Learning Models with Advanced Techniques and Automation,3.9,4.0,All Levels,41 lectures,2 total hours,Current price: $49.99
feature engineering,https://www.udemy.com/course/ai-for-engineering-applications-a-z/,https://img-c.udemycdn.com/course/240x135/5161264_0f3d_2.jpg,Dr.Mohammad Samara,Machine Learning For Engineering : A-Z,Practical Application of AI in Engineering products,4.2,15.0,All Levels,52 lectures,12 total hours,Current price: $19.99
feature engineering,https://www.udemy.com/course/data-engineering-pythonmachine-learningetlweb-scraping/,https://img-c.udemycdn.com/course/240x135/6087623_8a0f.jpg,Bluelime Learning Solutions,"Data Engineering  : Python,Machine Learning,ETL,Web Scraping","Learn essentials of Data Engineering with Python, Data Manipulation, Machine Learning,  ETL, SSIS , Web Scraping.",4.7,11.0,Beginner,128 lectures,10.5 total hours,Current price: $19.99
feature engineering,https://www.udemy.com/course/data-science-course-data-cleaning-feature-engineering/,https://img-c.udemycdn.com/course/240x135/4242704_7eda.jpg,Anupam Khare,Data Science 2023:  Data Preprocessing & Feature Engineering,Become expert in Data Cleaning and Feature Engineering for Machine Learning using Pandas & Scikit learn,4.3,40.0,All Levels,36 lectures,6 total hours,Current price: $74.99
feature engineering,https://www.udemy.com/course/feature-selection-for-machine-learning-in-python/,https://img-c.udemycdn.com/course/240x135/5102176_7719.jpg,Gianluca Malato,Feature selection for machine learning in Python,Several techniques to select features in a machine learning problem,4.0,1.0,Intermediate,9 lectures,1.5 total hours,Current price: $19.99
feature engineering,https://www.udemy.com/course/google-certified-professional-machine-learning-engineer/,https://img-c.udemycdn.com/course/240x135/5211228_899a_3.jpg,Deepak Dubey,Google Certified Professional Machine Learning Engineer,"Master ML Algorithms, Data Modeling, TensorFlow & Google Cloud AI/ML Services. 137 Questions, Answers with Explanations",4.1,223.0,All Levels,63 lectures,16.5 total hours,Current price: $79.99
feature engineering,https://www.udemy.com/course/big-data-engineering-bootcamp-with-gcp-and-azure-cloud/,https://img-c.udemycdn.com/course/240x135/6242299_e787.jpg,"Krish Naik, Mayank Aggarwal, KRISHAI Technologies Private Limited","Big Data Engineering Bootcamp with GCP, and Azure Cloud","Master Big Data with Hadoop, Spark, Kafka & Cloud | Build Real-World Projects & Scalable Data Pipelines from Scratch",4.7,357.0,All Levels,301 lectures,73.5 total hours,Current price: $44.99
