skill,link,image_link,partner,title,course_description,rating,num_review,difficulty,num_lecture,duration,price
big data,https://www.udemy.com/course/complete-machine-learning-nlp-bootcamp-mlops-deployment/,https://img-c.udemycdn.com/course/240x135/5993822_2c2a_7.jpg,"Krish Naik, KRISHAI Technologies Private Limited","Complete Data Science,Machine Learning,DL,NLP Bootcamp","Master the theory, practice,and math behind Data Science,Machine Learning,Deep Learning,NLP with end to end projects",4.5,11296,All Levels,429 lectures,99 total hours,Current price: $94.99
big data,https://www.udemy.com/course/aws-certified-machine-learning-engineer-associate-mla-c01/,https://img-c.udemycdn.com/course/240x135/6125705_2219.jpg,"Sundog Education by Frank Kane, Stephane Maarek | AWS Certified Cloud Practitioner,Solutions Architect,Developer, Frank Kane",AWS Certified Machine Learning Engineer Associate: Hands On!,"Practice exam included! Master MLA-C01 / ME1-C01 AWS Machine Learning Engineer Exam: SageMaker, Bedrock, and AI Skills.",4.6,1747,All Levels,294 lectures,23.5 total hours,Current price: $89.99
big data,https://www.udemy.com/course/complete-machine-learning-and-data-science-zero-to-mastery/,https://img-c.udemycdn.com/course/240x135/2511476_4e38_5.jpg,"Andrei Neagoie, Daniel Bourke","Complete A.I. & Machine Learning, Data Science Bootcamp","Learn Data Science, Data Analysis, Machine Learning (Artificial Intelligence) and Python with Tensorflow, Pandas & more!",4.6,26310,All Levels,384 lectures,44 total hours,Current price: $119.99
big data,https://www.udemy.com/course/practice-exams-aws-certified-machine-learning-engineer-associate/,https://img-c.udemycdn.com/course/240x135/6139021_a896.jpg,"Stephane Maarek | AWS Certified Cloud Practitioner,Solutions Architect,Developer, Abhishek Singh",Practice Exams: AWS Machine Learning Engineer Associate Cert,Prepare for AWS Certified Machine Learning Engineer Associate. 195 high-quality test questions and detailed explanations,4.6,306,All Levels,195 questions,,Current price: $64.99
big data,https://www.udemy.com/course/google-cloud-machine-learning-engineer-certification-prep/,https://img-c.udemycdn.com/course/240x135/4878666_74ed_3.jpg,"Dan Sullivan, Dan Sullivan",Google Cloud Machine Learning Engineer Certification Prep,"Building, Deploying, and Managing Machine Learning Services at Scale",4.4,1213,All Levels,71 lectures,5.5 total hours,Current price: $69.99
big data,https://www.udemy.com/course/big-data-engineering-bootcamp-with-gcp-and-azure-cloud/,https://img-c.udemycdn.com/course/240x135/6242299_e787.jpg,"Krish Naik, Mayank Aggarwal, KRISHAI Technologies Private Limited","Big Data Engineering Bootcamp with GCP, and Azure Cloud","Master Big Data with Hadoop, Spark, Kafka & Cloud | Build Real-World Projects & Scalable Data Pipelines from Scratch",4.7,357,All Levels,301 lectures,73.5 total hours,Current price: $44.99
big data,https://www.udemy.com/course/aws-certified-machine-learning-engineer-associate-mla-c01-exam-prep/,https://img-c.udemycdn.com/course/240x135/6188041_95ae.jpg,Nikolai Schuler,AWS Certified Machine Learning Engineer - Associate MLA-C01,The ONLY course you need to PASS the AWS Certified Machine Learning Engineer Exam | MLA-C01 | Incl. FULL Practice Exam!,4.6,263,All Levels,252 lectures,26.5 total hours,Current price: $89.99
big data,https://www.udemy.com/course/complete-data-science-and-machine-learning-using-python/,https://img-c.udemycdn.com/course/240x135/1478886_7e44_5.jpg,"Jitesh Khurkhuriya, Python, Data Science & Machine Learning A-Z Team",Data Science : Complete Data Science & Machine Learning,"Learn and master the Data Science, Python for Machine Learning, Math for Machine Learning, Statistics for Data Science",4.4,3337,All Levels,281 lectures,26 total hours,Current price: $99.99
big data,https://www.udemy.com/course/bigquery-ml-course/,https://img-c.udemycdn.com/course/240x135/4571796_5da2.jpg,J Garg - Real Time Learning,BigQuery ML - Machine Learning in Google BigQuery using SQL,"Create Machine Learning models in Google Cloud Big Query using standard SQL. Big query ML course for ML, Data engineers",4.4,268,All Levels,125 lectures,11 total hours,Current price: $84.99
big data,https://www.udemy.com/course/python-for-machine-learning-data-science-masterclass/,https://img-c.udemycdn.com/course/240x135/2769460_e60c.jpg,"Jose Portilla, Pierian Training",Python for Machine Learning & Data Science Masterclass,"Learn about Data Science and Machine Learning with Python! Including Numpy, Pandas, Matplotlib, Scikit-Learn and more!",4.6,17183,All Levels,231 lectures,44 total hours,Current price: $119.99
big data,https://www.udemy.com/course/the-data-science-course-complete-data-science-bootcamp/,https://img-c.udemycdn.com/course/240x135/1754098_e0df_3.jpg,365 Careers,The Data Science Course: Complete Data Science Bootcamp 2025,"Complete Data Science Training: Math, Statistics, Python, Advanced Statistics in Python, Machine and Deep Learning",4.6,151551,All Levels,523 lectures,32 total hours,Current price: $124.99
big data,https://www.udemy.com/course/data-science-in-python-unsupervised-learning/,https://img-c.udemycdn.com/course/240x135/5930252_06be_6.jpg,"Maven Analytics • 1,500,000 Learners, Alice Zhao",Python Data Science: Unsupervised Machine Learning,"Learn Python for data science & machine learning, and build unsupervised learning models w/ a top Python instructor!",4.7,187,All Levels,202 lectures,17 total hours,Current price: $84.99
big data,https://www.udemy.com/course/data-science-using-machine-learning-algorithm-with-big-data_2/,https://img-c.udemycdn.com/course/240x135/3742624_91c8.jpg,Piyushh n Dave9,Data Science using Machine Learning Algorithm with Big Data,Data Science and Data Analytics of Big Data with Machine Learning Algorithms,4.4,32,All Levels,74 lectures,12.5 total hours,Current price: $54.99
big data,https://www.udemy.com/course/aws-data-engineer/,https://img-c.udemycdn.com/course/240x135/5591620_4e46_2.jpg,"Sundog Education by Frank Kane, Frank Kane, Stephane Maarek | AWS Certified Cloud Practitioner,Solutions Architect,Developer",AWS Certified Data Engineer Associate 2025 - Hands On!,"AWS DEA-C01 certification prep course with exercises and a full-length practice exam. Redshift, Glue, Athena, and more",4.6,7915,Intermediate,289 lectures,22 total hours,Current price: $94.99
big data,https://www.udemy.com/course/bigquery/,https://img-c.udemycdn.com/course/240x135/3563469_0dc3_3.jpg,J Garg - Real Time Learning,BigQuery for Big data engineers - Master Big Query Internals,"A Complete deep knowledge BigQuery guide for Data engineers and Analysts. Hands-On Bigquery via Console, CLI, Python lib",4.5,3207,All Levels,105 lectures,9 total hours,Current price: $84.99
big data,https://www.udemy.com/course/an-introduction-to-machine-learning-for-data-engineers/,https://img-c.udemycdn.com/course/240x135/1333372_08d9_3.jpg,Mike West,An Introduction to Machine Learning for Data Engineers,A Prerequisite for Tensorflow on Google's Cloud Platform for Data Engineers,4.5,4325,Beginner,46 lectures,,Current price: $64.99
big data,https://www.udemy.com/course/data-science-and-machine-learning-fundamentals-one/,https://img-c.udemycdn.com/course/240x135/5160648_d59a_4.jpg,Henrik Johansson,Data Science and Machine Learning Fundamentals [2025],Learn to master Data Science and Machine Learning Fundamentals with Python and Pandas,4.8,529,All Levels,103 lectures,54.5 total hours,Current price: $19.99
big data,https://www.udemy.com/course/python-for-data-science-and-machine-learning-bootcamp/,https://img-c.udemycdn.com/course/240x135/903744_8eb2.jpg,"Jose Portilla, Pierian Training",Python for Data Science and Machine Learning Bootcamp,"Learn how to use NumPy, Pandas, Seaborn , Matplotlib , Plotly , Scikit-Learn , Machine Learning, Tensorflow , and more!",4.6,150162,All Levels,165 lectures,25 total hours,Current price: $119.99
big data,https://www.udemy.com/course/the-data-engineer-bootcamp/,https://img-c.udemycdn.com/course/240x135/6450865_98e6.jpg,365 Careers,The Data Engineer Bootcamp 2025,"Master Data Engineering, Build Scalable Pipelines, and Land a High-Paying Job. Learn with a Silicon Valley Data Engineer",4.7,49,All Levels,115 lectures,8 total hours,Current price: $54.99
big data,https://www.udemy.com/course/data-science-and-machine-learning-with-python-hands-on/,https://img-c.udemycdn.com/course/240x135/671576_a272_4.jpg,"Sundog Education by Frank Kane, Frank Kane, Sundog Education Team","Machine Learning, Data Science and Generative AI with Python","Complete hands-on machine learning and GenAI tutorial with data science, Tensorflow, GPT, OpenAI, and neural networks",4.5,34629,Beginner,146 lectures,20 total hours,Current price: $124.99
