skill,link,image_link,partner,title,course_description,rating,num_review,difficulty,num_lecture,duration,price
airflow,https://www.udemy.com/course/aws-certified-machine-learning-engineer-associate-mla-c01/,https://img-c.udemycdn.com/course/240x135/6125705_2219.jpg,"Sundog Education by Frank Kane, Stephane Maarek | AWS Certified Cloud Practitioner,Solutions Architect,Developer, Frank Kane",AWS Certified Machine Learning Engineer Associate: Hands On!,"Practice exam included! Master MLA-C01 / ME1-C01 AWS Machine Learning Engineer Exam: SageMaker, Bedrock, and AI Skills.",4.6,1747,All Levels,294 lectures,23.5 total hours,Current price: $89.99
airflow,https://www.udemy.com/course/the-complete-hands-on-course-to-master-apache-airflow/,https://img-c.udemycdn.com/course/240x135/1919064_e7a7_7.jpg,Marc Lamberti,The Complete Hands-On Introduction to Apache Airflow,"Learn to author, schedule and monitor data pipelines through practical examples using Apache Airflow",4.5,11872,All Levels,104 lectures,4 total hours,Current price: $79.99
airflow,https://www.udemy.com/course/practice-exams-aws-certified-machine-learning-engineer-associate/,https://img-c.udemycdn.com/course/240x135/6139021_a896.jpg,"Stephane Maarek | AWS Certified Cloud Practitioner,Solutions Architect,Developer, Abhishek Singh",Practice Exams: AWS Machine Learning Engineer Associate Cert,Prepare for AWS Certified Machine Learning Engineer Associate. 195 high-quality test questions and detailed explanations,4.6,306,All Levels,195 questions,,Current price: $64.99
airflow,https://www.udemy.com/course/the-ultimate-hands-on-course-to-master-apache-airflow/,https://img-c.udemycdn.com/course/240x135/2504438_c857_2.jpg,Marc Lamberti,Apache Airflow: The Hands-On Guide,"Master Apache Airflow from A to Z. Hands-on videos on Airflow with AWS, Kubernetes, Docker and more",4.4,4825,All Levels,101 lectures,11 total hours,Current price: $84.99
airflow,https://www.udemy.com/course/aws-certified-machine-learning-engineer-associate-mla-c01-exam-prep/,https://img-c.udemycdn.com/course/240x135/6188041_95ae.jpg,Nikolai Schuler,AWS Certified Machine Learning Engineer - Associate MLA-C01,The ONLY course you need to PASS the AWS Certified Machine Learning Engineer Exam | MLA-C01 | Incl. FULL Practice Exam!,4.6,263,All Levels,252 lectures,26.5 total hours,Current price: $89.99
airflow,https://www.udemy.com/course/complete-machine-learning-nlp-bootcamp-mlops-deployment/,https://img-c.udemycdn.com/course/240x135/5993822_2c2a_7.jpg,"Krish Naik, KRISHAI Technologies Private Limited","Complete Data Science,Machine Learning,DL,NLP Bootcamp","Master the theory, practice,and math behind Data Science,Machine Learning,Deep Learning,NLP with end to end projects",4.5,11296,All Levels,429 lectures,99 total hours,Current price: $94.99
airflow,https://www.udemy.com/course/google-cloud-machine-learning-engineer-certification-prep/,https://img-c.udemycdn.com/course/240x135/4878666_74ed_3.jpg,"Dan Sullivan, Dan Sullivan",Google Cloud Machine Learning Engineer Certification Prep,"Building, Deploying, and Managing Machine Learning Services at Scale",4.4,1213,All Levels,71 lectures,5.5 total hours,Current price: $69.99
airflow,https://www.udemy.com/course/machine-learning-using-azureml/,https://img-c.udemycdn.com/course/240x135/1088256_077d_2.jpg,"Jitesh Khurkhuriya, Python, Data Science & Machine Learning A-Z Team",DP-100: A-Z Machine Learning using Azure Machine Learning,Microsoft Azure DP-100: Designing and Implementing a Data Science Solution Exam Covered. Learn Azure Machine Learning,4.4,7796,All Levels,230 lectures,26.5 total hours,Current price: $124.99
airflow,https://www.udemy.com/course/google-certified-professional-machine-learning-engineer/,https://img-c.udemycdn.com/course/240x135/5211228_899a_3.jpg,Deepak Dubey,Google Certified Professional Machine Learning Engineer,"Master ML Algorithms, Data Modeling, TensorFlow & Google Cloud AI/ML Services. 137 Questions, Answers with Explanations",4.1,223,All Levels,63 lectures,16.5 total hours,Current price: $79.99
airflow,https://www.udemy.com/course/aws-machine-learning/,https://img-c.udemycdn.com/course/240x135/2529790_a0c6_9.jpg,"Sundog Education by Frank Kane, Stephane Maarek | AWS Certified Cloud Practitioner,Solutions Architect,Developer, Frank Kane, Sundog Education Team",AWS Certified Machine Learning Specialty 2025 - Hands On!,"AWS machine learning certification preparation - learn SageMaker, generative AI, data engineering, modeling & more",4.6,15104,Intermediate,167 lectures,15 total hours,Current price: $119.99
airflow,https://www.udemy.com/course/apache-airflow/,https://img-c.udemycdn.com/course/240x135/2699438_873d_4.jpg,A to Z Mentors,Apache Airflow | A Real-Time & Hands-On Course on Airflow,"Learn A to Z of Apache Airflow from Basic to ADVANCE level, deploy workflows & data pipelines using Airflow with Docker",4.5,2453,All Levels,63 lectures,6 total hours,Current price: $69.99
airflow,https://www.udemy.com/course/apache-airflow-the-operators-guide/,https://img-c.udemycdn.com/course/240x135/3404110_24d1.jpg,Marc Lamberti,Apache Airflow: The Operators Guide,Step up with Apache Airflow! Master Airflow Operators and create incredible data pipelines!,4.6,413,All Levels,56 lectures,7.5 total hours,Current price: $84.99
airflow,https://www.udemy.com/course/the-ai-engineer-course-complete-ai-engineer-bootcamp/,https://img-c.udemycdn.com/course/240x135/6112535_7103.jpg,365 Careers,The AI Engineer Course 2025: Complete AI Engineer Bootcamp,"Complete AI Engineer Training: Python, NLP, Transformers, LLMs, LangChain, Hugging Face, APIs",4.6,2803,All Levels,367 lectures,24.5 total hours,Current price: $89.99
airflow,https://www.udemy.com/course/machine-learning-with-google-cloud/,https://img-c.udemycdn.com/course/240x135/4923094_d761_5.jpg,"Ankit Mistry : 150,000+ Students, GCP Certification - Google Cloud Academy | Associate Cloud & Professional Engineer Certifications",Vertex AI | Gemini | Generative AI - GCP Machine learning,Learn How to Apply Google Cloud Vertex AI Machine Learning Products for your own ML Application Training  & Prediction,4.3,964,All Levels,109 lectures,12.5 total hours,Current price: $64.99
airflow,https://www.udemy.com/course/an-introduction-to-machine-learning-for-data-engineers/,https://img-c.udemycdn.com/course/240x135/1333372_08d9_3.jpg,Mike West,An Introduction to Machine Learning for Data Engineers,A Prerequisite for Tensorflow on Google's Cloud Platform for Data Engineers,4.5,4325,Beginner,46 lectures,,Current price: $64.99
airflow,https://www.udemy.com/course/complete-machine-learning-and-data-science-zero-to-mastery/,https://img-c.udemycdn.com/course/240x135/2511476_4e38_5.jpg,"Andrei Neagoie, Daniel Bourke","Complete A.I. & Machine Learning, Data Science Bootcamp","Learn Data Science, Data Analysis, Machine Learning (Artificial Intelligence) and Python with Tensorflow, Pandas & more!",4.6,26310,All Levels,384 lectures,44 total hours,Current price: $119.99
airflow,https://www.udemy.com/course/aws-machine-learning-engineer-associate-practice-exams/,https://img-c.udemycdn.com/course/240x135/6203243_dd68.jpg,Nikolai Schuler,Practice Exams | AWS Machine Learning Engineer - Associate,ACE the AWS Certified Machine Learning Engineer Associate Exam MLA-C01 | Full Practice Exam Sets + Detailed Explanations,4.4,57,All Levels,260 questions,,Current price: $69.99
airflow,https://www.udemy.com/course/become-an-aws-machine-learning-engineer-in-30-days-new-2022/,https://img-c.udemycdn.com/course/240x135/4579406_6c5e_10.jpg,Dr. Ryan Ahmed | 400K+ Students | Best-Selling Professor | 250K+ YouTube,AWS SageMaker Machine Learning Engineer in 30 Days + ChatGPT,"Build 30+ ML Projects in 30 Days in AWS, Master SageMaker JumpStart, Canvas, AutoPilot, DataWrangler, Lambda & S3",4.4,1055,Beginner,481 lectures,43 total hours,Current price: $99.99
airflow,https://www.udemy.com/course/databricks-machine-learning/,https://img-c.udemycdn.com/course/240x135/5279024_9dc7.jpg,"Ankit Mistry : 150,000+ Students, Vijay Gadhave, Ajay Gadhave",Databricks Certified Machine Learning Associate Exam Guide,Pass Databricks Certified Machine Learning Associate Certification with 10+ Hours of HD Quality Video & Lots of Hands-on,4.3,547,All Levels,124 lectures,16 total hours,Current price: $79.99
airflow,https://www.udemy.com/course/apache-airflow-course/,https://img-c.udemycdn.com/course/240x135/3202430_b1d3.jpg,Alexandra Abbas,Apache Airflow: Complete Hands-On Beginner to Advanced Class,Learn Apache Airflow step-by-step. Real-Life Data Pipelines & Quizzes Included. Learn by Doing!,4.0,438,Beginner,54 lectures,5 total hours,Current price: $64.99
