skill,link,image_link,partner,title,course_description,rating,num_review,difficulty,num_lecture,duration,price
machine learning,https://www.udemy.com/course/aws-certified-machine-learning-engineer-associate-mla-c01/,https://img-c.udemycdn.com/course/240x135/6125705_2219.jpg,"Sundog Education by Frank Kane, Stephane Maarek | AWS Certified Cloud Practitioner,Solutions Architect,Developer, Frank Kane",AWS Certified Machine Learning Engineer Associate: Hands On!,"Practice exam included! Master MLA-C01 / ME1-C01 AWS Machine Learning Engineer Exam: SageMaker, Bedrock, and AI Skills.",4.6,1747,All Levels,294 lectures,23.5 total hours,Current price: $89.99
machine learning,https://www.udemy.com/course/practice-exams-aws-certified-machine-learning-engineer-associate/,https://img-c.udemycdn.com/course/240x135/6139021_a896.jpg,"Stephane Maarek | AWS Certified Cloud Practitioner,Solutions Architect,Developer, Abhishek Singh",Practice Exams: AWS Machine Learning Engineer Associate Cert,Prepare for AWS Certified Machine Learning Engineer Associate. 195 high-quality test questions and detailed explanations,4.6,306,All Levels,195 questions,,Current price: $64.99
machine learning,https://www.udemy.com/course/aws-certified-machine-learning-engineer-associate-mla-c01-exam-prep/,https://img-c.udemycdn.com/course/240x135/6188041_95ae.jpg,Nikolai Schuler,AWS Certified Machine Learning Engineer - Associate MLA-C01,The ONLY course you need to PASS the AWS Certified Machine Learning Engineer Exam | MLA-C01 | Incl. FULL Practice Exam!,4.6,263,All Levels,252 lectures,26.5 total hours,Current price: $89.99
machine learning,https://www.udemy.com/course/google-cloud-machine-learning-engineer-certification-prep/,https://img-c.udemycdn.com/course/240x135/4878666_74ed_3.jpg,"Dan Sullivan, Dan Sullivan",Google Cloud Machine Learning Engineer Certification Prep,"Building, Deploying, and Managing Machine Learning Services at Scale",4.4,1213,All Levels,71 lectures,5.5 total hours,Current price: $69.99
machine learning,https://www.udemy.com/course/complete-machine-learning-nlp-bootcamp-mlops-deployment/,https://img-c.udemycdn.com/course/240x135/5993822_2c2a_7.jpg,"Krish Naik, KRISHAI Technologies Private Limited","Complete Data Science,Machine Learning,DL,NLP Bootcamp","Master the theory, practice,and math behind Data Science,Machine Learning,Deep Learning,NLP with end to end projects",4.5,11296,All Levels,429 lectures,99 total hours,Current price: $94.99
machine learning,https://www.udemy.com/course/complete-machine-learning-and-data-science-zero-to-mastery/,https://img-c.udemycdn.com/course/240x135/2511476_4e38_5.jpg,"Andrei Neagoie, Daniel Bourke","Complete A.I. & Machine Learning, Data Science Bootcamp","Learn Data Science, Data Analysis, Machine Learning (Artificial Intelligence) and Python with Tensorflow, Pandas & more!",4.6,26310,All Levels,384 lectures,44 total hours,Current price: $119.99
machine learning,https://www.udemy.com/course/google-certified-professional-machine-learning-engineer/,https://img-c.udemycdn.com/course/240x135/5211228_899a_3.jpg,Deepak Dubey,Google Certified Professional Machine Learning Engineer,"Master ML Algorithms, Data Modeling, TensorFlow & Google Cloud AI/ML Services. 137 Questions, Answers with Explanations",4.1,223,All Levels,63 lectures,16.5 total hours,Current price: $79.99
machine learning,https://www.udemy.com/course/google-professional-machine-learning-gcp-practice-exams/,https://img-c.udemycdn.com/course/240x135/6399753_e170_2.jpg,Cloud Masters,Google Professional Machine Learning (GCP) | Practice Exams,"Master Google Cloud Professional Machine Learning Engineer certification : Real Exam Practice, Key Concepts in AI Models",5.0,1,All Levels,300 questions,,Current price: $44.99
machine learning,https://www.udemy.com/course/an-introduction-to-machine-learning-for-data-engineers/,https://img-c.udemycdn.com/course/240x135/1333372_08d9_3.jpg,Mike West,An Introduction to Machine Learning for Data Engineers,A Prerequisite for Tensorflow on Google's Cloud Platform for Data Engineers,4.5,4325,Beginner,46 lectures,,Current price: $64.99
machine learning,https://www.udemy.com/course/aws-machine-learning/,https://img-c.udemycdn.com/course/240x135/2529790_a0c6_9.jpg,"Sundog Education by Frank Kane, Stephane Maarek | AWS Certified Cloud Practitioner,Solutions Architect,Developer, Frank Kane, Sundog Education Team",AWS Certified Machine Learning Specialty 2025 - Hands On!,"AWS machine learning certification preparation - learn SageMaker, generative AI, data engineering, modeling & more",4.6,15104,Intermediate,167 lectures,15 total hours,Current price: $119.99
machine learning,https://www.udemy.com/course/aws-machine-learning-engineer-associate-practice-exams/,https://img-c.udemycdn.com/course/240x135/6203243_dd68.jpg,Nikolai Schuler,Practice Exams | AWS Machine Learning Engineer - Associate,ACE the AWS Certified Machine Learning Engineer Associate Exam MLA-C01 | Full Practice Exam Sets + Detailed Explanations,4.4,57,All Levels,260 questions,,Current price: $69.99
machine learning,https://www.udemy.com/course/google-professional-machine-learning-engineer-test/,https://img-c.udemycdn.com/course/240x135/5863408_5446.jpg,IT Education Hub,Google Professional Machine Learning Engineer Test 2025,Prepare for your Google Cloud Certified Professional Machine Learning Engineer certification exam (Verified QA),5.0,1,All Levels,175 questions,,Current price: $19.99
machine learning,https://www.udemy.com/course/gcp-ml-engineer-exams-2024/,https://img-c.udemycdn.com/course/240x135/5702662_bf13.jpg,Exam Questions,Google Cloud Professional Machine Learning Engineer Exams,Prepare for the Google Cloud Certified Professional Machine Learning Engineer exam with 500 sample questions and a mock,4.5,3,Intermediate,555 questions,,Current price: $19.99
machine learning,https://www.udemy.com/course/machinelearning/,https://img-c.udemycdn.com/course/240x135/950390_270f_3.jpg,"Kirill Eremenko, Hadelin de Ponteves, SuperDataScience Team, Ligency Team","Machine Learning A-Z: AI, Python & R + ChatGPT Prize [2025]",Learn to create Machine Learning Algorithms in Python and R from two Data Science experts. Code templates included.,4.5,195572,All Levels,386 lectures,43 total hours,Current price: $149.99
machine learning,https://www.udemy.com/course/google-professional-machine-learning-certification-exam-2023/,https://img-c.udemycdn.com/course/240x135/5482100_19a3_2.jpg,Marc Caps,Google Professional Machine Learning Certification Exam 2025,"Professional Machine Learning Engineer practice exam certification with scenario based questions, detailed explanations",4.0,35,All Levels,234 questions,,Current price: $64.99
machine learning,https://www.udemy.com/course/google-professional-machine-learning-engineer-exams/,https://img-c.udemycdn.com/course/240x135/5643342_1ed6.jpg,Paweł Krakowiak,Google Professional Machine Learning Engineer - Mock Exams,Comprehensive Mock Exams to Prepare You for Google Professional Machine Learning Engineer Certification!,4.0,9,,Expert,,Current price: $19.99
machine learning,https://www.udemy.com/course/aws-certified-machine-learning-engineer-certified/,https://img-c.udemycdn.com/course/240x135/6206299_e969_2.jpg,Kumar Mishra,AWS Certified Machine Learning Engineer Associate| (Jan-25),Validate your skills in machine learning on AWS through this exam.,5.0,1,All Levels,413 questions,,Current price: $19.99
machine learning,https://www.udemy.com/course/google-professional-machine-learning-engineer-certification-test/,https://img-c.udemycdn.com/course/240x135/6051553_556c_2.jpg,Algoholic.pro ™,Professional Machine Learning Engineer - 2025,Pass Google Machine Learning Engineer in 1 Attempt by mastering ML deployment and operations principles,3.5,7,All Levels,346 questions,,Current price: $49.99
machine learning,https://www.udemy.com/course/become-an-aws-machine-learning-engineer-in-30-days-new-2022/,https://img-c.udemycdn.com/course/240x135/4579406_6c5e_10.jpg,Dr. Ryan Ahmed | 400K+ Students | Best-Selling Professor | 250K+ YouTube,AWS SageMaker Machine Learning Engineer in 30 Days + ChatGPT,"Build 30+ ML Projects in 30 Days in AWS, Master SageMaker JumpStart, Canvas, AutoPilot, DataWrangler, Lambda & S3",4.4,1055,Beginner,481 lectures,43 total hours,Current price: $99.99
machine learning,https://www.udemy.com/course/practice-exams-aws-certified-machine-learning-mla-c01/,https://img-c.udemycdn.com/course/240x135/6277145_55fc_10.jpg,Marlon Anesi | Python | AI | DevOps | AWS Certified Architect,Practice Exams - Ace AWS Certified Machine Learning MLA-C01,Pass in AWS Certified MLA-C01 exam! Study with 390 Practice Questions + Objective explanations for each answer!,4.6,136,Intermediate,390 questions,,Current price: $69.99
