skill,link,image_link,partner,title,course_description,rating,num_review,difficulty,num_lecture,duration,price
data analysis,https://www.udemy.com/course/data-analysis-projects-using-sql-power-bi-tableau-excel/,https://img-c.udemycdn.com/course/240x135/5349390_888b_5.jpg,Graeme Gordon,"Data Analysis | SQL,Tableau,Power BI & Excel | Real Projects",4-in-1 bundle: Practical learning of the essential tools used in Data Science with hands on examples and projects,4.5,3091,All Levels,120 lectures,12 total hours,Current price: $89.99
data analysis,https://www.udemy.com/course/the-data-analyst-course-complete-data-analyst-bootcamp/,https://img-c.udemycdn.com/course/240x135/3570337_9b02_6.jpg,365 Careers,The Data Analyst Course: Complete Data Analyst Bootcamp,"Complete Data Analyst Training: Python, NumPy, Pandas, Data Collection, Preprocessing, Data Types, Data Visualization",4.5,21135,All Levels,282 lectures,21.5 total hours,Current price: $149.99
data analysis,https://www.udemy.com/course/project-management-with-chatgpt/,https://img-c.udemycdn.com/course/240x135/5534098_a35c_5.jpg,Tobias Becker,Project Management with ChatGPT: AI for Project Managers,Master Modern Project Management with AI. A Comprehensive Guide to Use Chat GPT for Project Managers (+ 42 Prompts),4.4,4678,Beginner,29 lectures,2.5 total hours,Current price: $19.99
data analysis,https://www.udemy.com/course/data-analyst-professional-certificate-in-data-analysis/,https://img-c.udemycdn.com/course/240x135/6300333_97a2.jpg,"MTF Institute of Management, Technology and Finance",Data Analyst: Professional Certificate in Data Analysis,"Data Based Decision Making, Data Analysis. Data Collection, Cleaning, Statistical Analysis, Visualisation, Privacy.",4.6,366,All Levels,236 lectures,19 total hours,Current price: $69.99
data analysis,https://www.udemy.com/course/data-analytics-for-project-management/,https://img-c.udemycdn.com/course/240x135/5807618_5269.jpg,Start-Tech Academy,Data Analytics for Project Management,Master Data Analytics in Project Management: Drive success with KPIs & dashboards using Excel,4.6,421,Beginner,38 lectures,3 total hours,Current price: $59.99
data analysis,https://www.udemy.com/course/complete-data-analyst-bootcamp-from-basics-to-advanced/,https://img-c.udemycdn.com/course/240x135/6074041_36f4_3.jpg,"Krish Naik, Jayant Topnani, KRISHAI Technologies Private Limited",Complete Data Analyst Bootcamp From Basics To Advanced,"Master Data Analysis: Python, Statistics, EDA, Feature Engineering, Power BI, and SQL Server,Snowflake,AWS",4.5,4995,All Levels,407 lectures,71.5 total hours,Current price: $79.99
data analysis,https://www.udemy.com/course/the-data-science-course-complete-data-science-bootcamp/,https://img-c.udemycdn.com/course/240x135/1754098_e0df_3.jpg,365 Careers,The Data Science Course: Complete Data Science Bootcamp 2025,"Complete Data Science Training: Math, Statistics, Python, Advanced Statistics in Python, Machine and Deep Learning",4.6,151551,All Levels,523 lectures,32 total hours,Current price: $124.99
data analysis,https://www.udemy.com/course/python-foundations-for-data-analysis/,https://img-c.udemycdn.com/course/240x135/4616694_f947_4.jpg,"Maven Analytics • 1,500,000 Learners, Chris Bruehl",Python for Data Analysis & Business Intelligence,"Learn Python for data analysis & business intelligence, w/ real-world projects from a top Python data science instructor",4.6,1686,All Levels,226 lectures,11.5 total hours,Current price: $84.99
data analysis,https://www.udemy.com/course/up-running-with-tableau-desktop/,https://img-c.udemycdn.com/course/240x135/3175270_76b2_9.jpg,"Maven Analytics • 1,500,000 Learners, Dustin Cabral | Tableau & Data Visualization Expert",Tableau Desktop for Data Analysis & Data Visualization,"Learn Tableau Desktop for data analysis, visualization & dashboard design, and build fun Tableau projects & dashboards!",4.5,3126,All Levels,98 lectures,10.5 total hours,Current price: $119.99
data analysis,https://www.udemy.com/course/python-mysql-chatgpt-tableau-with-data-analysis-projects/,https://img-c.udemycdn.com/course/240x135/5874984_3d2b_17.jpg,Graeme Gordon,"Data Analyst in Python, Tableau, SQL & ChatGPT with Projects","4 in 1 Bundle - Data Analytics with Python, SQL, ChatGPT projects. Prepare for the Tableau Data Analyst Certification.",4.7,355,All Levels,199 lectures,21.5 total hours,Current price: $84.99
data analysis,https://www.udemy.com/course/data-analysis-real-world-use-cases-hands-on-python/,https://img-c.udemycdn.com/course/240x135/3819580_9b6d.jpg,Shan Singh,Data Analysis Real world use-cases- Hands on Python,"Build a Portfolio of 5 Data Analysis Projects with Python, Seaborn,Pandas,Plotly, numpy etc  & get a job of Data Analyst",4.6,1095,All Levels,52 lectures,7.5 total hours,Current price: $59.99
data analysis,https://www.udemy.com/course/python-for-data-analysis-with-practical-projects/,https://img-c.udemycdn.com/course/240x135/6039256_7cbd_4.jpg,Manuel Ernesto Cambota,Python for Data Analysis with Practical Projects,"Learn Data Analysis with Projects in Python using  Seaborn,Pandas,Plotly, Numpy and become expert Data Analyst",4.6,4,All Levels,39 lectures,7 total hours,Current price: $29.99
data analysis,https://www.udemy.com/course/python-for-data-analysis-projects-to-power-your-resume/,https://img-c.udemycdn.com/course/240x135/5692908_779d.jpg,Dee Naidoo,Python for Data Analysis: Projects to Power Your Resume,"Master Python for Data Analysis: Dive into Pandas, Visualization, and Real-World Projects to add to your Resume!",4.4,25,All Levels,68 lectures,9.5 total hours,Current price: $19.99
data analysis,https://www.udemy.com/course/the-complete-introduction-to-business-data-analysis/,https://img-c.udemycdn.com/course/240x135/540450_d09d_10.jpg,Ian Littlejohn,Complete Introduction to Business Data Analysis,Move beyond basic reports and learn data analysis.  Easily turn data into insight and intelligence with Microsoft Excel,4.6,20779,All Levels,53 lectures,3.5 total hours,Current price: $99.99
data analysis,https://www.udemy.com/course/data-analytics-career-track/,https://img-c.udemycdn.com/course/240x135/5787046_e749_10.jpg,Shahriar's Sight Academy,Data Analytics Career Path: 72 Days of Data Analyst Bootcamp,"Learn Excel, MySQL, Python, PowerBI, ChatGPT for A-Z Data Analysis. Become a Full-Packed Data Analyst. [5 Courses in 1]",4.3,958,All Levels,359 lectures,34.5 total hours,Current price: $79.99
data analysis,https://www.udemy.com/course/mastering-the-art-of-data-visualization-2020/,https://img-c.udemycdn.com/course/240x135/3002664_21f4_7.jpg,Joshua Brindley,Data Storytelling and Data Visualization Mastery,"Learn the crucial skills to effectively communicate, persuade, and drive decisions with data",4.5,10452,All Levels,30 lectures,6 total hours,Current price: $119.99
data analysis,https://www.udemy.com/course/data-analysis-for-beginners/,https://img-c.udemycdn.com/course/240x135/5891024_5cce_2.jpg,Matthew Walcott,Data Analysis for Beginners,"Learn the exact technical skills in Excel, Power BI and SQL that you need to land your first job as a Data Analyst",4.5,276,All Levels,118 lectures,4.5 total hours,Current price: $84.99
data analysis,https://www.udemy.com/course/pmp-certification-exam-prep-course-pmbok-6th-edition/,https://img-c.udemycdn.com/course/240x135/1759114_873a_13.jpg,"TIA Education, Andrew Ramdayal",PMP Certification Exam Prep Course 35 PDU Contact Hours/PDU,Get your PMP Certification with this course. Fully updated for the Current PMP Exam,4.7,124008,All Levels,364 lectures,35 total hours,Current price: $119.99
data analysis,https://www.udemy.com/course/data-analytics-masters-basics-to-advanced/,https://img-c.udemycdn.com/course/240x135/5182120_a68b.jpg,"Satyajit Pattnaik, Zep Tech Solutions",Data Analytics Masters - From Basics To Advanced,"Master Data Analysis: Learn Python, EDA, Stats,  MS Excel, SQL, Power BI, Tableau, Predictive Analytics & ETL Basics",4.3,738,Beginner,274 lectures,49.5 total hours,Current price: $74.99
data analysis,https://www.udemy.com/course/the-microsoft-excel-data-analysis-toolkit-bundle/,https://img-c.udemycdn.com/course/240x135/3833982_2291.jpg,Simon Sez IT,The Microsoft Excel Data Analysis Toolkit Bundle,Conquer data analysis in Excel with five comprehensive Excel courses in one,4.7,884,Intermediate,255 lectures,33 total hours,Current price: $84.99
