skill,link,image_link,partner,title,course_description,rating,num_review,difficulty,num_lecture,duration,price
salesforce.com,https://www.udemy.com/course/the-project-management-course-beginner-to-project-manager/,https://img-c.udemycdn.com/course/240x135/1978132_e90d_5.jpg,365 Careers,The Project Management Course: Beginner to PROject Manager,The Complete Course For Becoming A Successful Project Manager,4.6,74024,All Levels,109 lectures,8 total hours,Current price: $119.99
salesforce.com,https://www.udemy.com/course/project-management-with-chatgpt/,https://img-c.udemycdn.com/course/240x135/5534098_a35c_5.jpg,Tobias Becker,Project Management with ChatGPT: AI for Project Managers,Master Modern Project Management with AI. A Comprehensive Guide to Use Chat GPT for Project Managers (+ 42 Prompts),4.4,4678,Beginner,29 lectures,2.5 total hours,
salesforce.com,https://www.udemy.com/course/a-project-management-course-becoming-a-project-manager/,https://img-c.udemycdn.com/course/240x135/6049011_94c0_2.jpg,Providence Essien,A project management course: Becoming a PROject Manager,The Complete Course you need to Becoming a Successful PROject Manager,4.7,200,All Levels,10 lectures,1.5 total hours,
salesforce.com,https://www.udemy.com/course/project-management-with-gen-ai-a-guide-for-project-managers/,https://img-c.udemycdn.com/course/240x135/6488353_f0c1.jpg,AI MENTOR,Project Management with Gen AI: A Guide for Project Managers,"Learn Project Management with Generative AI to optimize workflows, automate tasks & drive Success in Project Management",4.5,90,All Levels,17 lectures,2 total hours,
salesforce.com,https://www.udemy.com/course/agile-scrum-project-management-with-salesforce-examples/,https://img-c.udemycdn.com/course/240x135/2356892_8cbf_2.jpg,Derek Davis,Salesforce Agile Scrum Project Management,Agile Scrum for Salesforce: The Ultimate Salesforce Scrum Course with Practical Examples and Hands On Training,4.3,74,All Levels,27 lectures,2 total hours,Current price: $59.99
salesforce.com,https://www.udemy.com/course/zero-to-hero-with-real-time-salesforcelwc-projects/,https://img-c.udemycdn.com/course/240x135/4898522_cb32.jpg,Salesforce troop,Build 7 Real-Time Salesforce(LWC) Projects,Go from Basics to Advance LWC with 7 real-time projects,4.5,986,Intermediate,120 lectures,17 total hours,Current price: $84.99
salesforce.com,https://www.udemy.com/course/project-management-basics-for-non-project-managers/,https://img-c.udemycdn.com/course/240x135/5724764_1da6_3.jpg,Robert Hean,Project Management Basics for Non-Project Managers,Learn how Agile and Waterfall projects work | Includes ALL Phases of Projects | NO experience needed,4.6,791,All Levels,15 lectures,1.5 total hours,
salesforce.com,https://www.udemy.com/course/salesforce-data-cloud-consultant-training-basics/,https://img-c.udemycdn.com/course/240x135/5973230_bd2c_4.jpg,Salesforce God,Salesforce Data Cloud Consultant: Hands-On Project Training,A Practical Guide to Getting Started with Salesforce Data Cloud Solutions Consultant with hands on project led training.,4.3,186,Beginner,13 lectures,7 total hours,
salesforce.com,https://www.udemy.com/course/monday-project-management-software/,https://img-c.udemycdn.com/course/240x135/3434284_384b_4.jpg,George Smarts,Monday - Project Management - The Complete Beginners Course,Learn Monday quickly. Become a better team and project manager. Add another project management skill to your CV,4.6,3146,Beginner,51 lectures,4 total hours,Current price: $84.99
salesforce.com,https://www.udemy.com/course/microsoft-project-tutorial/,https://img-c.udemycdn.com/course/240x135/831116_92e7_2.jpg,Srikanth Shirodkar,Microsoft Project ALL: BEGINNER to EXPERT 10 Projects 9 PDU,Learn MS Project all version HANDS-ON with COMPLETE real life examples BONUS 125 project files FREE PMI approved 9 PDUs,4.6,21952,All Levels,139 lectures,10.5 total hours,
salesforce.com,https://www.udemy.com/course/atlassian-confluence-training-project-management/,https://img-c.udemycdn.com/course/240x135/2573662_3be7_2.jpg,Andy Makar,Atlassian Confluence for Project Managers,Learn Confluence Project Management and how to manage projects and programs BETTER with Atlassian Confluence,4.5,4140,All Levels,38 lectures,3 total hours,Current price: $69.99
salesforce.com,https://www.udemy.com/course/project-management-mastery/,https://img-c.udemycdn.com/course/240x135/1918248_ad2f.jpg,Chris Croft,Project Management for Non Project Managers - PMP/PMI,Project Management practical guide for all industries,4.6,14699,All Levels,29 lectures,2.5 total hours,Current price: $109.99
salesforce.com,https://www.udemy.com/course/salesforce-admin-project-master-class-for-beginners/,https://img-c.udemycdn.com/course/240x135/6199871_dba2.jpg,Swapna 15 X Salesforce Certified Technical Architect,Salesforce Admin Project Master Class for Beginners,Become Master in Salesforce Admin Skills : Understand Salesforce Admin Project Flow  Pass Salesforce Admin Exam Easily,4.7,21,All Levels,8 lectures,8 total hours,
salesforce.com,https://www.udemy.com/course/project-management-complete-guide-for-a-project-managers/,https://img-c.udemycdn.com/course/240x135/4663650_39fa_9.jpg,"Peter Alkema, Regenesys Business School",Project Management - Complete Guide For A+ Project Managers,"Complete guide to project management - stakeholders, planning, cost, quality, risks, feasibility, methods & resourcing",4.4,793,All Levels,454 lectures,28 total hours,Current price: $74.99
salesforce.com,https://www.udemy.com/course/hybrid-project-management/,https://img-c.udemycdn.com/course/240x135/3722014_e0c0.jpg,Janet Burns,Hybrid Project Management for Project Managers,Agile? Waterfall? Why not both? Learn the benefits of these approaches to develop your own recipe for project success.,4.5,2772,Intermediate,22 lectures,,Current price: $39.99
salesforce.com,https://www.udemy.com/course/practical-project-management/,https://img-c.udemycdn.com/course/240x135/505136_007c_6.jpg,Mike Clayton,Practical Project Management for Managers and First Time PMs,"Learn Project management so you can deliver your next project be on time, on budget, and to requirements.",4.4,5086,Beginner,31 lectures,3.5 total hours,Current price: $59.99
salesforce.com,https://www.udemy.com/course/project-management-ai/,https://img-c.udemycdn.com/course/240x135/6204327_7fe0_4.jpg,"TIA Education, Andrew Ramdayal",Complete Project Manager's Practical Guide to Using AI 8 PDU,"Using GenAI to Boost Productivity, ChatGPT, Prompt Engineering From Amazon Bestselling PM Author",4.6,1396,Beginner,78 lectures,7 total hours,
salesforce.com,https://www.udemy.com/course/microsoft-project-for-civil-engineers-learn-2-live-projects/,https://img-c.udemycdn.com/course/240x135/5628573_a072_7.jpg,Akshay Kamath,Microsoft Project for Project Manager & Civil Engineers -MSP,[2024 ] Only Course With Live Project [23 Hours] on MS Project for Project Planning & Project Management from Zero,4.5,353,All Levels,75 lectures,23 total hours,
salesforce.com,https://www.udemy.com/course/beginning-project-management-project-management-level-one/,https://img-c.udemycdn.com/course/240x135/946742_7dc0_2.jpg,Joseph Phillips,Beginning Project Management: Project Management Level One,Project Management: Growing a Successful Career as a Project Manager,4.5,32236,Beginner,45 lectures,3 total hours,
salesforce.com,https://www.udemy.com/course/essential-excel-for-project-managers/,https://img-c.udemycdn.com/course/240x135/4682186_0e31_3.jpg,Asen Gyczew,Essential Excel for Project Managers,A practical guide on how to use Excel for preparing and managing projects,4.5,306,Intermediate,124 lectures,6 total hours,Current price: $59.99
