skill,link,image_link,partner,title,course_description,rating,num_review,difficulty,num_lecture,duration,price
c++,https://www.udemy.com/course/the-project-management-course-beginner-to-project-manager/,https://img-c.udemycdn.com/course/240x135/1978132_e90d_5.jpg,365 Careers,The Project Management Course: Beginner to PROject Manager,The Complete Course For Becoming A Successful Project Manager,4.6,74024,All Levels,109 lectures,8 total hours,Current price: $119.99
c++,https://www.udemy.com/course/sap-activate-project-manager-c_act_2403-new-version/,https://img-c.udemycdn.com/course/240x135/5874464_1dcb.jpg,GuruSAP Consulting,SAP Activate Project Manager {C_ACT_2403} NEW Version,SAP Activate Project Manager {C_ACT_2403} NEW Certification Questions,4.4,137,All Levels,255 questions,,Current price: $69.99
c++,https://www.udemy.com/course/sap_act2403_certification/,https://img-c.udemycdn.com/course/240x135/5905298_2e1e_24.jpg,Allegiant Consulting (SAP Certification Training),SAP Certified Project Manager C_ACT_2403 (Annotated!),Know more than just the exam's questions - understand them!,5.0,2,All Levels,160 questions,,Current price: $24.99
c++,https://www.udemy.com/course/a-project-management-course-becoming-a-project-manager/,https://img-c.udemycdn.com/course/240x135/6049011_94c0_2.jpg,Providence Essien,A project management course: Becoming a PROject Manager,The Complete Course you need to Becoming a Successful PROject Manager,4.7,200,All Levels,10 lectures,1.5 total hours,Current price: $19.99
c++,https://www.udemy.com/course/project-management-with-chatgpt/,https://img-c.udemycdn.com/course/240x135/5534098_a35c_5.jpg,Tobias Becker,Project Management with ChatGPT: AI for Project Managers,Master Modern Project Management with AI. A Comprehensive Guide to Use Chat GPT for Project Managers (+ 42 Prompts),4.4,4678,Beginner,29 lectures,2.5 total hours,Current price: $19.99
c++,https://www.udemy.com/course/c-programming-for-beginners-/,https://img-c.udemycdn.com/course/240x135/1467808_f8c0.jpg,"Tim Buchalka's Learn Programming Academy, Jason Fedin",C Programming For Beginners - Master the C Language,C Programming will increase career options.  Become a better dev in other languages by learning C.   Pointers explained,4.4,37980,All Levels,150 lectures,25.5 total hours,Current price: $119.99
c++,https://www.udemy.com/course/c_act_2403-sap-certified-project-manager-sap-activate-s/,https://img-c.udemycdn.com/course/240x135/6470531_d615.jpg,weLearn Consultants,C_ACT_2403 : SAP Certified - Project Manager - SAP Activate,SAP Certified Associate - Project Manager - SAP Activate {C_ACT_2403},4.6,6,All Levels,180 questions,,Current price: $44.99
c++,https://www.udemy.com/course/project-manager-sap-activate-exam-prep/,https://img-c.udemycdn.com/course/240x135/6267445_72e9.jpg,Kone Lisek,Project Manager - SAP Activate - Exam Prep C_ACT_2403,200 Questions to prepare you for your SAP Activate - C_ACT - Certification - multiple choice with explanation,4.1,8,Intermediate,235 questions,,Current price: $44.99
c++,https://www.udemy.com/course/project-management-with-gen-ai-a-guide-for-project-managers/,https://img-c.udemycdn.com/course/240x135/6488353_f0c1.jpg,AI MENTOR,Project Management with Gen AI: A Guide for Project Managers,"Learn Project Management with Generative AI to optimize workflows, automate tasks & drive Success in Project Management",4.5,90,All Levels,17 lectures,2 total hours,Current price: $44.99
c++,https://www.udemy.com/course/os-project-lmm/,https://img-c.udemycdn.com/course/240x135/2300060_4084_6.jpg,"Abhishek CSEPracticals, Shiwani Nigam, Ekta Ekta",Operating System Project - Develop Heap Memory Manager in C,"Operating System UG/PG Seminar Projects in C on Windows/Linux Platforms, Memory Management, System Programming, Linux.",4.3,126,Intermediate,85 lectures,7.5 total hours,Current price: $64.99
c++,https://www.udemy.com/course/c-programming-for-beginners-programming-in-c/,https://img-c.udemycdn.com/course/240x135/3173974_b870_4.jpg,Vlad Budnitski,C Programming Bootcamp - The Complete C Language Course,C Programming 2025: Master the Fundamentals of C Programming Language. Join the Comprehensive C Bootcamp Masterclass!,4.5,8880,All Levels,396 lectures,44 total hours,Current price: $84.99
c++,https://www.udemy.com/course/sap-activate-project-manager-lane-to-success-c_activate22/,https://img-c.udemycdn.com/course/240x135/5887332_335c.jpg,Kareem Ullah,SAP Activate Project Manager: Lane to Success (C_ACTIVATE22),"Unlock the SAP Activate Project Manager Certification: SAP Activate Methodology Unveiled, (C_ACTIVATE_22/13) Exam Prep.",4.6,48,All Levels,29 lectures,1.5 total hours,Current price: $39.99
c++,https://www.udemy.com/course/advanced-c-programming-course/,https://img-c.udemycdn.com/course/240x135/2800976_98e5.jpg,"Tim Buchalka's Learn Programming Academy, Jason Fedin",Advanced C Programming Course,Become a True Master of the C Programming Language - Confidently Apply for Real Time or Embedded C Jobs or contracts!,4.4,5100,Intermediate,175 lectures,29 total hours,Current price: $89.99
c++,https://www.udemy.com/course/project-management-mastery/,https://img-c.udemycdn.com/course/240x135/1918248_ad2f.jpg,Chris Croft,Project Management for Non Project Managers - PMP/PMI,Project Management practical guide for all industries,4.6,14699,All Levels,29 lectures,2.5 total hours,Current price: $109.99
c++,https://www.udemy.com/course/project-management-complete-guide-for-a-project-managers/,https://img-c.udemycdn.com/course/240x135/4663650_39fa_9.jpg,"Peter Alkema, Regenesys Business School",Project Management - Complete Guide For A+ Project Managers,"Complete guide to project management - stakeholders, planning, cost, quality, risks, feasibility, methods & resourcing",4.4,793,All Levels,454 lectures,28 total hours,Current price: $74.99
c++,https://www.udemy.com/course/hybrid-project-management/,https://img-c.udemycdn.com/course/240x135/3722014_e0c0.jpg,Janet Burns,Hybrid Project Management for Project Managers,Agile? Waterfall? Why not both? Learn the benefits of these approaches to develop your own recipe for project success.,4.5,2772,Intermediate,22 lectures,,Current price: $39.99
c++,https://www.udemy.com/course/sap-certified-associate-sap-activate-project-manager-k/,https://img-c.udemycdn.com/course/240x135/4872372_e4d8.jpg,SAPiem ERP,SAP Certified Associate - SAP Activate Project Manager,C_ACTIVATE13,4.1,8,All Levels,240 questions,,Current price: $44.99
c++,https://www.udemy.com/course/microsoft-project-for-civil-engineers-learn-2-live-projects/,https://img-c.udemycdn.com/course/240x135/5628573_a072_7.jpg,Akshay Kamath,Microsoft Project for Project Manager & Civil Engineers -MSP,[2024 ] Only Course With Live Project [23 Hours] on MS Project for Project Planning & Project Management from Zero,4.5,353,All Levels,75 lectures,23 total hours,Current price: $19.99
c++,https://www.udemy.com/course/cpp23-fundamentals-projects-algorithms/,https://img-c.udemycdn.com/course/240x135/6397539_9f8b_3.jpg,Daniel Gakwaya,C++23 Fundamentals with Projects & Algorithms,"Go beyond the basics—build, debug, and optimize modern C++23 projects with pro tools like CMake and vcpkg.",4.8,17,Beginner,103 lectures,60.5 total hours,Current price: $54.99
c++,https://www.udemy.com/course/gnu-make-and-makefile-for-your-embedded-c-project/,https://img-c.udemycdn.com/course/240x135/6058507_e3c3_4.jpg,Sebastian Helmut,GNU Make and Makefile for your Embedded C Project,"Learn makefile syntax , Write your makefile project from scratch, Use makefile with your Embedded C project",4.7,35,All Levels,45 lectures,3 total hours,Current price: $19.99
