skill,link,image_link,partner,title,course_description,rating,num_review,difficulty,num_lecture,duration,price
agile,https://www.udemy.com/course/the-complete-agile-scrum-project-management-course/,https://img-c.udemycdn.com/course/240x135/6028152_84b7.jpg,365 Careers,The Complete Agile & Scrum Project Management Course,"Master Agile and Scrum through an immersive, real-world case study to become a world-class project manager",4.6,1942,All Levels,57 lectures,4 total hours,Current price: $79.99
agile,https://www.udemy.com/course/the-project-management-course-beginner-to-project-manager/,https://img-c.udemycdn.com/course/240x135/1978132_e90d_5.jpg,365 Careers,The Project Management Course: Beginner to PROject Manager,The Complete Course For Becoming A Successful Project Manager,4.6,74024,All Levels,109 lectures,8 total hours,Current price: $119.99
agile,https://www.udemy.com/course/hybrid-project-management/,https://img-c.udemycdn.com/course/240x135/3722014_e0c0.jpg,Janet Burns,Hybrid Project Management for Project Managers,Agile? Waterfall? Why not both? Learn the benefits of these approaches to develop your own recipe for project success.,4.5,2772,Intermediate,22 lectures,,Current price: $39.99
agile,https://www.udemy.com/course/project-management-basics-for-non-project-managers/,https://img-c.udemycdn.com/course/240x135/5724764_1da6_3.jpg,Robert Hean,Project Management Basics for Non-Project Managers,Learn how Agile and Waterfall projects work | Includes ALL Phases of Projects | NO experience needed,4.6,791,All Levels,15 lectures,1.5 total hours,Current price: $59.99
agile,https://www.udemy.com/course/pmp-project-management/,https://img-c.udemycdn.com/course/240x135/5007930_0031.jpg,Dr. José Prabhu J,Master Course in Project Management 2.0,"Project Management, PMP, Agile project management, Project manager, Prince2, Scrum, Project Planning, CAPM, PMI",4.4,991,All Levels,49 lectures,10.5 total hours,Current price: $34.99
agile,https://www.udemy.com/course/scrum-master-training/,https://img-c.udemycdn.com/course/240x135/646076_6161.jpg,Paul Ashun,Agile Project Management+Scrum Step by Step with Examples,"Explained with examples based on the real world for scrum master, product owner, team and project manager in industry",4.4,5188,All Levels,68 lectures,2 total hours,Current price: $74.99
agile,https://www.udemy.com/course/agile-crash-course/,https://img-c.udemycdn.com/course/240x135/864146_dbd7_11.jpg,"YESI EDUCATION, Mauricio Rubio - Agile Guru & Founder of YESI EDUCATION, AgileKB & Grabdl",Agile Crash Course: Agile Project Management; Agile Delivery,"Agile Project Management Basics (Scrum), Agile Project Management Essentials (Scrum). Plus Agile Certification (Scrum)",4.5,93117,Beginner,26 lectures,3 total hours,Current price: $174.99
agile,https://www.udemy.com/course/ultimate-project-management-pmp-35-pdus/,https://img-c.udemycdn.com/course/240x135/5188420_f239_3.jpg,David McLachlan,The Ultimate Project Management PMP Prep Course (35 PDUs),"Master Project Management and Agile for your PMP or CAPM certification, with the PMBOK, Agile Practice Guide and more!",4.7,8575,All Levels,237 lectures,28.5 total hours,Current price: $99.99
agile,https://www.udemy.com/course/agile-project-management-mozn/,https://img-c.udemycdn.com/course/240x135/4340158_928e_3.jpg,Mozn Akhourshiedah,Agile Project Management,Agile Management Crash Course | What You Need to Start an Agile Project,4.3,2023,All Levels,33 lectures,2.5 total hours,Current price: $39.99
agile,https://www.udemy.com/course/jira-confluence-masterclass-2025-for-users-projects/,https://img-c.udemycdn.com/course/240x135/6203609_c5c7.jpg,"Niels Rabe | Agile Coach, Project manager, Scrum Master",Jira & Confluence Masterclass 2025 for Projects & Teams,"Manage Agile, Scrum, Kanban and more Teams and Projects by Mastering Jira and Confluence in 2025. Learn Jira today!",4.5,48,Beginner,114 lectures,10.5 total hours,Current price: $89.99
agile,https://www.udemy.com/course/the-agile-methodology-for-project-risk-managers/,https://img-c.udemycdn.com/course/240x135/1559988_e2af.jpg,Sorin Dumitrascu,The Agile Methodology for Project Risk Managers,The Agile Project Management and Risk Management for Project Professionals Full Course,4.3,369,All Levels,278 lectures,31.5 total hours,Current price: $69.99
agile,https://www.udemy.com/course/project-manager-certification/,https://img-c.udemycdn.com/course/240x135/6452283_5cbb_2.jpg,"Vipesh Singla , MBA, Certified  SAFe Agile Coach, Santosh Varma",Project Manager Certification,"Project Manager Certification by Agile Enterprise Coach, London",4.6,13,All Levels,64 questions,,Current price: $44.99
agile,https://www.udemy.com/course/project-management-chatgpt/,https://img-c.udemycdn.com/course/240x135/6345903_9ba2_2.jpg,Hassan Osman,Project Management with ChatGPT (Traditional + Agile),"How to Use ChatGPT to be a Faster, Smarter, and More Effective Project Manager (Includes Prompts, Image Gen, and More)",4.5,562,All Levels,12 lectures,,Current price: $54.99
agile,https://www.udemy.com/course/a-project-management-course-becoming-a-project-manager/,https://img-c.udemycdn.com/course/240x135/6049011_94c0_2.jpg,Providence Essien,A project management course: Becoming a PROject Manager,The Complete Course you need to Becoming a Successful PROject Manager,4.7,200,All Levels,10 lectures,1.5 total hours,Current price: $19.99
agile,https://www.udemy.com/course/scrum-course-udemy/,https://img-c.udemycdn.com/course/240x135/2002862_aa45_5.jpg,"YESI EDUCATION, Mauricio Rubio - Agile Guru & Founder of YESI EDUCATION, AgileKB & Grabdl",The Complete Agile Scrum Fundamentals Course + Certification,"Agile Scrum from A to Z: Scrum a Project Management methodology, Scrum Fundamentals, Scrum concepts, Agile Scrum tools",4.6,19628,Beginner,107 lectures,15 total hours,Current price: $139.99
agile,https://www.udemy.com/course/introductionto-agile-project-management/,https://img-c.udemycdn.com/course/240x135/896264_a499_3.jpg,Agile Project Management Academy - Chuck Cobb,Agile PM 202 - Introduction to Agile Project Management,Learn How to Apply Project Management Practices in an Agile Environment,4.5,11674,Intermediate,39 lectures,4.5 total hours,Current price: $69.99
agile,https://www.udemy.com/course/hybrid-agile-project-management-combine-scrum-and-waterfall/,https://img-c.udemycdn.com/course/240x135/3394930_f990_2.jpg,"Niels Rabe | Agile Coach, Project manager, Scrum Master",Agile project management: How to combine Scrum and Waterfall,Learn and understand an effective combination of agile and waterfall project management and how to set up your project,4.1,220,All Levels,39 lectures,2.5 total hours,Current price: $59.99
agile,https://www.udemy.com/course/acing-project-management/,https://img-c.udemycdn.com/course/240x135/3176952_9475_18.jpg,"Ben Moreau (PMP, Prince2, MSP, Agile)",Acing Project Management: Ultimate 8h Project Manager course,"End to end, Comprehensive Course including all Templates to get you started",4.6,476,All Levels,132 lectures,8.5 total hours,Current price: $69.99
agile,https://www.udemy.com/course/project-management-complete-guide-for-a-project-managers/,https://img-c.udemycdn.com/course/240x135/4663650_39fa_9.jpg,"Peter Alkema, Regenesys Business School",Project Management - Complete Guide For A+ Project Managers,"Complete guide to project management - stakeholders, planning, cost, quality, risks, feasibility, methods & resourcing",4.4,793,All Levels,454 lectures,28 total hours,Current price: $74.99
agile,https://www.udemy.com/course/agile-scrum-project-management-course/,https://img-c.udemycdn.com/course/240x135/5493840_2956_10.jpg,"Michael James (PSM I, PSM II, PSM III, PSPO 1, PSPO II, SPS certified), Ramon Janssen, Management Mavericks",Agile Project Management: Scrum & Leadership Best Practices,"Learn to adopt Agile practices, develop and manage dynamic teams for project success with real world project examples",4.4,106,All Levels,75 lectures,5.5 total hours,Current price: $19.99
