skill,link,image_link,partner,title,course_description,rating,num_review,difficulty,num_lecture,duration,price
network troubleshooting,https://www.udemy.com/course/network-troubleshooting-by-arash-deljoo-r/,https://img-c.udemycdn.com/course/240x135/5280174_b3e9.jpg,Arash Deljoo,Complete Teaching of Network Troubleshooting by Arash Deljoo,Mastering Network Troubleshooting: A Comprehensive Guide to Efficient Diagnosis and Resolution,4.6,120,All Levels,50 lectures,34 total hours,Current price: $84.99
network troubleshooting,https://www.udemy.com/course/the-project-management-course-beginner-to-project-manager/,https://img-c.udemycdn.com/course/240x135/1978132_e90d_5.jpg,365 Careers,The Project Management Course: Beginner to PROject Manager,The Complete Course For Becoming A Successful Project Manager,4.6,74024,All Levels,109 lectures,8 total hours,Current price: $119.99
network troubleshooting,https://www.udemy.com/course/network-performance-troubleshooting-masterclass/,https://img-c.udemycdn.com/course/240x135/5831436_4aef_3.jpg,Shaun Hummel,Troubleshooting Network Performance,"Learn how to troubleshoot network performance, testing tools, latency, throughput, TCP, Network Engineers, DevOps",3.8,15,All Levels,32 lectures,3 total hours,Current price: $59.99
network troubleshooting,https://www.udemy.com/course/network-troubleshooting-skills-training/,https://img-c.udemycdn.com/course/240x135/2270778_a7bb_18.jpg,Shaun Hummel,Cisco CCNA Network Troubleshooting Masterclass,CCNA complete troubleshooting course with student practice labs and CCNP ENCOR switching topics included.,4.4,65,All Levels,37 lectures,4.5 total hours,Current price: $49.99
network troubleshooting,https://www.udemy.com/course/mastering-network-troubleshooting-with-wireshark/,https://img-c.udemycdn.com/course/240x135/1593554_6bbd_2.jpg,Brian Hill,Mastering Network Troubleshooting with Wireshark,Solve network problems and improve your understanding of network protocols by learning Wireshark from an expert.,4.4,204,Intermediate,27 lectures,2.5 total hours,Current price: $44.99
network troubleshooting,https://www.udemy.com/course/a-project-management-course-becoming-a-project-manager/,https://img-c.udemycdn.com/course/240x135/6049011_94c0_2.jpg,Providence Essien,A project management course: Becoming a PROject Manager,The Complete Course you need to Becoming a Successful PROject Manager,4.7,200,All Levels,10 lectures,1.5 total hours,Current price: $19.99
network troubleshooting,https://www.udemy.com/course/networking-fundamentals-for-full-stack-web-developers/,https://img-c.udemycdn.com/course/240x135/5358812_152a_13.jpg,Shaun Hummel,Troubleshooting Web Applications (DevOps),"Network Engineers and DevOps - Troubleshoot Server Connection, Internet Performance, TCP/IP, DNS, AWS Subnetting",4.5,24,All Levels,71 lectures,6.5 total hours,Current price: $74.99
network troubleshooting,https://www.udemy.com/course/project-management-with-gen-ai-a-guide-for-project-managers/,https://img-c.udemycdn.com/course/240x135/6488353_f0c1.jpg,AI MENTOR,Project Management with Gen AI: A Guide for Project Managers,"Learn Project Management with Generative AI to optimize workflows, automate tasks & drive Success in Project Management",4.5,90,All Levels,17 lectures,2 total hours,Current price: $44.99
network troubleshooting,https://www.udemy.com/course/cisco-300-135-troubleshooting-maintaining-ip-networks/,https://img-c.udemycdn.com/course/240x135/986590_fb47_3.jpg,Stone River eLearning,Cisco 300-135 - Troubleshooting & Maintaining IP Networks,CISCO 300-135 - TSHOOT - Troubleshooting And Maintaining Cisco IP Networks,4.4,75,All Levels,143 lectures,7.5 total hours,Current price: $49.99
network troubleshooting,https://www.udemy.com/course/it-troubleshooting/,https://img-c.udemycdn.com/course/240x135/32199_6ad0_7.jpg,Noel Temena,IT Troubleshooting Skill Training,IT Troubleshooting 101 for Analysts and Managers,4.5,13485,Intermediate,31 lectures,1.5 total hours,Current price: $89.99
network troubleshooting,https://www.udemy.com/course/troubleshoot-network-issues/,https://img-c.udemycdn.com/course/240x135/3742576_1a86_3.jpg,selvajegan santhagruz,Troubleshoot Network Issues,"Complete Troubleshooting Lab for CCNA ,CCNP and CCIE .Solve Simple to Complex Network Issues",4.4,33,All Levels,85 lectures,10.5 total hours,Current price: $49.99
network troubleshooting,https://www.udemy.com/course/project-management-with-chatgpt/,https://img-c.udemycdn.com/course/240x135/5534098_a35c_5.jpg,Tobias Becker,Project Management with ChatGPT: AI for Project Managers,Master Modern Project Management with AI. A Comprehensive Guide to Use Chat GPT for Project Managers (+ 42 Prompts),4.4,4678,Beginner,29 lectures,2.5 total hours,Current price: $19.99
network troubleshooting,https://www.udemy.com/course/microsoft-project-tutorial/,https://img-c.udemycdn.com/course/240x135/831116_92e7_2.jpg,Srikanth Shirodkar,Microsoft Project ALL: BEGINNER to EXPERT 10 Projects 9 PDU,Learn MS Project all version HANDS-ON with COMPLETE real life examples BONUS 125 project files FREE PMI approved 9 PDUs,4.6,21952,All Levels,139 lectures,10.5 total hours,Current price: $124.99
network troubleshooting,https://www.udemy.com/course/project-management-for-infrastructure-sector/,https://img-c.udemycdn.com/course/240x135/4553552_54a2.jpg,Sanjoy Mukerji,Project Management for Infrastructure Sector,"Network Procurements & Network Techniques for planning, monitoring, control and execution of Infra Projects.",4.4,15,Intermediate,23 lectures,20.5 total hours,Current price: $44.99
network troubleshooting,https://www.udemy.com/course/master-python-network-automation-for-network-engineers/,https://img-c.udemycdn.com/course/240x135/1909942_c292_13.jpg,"Andrei Dumitrescu, Crystal Mind Academy",Master Network Automation with Python for Network Engineers,"Real-life hands-on Python and Ansible automation: SSH, Paramiko, Netmiko, Napalm, Telnet, Ansible, Cisco, Linux etc",4.6,3700,All Levels,252 lectures,23.5 total hours,Current price: $99.99
network troubleshooting,https://www.udemy.com/course/project-management-mastery/,https://img-c.udemycdn.com/course/240x135/1918248_ad2f.jpg,Chris Croft,Project Management for Non Project Managers - PMP/PMI,Project Management practical guide for all industries,4.6,14699,All Levels,29 lectures,2.5 total hours,Current price: $109.99
network troubleshooting,https://www.udemy.com/course/red-hat-linux-administration-advance-level-troubleshooting/,https://img-c.udemycdn.com/course/240x135/1314676_2c80_24.jpg,Shikhar Verma☆100K+ Students Globally,Ultimate Linux Training: Troubleshooting Skills for Success,A project-based approach to develop Linux skills that will boost your career & advancement: 42+ hours with 450+ lectures,4.6,4471,Beginner,433 lectures,42.5 total hours,Current price: $109.99
network troubleshooting,https://www.udemy.com/course/project-management-complete-guide-for-a-project-managers/,https://img-c.udemycdn.com/course/240x135/4663650_39fa_9.jpg,"Peter Alkema, Regenesys Business School",Project Management - Complete Guide For A+ Project Managers,"Complete guide to project management - stakeholders, planning, cost, quality, risks, feasibility, methods & resourcing",4.4,793,All Levels,454 lectures,28 total hours,Current price: $74.99
network troubleshooting,https://www.udemy.com/course/project-management-basics-for-non-project-managers/,https://img-c.udemycdn.com/course/240x135/5724764_1da6_3.jpg,Robert Hean,Project Management Basics for Non-Project Managers,Learn how Agile and Waterfall projects work | Includes ALL Phases of Projects | NO experience needed,4.6,791,All Levels,15 lectures,1.5 total hours,Current price: $59.99
network troubleshooting,https://www.udemy.com/course/microsoft-project-for-civil-engineers-learn-2-live-projects/,https://img-c.udemycdn.com/course/240x135/5628573_a072_7.jpg,Akshay Kamath,Microsoft Project for Project Manager & Civil Engineers -MSP,[2024 ] Only Course With Live Project [23 Hours] on MS Project for Project Planning & Project Management from Zero,4.5,353,All Levels,75 lectures,23 total hours,Current price: $19.99
