skill,link,image_link,partner,title,course_description,rating,num_review,difficulty,num_lecture,duration,price
unix shell,https://www.udemy.com/course/production-site-reliability-engineer/,https://img-c.udemycdn.com/course/240x135/3531340_3cd0_2.jpg,Nidhi Singh,Production Support - Site Reliability Engineer,Job of SRE in DevOps,4.5,2087,Beginner,95 lectures,7 total hours,Current price: $59.99
unix shell,https://www.udemy.com/course/sre-fundamentals-mastering-site-reliability-engineering/,https://img-c.udemycdn.com/course/240x135/5481794_d3c4_2.jpg,Douglas Mugnos,SRE Fundamentals: Mastering Site Reliability Engineering,Empower Your Team: Embrace SRE Fundamentals for Unparalleled Reliability and Efficiency,4.4,2058,All Levels,35 lectures,4 total hours,Current price: $19.99
unix shell,https://www.udemy.com/course/from-zero-to-site-reliability-engineer/,https://img-c.udemycdn.com/course/240x135/5901296_0671.jpg,Philip Afable,From Zero to Site Reliability Engineer,Learn About the SRE Workflow,4.2,20,Intermediate,24 lectures,3 total hours,Current price: $69.99
unix shell,https://www.udemy.com/course/bash-mastery/,https://img-c.udemycdn.com/course/240x135/2997494_0cc5_2.jpg,"Ziyad Yehia, Internet of Things Academy",Bash Mastery: The Complete Guide to Bash Shell Scripting,"Master Bash Shell Scripting to Automate Tasks, Save Time, and Boost Your Career. Practical Projects + All Code Included.",4.8,3906,All Levels,111 lectures,12 total hours,Current price: $84.99
unix shell,https://www.udemy.com/course/site-reliability-engineer-sre-150-unique-interview-questions/,https://img-c.udemycdn.com/course/240x135/5366082_0865.jpg,Mustafa Erdinç ZORBA,150 Unique Site Reliability Engineer SRE Interview Questions,Master SRE Concepts: Real-World Scenarios In-Depth Interview Preparation Guide with Answers and Explanations!,4.2,28,All Levels,150 questions,,Current price: $69.99
unix shell,https://www.udemy.com/course/unix-and-shell-scripting-training/,https://img-c.udemycdn.com/course/240x135/2629034_317b_6.jpg,Uplatz Training,Unix and Shell Scripting,Learn Unix & Shell programming with this step-by-step Unix course. Become a Unix Linux Systems Engineer / Administrator.,2.8,41,All Levels,6 lectures,3 total hours,Current price: $19.99
unix shell,https://www.udemy.com/course/unix-shell-scripting-basics-for-everyone/,https://img-c.udemycdn.com/course/240x135/4726116_a173_4.jpg,Gaurav Agarwal,UNIX Shell Scripting - Basics (For Every Programmer/Tester),Build your basics strong to build your career strong,4.6,5,Intermediate,75 lectures,41 total hours,Current price: $19.99
unix shell,https://www.udemy.com/course/powershell-from-beginner-to-sheller-and-scripter/,https://img-c.udemycdn.com/course/240x135/979510_95e0.jpg,David Fitzpatrick,PowerShell  from Beginner To Sheller And Scripter,Learn how to use PowerShell the easy way,4.7,2174,Beginner,115 lectures,11.5 total hours,Current price: $99.99
unix shell,https://www.udemy.com/course/shell-scripting-linux/,https://img-c.udemycdn.com/course/240x135/563066_4981_2.jpg,Jason Cannon,Shell Scripting: Discover How to Automate Command Line Tasks,"Learn shell programming for Linux, Unix, & Mac. Learn how to write shell scripts like a pro & solve real-world problems!",4.5,9140,All Levels,48 lectures,6 total hours,Current price: $84.99
unix shell,https://www.udemy.com/course/site-reliability-engineering-on-aws/,https://img-c.udemycdn.com/course/240x135/3287718_5368_2.jpg,Packt Publishing,Site Reliability Engineering on AWS,Implement a reliable application architecture using the patterns and best practices recommended by AWS.,4.1,224,Beginner,37 lectures,4.5 total hours,Current price: $54.99
unix shell,https://www.udemy.com/course/linux-shell-scripting-projects/,https://img-c.udemycdn.com/course/240x135/1349660_ecfb_4.jpg,Jason Cannon,Linux Shell Scripting: A Project-Based Approach to Learning,"Learn how to shell script through project-based training (Bash Scripting, Bash Programming, Sed, Grep, Awk, and More)",4.5,14948,All Levels,49 lectures,12.5 total hours,Current price: $119.99
unix shell,https://www.udemy.com/course/bash-scripting/,https://img-c.udemycdn.com/course/240x135/958532_478a_4.jpg,Jason Cannon,Bash Scripting and Shell Programming (Linux Command Line),"Learn bash programming for Linux, Unix, & Mac. Learn how to write bash scripts like a pro & solve real-world problems!",4.5,20282,All Levels,34 lectures,2.5 total hours,Current price: $109.99
unix shell,https://www.udemy.com/course/bash-shell-scripting-crash-course-for-beginners/,https://img-c.udemycdn.com/course/240x135/1583482_7f8e_2.jpg,Francesco Santi,Bash Shell Scripting: Crash Course For Beginners,"Learn Bash Shell Scripting from total beginner:Start from the Command Line,finish with a real world Shell Script Project",4.5,14866,All Levels,75 lectures,5.5 total hours,Current price: $109.99
unix shell,https://www.udemy.com/course/essential-unix-skills-for-developers/,https://img-c.udemycdn.com/course/240x135/4925270_afc6_6.jpg,Terry Martin,Essential Unix Skills for Developers,"Harness the powerful Unix command line within Linux, MacOS & other OSs to take your developer skills to the next level",4.6,628,Beginner,76 lectures,18 total hours,Current price: $79.99
unix shell,https://www.udemy.com/course/fast-track-to-shell-scripting-for-linux-admins/,https://img-c.udemycdn.com/course/240x135/5385340_7906_2.jpg,"Mo Khalil, Muhammed Torkey, Cloudsark",Linux Bash Shell Scripting for Beginners,"Learn Linux Bash Shell Scripting fast! Simple, beginner-friendly Linux shell scripting lessons to get you started.",4.2,19,All Levels,39 lectures,2.5 total hours,Current price: $54.99
unix shell,https://www.udemy.com/course/introduction-to-reliability-maintainability-availability/,https://img-c.udemycdn.com/course/240x135/4448412_a4b3_3.jpg,Christopher Olson,"Introduction to Reliability, Maintainability & Availability",A solid foundation for Project Managers & Systems Engineers,4.6,742,Beginner,85 lectures,7 total hours,Current price: $69.99
unix shell,https://www.udemy.com/course/complete-linux-training-course-to-get-your-dream-it-job/,https://img-c.udemycdn.com/course/240x135/1523066_334c_15.jpg,Imran Afzal,Complete Linux Training Course to Get Your Dream IT Job 2025,"The BEST Linux Administration course for corporate jobs and RHCSA, RHCE, LFCS, LPIC and CompTIA Linux+ certifications",4.7,40279,All Levels,283 lectures,41 total hours,Current price: $139.99
unix shell,https://www.udemy.com/course/shellprogramming/,https://img-c.udemycdn.com/course/240x135/607938_dc85_2.jpg,Ram Mohan,Unix and Shell Programming for Beginners,Learn how to start using Unix and the basics of shell programming in this simple and step by step course,4.0,165,Beginner,42 lectures,2.5 total hours,Current price: $59.99
unix shell,https://www.udemy.com/course/mastering-asq-certified-reliability-engineer-exam/,https://img-c.udemycdn.com/course/240x135/5663722_5b5f_4.jpg,AERP Engineering,Mastering Certified Reliability Engineer Exam - Vol 1,This course has been meticulously designed to aid individuals preparing for the Certified Reliability Engineer exam.,4.2,12,Intermediate,856 questions,,Current price: $19.99
unix shell,https://www.udemy.com/course/step-by-step-unix/,https://img-c.udemycdn.com/course/240x135/990276_7c25_11.jpg,Testing World,New to Unix/Linux? Be an Expert in a MONTH-Shell Script 2023,Step by Step Unix - Linux Commands |Grep in Detail | File and Folder operations | Best Practices | Quiz & Exercise,4.5,740,All Levels,117 lectures,11.5 total hours,Current price: $84.99
