skill,link,image_link,partner,title,course_description,rating,num_review,difficulty,num_lecture,duration,price
python,https://www.udemy.com/course/production-site-reliability-engineer/,https://img-c.udemycdn.com/course/240x135/3531340_3cd0_2.jpg,Nidhi Singh,Production Support - Site Reliability Engineer,Job of SRE in DevOps,4.5,2087,Beginner,95 lectures,7 total hours,Current price: $59.99
python,https://www.udemy.com/course/from-zero-to-site-reliability-engineer/,https://img-c.udemycdn.com/course/240x135/5901296_0671.jpg,Philip Afable,From Zero to Site Reliability Engineer,Learn About the SRE Workflow,4.2,20,Intermediate,24 lectures,3 total hours,Current price: $69.99
python,https://www.udemy.com/course/sre-fundamentals-mastering-site-reliability-engineering/,https://img-c.udemycdn.com/course/240x135/5481794_d3c4_2.jpg,Douglas Mugnos,SRE Fundamentals: Mastering Site Reliability Engineering,Empower Your Team: Embrace SRE Fundamentals for Unparalleled Reliability and Efficiency,4.4,2058,All Levels,35 lectures,4 total hours,Current price: $19.99
python,https://www.udemy.com/course/python-foundation-course/,https://img-c.udemycdn.com/course/240x135/2831076_e896.jpg,"Prashant Kumar Pandey, Satyam Kumar, Learning Journal",Python Programming - Foundation Course for Data Engineers,Just Enough Python - Quickly Learn Python Programming Fundamentals for Data Engineers with a capstone project,4.6,501,Beginner,57 lectures,4.5 total hours,Current price: $64.99
python,https://www.udemy.com/course/site-reliability-engineer-sre-150-unique-interview-questions/,https://img-c.udemycdn.com/course/240x135/5366082_0865.jpg,Mustafa Erdinç ZORBA,150 Unique Site Reliability Engineer SRE Interview Questions,Master SRE Concepts: Real-World Scenarios In-Depth Interview Preparation Guide with Answers and Explanations!,4.2,28,All Levels,150 questions,,Current price: $69.99
python,https://www.udemy.com/course/python-network-programming-for-network-engineers-python-3/,https://img-c.udemycdn.com/course/240x135/1554180_150a_2.jpg,"David Bombal, Experts with David Bombal",Python Network Programming for Network Engineers (Python 3),Program networks using Python version 3. Learn network programmability with this practical GNS3 and Cisco course,4.7,8837,Beginner,171 lectures,13 total hours,Current price: $99.99
python,https://www.udemy.com/course/site-reliability-engineering-on-aws/,https://img-c.udemycdn.com/course/240x135/3287718_5368_2.jpg,Packt Publishing,Site Reliability Engineering on AWS,Implement a reliable application architecture using the patterns and best practices recommended by AWS.,4.1,224,Beginner,37 lectures,4.5 total hours,Current price: $54.99
python,https://www.udemy.com/course/the-ai-engineer-course-complete-ai-engineer-bootcamp/,https://img-c.udemycdn.com/course/240x135/6112535_7103.jpg,365 Careers,The AI Engineer Course 2025: Complete AI Engineer Bootcamp,"Complete AI Engineer Training: Python, NLP, Transformers, LLMs, LangChain, Hugging Face, APIs",4.6,2803,All Levels,367 lectures,24.5 total hours,Current price: $89.99
python,https://www.udemy.com/course/reliability-engineering-statistics/,https://img-c.udemycdn.com/course/240x135/4308267_bdea.jpg,"Ray Harkins, The Manufacturing Academy, Michael J. Vella",Reliability Engineering Statistics (2025),"Master the Statistical Tools to Optimize Reliability, Minimize Failures, and Drive Performance in Engineering",4.4,633,All Levels,123 lectures,9 total hours,Current price: $84.99
python,https://www.udemy.com/course/introduction-to-reliability-maintainability-availability/,https://img-c.udemycdn.com/course/240x135/4448412_a4b3_3.jpg,Christopher Olson,"Introduction to Reliability, Maintainability & Availability",A solid foundation for Project Managers & Systems Engineers,4.6,742,Beginner,85 lectures,7 total hours,Current price: $69.99
python,https://www.udemy.com/course/100-days-of-code/,https://img-c.udemycdn.com/course/240x135/2776760_f176_10.jpg,"Dr. Angela Yu, Developer and Lead Instructor",100 Days of Code: The Complete Python Pro Bootcamp,"Master Python by building 100 projects in 100 days. Learn data science, automation, build websites, games and apps!",4.7,361653,All Levels,592 lectures,56.5 total hours,Current price: $119.99
python,https://www.udemy.com/course/mastering-asq-certified-reliability-engineer-exam/,https://img-c.udemycdn.com/course/240x135/5663722_5b5f_4.jpg,AERP Engineering,Mastering Certified Reliability Engineer Exam - Vol 1,This course has been meticulously designed to aid individuals preparing for the Certified Reliability Engineer exam.,4.2,12,Intermediate,856 questions,,Current price: $19.99
python,https://www.udemy.com/course/an-introduction-to-reliability-engineering/,https://img-c.udemycdn.com/course/240x135/2513962_7e40_4.jpg,"Ray Harkins, The Manufacturing Academy",An Introduction to Reliability Engineering,A Study of Why Things Fail and How to Measure and Improve their Useful Life,4.4,3367,All Levels,39 lectures,5 total hours,Current price: $84.99
python,https://www.udemy.com/course/python-for-engineers-and-scientists-basic-to-advanced/,https://img-c.udemycdn.com/course/240x135/6078403_fa8c_4.jpg,"Rafael Pereira da Silva, MSc.",Python for Engineers and Scientists / basic to advanced,"Replace Excel and Matlab with Sympy, Numpy, Pandas, Matplotlib, and Scipy; Task automation; From basic to advanced.",4.7,46,All Levels,120 lectures,14.5 total hours,Current price: $84.99
python,https://www.udemy.com/course/the-python-mega-course/,https://img-c.udemycdn.com/course/240x135/692188_9da7_35.jpg,Ardit Sulce,"Python Mega Course: Learn Python in 60 Days, Build 20 Apps",Learn Python from zero to advanced by building real programs to gain the skills needed to land an entry-level job.,4.6,70033,All Levels,459 lectures,52 total hours,Current price: $189.99
python,https://www.udemy.com/course/master-python-network-automation-for-network-engineers/,https://img-c.udemycdn.com/course/240x135/1909942_c292_13.jpg,"Andrei Dumitrescu, Crystal Mind Academy",Master Network Automation with Python for Network Engineers,"Real-life hands-on Python and Ansible automation: SSH, Paramiko, Netmiko, Napalm, Telnet, Ansible, Cisco, Linux etc",4.6,3700,All Levels,252 lectures,23.5 total hours,Current price: $99.99
python,https://www.udemy.com/course/python-pcep/,https://img-c.udemycdn.com/course/240x135/3626932_73ed_9.jpg,Adrian Wiech,Python PCEP: Become Certified Entry-Level Python Programmer,Learn Python from scratch and pass the PCEP exam (Certified Entry-Level Python Programmer),4.6,8705,Beginner,74 lectures,4 total hours,Current price: $99.99
python,https://www.udemy.com/course/complete-python-bootcamp/,https://img-c.udemycdn.com/course/240x135/567828_67d0.jpg,"Jose Portilla, Pierian Training",The Complete Python Bootcamp From Zero to Hero in Python,Learn Python like a Professional  Start from the basics and go all the way to creating your own applications and games,4.6,533201,All Levels,156 lectures,22 total hours,Current price: $199.99
python,https://www.udemy.com/course/python-automation-for-network-engineers/,https://img-c.udemycdn.com/course/240x135/2697328_1744.jpg,Ashish R,Python Automation for Network Engineers,"Automate the boring networking stuff using Python programming with telnet, paramiko and netmiko modules using python 3.8",4.6,271,Intermediate,24 lectures,4.5 total hours,Current price: $54.99
python,https://www.udemy.com/course/aws-data-engineer/,https://img-c.udemycdn.com/course/240x135/5591620_4e46_2.jpg,"Sundog Education by Frank Kane, Frank Kane, Stephane Maarek | AWS Certified Cloud Practitioner,Solutions Architect,Developer",AWS Certified Data Engineer Associate 2025 - Hands On!,"AWS DEA-C01 certification prep course with exercises and a full-length practice exam. Redshift, Glue, Athena, and more",4.6,7915,Intermediate,289 lectures,22 total hours,Current price: $94.99
