skill,link,image_link,partner,title,course_description,rating,num_review,difficulty,num_lecture,duration,price
hadoop,https://www.udemy.com/course/production-site-reliability-engineer/,https://img-c.udemycdn.com/course/240x135/3531340_3cd0_2.jpg,Nidhi Singh,Production Support - Site Reliability Engineer,Job of SRE in DevOps,4.5,2087,Beginner,95 lectures,7 total hours,Current price: $59.99
hadoop,https://www.udemy.com/course/sre-fundamentals-mastering-site-reliability-engineering/,https://img-c.udemycdn.com/course/240x135/5481794_d3c4_2.jpg,Douglas Mugnos,SRE Fundamentals: Mastering Site Reliability Engineering,Empower Your Team: Embrace SRE Fundamentals for Unparalleled Reliability and Efficiency,4.4,2058,All Levels,35 lectures,4 total hours,Current price: $19.99
hadoop,https://www.udemy.com/course/from-zero-to-site-reliability-engineer/,https://img-c.udemycdn.com/course/240x135/5901296_0671.jpg,Philip Afable,From Zero to Site Reliability Engineer,Learn About the SRE Workflow,4.2,20,Intermediate,24 lectures,3 total hours,Current price: $69.99
hadoop,https://www.udemy.com/course/site-reliability-engineer-sre-150-unique-interview-questions/,https://img-c.udemycdn.com/course/240x135/5366082_0865.jpg,Mustafa Erdinç ZORBA,150 Unique Site Reliability Engineer SRE Interview Questions,Master SRE Concepts: Real-World Scenarios In-Depth Interview Preparation Guide with Answers and Explanations!,4.2,28,All Levels,150 questions,,Current price: $69.99
hadoop,https://www.udemy.com/course/site-reliability-engineering-on-aws/,https://img-c.udemycdn.com/course/240x135/3287718_5368_2.jpg,Packt Publishing,Site Reliability Engineering on AWS,Implement a reliable application architecture using the patterns and best practices recommended by AWS.,4.1,224,Beginner,37 lectures,4.5 total hours,Current price: $54.99
hadoop,https://www.udemy.com/course/big-data-ingestion-using-sqoop-and-flume-cca-and-hdpcd/,https://img-c.udemycdn.com/course/240x135/2170564_8911_17.jpg,Navdeep Kaur,Data Engineering Master Course: Spark/Hadoop/Kafka/MongoDB,Full Hands on course to become Big Data Engineer: Spark/Kafka/Hadoop/Flume/Hive/Sqoop/MongoDB. Data Engineering course.,4.5,1966,All Levels,151 lectures,12 total hours,Current price: $69.99
hadoop,https://www.udemy.com/course/the-ultimate-hands-on-hadoop-tame-your-big-data/,https://img-c.udemycdn.com/course/240x135/996228_af5f_3.jpg,"Sundog Education by Frank Kane, Frank Kane, Sundog Education Team",The Ultimate Hands-On Hadoop: Tame your Big Data!,"Data Engineering and Hadoop tutorial with MapReduce, HDFS, Spark, Flink, Hive, HBase, MongoDB, Cassandra, Kafka + more!",4.6,30658,All Levels,104 lectures,14.5 total hours,Current price: $139.99
hadoop,https://www.udemy.com/course/big-data-engineering-bootcamp-with-gcp-and-azure-cloud/,https://img-c.udemycdn.com/course/240x135/6242299_e787.jpg,"Krish Naik, Mayank Aggarwal, KRISHAI Technologies Private Limited","Big Data Engineering Bootcamp with GCP, and Azure Cloud","Master Big Data with Hadoop, Spark, Kafka & Cloud | Build Real-World Projects & Scalable Data Pipelines from Scratch",4.7,357,All Levels,301 lectures,73.5 total hours,Current price: $44.99
hadoop,https://www.udemy.com/course/reliability-engineering-statistics/,https://img-c.udemycdn.com/course/240x135/4308267_bdea.jpg,"Ray Harkins, The Manufacturing Academy, Michael J. Vella",Reliability Engineering Statistics (2025),"Master the Statistical Tools to Optimize Reliability, Minimize Failures, and Drive Performance in Engineering",4.4,633,All Levels,123 lectures,9 total hours,Current price: $84.99
hadoop,https://www.udemy.com/course/introduction-to-reliability-maintainability-availability/,https://img-c.udemycdn.com/course/240x135/4448412_a4b3_3.jpg,Christopher Olson,"Introduction to Reliability, Maintainability & Availability",A solid foundation for Project Managers & Systems Engineers,4.6,742,Beginner,85 lectures,7 total hours,Current price: $69.99
hadoop,https://www.udemy.com/course/the-big-data-developer-course/,https://img-c.udemycdn.com/course/240x135/4870802_1653_5.jpg,Deesa Technologies,"Mastering Big Data: Spark, Scala, Kafka, Hadoop,Hive & More","Complete Hands-On Developer Guide to Modern Big Data Tools like Hadoop, Hive, Spark, Scala, Kafka, NIFI, HBase and more",4.4,140,All Levels,197 lectures,33.5 total hours,Current price: $64.99
hadoop,https://www.udemy.com/course/learn-big-data-hadoop-hands-on-for-beginner/,https://img-c.udemycdn.com/course/240x135/3756876_f55d_6.jpg,Bigdata Engineer,Learn Big Data Hadoop: Hands-On for Beginner,"Big Data Engineering and Hadoop tutorial with Bigdata, Hadoop, HDFS, Yarn, MapReduce, Pig, Sqoop, and Flume",3.6,45,Beginner,262 lectures,14 total hours,Current price: $39.99
hadoop,https://www.udemy.com/course/learn-by-example-hadoop-mapreduce/,https://img-c.udemycdn.com/course/240x135/825972_5fd2_4.jpg,Loony Corn,"Learn By Example: Hadoop, MapReduce for Big Data problems","A hands-on workout in Hadoop, MapReduce and the art of thinking parallel",4.6,1144,All Levels,73 lectures,13.5 total hours,Current price: $79.99
hadoop,https://www.udemy.com/course/cloudera-hadoop-administration/,https://img-c.udemycdn.com/course/240x135/1932176_94ad_2.jpg,Sijeesh Kunnotharamal,Cloudera Hadoop Administration,"Installation ,Configuration,Security,Evaluation and Upgrade of Cloudera Hadoop Cluster .Cloudera Certified Hadoop Admin",4.4,995,Intermediate,74 lectures,10 total hours,Current price: $59.99
hadoop,https://www.udemy.com/course/mastering-asq-certified-reliability-engineer-exam/,https://img-c.udemycdn.com/course/240x135/5663722_5b5f_4.jpg,AERP Engineering,Mastering Certified Reliability Engineer Exam - Vol 1,This course has been meticulously designed to aid individuals preparing for the Certified Reliability Engineer exam.,4.2,12,Intermediate,856 questions,,Current price: $19.99
hadoop,https://www.udemy.com/course/big-data-hadoop-spark-project/,https://img-c.udemycdn.com/course/240x135/2583632_3b66_3.jpg,FutureX Skills,A Big Data Hadoop and Spark project for absolute beginners,2025 Edition Data Engineering Spark PySpark Scala Coding Framework Testing IntelliJ Maven Glue Databricks Delta Lake,4.6,1456,Beginner,121 lectures,13 total hours,Current price: $74.99
hadoop,https://www.udemy.com/course/hadoop-administration-online-hadoop-admin-training/,https://img-c.udemycdn.com/course/240x135/1065390_f832_5.jpg,Inflame Tech,Hadoop Administration: Online Hadoop Admin Training,Become a Hadoop Administrator from Scratch,3.6,179,All Levels,69 lectures,5 total hours,Current price: $39.99
hadoop,https://www.udemy.com/course/hands-on-hadoop-masterclass-tame-the-big-data/,https://img-c.udemycdn.com/course/240x135/1978354_c650_4.jpg,EDUCBA Bridging the Gap,Big Data: Hadoop| MapReduce| Hive| Pig| NoSQL| Mahout| Oozie,"Learn Hadoop, HDFS, MapReduce, Hive, Pig, NoSQL, Mahout, Oozie, Flume, Storm, Avro, Spark, Projects and Case studies.",3.9,490,All Levels,532 lectures,68 total hours,Current price: $34.99
hadoop,https://www.udemy.com/course/an-introduction-to-reliability-engineering/,https://img-c.udemycdn.com/course/240x135/2513962_7e40_4.jpg,"Ray Harkins, The Manufacturing Academy",An Introduction to Reliability Engineering,A Study of Why Things Fail and How to Measure and Improve their Useful Life,4.4,3367,All Levels,39 lectures,5 total hours,Current price: $84.99
hadoop,https://www.udemy.com/course/hadoop-spark/,https://img-c.udemycdn.com/course/240x135/3809790_7233.jpg,Tani Das,Hadoop & Spark,Master the Hadoop ecosystem and Spark tutorial,4.4,25,Beginner,29 lectures,27 total hours,Current price: $59.99
