skill,link,image_link,partner,title,course_description,rating,num_review,difficulty,num_lecture,duration,price
automation tools,https://www.udemy.com/course/production-site-reliability-engineer/,https://img-c.udemycdn.com/course/240x135/3531340_3cd0_2.jpg,Nidhi Singh,Production Support - Site Reliability Engineer,Job of SRE in DevOps,4.5,2087,Beginner,95 lectures,7 total hours,Current price: $59.99
automation tools,https://www.udemy.com/course/sre-fundamentals-mastering-site-reliability-engineering/,https://img-c.udemycdn.com/course/240x135/5481794_d3c4_2.jpg,Douglas Mugnos,SRE Fundamentals: Mastering Site Reliability Engineering,Empower Your Team: Embrace SRE Fundamentals for Unparalleled Reliability and Efficiency,4.4,2058,All Levels,35 lectures,4 total hours,Current price: $19.99
automation tools,https://www.udemy.com/course/from-zero-to-site-reliability-engineer/,https://img-c.udemycdn.com/course/240x135/5901296_0671.jpg,Philip Afable,From Zero to Site Reliability Engineer,Learn About the SRE Workflow,4.2,20,Intermediate,24 lectures,3 total hours,Current price: $69.99
automation tools,https://www.udemy.com/course/site-reliability-engineer-sre-150-unique-interview-questions/,https://img-c.udemycdn.com/course/240x135/5366082_0865.jpg,Mustafa Erdinç ZORBA,150 Unique Site Reliability Engineer SRE Interview Questions,Master SRE Concepts: Real-World Scenarios In-Depth Interview Preparation Guide with Answers and Explanations!,4.2,28,All Levels,150 questions,,Current price: $69.99
automation tools,https://www.udemy.com/course/reliability-engineering-statistics/,https://img-c.udemycdn.com/course/240x135/4308267_bdea.jpg,"Ray Harkins, The Manufacturing Academy, Michael J. Vella",Reliability Engineering Statistics (2025),"Master the Statistical Tools to Optimize Reliability, Minimize Failures, and Drive Performance in Engineering",4.4,633,All Levels,123 lectures,9 total hours,Current price: $84.99
automation tools,https://www.udemy.com/course/mastering-asq-certified-reliability-engineer-exam/,https://img-c.udemycdn.com/course/240x135/5663722_5b5f_4.jpg,AERP Engineering,Mastering Certified Reliability Engineer Exam - Vol 1,This course has been meticulously designed to aid individuals preparing for the Certified Reliability Engineer exam.,4.2,12,Intermediate,856 questions,,Current price: $19.99
automation tools,https://www.udemy.com/course/site-reliability-engineering-on-aws/,https://img-c.udemycdn.com/course/240x135/3287718_5368_2.jpg,Packt Publishing,Site Reliability Engineering on AWS,Implement a reliable application architecture using the patterns and best practices recommended by AWS.,4.1,224,Beginner,37 lectures,4.5 total hours,Current price: $54.99
automation tools,https://www.udemy.com/course/istqb-advanced-test-automation/,https://img-c.udemycdn.com/course/240x135/5287100_980f_3.jpg,"Maged Koshty, Scottie Crump",ISTQB Advanced Test Automation Engineer - 2024,Master advanced automation techniques and excel as an ISTQB® Certified Test Automation Engineer,4.2,878,All Levels,58 lectures,5.5 total hours,Current price: $79.99
automation tools,https://www.udemy.com/course/introduction-to-reliability-maintainability-availability/,https://img-c.udemycdn.com/course/240x135/4448412_a4b3_3.jpg,Christopher Olson,"Introduction to Reliability, Maintainability & Availability",A solid foundation for Project Managers & Systems Engineers,4.6,742,Beginner,85 lectures,7 total hours,Current price: $69.99
automation tools,https://www.udemy.com/course/marketing-automation-for-beginners-strategy-and-tools/,https://img-c.udemycdn.com/course/240x135/4982683_74c1_6.jpg,Thalita Milan | Marketing Automation & HubSpot expert,Marketing Automation for Beginners - Strategy & Tools Intro,Build a Marketing Automation Strategy and learn about different tools with an Automation Expert & Bestseller Instructor!,4.5,400,Beginner,44 lectures,3.5 total hours,Current price: $74.99
automation tools,https://www.udemy.com/course/javascript-and-nodejs-essentials-for-test-automation/,https://img-c.udemycdn.com/course/240x135/4035456_f34c_6.jpg,Cope Automation,"JavaScript & Node.js course for Testers, QA and SDETs - 2025","A tool independent JavaScript and Node.js course, specifically designed for Test Engineers, QAs and SDETs for Automation",4.3,508,All Levels,123 lectures,12 total hours,Current price: $69.99
automation tools,https://www.udemy.com/course/the-ai-engineer-course-complete-ai-engineer-bootcamp/,https://img-c.udemycdn.com/course/240x135/6112535_7103.jpg,365 Careers,The AI Engineer Course 2025: Complete AI Engineer Bootcamp,"Complete AI Engineer Training: Python, NLP, Transformers, LLMs, LangChain, Hugging Face, APIs",4.6,2803,All Levels,367 lectures,24.5 total hours,Current price: $89.99
automation tools,https://www.udemy.com/course/an-introduction-to-reliability-engineering/,https://img-c.udemycdn.com/course/240x135/2513962_7e40_4.jpg,"Ray Harkins, The Manufacturing Academy",An Introduction to Reliability Engineering,A Study of Why Things Fail and How to Measure and Improve their Useful Life,4.4,3367,All Levels,39 lectures,5 total hours,Current price: $84.99
automation tools,https://www.udemy.com/course/istqb-test-automation-engineer-ct-tae-v2-full-course/,https://img-c.udemycdn.com/course/240x135/6212991_bf3a_5.jpg,QA improvement,ISTQB Test Automation Engineer (CT-TAE V2.0) : Full Course,ISTQB Test Automation Engineering v2.0 : Certification Training and Comprehensive Guide to Mastering Test Automation,4.4,81,All Levels,18 lectures,4 total hours,Current price: $79.99
automation tools,https://www.udemy.com/course/site-reliability-engineering-mastering-slo-and-error-budget/,https://img-c.udemycdn.com/course/240x135/5842894_7ad8.jpg,Junior Mayhé,Site Reliability Engineering: Mastering SLO and Error Budget,"SRE core concepts of Non-Functional Requirements, Reliability, Business Flows, SLI, SLO, Error Budget, and more.",4.4,29,Beginner,27 lectures,,Current price: $39.99
automation tools,https://www.udemy.com/course/master-certified-maintenance-reliability-professional-cmrp/,https://img-c.udemycdn.com/course/240x135/6467193_0ba3.jpg,Kareem Ullah,Master Certified Maintenance & Reliability Professional CMRP,"CMRP Certification Bootcamp: Strategies for Maintenance & Reliability Success, CMRP Exam Prep, Best Practices and Tips.",4.7,53,All Levels,25 lectures,2.5 total hours,Current price: $44.99
automation tools,https://www.udemy.com/course/google-cloud-certification-associate-cloud-engineer/,https://img-c.udemycdn.com/course/240x135/3827154_aecc_4.jpg,"in28Minutes Official, Ranga Karanam | GCP Certification - Google Cloud Engineer & Architect",GCP Associate Cloud Engineer - Google Cloud Certification,GCP ACE - Google Cloud Associate Cloud Engineer certification. Begin your Google Cloud Platform - GCP journey!,4.6,31693,All Levels,299 lectures,18 total hours,Current price: $109.99
automation tools,https://www.udemy.com/course/master-python-network-automation-for-network-engineers/,https://img-c.udemycdn.com/course/240x135/1909942_c292_13.jpg,"Andrei Dumitrescu, Crystal Mind Academy",Master Network Automation with Python for Network Engineers,"Real-life hands-on Python and Ansible automation: SSH, Paramiko, Netmiko, Napalm, Telnet, Ansible, Cisco, Linux etc",4.6,3700,All Levels,252 lectures,23.5 total hours,Current price: $99.99
automation tools,https://www.udemy.com/course/fundamentals-of-reliability-engineering/,https://img-c.udemycdn.com/course/240x135/4901284_2632_3.jpg,"Sandeep Kumar, ­ Quality Gurus Inc.",Fundamentals of Reliability Engineering (Accredited),Gain Insight into the Basics of Reliability Engineering for CRE or CMRP Certification - Get 2.5 PMI PDUs and SHRM PDCs,4.2,391,Beginner,34 lectures,2.5 total hours,Current price: $74.99
automation tools,https://www.udemy.com/course/xray-test-managament-tool-jira-automation/,https://img-c.udemycdn.com/course/240x135/5890254_6818.jpg,Ace Automation Academy,Xray | Test Managament Tool | JIRA | Automation Testing -E2E,"JIRA,Manual+Automation Testing,Selenium,Scrum,Kanban,Agile,Xray,Bitbucket, APIs,Docker,AWS,BDD,Cucumber",4.3,21,All Levels,104 lectures,14 total hours,Current price: $19.99
