skill,link,image_link,partner,title,course_description,rating,num_review,difficulty,num_lecture,duration,price
restful api,https://www.udemy.com/course/production-site-reliability-engineer/,https://img-c.udemycdn.com/course/240x135/3531340_3cd0_2.jpg,Nidhi Singh,Production Support - Site Reliability Engineer,Job of SRE in DevOps,4.5,2087,Beginner,95 lectures,7 total hours,Current price: $59.99
restful api,https://www.udemy.com/course/learn-and-understand-apis-and-restful-apis/,https://img-c.udemycdn.com/course/240x135/2425522_6d25.jpg,Kalob Taulien,Understanding APIs and RESTful APIs Crash Course,"An introduction to how APIs and RESTful APIs work. No coding in this course, it's all conceptual.",4.5,15175,Beginner,22 lectures,,Current price: $74.99
restful api,https://www.udemy.com/course/from-zero-to-site-reliability-engineer/,https://img-c.udemycdn.com/course/240x135/5901296_0671.jpg,Philip Afable,From Zero to Site Reliability Engineer,Learn About the SRE Workflow,4.2,20,Intermediate,24 lectures,3 total hours,Current price: $69.99
restful api,https://www.udemy.com/course/sre-fundamentals-mastering-site-reliability-engineering/,https://img-c.udemycdn.com/course/240x135/5481794_d3c4_2.jpg,Douglas Mugnos,SRE Fundamentals: Mastering Site Reliability Engineering,Empower Your Team: Embrace SRE Fundamentals for Unparalleled Reliability and Efficiency,4.4,2058,All Levels,35 lectures,4 total hours,Current price: $19.99
restful api,https://www.udemy.com/course/site-reliability-engineer-sre-150-unique-interview-questions/,https://img-c.udemycdn.com/course/240x135/5366082_0865.jpg,Mustafa Erdinç ZORBA,150 Unique Site Reliability Engineer SRE Interview Questions,Master SRE Concepts: Real-World Scenarios In-Depth Interview Preparation Guide with Answers and Explanations!,4.2,28,All Levels,150 questions,,Current price: $69.99
restful api,https://www.udemy.com/course/rest-api/,https://img-c.udemycdn.com/course/240x135/802366_74df_4.jpg,Rajeev Sakhuja,"REST API Design, Development & Management","Learn the REST API Concepts, Design best practices, Security practices, Swagger 2.0/OAI, Hands on API Management",4.5,12120,All Levels,60 lectures,7.5 total hours,Current price: $109.99
restful api,https://www.udemy.com/course/restful-api-with-asp-dot-net-core-web-api/,https://img-c.udemycdn.com/course/240x135/1480202_717c_7.jpg,Bhrugen Patel,RESTful Web API - The Complete Guide (.NET7  API) Part 1,Build RESTful web API (C#) with Authentication and learn how to consume them in a real world application (.NET 7 API),4.5,7290,Intermediate,133 lectures,9 total hours,Current price: $99.99
restful api,https://www.udemy.com/course/ethical-hacking-of-restful-and-graphql-apis-training-course/,https://img-c.udemycdn.com/course/240x135/5879124_9fc6_2.jpg,Martin Voelk,Ethical Hacking of RESTful and GraphQL APIs Training Course,Become a Successful REST API and GraphQL API Penetration Tester and Bug Bounty Hunter!,4.6,21,Beginner,59 lectures,5.5 total hours,Current price: $79.99
restful api,https://www.udemy.com/course/restful-web-api-the-complete-guide-net7-api-part-2/,https://img-c.udemycdn.com/course/240x135/5358556_d1d2_2.jpg,Bhrugen Patel,RESTful Web API - The Complete Guide (.NET7 API) Part 2,Learn advance concepts in RESTful web API (C#) with Authentication (.NET 7 API) and explore how to consume them.,4.6,209,Intermediate,73 lectures,4.5 total hours,Current price: $79.99
restful api,https://www.udemy.com/course/site-reliability-engineering-on-aws/,https://img-c.udemycdn.com/course/240x135/3287718_5368_2.jpg,Packt Publishing,Site Reliability Engineering on AWS,Implement a reliable application architecture using the patterns and best practices recommended by AWS.,4.1,224,Beginner,37 lectures,4.5 total hours,Current price: $54.99
restful api,https://www.udemy.com/course/designing-restful-api/,https://img-c.udemycdn.com/course/240x135/3880538_252d_2.jpg,Praveenkumar Bouna,Designing RESTful APIs: Learn to Design API from Scratch,A guide to designing HTTP web APIs that follows REST principles using a step-by-step approach.,4.4,620,Beginner,95 lectures,5.5 total hours,Current price: $74.99
restful api,https://www.udemy.com/course/build-restful-api-in-nodejs/,https://img-c.udemycdn.com/course/240x135/2843012_313d_5.jpg,Ghulam Abbas,Node.js - The Complete RESTful API Masterclass,"Node.js : Build fast, scalable and powerful Nodejs RESTful APIs using Express & MongoDB from Development to Deployment",4.3,947,All Levels,90 lectures,11 total hours,Current price: $74.99
restful api,https://www.udemy.com/course/building-restful-apis-with-go/,https://img-c.udemycdn.com/course/240x135/2136218_e961_4.jpg,Packt Publishing,Building RESTful APIs with Go,Build high performance REST APIs and RESTful services,4.1,69,Intermediate,33 lectures,3 total hours,Current price: $39.99
restful api,https://www.udemy.com/course/build-rest-apis-with-aspnet-core-web-api-entity-framework/,https://img-c.udemycdn.com/course/240x135/4421508_4c47_10.jpg,Sameer Saini,Build ASP.NET Core Web API - Scratch To Finish (.NET8 API),"Use C# and Build an ASP.NET Core Web API with Entity Framework Core, SQL Server, Authentication, Authorization | .NET8",4.5,7505,All Levels,186 lectures,18 total hours,Current price: $79.99
restful api,https://www.udemy.com/course/the-ai-engineer-course-complete-ai-engineer-bootcamp/,https://img-c.udemycdn.com/course/240x135/6112535_7103.jpg,365 Careers,The AI Engineer Course 2025: Complete AI Engineer Bootcamp,"Complete AI Engineer Training: Python, NLP, Transformers, LLMs, LangChain, Hugging Face, APIs",4.6,2803,All Levels,367 lectures,24.5 total hours,Current price: $89.99
restful api,https://www.udemy.com/course/rest-api-automation-testing-rest-assured/,https://img-c.udemycdn.com/course/240x135/694982_33b0_3.jpg,Rahul Shetty,Rest API Testing (Automation) from Scratch-Rest Assured Java,Top Ranked #1 Rest API Test Automation & postman tutorial with Java from Basics to Framework with Real time examples,4.6,42202,All Levels,151 lectures,24.5 total hours,Current price: $149.99
restful api,https://www.udemy.com/course/building-restful-apis/,https://img-c.udemycdn.com/course/240x135/4474592_f674.jpg,Dave R.,Building RESTful APIs,Learn How to Build Useful APIs,4.2,8,All Levels,21 lectures,1.5 total hours,Current price: $44.99
restful api,https://www.udemy.com/course/postman-the-complete-guide/,https://img-c.udemycdn.com/course/240x135/1265410_cb96_4.jpg,"Valentin Despa, Valentin Despa - Support",Postman: The Complete Guide - REST API Testing,"Postman API testing for manual and automated tests. Automate with Newman, GitLab, Jenkins or any other CI tool.",4.7,20710,All Levels,270 lectures,21.5 total hours,Current price: $109.99
restful api,https://www.udemy.com/course/spring-boot-rest-apis-ultimate/,https://img-c.udemycdn.com/course/240x135/4700982_5b9e_4.jpg,Nam Ha Minh,Spring Boot REST APIs Ultimate Course,"Hands-on REST API Development with Spring Boot: Design, Implement, Document, Secure, Test, Consume RESTful APIs",4.4,171,All Levels,230 lectures,49.5 total hours,Current price: $69.99
restful api,https://www.udemy.com/course/mastering-restful-apis-a-comprehensive-guide/,https://img-c.udemycdn.com/course/240x135/5884348_62fc.jpg,Ismail Tobi,"Mastering RESTful APIs with Python, Flask and Postman",From Design to Development: Unlock the Power of RESTful APIs for Seamless Web Integration,4.5,41,All Levels,11 lectures,2 total hours,Current price: $24.99
