skill,link,image_link,partner,title,course_description,rating,num_review,difficulty,num_lecture,duration,price
spring mvc,https://www.udemy.com/course/spring-hibernate-tutorial/,https://img-c.udemycdn.com/course/240x135/647428_be28_10.jpg,Chad Darby,"[NEW] Spring Boot 3, Spring 6 & Hibernate for Beginners","Spring Boot 3: Learn Spring 6, Spring Core, Spring REST, Spring MVC, Spring Security, Thymeleaf, JPA, Hibernate, MySQL",4.6,88573,All Levels,403 lectures,34.5 total hours,Current price: $109.99
spring mvc,https://www.udemy.com/course/spring-boot-for-software-engineers/,https://img-c.udemycdn.com/course/240x135/1418878_58b5_2.jpg,Nelson Jamal,Spring Boot For Software Engineers,Build enterprise restful API's,4.7,1260,,Expert,6.5 total hours,Current price: $59.99
spring mvc,https://www.udemy.com/course/spring-framework-6-beginner-to-guru/,https://img-c.udemycdn.com/course/240x135/4522192_d71d.jpg,"John Thompson • 500,000+ Enrollments Worldwide","[NEW] Spring Boot 3, Spring Framework 6: Beginner to Guru","Spring 6, Spring Boot 3, Spring MVC, JPA/Hibernate, Mongo, Spring Security, OAuth2 JWT, MySQL, Docker/K8s, Microservices",4.5,2275,All Levels,563 lectures,47.5 total hours,Current price: $84.99
spring mvc,https://www.udemy.com/course/spring-mvc-tutorial-for-beginners-step-by-step/,https://img-c.udemycdn.com/course/240x135/732464_7cf6_3.jpg,in28Minutes Official,Spring MVC For Beginners - Build Java Web App in 25 Steps,Learn Spring MVC Framework with a Hands-on Step by Step Approach building a Todo Management Application!,4.5,10304,Beginner,53 lectures,6.5 total hours,Current price: $74.99
spring mvc,https://www.udemy.com/course/spring-springboot-jpa-hibernate-zero-to-master/,https://img-c.udemycdn.com/course/240x135/4364200_0221_5.jpg,"Eazy Bytes, Madan Reddy","[NEW] Master Spring 6, Spring Boot 3, REST, JPA, Hibernate","Master Java framework Spring 6, AOP, Spring MVC, Spring Boot 3, Thymeleaf, Spring Security 6, Spring JDBC, JPA,REST",4.6,4891,Beginner,251 lectures,36.5 total hours,Current price: $89.99
spring mvc,https://www.udemy.com/course/restful-web-service-with-spring-boot-jpa-and-mysql/,https://img-c.udemycdn.com/course/240x135/1616708_c407_3.jpg,Sergey Kargopolov,"RESTful Web Services, Java, Spring Boot, Spring MVC and JPA","Implement API calls: Sign-up, sign-in, email verification, password reset, update, delete. Deploy to Amazon AWS Cloud.",4.5,4215,All Levels,300 lectures,25 total hours,Current price: $79.99
spring mvc,https://www.udemy.com/course/spring-boot-project-job-portal-web-app/,https://img-c.udemycdn.com/course/240x135/5673188_2b06_2.jpg,"Chad Darby, Ravi Kumar Singh",Spring Boot 3 Project - Build a Job Portal Web Application,"Spring Boot 3: Build a complete Project end-to-end. Spring MVC, Thymeleaf, Spring Security, JPA, Hibernate and MySQL",4.5,378,Intermediate,55 lectures,6 total hours,Current price: $79.99
spring mvc,https://www.udemy.com/course/spring-5-with-spring-boot-2/,https://img-c.udemycdn.com/course/240x135/2167814_a0e6_5.jpg,"Navin Reddy, Telusko",Java Spring Framework 6 with Spring Boot 3,"Master Java, Spring 6 and Spring Boot 3 with JDBC, JPA, Security, Docker and Microservices with Telusko",4.6,28008,All Levels,427 lectures,48.5 total hours,Current price: $109.99
spring mvc,https://www.udemy.com/course/spring-boot-using-intellij-build-a-real-world-project/,https://img-c.udemycdn.com/course/240x135/4298517_aa5d_3.jpg,"Faisal Memon (EmbarkX), EmbarkX Official",Java Spring Boot: Professional eCommerce Project Masterclass,"Spring Framework + Spring Boot Full Stack: eCommerce REST API, Spring Data JPA, Spring Security 6, JWT, Deploy on AWS",4.6,1374,All Levels,635 lectures,89 total hours,Current price: $74.99
spring mvc,https://www.udemy.com/course/java-messaging-service-spring-mvc-spring-boot-activemq/,https://img-c.udemycdn.com/course/240x135/2021224_5cfd_6.jpg,Infybuzz Learning,"Java Messaging Service - Spring MVC, Spring Boot, ActiveMQ","Learn Queue and Topic In Detail with Java, Spring Boot, Spring MVC, Spring Framework & Apache ActiveMQ",4.5,892,Beginner,28 lectures,2 total hours,Current price: $54.99
spring mvc,https://www.udemy.com/course/spring-boot-and-spring-framework-tutorial-for-beginners/,https://img-c.udemycdn.com/course/240x135/4993276_3452.jpg,in28Minutes Official,[NEW] Master Spring Boot 3 & Spring Framework 6 with Java,"Become Java Spring Boot Full Stack Developer. Learn Spring Framework, Spring Boot, Spring Data, Docker & AWS",4.6,9808,All Levels,423 lectures,39 total hours,Current price: $99.99
spring mvc,https://www.udemy.com/course/spring-framework-5-beginner-to-guru/,https://img-c.udemycdn.com/course/240x135/1217894_e8cc_4.jpg,"John Thompson • 500,000+ Enrollments Worldwide, Spring Ahead Code Academy",Spring Framework 5: Beginner to Guru,"Spring Framework 5: Learn Spring Framework 5, Spring Boot 2, Spring MVC, Spring Data JPA, Spring Data MongoDB, Hibernate",4.4,19440,All Levels,525 lectures,57.5 total hours,Current price: $99.99
spring mvc,https://www.udemy.com/course/learn-spring-boot/,https://img-c.udemycdn.com/course/240x135/4872100_35d1_3.jpg,Ramesh Fadatare (Java Guides),Spring 6 & Spring Boot 3 for Beginners (Includes 7 Projects),"Spring Core 6, Spring Boot 3, Spring Security 6, REST API, Spring MVC, WebFlux, Hibernate, React JS, Thymeleaf, Docker",4.5,1111,Beginner,420 lectures,46 total hours,Current price: $79.99
spring mvc,https://www.udemy.com/course/rabbitmq-messaging-with-java-spring-boot-and-spring-mvc/,https://img-c.udemycdn.com/course/240x135/2283238_7c96_7.jpg,Infybuzz Learning,"RabbitMQ : Messaging with Java, Spring Boot And Spring MVC","Java Messaging Service (JMS) with Spring Framework. Learn Asynchronous Messaging, Queue, Exchange & Routing Of Messages",4.4,2110,All Levels,62 lectures,4 total hours,Current price: $89.99
spring mvc,https://www.udemy.com/course/microservices-with-spring-boot-and-spring-cloud/,https://img-c.udemycdn.com/course/240x135/1352468_3d97_8.jpg,in28Minutes Official,Master Microservices with Spring Boot and Spring Cloud,"Java Spring Boot Microservices 5-in-1 - Spring Boot, Spring Cloud, Docker, Kubernetes and REST API (REST Web Services)",4.6,55679,All Levels,326 lectures,25.5 total hours,Current price: $139.99
spring mvc,https://www.udemy.com/course/spring-boot-3-and-spring-framework/,https://img-c.udemycdn.com/course/240x135/6085443_ccdc_3.jpg,Shabbir Dawoodi,[NEW] Spring Boot 3 and Spring Framework 6,"Learn Java framework Spring 6, Spring MVC, Spring Boot 3, Spring JDBC, JPA,REST, MySQL, MongoDB, Kafka, Security",4.6,42,All Levels,115 lectures,11.5 total hours,Current price: $19.99
spring mvc,https://www.udemy.com/course/learn-spring-framework-the-easy-and-fun-way/,https://img-c.udemycdn.com/course/240x135/6246871_8688_2.jpg,"Sunshine Coding, Code IT","Ultimate Guide to Spring 6, Spring Boot 3 & Hibernate [NEW]","Learn Spring 6, Spring Boot 3, Spring Core, Spring REST, JPA, Spring MVC, Thymeleaf, Spring Security, Hibernate, MySQL",4.8,75,All Levels,191 lectures,22 total hours,Current price: $69.99
spring mvc,https://www.udemy.com/course/spring-professional-certification-exam-tutorial-module-05/,https://img-c.udemycdn.com/course/240x135/2701338_3992.jpg,Dominik Cebula,Spring Professional Certification Exam Tutorial - Module 05,Spring MVC and the Web Layer,4.6,642,Intermediate,12 lectures,3.5 total hours,Current price: $79.99
spring mvc,https://www.udemy.com/course/spring_boot/,https://img-c.udemycdn.com/course/240x135/5918252_a2ed_2.jpg,Shrayansh Jain,Learn Fundamentals and Basics of Spring boot,"Covered Imp topics like Spring MVC vs Spring boot, Project setup, Architecture, Bean, IOC, Dependency Injection etc.",4.8,607,Beginner,37 lectures,25 total hours,Current price: $59.99
spring mvc,https://www.udemy.com/course/spring-security-zero-to-master/,https://img-c.udemycdn.com/course/240x135/3485044_ef54_2.jpg,"Eazy Bytes, Madan Reddy","Spring Security 6 Zero to Master along with JWT,OAUTH2","Spring Security 6 , SpringBoot 3 Security, CORs,CSRF,JWT, OAUTH2, OpenID Connect, KeyCloak, Spring Authorization Server",4.7,8797,All Levels,162 lectures,25 total hours,Current price: $84.99
