skill,link,image_link,partner,title,course_description,rating,num_review,difficulty,num_lecture,duration,price
etl,https://www.udemy.com/course/the-complete-etl-testing-course/,https://img-c.udemycdn.com/course/240x135/738842_293f_3.jpg,Sid Inf,ETL Testing: From Beginner to Expert,ETL Testing: Essential course for all software testing professionals.,4.2,2507,All Levels,255 lectures,19 total hours,Current price: $69.99
etl,https://www.udemy.com/course/data-warehouse-the-ultimate-guide/,https://img-c.udemycdn.com/course/240x135/4626978_4f9c_4.jpg,Nikolai Schuler,Data Warehouse - The Ultimate Guide,"Master Data Warehousing, Dimensional Modeling & ETL process",4.6,8699,All Levels,102 lectures,9 total hours,Current price: $89.99
etl,https://www.udemy.com/course/the-data-engineer-bootcamp/,https://img-c.udemycdn.com/course/240x135/6450865_98e6.jpg,365 Careers,The Data Engineer Bootcamp 2025,"Master Data Engineering, Build Scalable Pipelines, and Land a High-Paying Job. Learn with a Silicon Valley Data Engineer",4.7,49,All Levels,115 lectures,8 total hours,Current price: $54.99
etl,https://www.udemy.com/course/become-a-data-warehouse-engineer-dwsqletlssisazure/,https://img-c.udemycdn.com/course/240x135/5340490_a6ca.jpg,247 Learning,"Become a Data Warehouse Engineer - (DW,SQL,ETL/SSIS,Azure)","Practical Data Warehousing:  Data Warehouse Design,Azure Synapse, ETL, Ingesting and Consuming Data in a Data Warehouse",4.5,16,Beginner,86 lectures,7.5 total hours,Current price: $49.99
etl,https://www.udemy.com/course/sql-for-data-engineer-etl-testing-basics-foundation/,https://img-c.udemycdn.com/course/240x135/5011158_3e0a_3.jpg,Akash Sunil Pawar,SQL Foundation for data engineer | ETL | Testing | Analytics,A comprehensive course to teach you how to complete SQL queries,4.2,79,All Levels,42 lectures,1.5 total hours,Current price: $19.99
etl,https://www.udemy.com/course/become-a-data-engineer-bi-python-sql-ssis-etl/,https://img-c.udemycdn.com/course/240x135/5740060_b1eb_3.jpg,Bluelime Learning Solutions,"Become a Data Engineer- BI, Python, SQL, SSIS, ETL","Transforming Business Intelligence with Python, SQL, SSIS, and ETL",2.5,2,Beginner,121 lectures,10.5 total hours,Current price: $19.99
etl,https://www.udemy.com/course/writing-production-ready-etl-pipelines-in-python-pandas/,https://img-c.udemycdn.com/course/240x135/4175968_6bea.jpg,Jan Schwarzlose,Writing production-ready ETL pipelines in Python / Pandas,Learn how to write professional ETL pipelines using best practices in Python and Data Engineering.,4.2,850,All Levels,79 lectures,7 total hours,Current price: $59.99
etl,https://www.udemy.com/course/etl-developer-mysql-data-migration-ms-sql-server-ssis/,https://img-c.udemycdn.com/course/240x135/5423598_75aa.jpg,Bluelime Learning Solutions,"ETL Developer - (MySQL, Data Migration ,MS SQL Server, SSIS)","Harnessing Data Power: ETL Development and Data Migration with MySQL, MS SQL Server",4.8,17,Beginner,118 lectures,8.5 total hours,Current price: $34.99
etl,https://www.udemy.com/course/etl-using-python-mysql-to-bigquery/,https://img-c.udemycdn.com/course/240x135/4295588_e5ac.jpg,Oscar Valles,ETL using Python: from MySQL to BigQuery,A course for supercharged analysts,4.4,537,Intermediate,27 lectures,3 total hours,Current price: $49.99
etl,https://www.udemy.com/course/become-an-associate-software-engineer/,https://img-c.udemycdn.com/course/240x135/5958238_8203_3.jpg,Paulo Victor Gomes,Become a Software Engineer,The Complete Guide to Becoming an Associate Software Engineer: Your Entry into the Tech World,4.8,19,All Levels,135 lectures,14.5 total hours,Current price: $19.99
etl,https://www.udemy.com/course/software-development-and-it-complete-guide-to-key-concepts/,https://img-c.udemycdn.com/course/240x135/4879694_6afd_4.jpg,Kamil Kulik • Software Engineer,Software Development and IT - Complete Guide To Key Concepts,"For new joiners in IT industry: basics of apps, APIs, testing, Cloud, GIT, deployment, containerisation, SDLC, Scrum",4.7,1213,All Levels,109 lectures,6.5 total hours,Current price: $84.99
etl,https://www.udemy.com/course/data-engineering-pythonmachine-learningetlweb-scraping/,https://img-c.udemycdn.com/course/240x135/6087623_8a0f.jpg,Bluelime Learning Solutions,"Data Engineering  : Python,Machine Learning,ETL,Web Scraping","Learn essentials of Data Engineering with Python, Data Manipulation, Machine Learning,  ETL, SSIS , Web Scraping.",4.7,11,Beginner,128 lectures,10.5 total hours,Current price: $19.99
etl,https://www.udemy.com/course/data-warehouse-etl-testing-data-quality-management-a-z/,https://img-c.udemycdn.com/course/240x135/2089692_d7b7.jpg,Lorenz D.,Data Warehouse ETL Testing & Data Quality Management A-Z,ETL Testing and Data Quality Management for beginners with practical exercises and certificate of completion.,4.4,5331,Beginner,20 lectures,2 total hours,Current price: $64.99
etl,https://www.udemy.com/course/data-integration-etl-talend-open-studio-zero-to-hero/,https://img-c.udemycdn.com/course/240x135/4296082_df35_7.jpg,"Samuel Lenk, Diamond Training",Data Integration & ETL with Talend Open Studio Zero to Hero,"Add value to your data - with Talend Open Studio for Data Integration, ETL, Data Warehousing, Data Migration, BI",4.5,1715,Beginner,139 lectures,8.5 total hours,Current price: $84.99
etl,https://www.udemy.com/course/data-engineerdata-analyst-sql-azure-etl-ssis-bi/,https://img-c.udemycdn.com/course/240x135/4369760_2219.jpg,Bluelime Learning Solutions,Data Engineer/Data Analyst - SQL | Azure | ETL | SSIS | BI,Data Extraction | Data Cleaning & Transformation | Data Visualization,3.9,39,Beginner,75 lectures,7 total hours,Current price: $54.99
etl,https://www.udemy.com/course/data-warehouse-developer-sql-serveretlssisssasssrst-sql/,https://img-c.udemycdn.com/course/240x135/3901412_7bb4.jpg,Bluelime Learning Solutions,Data Warehouse Developer-SQL Server/ETL/SSIS/SSAS/SSRS/T-SQL,Develop and Implement a Data Warehouse  Solution  Step by step,4.1,1933,Beginner,83 lectures,8 total hours,Current price: $74.99
etl,https://www.udemy.com/course/data-warehouse-etl-testing/,https://img-c.udemycdn.com/course/240x135/5159350_ba5f.jpg,Blismos Academy,Data Warehouse / ETL Testing,ETL Testing,4.3,50,Intermediate,248 lectures,23 total hours,Current price: $54.99
etl,https://www.udemy.com/course/the-ai-engineer-course-complete-ai-engineer-bootcamp/,https://img-c.udemycdn.com/course/240x135/6112535_7103.jpg,365 Careers,The AI Engineer Course 2025: Complete AI Engineer Bootcamp,"Complete AI Engineer Training: Python, NLP, Transformers, LLMs, LangChain, Hugging Face, APIs",4.6,2803,All Levels,367 lectures,24.5 total hours,Current price: $89.99
etl,https://www.udemy.com/course/software-engineering-101/,https://img-c.udemycdn.com/course/240x135/2267906_505c.jpg,Kurt Anderson,Software Engineering 101: Plan and Execute Better Software.,Software Engineering 101: Use Software Engineering to Plan and Build Amazing Software + Learn SCRUM Framework!,4.5,12113,All Levels,102 lectures,8.5 total hours,Current price: $109.99
etl,https://www.udemy.com/course/master-matillion-etl-cloud-data-integration-for-success-i/,https://img-c.udemycdn.com/course/240x135/5778778_3a1c.jpg,Kareem Ullah,Master Matillion: ETL & Cloud Data Integration for Success,"Matillion Essentials: Build ETL Solutions with Confidence, ETL Bootcamp, Matillion Associate Certification Exam Prep.",4.1,281,All Levels,21 lectures,,Current price: $29.99
