skill,link,image_link,partner,title,course_description,rating,num_review,difficulty,num_lecture,duration,price
api development,https://www.udemy.com/course/software-development-and-it-complete-guide-to-key-concepts/,https://img-c.udemycdn.com/course/240x135/4879694_6afd_4.jpg,Kamil Kulik • Software Engineer,Software Development and IT - Complete Guide To Key Concepts,"For new joiners in IT industry: basics of apps, APIs, testing, Cloud, GIT, deployment, containerisation, SDLC, Scrum",4.7,1213,All Levels,109 lectures,6.5 total hours,Current price: $84.99
api development,https://www.udemy.com/course/rest-api/,https://img-c.udemycdn.com/course/240x135/802366_74df_4.jpg,Rajeev Sakhuja,"REST API Design, Development & Management","Learn the REST API Concepts, Design best practices, Security practices, Swagger 2.0/OAI, Hands on API Management",4.5,12125,All Levels,60 lectures,7.5 total hours,Current price: $109.99
api development,https://www.udemy.com/course/become-an-associate-software-engineer/,https://img-c.udemycdn.com/course/240x135/5958238_8203_3.jpg,Paulo Victor Gomes,Become a Software Engineer,The Complete Guide to Becoming an Associate Software Engineer: Your Entry into the Tech World,4.8,19,All Levels,135 lectures,14.5 total hours,Current price: $19.99
api development,https://www.udemy.com/course/software-development-from-a-to-z/,https://img-c.udemycdn.com/course/240x135/826410_16f3_14.jpg,Karoly Nyisztor • Professional Software Architect,Software Development From A to Z - Learn What Truly Matters,"Valuable Software Development Insights: IT Roles, Agile, SCRUM, SDLC, OOP, UML, Python Programming 101, Web Development",4.5,3313,Beginner,117 lectures,6.5 total hours,Current price: $89.99
api development,https://www.udemy.com/course/the-ai-engineer-course-complete-ai-engineer-bootcamp/,https://img-c.udemycdn.com/course/240x135/6112535_7103.jpg,365 Careers,The AI Engineer Course 2025: Complete AI Engineer Bootcamp,"Complete AI Engineer Training: Python, NLP, Transformers, LLMs, LangChain, Hugging Face, APIs",4.6,2803,All Levels,367 lectures,24.5 total hours,Current price: $89.99
api development,https://www.udemy.com/course/rest-api-design-the-complete-guide/,https://img-c.udemycdn.com/course/240x135/2579842_5ea4_4.jpg,Memi Lavi,Software Architecture: REST API Design - The Complete Guide,"Become a better Software Architect by designing professional, easy to use and attractive REST API",4.5,4719,Beginner,73 lectures,4 total hours,Current price: $79.99
api development,https://www.udemy.com/course/software-engineering-101/,https://img-c.udemycdn.com/course/240x135/2267906_505c.jpg,Kurt Anderson,Software Engineering 101: Plan and Execute Better Software.,Software Engineering 101: Use Software Engineering to Plan and Build Amazing Software + Learn SCRUM Framework!,4.5,12113,All Levels,102 lectures,8.5 total hours,Current price: $109.99
api development,https://www.udemy.com/course/testerbootcamp/,https://img-c.udemycdn.com/course/240x135/2125112_86f5_8.jpg,"Tarek Roshdy, Nezam Academy, Nezam Team",The Complete 2025 Software Testing Bootcamp,Your Step-by-Step Guide to Becoming a Professional Software Tester,4.5,33946,Beginner,395 lectures,37.5 total hours,Current price: $119.99
api development,https://www.udemy.com/course/api-design-development-with-raml-building-complex-api/,https://img-c.udemycdn.com/course/240x135/4494810_961f_4.jpg,Uplatz Training,API Design & Development,"Learn API design principles. Develop API from scratch using RAML. Build complex APIs for Banking, Music, Mobile Orders.",4.2,10,All Levels,39 lectures,57 total hours,Current price: $44.99
api development,https://www.udemy.com/course/complete-web-api-course/,https://img-c.udemycdn.com/course/240x135/3702120_dcb8_6.jpg,Frank Liu,Complete Guide to Web API in .NET 8: Master API Development,Master RESTful API Development in ASP.NET Core 8: Build and Consume APIs in Real-World Applications,4.5,995,All Levels,207 lectures,23 total hours,Current price: $74.99
api development,https://www.udemy.com/course/nodejs-the-complete-guide/,https://img-c.udemycdn.com/course/240x135/1879018_95b6_3.jpg,"Academind by Maximilian Schwarzmüller, Maximilian Schwarzmüller","NodeJS - The Complete Guide (MVC, REST APIs, GraphQL, Deno)","Master Node JS & Deno.js, build REST APIs with Node.js, GraphQL APIs, add Authentication, use MongoDB, SQL & much more!",4.6,51540,All Levels,544 lectures,40.5 total hours,Current price: $149.99
api development,https://www.udemy.com/course/become-a-software-engineer/,https://img-c.udemycdn.com/course/240x135/5513466_870f_2.jpg,Board Infinity,Become a Software Development Engineer,Master C++ Data Structures: From Basic Arrays to Advanced Algorithmic Techniques.,4.1,13,Intermediate,171 lectures,59.5 total hours,Current price: $19.99
api development,https://www.udemy.com/course/software-architecture-design-of-modern-large-scale-systems/,https://img-c.udemycdn.com/course/240x135/3997622_0670_2.jpg,"Michael Pogrebinsky | Software Architecture, System Design, Java Expert, Top Developer Academy LLC",Software Architecture & Design of Modern Large Scale Systems,"Become a Software Architect or Technical Lead by Mastering Software Architecture, System Design & Big Data Processing.",4.7,11311,All Levels,45 lectures,7 total hours,Current price: $109.99
api development,https://www.udemy.com/course/the-complete-web-development-bootcamp/,https://img-c.udemycdn.com/course/240x135/1565838_e54e_18.jpg,"Dr. Angela Yu, Developer and Lead Instructor",The Complete Full-Stack Web Development Bootcamp,"Become a Full-Stack Web Developer with just ONE course. HTML, CSS, Javascript, Node, React, PostgreSQL, Web3 and DApps",4.7,431983,All Levels,374 lectures,61.5 total hours,Current price: $119.99
api development,https://www.udemy.com/course/selenium-cucumber-integration/,https://img-c.udemycdn.com/course/240x135/1287612_0451_6.jpg,"Testing World Infotech, Testing World",Practical Software Testing 2025-Manual+JIRA+API+DB+Selenium,Practical Manual Testing | Bug Reporting and Task Management with JIRA | Database Testing | Selenium with Python,4.5,1670,Intermediate,365 lectures,97.5 total hours,Current price: $84.99
api development,https://www.udemy.com/course/sdlc-software-development-life-cycle-lifecycle-process/,https://img-c.udemycdn.com/course/240x135/4374016_a9fc_2.jpg,Yogesh Dahake,SDLC - Software Development Life Cycle SDLC,Learn Software development life cycle/ Process and methodologies of developing software's with real life project.,4.4,5694,Beginner,49 lectures,2.5 total hours,Current price: $64.99
api development,https://www.udemy.com/course/introduction-to-openai-api-chatgpt-api-chatgpt-plugins/,https://img-c.udemycdn.com/course/240x135/5192882_641d_2.jpg,"Valentin Despa, Valentin Despa - Support",Introduction to OpenAI API & ChatGPT API for Developers,"Intro to GenAI. Integrate APIs from OpenAI such as ChatGPT (GPT-3.5 & GPT4), Whisper & DALL-E in your own applications",4.5,53272,All Levels,39 lectures,3 total hours,Current price: $69.99
api development,https://www.udemy.com/course/api-and-web-service-introduction/,https://img-c.udemycdn.com/course/240x135/1677376_3eac_3.jpg,Nate Ross,API and Web Service Introduction,"Includes API, Web Services using REST, JSON, XML, HTTP, SOAP, OAuth, OpenID Connect, Postman and Python",4.5,35125,Beginner,57 lectures,7 total hours,Current price: $109.99
api development,https://www.udemy.com/course/complete-software-engineering-course-build-develop-better-software/,https://img-c.udemycdn.com/course/240x135/5663686_5172_6.jpg,Yogesh Dahake,Complete Software Engineering Course : Build Better Software,"Learn Everything of Software Engineering : Plan, Design ,Develop, Test and Execute Software's using Software Engineering",4.3,228,All Levels,196 lectures,15 total hours,Current price: $19.99
api development,https://www.udemy.com/course/learn-api-development-with-fast-api-mysql-in-python/,https://img-c.udemycdn.com/course/240x135/5597032_4047_2.jpg,Pawan Deore,Learn API development with Fast API + MySQL in Python,"Get ready to master Fast API, MySQL, and Python as you build powerful and efficient APIs",4.2,33,All Levels,14 lectures,1.5 total hours,Current price: $34.99
