skill,link,image_link,partner,title,course_description,rating,num_review,difficulty,num_lecture,duration,price
groovy,https://www.udemy.com/course/apache-groovy/,https://img-c.udemycdn.com/course/240x135/756634_ad7b_5.jpg,Dan Vega,The Complete Apache Groovy Developer Course,Learn how to program using Apache Groovy.,4.4,5340,All Levels,128 lectures,13.5 total hours,Current price: $94.99
groovy,https://www.udemy.com/course/groovy-fundamentals-for-testers-step-by-step/,https://img-c.udemycdn.com/course/240x135/1675730_1721_3.jpg,Krishna Sakinala,Groovy Fundamentals For Testers - Step By Step,Groovy for Selenium and SoapUI,4.4,360,Beginner,64 lectures,9 total hours,Current price: $74.99
groovy,https://www.udemy.com/course/groovy-basics/,https://img-c.udemycdn.com/course/240x135/866154_9e6b_3.jpg,Abode QA,Learn groovy programming basics,Groovy: A companion to your SoapUI automation.,3.6,88,All Levels,22 lectures,2.5 total hours,Current price: $54.99
groovy,https://www.udemy.com/course/groovy-programming-fundamentals-for-java-developers/,https://img-c.udemycdn.com/course/240x135/3345426_c45d_2.jpg,Matt Speake,Groovy Programming Fundamentals for Java Developers,Supercharge your productivity by understanding the quickest way to write Java-based applications!,4.4,105,All Levels,49 lectures,2.5 total hours,Current price: $54.99
groovy,https://www.udemy.com/course/become-an-associate-software-engineer/,https://img-c.udemycdn.com/course/240x135/5958238_8203_3.jpg,Paulo Victor Gomes,Become a Software Engineer,The Complete Guide to Becoming an Associate Software Engineer: Your Entry into the Tech World,4.8,19,All Levels,135 lectures,14.5 total hours,Current price: $19.99
groovy,https://www.udemy.com/course/software-development-and-it-complete-guide-to-key-concepts/,https://img-c.udemycdn.com/course/240x135/4879694_6afd_4.jpg,Kamil Kulik • Software Engineer,Software Development and IT - Complete Guide To Key Concepts,"For new joiners in IT industry: basics of apps, APIs, testing, Cloud, GIT, deployment, containerisation, SDLC, Scrum",4.7,1213,All Levels,109 lectures,6.5 total hours,Current price: $84.99
groovy,https://www.udemy.com/course/software-engineering-101/,https://img-c.udemycdn.com/course/240x135/2267906_505c.jpg,Kurt Anderson,Software Engineering 101: Plan and Execute Better Software.,Software Engineering 101: Use Software Engineering to Plan and Build Amazing Software + Learn SCRUM Framework!,4.5,12113,All Levels,102 lectures,8.5 total hours,Current price: $109.99
groovy,https://www.udemy.com/course/soapui-with-groovy-with-realtime-projects/,https://img-c.udemycdn.com/course/240x135/675248_b27e_9.jpg,Automation World,WebServices/API Testing by SoapUI & ReadyAPI - Groovy |30+hr,"Detailed Groovy + Certification Coverage + Soapui tutorial, Rest API Testing, Soap UI Free & Pro",4.5,1733,All Levels,257 lectures,31 total hours,Current price: $79.99
groovy,https://www.udemy.com/course/testerbootcamp/,https://img-c.udemycdn.com/course/240x135/2125112_86f5_8.jpg,"Tarek Roshdy, Nezam Academy, Nezam Team",The Complete 2025 Software Testing Bootcamp,Your Step-by-Step Guide to Becoming a Professional Software Tester,4.5,33957,Beginner,395 lectures,37.5 total hours,Current price: $119.99
groovy,https://www.udemy.com/course/google-cloud-certification-associate-cloud-engineer/,https://img-c.udemycdn.com/course/240x135/3827154_aecc_4.jpg,"in28Minutes Official, Ranga Karanam | GCP Certification - Google Cloud Engineer & Architect",GCP Associate Cloud Engineer - Google Cloud Certification,GCP ACE - Google Cloud Associate Cloud Engineer certification. Begin your Google Cloud Platform - GCP journey!,4.6,31693,All Levels,299 lectures,18 total hours,Current price: $109.99
groovy,https://www.udemy.com/course/readyapi/,https://img-c.udemycdn.com/course/240x135/1159826_22f1.jpg,Testing World,Step by Step API Automation with ReadyAPI (SOAPUI PRO)Groovy,"Detailed Groovy +Certification Coverage + Step by Step tutorial, Rest API Testing terminology",4.2,249,All Levels,80 lectures,8.5 total hours,Current price: $64.99
groovy,https://www.udemy.com/course/the-ai-engineer-course-complete-ai-engineer-bootcamp/,https://img-c.udemycdn.com/course/240x135/6112535_7103.jpg,365 Careers,The AI Engineer Course 2025: Complete AI Engineer Bootcamp,"Complete AI Engineer Training: Python, NLP, Transformers, LLMs, LangChain, Hugging Face, APIs",4.6,2803,All Levels,367 lectures,24.5 total hours,Current price: $89.99
groovy,https://www.udemy.com/course/software-engineer-interview-unleashed/,https://img-c.udemycdn.com/course/240x135/960796_025f_4.jpg,Jeff Bae,Software Engineer Interview Unleashed,Learn how to make yourself ready for software engineer interviews from a former Google interviewer.,4.2,1206,All Levels,41 lectures,7 total hours,Current price: $69.99
groovy,https://www.udemy.com/course/software-architecture-design-of-modern-large-scale-systems/,https://img-c.udemycdn.com/course/240x135/3997622_0670_2.jpg,"Michael Pogrebinsky | Software Architecture, System Design, Java Expert, Top Developer Academy LLC",Software Architecture & Design of Modern Large Scale Systems,"Become a Software Architect or Technical Lead by Mastering Software Architecture, System Design & Big Data Processing.",4.7,11311,All Levels,45 lectures,7 total hours,Current price: $109.99
groovy,https://www.udemy.com/course/low-level-system-design/,https://img-c.udemycdn.com/course/240x135/6213077_f96e_4.jpg,Prateek Narang Sr. Software Engineer Google,"Low Level System Design, Design Patterns & SOLID Principles",Master Proven Design Techniques and SOLID Principles to Build Robust and Scalable Systems!,4.6,473,All Levels,70 lectures,9 total hours,Current price: $74.99
groovy,https://www.udemy.com/course/spring-boot-for-software-engineers/,https://img-c.udemycdn.com/course/240x135/1418878_58b5_2.jpg,Nelson Jamal,Spring Boot For Software Engineers,Build enterprise restful API's,4.7,1260,,Expert,6.5 total hours,Current price: $59.99
groovy,https://www.udemy.com/course/the-complete-guide-to-becoming-a-software-architect/,https://img-c.udemycdn.com/course/240x135/2304734_767b.jpg,Memi Lavi,The Complete Guide to Becoming a Software Architect,"The most comprehensive guide that will make you a Software Architect, the most desired role in the software industry.",4.6,16080,Beginner,117 lectures,6 total hours,Current price: $159.99
groovy,https://www.udemy.com/course/manual-and-automation-software-testing-with-help-of-chatgpt/,https://img-c.udemycdn.com/course/240x135/5285970_8863_3.jpg,"Mark Shrike, Viсtoria N, Andrii Kuchyrenko",Manual and Automation Software Testing with help of ChatGPT,Discover how QA Engineers and Software Testers can use Generative AI (GenAI) for manual and automated software testing,4.6,545,All Levels,64 lectures,16 total hours,Current price: $69.99
groovy,https://www.udemy.com/course/master-uml-pro-with-ease-unlock-your-future-software-architect/,https://img-c.udemycdn.com/course/240x135/5525234_4c7f_7.jpg,Santanu Das,UML Course for Software Engineers!,Unlock Architect-Level Design Skills with UML and AI: Turn Complex Systems into Child's Play!,4.5,30,All Levels,39 lectures,7.5 total hours,Current price: $49.99
groovy,https://www.udemy.com/course/complete-software-engineering-course-build-develop-better-software/,https://img-c.udemycdn.com/course/240x135/5663686_5172_6.jpg,Yogesh Dahake,Complete Software Engineering Course : Build Better Software,"Learn Everything of Software Engineering : Plan, Design ,Develop, Test and Execute Software's using Software Engineering",4.3,228,All Levels,196 lectures,15 total hours,Current price: $19.99
