skill,link,image_link,partner,title,course_description,rating,num_review,difficulty,num_lecture,duration,price
css,https://www.udemy.com/course/css-the-complete-guide-incl-flexbox-grid-sass/,https://img-c.udemycdn.com/course/240x135/1561458_7f3b_2.jpg,"Academind by Maximilian Schwarzmüller, Maximilian Schwarzmüller, Manuel Lorenz","CSS - The Complete Guide 2025 (incl. Flexbox, Grid & Sass)",Learn CSS for the first time or brush up your CSS skills and dive in even deeper. EVERY web developer has to know CSS.,4.6,19432,All Levels,297 lectures,23 total hours,Current price: $129.99
css,https://www.udemy.com/course/design-and-develop-a-killer-website-with-html5-and-css3/,https://img-c.udemycdn.com/course/240x135/437398_46c3_10.jpg,Jonas Schmedtmann,Build Responsive Real-World Websites with HTML and CSS,"Learn modern HTML5, CSS3 and web design by building a stunning website for your portfolio! Includes flexbox and CSS Grid",4.7,112855,All Levels,149 lectures,37.5 total hours,Current price: $159.99
css,https://www.udemy.com/course/learn-html-and-css-in-7-days-web-developer-bootcamp/,https://img-c.udemycdn.com/course/240x135/6096683_cc99_3.jpg,Fabian & Pavel Coding2GO,Learn HTML and CSS in 7 Days | Web Developer Bootcamp,"Create amazing websites with HTML, CSS and learn responsive web design with CSS Flexbox and Grid Layouts",4.8,399,Beginner,105 lectures,6 total hours,Current price: $19.99
css,https://www.udemy.com/course/advanced-css-and-sass/,https://img-c.udemycdn.com/course/240x135/1026604_790b_2.jpg,Jonas Schmedtmann,"Advanced CSS and Sass: Flexbox, Grid, Animations and More!","The most advanced and modern CSS course on the internet: master flexbox, CSS Grid, responsive design, and so much more.",4.7,45349,Intermediate,126 lectures,28 total hours,Current price: $139.99
css,https://www.udemy.com/course/become-an-associate-software-engineer/,https://img-c.udemycdn.com/course/240x135/5958238_8203_3.jpg,Paulo Victor Gomes,Become a Software Engineer,The Complete Guide to Becoming an Associate Software Engineer: Your Entry into the Tech World,4.8,19,All Levels,135 lectures,14.5 total hours,Current price: $19.99
css,https://www.udemy.com/course/css-course-css/,https://img-c.udemycdn.com/course/240x135/393928_0e1c_6.jpg,Andrew Williams,CSS for beginners,CSS for Beginners Course.  Learn CSS basics to Tweak your Website - No experience required.,4.7,189,Beginner,34 lectures,3.5 total hours,Current price: $64.99
css,https://www.udemy.com/course/html-and-css-bootcamp/,https://img-c.udemycdn.com/course/240x135/5088684_a587_7.jpg,Colt Steele,The HTML & CSS Bootcamp 2025 Edition,"Brand New Course! Covers Flexbox, CSS Grid,  Animations, Responsive Design and More! Tons of Exercises & Projects.",4.7,3424,Beginner,318 lectures,37 total hours,Current price: $94.99
css,https://www.udemy.com/course/creative-css-drawing-course-make-art-with-css/,https://img-c.udemycdn.com/course/240x135/3034356_9833_7.jpg,Ahmed Sadek,Creative CSS Drawing Course : Make Art With CSS,"level up your CSS skills by learning how to create more than 30 drawings, shapes and logos using only CSS.",4.8,234,All Levels,42 lectures,6.5 total hours,Current price: $64.99
css,https://www.udemy.com/course/understanding-html-and-css/,https://img-c.udemycdn.com/course/240x135/3223049_5074_3.jpg,Anthony Alicea,Understanding HTML and CSS  (2025 Edition),"NEWLY UPDATED! Modern HTML/CSS: Layers, Containers, :has, Nesting, Grid, Flexbox, Semantic HTML, Multiple projects, AI",4.7,2573,All Levels,263 lectures,18 total hours,Current price: $84.99
css,https://www.udemy.com/course/modern-html-css-from-the-beginning/,https://img-c.udemycdn.com/course/240x135/2153774_bef0_5.jpg,Brad Traversy,Modern HTML & CSS From The Beginning 2.0 (2024 Revamp),"Build modern responsive websites with HTML and CSS - Learning modules, mini-projects and 3 full websites",4.7,27756,All Levels,200 lectures,24.5 total hours,Current price: $124.99
css,https://www.udemy.com/course/the-complete-web-development-bootcamp/,https://img-c.udemycdn.com/course/240x135/1565838_e54e_18.jpg,"Dr. Angela Yu, Developer and Lead Instructor",The Complete Full-Stack Web Development Bootcamp,"Become a Full-Stack Web Developer with just ONE course. HTML, CSS, Javascript, Node, React, PostgreSQL, Web3 and DApps",4.7,431983,All Levels,374 lectures,61.5 total hours,Current price: $119.99
css,https://www.udemy.com/course/css_grid/,https://img-c.udemycdn.com/course/240x135/3730856_099b_2.jpg,"Code gurus by Catalin, Dennis Singh",CSS Grid Masterclass,"CSS Grid: The most powerful CSS layout system including responsiveness, positioning, layering etc.",4.4,21,All Levels,56 lectures,8 total hours,Current price: $19.99
css,https://www.udemy.com/course/css-bootcamp-master-in-css-including-css-grid-flexbox/,https://img-c.udemycdn.com/course/240x135/1693826_5759_2.jpg,"Code And Create, George Lomidze, Lasha Nozadze",CSS Bootcamp - Master CSS (CSS Grid / CSS Flexbox),"CSS Course - Project Based CSS Tutorial. Learn how to create modern, responsive websites using CSS / CSS Grid / Flexbox",4.6,1462,All Levels,89 lectures,11.5 total hours,Current price: $79.99
css,https://www.udemy.com/course/css-for-everybody-the-perfect-beginner-course-with-tutorials-and-tips/,https://img-c.udemycdn.com/course/240x135/3592712_192c.jpg,Kalob Taulien,CSS for Everybody: From beginner to boss,Learn CSS from the ground up. Absolutely no experience required. This course will take you all the way to expert level.,4.7,33,All Levels,76 lectures,4.5 total hours,Current price: $54.99
css,https://www.udemy.com/course/javascript-master-class-with-html-and-css/,https://img-c.udemycdn.com/course/240x135/4382830_3daf_4.jpg,Isaiah Harrison,JavaScript Master Class for 2025 with HTML and CSS,"Modern JavaScript from the beginning - learn fast with concise lecture, 15+ projects, & 40+ quizzes, HTML & CSS included",4.7,201,Beginner,208 lectures,12 total hours,Current price: $19.99
css,https://www.udemy.com/course/all-in-1-css-course/,https://img-c.udemycdn.com/course/240x135/4270072_933b_2.jpg,Supriyo Kundu,"All in 1 CSS Course : Learn CSS, Sass, Grid, Flex, Animation","Learn Complete CSS from basics to Grid, Flex, Sass, Shapes, Pseudo Elements, Hover Effects, Character Animations & more",4.7,30,All Levels,147 lectures,23 total hours,Current price: $74.99
css,https://www.udemy.com/course/css-animation-transitions-and-transforms-creativity-course/,https://img-c.udemycdn.com/course/240x135/1908196_f5b8_3.jpg,Ahmed Sadek,Creative Advanced CSS & JavaScript Animations - 150 Projects,"Master Advanced CSS & JavaScript Animations, Transitions and Transforms And Practice with 150 Creative Projects!",4.6,2351,All Levels,167 lectures,19.5 total hours,Current price: $84.99
css,https://www.udemy.com/course/50-web-projects-with-html-css-and-javascript/,https://img-c.udemycdn.com/course/240x135/4663468_cc81_2.jpg,"Code And Create, George Lomidze, Lasha Nozadze","50+ Web Projects with HTML, CSS, and JavaScript","HTML, CSS, and JavaScript. Build 50+ Web Projects with HTML, CSS, and JavaScript",4.7,384,All Levels,101 lectures,25 total hours,Current price: $89.99
css,https://www.udemy.com/course/advanced-css-for-web-developers/,https://img-c.udemycdn.com/course/240x135/3559315_0537.jpg,"Eduonix Learning Solutions, Eduonix-Tech .",Advanced CSS For Web Developers,The most comprehensive program to learn and master modern CSS development,4.5,51,Beginner,105 lectures,10.5 total hours,Current price: $39.99
css,https://www.udemy.com/course/tailwind-css-zero-to-hero/,https://img-c.udemycdn.com/course/240x135/4915540_804a_6.jpg,"Tom Phillips, WebDevEducation (Tom Phillips)",Tailwind CSS v4 - Beginner to Pro,Tailwind CSS - effortlessly build a tailwind css music festival site and learn to customize and extend tailwind css!,4.7,681,All Levels,34 lectures,4 total hours,Current price: $69.99
