skill,link,image_link,partner,title,course_description,rating,num_review,difficulty,num_lecture,duration,price
web services,https://www.udemy.com/course/become-an-associate-software-engineer/,https://img-c.udemycdn.com/course/240x135/5958238_8203_3.jpg,Paulo Victor Gomes,Become a Software Engineer,The Complete Guide to Becoming an Associate Software Engineer: Your Entry into the Tech World,4.8,19,All Levels,135 lectures,14.5 total hours,Current price: $19.99
web services,https://www.udemy.com/course/software-architecture-design-of-modern-large-scale-systems/,https://img-c.udemycdn.com/course/240x135/3997622_0670_2.jpg,"Michael Pogrebinsky | Software Architecture, System Design, Java Expert, Top Developer Academy LLC",Software Architecture & Design of Modern Large Scale Systems,"Become a Software Architect or Technical Lead by Mastering Software Architecture, System Design & Big Data Processing.",4.7,11311,All Levels,45 lectures,7 total hours,Current price: $109.99
web services,https://www.udemy.com/course/spring-web-services-tutorial/,https://img-c.udemycdn.com/course/240x135/1302610_5c62_4.jpg,in28Minutes Official,Master Java Web Services and REST API with Spring Boot,Build Java Web Services & REST API - RESTful & SOAP - with Spring & Spring Boot. Learn REST API & SOAP Web Services Now!,4.5,16044,All Levels,154 lectures,13.5 total hours,Current price: $129.99
web services,https://www.udemy.com/course/the-complete-web-development-bootcamp/,https://img-c.udemycdn.com/course/240x135/1565838_e54e_18.jpg,"Dr. Angela Yu, Developer and Lead Instructor",The Complete Full-Stack Web Development Bootcamp,"Become a Full-Stack Web Developer with just ONE course. HTML, CSS, Javascript, Node, React, PostgreSQL, Web3 and DApps",4.7,431983,All Levels,374 lectures,61.5 total hours,Current price: $119.99
web services,https://www.udemy.com/course/software-engineering-101/,https://img-c.udemycdn.com/course/240x135/2267906_505c.jpg,Kurt Anderson,Software Engineering 101: Plan and Execute Better Software.,Software Engineering 101: Use Software Engineering to Plan and Build Amazing Software + Learn SCRUM Framework!,4.5,12122,All Levels,102 lectures,8.5 total hours,Current price: $109.99
web services,https://www.udemy.com/course/the-complete-guide-to-becoming-a-software-architect/,https://img-c.udemycdn.com/course/240x135/2304734_767b.jpg,Memi Lavi,The Complete Guide to Becoming a Software Architect,"The most comprehensive guide that will make you a Software Architect, the most desired role in the software industry.",4.6,16096,Beginner,117 lectures,6 total hours,Current price: $159.99
web services,https://www.udemy.com/course/application-programming-interface/,https://img-c.udemycdn.com/course/240x135/4322366_8082_2.jpg,Eric Roby,Application Programming Interface: API and Web Services,"Learn APIs and Web Services using REST, SOAP, JSON, XML, HTTP, Authorization, Authentication, JWT, Postman and Python",4.3,198,All Levels,56 lectures,4.5 total hours,Current price: $59.99
web services,https://www.udemy.com/course/api-and-web-service-introduction/,https://img-c.udemycdn.com/course/240x135/1677376_3eac_3.jpg,Nate Ross,API and Web Service Introduction,"Includes API, Web Services using REST, JSON, XML, HTTP, SOAP, OAuth, OpenID Connect, Postman and Python",4.5,35125,Beginner,57 lectures,7 total hours,Current price: $109.99
web services,https://www.udemy.com/course/java-web-services/,https://img-c.udemycdn.com/course/240x135/345340_1d59_8.jpg,Bharath Thippireddy,Java Web Services,"Learn how to design,create , consume and secure SOAP   and REST web services  from scratch in easy steps.",4.3,9634,All Levels,338 lectures,17 total hours,Current price: $119.99
web services,https://www.udemy.com/course/soap-web-services-mastering-api-design-and-implementation/,https://img-c.udemycdn.com/course/240x135/6288319_d1dc.jpg,EDUCBA Bridging the Gap,SOAP Web Services: Mastering API Design and Implementation,"Master SOAP and REST APIs, explore web development basics, and dive into real-world projects with this course!",4.6,13,All Levels,102 lectures,14 total hours,Current price: $69.99
web services,https://www.udemy.com/course/the-ai-engineer-course-complete-ai-engineer-bootcamp/,https://img-c.udemycdn.com/course/240x135/6112535_7103.jpg,365 Careers,The AI Engineer Course 2025: Complete AI Engineer Bootcamp,"Complete AI Engineer Training: Python, NLP, Transformers, LLMs, LangChain, Hugging Face, APIs",4.6,2803,All Levels,367 lectures,24.5 total hours,Current price: $89.99
web services,https://www.udemy.com/course/learn-html-javascript-restful-api-from-scratch-web-services/,https://img-c.udemycdn.com/course/240x135/4717918_ce38_4.jpg,Metla Sudha Sekhar,"Learn Restful WEB API, JavaScript and HTML: Web Services","Restful Web API Services PHP with MySQL, POSTMAN, JSON object and JWT token authentication",4.4,99,All Levels,111 lectures,12 total hours,Current price: $54.99
web services,https://www.udemy.com/course/100-days-of-code/,https://img-c.udemycdn.com/course/240x135/2776760_f176_10.jpg,"Dr. Angela Yu, Developer and Lead Instructor",100 Days of Code: The Complete Python Pro Bootcamp,"Master Python by building 100 projects in 100 days. Learn data science, automation, build websites, games and apps!",4.7,361848,All Levels,592 lectures,56.5 total hours,Current price: $119.99
web services,https://www.udemy.com/course/google-cloud-gcp-professional-data-engineer-certification/,https://img-c.udemycdn.com/course/240x135/4095980_4e90_18.jpg,"Ankit Mistry : 150,000+ Students, GCP Certification - Google Cloud Academy | Associate Cloud & Professional Engineer Certifications",GCP - Google Cloud Professional Data Engineer Certification,"Learn Google Cloud Professional Data Engineer Certification with 80+ Hands-on demo on storage, Database, ML GCP Services",4.4,4721,All Levels,268 lectures,32.5 total hours,Current price: $94.99
web services,https://www.udemy.com/course/the-web-developer-bootcamp/,https://img-c.udemycdn.com/course/240x135/625204_436a_3.jpg,Colt Steele,The Web Developer Bootcamp 2025,"With 10 Hours of React added. Become a Developer With ONE course - HTML, CSS, JavaScript, React, Node, MongoDB and More!",4.7,279902,All Levels,730 lectures,74 total hours,Current price: $149.99
web services,https://www.udemy.com/course/google-cloud-certification-associate-cloud-engineer/,https://img-c.udemycdn.com/course/240x135/3827154_aecc_4.jpg,"in28Minutes Official, Ranga Karanam | GCP Certification - Google Cloud Engineer & Architect",GCP Associate Cloud Engineer - Google Cloud Certification,GCP ACE - Google Cloud Associate Cloud Engineer certification. Begin your Google Cloud Platform - GCP journey!,4.6,31693,All Levels,299 lectures,18 total hours,Current price: $109.99
web services,https://www.udemy.com/course/connect-systems-with-sap-web-services-using-sap-soa-manager/,https://img-c.udemycdn.com/course/240x135/2481224_d022_5.jpg,Vishal Saxena,Connect Systems with SAP Web Services using SAP SOA MANAGER,"Best course to learn how to create, build and consume Web Services in SAP using SOA MANAGER with practical examples",4.3,246,All Levels,7 lectures,1.5 total hours,Current price: $29.99
web services,https://www.udemy.com/course/soap-with-spring-web-services/,https://img-c.udemycdn.com/course/240x135/2319594_0b27_4.jpg,Nicolaas Kock,SOAP with Spring Web Services in IntelliJ,How to implement and test a contract first SOAP web service with Spring Web Services in IntelliJ,3.9,77,Intermediate,24 lectures,2.5 total hours,Current price: $39.99
web services,https://www.udemy.com/course/python-for-software-engineering/,https://img-c.udemycdn.com/course/240x135/4510136_b0f4_2.jpg,Max A,Python for Software Engineering Bootcamp,Go from zero to software engineer,4.4,361,Beginner,185 lectures,41 total hours,Current price: $64.99
web services,https://www.udemy.com/course/rest-api-using-java/,https://img-c.udemycdn.com/course/240x135/1958098_d9db_4.jpg,"StudyEasy Organization, Chand Sheikh",Master Java Web Services: Restful API (JAX RS),"Learn building Restful API based application with Java, FREE 6-month IDE.",4.5,126,Beginner,89 lectures,10.5 total hours,Current price: $64.99
