skill,link,image_link,partner,title,course_description,rating,num_review,difficulty,num_lecture,duration,price
rest,https://www.udemy.com/course/rest-api-design-the-complete-guide/,https://img-c.udemycdn.com/course/240x135/2579842_5ea4_4.jpg,Memi Lavi,Software Architecture: REST API Design - The Complete Guide,"Become a better Software Architect by designing professional, easy to use and attractive REST API",4.5,4722,Beginner,73 lectures,4 total hours,Current price: $79.99
rest,https://www.udemy.com/course/software-development-and-it-complete-guide-to-key-concepts/,https://img-c.udemycdn.com/course/240x135/4879694_6afd_4.jpg,Kamil Kulik • Software Engineer,Software Development and IT - Complete Guide To Key Concepts,"For new joiners in IT industry: basics of apps, APIs, testing, Cloud, GIT, deployment, containerisation, SDLC, Scrum",4.7,1213,All Levels,109 lectures,6.5 total hours,Current price: $84.99
rest,https://www.udemy.com/course/rest-api-automation-testing-rest-assured/,https://img-c.udemycdn.com/course/240x135/694982_33b0_3.jpg,Rahul Shetty,Rest API Testing (Automation) from Scratch-Rest Assured Java,Top Ranked #1 Rest API Test Automation & postman tutorial with Java from Basics to Framework with Real time examples,4.6,42223,All Levels,151 lectures,24.5 total hours,Current price: $149.99
rest,https://www.udemy.com/course/become-an-associate-software-engineer/,https://img-c.udemycdn.com/course/240x135/5958238_8203_3.jpg,Paulo Victor Gomes,Become a Software Engineer,The Complete Guide to Becoming an Associate Software Engineer: Your Entry into the Tech World,4.8,19,All Levels,135 lectures,14.5 total hours,Current price: $19.99
rest,https://www.udemy.com/course/postman-the-complete-guide/,https://img-c.udemycdn.com/course/240x135/1265410_cb96_4.jpg,"Valentin Despa, Valentin Despa - Support",Postman: The Complete Guide - REST API Testing,"Postman API testing for manual and automated tests. Automate with Newman, GitLab, Jenkins or any other CI tool.",4.7,20716,All Levels,270 lectures,21.5 total hours,Current price: $109.99
rest,https://www.udemy.com/course/testerbootcamp/,https://img-c.udemycdn.com/course/240x135/2125112_86f5_8.jpg,"Tarek Roshdy, Nezam Academy, Nezam Team",The Complete 2025 Software Testing Bootcamp,Your Step-by-Step Guide to Becoming a Professional Software Tester,4.5,33957,Beginner,395 lectures,37.5 total hours,Current price: $119.99
rest,https://www.udemy.com/course/api-with-postman-for-absolute-beginners/,https://img-c.udemycdn.com/course/240x135/2912472_af7b_3.jpg,"Valentin Despa, Valentin Despa - Support",Introduction to REST APIs for Absolute Beginners,Learn how to use Postman to build REST & GraphQL requests,4.7,6118,Beginner,51 lectures,3.5 total hours,Current price: $79.99
rest,https://www.udemy.com/course/software-architecture-design-of-modern-large-scale-systems/,https://img-c.udemycdn.com/course/240x135/3997622_0670_2.jpg,"Michael Pogrebinsky | Software Architecture, System Design, Java Expert, Top Developer Academy LLC",Software Architecture & Design of Modern Large Scale Systems,"Become a Software Architect or Technical Lead by Mastering Software Architecture, System Design & Big Data Processing.",4.7,11311,All Levels,45 lectures,7 total hours,Current price: $109.99
rest,https://www.udemy.com/course/software-engineering-101/,https://img-c.udemycdn.com/course/240x135/2267906_505c.jpg,Kurt Anderson,Software Engineering 101: Plan and Execute Better Software.,Software Engineering 101: Use Software Engineering to Plan and Build Amazing Software + Learn SCRUM Framework!,4.5,12122,All Levels,102 lectures,8.5 total hours,Current price: $109.99
rest,https://www.udemy.com/course/rest-api/,https://img-c.udemycdn.com/course/240x135/802366_74df_4.jpg,Rajeev Sakhuja,"REST API Design, Development & Management","Learn the REST API Concepts, Design best practices, Security practices, Swagger 2.0/OAI, Hands on API Management",4.5,12125,All Levels,60 lectures,7.5 total hours,Current price: $109.99
rest,https://www.udemy.com/course/spring-boot-for-software-engineers/,https://img-c.udemycdn.com/course/240x135/1418878_58b5_2.jpg,Nelson Jamal,Spring Boot For Software Engineers,Build enterprise restful API's,4.7,1260,,Expert,6.5 total hours,Current price: $59.99
rest,https://www.udemy.com/course/the-complete-guide-to-becoming-a-software-architect/,https://img-c.udemycdn.com/course/240x135/2304734_767b.jpg,Memi Lavi,The Complete Guide to Becoming a Software Architect,"The most comprehensive guide that will make you a Software Architect, the most desired role in the software industry.",4.6,16096,Beginner,117 lectures,6 total hours,Current price: $159.99
rest,https://www.udemy.com/course/the-ai-engineer-course-complete-ai-engineer-bootcamp/,https://img-c.udemycdn.com/course/240x135/6112535_7103.jpg,365 Careers,The AI Engineer Course 2025: Complete AI Engineer Bootcamp,"Complete AI Engineer Training: Python, NLP, Transformers, LLMs, LangChain, Hugging Face, APIs",4.6,2803,All Levels,367 lectures,24.5 total hours,Current price: $89.99
rest,https://www.udemy.com/course/selenium-cucumber-integration/,https://img-c.udemycdn.com/course/240x135/1287612_0451_6.jpg,"Testing World Infotech, Testing World",Practical Software Testing 2025-Manual+JIRA+API+DB+Selenium,Practical Manual Testing | Bug Reporting and Task Management with JIRA | Database Testing | Selenium with Python,4.5,1670,Intermediate,365 lectures,97.5 total hours,Current price: $84.99
rest,https://www.udemy.com/course/spring-web-services-tutorial/,https://img-c.udemycdn.com/course/240x135/1302610_5c62_4.jpg,in28Minutes Official,Master Java Web Services and REST API with Spring Boot,Build Java Web Services & REST API - RESTful & SOAP - with Spring & Spring Boot. Learn REST API & SOAP Web Services Now!,4.5,16044,All Levels,154 lectures,13.5 total hours,Current price: $129.99
rest,https://www.udemy.com/course/django-rest-framework/,https://img-c.udemycdn.com/course/240x135/3856080_6aff_7.jpg,Shubham Sarda,Build REST APIs with Django REST Framework and Python,"Learn Basics to Advanced Django REST Framework by building IMDB API Clone (JWT, Token, Throttling, Pagination, Testing)",4.5,1827,All Levels,74 lectures,13 total hours,Current price: $74.99
rest,https://www.udemy.com/course/spring-springboot-jpa-hibernate-zero-to-master/,https://img-c.udemycdn.com/course/240x135/4364200_0221_5.jpg,"Eazy Bytes, Madan Reddy","[NEW] Master Spring 6, Spring Boot 3, REST, JPA, Hibernate","Master Java framework Spring 6, AOP, Spring MVC, Spring Boot 3, Thymeleaf, Spring Security 6, Spring JDBC, JPA,REST",4.6,4891,Beginner,251 lectures,36.5 total hours,Current price: $89.99
rest,https://www.udemy.com/course/complete-software-engineering-course-build-develop-better-software/,https://img-c.udemycdn.com/course/240x135/5663686_5172_6.jpg,Yogesh Dahake,Complete Software Engineering Course : Build Better Software,"Learn Everything of Software Engineering : Plan, Design ,Develop, Test and Execute Software's using Software Engineering",4.3,228,All Levels,196 lectures,15 total hours,Current price: $19.99
rest,https://www.udemy.com/course/spring-hibernate-tutorial/,https://img-c.udemycdn.com/course/240x135/647428_be28_10.jpg,Chad Darby,"[NEW] Spring Boot 3, Spring 6 & Hibernate for Beginners","Spring Boot 3: Learn Spring 6, Spring Core, Spring REST, Spring MVC, Spring Security, Thymeleaf, JPA, Hibernate, MySQL",4.6,88573,All Levels,403 lectures,34.5 total hours,Current price: $109.99
rest,https://www.udemy.com/course/spring-boot-rest-apis-ultimate/,https://img-c.udemycdn.com/course/240x135/4700982_5b9e_4.jpg,Nam Ha Minh,Spring Boot REST APIs Ultimate Course,"Hands-on REST API Development with Spring Boot: Design, Implement, Document, Secure, Test, Consume RESTful APIs",4.4,171,All Levels,230 lectures,49.5 total hours,Current price: $69.99
