skill,link,image_link,partner,title,course_description,rating,num_review,difficulty,num_lecture,duration,price
perl,https://www.udemy.com/course/enhance-your-skill-set-with-perl/,https://img-c.udemycdn.com/course/240x135/965166_f762_3.jpg,Darryl Pace,Enhance Your Skill Set with Perl,"See Perl work, Hear Perl explained, Practice Perl to be an even more Skilled, Versatile, and Valuable I.T. Professional",4.5,704,Beginner,115 lectures,16 total hours,Current price: $69.99
perl,https://www.udemy.com/course/perl-programming-for-beginners/,https://img-c.udemycdn.com/course/240x135/648022_8693_3.jpg,Stone River eLearning,Perl Programming for Beginners,Perl application,4.4,1396,All Levels,70 lectures,7.5 total hours,Current price: $64.99
perl,https://www.udemy.com/course/perl-programming-course/,https://img-c.udemycdn.com/course/240x135/6067963_7620.jpg,The Tech Courses,The Complete Course of Perl Programming 2025,Learn Perl Programming like a Professional. Start from the basis and finish mastering Perl Script. From ZERO to HERO!,3.6,19,All Levels,64 lectures,12 total hours,Current price: $19.99
perl,https://www.udemy.com/course/perltutorial/,https://img-c.udemycdn.com/course/240x135/38915_03af_5.jpg,John Purcell,Learn Perl 5 By Doing It,"Learn Perl by actually creating useful, working Perl programs for everything from web scraping to fixing your data.",4.5,2652,Intermediate,68 lectures,14.5 total hours,Current price: $94.99
perl,https://www.udemy.com/course/the-complete-web-development-bootcamp/,https://img-c.udemycdn.com/course/240x135/1565838_e54e_18.jpg,"Dr. Angela Yu, Developer and Lead Instructor",The Complete Full-Stack Web Development Bootcamp,"Become a Full-Stack Web Developer with just ONE course. HTML, CSS, Javascript, Node, React, PostgreSQL, Web3 and DApps",4.7,431983,All Levels,374 lectures,61.5 total hours,Current price: $119.99
perl,https://www.udemy.com/course/the-complete-perl-programming-course/,https://img-c.udemycdn.com/course/240x135/5673792_c93e_2.jpg,Codestars • over 2 million students worldwide!,The Complete Perl Programming Course,"Master the building blocks of Perl, then build a Log Analyser to gather system and performance data!",4.4,16,Beginner,32 lectures,6 total hours,Current price: $19.99
perl,https://www.udemy.com/course/master-perl-programming-from-beginner-to-expert-2025/,https://img-c.udemycdn.com/course/240x135/6479769_a988_2.jpg,Chandan Kumar,Master Perl Programming: From Beginner to Expert (2025),"Learn Perl Programming: Master Regex, File Handling, Web Scraping, and Automation",4.5,5,All Levels,44 lectures,5 total hours,Current price: $54.99
perl,https://www.udemy.com/course/100-days-of-code/,https://img-c.udemycdn.com/course/240x135/2776760_f176_10.jpg,"Dr. Angela Yu, Developer and Lead Instructor",100 Days of Code: The Complete Python Pro Bootcamp,"Master Python by building 100 projects in 100 days. Learn data science, automation, build websites, games and apps!",4.7,361848,All Levels,592 lectures,56.5 total hours,Current price: $119.99
perl,https://www.udemy.com/course/the-web-developer-bootcamp/,https://img-c.udemycdn.com/course/240x135/625204_436a_3.jpg,Colt Steele,The Web Developer Bootcamp 2025,"With 10 Hours of React added. Become a Developer With ONE course - HTML, CSS, JavaScript, React, Node, MongoDB and More!",4.7,279902,All Levels,730 lectures,74 total hours,Current price: $149.99
perl,https://www.udemy.com/course/perl-programming-understanding-the-basics/,https://img-c.udemycdn.com/course/240x135/6014396_a41d_4.jpg,Valters S,Perl Programming: Understanding The Basics [2024],"Mastering Perl: Fundamentals, Unit Testing, Mouse OOP and DBIx ORM Frameworks",4.7,2,All Levels,81 lectures,11 total hours,Current price: $54.99
perl,https://www.udemy.com/course/mastering-perl-programming-basics-to-advanced-techniques/,https://img-c.udemycdn.com/course/240x135/6318335_fac6.jpg,EDUCBA Bridging the Gap,Mastering PERL Programming: Basics to Advanced Techniques,"Learn Perl programming with hands-on mastery of variables, loops, operators, file I/O, and advanced regular expressions.",4.4,4,All Levels,43 lectures,4.5 total hours,Current price: $54.99
perl,https://www.udemy.com/course/perl-for-beginners/,https://img-c.udemycdn.com/course/240x135/1347936_4117.jpg,"AkaSkills! 35,000+ Students",Perl for Beginners: Learn A to Z of Perl Scripting Hands-on,Learn Perl from Industry Expert. Perl is the Swiss Army chainsaw of scripting languages due of its flexibility & power,4.1,334,All Levels,30 lectures,6 total hours,Current price: $54.99
perl,https://www.udemy.com/course/complete-python-developer-zero-to-mastery/,https://img-c.udemycdn.com/course/240x135/2473048_8255_5.jpg,Andrei Neagoie,The Complete Python Developer,"How to become a Python 3 Developer and get hired! Build 12+ projects, learn Web Development, Machine Learning + more!",4.6,58255,All Levels,346 lectures,31 total hours,Current price: $119.99
perl,https://www.udemy.com/course/power-of-perl/,https://img-c.udemycdn.com/course/240x135/1774776_9035_3.jpg,Robin Garg,Power of Perl :: Learn Basic and Advanced Perl Programming,Crash course covering basic & advanced Perl scripting. A must have for Digital VLSI Design and Verification enthusiasts.,4.2,478,All Levels,17 lectures,2.5 total hours,Current price: $44.99
perl,https://www.udemy.com/course/learning-perl-by-example/,https://img-c.udemycdn.com/course/240x135/265396_0c5d_5.jpg,Larry Prucha,Learning Perl by Example,By using examples to illustrate features and functions you will quickly learn Perl,3.8,138,Beginner,84 lectures,5.5 total hours,Current price: $49.99
perl,https://www.udemy.com/course/become-a-web-developer/,https://img-c.udemycdn.com/course/240x135/288466_7404_4.jpg,Simon Sez IT,Web Developer Fundamentals: Newbie to Pro Web Bootcamp!,The 12 must have web programming courses to help you become the ultimate web developer. Includes 50+ hours of training.,4.5,98,All Levels,424 lectures,54.5 total hours,Current price: $59.99
perl,https://www.udemy.com/course/the-complete-ruby-on-rails-developer-course/,https://img-c.udemycdn.com/course/240x135/519442_63fe_2.jpg,"Rob Percival, Mashrur Hossain, Codestars • over 2 million students worldwide!",The Complete Ruby on Rails Developer Course,Learn to make innovative web apps with Ruby on Rails and unleash your creativity,4.5,16347,All Levels,433 lectures,48 total hours,Current price: $139.99
perl,https://www.udemy.com/course/perl-5-programming-course-for-beginner-to-advanced/,https://img-c.udemycdn.com/course/240x135/2243714_7dd2_2.jpg,Inflame Tech,PERL 5 Programming Course for Beginner to Advanced,"Enhance your skills of Programming with Perl fundamentals and advanced topics like Hashes, Subroutines, references etc.",3.7,40,All Levels,63 lectures,7 total hours,Current price: $39.99
perl,https://www.udemy.com/course/seo-for-web-developers/,https://img-c.udemycdn.com/course/240x135/4677892_d310.jpg,Nat Miletic,SEO for Web Developers,Do you want to raise your rates as a web developer without having to learn another programming language?,4.7,16,Beginner,11 lectures,3 total hours,Current price: $49.99
perl,https://www.udemy.com/course/learning-installing-apache-mysql-and-php/,https://img-c.udemycdn.com/course/240x135/1803174_4bb2_2.jpg,Zulqarnain Hayat,"LAMP Stack and WAMP, MAMP : Install PHP, Apache, Perl, MySQL","Learn how to setup a LAMP,WAMP, MAMP (Linux Apache MySQL and PHP) web server and Install MAMP,WAMP on macOS and linux",4.0,41,All Levels,30 lectures,2.5 total hours,Current price: $27.99
