skill,link,image_link,partner,title,course_description,rating,num_review,difficulty,num_lecture,duration,price
bash,https://www.udemy.com/course/bash-mastery/,https://img-c.udemycdn.com/course/240x135/2997494_0cc5_2.jpg,"Ziyad Yehia, Internet of Things Academy",Bash Mastery: The Complete Guide to Bash Shell Scripting,"Master Bash Shell Scripting to Automate Tasks, Save Time, and Boost Your Career. Practical Projects + All Code Included.",4.8,3909,All Levels,111 lectures,12 total hours,Current price: $84.99
bash,https://www.udemy.com/course/linux-command-line-masterclass/,https://img-c.udemycdn.com/course/240x135/5670494_cf42_9.jpg,Manik (Cloudaffle),Linux Command Line For Developers Masterclass - Bash Shell,Learn the Linux Administration using Linux Command Line and Bash Shell. Learn to Use Linux From Scratch as A Developer.,4.8,15,All Levels,192 lectures,20 total hours,Current price: $74.99
bash,https://www.udemy.com/course/the-web-developer-bootcamp/,https://img-c.udemycdn.com/course/240x135/625204_436a_3.jpg,Colt Steele,The Web Developer Bootcamp 2025,"With 10 Hours of React added. Become a Developer With ONE course - HTML, CSS, JavaScript, React, Node, MongoDB and More!",4.7,279902,All Levels,730 lectures,74 total hours,Current price: $149.99
bash,https://www.udemy.com/course/the-complete-web-development-bootcamp/,https://img-c.udemycdn.com/course/240x135/1565838_e54e_18.jpg,"Dr. Angela Yu, Developer and Lead Instructor",The Complete Full-Stack Web Development Bootcamp,"Become a Full-Stack Web Developer with just ONE course. HTML, CSS, Javascript, Node, React, PostgreSQL, Web3 and DApps",4.7,431983,All Levels,374 lectures,61.5 total hours,Current price: $119.99
bash,https://www.udemy.com/course/bash-scripting/,https://img-c.udemycdn.com/course/240x135/958532_478a_4.jpg,Jason Cannon,Bash Scripting and Shell Programming (Linux Command Line),"Learn bash programming for Linux, Unix, & Mac. Learn how to write bash scripts like a pro & solve real-world problems!",4.5,20293,All Levels,34 lectures,2.5 total hours,Current price: $109.99
bash,https://www.udemy.com/course/bash-commands-and-scripting/,https://img-c.udemycdn.com/course/240x135/3935122_1753.jpg,Chris Frewin,Bash Commands and Scripting - from Beginner to Expert,"From the most basic of how to use a terminal, to advanced Bash scripting techniques!",4.7,18,All Levels,24 lectures,3 total hours,Current price: $44.99
bash,https://www.udemy.com/course/100-days-of-code/,https://img-c.udemycdn.com/course/240x135/2776760_f176_10.jpg,"Dr. Angela Yu, Developer and Lead Instructor",100 Days of Code: The Complete Python Pro Bootcamp,"Master Python by building 100 projects in 100 days. Learn data science, automation, build websites, games and apps!",4.7,361848,All Levels,592 lectures,56.5 total hours,Current price: $119.99
bash,https://www.udemy.com/course/linux-bash-shell-scripting-through-real-life-examples/,https://img-c.udemycdn.com/course/240x135/1585444_e4de_6.jpg,Imran Afzal,Complete Linux Bash Shell Scripting with Real Life Examples,Shell Scripting and Programming for Daily Tedious Tasks Automation (Scripting is required for RHCSA certification),4.5,4385,All Levels,87 lectures,14.5 total hours,Current price: $99.99
bash,https://www.udemy.com/course/bash-shell-scripting-crash-course-for-beginners/,https://img-c.udemycdn.com/course/240x135/1583482_7f8e_2.jpg,Francesco Santi,Bash Shell Scripting: Crash Course For Beginners,"Learn Bash Shell Scripting from total beginner:Start from the Command Line,finish with a real world Shell Script Project",4.5,14867,All Levels,75 lectures,5.5 total hours,Current price: $109.99
bash,https://www.udemy.com/course/learn-advanced-bash-for-automation-and-productivity-boost/,https://img-c.udemycdn.com/course/240x135/1073568_2281_2.jpg,MyEmBrain Inc.,Learn Advanced BASH for Automation and Productivity Boost,"Master modern and classic BASH skills on Linux, Mac OS X, Unix, and Windows to become a star software developer!",4.0,134,All Levels,121 lectures,12.5 total hours,Current price: $49.99
bash,https://www.udemy.com/course/the-complete-bashshell-developer-course/,https://img-c.udemycdn.com/course/240x135/4961406_946c_3.jpg,Codestars • over 2 million students worldwide!,The Complete Bash/Shell Developer Course,"Write Shell scripts, automate tasks, and solve any problem in Linux using Bash!",4.4,607,Beginner,59 lectures,6 total hours,Current price: $64.99
bash,https://www.udemy.com/course/fast-track-to-shell-scripting-for-linux-admins/,https://img-c.udemycdn.com/course/240x135/5385340_7906_2.jpg,"Mo Khalil, Muhammed Torkey, Cloudsark",Linux Bash Shell Scripting for Beginners,"Learn Linux Bash Shell Scripting fast! Simple, beginner-friendly Linux shell scripting lessons to get you started.",4.2,19,All Levels,39 lectures,2.5 total hours,Current price: $54.99
bash,https://www.udemy.com/course/mastering-bash-shell-scripting/,https://img-c.udemycdn.com/course/240x135/2707352_1176_2.jpg,Coding Gears | Train Your Brain,Mastering Bash Shell Scripting: Automate your daily tasks,Access to Live Linux Lab Environments!!,4.5,42,All Levels,122 lectures,11.5 total hours,Current price: $64.99
bash,https://www.udemy.com/course/linux-bash-shell-scripting-complete-guide-incl-awk-sed/,https://img-c.udemycdn.com/course/240x135/969354_614a_14.jpg,Richard Böhm,Linux Bash Shell Scripting: Complete Guide (incl. AWK & SED),"Bash shell scripting tutorial, go from ZERO to HERO and let's dance your bash programming skills",4.7,1060,All Levels,95 lectures,8.5 total hours,Current price: $74.99
bash,https://www.udemy.com/course/bash-shell-scripting-learn-by-creating-6-real-world-scripts/,https://img-c.udemycdn.com/course/240x135/2277879_8610_2.jpg,Francesco Santi,Bash Shell Scripting: From Zero To Automation,"Learn all Bash Basics, Then Master Bash Shell Scripting by Automating 6 Simple Tasks of incremental Difficulty",4.4,591,All Levels,70 lectures,6.5 total hours,Current price: $89.99
bash,https://www.udemy.com/course/essential-unix-skills-for-developers/,https://img-c.udemycdn.com/course/240x135/4925270_afc6_6.jpg,Terry Martin,Essential Unix Skills for Developers,"Harness the powerful Unix command line within Linux, MacOS & other OSs to take your developer skills to the next level",4.6,628,Beginner,76 lectures,18 total hours,Current price: $79.99
bash,https://www.udemy.com/course/beginners-course-learn-bash-shell-scripting-for-automation/,https://img-c.udemycdn.com/course/240x135/5268854_acdf_7.jpg,VR Technologies,Learn Bash Shell Scripting For Automation,Learn How to Automate Repetitive Tasks with Bash Shell Scripting,4.5,226,Beginner,108 lectures,12.5 total hours,Current price: $69.99
bash,https://www.udemy.com/course/linux-mastery-for-modern-developers-and-devops/,https://img-c.udemycdn.com/course/240x135/6111709_c600_3.jpg,Sousa Gaspar,Linux Mastery for Modern Developers and Devops,Unlock from Basic to Advanced Skills for Effective System Management and Development,5.0,1,All Levels,106 lectures,10 total hours,Current price: $79.99
bash,https://www.udemy.com/course/bash-scripting-practice-questions-100-tasks-hands-on/,https://img-c.udemycdn.com/course/240x135/4684858_3d81_2.jpg,AutoPilot DevOps,Bash / Shell | 100 Hands On Challenge with 10 Live Projects,"Shell Scripting Practice Questions | Linux Scripting Questions ( Solve 100+ tasks | Bash Commands/Scripts, 10 Projects)",4.3,157,Beginner,244 lectures,2 total hours,Current price: $54.99
bash,https://www.udemy.com/course/learn-bash-quickly/,https://img-c.udemycdn.com/course/240x135/3853842_c7ff_8.jpg,"Ahmed Alkabary, Abdullah Tarek",Learn Bash Quickly: A Hands-on approach to Linux Automation,⭐⭐⭐⭐⭐ Master Bash/Shell Scripting and learn how to automate boring Linux tasks!,4.7,657,All Levels,84 lectures,8.5 total hours,Current price: $84.99
