skill,link,image_link,partner,title,course_description,rating,num_review,difficulty,num_lecture,duration,price
hadoop,https://www.udemy.com/course/the-big-data-developer-course/,https://img-c.udemycdn.com/course/240x135/4870802_1653_5.jpg,Deesa Technologies,"Mastering Big Data: Spark, Scala, Kafka, Hadoop,Hive & More","Complete Hands-On Developer Guide to Modern Big Data Tools like Hadoop, Hive, Spark, Scala, Kafka, NIFI, HBase and more",4.4,140,All Levels,197 lectures,33.5 total hours,Current price: $64.99
hadoop,https://www.udemy.com/course/the-ultimate-hands-on-hadoop-tame-your-big-data/,https://img-c.udemycdn.com/course/240x135/996228_af5f_3.jpg,"Sundog Education by Frank Kane, Frank Kane, Sundog Education Team",The Ultimate Hands-On Hadoop: Tame your Big Data!,"Data Engineering and Hadoop tutorial with MapReduce, HDFS, Spark, Flink, Hive, HBase, MongoDB, Cassandra, Kafka + more!",4.6,30661,All Levels,104 lectures,14.5 total hours,Current price: $139.99
hadoop,https://www.udemy.com/course/big-data-and-hadoop-developer-course-with-mapreduce-and-java/,https://img-c.udemycdn.com/course/240x135/928774_e898.jpg,Inflame Tech,Hadoop Developer Course with MapReduce and Java,Learn Basics of Hadoop and MapReduce with Java,3.0,34,All Levels,77 lectures,8 total hours,Current price: $39.99
hadoop,https://www.udemy.com/course/the-complete-web-development-bootcamp/,https://img-c.udemycdn.com/course/240x135/1565838_e54e_18.jpg,"Dr. Angela Yu, Developer and Lead Instructor",The Complete Full-Stack Web Development Bootcamp,"Become a Full-Stack Web Developer with just ONE course. HTML, CSS, Javascript, Node, React, PostgreSQL, Web3 and DApps",4.7,431983,All Levels,374 lectures,61.5 total hours,Current price: $119.99
hadoop,https://www.udemy.com/course/the-web-developer-bootcamp/,https://img-c.udemycdn.com/course/240x135/625204_436a_3.jpg,Colt Steele,The Web Developer Bootcamp 2025,"With 10 Hours of React added. Become a Developer With ONE course - HTML, CSS, JavaScript, React, Node, MongoDB and More!",4.7,279902,All Levels,730 lectures,74 total hours,Current price: $149.99
hadoop,https://www.udemy.com/course/100-days-of-code/,https://img-c.udemycdn.com/course/240x135/2776760_f176_10.jpg,"Dr. Angela Yu, Developer and Lead Instructor",100 Days of Code: The Complete Python Pro Bootcamp,"Master Python by building 100 projects in 100 days. Learn data science, automation, build websites, games and apps!",4.7,361848,All Levels,592 lectures,56.5 total hours,Current price: $119.99
hadoop,https://www.udemy.com/course/hadoop-administration-online-hadoop-admin-training/,https://img-c.udemycdn.com/course/240x135/1065390_f832_5.jpg,Inflame Tech,Hadoop Administration: Online Hadoop Admin Training,Become a Hadoop Administrator from Scratch,3.6,179,All Levels,69 lectures,5 total hours,Current price: $39.99
hadoop,https://www.udemy.com/course/big-data-ingestion-using-sqoop-and-flume-cca-and-hdpcd/,https://img-c.udemycdn.com/course/240x135/2170564_8911_17.jpg,Navdeep Kaur,Data Engineering Master Course: Spark/Hadoop/Kafka/MongoDB,Full Hands on course to become Big Data Engineer: Spark/Kafka/Hadoop/Flume/Hive/Sqoop/MongoDB. Data Engineering course.,4.5,1967,All Levels,151 lectures,12 total hours,Current price: $69.99
hadoop,https://www.udemy.com/course/cca-175-spark-and-hadoop-developer-certification/,https://img-c.udemycdn.com/course/240x135/4003846_db8a.jpg,Proedu Organization,CCA 175 Spark and Hadoop Developer Certification - Scala,100% guarantee to pass CCA175 Certification Exam,4.4,23,Beginner,37 lectures,5.5 total hours,Current price: $49.99
hadoop,https://www.udemy.com/course/hadoop-querying-tool-hive-to-advance-hivereal-time-usage/,https://img-c.udemycdn.com/course/240x135/1286120_1ad8_10.jpg,J Garg,Hive to ADVANCE Hive (Real time usage) :Hadoop querying tool,In and Out of Apache Hive - From Basic to Advance Hive (Real-world concepts) + Use cases asked in Hive interviews,4.5,6012,All Levels,77 lectures,7 total hours,Current price: $74.99
hadoop,https://www.udemy.com/course/hands-on-hadoop-masterclass-tame-the-big-data/,https://img-c.udemycdn.com/course/240x135/1978354_c650_4.jpg,EDUCBA Bridging the Gap,Big Data: Hadoop| MapReduce| Hive| Pig| NoSQL| Mahout| Oozie,"Learn Hadoop, HDFS, MapReduce, Hive, Pig, NoSQL, Mahout, Oozie, Flume, Storm, Avro, Spark, Projects and Case studies.",3.9,490,All Levels,532 lectures,68 total hours,Current price: $34.99
hadoop,https://www.udemy.com/course/hadoop-spark/,https://img-c.udemycdn.com/course/240x135/3809790_7233.jpg,Tani Das,Hadoop & Spark,Master the Hadoop ecosystem and Spark tutorial,4.4,25,Beginner,29 lectures,27 total hours,Current price: $59.99
hadoop,https://www.udemy.com/course/aws-certified-developer-associate-dva-c01/,https://img-c.udemycdn.com/course/240x135/1921420_384a_14.jpg,"Stephane Maarek | AWS Certified Cloud Practitioner,Solutions Architect,Developer",Ultimate AWS Certified Developer Associate 2025 DVA-C02,Full Practice Exam with Explanations included! PASS the Amazon Web Services Certified Developer Certification DVA-C02,4.7,110810,All Levels,461 lectures,32.5 total hours,Current price: $149.99
hadoop,https://www.udemy.com/course/learn-by-example-hadoop-mapreduce/,https://img-c.udemycdn.com/course/240x135/825972_5fd2_4.jpg,Loony Corn,"Learn By Example: Hadoop, MapReduce for Big Data problems","A hands-on workout in Hadoop, MapReduce and the art of thinking parallel",4.6,1144,All Levels,73 lectures,13.5 total hours,Current price: $79.99
hadoop,https://www.udemy.com/course/hadoopinrealworld/,https://img-c.udemycdn.com/course/240x135/384458_6b98_2.jpg,Big Data In Real World,Hadoop Developer In Real World,Free Cluster Access * HDFS * MapReduce * YARN * Pig * Hive * Flume * Sqoop * AWS * EMR * Optimization * Troubleshooting,4.5,3312,All Levels,98 lectures,20.5 total hours,Current price: $199.99
hadoop,https://www.udemy.com/course/learn-hadoop-step-by-step-from-scratch/,https://img-c.udemycdn.com/course/240x135/291080_a491_5.jpg,IT Skills In Demand,Big Data and Hadoop for Absolute Beginners,Learn all the concepts related to Big Data and Hadoop in a simplified way,4.3,492,All Levels,51 lectures,4 total hours,Current price: $54.99
hadoop,https://www.udemy.com/course/big-data-hadoop-the-complete-course/,https://img-c.udemycdn.com/course/240x135/940120_7175_2.jpg,TELCOMA Global,Big Data Hadoop - The Complete Course,"Learn BIG DATA HADOOP Hands-on from Global Experts -  Apache Hadoop, HDFS, Map Reduce, YARN, Hive, PIG, Impala, Scoop",3.5,939,All Levels,92 lectures,11.5 total hours,Current price: $54.99
hadoop,https://www.udemy.com/course/big-data-hadoop-spark-project/,https://img-c.udemycdn.com/course/240x135/2583632_3b66_3.jpg,FutureX Skills,A Big Data Hadoop and Spark project for absolute beginners,2025 Edition Data Engineering Spark PySpark Scala Coding Framework Testing IntelliJ Maven Glue Databricks Delta Lake,4.6,1456,Beginner,121 lectures,13 total hours,Current price: $74.99
hadoop,https://www.udemy.com/course/cloudera-hadoop-administration/,https://img-c.udemycdn.com/course/240x135/1932176_94ad_2.jpg,Sijeesh Kunnotharamal,Cloudera Hadoop Administration,"Installation ,Configuration,Security,Evaluation and Upgrade of Cloudera Hadoop Cluster .Cloudera Certified Hadoop Admin",4.4,996,Intermediate,74 lectures,10 total hours,Current price: $59.99
hadoop,https://www.udemy.com/course/learn-big-data-hadoop-hands-on-for-beginner/,https://img-c.udemycdn.com/course/240x135/3756876_f55d_6.jpg,Bigdata Engineer,Learn Big Data Hadoop: Hands-On for Beginner,"Big Data Engineering and Hadoop tutorial with Bigdata, Hadoop, HDFS, Yarn, MapReduce, Pig, Sqoop, and Flume",3.6,45,Beginner,262 lectures,14 total hours,Current price: $39.99
